Start Timestamp;End Timestamp;Transcript
01:17:01;01:17:03;"Shawn Mendes has just been a gentler,"
01:17:05;01:17:07;"more wholesome presence."
01:17:07;01:17:09;"He never really had that,"
01:17:09;01:17:11;"those wildfires, those wilderness,"
01:17:11;01:17:13;"what are those, salad days?"
01:17:13;01:17:15;"Is that what you said? No."
01:17:15;01:17:17;"Salad days are good."
01:17:17;01:17:19;"You know what I'm saying though."
01:17:19;01:17:21;"You didn't sow his wild oats."
01:17:21;01:17:23;"There you go."
01:17:23;01:17:25;"Maybe this is the beginning of the wild oats being sowed."
01:17:25;01:17:27;"Like maybe he'll break up with Camila and p*** in a bucket."
01:17:27;01:17:29;"Renounce Tim Hortons."
01:17:29;01:17:31;"Right?"
01:17:31;01:17:33;"But it's funny because when I was talking about how like,"
01:17:33;01:17:35;"you can't picture Justin Bieber just like,"
01:17:35;01:17:37;"humbly sipping on like a hot Tim Hortons."
01:17:37;01:17:39;"We found a picture of him just like wearing some like,"
01:17:39;01:17:41;"f***ing like ragged ass street wear,"
01:17:41;01:17:43;"like crazy outfit,"
01:17:43;01:17:45;"holding like a giant Starbucks."
01:17:45;01:17:47;"And you're like, yeah that's Bieber."
01:17:47;01:17:49;"It's like a giant Starbucks iced coffee."
01:17:49;01:17:51;"And Shawn Mendes is a little more like,"
01:17:51;01:17:53;"oh you know man,"
01:17:53;01:17:55;"I just like to get a nice hot coffee from Tim Hortons."
01:17:57;01:17:59;"Yeah, like stop by Timmy's,"
01:17:59;01:18:01;"get a nice hot coffee."
01:18:01;01:18:03;"It's real cold outside."
01:18:03;01:18:05;"Like Justin Bieber,"
01:18:05;01:18:07;"I was picturing Justin Bieber like,"
01:18:07;01:18:09;"back on Ontario in like,"
01:18:09;01:18:11;"October, and it's like 50 degrees."
01:18:11;01:18:13;"And he's just like,"
01:18:13;01:18:15;"what the f***?"
01:18:15;01:18:17;"F*** this s***."
01:18:17;01:18:19;"Why is it so f***ing cold?"
01:18:19;01:18:21;"And like,"
01:18:21;01:18:23;"everybody's like, oh Justin remember,"
01:18:23;01:18:25;"you know when you were a little boy,"
01:18:25;01:18:27;"when it was really cold in the winter,"
01:18:27;01:18:29;"it was going down to -5 degrees."
01:18:29;01:18:31;"And he's like, no honestly f*** this s***."
01:18:31;01:18:33;"I want an ice, it's too cold to have a f***ing iced coffee."
01:18:33;01:18:35;"Can the plane leave?"
01:18:35;01:18:37;"F***ing sick of this s***."
01:18:37;01:18:39;"Just breaking all the rules of being a good Canadian."
01:18:39;01:18:41;"Wearing a Gucci bucket hat."
01:18:41;01:18:43;"Is it lame as a Canadian to"
01:18:43;01:18:45;"complain about the cold?"
01:18:45;01:18:47;"We complain about the cold."
01:18:47;01:18:49;"It's kind of part of the lifestyle."
01:18:49;01:18:51;"Is it lame?"
01:18:51;01:18:53;"No, I think it's par for the course."
01:18:53;01:18:55;"But do you have to have like a smile about it?"
01:18:55;01:18:57;"Like, do you have to be a little bit like,"
01:18:57;01:18:59;"oh it's so cold, wow."
01:18:59;01:19:01;"Do we have a smile about it?"
01:19:01;01:19:03;"No, I mean it's pretty miserable."
01:19:03;01:19:05;"Like, we're not exempt from the human conditions."
01:19:05;01:19:07;"You're allowed to walk into -"
01:19:07;01:19:09;"and I mean I'm talking about"
01:19:09;01:19:11;"like the real Canada."
01:19:11;01:19:13;"I'm not talking about, you know -"
01:19:13;01:19:15;"What's the real Canada?"
01:19:15;01:19:17;"I'm not talking about a downtown penthouse in Toronto."
01:19:17;01:19:19;"I'm talking about real Canadians."
01:19:19;01:19:21;"What, like the Yukon?"
01:19:21;01:19:23;"I'm not talking about -"
01:19:23;01:19:25;"The Northwest Territories?"
01:19:25;01:19:27;"Newfoundland?"
01:19:27;01:19:29;"I'm talking about Calgary."
01:19:29;01:19:31;"I'm talking about like -"
01:19:31;01:19:33;"Toronto gets pretty cold."
01:19:33;01:19:35;"Medicine hat."
01:19:35;01:19:37;"At a certain point -"
01:19:37;01:19:39;"I know Toronto gets cold,"
01:19:39;01:19:41;"but also Toronto's gotten very full of money"
01:19:41;01:19:43;"and built up lately."
01:19:43;01:19:45;"Yeah, tell me more."
01:19:45;01:19:47;"I just heard that because like -"
01:19:47;01:19:49;"I was just talking to a promoter in Toronto"
01:19:49;01:19:51;"and they were just like -"
01:19:51;01:19:53;"the tickets for our Toronto show went very quickly"
01:19:53;01:19:55;"and they were like, oh Toronto's a very hot market lately."
01:19:55;01:19:57;"And I was like, oh yeah, well Toronto's a great city."
01:19:57;01:19:59;"That doesn't surprise me."
01:19:59;01:20:01;"Why is it hotter now?"
01:20:01;01:20:03;"And they're just like, oh you know,"
01:20:03;01:20:05;"they built up downtown so many new -"
01:20:05;01:20:07;"so many kind of like yuppies moving in -"
01:20:07;01:20:09;"This accent."
01:20:09;01:20:11;"It's subtle."
01:20:11;01:20:13;"He's doing good work."
01:20:13;01:20:15;"I'm doing real subtle."
01:20:15;01:20:17;"All these yuppies moving in in Toronto."
01:20:17;01:20:19;"Not for Vampire Weekend in general,"
01:20:19;01:20:21;"even though I'll admit we have some yuppie fans,"
01:20:21;01:20:23;"but they're just saying, just generally speaking,"
01:20:23;01:20:25;"a lot more young people with money"
01:20:25;01:20:27;"are coming to Toronto so that there's more"
01:20:27;01:20:29;"concert tickets sell and I'm sure there's"
01:20:29;01:20:31;"way more restaurants and coffee shops and bars"
01:20:31;01:20:35;"to serve a kind of international elite."
01:20:35;01:20:37;"So Toronto's - over the past decade,"
01:20:37;01:20:41;"Toronto's waterfront got developed quite a bit"
01:20:41;01:20:43;"and filled with these condos that have sprung up"
01:20:43;01:20:45;"overnight essentially."
01:20:45;01:20:47;"So it's just like this wall to wall."
01:20:47;01:20:49;"The skyline is just - around where the CN Tower is,"
01:20:49;01:20:51;"it's just wall to wall condos."
01:20:51;01:20:53;"So it's like with any city."
01:20:53;01:20:55;"It's like Austin, Texas, and obviously New York."
01:20:55;01:20:57;"It's always a part of the New York story"
01:20:57;01:20:59;"is that the people who were there before"
01:20:59;01:21:01;"all the condos went up being a little bit like,"
01:21:01;01:21:03;"""Oh, look at you guys."""
01:21:03;01:21:05;"Because usually the crowd that comes in with the condos"
01:21:05;01:21:07;"is not locals."
01:21:07;01:21:09;"So there's maybe a feeling of like,"
01:21:09;01:21:11;"""Are you really down with what it means to love this place"
01:21:11;01:21:13;"or you just want a kind of anonymous,"
01:21:13;01:21:15;"wealthy aesthetic?"""
01:21:15;01:21:17;"True, yeah."
01:21:17;01:21:19;"Downtown Los Angeles, you're seeing it happen."
01:21:19;01:21:21;"Of course, you're seeing it in every city."
01:21:21;01:21:23;"But I'm saying in Canada,"
01:21:23;01:21:25;"which is a specific, very proud place,"
01:21:25;01:21:27;"I just wonder if"
01:21:27;01:21:29;"your attitude towards the cold"
01:21:29;01:21:31;"maybe separates"
01:21:31;01:21:33;"the new condo people"
01:21:33;01:21:35;"from the old school."
01:21:35;01:21:37;"So you walk into your office in downtown Toronto"
01:21:37;01:21:39;"and one person walks in and is like,"
01:21:39;01:21:41;"""Oh, man."
01:21:41;01:21:43;"It was so cold out there."
01:21:43;01:21:45;"I thought my damn eyeballs were about to"
01:21:45;01:21:47;"freeze and fall out and shatter on the ground."""
01:21:47;01:21:49;"And everybody's like, ""Oh, yeah, it was cold."""
01:21:49;01:21:51;"Then somebody else comes in and is like,"
01:21:51;01:21:53;"""Fuck, it was fucking cold. Fuck this winter."
01:21:53;01:21:55;"Jesus fucking Christ, I hate it."""
01:21:55;01:21:57;"And then that person is like,"
01:21:57;01:21:59;"""Oh, yeah."""
01:21:59;01:22:01;"One person's more like the Shawn Mendes"
01:22:01;01:22:03;"and one person's the Justin Bieber."
01:22:03;01:22:05;"You know what I mean?"
01:22:05;01:22:07;"Yeah, I think you'd find that about maybe people who"
01:22:07;01:22:09;"have come from, I don't know,"
01:22:09;01:22:11;"if somebody moved there from California or something,"
01:22:11;01:22:13;"you might..."
01:22:13;01:22:15;"Hey, gang, Corporate wants to shake things up a bit."
01:22:15;01:22:17;"So we're bringing in a new manager."
01:22:17;01:22:19;"And we're like, ""We're gonna bring in a new manager."""
01:24:17;01:24:19;"Let's go, let's go thaw out."
01:24:19;01:24:21;"Justin, we're all cold."
01:24:25;01:24:27;"Justin, sit down for a second."
01:24:27;01:24:29;"Justin, we're all cold."
01:24:29;01:24:31;"Sean's cold. Sean's very cold."
01:24:31;01:24:33;"But he's not talking the way you're talking."
01:24:35;01:24:37;"Do you think you're any colder than Sean, Justin?"
01:24:37;01:24:39;"Sean might even be colder than you, Justin."
01:24:39;01:24:41;"What?"
01:24:41;01:24:43;"Oh my god."
01:24:43;01:24:45;"Okay, let's keep moving."
01:24:45;01:24:47;"Number four, 1992, Bobby Brown, ""Humpin' Around."""
01:24:47;01:24:49;"Great title."
01:24:49;01:24:51;"♪"
01:24:51;01:24:53;"""Humpin' Around."""
01:24:53;01:24:55;"♪"
01:25:11;01:25:13;"Little dancing days in there."
01:25:13;01:25:15;"That's definitely his dancing days."
01:25:15;01:25:17;"♪"
01:25:23;01:25:25;"Six minutes."
01:25:25;01:25:27;"This one is?"
01:25:27;01:25:31;"Yeah, so the top two is a nine minute song and a six minute song."
01:25:31;01:25:33;"A lot of long songs."
01:25:33;01:25:35;"♪"
01:26:05;01:26:07;"""Humpin' Around."""
01:26:07;01:26:09;"His '93 world tour was called"
01:26:09;01:26:11;"the ""Humpin' Around the World Tour."""
01:26:11;01:26:13;"That's sick."
01:26:13;01:26:15;"♪"
01:26:21;01:26:23;"He's saying, ""Ain't nobody humpin' around?"""
01:26:23;01:26:25;"It's like his girlfriend thinks he's cheating on her,"
01:26:25;01:26:27;"but he's saying, ""Nobody's humpin' around."""
01:26:27;01:26:29;"What the tour is called ""Humpin' Around."""
01:26:29;01:26:31;"♪"
01:26:33;01:26:35;"Wait, I gotta look up the lyrics."
01:26:35;01:26:37;"♪"
01:26:37;01:26:39;"In this song specifically,"
01:26:39;01:26:41;"I'm not humping around, but the tour,"
01:26:41;01:26:43;"you better believe."
01:26:43;01:26:45;"I know why you think I'd be humping around."
01:26:45;01:26:47;"♪"
01:26:49;01:26:51;"The chorus is, ""Get off my back, save a heart attack,"
01:26:51;01:26:53;"ain't nobody humpin' around."
01:26:53;01:26:55;"No matter what they say, no it ain't that way,"
01:26:55;01:26:57;"ain't nobody humpin' around."""
01:26:57;01:26:59;"Well, because he's the first-- He's not cheating."
01:26:59;01:27:01;"When you trust someone and you know you're on their back,"
01:27:01;01:27:03;"you ain't got no trusting about you,"
01:27:03;01:27:05;"and you claim that you don't care where I'm at,"
01:27:05;01:27:07;"you've given me reason to doubt."
01:27:07;01:27:09;"You say you trust someone, why are you calling around?"
01:27:09;01:27:11;"Think I've got some dip on the side?"
01:27:11;01:27:13;"Girl, you don't trust no one, you're constantly in doubt."
01:27:13;01:27:15;"You lose the game if you play that way."
01:27:15;01:27:17;"I think he's saying, like, ""I'm not cheating on you,"
01:27:17;01:27:19;"but damn it,"
01:27:19;01:27:21;"you're--"
01:27:21;01:27:23;"You're--"
01:27:23;01:27:25;"You're making this difficult."
01:27:25;01:27:27;"Yeah, the fact that you don't trust me"
01:27:27;01:27:29;"is alienating me, and let's keep it real."
01:27:29;01:27:31;"Why do people cheat sometimes?"
01:27:31;01:27:33;"Because they become alienated from their partner."
01:27:33;01:27:35;"And then they start humping."
01:27:35;01:27:37;"Yeah."
01:27:37;01:27:39;"Humping!"
01:27:39;01:27:41;"Humping is such a funny"
01:27:41;01:27:43;"euphemism"
01:27:43;01:27:45;"for an adult"
01:27:45;01:27:47;"to be using in a song."
01:27:47;01:27:49;"It was truly, like--"
01:27:49;01:27:51;"Humping was very much like--"
01:27:51;01:27:53;"You're in, like, fifth grade, and you have, like,"
01:27:53;01:27:55;"vague understanding of, like,"
01:27:55;01:27:57;"the mechanics of sex."
01:27:57;01:27:59;"Yeah, humping. Dry humping."
01:27:59;01:28:01;"Oh, yeah, dry humping. People always talk about that"
01:28:01;01:28:03;"like middle school. Right."
01:28:03;01:28:05;"Oh, man, they're dry humping."
01:28:05;01:28:07;"Dry--"
01:28:07;01:28:09;"Yeah, dry humping versus wet humping."
01:28:09;01:28:11;"Oh!"
01:28:11;01:28:13;"I've never heard wet humping"
01:28:13;01:28:15;"before this round."
01:28:15;01:28:17;"Wet humping is just humping."
01:28:17;01:28:19;"You don't need the--"
01:28:19;01:28:21;"The wetness is implied."
01:28:21;01:28:23;"So then we started humping."
01:28:23;01:28:25;"Was it dry or wet?"
01:28:25;01:28:27;"Um--"
01:28:27;01:28:29;"A hundred of those are, like, deeper album cuts on this record."
01:28:29;01:28:31;"Dry humping track one."
01:28:31;01:28:33;"No, but he's making a good point."
01:28:33;01:28:35;"He's talking about that"
01:28:35;01:28:37;"you know that you're holding on too tight."
01:28:37;01:28:39;"Soon they will be leaving without you."
01:28:39;01:28:41;"He's saying that that's the irony."
01:28:41;01:28:43;"And this is true."
01:28:43;01:28:45;"Think about-- I mean, Bobby Brown,"
01:28:45;01:28:47;"I think, identifies as male,"
01:28:47;01:28:49;"but, you know, the classic"
01:28:49;01:28:51;"""We often think about the controlling""--"
01:28:51;01:28:53;"""We often think about the controlling boyfriend."""
01:28:53;01:28:55;"That's a very familiar figure, right?"
01:28:55;01:28:57;"Sure."
01:28:57;01:28:59;"He's like the guy who is"
01:28:59;01:29:01;"so jealous and, like, crazy"
01:29:01;01:29:03;"towards his girlfriend. Possessive."
01:29:03;01:29:05;"Possessive. You're talking to him? What the [bleep]"
01:29:05;01:29:07;"That eventually he holds on way too tight."
01:29:07;01:29:09;"And then she's, like, in her mind, she's like,"
01:29:09;01:29:11;"""Well, this guy's insane. Maybe I will cheat on him."
01:29:11;01:29:13;"I'm sick of him."""
01:29:13;01:29:15;"And I guess Bobby's talking about, you know,"
01:29:15;01:29:17;"presumably a woman who's like that."
01:29:17;01:29:19;"She's calling all his friends, and he's like,"
01:29:19;01:29:21;"""But maybe he is gaslighting her"
01:29:21;01:29:23;"when you think about it that"
01:29:23;01:29:25;"in 1992 he releases a song"
01:29:25;01:29:27;"that he took is 'Ain't Nobody Humpin' Around.'"""
01:29:27;01:29:29;"And it's funny that the song is just called"
01:29:29;01:29:31;"""Humpin' Around."" She's like,"
01:29:31;01:29:33;"""Why is the song just called 'Humpin' Around'?"""
01:29:33;01:29:35;"He's like, ""'Cause it's shorter."""
01:29:35;01:29:37;"""Okay, in the song I say 'Ain't Nobody Humpin' Around.'"""
01:29:37;01:29:39;"""Okay, but still, your new single's called 'Humpin' Around.'"
01:29:39;01:29:41;"It makes me feel uncomfortable."""
01:29:41;01:29:43;"It's very misleading, Bobby."
01:29:43;01:29:45;"He's like, ""Oh, my God."""
01:29:45;01:29:47;"Wait, was he with Whitney Houston?"
01:29:47;01:29:49;"They're probably just getting together right now."
01:29:49;01:29:51;"They got together in the early '90s."
01:29:51;01:29:53;"And he's like, ""Oh, my God. Chill."""
01:29:53;01:29:55;"She's like, ""Couldn't you have at least called it 'Humpin' Around'"
01:29:55;01:29:57;"and then in parentheses before 'Ain't No'?"""
01:29:57;01:29:59;"Like, ""I can't get no satisfaction."""
01:29:59;01:30:01;"And he's like, ""Look, people just call the song"
01:30:01;01:30:03;"'Satisfaction,' so it doesn't even matter."
01:30:03;01:30:05;"It's just called 'Humpin' Around.'"
01:30:05;01:30:07;"When they hear the song, they're gonna hear me saying"
01:30:07;01:30:09;"'Ain't Nobody Humpin' Around.' That makes it very clear."""
01:30:09;01:30:11;"She's like, ""Okay."""
01:30:11;01:30:13;"Okay, he's like,"
01:30:13;01:30:15;"""Baby, please, listen to the song."
01:30:15;01:30:17;"If you keep nagging me, things are gonna go"
01:30:17;01:30:19;"really sideways. Okay, Bobby, I trust you."""
01:30:21;01:30:23;"And then, like, next year,"
01:30:23;01:30:25;"just like,"
01:30:25;01:30:27;"""All right."""
01:30:27;01:30:29;"Got the tour T-shirts printed up,"
01:30:29;01:30:31;"getting ready to go. ""Oh, can I see one?"
01:30:31;01:30:33;"Yeah, sure. It's called"
01:30:33;01:30:35;"'Humpin' Around the World Tour.'"""
01:30:35;01:30:37;"[laughter]"
01:30:37;01:30:39;"""Wait, wait, Bobby."
01:30:39;01:30:41;"It's called the 'Humpin' Around the World Tour?'"
01:30:41;01:30:43;"Oh, yeah, yeah,"
01:30:43;01:30:45;"because, you know, the hit single's called 'Humpin' Around.'"
01:30:45;01:30:47;"Okay."
01:30:47;01:30:49;"I was with you up to a point."
01:30:49;01:30:51;"I understand you called the song"
01:30:51;01:30:53;"'Humpin' Around,' but"
01:30:53;01:30:55;"'Humpin' Around the World,'"
01:30:55;01:30:57;"that really makes it sound like you're gonna be"
01:30:57;01:30:59;"cheating on me by humping various"
01:30:59;01:31:01;"women around the world."""
01:31:01;01:31:03;"Okay."
01:31:03;01:31:05;"Okay, you're being crazy right now."
01:31:05;01:31:07;"Okay, let's take this back to the beginning."
01:31:07;01:31:09;"The tour's called 'Humpin' Around the World,'"
01:31:09;01:31:11;"because it's a world tour,"
01:31:11;01:31:13;"and because the song is called 'Humpin' Around.'"
01:31:13;01:31:15;"Why is the song called"
01:31:15;01:31:17;"'Humpin' Around?' Because the hook of the song"
01:31:17;01:31:19;"is ""Ain't nobody humpin' around."""
01:31:19;01:31:21;"So when you really think about it,"
01:31:21;01:31:23;"the tour is basically called"
01:31:23;01:31:25;"""Ain't nobody humpin' around the world tour."""
01:31:25;01:31:27;"It's just edited for brevity."
01:31:27;01:31:29;"[explosion]"
01:31:29;01:31:31;"Bobby, I'm trying to have this"
01:31:31;01:31:33;"make sense, but"
01:31:33;01:31:35;"I don't know, man."
01:31:35;01:31:37;"Anyway."
01:31:37;01:31:39;"The number"
01:31:39;01:31:41;"four song in 2019,"
01:31:41;01:31:43;"oh, our good friend Post Malone."
01:31:43;01:31:45;"Oh, you're gonna be interested in this one, Jake."
01:31:45;01:31:47;"This is from his new album that just came out,"
01:31:47;01:31:49;"and this one has Ozzy Osbourne and"
01:31:49;01:31:51;"Travis Scott."
01:31:51;01:31:55;"Definitely has an Ozzy vibe."
01:31:55;01:31:57;"Yeah. Already. Post Malone is a"
01:31:57;01:31:59;"self-professed metal fan."
01:31:59;01:32:05;"""I feel you crumble"
01:32:05;01:32:07;"in my arms,"
01:32:07;01:32:09;"down to your heart of stone."""
01:32:09;01:32:11;"Wow."
01:32:11;01:32:13;"""You let me dry just like"
01:32:13;01:32:15;"tears you never show."
01:32:15;01:32:17;"Why don't you take"
01:32:17;01:32:19;"what you want from me? Take what"
01:32:19;01:32:21;"you need from me? Take what you"
01:32:21;01:32:23;"wanna go."
01:32:23;01:32:25;"Why don't you take what you want from me?"
01:32:25;01:32:27;"Take what you need from me?"
01:32:27;01:32:29;"Take what you wanna go."""
01:32:29;01:32:31;"""I never needed"
01:32:31;01:32:33;"anything from you."
01:32:33;01:32:35;"And all I ever asked was for"
01:32:35;01:32:37;"the truth."" I like the Ozzy hook. It's cool."
01:32:37;01:32:39;"I wonder if Post wrote that"
01:32:39;01:32:41;"part for Ozzy."
01:32:41;01:32:43;"I don't know. They're both credited"
01:32:43;01:32:45;"songwriters. It was perfect for Ozzy."
01:32:45;01:32:47;"Yeah, it was."
01:32:51;01:32:55;"♪ I was facing away trying to find my way out ♪"
01:32:55;01:32:57;"♪ Find my way out ♪"
01:32:57;01:32:59;"♪ And then finally ♪"
01:32:59;01:33:01;"♪ Came the day ♪"
01:33:01;01:33:04;"♪ I started giving my heart away ♪"
01:33:04;01:33:06;"♪ For heaven sake ♪"
01:33:06;01:33:08;"♪ My bones were brave ♪"
01:33:08;01:33:11;"♪ But you never owned my soul ♪"
01:33:11;01:33:12;"♪ No ♪"
01:33:12;01:33:15;"♪ I feel you crumbling my arms ♪"
01:33:15;01:33:19;"♪ Down to your heart of stone ♪"
01:33:19;01:33:22;"♪ You'll blame me ♪"
01:33:22;01:33:25;"♪ Dry just like the tears you never show ♪"
01:33:25;01:33:27;"♪ Why don't you tell you what you want from me ♪"
01:33:27;01:33:29;"♪ Tell you what you need from me ♪"
01:33:29;01:33:32;"♪ Tell you what you want to go ♪"
01:33:32;01:33:34;"♪ Why don't you tell you what you want from me ♪"
01:33:34;01:33:36;"♪ Tell you what you need from me ♪"
01:33:36;01:33:39;"♪ Tell you what you want to go ♪"
01:33:39;01:33:40;"♪ I took those calls you threw ♪"
01:33:40;01:33:42;"♪ Made chains for the crew ♪"
01:33:42;01:33:43;"♪ I bought on 10 of this ♪"
01:33:43;01:33:45;"♪ Coupon they make for two ♪"
01:33:45;01:33:46;"You know what? It works."
01:33:46;01:33:49;"Post Malone, Ozzy Osbourne, Travis Scott, it just works."
01:33:49;01:33:55;"Back to 1994, 1992, TLC, ""Baby, Baby, Baby."""
01:33:55;01:33:57;"And guess what? The song has the same producers"
01:33:57;01:33:58;"as ""Humping Around."""
01:33:58;01:34:00;"L.A. Reid, Babyface, Dow Simon."
01:34:00;01:34:04;"[ Music ]"
01:34:04;01:34:06;"This sounds sick."
01:34:06;01:34:21;"[ Music ]"
01:34:21;01:34:22;"Oh, yeah."
01:34:22;01:34:24;"Oh, yeah, this could be in the ""Flamin' Hot"" movie."
01:34:24;01:34:27;"[ Music ]"
01:34:27;01:34:29;"Like a montage sequence?"
01:34:29;01:34:31;"This would be the montage of when he meets Judy"
01:34:31;01:34:35;"and they're like on the roller coaster and stuff,"
01:34:35;01:34:36;"hanging out."
01:34:36;01:34:48;"[ Music ]"
01:34:48;01:34:51;"TLC has so many good songs from the '90s."
01:34:51;01:34:52;"A lot of great production."
01:34:52;01:35:05;"[ Music ]"
01:35:05;01:35:09;"Keep it moving. Back to 2019, Lizzo, ""Truth Hurts."""
01:35:09;01:35:12;"This song recently went number one on the Billboard charts"
01:35:12;01:35:14;"two years after it came out."
01:35:14;01:35:15;"Whoa."
01:35:15;01:35:16;"So it came out two years ago,"
01:35:16;01:35:19;"then didn't do much initially?"
01:35:19;01:35:20;"Yeah."
01:35:20;01:35:30;"[ Music ]"
01:35:50;01:36:00;"[ Music ]"
01:36:00;01:36:07;"[ Music ]"
01:36:07;01:36:09;"But listen to this."
01:36:09;01:36:11;"Lizzo almost quit music following the song's"
01:36:11;01:36:12;"initial release."
01:36:12;01:36:13;"She told People magazine,"
01:36:13;01:36:14;"""The day I released 'Truth Hurts'"
01:36:14;01:36:17;"was probably one of the darkest days ever in my career."
01:36:17;01:36:18;"I remember thinking if I quit music now,"
01:36:18;01:36:19;"nobody would notice."
01:36:19;01:36:20;"This is my best song ever."
01:36:20;01:36:21;"Nobody cares."
01:36:21;01:36:23;"I was like, 'Fuck it. I'm done.'"""
01:36:23;01:36:24;"Yikes."
01:36:24;01:36:26;"So what happened to bring the song --"
01:36:26;01:36:30;"Actually, I can say that this song was in a trailer"
01:36:30;01:36:33;"for a Netflix movie called ""Someone Great,"""
01:36:33;01:36:36;"and it sort of caught fire after that came out."
01:36:36;01:36:37;"Oh, wait. Didn't we talk about this?"
01:36:37;01:36:38;"'Cause I thought --"
01:36:38;01:36:39;"I think we did."
01:36:39;01:36:40;"I think there was a ""Vampire Weekend"" song"
01:36:40;01:36:41;"in ""Someone Great."""
01:36:41;01:36:42;"That's right. Yeah, we did talk about it."
01:36:42;01:36:46;"Did not have a similar trajectory."
01:36:46;01:36:49;"Well, it hasn't been two years yet."
01:36:49;01:36:50;"But I feel like it was a song of ours"
01:36:50;01:36:51;"from like 2008 or something."
01:36:51;01:36:53;"Oh, right."
01:36:53;01:36:54;"Well, you never know."
01:36:54;01:36:57;"I think her profile grew as a person,"
01:36:57;01:37:01;"and maybe, yeah, the song did its thing."
01:37:01;01:37:03;"Well, shout-out to Lizzo."
01:37:03;01:37:05;"Good for her."
01:37:05;01:37:06;"Back to 1992."
01:37:06;01:37:07;"Patti Smith featuring Don Henley,"
01:37:07;01:37:09;"but this is the Patti Smith with a ""Y."""
01:37:09;01:37:12;"♪♪"
01:37:12;01:37:13;"""Sometimes Love Just Ain't Enough."""
01:37:13;01:37:16;"Do you know this song?"
01:37:16;01:37:18;"It sounds familiar, yeah."
01:37:18;01:37:21;"♪♪"
01:37:21;01:37:23;"Producer Roy Bitton."
01:37:23;01:37:25;"Is that -- Is he from the E Street Band?"
01:37:25;01:37:28;"Yeah, yeah, he was the keyboardist."
01:37:28;01:37:29;"It must be the same guy?"
01:37:29;01:37:30;"Yeah, he's the one who also, like,"
01:37:30;01:37:33;"played on all, like, the good Meatloaf singles."
01:37:33;01:37:34;"Oh."
01:37:34;01:37:40;"♪♪"
01:37:40;01:37:41;"The Professor."
01:37:41;01:37:45;"That's right."
01:37:45;01:37:54;"♪♪"
01:37:54;01:37:56;"I don't think I've ever heard this song."
01:37:56;01:37:59;"♪♪"
01:37:59;01:38:02;"Yeah, I don't even know if I have or not."
01:38:02;01:38:04;"There's so many songs that sound like this."
01:38:04;01:38:08;"Released August '92."
01:38:08;01:38:12;"♪ But like a fool, I keep losing my place ♪"
01:38:12;01:38:16;"♪ And I keep seeing you walk through that door ♪"
01:38:16;01:38:18;"Has a real '80s vibe."
01:38:18;01:38:19;"Yeah."
01:38:19;01:38:20;"Oh, yeah."
01:38:20;01:38:24;"♪ Been somebody too much ♪"
01:38:24;01:38:26;"♪ And it's sad when you know ♪"
01:38:26;01:38:29;"♪ It's your heart you can't trust ♪"
01:38:29;01:38:35;"♪ There's a reason why people don't stay where they are ♪"
01:38:35;01:38:39;"♪ Baby, sometimes love just ain't enough ♪"
01:38:39;01:38:42;"Don sounded great on those harmonies."
01:38:42;01:38:45;"Does he get his own verse?"
01:38:45;01:38:47;"I'm hoping."
01:38:47;01:38:51;"♪ Well, I can't ♪"
01:38:51;01:38:54;"♪ I could never change you ♪"
01:38:54;01:38:57;"♪ I don't want to blame you ♪"
01:38:57;01:38:58;"♪ Baby, you don't have to change me ♪"
01:38:58;01:39:00;"It kind of reminds me of, like,"
01:39:00;01:39:02;"'80s Bonnie Raitt kind of--"
01:39:02;01:39:03;"Yeah."
01:39:03;01:39:05;"I guess-- Oh, there he goes."
01:39:05;01:39:07;"He gets half a verse."
01:39:07;01:39:10;"I guess this really does sound like early '90s."
01:39:10;01:39:13;"It's like a little bit of '80s,"
