Start Timestamp;End Timestamp;Transcript
19:58;20:03;"So I would say minimum four times, maybe like six or seven times,"
20:03;20:06;"a lot of times I saw Brian Wilson come in and eat solo."
20:06;20:08;"He must live near there."
20:08;20:10;"And it was always really interesting because, like, you know, Jon Voight,"
20:10;20:12;"you look at him and you're just like, yeah,"
20:12;20:15;"that's like a crotchety old dude reading his book and having his coffee"
20:15;20:16;"or whatever."
20:16;20:19;"But Brian Wilson was different because--and I was always so curious about,"
20:19;20:23;"you know, obviously his life is filled with mystery and people are like,"
20:23;20:24;"you know, what's up with him?"
20:24;20:25;"Yeah."
20:25;20:26;"I never saw that."
20:26;20:28;"I saw a movie a few years ago that was like about--"
20:28;20:29;"Love and Mercy."
20:30;20:31;"Did you see that?"
20:31;20:32;"Yeah, it was good."
20:32;20:33;"It was good."
20:33;20:36;"So people say like this doctor giving him all sorts of stuff that damaged--who"
20:36;20:37;"knows?"
20:37;20:39;"Clearly he's had all sorts of struggles in his life."
20:39;20:42;"So he would always come in the door by himself."
20:42;20:44;"But I could tell, I was like, this is a dude who doesn't drive."
20:44;20:45;"So clearly somebody was waiting outside."
20:45;20:46;"He got dropped."
20:46;20:47;"Yeah, he got dropped."
20:47;20:48;"And then he would sit down."
20:48;20:51;"He was such a regular that people would always come up to him and say like,"
20:51;20:54;"oh, hey, Brian, how are you doing?"
20:54;20:55;"And I saw this--"
20:55;20:59;"Like they would talk to him like he was a child sort of?"
20:59;21:00;"Slightly."
21:00;21:02;"Or just talking to like a sweet old person."
21:02;21:05;"But I'm just saying they would go out of their way to be like, oh,"
21:05;21:06;"we know you."
21:06;21:07;"How are you?"
21:07;21:08;"Whatever."
21:08;21:09;"And I saw this many times because it's a small place."
21:09;21:12;"It'd be like me, Jon Voight, and Brian Wilson just all sitting solo at a"
21:12;21:13;"booth."
21:13;21:14;"That's a solid crew."
21:14;21:16;"Yeah, it was a tight crew."
21:16;21:20;"Imagine one day I was just like, guys, every day we're in here sitting,"
21:20;21:22;"you know, sitting together."
21:22;21:23;"We're all in show biz."
21:23;21:24;"Why don't we sit together?"
21:24;21:25;"Let's just grab a booth."
21:25;21:27;"Let's just grab a booth."
21:27;21:29;"You guys probably knew each other back in the day."
21:29;21:30;"What's up, man?"
21:30;21:31;"Jon, what are you reading there?"
21:31;21:38;"But so I noticed with Brian Wilson just, yeah,"
21:38;21:40;"the people would come up and just be like, oh, hey, Brian,"
21:40;21:41;"how are you doing today?"
21:41;21:42;"And just like he would never engage."
21:42;21:45;"And he would just go like breakfast burrito."
21:45;21:47;"So, you know, obviously a legend."
21:47;21:50;"I was always interested by how often he got a breakfast burrito."
21:50;21:52;"But, you know, he'd speak kind of loudly."
21:52;21:53;"Yeah."
21:53;21:55;"It was interesting because I see these people kind of go up to him like,"
21:55;21:56;"oh, yeah, what's up?"
21:56;21:58;"And you just like not really look at them and just don't say the thing."
21:58;22:02;"They'd bring it out, scarf it down in and out in like 12 minutes."
22:02;22:03;"Like you would just crush that burrito."
22:03;22:04;"Yeah."
22:04;22:06;"You know, I don't want to like speculate too much on the man's life."
22:06;22:09;"He's a legend, but it certainly got me curious about like,"
22:09;22:10;"what does this do?"
22:10;22:11;"You know, we love day to day."
22:11;22:13;"I was like, what is this dude's day to day life?"
22:13;22:17;"And I guess also the reason that I bring it up is he's been through the"
22:17;22:18;"ringer in his life."
22:18;22:21;"So it doesn't shock me that maybe he's in this kind of state of mind where"
22:21;22:22;"he's just like, you know what?"
22:22;22:23;"Drop me off."
22:23;22:24;"Let me eat my breakfast burrito."
22:24;22:25;"No time for niceties."
22:25;22:26;"Yeah."
22:26;22:27;"Whatever."
22:27;22:28;"He's on his own trip."
22:28;22:29;"That's not weird."
22:29;22:31;"I think the thing that struck me when I was like, oh,"
22:31;22:33;"but he still goes on tour and makes albums and stuff."
22:33;22:35;"I was like, that's interesting."
22:35;22:36;"Yeah."
22:36;22:38;"I mean, I think, like I said at this show, I mean,"
22:38;22:42;"he must have someone that's just like holding his hand the whole step of the"
22:42;22:45;"way, like right until he sits down at the piano."
22:45;22:47;"But he can play piano."
22:47;22:50;"Well, the, you know how normally on a stage,"
22:50;22:53;"the piano is like kind of set sideways so you can see the hands."
22:53;22:58;"This was just sort of like set at a 90 degree angle to the audience."
22:58;22:59;"You're looking straight at him."
22:59;23:01;"You're looking at the back of the piano and you're looking at him."
23:01;23:04;"I don't think he was, he was truly like, it was sad."
23:04;23:06;"It was truly like almost like, um,"
23:06;23:09;"like the final days of like a third world dictator."
23:09;23:10;"Like they wheel them out."
23:10;23:11;"Yeah."
23:11;23:13;"And there's like a teleprompter and it's just sort of was like,"
23:13;23:14;"it was a bummer."
23:14;23:15;"How old is he?"
23:15;23:17;"He's got to be in his seventies."
23:17;23:21;"I guess it's the type of thing where obviously it's like a controversial"
23:21;23:22;"subject."
23:22;23:25;"You know, there's been a lot of speculation and talk about Richard Simmons."
23:25;23:28;"People believe that he's like elder abuse,"
23:28;23:31;"that maybe he's suffering from dementia or something like that."
23:31;23:35;"And he's being kind of kept away and alive so that he can like sign away"
23:35;23:39;"some of his fortune to family members or people who don't have his best"
23:39;23:40;"interests at heart."
23:40;23:42;"You know, it's really tricky when people get older and don't have all their"
23:42;23:43;"faculties."
23:43;23:45;"I mean, maybe Brian's having a great time."
23:45;23:47;"It's very like very raw."
23:47;23:53;"And like the decline of like every human that is in our future is like"
23:53;23:55;"fully on stage."
23:55;23:58;"It's not like, but they're playing this like fun, happy music."
23:58;24:01;"And there's a guy that's like completely checked out sitting in the dead"
24:01;24:06;"center of the stage, literally just staring out into the sky."
24:06;24:07;"It's really crazy."
24:07;24:11;"And so, but maybe he's having a great time and he's like, I love this music."
24:11;24:13;"I love my band."
24:13;24:14;"Yeah, I guess that's maybe."
24:14;24:15;"I don't know what's going on."
24:15;24:16;"It's a weird show though."
24:16;24:18;"Obviously everybody gets older."
24:18;24:20;"You got to deal with different stuff."
24:20;24:23;"There's probably a lot of people who just want to, to want to see people."
24:23;24:24;"Yeah."
24:24;24:29;"There's an epidemic of loneliness in this country as we've discussed way back"
24:29;24:31;"in the day, especially with older people."
24:31;24:34;"And you know, they might just want to be around people."
24:34;24:35;"Yeah."
24:35;24:38;"Performing at the Greek theater."
24:38;24:39;"I wonder."
24:39;24:40;"Yeah, I guess that's it."
24:40;24:43;"Based on what you're describing and I've never seen him live."
24:43;24:47;"I don't think that's the type of thing where you just want to know that even"
24:47;24:51;"though he might be a little more checked out, maybe that happens."
24:51;24:52;"Yeah."
24:52;24:53;"I'm just saying that."
24:53;24:54;"Yeah."
24:54;24:56;"You want to think that somebody like is talking about it with him and whatever"
24:56;25:01;"his demeanor or like if his face doesn't express joy in the way that it did"
25:01;25:03;"when he was 25, like that's normal."
25:03;25:07;"As long as he's basically like, no, this is what I want to do."
25:07;25:11;"Because if you feel like your life is defined by playing music and performing."
25:11;25:12;"Yeah."
25:12;25:13;"Because he probably doesn't do interviews anymore."
25:13;25:14;"Does he?"
25:14;25:15;"I have no idea."
25:15;25:18;"I guess he did an interview in 2016 with Rolling Stone."
25:18;25:19;"I wonder what that interview was though."
25:19;25:23;"That was like over email with his assistant or that was like actually a sit"
25:23;25:24;"down."
25:24;25:26;"I have something here from the Palm Springs desert sun."
25:26;25:27;"Yeah."
25:27;25:28;"August of this year."
25:28;25:30;"An interview with Brian Wilson."
25:30;25:31;"Yeah."
25:31;25:34;"Uh, talking about touring with the zombies."
25:34;25:35;"Oh yeah."
25:35;25:37;"It's a great night of music folks."
25:37;25:41;"Just, he's just like, you know, mortality was just on full display."
25:41;25:43;"Always get some hole in the crowd."
25:43;25:47;"Who's like, you know, nitpicking my vibe on stage."
25:47;25:48;"Listen, like I'm an old dude."
25:48;25:51;"I can't bring the energy like I used to, but I'm having a ball out there."
25:51;25:53;"I guess I gotta be honest."
25:53;25:54;"I'm having the time of my life."
25:54;25:57;"This is from that 2016 article."
25:57;25:58;"A few days early,"
25:58;26:01;"the singer songwriter and founding Beach Boy celebrated his 74th birthday."
26:01;26:04;"And when the subject comes up, his eyes widen."
26:04;26:06;"It was the greatest birthday of my life."
26:06;26:08;"He says, I'm crossing his arms."
26:08;26:10;"We went to a place called Peter Luger's."
26:10;26:12;"You got to go there."
26:12;26:13;"You will love it."
26:13;26:15;"I had the greatest steak dinner that I ever had in my whole life."
26:15;26:16;"He dropped an F bomb."
26:16;26:20;"He waits a beat and raises his voice in my whole life."
26:20;26:22;"Maybe he just lives for food and music."
26:22;26:23;"Now."
26:23;26:24;"Loving those steaks."
26:24;26:25;"Loving those breakfast burritos."
26:25;26:27;"You know what I think?"
26:27;26:29;"Loving the late sixties Beach Boys stuff."
26:29;26:30;"I bet he's chilling."
26:30;26:32;"Al Jardine was on stage with them."
26:32;26:33;"Oh, that's tight."
26:33;26:34;"It was funny."
26:34;26:35;"Cause like, yeah,"
26:35;26:38;"they're playing stuff off like smile and cause yeah,"
26:38;26:40;"they did heroes and villains and they were doing stuff of surfs up."
26:40;26:42;"And that's like George Gershwin level,"
26:42;26:44;"sophisticated composition."
26:44;26:47;"And then it'd be like, now we're doing an Al Jardine song."
26:47;26:49;"And it's just like, I can't remember what they were."
26:49;26:52;"Just like the funniest, just like garage rock."
26:52;26:54;"Bar band garage rock."
26:54;26:56;"Between those guys."
26:56;26:58;"Going down to the beach and doing their stuff."
26:58;27:00;"It's like, it was like,"
27:00;27:02;"that's like really kind of an old school band vibe."
27:02;27:03;"Yeah."
27:03;27:04;"Like there's like one,"
27:04;27:05;"one or two geniuses."
27:05;27:08;"And then there's like another guy or two that also write songs."
27:08;27:11;"Well, that was like a recurring joke in Bohemian Rhapsody."
27:11;27:14;"They would always kind of razz the drummer because they'd be like"
27:14;27:16;"single from the cell."
27:16;27:18;"It's gotta be Bohemian Rhapsody."
27:18;27:19;"There's like, it's opera."
27:19;27:20;"It's, you know,"
27:20;27:21;"it's our most ambitious work yet."
27:21;27:22;"And then the joke in the movies,"
27:22;27:24;"he's always like, what about my song?"
27:24;27:25;"I love my car."
27:25;27:29;"I don't know if that was like reflective of the actual dynamic in the band,"
27:29;27:32;"but they made that a joke that it was like Brian May and like,"
27:32;27:33;"obviously Freddie Mercury."
27:33;27:34;"Yeah."
27:34;27:35;"Just like this very sophisticated stuff."
27:35;27:37;"And it's like, I love my car."
27:37;27:39;"It's a good rock tune, man."
27:39;27:41;"Well, anyway, shout out to Brian Wilson."
27:41;27:42;"I bet he's chilling."
27:42;27:44;"I've been in this town so long,"
27:44;27:45;"the back of the city."
27:45;27:48;"I've been taken for a lost gun."
27:48;27:52;"And I've known for a long, long time."
27:52;27:56;"Held in love musical with an innocent girl"
27:56;27:59;"From the Spanish and Indian home"
27:59;28:01;"Of the heroes and villains"
28:01;28:07;"Once a knight could change land and water"
28:07;28:10;"And she was riding the rein of the foes"
28:10;28:13;"That eventually brought her down"
28:13;28:18;"But she's still dancing in the night and the rain"
28:18;28:20;"Of what a deed will do in a town"
28:20;28:23;"For the heroes and villains"
28:23;28:25;"Ah"
28:25;28:32;"Heroes and villains"
28:32;28:37;"Just see what you've done"
28:37;28:48;"Heroes and villains"
28:48;28:53;"Just see what you've done"
28:53;29:09;"I mean, we've been following this story for a long time."
29:09;29:11;"I don't know if we've talked about it that much on air,"
29:11;29:14;"but I got a lot of texts, got a lot of emails"
29:14;29:17;"from people when the news broke to the mainstream."
29:17;29:21;"That the Richard Montanez biopic is happening."
29:21;29:24;"I feel like we willed this into existence."
29:24;29:26;"I kind of feel that way."
29:26;29:29;"Tom Christmas is very influential."
29:29;29:33;"By the way, you see how many people have been covering"
29:33;29:35;"winter starbucking lately?"
29:35;29:36;"Yeah, it's crazy."
29:36;29:41;"BBC, Fox News, CNN, Seth Meyers."
29:41;29:42;"Oh, Seth Meyers?"
29:42;29:43;"Yeah."
29:43;29:44;"What, did he do a joke about it?"
29:44;29:45;"Yeah, he kind of ripped on winter."
29:45;29:46;"But I think winter was down."
29:46;29:50;"Oh no, the joke was a man's mission to visit every"
29:50;29:51;"Starbucks in the world."
29:51;29:54;"He finally reaches 15,000 Starbucks and they finally"
29:54;29:56;"spelled his name right on his cup and it cut to this cup."
29:56;29:58;"It's a dork."
29:58;30:01;"And winter was like, oh man, but you know what?"
30:01;30:03;"Respect coming from Seth Meyers or something like that."
30:03;30:04;"And then like--"
30:04;30:05;"Not cool, Seth."
30:05;30:07;"Yeah, it's like Seth, come on, bro."
30:07;30:08;"Yeah, f*** you."
30:08;30:10;"(laughter)"
30:10;30:12;"I mean, real talk."
30:12;30:14;"Seinfeld is going hard on--"
30:14;30:16;"Cutting through all the noise with that one."
30:16;30:18;"Should we try to get Seth Meyers on the show?"
30:18;30:19;"Hash this out?"
30:19;30:20;"I would love that."
30:20;30:23;"Yeah, let's see Seth Meyers around here and there."
30:23;30:26;"Yeah, I think I could get his email very quickly."
30:26;30:29;"I'd like send him like, hey man, so we'd love it if you'd"
30:29;30:32;"come on-- he would just be like-- I bet he literally"
30:32;30:34;"wouldn't know what we were talking about."
30:34;30:36;"Yeah, he just read that joke."
30:36;30:39;"Yeah, like I do 20 of those jokes a night."
30:39;30:40;"Yeah."
30:40;30:42;"What the f*** are you talking about?"
30:42;30:45;"He's a friend-- because we do a show, and Winter's like"
30:45;30:47;"a kind of character on our show."
30:47;30:50;"You do a show, we do a show, you got your kind of guys,"
30:50;30:52;"we got our guys, Winter's one of our guys, man."
30:52;30:55;"We just-- it didn't sit right with us."
30:55;30:58;"She's like, I have no idea."
30:58;31:00;"The Starbucks joke."
31:00;31:02;"Which Starbucks joke?"
31:02;31:04;"Obviously, Winter deserves all the credit."
31:04;31:06;"He's the one who went to 15,000 Starbucks."
31:06;31:10;"All I'm saying is that time crisis, we've been covering him"
31:10;31:15;"since 2017, because we tell the stories that matter first."
31:15;31:20;"One question is, I wonder if any of those outlets did pick up"
31:20;31:26;"on the story via time crisis, chose not to give us credit."
31:26;31:29;"Some like intern in the writer's room."
31:29;31:30;"The TC head?"
31:30;31:33;"It was like, hey, I got an idea."
31:33;31:34;"Who knows?"
31:34;31:36;"But whatever, Winter deserves the credit for all the press."
31:36;31:42;"All I'm saying is, as usual, we beat the lamestream media by years."
31:42;31:45;"Well, Winter blasted out a press release."
31:45;31:47;"Remember he was asking for our notes on it?"
31:47;31:48;"No, I missed that."
31:48;31:50;"I missed that email."
31:50;31:53;"He sent an email being like, hey, what are your thoughts"
31:53;31:55;"on this press release?"
31:55;31:56;"When was this?"
31:56;31:58;"Like a month ago."
31:58;31:59;"Totally missed that."
31:59;32:00;"Oops."
32:00;32:03;"All right, we found one article that loops us in."
32:03;32:05;"Very self-indulgent part of the show."
32:05;32:09;"Looking for articles on the internet that reference our own show."
32:09;32:13;"For the last 22 years, Winter has been the subject of many people's fascination."
32:13;32:16;"In 2006, he was the star of a documentary called Starbucking"
32:16;32:17;"by Bill Tangerman."
32:17;32:19;"We've got to watch that."
32:19;32:23;"I guess there was a full documentary a decade before we were on it,"
32:23;32:24;"so we don't deserve too much credit."
32:24;32:27;"Well, my first communication with him goes back to '03."
32:27;32:28;"Okay."
32:28;32:29;"Emailed in '03."
32:29;32:32;"It's funny because the next line of this, news outlets have written articles"
32:32;32:35;"about him since as early as 2002."
32:35;32:36;"Okay."
32:36;32:37;"Well, somehow I found him."
32:37;32:43;"A headline in the Palm Beach Post from 2007 reads, ""Is he off his bean?"""
32:43;32:44;"Off his bean."
32:44;32:45;"Disrespectful."
32:45;32:47;"[Bleep] you, Palm Beach Post."
32:47;32:49;"Is that an expression?"
32:49;32:51;"It's like off your rocker."
32:51;32:54;"Definitely your bean referred to as your head is a thing."
32:54;32:55;"Sure."
32:55;32:56;"And recently he's been--"
32:56;32:57;"They're pushing it with that palm."
32:57;32:58;"Yeah, right."
32:58;33:00;"Recently he's been featured a few times on the podcast."
33:00;33:02;"[Bleep]"
33:02;33:05;"Time Crisis hosted by Vampire Weekend frontman Ezra Kanning."
33:05;33:06;"Okay, we need--"
33:06;33:08;"And American painter."
33:08;33:12;"Yeah, what about American painter and radio personality?"
33:12;33:17;"As well as Twitter celebrity Seinfeld 2000."
33:17;33:18;"Influencer."
33:18;33:19;"Influencer, sorry, wrong term."
33:19;33:20;"It's okay."
33:20;33:24;"I'm an American musician and radio personality,"
33:24;33:26;"Jake's an American painter and music personality."
33:26;33:31;"Seinfeld is a Canadian influencer and radio personality."
33:31;33:33;"Would it be Canadian-American or just Canadian?"
33:33;33:34;"Just Canadian."
33:34;33:35;"Wait, are you Canadian-American?"
33:35;33:36;"No."
33:36;33:37;"I mean, you live in America, so it's like--"
33:37;33:38;"Yeah, you're allowed to."
33:38;33:40;"I feel American."
33:40;33:44;"Don't buy into outdated notions of citizenship, man."
33:44;33:46;"Can we say North American?"
33:46;33:47;"Too vague."
33:47;33:50;"North American influencer."
33:50;33:51;"Oh, but you know, by the way, speaking of--"
33:51;33:55;"Before we dive back into the Montanhas, I met Patrick World in Montreal."
33:55;33:56;"Oh, yeah."
33:56;33:57;"Yeah."
33:57;34:02;"Yeah, he DMed us, and yeah, I put him in touch with your management,"
34:02;34:06;"and I'm glad you guys had a chance to meet."
34:06;34:07;"Shout-out to Patrick World."
34:07;34:12;"It was tight because two people from my high school, Pete and Celia,"
34:12;34:16;"a couple from my town, Glen Ridge, they're married now, and they live in Vermont."
34:16;34:19;"Are they a TC couple?"
34:19;34:22;"I don't remember if they said they listen to TC,"
34:22;34:27;"but they came to see Vampire Weekend, and people from Vermont go see shows"
34:27;34:28;"in Montreal a lot."
34:28;34:29;"Yeah, closest city."
34:29;34:30;"That can be their closest city."
34:30;34:33;"Oh, yeah, we used to drive down, do some cross-border shopping,"
34:33;34:34;"and then we saw--"
34:34;34:35;"In Vermont?"
34:35;34:38;"Yeah, we saw Louis Guzman once at Sweetwater when I was a kid."
34:38;34:39;"In Vermont?"
34:39;34:40;"Yeah."
34:40;34:41;"In like Montpelier or what city?"
34:41;34:42;"Burlington."
34:42;34:43;"Okay."
34:43;34:46;"Okay, so there's a nice cultural exchange between Burlington and Montreal."
34:46;34:51;"Yeah, actually, Luis, who we knew from doing stuff for Bernie Sanders,"
34:51;34:52;"came up too."
34:52;34:53;"Oh, yeah."
34:53;34:54;"It was a little Burlington crew, and it was good to see them"
34:54;34:58;"and just kind of catch up on our hometown and stuff."
34:58;35:02;"But it's funny, you're backstage, and you see a bunch of people"
35:02;35:04;"who are at the show, so you talk to some people, and somebody comes up,"
35:04;35:07;"and like, ""Oh, hey,"" you know, you often have--"
35:07;35:10;"I guess this could happen at any type of gathering or party,"
35:10;35:12;"but specifically at aftershows sometimes,"
35:12;35:15;"especially if Vampire Weekend aftershow could be like the most random mix"
35:15;35:16;"of people, because suddenly you're--"
35:16;35:19;"like two people you're just talking to, they're kind of sitting there waiting."
35:19;35:21;"So I was just like, ""Then that happened, and I'm talking to Patrick,"
35:21;35:24;"and he's telling me we're catching up, and I'm thanking him"
35:24;35:28;"for all the great work he's done for the show and for supporting us,"
35:28;35:29;"and he's telling me more about his background."""
35:29;35:31;"He actually has a bit of a radio background."
35:31;35:32;"Oh, okay."
35:32;35:33;"That was cool."
35:33;35:35;"Oh, one thing also he confirmed, he doesn't make the tracks."
35:35;35:40;"Okay, he's not doing live drums on his cover of ""Boys Are Back in Town."""
35:40;35:41;"Which--"
35:41;35:42;"Oh, wow."
35:42;35:43;"Which makes sense."
35:43;35:44;"I'm like weird Al Yankovic."
35:44;35:46;"Does Al build from the ground up?"
35:46;35:47;"Al builds everything from the ground up."
35:47;35:48;"He must."
35:48;35:50;"He creates everything."
35:50;35:51;"Yeah, but we can't expect--"
35:51;35:54;"It's like one of those funny things where I turn to them and say like,"
35:54;35:57;"""Oh, hey guys, by the way, this is Patrick."""
35:57;35:59;"I'm like, ""Hey,"" and I was like, ""So--"
35:59;36:00;"Yeah, in fact, I don't think they were TCS."""
36:00;36:01;"That's a lot of backstory."
36:01;36:03;"I was like, ""You know I do this radio show,"" and they're like, ""Oh, okay."""
36:03;36:07;"And I was like, ""So on the radio show, Patrick, I've never met him before,"
36:07;36:11;"but he's a listener who will send us in parodies, songs based on--"""
36:11;36:14;"They're just kind of like, ""Okay."""
36:14;36:16;"Yeah, a lot of inside jokes from our show."
36:16;36:21;"You know, Lonnie's dad, Lord Hadaway, things of that nature."
36:21;36:23;"They look around and Patrick's nowhere to be seen."
36:23;36:24;"No, I swear he was--"
36:24;36:26;"Yeah, he was just there."
36:26;36:29;"No, but shout out to Patrick and his wife who came through."
36:29;36:35;"Wow, it sounds like the East Coast is really like some big TC icons were in the mix."
36:35;36:36;"Well, and then there was--"
36:36;36:37;"Winter and Patrick."
36:37;36:42;"There was a Twitter exchange later where Winter and Patrick were making plans to link up."
36:42;36:43;"Did you see that?"
36:43;36:44;"Oh, actually I did."
36:44;36:45;"That is sick."
36:45;36:46;"I'm not lying."
36:46;36:49;"The TC world is--it's really a family."
36:49;36:56;"You know, the next step would be people starting to date, like TC fan community."
36:56;36:58;"You know, they'd be like, ""Hey, anyone else a TC head?"
36:58;37:02;"I'm looking to meet someone."""
37:02;37:07;"Wait, I told you how like a while ago I got a bunch of old issues of Relics on eBay,"
37:07;37:09;"like some '80s Relics."
37:09;37:10;"Wow."
37:10;37:12;"So, you know, Relics still exists."
37:12;37:13;"It's a great news source."
37:13;37:16;"They did a big Vampire Weekend cover story this year."
37:16;37:17;"I got to check that out."
37:17;37:18;"Yeah, it was tight."
37:18;37:24;"Yeah, I love talking to the journalist who also wrote or co-wrote Bill Kreutzman's memoirs."
37:24;37:25;"Oh, that's sick."
37:25;37:32;"But I remember looking through one of them, and there were, you know, like wan ads and personals in the back."
37:32;37:36;"And they're literally--I know this sounds like so kooky, but I wish I could say verbatim,"
37:36;37:41;"but I remember seeing some--so it might be everything from people being like looking to trade tapes,"
37:41;37:43;"you know, that kind of stuff."
37:43;37:47;"But then I remember seeing some personal ads, and I remember they were like some were so hyper-specific,"
37:47;37:51;"just like looking for ladies who are also deadheads."
37:51;37:53;"And like some of them were so hyper-specific."
37:53;38:00;"I remember a guy who's like looking for like a deadhead lady, you know, age, whatever,"
38:00;38:02;"somebody who leans towards pre-'72 stuff."
38:02;38:03;"That's important to me."
38:03;38:06;"It was like literally like that kind of thing."
38:06;38:08;"It's so deep."
38:08;38:13;"I guess it's also possible that if this was the '80s--I can't remember when this issue was--"
38:13;38:15;"maybe he just wanted to make sure he wasn't getting a touch head."
38:15;38:16;"Sure, sure."
38:16;38:20;"Which are people who got on board with their breakout single ""Touch of Gray."""
38:20;38:21;"In '87."
38:21;38:24;"So like what years were these magazines you were buying?"
38:24;38:25;"Some of them were from the '80s."
38:25;38:26;"Like late '80s, early '90s?"
38:26;38:27;"I'll bring some in."
38:27;38:28;"Why did you get them?"
38:28;38:30;"Just out of curiosity?"
38:30;38:32;"I mean I've always been interested in relics."
38:32;38:34;"It's like a magazine I would see around, but not '80s relics."
38:34;38:37;"I would see it at best for me maybe in the late '90s."
