Start Timestamp;End Timestamp;Transcript
38:37;38:40;"And I think I would see--I would just see like cool people."
38:40;38:43;"Like some cool Deadhead t-shirt people, like post-relics."
38:43;38:46;"And I would see them post their collection of vintage ones."
38:46;38:50;"I was like, ""Ooh, I want to see what's inside that 1985 relic."""
38:50;38:52;"That is so deep."
38:52;38:55;"So I bought like three or four that I got for decent prices."
38:55;38:57;"Are they expensive, sort of?"
38:57;38:59;"I didn't find any dirt cheap."
38:59;39:00;"I got a hundred relics."
39:00;39:03;"Hey, if you take them off my hands for $10, I'm happy."
39:03;39:04;"No, it's more like, you know."
39:04;39:07;"Like probably some of them cost like $10."
39:07;39:08;"Okay, yeah."
39:08;39:11;"It wasn't like--well, yeah, I wasn't dropping like $150 for a pristine copy."
39:11;39:13;"But, you know, like--"
39:13;39:15;"Near mint, mint."
39:15;39:16;"Yeah."
39:16;39:18;"But I'll bring them in because they're fascinating."
39:18;39:22;"And also there's something nice about--at that era, it's like in between a zine"
39:22;39:23;"and a professional magazine."
39:23;39:26;"There's like a handmade quality to some of the stuff inside."
39:26;39:30;"But I also just like love thinking about this dude just like mid-'80s."
39:30;39:34;"Like at first I wonder what kind of responses he got."
39:34;39:37;"And I'm also picturing somebody just like, ""Hey, man, like, you know what?"
39:37;39:41;"I also live in Westchester, and I happen to see that."
39:41;39:42;"I've been looking to meet a Deadhead, too."""
39:42;39:46;"And then like they link up, and he's just like immediately just like full jeush bag,"
39:46;39:47;"just like quizzing her."
39:47;39:48;"Just like--"
39:48;39:50;"So '74, how do you feel?"
39:50;39:51;"Yeah."
39:51;39:53;"Okay."
39:53;39:57;"What's the best Mr. Charlie of '72?"
39:57;39:59;"And you can't say the one on Europe '72."
39:59;40:01;"And she's like, ""I don't know, man."
40:01;40:05;"I like--I like touch of gray, like Uncle John's man."""
40:05;40:07;"He's just like, ""Get the f--- out of here."""
40:07;40:08;"This is not going to work."
40:09;40:10;"I'm looking for happiness."
40:10;40:11;"Can't you tell?"
40:11;40:12;"Yeah."
40:12;40:16;"She's just like beautiful hippie chick."
40:16;40:19;"Yeah, just somewhat familiar."
40:19;40:20;"""Oh, no, I haven't heard that."
40:20;40:25;"No, I'd love to learn more about some of like the '74 bootlegs."""
40:25;40:28;"And he's like, ""Well, get back to me when you do."""
40:28;40:31;"You wasted both of our time."
40:31;40:34;"Anyway, the TC personals wouldn't be like that."
40:34;40:35;"Colin just showed me something."
40:35;40:36;"Where was it?"
40:36;40:37;"It was on Reddit."
40:37;40:38;"Wait, is it on the TC Reddit?"
40:38;40:40;"The TC Reddit, which I never look at, but--"
40:40;40:42;"Oh, yeah, is the TC Reddit popping?"
40:42;40:43;"Oh, nice."
40:43;40:46;"Subject had New York-based TC heads."
40:46;40:49;"""Hey, I'm visiting New York for work October 6 to 8"
40:49;40:52;"and wondering if any TC heads wanted to get a drink."
40:52;40:54;"I'm 25, into corporate food history,"
40:54;40:57;"jam bands, and visiting Starbucks."""
40:57;40:59;"Response, ""Suburban New Yorker here."
40:59;41:00;"Let's get a coffee."""
41:00;41:01;"Oh, that's sick."
41:01;41:02;"That's sweet."
41:02;41:03;"Wait, what?"
41:03;41:05;"It was a 25-year-old man?"
41:05;41:06;"Oh, that's cool."
41:06;41:07;"Yeah, there's no--"
41:07;41:09;"It's kind of post-gender, just like--"
41:09;41:10;"This is about the show."
41:10;41:12;"Oh, this is just about linking up."
41:12;41:15;"Yeah, it's not a dating inquiry."
41:15;41:17;"Yeah, you know, maybe that's better, too."
41:17;41:18;"Yeah, it's better."
41:18;41:20;"People bring too much energy and expectation"
41:20;41:21;"to romantic relationships."
41:21;41:23;"Well, that's how something could really happen, though."
41:23;41:25;"It's like two TC heads."
41:25;41:27;"They're just there to talk about the show, maybe connect."
41:27;41:30;"And then, you know, one thing leads to another, maybe."
41:30;41:31;"But if you just go in like,"
41:31;41:33;"""Hey, we're just talking about the show,"""
41:33;41:34;"no presh."
41:34;41:35;"Yeah, it's just a meet-up."
41:35;41:37;"There was one time earlier this year,"
41:37;41:40;"I believe it was after our Cincinnati show,"
41:40;41:45;"a young woman DM'd me on Instagram and said like,"
41:45;41:49;"""Listen, I was sitting next to this guy at the show,"
41:49;41:50;"and we really hit it off,"
41:50;41:53;"and we were talking about this, this, and this."""
41:53;41:54;"We had good sense--"
41:54;41:55;"They might have been TC heads."
41:55;41:57;"I don't remember, but they were like--"
41:57;41:58;"We were like joking around."
41:58;42:00;"He's like a medical student at the University of Cincinnati,"
42:00;42:01;"blah, blah, blah."
42:01;42:03;"I really regret that I didn't ask for his number."
42:03;42:05;"I was like being too shy or something."
42:05;42:06;"Can you help me out?"
42:06;42:10;"And then I was like, ""I mean, I guess."""
42:10;42:11;"Yeah, what do you do?"
42:11;42:14;"I was like, ""If you can condense this into one post,"
42:14;42:17;"I'll throw it on my IG stories."""
42:17;42:20;"So she made like a pretty well-designed little like,"
42:20;42:21;"""Hey, what's up?"""
42:21;42:23;"You know, she was using Futura and stuff."
42:23;42:25;"Yeah, Miss Connections, Cincinnati show."
42:25;42:27;"And I posted it, and I got a lot of response."
42:27;42:28;"I'd be like, ""Oh, that's so sweet."""
42:28;42:31;"I would feel like in this day and age,"
42:31;42:34;"somebody--it wouldn't be that hard to figure out."
42:34;42:35;"I wonder if they ever linked up."
42:35;42:37;"Yeah."
42:37;42:38;"I kind of feel like if they had,"
42:38;42:41;"then you would have gotten like a follow-up from her."
42:41;42:43;"A wedding invitation."
42:43;42:44;"But I agree."
42:44;42:45;"Romantic relationships."
42:45;42:47;"I was expecting."
42:47;42:49;"TC, baby."
42:49;42:50;"I'm just going deep on this subreddit."
42:50;42:53;"Did you know that during the Apple iPhone release,"
42:53;42:56;"there was an Apple Watch video with a VO by Michael Cera"
42:56;42:58;"with Sympathy as the back--"
42:58;42:59;"Oh, yeah, of course."
42:59;43:00;"Wild."
43:00;43:01;"I missed that."
43:01;43:03;"Yeah, unrelated to time crisis."
43:03;43:04;"I got you."
43:04;43:05;"There was like some message on Twitter that was like,"
43:05;43:07;"""Is that part of your time crisis deal?"""
43:07;43:11;"And I was like, ""How dare you?"""
43:11;43:14;"These are independent branches of the organization."
43:14;43:17;"Yeah, Sympathy is in an Apple Watch commercial."
43:17;43:18;"That's so modern."
43:18;43:20;"I haven't seen it in full,"
43:20;43:23;"and I didn't know that Michael Cera was going to do the voiceover,"
43:23;43:24;"but that's tight."
43:24;43:26;"Yeah, I think it premiered at the keynote,"
43:26;43:28;"but I don't know if it's on TV yet."
43:28;43:30;"Yeah, I can't find it anywhere."
43:30;43:31;"Anyway, check it out."
43:31;43:33;"Seinfeld's down the rabbit hole in that Reddit."
43:33;43:34;"Yeah, I got to close this window."
43:34;43:36;"Yeah, I can see like your eyes are glazing over."
43:36;43:38;"You need to get out of there."
43:38;43:42;"Reddit, that's the Reddit, you know, it just sucks you in."
43:42;43:44;"Suddenly it's nighttime."
43:44;43:45;"You're just on Reddit all day."
43:45;43:54;"""Master thread for determining Seinfeld 2000's address."""
43:54;43:56;"I wonder if there's any, like, TC loyalists"
43:56;43:58;"who, like, still see you as a villain."
43:58;44:00;"Because when you first came on the show,"
44:00;44:04;"you were definitely a bit of a villain."
44:04;44:06;"Yeah, people are confused by that narrative."
44:06;44:09;"That's one of the most classic narratives of all time."
44:09;44:10;"Foe becomes friend."
44:10;44:12;"It's true."
44:12;44:14;"It was a character evolution."
44:14;44:16;"It was some pro wrestling sh*t."
44:16;44:17;"That's right."
44:17;44:19;"Eventually, though, there's going to be the fallout."
44:19;44:21;"There could be the fallout."
44:21;44:22;"Seinfeld gets banished."
44:22;44:26;"Yeah, we should create more storylines for this show."
44:26;44:29;"We just bring in just like some real dweeb"
44:29;44:34;"who's just like, ""World's biggest Friends fan."""
44:34;44:37;"I am interested in hearing about how the Rembrandts"
44:37;44:39;"feel about the 25th anniversary of Friends,"
44:39;44:41;"which is now, right?"
44:41;44:44;"Anyway, why am I talking about this?"
44:44;44:45;"You're kind of excited."
44:45;44:48;"I mean, at a certain point, old rivalries,"
44:48;44:50;"they kind of collapse."
44:50;44:52;"You know, it's kind of like when you're talking about,"
44:52;44:55;"like, imagine two 85-year-olds"
44:55;44:58;"fought on opposing sides of a war."
44:58;44:59;"They both make it to 85."
44:59;45:01;"They're sitting at a cafe."
45:01;45:04;"They've both seen the way that time ravages everybody,"
45:04;45:07;"the winners, the losers."
45:07;45:09;"They both have lost so many people."
45:09;45:11;"They're both the last men standing from their platoon."
45:11;45:14;"They look at each other, former enemies,"
45:14;45:16;"and they're just kind of like,"
45:16;45:18;"""Hey, man, let me buy you that cup of coffee."
45:18;45:22;"""I hated your guts. I wanted to kill you, but now we're--"""
45:22;45:24;"I mean, it's real sh--. Actually, it's very moving."
45:24;45:27;"I've spoken highly of the Ken Burns Vietnam doc."
45:27;45:29;"You ever crack that, Jake?"
45:29;45:31;"Didn't get through it. It's awesome."
45:31;45:34;"The beginning's tough. The beginning's tough."
45:34;45:36;"That's on me."
45:36;45:38;"It's a major investment in the beginning,"
45:38;45:40;"but when you get to the end, they talk, too,"
45:40;45:44;"about a lot of these American soldiers"
45:44;45:46;"who were so young."
45:46;45:49;"These were very young adults when they rolled over there."
45:49;45:51;"Some of them who probably drank the Kool-Aid"
45:51;45:54;"or believed they were fighting a necessary battle"
45:54;45:56;"have a lot of questions later."
45:56;45:59;"And they talk about it, some of these dudes roll back to Vietnam."
45:59;46:02;"It's haunted them their whole lives, PTSD, whatever."
46:02;46:05;"And they talk about that there's a not-uncommon thing,"
46:05;46:09;"is that Northern Vietnamese soldiers and North Vietnamese won,"
46:09;46:11;"so the whole country is--"
46:11;46:15;"They're returning to the country where the victors beat the U.S.,"
46:15;46:18;"and now some of these American soldiers"
46:18;46:21;"will go link up with dudes who are on the opposing side,"
46:21;46:25;"and there is this weird shared camaraderie of kind of like--"
46:25;46:27;"I don't think the Northern Vietnamese soldiers are like,"
46:27;46:29;"""You know what, man?"""
46:29;46:31;"Water under the bridge."
46:31;46:34;"U.S. imperialism, capitalism, it's all the same."
46:34;46:35;"It's all good, man."
46:35;46:37;"I do think there is some weird shared thing"
46:37;46:39;"where they're just kind of like,"
46:39;46:42;"""We were both on-the-ground soldiers in a larger thing."
46:42;46:45;"I don't hate you. We both shared a traumatic experience."""
46:45;46:48;"Probably not forgiving the U.S. as an entity."
46:48;46:51;"Oh, yeah, like we were both cannon fodder."
46:51;46:54;"Yeah, and even some of these guys probably realizing the way"
46:54;46:57;"that their worldview was morphed by the--"
46:57;46:59;"So anyway, it's like this kind of moving thing"
46:59;47:03;"where some of these dudes who probably wouldn't have dreamed of it"
47:03;47:05;"are there, and it feels cathartic to them"
47:05;47:09;"to be like, ""We were both victims of violence."""
47:09;47:12;"Actually, now I just remember what we were talking about."
47:12;47:14;"Yeah, just me defending--"
47:14;47:16;"This is like a bad TC rabbit hole"
47:16;47:18;"where I actually jumped to something way too deep,"
47:18;47:20;"and now it's actually insulting to go back"
47:20;47:22;"to what we were originally talking about,"
47:22;47:24;"which is friends versus Seinfeld."
47:24;47:26;"Oops. Apologies."
47:26;47:29;"But I'm saying that I think time collapses everything,"
47:29;47:31;"and when I picture the old heads--"
47:31;47:34;"I've given this example before in Keith Richards' book"
47:34;47:37;"how he talks about he and Paul McCartney"
47:37;47:39;"staying on the same Caribbean island,"
47:39;47:41;"like staying in two villas next to each other,"
47:41;47:43;"and just kind of hitting them up, just like,"
47:43;47:45;"""Yo, man, you want to go for a walk?"""
47:45;47:48;"And he's like, ""Me and Paul just walked on the beach,"
47:48;47:50;"and we just talked about the old days, man."""
47:50;47:52;"And obviously, the Beatles versus the Stones"
47:52;47:54;"is not the same intensity as--"
47:54;47:56;"Friends versus Seinfeld."
47:56;48:00;"Friends versus Seinfeld, let alone North Vietnam versus the U.S.,"
48:00;48:03;"but the way he talked about it was kind of just like,"
48:03;48:05;"""We used to be competitive."""
48:05;48:07;"I don't know if he quite says it, but you can imagine"
48:07;48:10;"Keith Richards probably thought McCartney was a bit of a cornball."
48:10;48:11;"Mm-hmm."
48:11;48:14;"Keith Richards was the badass of the badass crew,"
48:14;48:16;"and Paul McCartney was kind of like the sweetheart"
48:16;48:18;"of, like, the sweet crew."
48:18;48:21;"So, you know, in many ways, they're diametric opposites."
48:21;48:24;"But the way he frames it is a little bit just like,"
48:24;48:27;"""Yeah, two grizzled soldiers. We're both still standing,"
48:27;48:29;"and actually we have more in common with each other"
48:29;48:31;"because we remember."
48:31;48:34;"We remember the past. We've seen good men die."
48:34;48:38;"John Lennon, George Harrison, Brian Jones."""
48:38;48:40;"So there's, like, this slight--"
48:40;48:42;"Actually, I should go back to that passage."
48:42;48:44;"I wonder if he uses any soldier imagery."
48:44;48:46;"But we had this feeling of just kind of like"
48:46;48:48;"the fact that we're both still standing"
48:48;48:51;"and that we both even remember this battle"
48:51;48:54;"or this time period unites us in a way"
48:54;48:57;"that even, like, our children couldn't understand."
48:57;48:59;"So anyway, I think that's starting to happen"
48:59;49:02;"with ""Seinfeld 2000,"" where you've been fighting"
49:02;49:05;"this battle for so long, that one day--"
49:05;49:08;"And look, now you even see, like, ""Friends"" is getting canceled."
49:08;49:10;"- No, what?"
49:10;49:12;"- ""Friends"" is the most popular show on Netflix."
49:12;49:14;"I just thought there was some kind of clickbait article"
49:14;49:16;"that was like, ""Why 'Friends' is actually trash."""
49:16;49:18;"- Yeah, there's been a backlash."
49:18;49:20;"A lot of think pieces about the 25th anniversary"
49:20;49:22;"and how, you know, we're rethinking ""Friends"""
49:22;49:24;"and all the rest of it. I mean, we all already--"
49:24;49:26;"A lot of us knew that ""Friends"" was trash"
49:26;49:28;"from the jump. - Yeah, but people do that"
49:28;49:31;"with ""Seinfeld"" too, but ""Seinfeld"" got more heat"
49:31;49:33;"earlier maybe because ""Seinfeld""--"
49:33;49:35;"""Seinfeld"" was a bigger target maybe"
49:35;49:38;"because it actually existed in this more intelligent circle."
49:38;49:41;"- Why did people say ""Seinfeld"" was trash?"
49:41;49:43;"- I just think, like, to some people, represent, like--"
49:43;49:46;"Well, people talked about, like, ""Seinfeld"" being very white."
49:46;49:48;"- Yeah, that's true. Yeah."
49:48;49:50;"And, you know, Larry David references it a lot"
49:50;49:53;"on ""Curb Your Enthusiasm,"" and..."
49:53;49:55;"Anyway. - All I'm saying is"
49:55;49:58;"that I bet there's a part of you that sees"
49:58;50:00;"the, you know, ""Friends"" backlash,"
50:00;50:02;"and you're just kind of like, ""Man,"
50:02;50:04;"""at the end of the day,"
50:04;50:07;"""we're both fighting a forgotten war"
50:07;50:10;"""for NBC's must-see TV"
50:10;50:12;"mid-'90s block."" - I do not feel that way."
50:12;50:14;"- And I can just kind of-- Okay. - No."
50:14;50:16;"- I just think-- No, you're not there yet,"
50:16;50:17;"but I'm picturing, like, in 20 years."
50:17;50:19;"- No, I'll never be there. - We're sitting here,"
50:19;50:21;"and you have, like-- It's, like, really retro"
50:21;50:23;"and cool to be into ""Riverdale."""
50:23;50:25;"- [laughs]"
50:25;50:27;"- It's like young kids are like, ""Oh, yeah,"
50:27;50:28;"""like, I'm into 'Riverdale.'"""
50:28;50:29;"Somebody's like, ""Oh, what about, like,"
50:29;50:31;"""Friends and 'Seinfeld'?"" And they're just like,"
50:31;50:33;"""I don't even know what the f--- you're talking about."""
50:33;50:35;"And you'll look at, like, some ""Friends"" fanatic,"
50:35;50:36;"and he'll look at you, and you'll just be like,"
50:36;50:38;"""We're just two forgotten soldiers"
50:38;50:41;"""in a war that these kids don't even care about."""
50:41;50:43;"- Well, you know, if they bring ""Seinfeld"" back,"
50:43;50:45;"we wouldn't even have to have that conversation,"
50:45;50:48;"and that's a mission that I'm still kind of"
50:48;50:50;"dedicated to, so we'll see."
50:50;50:52;"- I have a feeling that ""Friends"" will come back"
50:52;50:53;"before ""Seinfeld."""
50:53;50:58;"- ♪ Said no one told you life was gonna be this way ♪"
50:58;51:00;"♪ Your job's a joke, you're broke ♪"
51:00;51:03;"♪ Your love life's the other way ♪"
51:03;51:07;"♪ It's like you're always stuck in second gear ♪"
51:07;51:11;"♪ When it hasn't been your day, your week, your month ♪"
51:11;51:13;"♪ Or even your year ♪"
51:13;51:17;"♪ But I'll be there for you ♪"
51:17;51:20;"- ""Time Crisis"" with Ezra Koenig"
51:20;51:22;"on Beat Squad."
51:22;51:25;"- So, Yvelon Goria with this ""Flaming Hot Cheetos"" film."
51:25;51:27;"- Anyway. - It's pretty cool."
51:27;51:29;"- So, we've been talking about Richard Montanez for a minute,"
51:29;51:33;"and because I follow him on Instagram,"
51:33;51:34;"I've known that he's been working on"
51:34;51:37;"developing a film for a long time, years."
51:37;51:40;"Last time I checked, his account is private,"
51:40;51:43;"so you have to be accepted into the inner circle"
51:43;51:45;"to get to follow him, but he's always been very open"
51:45;51:47;"about the fact, like, ""Oh, yeah, I was in L.A."
51:47;51:49;"""doing a meeting, looks like things are gonna happen,"""
51:49;51:52;"and now finally, it reaches the mainstream"
51:52;51:55;"with the announcement that Yvelon Goria is gonna direct it."
51:55;51:57;"One thing I'd like to say is we've tried to get"
51:57;51:59;"Montanez on the show many times."
51:59;52:02;"So, Seinfeld, you kind of spearheaded that initiative."
52:02;52:04;"How'd you fuck that one up?"
52:04;52:06;"- Oh, well, no, I didn't-- - What happened?"
52:06;52:08;"- I didn't fuck it, I made a valiant effort to--"
52:08;52:10;"- You had one job. - Well, listen,"
52:10;52:13;"Montanez does not want to be on this show,"
52:13;52:15;"straight up, let's just say that."
52:15;52:18;"He was speaking at some sort of corporate event,"
52:18;52:20;"and I went through the promoters, and I went through the thing,"
52:20;52:22;"and it came--you know, it went back to him,"
52:22;52:24;"and it was just a note from him."
52:24;52:26;"And I think we've also been trying to go through--"
52:26;52:29;"- But did you say it was time crisis with Ezra and Jake?"
52:29;52:31;"- Yeah, I led with--I did the whole thing."
52:31;52:33;"I said, you know, you can-- - But did you start out saying,"
52:33;52:35;"""Hey, I'm Seinfeld 2000,"" maybe they were just like, ""Eh."""
52:35;52:38;"- No, no, no, I did it, like, as my real, like--"
52:38;52:40;"I used my real name. - He's probably like,"
52:40;52:42;"""Oh, yeah, Seinfeld 2000, I don't like that guy."""
52:42;52:44;"- No, no, no, everybody loves-- - He caused a lot of trouble"
52:44;52:46;"in the early days of TC. - No, no."
52:46;52:49;"No, no, no, it's a beloved-- it's a beloved Internet presence"
52:49;52:53;"that really everybody wants to be tapped into."
52:53;52:56;"But no, he--I think that he was actually"
52:56;52:59;"just saving the IP for this film."
52:59;53:01;"That's my theory. He's like, ""I'm not gonna do interviews."
53:01;53:03;"I'm not gonna do press."
53:03;53:05;"Let's have Eva Longoria handle this story with a tender."""
53:05;53:08;"- Or to be fair, to be fair, maybe he's like--"
53:08;53:10;"he gets paid to fly around the world to tell his story."
53:10;53:12;"He goes to colleges."
53:12;53:15;"He gives kind of inspirational talks at corporations."
53:15;53:18;"Maybe his vibe is like, ""I don't need to do press per se."
53:18;53:21;"I'm out there telling my story, and I'm being rewarded for it."""
53:21;53:24;"So I could imagine, you know, he's talking at a college"
53:24;53:26;"or something, he's getting his speaker's fee,"
53:26;53:29;"and we're like, ""You want to just come do some press?"""
53:29;53:31;"He's like, ""Why?"" - Right, yeah, and I think"
53:31;53:33;"he knows that you're kind of like, uh..."
53:33;53:36;"I don't know, like, maybe you'll make fun of him."
53:36;53:38;"Like, maybe this isn't a safe space for--"
53:38;53:40;"- I don't make fun of people. - Well, not make fun of--"
53:40;53:42;"but he knows that you're like, maybe sometimes--"
53:42;53:45;"- Maybe he knows that I associate with people like a Seinfeld 2000."
53:45;53:47;"- Right. - Kind of mean-spirited."
53:47;53:49;"- No, there's nothing-- - Kind of snarky."
53:49;53:51;"- No, no, no, no, like, um..."
53:51;53:54;"What I'm saying is that maybe he's heard some of the show,"
53:54;53:56;"and he thinks, ""Well, this is a little tongue-in-cheek, maybe,"
53:56;53:59;"about the craft of, um, these Cheetos,"
53:59;54:01;"which I've devoted my life to, and I don't want this--"
54:01;54:03;"- Right, he hears us talking about Frito-Lay Corporation,"
54:03;54:05;"and he's like, ""I don't know what to make of this."""
54:05;54:07;"- Maybe. - He heard the Donald Kendall segment."
54:07;54:10;"- Maybe he's heard our-- yeah, your takes on Brad's drink"
54:10;54:14;"and whatnot, and just, ""I don't want this Ezra ripping into my--"
54:14;54:16;"my--my--"" - Although, I will say one thing."
54:16;54:19;"Sorry to brag."
54:19;54:23;"Forgive me, Lord, but I'm about to brag."
54:23;54:26;"- Is this gonna be a humble brag or, like, a full-on brag?"
54:26;54:29;"- This is a full-on brag. - Uh-huh."
54:29;54:32;"- Lord, forgive me, but I'm going back to the old me."
54:32;54:35;"I try to tame my ego,"
54:35;54:38;"but sometimes I can't keep it in check."
54:38;54:40;"- Oh, my God."
54:40;54:42;"- Lord, forgive me. Here we go."
54:42;54:44;"So I followed him for a long time,"
54:44;54:46;"even when he was private, and you needed him"
54:46;54:48;"to personally approve you."
54:48;54:50;"- He still is private. - Oh, he still is private."
54:50;54:52;"- With 63,000 followers. - Wow."
54:52;54:54;"- What a piece of [bleep]"
54:54;54:56;"- What? - No, no."
54:56;54:59;"No, no, I mean, like, not--not really."
54:59;55:02;"- Do you think he's personally going through and, like, okaying?"
55:02;55:05;"- Absolutely. - I take that back, Richard."
55:05;55:07;"That was--if you're listening. - See, Seinfeld, you're--"
55:07;55:09;"- Man. - I'm still--"
55:09;55:11;"- So anyway, here's my brag. - Cut that. Cut that."
55:11;55:13;"- Here's my brag."
55:13;55:15;"- Seinfeld's going--I mean-- - See, you know what--"
55:15;55:18;"- Episode 101 starts the decline of Seinfeld."
55:18;55:20;"- Yeah. - We're slowly building the story."
55:20;55:23;"- Right. - By episode 120, he's off the show."
55:23;55:25;"- Making a lot of edibies."
55:25;55:28;"- From episode 9 to 100, Seinfeld was rehabilitated,"
55:28;55:31;"brought back into the fold."
55:31;55:34;"From 101 to 150..."
55:34;55:36;"- A dark spiral."
55:36;55:39;"- One of the most precipitous falls from grace"
55:39;55:41;"ever recorded on an Internet radio show."
55:41;55:43;"- Seth Meyers, if you're listening,"
55:43;55:45;"I was also joking earlier"
55:45;55:48;"when I told you to go [bleep] yourself."
55:48;55:51;"- Episode 101 to 150 is called"
55:51;55:54;"""The Rise of Winter and the Fall of Seinfeld."""
55:54;55:57;"- People thought I was Winter at MSG."
55:57;55:59;"They're like, ""Yo, Winter."" - Really?"
55:59;56:01;"- Yeah, I'm like, ""Come on."""
56:01;56:04;"Anyway... [laughter]"
56:04;56:06;"You guys can be, like, cousins."
56:06;56:09;"Oh, I was about to brag."
56:09;56:12;"One time--and this is also--"
56:12;56:14;"you know what's funny about this too?"
56:14;56:17;"Is it's like, Richard Montanez reminds me of Jay-Z."
56:17;56:20;"I've spoken on the show about how Jay-Z does this thing"
56:20;56:22;"where he maintains this kind of, like,"
56:22;56:24;"you know, very mysterious, like,"
56:24;56:26;"is this guy tucked away, and then he'll do things"
56:26;56:29;"just to remind people, ""I've always got my ear to the ground."
56:29;56:31;"I know what's going on."""
56:31;56:33;"Heard a lot of stories like that."
56:33;56:35;"I'm not--I'm not doing mild things."
56:35;56:37;"I'm not--nothing crazy, but just, like, that people--"
56:37;56:39;"you know, 'cause people probably wonder with a guy like Jay-Z."
56:39;56:41;"I mean, for all we know, he's an incredibly wealthy guy."
56:41;56:43;"For all we know, he's, like, semi-retired."
56:43;56:45;"But then he'll, like, always let people know, like,"
56:45;56:47;"""Oh, no, I noticed what you said."
56:47;56:49;"I noticed what you're doing."
56:49;56:51;"Um, I'm up on stuff."""
56:51;56:53;"And there's something about Richard Montanez"
56:53;56:55;"where I was kind of like, ""All right, this guy doesn't give a f---"
56:55;56:57;"about TC."" He probably just thought--he was like,"
