Start Timestamp;End Timestamp;Transcript
00:00;00:08;"Time Crisis, back again. Jake and I reunite in Los Angeles and boy do we have a lot to cover."
00:08;00:14;"Finally, there's news on the Flame and Hot Cheetos movie, the story of Richard Montanez."
00:14;00:23;"All this, plus S.O.D. installation and the top hits of 1992, a very special year."
00:23;00:33;"This is Time Crisis with Ezra King. B-B-B-B-B-B-B-B-Sport One."
00:34;00:40;"They passed me by, all of those great romances"
00:40;00:47;"They were a threat to our belief, of my rightful chances"
00:47;00:55;"My picture clear, everything seemed so easy"
00:55;01:02;"And so I dealt to the blow, when a bus had to go"
01:02;01:06;"Now it's different, I want you to know"
01:06;01:12;"One of us is crying, one of us is lying"
01:12;01:17;"We were only there"
01:17;01:23;"Time Crisis back once again. A little bit stuffy. You think my voice sounds weird?"
01:23;01:27;"Post tour? I guess you're on tour, sort of."
01:27;01:32;"Yeah, well, it's funny, that's a question I get a lot, people are like, ""Oh is the tour over?"""
01:32;01:38;"Or like, ""Are you on tour?"" and it's like, ""Man, this is the show that never ends."""
01:38;01:41;"What is it? ""Welcome Back My Friend""?"
01:41;01:45;"Welcome back my friend, to the show that never ends"
01:45;01:48;"I should have said ""Welcome Back My Friend, to the show that never ends."""
01:48;01:50;"Wait, who is that?"
01:50;01:52;"ELO? No, no, no, ELP."
01:52;01:57;"Good call, yeah, definitely not ELO. That's like the big ELP hit."
01:57;02:01;"Along with ""Ooooh, what a lucky man"""
02:01;02:03;"Great song. Yeah, lucky man's song."
02:03;02:06;"Wee do do wee do do wee do do"
02:06;02:09;"That was a classic Q104.3 jam."
02:09;02:11;"Classic rock radio."
02:11;02:14;"Wait, did you listen to classic Q in Connecticut?"
02:14;02:17;"No, we didn't get that, we had our own Connecticut classic rock stations."
02:17;02:21;"I-95, Danbury's, classic rock radio, and then"
02:21;02:23;"Just like named after the highway?"
02:23;02:25;"No, because I-95 doesn't go through Danbury."
02:25;02:27;"But I-95 goes through Connecticut."
02:27;02:30;"Oh yeah, it goes along, they're like southern Connecticut."
02:30;02:32;"But I-84 goes through Danbury."
02:32;02:37;"Never quite got a handle on why Danbury's classic rock station was I-95."
02:37;02:40;"Was it because it's like W-H-X-I?"
02:40;02:41;"Something like that."
02:41;02:43;"95.7?"
02:43;02:48;"95.1. W-H-G-I, Danbury's classic rock."
02:48;02:50;"And then we had W-P-L-R out of New Haven."
02:50;02:52;"Oh, so you got two classic rock?"
02:52;02:53;"We had two, dude."
02:53;02:54;"That explains a lot."
02:54;02:57;"Jake's just getting slammed by two classic rock radio stations."
02:57;03:01;"Getting Eddie money on this station, getting Eddie money on the other station."
03:01;03:02;"R.I.P."
03:02;03:04;"R.I.P., man."
03:04;03:10;"Yeah, it's funny, because I only had one classic rock radio station, classic Q104.3."
03:10;03:13;"And looking back on it, it was fairly idiosyncratic."
03:13;03:18;"I felt like one of the songs they played the most was Jessica by the Allman Brothers, the instrumental."
03:18;03:19;"Yep."
03:19;03:22;"Great one."
03:22;03:23;"Played that a ton."
03:23;03:25;"Not that much Led Zeppelin."
03:25;03:26;"Really?"
03:26;03:28;"I think we've had this conversation before."
03:28;03:33;"They've thrown Billy Joel, where I have this feeling that a classic rock radio station in Florida"
03:33;03:36;"is not going to be dropping New York State of Mind ever."
03:36;03:37;"Right."
03:37;03:39;"That's some regional love."
03:39;03:42;"Who needs a house out in Hackensack?"
03:43;03:46;"Sergeant Noel here is walking the beach."
03:46;03:49;"At night he becomes a bartender."
03:49;03:53;"He works at Mr. Cacciatore's down on Sullivan Street."
03:53;03:56;"Across from the medical center."
03:56;04:01;"And he's trading in his Chevy for a Cadillac."
04:01;04:03;"Billy's super regional."
04:03;04:05;"Yeah, I feel like it's a classic."
04:05;04:07;"It's just like, oh, so yeah, it's the tour over, you done."
04:07;04:08;"Right."
04:08;04:11;"It'll just be like, this leg of the North American tour has ended."
04:11;04:16;"But, you know, the Father of the Bride cycle continues well into 2020."
04:16;04:18;"Oh, just announced some 2020 dates."
04:18;04:19;"Saw that."
04:19;04:20;"Not that long ago."
04:20;04:23;"Some secondary and tertiary markets."
04:23;04:25;"Looks great, man."
04:25;04:31;"I'm pretty psyched for your kind of inner Pacific Northwest mountain region tour starting in Bend."
04:31;04:33;"Oh, yeah, you got to come tailgate those shows, man."
04:33;04:34;"You're starting in Bend."
04:34;04:36;"Hop on the bus."
04:36;04:37;"Where else are you going?"
04:37;04:38;"I think, let me look it up."
04:38;04:39;"Missoula."
04:39;04:41;"And then Calgary."
04:41;04:42;"Yep."
04:42;04:44;"Great part of the country."
04:44;04:49;"I remember being on some tour that I feel like started in Calgary and went down into,"
04:49;04:51;"maybe ended up in Denver or something."
04:51;04:55;"And I just remember being like, wow, it's the longest I've ever spent in mountain time."
04:55;04:56;"Great time zone."
04:56;04:58;"Spent a lot of time in Eastern time."
04:58;04:59;"Sure."
04:59;05:00;"A lot of Pacific time."
05:00;05:01;"It's also the only one with a cool name."
05:01;05:02;"Yeah."
05:02;05:05;"It's interesting how it's like, there's no rhyme or reason."
05:05;05:09;"I guess in a real dystopian universe, they would have been called zone one, zone two,"
05:09;05:10;"zone three, and zone four."
05:10;05:12;"That's like in the Hunger Games."
05:12;05:13;"Totally."
05:13;05:16;"So Eastern time, that's where we're from."
05:16;05:17;"Yeah."
05:17;05:18;"But it's not Atlantic time."
05:18;05:21;"That would be kind of, have a little more flavor."
05:21;05:24;"On the two sides of the country, you have Pacific time, which is kind of cool."
05:24;05:25;"And then you have Eastern time."
05:25;05:26;"Hmm."
05:26;05:28;"Should have been Atlantic time."
05:28;05:29;"I would just rethought that one."
05:29;05:31;"And then you have Central time."
05:31;05:32;"That's pretty bland."
05:32;05:33;"That's a real bland."
05:33;05:35;"Well, imagine if that was called Heartland time."
05:35;05:36;"Heart time."
05:36;05:37;"Heartbeat."
05:37;05:39;"Yeah, that one, they don't even use time."
05:39;05:41;"That one's just called heartbeat."
05:41;05:42;"That's kind of like a radio station."
05:42;05:43;"Yeah."
05:43;05:45;"The heartbeat of America."
05:45;05:48;"It is 1 PM in the heartbeat of America."
05:48;05:50;"Yeah, Eastern time is the big dog."
05:50;05:51;"Big dog, heartbeat."
05:51;05:53;"Mountain time can stay, because that's a good one."
05:53;05:54;"Yeah."
05:54;05:56;"And then golden time."
05:56;06:01;"Yeah, but mountain time is definitely the most interesting of the American time zones."
06:01;06:04;"And I'm sure somebody's going to be like, well, what about the Hawaii time zone?"
06:04;06:06;"All right, I'm talking about continental US."
06:06;06:07;"Lower 48."
06:07;06:09;"You're talking lower 48."
06:09;06:11;"That's a tight name for something."
06:11;06:12;"Lower 48."
06:12;06:15;"I was thinking mountain time would be a good song title."
06:15;06:16;"For Mountain Bruce."
06:16;06:18;"Absolutely."
06:18;06:22;"I wonder what the-- I guess, is Denver the biggest city in mountain time?"
06:22;06:23;"Might be."
06:23;06:24;"Phoenix."
06:24;06:25;"Is Phoenix mountain time?"
06:25;06:27;"I think it is."
06:27;06:28;"Yeah."
06:28;06:30;"Arizona native is-- well, yeah, because it's not the same as--"
06:30;06:32;"Well, yeah, because it's not the same as LA, right?"
06:32;06:33;"Oh, yeah, it's got to be mountain time."
06:33;06:35;"Yeah, Phoenix is the biggest city in mountain time."
06:35;06:37;"Phoenix, very flat city."
06:37;06:39;"Great number crunching over there."
06:39;06:40;"Thank you, Seinfeld."
06:40;06:42;"Yeah, I just looked it up for you guys."
06:42;06:46;"Yeah, that's interesting to think somebody down in Phoenix, a notoriously flat city,"
06:46;06:49;"are they identifying with mountain time?"
06:49;06:50;"Right."
06:50;06:51;"But I feel like they're surrounded by mountains."
06:51;06:53;"Yeah, there are mountains in Arizona."
06:53;06:54;"So what's that leg though?"
06:54;06:55;"You're doing Bend?"
06:55;06:57;"Oh, you're doing Boise, I think."
06:57;06:58;"Oh, yeah, I haven't been there in a while."
06:58;07:00;"What's the venue in Boise, do you know?"
07:00;07:04;"The only two venues that when I think of Boise, I think of Neurolux."
07:04;07:05;"Have you played there?"
07:05;07:06;"Oh, yeah, definitely back in the day."
07:06;07:07;"I played there with Dirty Projectors too."
07:07;07:08;"Oh, yeah, I was there."
07:08;07:09;"Hold on."
07:09;07:12;"I got to go to vampireweekend.com to--"
07:12;07:13;"Like a seated auditorium in Boise."
07:13;07:16;"Yeah, my feeling was-- you know, we talked about what we could do this year."
07:16;07:20;"And it's tough because there's definitely some big cities where the tickets went really fast."
07:20;07:25;"It just felt like, you know what, we'll be back sooner rather than later, next album."
07:25;07:28;"But, like, it seemed cooler just to hit new spots."
07:28;07:30;"Let's see."
07:30;07:33;"Boise, we're playing the Ford Idaho Center Amphitheater."
07:33;07:36;"Missoula, Montana, Kettle House Amphitheater."
07:36;07:39;"I've heard very good things about the Kettle House Amphitheater."
07:39;07:43;"So these are outdoor seated, kind of like a Libby Bowl."
07:43;07:44;"Yeah."
07:44;07:46;"Oh, these ones are next summer."
07:46;07:48;"But that's the way of now."
07:48;07:51;"You just put all your tickets up at the same time, let people know."
07:51;07:54;"So people are buying tickets for a show that's like 10 months from now?"
07:54;07:57;"Yeah, I guess that's kind of the vibe now is like the--"
07:57;08:00;"because even this year, I think it was smart."
08:00;08:02;"Like our touring people were just like-- they planned the whole year out,"
08:02;08:04;"and they were like, let's just put all the tickets on sale together."
08:04;08:06;"And, you know, you could probably get into one school and be like,"
08:06;08:09;"yeah, isn't it more exciting if you wait a little bit to announce the next--"
08:09;08:11;"and they're just like, just put them all up at the same time."
08:11;08:13;"You know, they'll do their thing at different rates."
08:13;08:18;"Because when I think about it, like, we put up the tickets kind of as soon as we were back."
08:18;08:20;"So, you know, some of the shows were like four months away."
08:20;08:24;"And then shows like the Garden or the Hollywood Bowl were like seven or eight months away."
08:24;08:28;"That way you let the hardcore fans have like-- they can get the tickets really quick."
08:28;08:31;"You know, actually there's a big tour for next summer that was just announced."
08:31;08:33;"Are you aware of this?"
08:33;08:36;"Give me a hint."
08:36;08:41;"Um, three bands more or less associated with pop punk."
08:41;08:43;"Is it Weezer, Green Day?"
08:43;08:44;"Yeah, who else?"
08:44;08:45;"Blink?"
08:45;08:47;"No."
08:47;08:49;"I wonder how Blink feels about this, actually."
08:49;08:51;"They just started Lil Wayne."
08:51;08:56;"But another-- Weezer, Green Day, and another like huge--"
08:56;08:59;"Is the third band as big as those bands?"
08:59;09:02;"The third band, I bet you don't know as much about."
09:02;09:05;"They're bigger than Weezer, Green Day, hard to say."
09:05;09:06;"I don't think you're gonna guess."
09:06;09:07;"I'm stumped."
09:07;09:08;"It's Fall Out Boy."
09:08;09:09;"Oh, yeah, that's after my time."
09:09;09:11;"I've been trying to get Pete Wince on the show for a minute."
09:11;09:12;"That's right."
09:12;09:14;"He said he was down. I'm gonna reach out to him again."
09:14;09:17;"It's a stadium tour going big."
09:17;09:18;"The Hella Mega Tour."
09:18;09:19;"It's called the Hella Mega Tour."
09:19;09:21;"Good title."
09:21;09:24;"So that's gonna go Fall Out Boy, Weezer, Green Day."
09:24;09:25;"That's the order of events."
09:25;09:27;"Nah."
09:27;09:29;"Weezer first to three."
09:29;09:30;"Well, actually, there's a--"
09:30;09:32;"Not if I'm booking it."
09:32;09:34;"There's a Scott punk band called The Interrupters"
09:34;09:37;"who I've been following for a minute as a Scott punk enthusiast."
09:37;09:38;"That's cool."
09:38;09:39;"They're technically first to four,"
09:39;09:43;"but the way it's spelled is like Green Day, Fall Out Boy, Weezer,"
09:43;09:45;"with special guest The Interrupters."
09:45;09:46;"So, you know, they're kind of--"
09:46;09:48;"They're kicking things off, but that's different."
09:48;09:53;"So of the big three, Weezer is the lowest ranked."
09:53;09:57;"I don't know one Fall Out Boy song, but that's just my--"
09:57;09:58;"You don't know--"
09:58;10:00;"♪ We're going down, down, and then around ♪"
10:00;10:02;"♪ Sugar me, coming down swinging ♪"
10:02;10:03;"Put it on."
10:03;10:05;"♪ I'll be your number one with a bullet ♪"
10:05;10:06;"I don't know it, man."
10:06;10:08;"We've listened to them on this show, too."
10:08;10:11;"Like, they basically started as like a very--"
10:11;10:13;"When was their heyday? Like early 2000s?"
10:13;10:15;"I think their heyday was early 2000s,"
10:15;10:18;"and then they kind of broke up or took a beat"
10:18;10:21;"and then came back with like full-on,"
10:21;10:24;"like pumped-up stadium rock pop kind of stuff."
10:24;10:27;"This is like their early beloved song."
10:27;10:31;"♪"
10:31;10:33;"Oh, it's heavy."
10:33;10:34;"Well, yeah."
10:34;10:35;"Oh, no."
10:35;10:37;"But then it's pop punk kind of chord."
10:37;10:38;"Yeah."
10:38;10:53;"♪"
10:53;10:57;"♪ Am I more than you bargained for yet? ♪"
10:57;11:01;"♪ I've been dying to tell you anything ♪"
11:01;11:02;"♪ You already hear ♪"
11:02;11:05;"♪ 'Cause that's just who I am this week ♪"
11:05;11:10;"♪ I lie in the grass next to the mausoleum ♪"
11:10;11:12;"They've got good lyrics."
11:12;11:14;"♪ Lying in the grass next to the mausoleum ♪"
11:14;11:18;"This could totally be a GBV song in a different universe."
11:18;11:22;"♪ ...and break our name ♪"
11:22;11:28;"♪ We're always sleeping in the sleeping for the road team ♪"
11:28;11:32;"♪ We're going down, down in the river ♪"
11:32;11:33;"Wait, what were the lyrics?"
11:33;11:36;"Wait, Seinfeld, look up the lyrics to ""Sugar, We're Going Down."""
11:36;11:39;"It starts with, ""Am I more than you bargained for yet?"
11:39;11:42;"♪ I've been dying to tell you anything you want to hear ♪"
11:42;11:44;"♪ 'Cause that's just who I am this week ♪"
11:44;11:46;"♪ I lie in the grass next to the mausoleum ♪"
11:46;11:47;"You like that?"
11:47;11:48;"Yeah."
11:48;11:52;"♪ Lying in the grass next to the mausoleum ♪"
11:52;11:54;"I think Pete Wentz writes the lyrics."
11:54;11:56;"He's the bassist, not the singer."
11:56;11:57;"Oh, wow, okay."
11:57;11:59;"Kind of like a Who situation."
11:59;12:02;"He's the Pete Townsend/Nwhistle."
12:02;12:05;"They were known for having very long song titles and stuff."
12:05;12:06;"Oh, wow."
12:06;12:08;"They paved the way for Panic! at the Disco,"
12:08;12:10;"who you're probably a little more familiar with."
12:10;12:11;"Actually, I'm not."
12:11;12:13;"Well, but you know that one song."
12:13;12:15;"I can actually hear a little GBV in there for sure,"
12:15;12:17;"and certainly some Weezer."
12:17;12:19;"Oh, man, we got to get Wentz on the show and just be like,"
12:19;12:20;"""Dude, GBV."""
12:20;12:21;"GBV, Weezer."
12:21;12:23;"Oh, sure, Weezer."
12:23;12:25;"But there's no way that Pete Wentz doesn't know"
12:25;12:26;"who Guy to Buy Voices is."
12:26;12:27;"Sure."
12:27;12:29;"To what extent he's a fan, I have no idea."
12:29;12:30;"Right."
12:30;12:31;"He knows his [bleep]"
12:31;12:32;"He's up on stuff."
12:32;12:34;"It might be just like a micro-generation thing."
12:34;12:36;"Yeah."
12:36;12:38;"Then they came back kind of like turbo-charged,"
12:38;12:41;"like with just--"
12:41;12:42;"What year is this?"
12:42;12:43;"This is like a couple years ago."
12:43;12:45;"This is like their big comeback."
12:45;12:47;"♪ Some legends are told ♪"
12:47;12:49;"♪ Some turn to dust or to gold ♪"
12:49;12:53;"♪ But you will remember me ♪"
12:53;12:55;"♪ Remember me for centuries ♪"
12:55;12:57;"So the singer is just like the singer."
12:57;12:59;"Yeah, his name is Patrick Stump."
12:59;13:01;"Cool name."
13:01;13:02;"Pat Stump."
13:02;13:04;"Yeah, why is he not Pat Stump?"
13:04;13:07;"Yeah, 'cause Patrick Stump went solo for a minute."
13:07;13:12;"He went solo, and then they reunited."
13:12;13:15;"I saw a band last night"
13:15;13:17;"where the singer is only the singer."
13:17;13:18;"What band?"
13:18;13:19;"The Zombies."
13:19;13:20;"Oh."
13:20;13:21;"Yeah, what's the story with the Zombies?"
13:21;13:23;"I went to the Greek theater"
13:23;13:25;"with friend of the show Daniel Ralston."
13:25;13:26;"Oh, right, right."
13:26;13:30;"And the Zombies played the Odyssey and Oracle in sequence."
13:30;13:31;"Whoa."
13:31;13:32;"It was so tight."
13:32;13:36;"But Daniel was telling me that they broke up"
13:36;13:39;"right after that record was released in '68 or '69."
13:39;13:40;"Yeah."
13:40;13:42;"And then--what's his name?"
13:42;13:45;"Colin Blundstone, the singer?"
13:45;13:46;"Yeah, and then there's Rod Argent."
13:46;13:48;"Yeah, Rod Argent was the keyboard player"
13:48;13:50;"who I think wrote a lot of the material."
13:50;13:52;"And then he started a band called Argent."
13:52;13:53;"Right."
13:53;13:54;"♪ Hold your head up ♪"
13:54;13:57;"But Colin apparently was just the singer,"
13:57;13:58;"and then when the band broke up,"
13:58;14:00;"worked as an accountant for five years."
14:00;14:01;"Whoa."
14:01;14:02;"Into the mid-'70s."
14:02;14:04;"He was just out."
14:04;14:06;"But these guys were all in their mid-'70s."
14:06;14:10;"It was Rod Argent, Colin, this guy Chris White,"
14:10;14:12;"I think his name is, who's the original bass player,"
14:12;14:14;"who looked like Donald Rumsfeld."
14:14;14:15;"Yeah."
14:15;14:18;"Just like these guys in their '70s."
14:18;14:19;"Yeah."
14:19;14:21;"And he's wearing a suit that was a little too big for him."
14:21;14:22;"Yeah."
14:22;14:23;"It was a cool vibe."
14:23;14:27;"And then they had another five or six people on stage"
14:27;14:29;"just doing it note for note."
14:29;14:30;"Right, you need a lot of people on stage"
14:30;14:31;"to perform that whole album."
14:31;14:33;"It was so tight."
14:33;14:36;"And then Brian Wilson played, and that was rough."
14:36;14:37;"Rough stuff?"
14:37;14:38;"Yeah."
14:38;14:39;"Rough stuff, folks?"
14:39;14:40;"Yeah."
14:40;14:41;"♪ Rough stuff ♪"
14:41;14:42;"Wait, 'cause there was a double bill,"
14:42;14:44;"or he was a surprise guest?"
14:44;14:45;"No, double bill."
14:45;14:46;"Zombies opened."
14:46;14:47;"Oh, yeah."
14:47;14:50;"They opened for Arcade Fire at the Greek last year, I think."
14:50;14:52;"I think Daniel went to that, too, 'cause he wrote a story."
14:52;14:54;"Have you heard that story about the fake zombies?"
14:54;14:55;"Oh, yeah, yeah, no, no."
14:55;14:56;"I've heard about it from him."
14:56;15:00;"Yeah, so he knows the upper management of zombies."
15:00;15:02;"What was the Brian Wilson set list like?"
15:02;15:03;"Okay, here's the cool thing about it."
15:03;15:06;"It was all stuff off of Surf's Up and Friends."
15:06;15:08;"Did he play the song Surf's Up?"
15:08;15:09;"Yes, they played Surf's Up."
15:09;15:11;"I would say they played Surf's Up."
15:11;15:14;"I mean, Brian was very checked out."
15:14;15:18;"It was truly like, Daniel's girlfriend was basically like,"
15:18;15:20;"""This seems like borderline elder abuse."""
15:20;15:23;"Like, he was just kind of sitting there in the middle of the stage,"
15:23;15:26;"and then he would just be kind of like, padding his hair"
15:26;15:29;"to make sure it was still parted correctly."
15:29;15:33;"It was super intense and kind of dark."
15:33;15:36;"♪ Hand in hand, sun grown to long-blown ♪"
15:36;15:39;"♪ To a handsome man in the time ♪"
15:39;15:40;"People don't know the album Surf's Up."
15:40;15:41;"Oh, yeah, this is--"
15:41;15:45;"It is kind of dark, and the album cover is so intense and weird."
15:45;15:47;"Yeah, that weird Don Quixote-like--"
15:47;15:48;"Yeah."
15:48;15:53;"♪ I've been in the bedroom all night ♪"
15:53;15:58;"Yeah, I mean, Brian would sing like, a few phrases every few songs,"
15:58;16:02;"and then there was a guy like in his 40s that was like,"
16:02;16:05;"holding a tambourine and standing and doing all of these parts."
16:05;16:06;"Yeah."
16:06;16:09;"And then Brian was just like, sitting there,"
16:09;16:13;"like, kind of staring up into the sky for most of it."
16:13;16:16;"It was weird, man."
16:16;16:19;"♪ Humble, they're overtaking me ♪"
16:19;16:22;"♪ Dim shadow, they're awaking me ♪"
16:22;16:27;"♪ To a song that's off at the door ♪"
16:27;16:30;"It was an amazing set list, but it was a weird vibe."
16:30;16:33;"Did I ever talk on the show about when I used to go to that diner"
16:33;16:35;"and see Brian Wilson all the time?"
16:35;16:37;"No, you told me off mic, but I would love to--"
16:37;16:41;"I don't think I've talked about it, but in early days"
16:41;16:44;"when I'd come stay in L.A. for like a week or two,"
16:44;16:48;"I would stay up at a neighborhood some people call Beverly Glen,"
16:48;16:52;"which is like, you know, kind of west side L.A. up in the hills."
16:52;16:55;"And that part of up in the hills, it's like so high up."
16:55;16:59;"When you're up by Mulholland, you really feel like you're the top of a mountain."
16:59;17:02;"I think I've told you how I'd go up to the door of the house"
17:02;17:05;"and there'd be like a full-on giant buck,"
17:05;17:08;"and I'd hear ""bound down the driveway,"" and I'd just be like,"
17:08;17:11;"""Oh my God, if that thing hit a person, they'd die instantly."""
17:11;17:13;"You know, like a 1,200-pound animal."
17:13;17:15;"But anyway, so you're up there."
17:15;17:19;"You're right up at kind of the peak of the mountain up by Mulholland."
17:19;17:20;"Yeah."
17:20;17:23;"And up there, it's almost entirely residential,"
17:23;17:26;"except there's this one little shopping area"
17:26;17:29;"that I think is called the Beverly Glen Shops or something."
17:29;17:33;"It's one little mini mall up in the hills,"
17:33;17:36;"because otherwise for everything else, you have to go down the hill"
17:36;17:39;"either to the L.A. side or to the valley side."
17:39;17:45;"So up there, there's this one kind of East Coast-ish, Jewish-ish deli/diner"
17:45;17:47;"called the Beverly Glen Deli."
17:47;17:52;"And it's a funny place where I'd be up there kind of by myself,"
17:52;17:56;"and so I'd be like--hilarious, like jump in the car for three minutes,"
17:56;17:59;"get to this place, and if I wanted to have breakfast or a cup of coffee"
17:59;18:02;"or something, I'd go to this spot."
18:02;18:06;"And, you know, it has the charm a little bit of kind of like a low-key"
18:06;18:11;"East Coast deli, but it's up in the hills surrounded by not only rich people,"
18:11;18:14;"but right by there, there's some of these gated communities."
18:14;18:16;"That's always a funny vibe when you're in a rich neighborhood"
18:16;18:19;"and then you see the gated community, and you're just like, okay."
18:19;18:20;"Layer upon layer."
18:20;18:24;"Yeah, and there's this one gated community up there that's like--"
18:24;18:26;"I've been in there once or twice."
18:26;18:29;"I'm pretty sure DJ Khaled lives in there, Rod Stewart."
18:29;18:31;"It's just like, you know, true."
18:31;18:32;"Heavy hitters."
18:33;18:37;"I remember just being up there, and I'd be eating solo a lot, you know,"
18:37;18:39;"because it's that type of thing."
18:39;18:43;"It's not like you're down in Silver Lake, just hit a bunch of people,"
18:43;18:45;"like, oh, you want to come through, you know?"
18:45;18:49;"You're up literally in Asgard, you know what I mean?"
18:49;18:52;"That's an MCU reference."
18:52;18:53;"I didn't actually get it."
18:53;18:55;"I just kind of played along to keep the story going."
18:55;18:56;"It's a Thor thing."
18:57;18:58;"Missed it."
18:58;19:00;"So anyway, you're basically up in Asgard."
19:00;19:01;"People can't just jump--"
19:01;19:02;"Oh, yeah."
19:02;19:06;"--into the portal, you know, very easily to come link up with you."
19:06;19:08;"So I'd be rolling solo to the deli a lot."
19:08;19:10;"You know, I saw all sorts of funny people, you know,"
19:10;19:15;"people like really hardcore music industry legends that the listeners wouldn't know"
19:15;19:18;"who they are, you know, like some old-school lawyer that I've heard about,"
19:18;19:20;"you know, and these are just like they're on the phone,"
19:20;19:23;"you know, like a bagel, like papers all spread out."
19:23;19:27;"So you'd recognize like a legendary music industry lawyer,"
19:27;19:29;"like from documentaries?"
19:29;19:30;"A little bit of that."
19:30;19:35;"And, you know, just being in the game long enough that people like point out"
19:35;19:37;"these types to me."
19:37;19:40;"One time I remember Jon Voight eating solo."
19:40;19:41;"Booth or counter?"
19:41;19:42;"Booth."
19:42;19:44;"He was reading some like right-wing book."
19:44;19:46;"It was like very on the nose."
19:46;19:48;"But anyway, the real part of the story is that."
19:48;19:51;"So I was, you know, I might be eating breakfast there three or four times a week,"
19:51;19:53;"you know, over the course of a week."
19:53;19:55;"So you were really like regular there for a while."
19:55;19:56;"Yeah, a week here or there."
19:56;19:57;"And these people are super regulars."
19:57;19:58;"Right."
