Start Timestamp;End Timestamp;Transcript
24:47;24:54;"So the idea that 30 years later, the Grateful Dead would team up with a company like Nike,"
24:54;25:01;"which as we've previously discussed, has a kind of crunchy Oregon heritage, it's not psychotic."
25:01;25:08;"It's not like probably in the '80s when they first started using classic rock in advertisements."
25:08;25:12;"Actually, I just saw a funny one speaking of classic rock in advertisements."
25:12;25:20;"Basically, a lot of people talk about the '80s as being the era of people who grew up in the rock and roll era"
25:20;25:28;"finally becoming of age and suddenly being the new captains of industry and the new people working at advertising firms."
25:28;25:33;"And there's a few notable ones like Bob Dylan and the Beatles getting used in ads for the first time,"
25:33;25:36;"which probably really harshed out some of the older hippies."
25:36;25:43;"But one interesting one is there's a Honda scooter ad from the mid '80s starring Lou Reed."
25:43;25:44;"Oh, wow."
25:44;25:48;"Apparently, he felt a little bit embarrassed by it, but he was also kind of defensive."
25:48;25:51;"And later on, people would ask him about his Honda ad."
25:51;25:53;"And he'd just be like, ""Well, whatever, man."
25:53;25:58;"Some of those advertising guys, they show you more respect than music industry guys."""
25:58;25:59;"So he clearly had mixed feelings about it."
25:59;26:03;"But basically, they're playing the instrumental of ""Walk on the Wild Side"""
26:03;26:07;"and just kind of like shots of like busy New York City in the '80s."
26:07;26:11;"And then it kind of just like cuts to Lou Reed sitting on his Honda scooter."
26:11;26:12;"I forget what he says."
26:12;26:17;"Maybe he says something like, ""Hey, you don't always have to walk on the wild side."""
26:17;26:27;"He's like some kind of goofy, like something kind of like hilariously corny for a song that was like kind of like a huge counterculture hit."
26:27;26:40;"But anyway, the idea that the Grateful Dead in 2020 doing a collab with Nike is somehow breaking a sacred contract of like the spirit of independent music and free-thinking rock and roll, that's crazy."
26:40;26:43;"That ship sailed a long, long time ago."
26:43;26:49;"And my understanding is that Nike actually has a pretty decent record these days when it comes to like sweatshop labor."
26:49;26:51;"But so anyway, I think people are being a little bit harsh."
26:51;27:01;"To me, part of the reason that the shoe doesn't really work is because the Dead have already successfully branded themselves so well in the merchandise space."
27:01;27:07;"You know, like with Ben and Jerry's, there's a real novelty to being like an ice cream brand is now doing a shoe."
27:07;27:10;"It's so funny and random."
27:10;27:18;"But Grateful Dead, official and unofficial, they've been making iconic pieces of clothing for decades."
27:18;27:21;"So a Grateful Dead shoe is not actually like that exciting."
27:21;27:25;"And then they're not really what I associate the Grateful Dead with."
27:25;27:28;"Like, I understand that the shoe is inspired by the bear."
27:28;27:36;"But there's something to me when I think about the classic Grateful Dead bear, the dancing bear or the marching bears, they call it."
27:36;27:39;"I love when you see it on like an old Grateful Dead shirt."
27:39;27:41;"And it's like it's kind of got a pop art feel."
27:41;27:43;"It's like real flat and comic booky."
27:43;27:49;"There's something about being like, well, now you have these fuzzy shoes that represent the bear."
27:49;27:52;"I'm like, but the bear doesn't live outside of that 2D world, man."
27:52;27:59;"It's kind of like an uncanny valley thing where it's like, I don't want to see like the fleecy texture of the bear's fur."
27:59;28:00;"You know what I mean?"
28:00;28:02;"Like, that's just like off to me."
28:02;28:05;"And then it kind of feels like more of like a furry thing."
28:05;28:06;"You know about the furry lifestyle?"
28:06;28:07;"Wait, what is that again?"
28:07;28:09;"You know, furries?"
28:11;28:13;"I'm blanking and I've heard the term."
28:13;28:15;"What is it? Is there something sexual?"
28:15;28:18;"I don't want to speak out of turn because I don't want to offend any."
28:18;28:20;"We might have some listeners who are members of the community."
28:20;28:25;"I understood that there often is a sexual element, but maybe it's more complicated than that."
28:25;28:39;"But I think on the most basic level, it's people who identify with furry animals and who dress up in suits to reflect their identity, which could be like a big furry bear or any kind of animal."
28:39;28:52;"And yet when I first heard about it, maybe like a decade ago, I feel like I read about it in the context of a sexual thing, like people who find that to be a turn on or people who want to have sex wearing the furry outfits."
28:52;28:56;"But I think like with any culture, there's probably a lot of deviations."
28:56;29:04;"Actually, Nick, while you're on number crunching duty, can you give us like a good community approved definition of the furry lifestyle?"
29:04;29:10;"The furry fandom is a subculture interested in anthropomorphic animal characters with human personalities and characteristics."
29:10;29:23;"That really doesn't necessarily lend to something sexual, but I think that it's sort of like living through this sort of anthropomorphic character."
29:23;29:26;"There certainly is a sexual element to it."
29:26;29:33;"All right, so that's a good definition. And I imagine, yeah, perhaps sex is a part of it, just like sex is a fact of life."
29:33;29:38;"But it sounds like I could imagine maybe furries don't want to be thought of as like, oh, it's about sex."
29:38;29:44;"They're like, no, we identify. We just enjoy the anthropomorphic animal lifestyle."
29:44;29:47;"And for some people, there could be a sexual element, for others not."
29:47;29:57;"So there is something to me. Yeah, it's kind of like the difference between enjoying like cute animals in a 2D space versus being like, I want to feel that fur."
29:57;30:05;"I want to see that life size animal. And putting on these Grateful Dead bear shoes, it's so different than wearing a T-shirt with a 2D bear."
30:05;30:07;"It's not how I think of the Grateful Dead bear."
30:07;30:12;"I would respect these shoes more if they were kind of like if they were specifically for..."
30:12;30:17;"Because I'm sure there must be people who are deadheads and furries and who are members of both communities."
30:17;30:24;"If you present it to me that way, I'd be like, oh, well, that makes a lot of sense because there's the anthropomorphic animal element."
30:24;30:32;"Just presenting it as a Grateful Dead shoe, it somehow doesn't capture the world or the aesthetic of the dead to me."
30:32;30:36;"Fully agree. I feel like this came up when we talked about the Chunky Dunkies."
30:36;30:39;"I mean, the shoes should be red, white and blue. End of story."
30:39;30:40;"Yeah."
30:40;30:43;"The bears are the lamest part of the dead iconography."
30:43;30:48;"I agree with you that the early versions of the bears that are just flat and 2D are great."
30:48;30:58;"Even when you see the bears on T-shirts from the last 20 years, they'll add detail and shading and dimensionality."
30:58;31:00;"It just looks bad."
31:00;31:05;"It's not unique to the dead. You see that with other logos being updated."
31:05;31:15;"And then they take the classic flat, simple version and they add drop shadows or something stupid and it's just like, come out."
31:15;31:20;"Baby, here I am and I'm made up of all the sweet."
31:20;31:25;"I can't give you what you want, but you got to come home with me."
31:25;31:30;"And I got a whole lot of good old lovin' and I got me drummin' and strollin'."
31:30;31:35;"When I get up, you're goin' head on and you got to come back for more."
31:35;31:40;"Boy, those things will come out of dust. Ain't nothin' but dust, no, no."
31:40;31:45;"Tell your thang that me like you can't hold it, mama. I'm sure all the hell now, yes I am."
31:45;31:54;"I don't know if I turned this to the thread, but hearing you talk about this classic updating where sometimes a great logo becomes more 3D or something."
31:54;32:03;"It made me think about something I had saved in my camera roll, which I saw on Twitter, which is the kind of weird saga of the Jolly Green Giant."
32:03;32:04;"Oh, yeah."
32:04;32:13;"From 1928 to 2014. And he kind of ended up in a pretty good place. He kind of looks a little manga or maybe like a 90s X-Men comic."
32:13;32:24;"But he really had quite a journey because the Jolly Green Giant, if you look back to 1928 when he started, he kind of looks like a Caucasian Neanderthal."
32:24;32:25;"Right."
32:25;32:34;"He's got kind of a Flintstones like fur singlet. You know, he looks like a prehistoric Caucasian man. His hair is kind of messy."
32:34;32:43;"I don't know if he really looks like a giant, but yeah, maybe you could also imagine maybe a depiction of the Goliath from the Bible looking like this guy."
32:43;32:48;"And then after that, they turned him all green. And then he kind of got a little more like statuesque."
32:48;32:49;"Mm-hmm."
32:49;33:00;"He started holding corn in 1945. He was like this giant green man and he seemed to have a little modern girlfriend in one arm."
33:00;33:04;"This giant green colossus is holding a giant corn."
33:04;33:11;"And then in his left hand, he's holding the hand of a smaller woman whose head probably goes up to like his hips."
33:11;33:20;"That's kind of seems like some kind of weird sublimated sexual thing. In 1970, he became all funky looking and he's kind of cool."
33:20;33:25;"He kind of looks like a character from the Harry Nilsson animated film, The Point."
33:25;33:26;"Totally."
33:26;33:34;"He almost looks like Shel Silverstein drew him or something. And then he kind of got back to being a statuesque kind of Greek God type dude."
33:34;33:43;"For some reason in 1980, he started wearing a red scarf. And now in 2014, he's kind of back to being just a big green giant."
33:43;33:47;"But yeah, it's really like quite a journey. And it's kind of surprising."
33:47;33:51;"Like I imagine with some of these logos, they do need to change him."
33:51;33:55;"It's kind of like Mr. Clean because, you know, it's not just like the MGM lion."
33:55;34:02;"These characters like a Mr. Clean or a Jolly Green Giant, I imagine they were created."
34:02;34:10;"You know, like with some Austrian psychoanalysts, you know, who fled the Nazis and came to the US."
34:10;34:17;"And we're probably like saying like in your sexist society, you have the unfulfilled needs of the modern American housewife."
34:17;34:23;"You want to present your product as being a kind of stand in lover, someone who is there."
34:23;34:32;"So, you know, maybe these characters, they have to change them because they have to kind of reflect like the standard of like sexiness of their time."
34:32;34:40;"Because like Mr. Clean, they've really gone out of their way to be like Mr. Clean is a sex symbol and he's here to help you."
34:40;34:45;"And he is more sexually potent and better at cleaning than your husband."
34:45;34:50;"Mr. Clean has kind of become computer animated in this kind of weird uncanny valley way."
34:50;34:54;"I feel like there were straight up like Mr. Clean commercials."
34:54;35:04;"I don't know if you guys can picture any, but where straight up the implication is that Mr. Clean violated the sanctity of a couple's marriage."
35:04;35:12;"Like, doesn't that sound familiar? That there's like Mr. Clean kind of waltzes in and then there's like the kind of like good for nothing husband who is ignoring his wife."
35:12;35:17;"And Mr. Clean comes in and kind of like gives her like this amazing day and she lets her hair down."
35:17;35:18;"Does that sound familiar?"
35:18;35:20;"I can't say that it does."
35:20;35:32;"I guess in the case of the Jolly Green Giant or Mr. Clean, these corporations who are trying to sell a product, they need to update him a lot to appeal to the people of the era."
35:32;35:42;"Because you're not going to sell any frozen vegetables or cleaning product if the men and women of America don't want to have sex with your mascot."
35:42;35:46;"But in the case of the Grateful Dead Bear, it's not really a sexual thing."
35:46;35:54;"And also they have, like you said, to you, the bear is the lamest, but they have so many classic characters and logos and stuff."
35:54;36:03;"I think what would have been cool and what the Deadheads might have appreciated would be that rather than go for the lowest hanging fruit of the Grateful Dead universe, which is the bear,"
36:03;36:12;"and then kind of turn it into this like strange 3D real life bear thing, they should have picked a deep cut."
36:12;36:21;"One character that I've always felt like is really undervalued in the Dead community, the violinist from the cover of Blues for Allah."
36:21;36:23;"Oh, like he's a skeleton, right?"
36:23;36:31;"He's a skeleton, but he's not Bertha. This guy, he kind of looks like the Crypt Keeper from Tales from the Crypt."
36:31;36:35;"And he's got these red sunglasses and he's got like a shock of white hair."
36:35;36:44;"Kind of disgusting, because when I picture like a skeleton that has hair, I kind of picture the Crypt Keeper, which is like, it's like not fully decomposed yet."
36:44;36:47;"So it's got more of a zombie vibe when a skeleton has hair."
36:47;36:57;"But he's wearing these like interesting red robes and he's playing violin, which is an instrument you don't hear too much of in the music of the Grateful Dead."
36:57;37:04;"So I just felt like that's kind of like an interesting dude. If he kind of popped up and Nike was randomly like,"
37:04;37:13;"this entire line of shoes is dedicated to the Blues for Allah violinist, at the very least, Deadheads would have to be like, okay, interesting."
37:13;37:23;"Maybe they'd be like, we represent his violin in the sock liner, where you see kind of like a bow, you know, like they could get really deep into that."
37:23;37:24;"That might have been a little more interesting."
37:24;37:27;"The underside of the sock liner."
37:27;37:29;"The underside of the sock liner."
37:29;37:36;"I'm looking again, for the first time in a long time at the Blues for Allah cover. It's definitely the most like metal cover they ever did."
37:36;37:39;"Like that, it almost could be like an Iron Maiden cover."
37:39;37:46;"Totally. I mean, it's ahead of its time in a way. It's like Eddie, that's the Iron Maiden guy. This is like the original Eddie."
37:46;37:57;"Yeah, it's 1975. He's standing in front of this like weird kind of like stone, like circular portal with like this deep sense of space behind him."
37:57;38:09;"It has like this almost like kind of Led Zeppelin-y kind of like medieval energy and like the way the font is designed for the band name."
38:09;38:13;"It's very metal. It never has occurred to me."
38:13;38:20;"Yeah, because it's not psychedelic. And even like some of the other 70s covers, like from the Mars Hotel, it's like kooky and weird."
38:20;38:26;"It's like it's a hotel on Mars in outer space. The fact that the words are like carved into stone."
38:26;38:30;"It's got that sense of like metal grandeur. I know exactly what you mean."
38:30;38:36;"I mean, maybe Nike wanted to stay away. They were like Blues for Allah. Are we going to get cancelled for that?"
38:36;38:43;"So they went with the Bears. I don't think it was the right move, but I guess they're not really making these shoes for deadheads."
38:43;38:48;"That's the thing. Right. These shoes are for hypebeasts and maybe some of them will like it."
38:48;38:52;"But yeah, it just doesn't look like the Grateful Dead. It's a fine line."
38:52;38:59;"So we got a major guest coming up. We've been talking about Ben & Jerry's quite a bit over the last few months because of the Chunky Dunkys,"
38:59;39:07;"but also because of their passionate posting about social justice issues, such as the Black Lives Matter movement."
39:07;39:13;"And even before that, posting about the legalization of weed, all things that we feel very strongly about here at Time Crisis."
39:13;39:21;"We're very lucky and honored that we're getting somebody from Ben & Jerry's and not just anybody, the head of global activism and strategy."
39:21;39:26;"And his name's Chris Miller. So Chris is going to talk to us about Ben & Jerry's and their relationship to activism."
39:26;39:30;"Now, let's go to the Time Crisis Hotline."
39:30;39:41;"Hello. Hey, Chris. Hey. Welcome to Time Crisis. It is good to be on Time Crisis."
39:41;39:45;"We're honored to have you. First question, are you a deadhead?"
39:45;39:52;"I was at one point in my life. I would not say that I am currently a deadhead."
39:52;40:00;"But, you know, I mean, I went to the Fare Thee Well shows out in San Francisco and I did briefly pop on the live stream."
40:00;40:02;"What was it over the Independence Day weekend?"
40:02;40:08;"That's legitimate credentials. And so you are the head of global activism and strategy at Ben & Jerry's."
40:08;40:10;"That is true. It's what I do."
40:10;40:17;"So does that job exist at most companies in this day and age? Or is that kind of a unique Ben & Jerry's thing?"
40:17;40:22;"Yeah, that's not a job that exists in most places. There are a handful of companies that have people like me."
40:22;40:26;"But, you know, if you I started my career working for Bernie Sanders."
40:26;40:31;"I spent half a dozen years at Greenpeace hanging banners off of coal plants and bashing the fossil fuel industry."
40:31;40:35;"Most reputable corporations don't let people like me inside."
40:35;40:41;"Right. There's probably companies that have something like a kind of head of global activism."
40:41;40:50;"But they probably the track that they might arrive from, I bet, comes more from like a very specific type of corporate giving."
40:50;40:54;"You know, there's like a whole world of like kind of corporate charity that you don't come from."
40:54;41:01;"That's right. I mean, look, there are certainly, you know, companies play in public policy all the time."
41:01;41:09;"Most of the time it's through things like government affairs functions where corporations are pursuing policy that, you know,"
41:09;41:14;"are in their direct self-interest. So, you know, take us, for example, we're a food company."
41:14;41:20;"You know, we might have an interest in things like agriculture policy and we sell our products and export our products around the world."
41:20;41:29;"So trade policy might be relevant. You know, kind of what we do in terms of this kind of citizen or we call our consumers fans,"
41:29;41:34;"our fan facing activism work is more unusual in the corporate space."
41:34;41:38;"There are a handful of companies that do it, but it is the exception to the rule."
41:38;41:43;"Well, so, yeah, walk us through your career a little bit. You said your first job was working for Bernie."
41:43;41:47;"So what era was that? That was in the U.S. House of Representatives era."
41:47;41:56;"So I came out of college in the early 90s and I signed on to Bernie Sanders' first re-election campaign, which was in 1992."
41:56;41:59;"He'd been elected to the U.S. House of Representatives in 1990."
41:59;42:03;"So were you already up in Burlington? Did you go to college in Vermont?"
42:03;42:12;"Yeah, I grew up just outside of Burlington. So I was around for and was aware of Bernie's time as mayor of Burlington."
42:12;42:26;"And, you know, for me, Bernie, even before I worked for him, was sort of part of what inspired and motivated me to become engaged in the issues that I get the privilege of working on currently at Ben & Jerry's."
42:26;42:39;"I mean, you know, his whole story of upending the political establishment in the city of Burlington, winning the mayor's office just after Ronald Reagan is elected nationally by two votes."
42:39;42:44;"Right. Sort of threw the idea out the window that voting doesn't matter or that your vote doesn't matter."
42:44;42:56;"And his whole story and how he transformed the city of Burlington really was a kind of defining thing as I thought about what I wanted to do with my career and my life."
42:56;43:04;"I can only imagine. It's always struck me as such a fascinating, magical time to imagine 1980s Burlington."
43:04;43:19;"And as you described, a couple of votes, it could have been a very different story. But it seems worth noting that in a fairly small American city, a little bit tucked away, that you would end up in the same time period."
43:19;43:35;"You would have Bernie Sanders, who goes on to on the national stage, obviously become a huge force. Ben & Jerry's, which clearly you're still connected to today. A small ice cream maker that becomes also a big global brand that is still influencing things."
43:35;43:48;"And also the band Fish that becomes one of the biggest, you know, in terms of tickets, one of the best selling acts of all time. All started in early 80s Burlington. So, you know, what was going on? Something in the water?"
43:48;44:01;"It's something in the water. You know, I mean, Burlington and Vermont as a state, I think, has just always punched above its weight. To your point, it's this small little state that's tucked away in the Northeast."
44:01;44:16;"Most people think it's a part of New York. But, you know, Vermont in so many ways has had an oversized impact on art and culture and politics. And it's a wonderful place. I mean, you know, Vermont was the first state in the nation to outlaw slavery."
44:16;44:17;"Really?"
44:17;44:36;"Yep. It was the first state to legalize gay marriage through the legislative process versus through the courts. And if you look at companies like Ben & Jerry's, Vermont had a number of companies that were part of that first wave of corporate social responsibility."
44:36;44:53;"You know, Jeffrey Hollander, who was one of the co-founders that started Seventh Generation. Alan Newman, who founded Magic Hat Brewery. Will Rapp, who started Gardener's Supply. The employee owned company down in the central part of the state, King Arthur Flower."
44:53;44:55;"Oh, King Arthur Flower comes from Vermont?"
44:55;45:17;"It does. And so, you know, certainly in the context of what has now become more commonplace, but back to your point in the 80s, as Ben & Jerry's and these other companies were coming of age, you know, really sort of led a revolution in the way people think about the role of business and what business can do."
45:17;45:19;"So when did you start working at Ben & Jerry's?"
45:19;45:39;"Well, so I'm a two-timer at Ben & Jerry's. I'm not the only one. I actually, my first stint at Ben & Jerry's was after my work with Bernie Sanders. So in about 1996, I guess, I left Bernie's office."
45:39;45:51;"And at that point, Ben Cohen and Jerry Greenfield had sort of phased out of day-to-day operations at the company, and I came in to work with them primarily on their issue advocacy work."
45:51;46:08;"So at the time, Ben was sort of spooling up an effort that was focused on national budget priorities and the need to reduce military spending. You know, the Iron Curtain had come down, the Soviet Union had collapsed, and we had this massive military budget."
46:08;46:20;"And the idea was Ben was building a coalition of business leaders to advocate for the idea of making a relatively modest reduction in the Pentagon budget and shifting those dollars into kids' education and healthcare."
46:20;46:33;"So that was '96. I sort of rode the wave through the Unilever acquisition. Unilever bought the company in 2000, and I left about a year after that."
46:33;46:43;"I took 12 years away and spent part of that time at Greenpeace, part of that time at 7th Generation, and then landed back at the company almost seven years ago."
46:43;46:48;"So that's, what, 2013-ish, when they created this position."
46:48;47:04;"So despite the fact that this company had this sort of long history of using its voice and its connection with its fans to advocate for progressive social change, there was never anybody that owned that job."
47:04;47:09;"And it sort of would juggle between somebody on the social mission team and somebody on the marketing team."
47:09;47:19;"And so when I stepped into this role, the company wanted to bring in someone that had this sort of campaigner and sort of policy experience into the role."
47:19;47:22;"So been back at the company for almost seven years now."
47:22;47:27;"Wow. Okay. Well, first of all, you might have one of the most Vermont resumes of all time."
47:27;47:32;"Bernie Sanders, Greenpeace, 7th Generation, and Ben and Jerry's twice."
47:32;47:34;"How many times have you seen fish?"
47:34;47:46;"You know, my best fish story is that, and let me just say, you know, I have colleagues who are just such huge fish fans, and I've seen fish a number of times over the years."
47:46;47:49;"But we have some diehard fish fans at the company."
47:49;47:50;"I'm sure."
47:50;47:57;"My fish story would have been in, gosh, probably 1988."
47:57;48:04;"I did a semester at a small state college in Johnson, Vermont, at a college called Johnson State College."
48:04;48:10;"And fish came and they played the dining hall at Johnson State College."
48:10;48:15;"And the campus was turned upside down."
48:15;48:23;"I mean, it was this amazing show in literally this small dining hall on campus at Johnson State College."
48:23;48:26;"And, you know, the show went late into the night."
48:26;48:32;"And I mean, I just I can't tell you how, what a party it was."
48:32;48:38;"And I will tell you that the band was henceforth banned from ever appearing at Johnson State College again."
48:38;48:39;"Really?"
48:39;48:41;"Because the place got so turned upside down. Yes."
