Start Timestamp;End Timestamp;Transcript
01:04:25;01:04:26;"He's like, ""Dude, I don't know if you want to do anything"
01:04:26;01:04:29;"with this, but like, I made this thing at the end."""
01:04:29;01:04:31;"And he just like played drums over it"
01:04:31;01:04:33;"and he played this like crazy guitar solo."
01:04:33;01:04:36;"And I was like, ""Oh hell yeah, like I gotta use this."""
01:04:36;01:04:37;"So the whole outro-"
01:04:37;01:04:39;"- Oh, say, wait, which song is that again?"
01:04:39;01:04:41;"- This is on ""This I Promise You""."
01:04:41;01:04:44;"- So the ""This I Promise You"" on your no strings attached"
01:04:44;01:04:48;"has an extended CT guitar solo at the end?"
01:04:48;01:04:50;"- Yes, the song is seven minutes long."
01:04:50;01:04:51;"- Oh, (beep)"
01:04:51;01:04:55;"- I really wanted one to break seven and it's 6.59"
01:04:55;01:04:59;"and I'm a little sad about it, but you know, whatever."
01:04:59;01:05:01;"I could have just made the master a little longer, but-"
01:05:01;01:05:02;"- You'll jam it out live."
01:05:02;01:05:04;"- Yeah, exactly."
01:05:04;01:05:06;"(laughing)"
01:05:06;01:05:06;"Yeah, exactly."
01:05:06;01:05:09;"(soft music)"
01:05:09;01:05:14;"♪ All around you ♪"
01:05:14;01:05:19;"♪ Bring tears to your eyes ♪"
01:05:19;01:05:25;"♪ And all that surround you ♪"
01:05:25;01:05:31;"♪ Are secrets and lies ♪"
01:05:31;01:05:34;"♪ I'll be your strength ♪"
01:05:34;01:05:37;"♪ I'll give you hope ♪"
01:05:37;01:05:42;"♪ Keeping your faith when it's gone ♪"
01:05:42;01:05:45;"♪ The one you should call ♪"
01:05:45;01:05:50;"♪ Was standing there all alone ♪"
01:05:50;01:05:56;"♪ And I will take you in my arms ♪"
01:05:56;01:06:02;"♪ And hold you right where you belong ♪"
01:06:04;01:06:08;"♪ Until the day my life is through ♪"
01:06:08;01:06:13;"♪ This I promise you ♪"
01:06:13;01:06:17;"♪ This I promise you ♪"
01:06:17;01:06:21;"- Do you shred any solo on the record?"
01:06:21;01:06:24;"- I do shred a little solo on one of the ballads"
01:06:24;01:06:26;"at the end, that's when I'll stop loving you."
01:06:26;01:06:29;"And then my friend Alex ripped a nice little solo"
01:06:29;01:06:31;"on Space Cowboy as well."
01:06:31;01:06:35;"I didn't really make it too nerdy music-y,"
01:06:35;01:06:37;"which maybe was a mistake, but you know."
01:06:37;01:06:40;"- Well, you can always do,"
01:06:40;01:06:43;"when you put on the concert for it,"
01:06:43;01:06:44;"you can jam stuff out."
01:06:44;01:06:45;"- Precisely."
01:06:45;01:06:47;"- Wait, now I'm thinking,"
01:06:47;01:06:50;"the NSA is based in Fort Meade, Maryland."
01:06:50;01:06:54;"That can't be too far from Ashburn, Virginia."
01:06:54;01:06:56;"So you could do something that's like,"
01:06:56;01:06:58;"maybe next year, if there's more live music,"
01:06:58;01:07:02;"NSA 2021 performed live at NSA headquarters,"
01:07:02;01:07:04;"Fort Meade, Maryland."
01:07:04;01:07:07;"- That would go extremely hard."
01:07:07;01:07:08;"I definitely want to do a live show at some point,"
01:07:08;01:07:10;"but I might do another,"
01:07:10;01:07:12;"I mean, who knows how long we're going to be doing this."
01:07:12;01:07:15;"I might have to do another BRJ and Friends situation"
01:07:15;01:07:17;"with a different album or something."
01:07:17;01:07:19;"- That was my next question was,"
01:07:19;01:07:23;"is your instinct to go, if you do another one,"
01:07:23;01:07:24;"to stay in sync?"
01:07:24;01:07:25;"- I'd almost want to jump around."
01:07:25;01:07:27;"Like, I mean, there's obviously,"
01:07:27;01:07:28;"like, obviously, you know,"
01:07:28;01:07:31;"I could be very inspired to do a lot more"
01:07:31;01:07:32;"of the NSYNC discography,"
01:07:32;01:07:35;"but I might switch gears a little bit."
01:07:35;01:07:38;"Maybe I go Britney or maybe I do something else."
01:07:38;01:07:39;"I don't really know."
01:07:39;01:07:41;"It's a lot of options out there."
01:07:41;01:07:43;"- I love Britney being a big gear switch."
01:07:43;01:07:46;"(laughing)"
01:07:46;01:07:51;"- No, not really, but you know."
01:07:51;01:07:52;"- When you've been on before,"
01:07:52;01:07:55;"obviously we talked so much about this album in particular,"
01:07:55;01:07:59;"but this era of your life, when you were,"
01:07:59;01:08:00;"what year did this album come out?"
01:08:00;01:08:01;"2000?"
01:08:01;01:08:05;"- 2000, so I was seven at the time."
01:08:05;01:08:06;"- I think that's the age where most people,"
01:08:06;01:08:08;"like around seven,"
01:08:08;01:08:10;"you first start to really be aware of, like,"
01:08:10;01:08:12;"new music or something."
01:08:12;01:08:13;"You know, kids love music,"
01:08:13;01:08:15;"but it's like, when you're really little,"
01:08:15;01:08:17;"it's like, you're not going to have this perception"
01:08:17;01:08:20;"of, like, necessarily, oh, I like that band NSYNC"
01:08:20;01:08:22;"and I like their new album or something."
01:08:22;01:08:24;"So what are the other things from that era"
01:08:24;01:08:26;"that are real hallmarks for you?"
01:08:26;01:08:29;"Is it the first Britney Spears album or?"
01:08:29;01:08:32;"- I don't think her album cuts are as strong"
01:08:32;01:08:34;"as maybe the NSYNC ones."
01:08:34;01:08:36;"So there was never really any big Britney albums,"
01:08:36;01:08:39;"but I mean, I was consuming all boy band content"
01:08:39;01:08:41;"I could get my hands on."
01:08:41;01:08:42;"- How deep would you go?"
01:08:42;01:08:44;"Would you get like 98 degrees?"
01:08:44;01:08:46;"Was that a bridge too far?"
01:08:46;01:08:49;"- I wasn't into 98 degrees, but I was into O-Tone."
01:08:49;01:08:50;"If you remember O-Tone."
01:08:50;01:08:52;"- They were put together on a TV show?"
01:08:52;01:08:54;"- Yes, they were put together by Lou Pearlman,"
01:08:54;01:08:57;"I believe, on ""Making the Band,"" which is hilarious."
01:08:57;01:09:00;"But if you don't know ""Liquid Dreams"" by O-Tone,"
01:09:00;01:09:02;"that's an incredible boy band song."
01:09:02;01:09:05;"That is beautifully, like, horny, 2000,"
01:09:05;01:09:10;"like, one energy song that's essentially about a wet dream"
01:09:10;01:09:13;"and some weird, like, fantasy woman"
01:09:13;01:09:15;"that these guys are combining with, like,"
01:09:15;01:09:18;"different parts of different celebrities' bodies"
01:09:18;01:09:19;"and personalities."
01:09:19;01:09:20;"- We gotta listen to this for a second."
01:09:20;01:09:23;"Can you throw on ""Liquid Dreams"" by O-Tone?"
01:09:25;01:09:28;"- The music video has those, like, CGI waterfall,"
01:09:28;01:09:30;"like, early 2000s. - Yes."
01:09:30;01:09:30;"- Yeah."
01:09:30;01:09:33;"- Jake, you know this song?"
01:09:33;01:09:34;"- No."
01:09:34;01:09:36;"♪ All the love surrounding me ♪"
01:09:36;01:09:41;"♪ Lost in a world of fantasy ♪"
01:09:41;01:09:44;"♪ Every night she comes to me ♪"
01:09:44;01:09:45;"- Man."
01:09:45;01:09:49;"♪ And gives me all the love I need ♪"
01:09:49;01:09:52;"♪ Now this hot girl ♪"
01:09:52;01:09:53;"♪ She's not your average girl ♪"
01:09:53;01:09:55;"- Oh yeah, I know this."
01:09:55;01:09:58;"♪ She's a philosophical dream from a magazine ♪"
01:09:58;01:10:00;"♪ And she's so fine ♪"
01:10:00;01:10:01;"- Damn."
01:10:01;01:10:04;"- All right, and then this is where they list,"
01:10:04;01:10:06;"not dominatrix, supermodel, beauty queen,"
01:10:06;01:10:08;"and this is where they list all the different parts."
01:10:08;01:10:11;"♪ I dream about a girl who's a mix of Destiny's Child ♪"
01:10:11;01:10:13;"♪ Just a little touch of Madonna's wild style ♪"
01:10:13;01:10:16;"♪ With Janet Jackson's smile ♪"
01:10:16;01:10:20;"♪ Rollin' her body like Jennifer's ♪"
01:10:20;01:10:25;"♪ You got the star of my liquid dream ♪"
01:10:25;01:10:27;"- Let's just break down that chorus."
01:10:27;01:10:31;"So that's, you're saying you got a mix of Destiny's Child,"
01:10:31;01:10:36;"Madonna's wild style, Janet Jackson's smile,"
01:10:36;01:10:37;"a body like Jennifer?"
01:10:37;01:10:38;"- Lopez?"
01:10:38;01:10:40;"- It's unclear if it's, I mean,"
01:10:40;01:10:42;"it's probably Jennifer Lopez,"
01:10:42;01:10:45;"but there were a lot of Jennifers at the time,"
01:10:45;01:10:48;"I feel like, that it technically could have referred to."
01:10:48;01:10:50;"Wait, isn't there a whole song called ""Jennifer's Body""?"
01:10:50;01:10:52;"- I know there's the Megan Fox movie."
01:10:52;01:10:55;"- There was also Jennifer Love Hewitt."
01:10:55;01:10:56;"- Jennifer Love Hewitt."
01:10:56;01:10:58;"- Oh yeah, she was a very big star at the time"
01:10:58;01:11:01;"from like, I Know What You Did Last Summer."
01:11:01;01:11:03;"Yeah, ""Jennifer's Body"" is a whole song."
01:11:03;01:11:04;"- Oh."
01:11:04;01:11:06;"- So I think he was really trying to obliquely"
01:11:06;01:11:08;"set up Courtney Love."
01:11:08;01:11:10;"He wanted a girl who's a mix of Destiny's Child,"
01:11:10;01:11:12;"Madonna's wild style, Janet Jackson's smile,"
01:11:12;01:11:14;"and somebody with the kind of, you know,"
01:11:14;01:11:17;"lyrical wit of a Courtney Love."
01:11:17;01:11:20;"And he's saying, ""You're the star of my liquid dream."""
01:11:20;01:11:24;"- Yes, which I believe is like the fantasy woman"
01:11:24;01:11:29;"he's created in his head in order to pleasure himself."
01:11:29;01:11:33;"- This is like some weird, early like,"
01:11:33;01:11:36;"incel kind of anthem or something."
01:11:36;01:11:38;"Like, wait, am I misreading this?"
01:11:38;01:11:40;"Like, the opening line is,"
01:11:40;01:11:42;"""Posters of love surrounding me,"
01:11:42;01:11:43;"lost in the world of fantasy."""
01:11:43;01:11:45;"It's not even like that NSYNC song."
01:11:45;01:11:47;"What's the one that's about like--"
01:11:47;01:11:49;"- Oh, Digital Ghetto?"
01:11:49;01:11:50;"- Right."
01:11:50;01:11:50;"- Digital Ghetto."
01:11:50;01:11:53;"It's not even like, well, we're separated by space,"
01:11:53;01:11:55;"but we can still kind of have cyber sex."
01:11:55;01:11:57;"This is literally a dude being like,"
01:11:57;01:12:00;"""I'm alone in a room surrounded by posters."""
01:12:00;01:12:02;"He's like an otaku."
01:12:02;01:12:06;"He's just like, ""I've got my anime pillows next to me."""
01:12:06;01:12:09;"And every night, a weird Frankenstein woman"
01:12:09;01:12:12;"that I've created in my own mind,"
01:12:12;01:12:15;"that reminds me, there's like a classic old tweet"
01:12:15;01:12:18;"that was something about, maybe you guys have seen it."
01:12:18;01:12:20;"It was like kind of making fun of just like,"
01:12:20;01:12:23;"a kind of like misogynist dude ranking women on the internet"
01:12:23;01:12:24;"when he's like a huge loser."
01:12:24;01:12:27;"And it was kind of like, ""Rihanna's forehead is too big,"""
01:12:27;01:12:31;"he typed as he wiped the Cheeto dust onto his sweatpants."
01:12:31;01:12:32;"- Oh, yeah."
01:12:32;01:12:33;"- Does that sound familiar?"
01:12:33;01:12:35;"That idea of just like people on the internet"
01:12:35;01:12:37;"just being super harsh and just being like,"
01:12:37;01:12:38;"""No way."
01:12:38;01:12:41;"Like, I like Janet Jackson's smile,"
01:12:41;01:12:44;"but you need to throw that on a body like Jennifer's."""
01:12:44;01:12:47;"Now that is a hot chick."
01:12:47;01:12:49;"Like, it's so dark and weird, just like,"
01:12:49;01:12:51;"picture like just somebody alone."
01:12:51;01:12:54;"It's not, it doesn't even have the,"
01:12:54;01:12:55;"at least so far in the song,"
01:12:55;01:12:57;"it doesn't even have the,"
01:12:57;01:12:59;"""Eventually we're gonna meet in real life."""
01:12:59;01:13:01;"Like, maybe you didn't get the girl yet,"
01:13:01;01:13:03;"or you're pining after her, you're separate."
01:13:03;01:13:05;"It's very weird for a big boy band single"
01:13:05;01:13:08;"just to be like, ""I have a lot of posters,"
01:13:08;01:13:12;"and at night, sometimes I have wet dreams"
01:13:12;01:13:14;"about a Frankenstein woman."""
01:13:14;01:13:15;"That's it."
01:13:15;01:13:16;"(laughing)"
01:13:16;01:13:18;"- What a difference 20 years makes, right?"
01:13:18;01:13:19;"I mean, at the time, people were like,"
01:13:19;01:13:22;"""Dude, that's so awesome."
01:13:22;01:13:24;"That's so funny and cool that you thought of that."""
01:13:24;01:13:28;"No one was like, ""Man, this is pathetic."""
01:13:28;01:13:29;"- Yeah."
01:13:29;01:13:32;"Well, I feel like I need to bring up the bridge."
01:13:32;01:13:33;"- Let's get there."
01:13:33;01:13:35;"- The bridge has an interesting turn."
01:13:35;01:13:39;"♪ The hinge on his nips to kiss in the dark ♪"
01:13:39;01:13:43;"♪ Underneath Cindy sees beauty mark ♪"
01:13:43;01:13:47;"♪ When it comes to the test, well, Tyra's the best ♪"
01:13:47;01:13:51;"♪ And tell my heart you'd please arrest ♪"
01:13:51;01:13:56;"♪ Oh, now this hot girl, she's not your average girl ♪"
01:13:56;01:13:58;"♪ She's a morphorotic ♪"
01:13:58;01:13:58;"- Morphorotic."
01:13:58;01:14:01;"♪ Came from a magazine ♪"
01:14:01;01:14:03;"♪ And she's so fine ♪"
01:14:03;01:14:04;"- Hey."
01:14:04;01:14:05;"♪ Designed to blow your mind ♪"
01:14:05;01:14:10;"♪ She's a dominatrix, supermodel, beauty queen ♪"
01:14:10;01:14:13;"♪ I'd you find a girl who's a mix of Destiny's Child ♪"
01:14:13;01:14:16;"♪ Just a little touch of Madonna's cross-eye ♪"
01:14:16;01:14:18;"♪ And Janet Jackson's smile ♪"
01:14:18;01:14:22;"♪ Janet Jackson's got a body like Jenna Woo ♪"
01:14:22;01:14:27;"♪ You got the star of my liquid dreams ♪"
01:14:27;01:14:28;"♪ My liquid dreams ♪"
01:14:28;01:14:33;"♪ Losing everything, she's got the sweetest personality ♪"
01:14:33;01:14:35;"- Oh."
01:14:35;01:14:38;"She's got a good personality, guys."
01:14:38;01:14:39;"She's not like the girls at my school, guys."
01:14:39;01:14:41;"She's actually got a really sweet personality."
01:14:41;01:14:44;"♪ I live for my life ♪"
01:14:44;01:14:47;"- That line about my mama thinks I'm lazy,"
01:14:47;01:14:49;"I mean, that's early incel."
01:14:49;01:14:51;"That's dead star."
01:14:51;01:14:52;"No one understands me."
01:14:52;01:14:55;"- This is when incel culture really started."
01:14:55;01:14:57;"O-Town was created by the CIA"
01:14:57;01:15:02;"to infect a bunch of Americans with the incel curse."
01:15:02;01:15:05;"Well, that bridge that you're talking about,"
01:15:05;01:15:06;"let's just break it down."
01:15:06;01:15:07;"Looks ain't everything."
01:15:07;01:15:10;"She's got the sweetest personality."
01:15:10;01:15:12;"And then, this is hilarious, like Halle B."
01:15:12;01:15:13;"So like Halle Berry."
01:15:13;01:15:16;"It's like, that's even more like psycho,"
01:15:16;01:15:17;"just like weirdo on the internet,"
01:15:17;01:15:21;"just being like, unless anybody think that I'm shallow"
01:15:21;01:15:23;"and only care about looks,"
01:15:23;01:15:26;"I'd also be willing to throw in a touch of Halle Berry."
01:15:26;01:15:28;"(laughing)"
01:15:28;01:15:33;"And no, it's not because she's beautiful."
01:15:33;01:15:35;"It's because of her personality."
01:15:35;01:15:38;"It's like, in this song, they couldn't even,"
01:15:38;01:15:40;"I mean, I don't even wanna be mean"
01:15:40;01:15:42;"by trying to think of somebody"
01:15:42;01:15:43;"who's known to have a good personality,"
01:15:43;01:15:44;"but be unattractive."
01:15:44;01:15:47;"But it's like, they still have to throw in somebody"
01:15:47;01:15:50;"who's known far and wide as a beautiful woman,"
01:15:50;01:15:52;"even for the personality."
01:15:52;01:15:54;"You'd really have to give them props"
01:15:54;01:15:56;"if all of a sudden this super heteronormative song,"
01:15:56;01:15:59;"they just throw in a dude for personality."
01:15:59;01:16:02;"(laughing)"
01:16:02;01:16:05;"This was also early 2000s."
01:16:05;01:16:06;"Who's considered a cool guy then?"
01:16:06;01:16:08;"Just like, looks ain't everything."
01:16:08;01:16:11;"She's got the personality of a Carson Daly."
01:16:11;01:16:12;"(laughing)"
01:16:12;01:16:14;"Of a Craig Kilmore. - Tom Hanks."
01:16:14;01:16:17;"- Craig Kilmore. - Personality of a Tom Hanks."
01:16:17;01:16:19;"Just a cool dude to hang out with."
01:16:19;01:16:19;"- Shaq."
01:16:19;01:16:21;"- She's got Shaq's personality."
01:16:21;01:16:25;"My mama thinks I'm lazy."
01:16:25;01:16:27;"His mom is from a previous generation being like,"
01:16:27;01:16:31;"all you do is stay up there with your anime pillows."
01:16:31;01:16:32;"You spend all this time on the internet"
01:16:32;01:16:36;"obsessing about this Frankenstein woman who doesn't exist."
01:16:36;01:16:37;"Get out there and meet a real girl."
01:16:37;01:16:39;"And he's like, shut up, mom."
01:16:39;01:16:41;"My friends all think I'm crazy."
01:16:41;01:16:43;"They're like, dude, it's actually cool"
01:16:43;01:16:45;"to come hang out in real life."
01:16:45;01:16:46;"And he's like, no."
01:16:46;01:16:49;"And then this part that we just listened to,"
01:16:49;01:16:50;"it's kind of quiet."
01:16:50;01:16:52;"He said, liquid dreams, my liquid dreams."
01:16:52;01:16:53;"I do kind of love this line."
01:16:53;01:16:57;"Waterfalls and streams, these liquid dreams."
01:16:57;01:16:59;"(laughing)"
01:16:59;01:17:02;"- Yikes. - It's a great one."
01:17:02;01:17:03;"Okay, now I understand."
01:17:03;01:17:04;"At first I thought he was saying,"
01:17:04;01:17:06;"you are the star of my liquid dreams,"
01:17:06;01:17:08;"but it's even weirder."
01:17:08;01:17:10;"He's not even addressing the Frankenstein."
01:17:10;01:17:14;"You is like us, the listener, or his buddy."
01:17:14;01:17:16;"I dream about a girl who's a mix of all these things."
01:17:16;01:17:18;"Throw in a body like Jennifer's,"
01:17:18;01:17:19;"and guess what, buddy?"
01:17:19;01:17:21;"You got the star of my liquid dreams."
01:17:21;01:17:25;"And look, a lot of times we like to break down songs"
01:17:25;01:17:27;"and talk about what they're going for."
01:17:27;01:17:30;"Obviously, for me as a songwriter, me as a music fan,"
01:17:30;01:17:35;"I don't believe that every song has to be hyper-specific"
01:17:35;01:17:37;"and there can be layers of meaning."
01:17:37;01:17:40;"And as much as I sometimes bring a lot of rigorous logic"
01:17:40;01:17:43;"to our song breakdowns,"
01:17:43;01:17:45;"I don't believe all songs need to adhere to rigorous logic."
01:17:45;01:17:47;"However, one thing I'll say,"
01:17:47;01:17:50;"in pop music, and especially like boy band music,"
01:17:50;01:17:52;"usually the people who write songs,"
01:17:52;01:17:56;"there is a conversation about just what is the song about."
01:17:56;01:17:59;"That doesn't happen in slightly more abstract"
01:17:59;01:18:00;"forms of songwriting."
01:18:00;01:18:05;"People might talk more about mood or is that a cool line?"
01:18:05;01:18:09;"But with a song like this, that is pretty straightforward,"
01:18:09;01:18:11;"there 100% must have been a moment"
01:18:11;01:18:14;"where somebody was like, it was discussed in the room."
01:18:14;01:18:16;"Well, so what's the song really about?"
01:18:16;01:18:20;"And somebody was like, this is about either masturbating"
01:18:20;01:18:22;"and picturing this Frankenstein woman,"
01:18:22;01:18:25;"or just literally having a wet dream."
01:18:25;01:18:27;"And somebody else was like, oh, that's awesome."
01:18:27;01:18:28;"Definitely."
01:18:28;01:18:30;"And nobody stopped to think like,"
01:18:30;01:18:33;"none of the other big boy bands really go that route."
01:18:33;01:18:36;"Another thing you could say about boy bands from this era"
01:18:36;01:18:39;"is that everything about them was usually designed"
01:18:39;01:18:42;"to appeal to--"
01:18:42;01:18:43;"- 14 year old girls."
01:18:43;01:18:44;"- To 14 year old girls."
01:18:44;01:18:46;"And if the music and the dancing was good enough,"
01:18:46;01:18:49;"you might get people of all genders and ages"
01:18:49;01:18:50;"interested in them."
01:18:50;01:18:52;"'Cause like, you know, Backstreet Boys and NSYNC,"
01:18:52;01:18:55;"everybody got at least their song stuck in their head"
01:18:55;01:18:56;"here and there."
01:18:56;01:18:58;"But still, their point, a lot of their songs"
01:18:58;01:19:02;"would be about heartbreak and a lot directly addressed"
01:19:02;01:19:05;"to a person they love, to a girl."
01:19:05;01:19:08;"This song is so weird because, again,"
01:19:08;01:19:10;"the you is not the girl."
01:19:10;01:19:12;"I bet if like we look through that,"
01:19:12;01:19:13;"the whole ""No Strings Attached"" album,"
01:19:13;01:19:16;"almost every you is about either the girl"
01:19:16;01:19:18;"that they are split up with,"
01:19:18;01:19:21;"the girl they're pining after, the girl they're with."
01:19:21;01:19:24;"You know, like the you is almost always the girl."
01:19:24;01:19:27;"It's so weird who this is supposed to appeal to."
01:19:27;01:19:29;"Is it supposed to appeal to like the fellas?"
01:19:29;01:19:31;"Just kind of being like, ""Hey guys."""
01:19:31;01:19:32;"(laughing)"
01:19:32;01:19:33;"""Hey guys."""
01:19:33;01:19:35;"That feels like such a thing."
01:19:35;01:19:37;"- You know when you're up late at night"
01:19:37;01:19:40;"and you're trying to craft that perfect scene"
01:19:40;01:19:41;"to send you to sleep?"
01:19:41;01:19:45;"- That was like a classic weird energy in like middle school"
01:19:45;01:19:48;"when like you and your friends start talking about sex"
01:19:48;01:19:52;"and everybody's so like trying to be like mature and cool"
01:19:52;01:19:54;"and you know, talk about stuff as if they know"
01:19:54;01:19:55;"what it's all about."
01:19:55;01:19:58;"And there's that classic dynamic of like some kid"
01:19:58;01:20:00;"in the crew being like, ""Oh no, totally."""
01:20:00;01:20:02;"And you know when you just like start freaking thinking"
01:20:02;01:20:04;"about and they say something so weird"
01:20:04;01:20:06;"and everybody's like, ""What the fuck is wrong with you?"""
01:20:06;01:20:07;"You know what I mean?"
01:20:07;01:20:09;"Like that's that classic middle school shit."
01:20:09;01:20:11;"That kind of sounds like somebody being like,"
01:20:11;01:20:14;"""Hey guys, you ever like look at hot girls on the internet?"""
01:20:14;01:20:15;"""Oh yeah, man."
01:20:15;01:20:17;"I found a playboy in the woods."
01:20:17;01:20:19;"Dude, this girl was so hot."""
01:20:19;01:20:19;"""Really?"""
01:20:19;01:20:21;"""Man, I'd love to see that."""
01:20:21;01:20:22;"And then when a kid's like,"
01:20:22;01:20:23;"""You know what my dream would be?"
01:20:23;01:20:26;"Would be to take various parts of celebrities' bodies,"
01:20:26;01:20:28;"put them together."""
01:20:28;01:20:29;"You know, like, and everybody's like, ""Whoa, yo."""
01:20:29;01:20:31;"Like, ""Too much."
01:20:31;01:20:32;"Too much."""
01:20:32;01:20:34;"- How successful was O-Town?"
01:20:34;01:20:36;"- They had that song that was big"
01:20:36;01:20:39;"and then they had another one called ""All or Nothing"""
01:20:39;01:20:42;"which was like, it was like a quintessential boy band"
01:20:42;01:20:43;"slow jam in my opinion."
01:20:43;01:20:44;"But you know, it's,"
01:20:44;01:20:48;"and I think they still do some stuff every now and then."
01:20:48;01:20:50;"Like they kind of stuck around for a little bit."
01:20:50;01:20:53;"- I'm on the Wikipedia page for Liquid Dreams"
01:20:53;01:20:55;"and first of all, in the opening paragraph,"
01:20:55;01:20:57;"it's very straightforward."
01:20:57;01:21:01;"It says, ""It's a song by American boy band O-Town"
01:21:01;01:21:05;"released in December 2000, reached number one in Canada."""
01:21:05;01:21:06;"What's going on in Canada?"
01:21:06;01:21:09;"""Number 10 in the US, number three in the United Kingdom."
01:21:09;01:21:10;"The song is about wet dreams,"
01:21:10;01:21:13;"filled with sexual innuendos and pop culture references."""
01:21:13;01:21:16;"But also in this article, it's talking about"
01:21:16;01:21:18;"how one of the people,"
01:21:18;01:21:21;"Ikaika Kahoano"
01:21:21;01:21:25;"was one of the five members selected for making the band,"
01:21:25;01:21:26;"but he and his family decided"
01:21:26;01:21:28;"he should go to med school instead,"
01:21:28;01:21:31;"causing him to back out, making way for Dan Miller."
01:21:31;01:21:34;"Wait, so I'm curious about this dude who was like,"
01:21:34;01:21:37;"I guess he was in a different boy band called Element."
01:21:37;01:21:38;"And then he was-"
01:21:38;01:21:39;"- No, Element was later."
01:21:39;01:21:40;"Element was like other people,"
01:21:40;01:21:42;"people who didn't make the band,"
01:21:42;01:21:44;"if that makes any sense, I believe."
01:21:44;01:21:47;"- I wonder if this dude who was almost in O-Town"
01:21:47;01:21:49;"is like a practicing doctor right now."
01:21:49;01:21:51;"- Oh, that is a great thing to look up."
01:21:51;01:21:52;"- We should have him on."
01:21:52;01:21:54;"- We should have him call in."
01:21:54;01:21:59;"- It says he's an American military officer and an actor."
01:21:59;01:22:01;"Sounds like he's got an interesting life."
01:22:01;01:22:02;"Well, thanks so much for coming on, Brian."
01:22:02;01:22:05;"Everybody needs to go stream ""No Strings Attached."""
01:22:05;01:22:08;"So is this just under Brian Jones and Friends?"
01:22:08;01:22:10;"- It's under Brian Robert Jones."
01:22:10;01:22:11;"- Brian Robert Jones."
01:22:11;01:22:12;"- Yeah."
01:22:12;01:22:13;"- All right, well, thanks so much, Brian."
01:22:13;01:22:15;"- Of course, thanks for having me on."
01:22:15;01:22:18;"- No, and thanks for putting us onto that disgusting song,"
01:22:18;01:22:19;"""Liquid Dreams."""
01:22:19;01:22:20;"I haven't thought about that in a long time."
01:22:20;01:22:21;"- Sorry, sorry about that."
01:22:21;01:22:22;"Yeah, it's a bit of a doozy."
01:22:22;01:22:24;"- Let's catch up soon, Brian."
01:22:24;01:22:24;"Good to see you."
01:22:24;01:22:25;"- Absolutely, man."
