Start Timestamp;End Timestamp;Transcript
43:42;43:43;"McDonald's and Travis Scott."
43:43;43:45;"I think we barely scratched the surface here."
43:46;43:51;"I think we need to go read up on some French philosophy to fully, truly understand this"
43:51;43:52;"cultural moment."
43:52;43:55;"It's down freezing cold."
43:55;43:58;"That's how we already know when it's here."
43:58;44:01;"My dog will probably do it for Louis Bell."
44:01;44:03;"That's just all he know."
44:03;44:04;"He don't know nothing else."
44:04;44:06;"I tried to show."
44:06;44:09;"Yeah."
44:09;44:13;"I tried to show."
44:13;44:16;"Yeah."
44:16;44:18;"Yeah."
44:18;44:19;"Yeah."
44:19;44:19;"Yeah."
44:19;44:20;"Yeah."
44:20;44:22;"Gone on you with the pick and roll."
44:22;44:24;"Young flame here in sicko mode."
44:24;44:34;"Made this here with all the ice on in the booth at the gate outside when they pull up,"
44:34;44:35;"they give me loose."
44:35;44:35;"Yeah."
44:35;44:40;"Jump off boys as Nike boys hopping our coats way to be when we pull up."
44:40;44:41;"Give me the Lou."
44:41;44:44;"Was off the Remy had a bad post."
44:44;44:49;"Had to in my old town to duck the news to pull out a lockdown."
44:49;44:50;"We made no moves."
44:50;44:53;"Now it's 4 a.m. and I'm back up popping with the cool."
44:53;44:55;"I just landed in chase."
44:55;44:58;"We mix this pop like Jamba Joe's different color change."
44:58;45:01;"See my jewelry selling fruits and a joking man."
45:01;45:02;"No, the crackers with you."
45:02;45:08;"You're listening to time crisis."
45:08;45:10;"That's enough about new music."
45:10;45:14;"Jake, I heard you have some things to say about the new Rolling Stone top 500 greatest"
45:14;45:15;"albums of all time."
45:15;45:15;"That's right."
45:15;45:19;"Which dropped this past week, which by the way, I didn't realize it was dropping."
45:20;45:25;"And I heard about it because I was in the studio with Arielle and somebody hit him up about it"
45:25;45:26;"because he voted."
45:26;45:30;"And then I vaguely remembered, oh, yeah, I kind of remember getting an email that said,"
45:30;45:34;"do you want to vote in this and like kind of clocking it?"
45:34;45:36;"And then like I was like realizing I never did."
45:36;45:39;"So once again, I failed culture."
45:39;45:42;"Just like the times where I didn't get to vote in the Grammys."
45:42;45:44;"I didn't vote in the Rolling Stone 500."
45:44;45:46;"And apparently people like Beyonce did."
45:46;45:49;"So I would have been in good company, but I didn't."
45:49;45:50;"I f***ed up."
45:50;45:54;"And there is I found out there's one Vampire Weekend album in there."
45:54;45:54;"Yeah."
45:54;45:56;"Modern Vampires of the City."
45:56;45:58;"But one funny thing is nobody hit me up about it."
45:58;46:04;"Maybe nobody cares to tell me that a seven year old album is in the top 500."
46:04;46:07;"But then I was trying to think, when's the last time they did one?"
46:07;46:11;"I have some vague memory that maybe our first album used to be in there."
46:11;46:14;"Well, anyway, it made me kind of wonder a lot."
46:14;46:16;"I would love to know what fell out."
46:16;46:18;"And somehow Arielle knew."
46:18;46:21;"I don't know if it has to do with the person who told him, but Arielle was like,"
46:21;46:25;"did you hear that ZZ Top fully fell out of the top 500 this time?"
46:25;46:31;"I guess in years past, they had both Trace Ombres and Eliminator in the top 500."
46:31;46:32;"But no more."
46:32;46:35;"Anyway, that's my experience with the top 500."
46:35;46:37;"Jake, how did it come across your desk?"
46:37;46:40;"There was a lot of activity around it in my Twitter feed."
46:40;46:43;"Initially, I was sort of like, who cares?"
46:43;46:48;"But then I looked at it today and just made a few notes of what kind of stuck out to me."
46:48;46:54;"But I do want to say, Modern Vampires of the City was number 328."
46:54;46:55;"Solid."
46:55;46:58;"You were edged out by the Who live at Leeds."
46:58;47:02;"I'm surprised that that actually is still in there."
47:02;47:05;"OK, here's a question."
47:05;47:09;"What do you think is the highest ranking indie record?"
47:10;47:13;"Something that would be unambiguously categorized as indie."
47:13;47:14;"Unambiguously?"
47:14;47:15;"That's a great question."
47:15;47:16;"I was surprised."
47:16;47:19;"Velvet Underground, we couldn't call unambiguously indie."
47:19;47:21;"That was a phrase that didn't exist then."
47:21;47:24;"Indie is like post-punk, you know?"
47:24;47:26;"We're saying like 82, 83 at the earliest."
47:26;47:28;"An REM album, maybe?"
47:28;47:29;"No."
47:29;47:32;"OK, because like huge artists like Nevermind was number six."
47:32;47:33;"And Nirvana is not indie."
47:33;47:34;"Right."
47:34;47:37;"No, yeah, I know what you mean."
47:37;47:37;"True indie."
47:37;47:39;"Like something that didn't sell millions of copies."
47:39;47:40;"Yeah."
47:40;47:43;"I don't know, like Slanted and Enchanted."
47:43;47:45;"Like that's like a classic critics pick."
47:45;47:46;"I mean, that's what I would have guessed too."
47:46;47:50;"That was coming in at $199."
47:50;47:54;"There was a record at number 56, also released on Matador."
47:54;47:54;"Oh, Matador."
47:54;47:57;"Is it from the 90s?"
47:57;47:57;"It is."
47:57;48:00;"I mean, is it Guided by Voices?"
48:00;48:03;"No, GBV was denied."
48:03;48:03;"Shut out."
48:03;48:05;"Into the 500."
48:05;48:08;"I love Bill and Sebastian, but I doubt they're coming at 56."
48:08;48:09;"No."
48:09;48:10;"Cat Power?"
48:10;48:12;"No, there was no Cat Power on the list."
48:12;48:16;"There was a Bill and Sebastian like in the 400s, if I remember."
48:16;48:18;"But you're getting warmer with Cat Power."
48:18;48:21;"Solo female artist on Matador."
48:21;48:23;"Was Liz Phair on Matador?"
48:23;48:24;"Oh, right."
48:24;48:25;"I noticed that."
48:25;48:27;"Exile and Guy Vaughn."
48:27;48:28;"Is a great record."
48:28;48:29;"I love that record."
48:29;48:32;"And that is also a classic critics' fave."
48:32;48:34;"That's something about when I look through this stuff."
48:34;48:38;"And to Rolling Stone's credit, first of all, thank you for inviting me to vote."
48:38;48:40;"I'm setting a terrible example for every--"
48:40;48:44;"obviously, please vote in the upcoming elections."
48:44;48:47;"I am proud that we got an album in there without me voting."
48:47;48:51;"Because then I would have had to deal with the moral quandary of whether or not to vote for us."
48:51;48:54;"Which I don't think I could have brought myself to do."
48:54;48:57;"But I know for a fact that Arielle voted."
48:57;49:01;"And I know that Beyonce voted because they said she voted."
49:01;49:02;"So then I'm wondering how many--"
49:02;49:05;"I assume it's a mix of critics and artists."
49:05;49:07;"I know that Stephen Hyden voted."
49:07;49:10;"I saw that on his Twitter."
49:10;49:11;"Let me just read this to you."
49:11;49:16;"""To do so, we received and tabulated the top 50 albums lists from more than 300 artists,"
49:16;49:19;"producers, critics, and music industry figures."
49:19;49:27;"The electorate included Beyonce, Taylor Swift, Billie Eilish, rising stars or artists like"
49:27;49:32;"Her, Tierra Whack, Lindsey Jordan of Snail Mail, and veterans such as Adam Clayton and"
49:32;49:40;"The Edge from U2, Raekwon from Wu-Tang, Gene Simmons, and Stevie Nicks."""
49:40;49:43;"I mean, all right, to their credit, they really were trying to get a mix of old and young."
49:43;49:49;"And the newest album I saw on there was Frank Ocean Blonde, which came out like four years ago."
49:49;49:51;"And there was-- oh, Kendrick Damm."
49:51;49:53;"Kendrick Damm was probably the newest album that I saw."
49:53;49:56;"And the Harry Styles record from last year was on there somewhere."
49:56;49:58;"OK, so maybe that was the newest."
49:58;50:01;"It was the Harry Styles from last year was up in there."
50:01;50:05;"But the truth is, even if they make a big push to get a bunch of young people to vote,"
50:05;50:10;"I'm sure Taylor Swift and Beyonce are going to throw down a lot of classic albums."
50:10;50:18;"It might take 100 years for you to start to see a totally changing of the guard."
50:18;50:23;"Because if I did it, which is the title of OJ Simpson's book,"
50:23;50:28;"if I did it, I'm sure I would have picked a few albums from the past decade."
50:28;50:33;"But I hate to say it, if I was honest with myself, I'd be picking a lot of basic, tasteful--"
50:34;50:38;"[MUSIC - ""I NEVER SAID NOTHING""]"
50:38;51:05;"[MUSIC - ""I NEVER SAID NOTHING""]"
51:05;51:10;"Speaking of, where do you think the highest ranking Grateful Dead record was?"
51:10;51:12;"I remember Clocking American Beauty."
51:12;51:15;"Definitely not top 100."
51:15;51:18;"That sounds like in the two or three hundreds to me."
51:18;51:19;"Yeah, it was 215."
51:19;51:21;"That's a top 100 record."
51:21;51:24;"Get Jacob Ballett next time."
51:24;51:30;"I wonder if it was weighted voting, because I was surprised to see the Kiss"
51:30;51:32;"live album on there, number 305."
51:32;51:33;"Interesting."
51:33;51:38;"I was just picturing Gene Simmons just listing that album 50 times."
51:38;51:38;"Right."
51:38;51:46;"500 is such a big number that it's like, by the time you get down to the last Tyree Stiles record,"
51:46;51:50;"is that four votes is enough to get you in the top five?"
51:50;51:54;"Because there must be thousands and thousands of records that got one vote."
51:54;51:54;"Yeah."
51:54;51:56;"And there's just not enough consent."
51:56;52:00;"Also, one thing I'll say is that probably some artists like the Grateful Dead"
52:00;52:03;"are at least partially the victims of like..."
52:03;52:09;"I bet Grateful Dead would be top 100 if you were asking people to vote on the 50 most iconic"
52:09;52:14;"artists of the post-war era, because it'd be very easy for a lot of people to say,"
52:14;52:15;"""Well, Grateful Dead, look what they accomplished."""
52:15;52:23;"Not every artist has a Sgt. Peppers where it becomes this article of faith that that's their"
52:23;52:24;"opus."
52:24;52:24;"Right."
52:24;52:28;"I can even picture some people being like, ""Well, my favorite Beatles album is like,"
52:28;52:34;"I don't know, like Magical Mystery Tour, but I got to put Sgt. Pepper because that's more of"
52:34;52:37;"an iconic, important album."" It becomes a self-fulfilling prophecy."
52:37;52:41;"So in the case of the Grateful Dead, nobody's going to put like,"
52:41;52:46;"Blues for Allah. It's part of their story and they're as iconic as the Beatles to me in many"
52:46;52:52;"ways, but they don't have that album that every... I guess American Beauty is their closest."
52:52;52:57;"Well, yeah, I would say that the deadheads that would actually be voting for the dead"
52:57;53:01;"are so deep in it that American Beauty is too basic."
53:01;53:01;"Right."
53:01;53:05;"True deadheads are not down with talking about American Beauty."
53:05;53:06;"What were some of your other observations?"
53:06;53:11;"I thought there was a huge omission because there was a ton of compilation albums,"
53:11;53:16;"which I understand for some of the artists that were making music before the album became the"
53:16;53:22;"sort of de facto form. So you're Muddy Waters, Buddy Holly, Chuck Berry."
53:22;53:24;"I understand that there's a couple of..."
53:24;53:29;"But then there was like Bob Marley Legend and Madonna Immaculate Collection, which is a little"
53:29;53:35;"bit like... And those are artists that had actual real albums elsewhere in the top 500. So it made"
53:35;53:38;"me think the most glaring omission is the greatest selling album of all time."
53:38;53:41;"Oh, it's the Eagles, right? So Eagles greatest hits."
53:41;53:42;"The Eagles greatest hits."
53:42;53:44;"Was Hotel California in there?"
53:44;53:48;"Yes, it came in at number 118, which is respectable."
53:48;53:50;"Was that the only Eagles album?"
53:50;53:53;"I think the first Eagles record was in there somewhere."
53:53;53:54;"Yeah."
53:54;53:56;"It's a ridiculous thing to go to bat for, but..."
53:56;54:00;"It's a self-fulfilling privacy thing where it's like, even though it's such a huge selling album,"
54:00;54:06;"it doesn't have the... Even an Eagles fan critic person would still pick Hotel California over it."
54:06;54:10;"I don't know exactly why. Hotel California just has more of this aura."
54:10;54:12;"Yeah, I mean, I just..."
54:12;54:14;"Legend is also like..."
54:14;54:21;"Legend is the most basic greatest hits CD you'd ever have next to the Eagles greatest hits."
54:21;54:27;"Legend famously, similar to Dark Side of the Moon, I think was in the... There used to be a thing,"
54:27;54:32;"Billboard charts, they created an alternate chart for stuff that had been out forever."
54:32;54:35;"And Legend was up there with Pink Floyd as just this perennial seller."
54:35;54:45;"So it's a real thing that Legend, I'm sure, dwarfs any other Bob Marley album in terms of sales."
54:45;54:46;"Oh, I'm sure."
54:46;54:49;"I guess, obviously, you're saying that's the same thing with the Eagles."
54:49;54:56;"But there's something about Legend that became the de facto entry point for all subsequent"
54:56;55:00;"generations of people interested in Bob Marley. So it's like, even though you're right,"
55:00;55:04;"it is just kind of like a random greatest hits. There's something about Bob Marley Legend that"
55:04;55:09;"does have... Maybe just because it sold so many copies, it has this aura. And I think"
55:09;55:16;"Bob Marley, for the average American fan, doesn't have a Hotel California."
55:16;55:21;"Yeah. There was a few other things that I thought were interesting. The highest ranked U2 album."
55:21;55:25;"I clocked this too. It's Octoon, baby, right? It's above Joshua Tree."
55:25;55:32;"Yeah. And they were really close together. Octoon was 124, Joshua was 135. And then similarly,"
55:32;55:38;"much to the consternation of... Or it would be much to the consternation of James Gandolfini"
55:38;55:45;"if he was still with us. Green Day Juki coming in at number 375. American Idiot, 248."
55:45;55:46;"Oh, man, come on."
55:46;55:47;"Blowing Juki out of the water."
55:47;55:54;"That's the classic bias towards capital I important works. American Idiot was seen as"
55:54;55:59;"Green Day speaking truth to power, tackling big ideas, talking about the state of the world,"
55:59;56:02;"the state of America, all this. Whereas Juki..."
56:02;56:04;"It's called Juki."
56:04;56:13;"Whereas Juki is called Juki. I mean, Juki is a more important record than American Idiot by any"
56:13;56:18;"metric. I'm not dissing American Idiot, but come on, we're talking about Juki here."
56:18;56:19;"It's a beautiful record."
56:19;56:20;"Yeah, it's a beautiful record."
56:20;56:24;"Rumors came in at number 7, Fleetwood Mac Rumors, 7."
56:24;56:29;"Solid. I wonder if Rumors is going up in the charts. I could imagine 10, 20 years ago,"
56:29;56:32;"people not wanting to give it up for Rumors in the same way."
56:32;56:37;"For sure. Because the first one was an 03, and then they did a revised one in 2012."
56:37;56:40;"I was shocked to see Rumors so high up at number 7."
56:40;56:40;"That's great."
56:40;56:44;"But I was equally shocked to see no Tusk."
56:44;56:46;"Tusk is too funky for a lot of people."
56:46;56:50;"Shut out. But I feel like music nerds, who it seems like the most people,"
56:50;56:55;"like people submitting their ballots for probably professional musicians or music nerds,"
56:55;56:59;"are like up on Tusk, right?"
56:59;57:03;"If you told me that Tusk was in there at like 297, I'd be like, ""Yeah, oh, cool."""
57:03;57:04;"Sure, of course."
57:04;57:06;"It took a Trace Ombre slot."
57:06;57:08;"[laughter]"
57:08;57:14;" Drowning in the sea of love "
57:14;57:20;" Where everyone would love to drown "
57:20;57:28;" But now it's gone, it doesn't matter what for "
57:28;57:37;" When you build your house, then call me home "
57:37;57:43;"And then there were definitely like, yeah, like 10 Bob Dylan records, every Kanye record."
57:43;57:46;"As we've discussed many times, Kanye and Bob Dylan, a lot in common."
57:46;57:53;"Exactly. I did notice that Dark Twisted Fantasy edged out Highway 61."
57:53;57:54;"Oh, they were like next to each other?"
57:54;57:57;"They were next to each other. It was like, you know, whatever it was,"
57:57;57:59;"like 19 and 20 or whatever it was."
57:59;58:00;"Wow."
58:00;58:04;"Then I was thinking, if I had to choose like the greatest all-time album,"
58:05;58:09;"I would probably just choose like Alien Lanes, but I acknowledge that that doesn't have"
58:09;58:14;"the cultural footprint that is required for an album to be the greatest."
58:14;58:19;"And then I was looking through it and then I saw that Kanye and I love Twisted Fantasy,"
58:19;58:23;"but then I was like, maybe Highway 61 would be my number one. I don't know."
58:23;58:26;"I'm not gonna like rack my brain over it, but like..."
58:26;58:27;"It's a great album."
58:27;58:30;"At a certain point, you kind of throw up your hands, right? I mean, it's sort of like..."
58:30;58:33;"I always get confused between that and bringing it all back home,"
58:33;58:35;"because the covers are similar with the white borders."
58:35;58:38;"Also, I got into them at the same time, so it's like..."
58:38;58:39;"Interesting."
58:39;58:42;"But yeah, Highway 61 is..."
58:42;58:42;"I think you're saying..."
58:42;58:43;"It opens with like a Rolling Stone."
58:43;58:48;"It's like a Rolling Stone from a Buick. Is that what it was?"
58:48;58:54;"Tom Thumbs, blues, it closes with Desolation Row, like Queen Jane approximately. I don't know."
58:54;58:56;"The Ballad of a Thin Man?"
58:56;58:57;"That's on there, yeah."
58:57;58:59;"Well, it's also... I think there's something funny too."
59:00;59:04;"We really got to do like a philosophy episode, because I got some things I want to..."
59:04;59:06;"Some questions I want to ask. Get some real philosophers on."
59:06;59:10;"There's something also that's inherent in the proposition"
59:10;59:13;"of asking people to list the greatest 500 albums."
59:13;59:18;"I can picture a lot of people bending their own preference to the spectacle."
59:18;59:23;"Like I was talking about the example of somebody whose personal favorite Beatles record or..."
59:23;59:24;"You know, is something."
59:24;59:27;"And yet, they'd know that to represent the Beatles,"
59:27;59:34;"they have to bend to Sgt. Pepper because that's like the one that is been said to be so important"
59:34;59:39;"over and over again that its importance is like the orders of magnitude greater than,"
59:39;59:42;"you know, even like the White Album or something."
59:42;59:45;"It's like what I said. If it was just me, I would be choosing Alien Lanes,"
59:45;59:46;"but I wouldn't because I would be..."
59:46;59:51;"That's a pathetic choice because it doesn't have cultural reach."
59:51;59:56;"And yet, it doesn't have cultural reach because the policeman in your head said,"
59:56;59:59;"""You're about to write Alien Lanes,"" and said, ""Jake, you're under arrest."""
59:59;01:00:01;"You almost put something that mattered to you."
01:00:01;01:00:06;"You know what? Alien Lanes, Ezra, Alien Lanes is unelectable."
01:00:06;01:00:11;"Right. You're like, ""Alien Lanes is your Bernie."""
01:00:11;01:00:13;"You're just like..."
01:00:13;01:00:16;"It's unelectable. It's unelectable."
01:00:16;01:00:20;"Listen, man, in a perfect world, I would love to see Alien Lanes top 10."
01:00:20;01:00:23;"It's just not going to happen. It's pie in the sky, Jake."
01:00:23;01:00:26;"Throw that off your list and put Pet Sounds, man."
01:00:26;01:00:29;"You're like, ""I never actually throw on Pet Sounds."""
01:00:29;01:00:34;"Jake, just suck it up and put down Pet Sounds and you're just like, ""Yes."""
01:00:34;01:00:39;"Pet Sounds was number two, which was... I was surprised how high that was."
01:00:39;01:00:42;"When we were in the studio and we were like talking about it and we were kind of..."
01:00:42;01:00:44;"There was like some like, ""All right, like scrolling to number one."
01:00:44;01:00:46;"Guess what it's going to be. Guess what's going to be."""
01:00:46;01:00:49;"And I was like, ""Uh, uh."" And I said Pet Sounds."
01:00:49;01:00:51;"I knew it wasn't going to be Sardine Pepper for whatever reason."
01:00:51;01:00:57;"And number one, by the way, for anybody listening was Marvin Gaye, What's Going On, right?"
01:00:57;01:00:58;"Yeah, it was."
01:00:58;01:01:00;"When I actually think about my favorite albums of all time,"
01:01:00;01:01:02;"the ones I spent the most time with in my life,"
01:01:02;01:01:05;"I think I saw at least one of these albums in there."
01:01:05;01:01:10;"The two albums that I truly was obsessed with at an important time in my life"
01:01:10;01:01:15;"were Something Else and Village Green Preservation Society by The Kinks."
01:01:15;01:01:16;"I think I saw one of them in there."
01:01:16;01:01:20;"I think Village Green was... Oh, no, Something Else was definitely in there."
01:01:20;01:01:21;"Maybe they both were."
01:01:21;01:01:24;"Something Else has like Waterloo Sunset on it, right?"
01:01:24;01:01:27;"Yeah. I mean, it is funny. It's like, I wonder..."
01:01:27;01:01:28;"God, I'm glad I didn't fill this out."
01:01:28;01:01:31;"I would have had a breakdown if I had to vote in this election."
01:01:31;01:01:33;"Dude, coming in with 50 albums would be hard."
01:01:33;01:01:35;"That's stressful."
01:01:35;01:01:38;"It would take like hours to really like..."
01:01:38;01:01:39;"I literally just... I'm trying to do..."
01:01:39;01:01:41;"With this thought experiment, I'm thinking like,"
01:01:41;01:01:43;"""All right, let's just forget about top 50, but top 10."""
01:01:43;01:01:46;"I'm like, ""Would I put a Beatles album in my top 10?"""
01:01:46;01:01:47;"And I'm like stressed out about it."
01:01:47;01:01:48;"It's like..."
01:01:48;01:01:50;"What's your favorite Beatles record?"
01:01:50;01:01:53;"Well, when I was growing up, it might just be because my parents had it."
01:01:53;01:01:54;"Sure."
01:01:54;01:01:57;"I knew Magical Mystery Tour better than a lot of albums."
01:01:57;01:01:58;"I love that record."
01:01:58;01:02:02;"And by the way, if there's any stats geeks listening, Beatles stats geeks,"
01:02:02;01:02:07;"I recognize that Magical Mystery Tour is considered a soundtrack or a compilation"
01:02:07;01:02:08;"and not a studio album."
01:02:08;01:02:09;"Exactly."
01:02:09;01:02:10;"I hear you. I get it."
01:02:10;01:02:14;"Because some of these things were released as singles and blah, blah, blah."
01:02:14;01:02:16;"But whatever. It feels and looks like an album."
01:02:16;01:02:20;"I was limited before I started having my own money to buy CDs"
01:02:20;01:02:22;"to just listen to whatever records my parents had."
01:02:22;01:02:23;"And they didn't have Revolver."
01:02:23;01:02:25;"And they didn't have The White Album."
01:02:25;01:02:29;"I think they had Sgt. Pepper's and Magical Mystery Tour."
01:02:29;01:02:31;"And straight up as a kid, I would throw on..."
01:02:31;01:02:35;"I would choose Magical Mystery Tour over Sgt. Pepper every time."
01:02:35;01:02:38;"I mean, because Magical Mystery Tour had Strawberry Fields Forever."
01:02:38;01:02:42;"The song Magical Mystery Tour is actually an amazing recording."
01:02:42;01:02:42;"Yep."
01:02:42;01:02:45;"That's crazy trumpet with the echo and stuff."
01:02:45;01:02:46;"It's so weird."
01:02:46;01:02:47;"Full on the Hill."
01:02:47;01:02:51;"Full on the Hill is like actually a very haunting, dark, weird song."
01:02:51;01:02:52;"What else is on that? Your Mother Should Know."
01:02:52;01:02:54;"Yeah."
01:02:54;01:02:54;"Kind of like..."
01:02:54;01:02:55;"Annie Lane."
01:02:55;01:02:58;"No, dude, I prefer Magical Mystery to Pepper."
01:02:58;01:03:00;"This is why we're friends, Jake."
01:03:00;01:03:00;"Man, I can't..."
01:03:00;01:03:03;"Can you believe all these years we've known each other,"
01:03:03;01:03:05;"we're still discovering new things we have in common."
01:03:05;01:03:08;"Oh, yeah. I am the walrus."
01:03:08;01:03:09;"Oh, yeah."
01:03:09;01:03:12;"Blue Jay Way, which also is the most LA Beatles song"
01:03:12;01:03:17;"because Blue Jay Way is a street in West Hollywood, Beverly Hills."
01:03:17;01:03:18;"Yeah."
01:03:18;01:03:18;"The Bird Streets."
01:03:18;01:03:21;"There's a fog upon LA."
01:03:21;01:03:25;"I think people look at Magical Mystery Tour and they're like,"
01:03:25;01:03:26;"""Oh, it's kind of corny."""
01:03:26;01:03:27;"Because it has..."
01:03:27;01:03:31;"There's a strain of Beatles corniness in it with Penny Lane and stuff."
01:03:31;01:03:34;"But if you're willing to interpret a song like Penny Lane"
01:03:34;01:03:38;"as being actually a haunting, sad vision of suburbia,"
01:03:38;01:03:40;"which to me it is,"
01:03:40;01:03:44;"then suddenly this album feels as deep and dark as Sgt. Pepper."
01:03:44;01:03:45;"That song is sad and weird."
01:03:46;01:03:49;"Penny Lane, there is a barber showing photographs"
01:03:49;01:03:53;"Of every head he's had the pleasure to know"
01:03:53;01:03:57;"And all the people that come and go"
01:03:57;01:04:00;"Stop and say hello"
01:04:00;01:04:06;"On the corner is a banker with a motorcar"
01:04:06;01:04:10;"The little children love him behind his back"
01:04:10;01:04:14;"And the banker never wears a mask"
01:04:15;01:04:17;"In the pouring rain"
01:04:17;01:04:19;"Very strange"
01:04:19;01:04:25;"Penny Lane is in my ears and in my eyes"
01:04:25;01:04:34;"There beneath the blue suburban skies"
01:04:34;01:04:36;"I sit and meanwhile back..."
01:04:36;01:04:38;"Dude, you know what a fun game is?"
01:04:38;01:04:39;"I don't know if you've ever done this on tour,"
01:04:39;01:04:44;"but have someone try to list the tracks of a Beatles record"
01:04:44;01:04:45;"from by memory?"
01:04:45;01:04:48;"Like Abbey Road, Go."
