Start Timestamp;End Timestamp;Transcript
44:36;44:41;"♪ I just got to look through ♪"
44:41;44:45;"♪ Before it's all in the air ♪"
44:45;44:50;"- But yeah, it is funny to think Subway,"
44:50;44:52;"like, I'm not even kidding,"
44:52;44:55;"Subway just seems like a technology."
44:55;44:58;"It's so little about the customer experience or the food."
44:58;45:01;"Even McDonald's feels more about the food."
45:01;45:04;"Subway really just feels like a technology,"
45:04;45:07;"a viral technology that's spreading across the globe."
45:07;45:09;"There's just some, it's like the food"
45:09;45:11;"is so besides the point there."
45:11;45:13;"I don't picture Fred DeLuca,"
45:13;45:14;"well, I don't want to get personal,"
45:14;45:17;"but you know, like this idea of,"
45:17;45:20;"we talked to Jake, one thing that Robert Rosenberg said,"
45:20;45:21;"which is kind of shocking,"
45:21;45:25;"is that he doesn't have very strong taste buds."
45:25;45:28;"So he's always relied on other people in the office"
45:28;45:30;"to like really decide if something tastes good"
45:30;45:32;"and if the consumers are going to like it."
45:32;45:34;"There's something about Subway where it just feels like,"
45:34;45:36;"I know they're always, they have special sandwiches,"
45:36;45:38;"but it just feels like, who gives a (beep)"
45:38;45:40;"just like open a Subway."
45:40;45:42;"I feel like Subway gets most of their customers"
45:42;45:44;"just from people being like, well,"
45:44;45:45;"- I'm hungry."
45:45;45:47;"- I'm hungry and I probably shouldn't go to McDonald's."
45:47;45:50;"- Fred DeLuca's tasting it and someone's like,"
45:50;45:52;"Mr. DeLuca, you don't have any taste buds."
45:52;45:53;"(laughing)"
45:53;45:54;"Who gives a (beep)"
45:54;45:56;"- Yeah, who gives a (beep)"
45:56;45:57;"Go (beep) yourself."
45:57;46:00;"- RIP Fred DeLuca."
46:00;46:03;"He left this earth in 2015."
46:03;46:04;"- Actually right before the taping we got."
46:04;46:06;"- I don't want to speak ill of the dead."
46:06;46:08;"Rest in peace, Mr. DeLuca."
46:08;46:09;"And honestly, at the end of the day,"
46:09;46:11;"he accomplished something incredible."
46:11;46:12;"So."
46:12;46:13;"- Oh, absolutely."
46:13;46:16;"- We got a great email right before the taping"
46:16;46:18;"from a professional beer taster"
46:18;46:22;"who really gets into the process of tasting."
46:22;46:24;"He's a sensory technician."
46:24;46:27;"It might be relevant to read this letter."
46:27;46:28;"- Let's check this out."
46:28;46:32;"- Let's go to the time crisis mailbag."
46:32;46:33;"- This is from Trevor."
46:33;46:37;"Professional beer taster, episode 142 analysis."
46:37;46:39;"Hey, Crisis Crew, huge TC head here."
46:39;46:42;"Professionally though, I'm a sensory scientist"
46:42;46:46;"at New Belgium Brewing in Fort Collins, Colorado."
46:46;46:47;"In typically TC fashion,"
46:47;46:48;"I was listening to the most recent episode"
46:48;46:51;"with Robert Rosenberg about a week late,"
46:51;46:52;"and I thought I could try and weigh in"
46:52;46:54;"on some questions regarding professional tasters"
46:54;46:56;"and how to find them."
46:56;46:57;"While obviously not on Duncan's level,"
46:57;46:59;"not a food manufacturer,"
46:59;47:00;"I figured that a brief overview"
47:00;47:04;"from inside Colorado's biggest craft brewery"
47:04;47:06;"might help clear a couple things up for yourselves"
47:06;47:09;"and other listeners about how tasters are usually created."
47:09;47:11;"I'd never even heard of this as a job."
47:11;47:13;"When I'm picturing the Dunkin' Donuts story,"
47:13;47:15;"it sounded like he just picked people"
47:15;47:18;"with other jobs in the office just to weigh in."
47:18;47:20;"Okay, so here's where Trevor explains his job."
47:20;47:23;"I, along with a small team, among other things,"
47:23;47:25;"run a daily taste panel at the brewery,"
47:25;47:27;"which involves sample evaluation"
47:27;47:30;"for approximately 20 trained tasters."
47:30;47:32;"To put it bluntly, all of our panelists and technicians"
47:32;47:34;"drink beer each morning."
47:34;47:35;"Tight. - Wow."
47:35;47:36;"- From each batch, a finished product"
47:36;47:40;"to determine if our beers contain any number of off flavors"
47:40;47:42;"and make sure they're true to brand."
47:42;47:43;"In beer at any brewery,"
47:43;47:45;"this could be anything from slight amounts of onion"
47:45;47:48;"or fruity aromas that shouldn't be in a specific brand"
47:48;47:50;"to more serious fermentation issues"
47:50;47:53;"that produce aromas of DMS, creamed corn,"
47:53;47:57;"mercaptan, rotting garbage, isovaleric,"
47:57;48:00;"sweaty socks, among a million others."
48:00;48:01;"I guess he's saying-- - What the hell?"
48:01;48:04;"- I guess he's naming the chemical"
48:04;48:07;"and saying what it tastes like to a professional taster."
48:07;48:09;"This daily tasting allows us to put out world-class beer"
48:09;48:10;"in the hands of our customers each day"
48:10;48:12;"with a clear conscience."
48:12;48:14;"You know, I guess the same way that you see footage"
48:14;48:16;"of somebody in a factory where there's people"
48:16;48:19;"just checking every little thing all day."
48:19;48:22;"You know, sometimes a robot can do that too,"
48:22;48:27;"just to push out any deformed M&M or something."
48:27;48:30;"I guess it makes sense the only way just to, every day,"
48:30;48:32;"be testing these huge batches of beer"
48:32;48:35;"and make sure you're not about to go send,"
48:35;48:38;"you know, thousands of skunked brews out"
48:38;48:41;"would be to have human beings do it."
48:41;48:43;"Says, ""Hopefully I don't get too far in the weeds,"
48:43;48:45;"""but what we do is find willing participants"
48:45;48:47;"""in the company, literally anyone,"
48:47;48:48;"""to first go through a set of online trainings"
48:48;48:51;"""in order to provide them with beer-specific knowledge"
48:51;48:53;"""and then sense knowledge."""
48:53;48:55;"Okay, so it's almost like he's the full-time dude"
48:55;48:58;"and he's taking people from within the company"
48:58;49:00;"to kind of volunteer, I guess."
49:00;49:01;"""We then take these individuals"
49:01;49:04;"""and give them hands-on trainings in our sensory lab."
49:04;49:05;"""They're tasting beers,"
49:05;49:08;"""talking about their characteristics,"
49:08;49:10;"""kind of learning what to look out for,"
49:10;49:13;"""like the sweaty socks chemical."
49:13;49:15;"""After trainings, they get to join our taste program"
49:15;49:17;"""under a provisionary status as not validated"
49:17;49:19;"""until they see a certain number of spiked beers"
49:19;49:22;"""and call them out correctly a certain number of times."""
49:22;49:24;"- Oh, wow. - So this is very serious."
49:24;49:25;"They're like, ""You can't bull (beep)"
49:25;49:26;"""your way through this."""
49:26;49:29;"""We also use tests similar to what Ezra's talking about,"
49:29;49:32;"""where we give them four glasses of two different beers"
49:32;49:34;"""that have relatively similar attributes or spikes"
49:34;49:37;"""and have them group them into two groups"
49:37;49:39;"""of two known as a tetrad test."""
49:39;49:42;"Okay, this is serious."
49:42;49:43;"""While I'm sure it varies from company to company,"
49:43;49:46;"""regardless of food, beverage, manufacturer,"
49:46;49:48;"""statistical analysis of tasting performance"
49:48;49:50;"""is the main way you can validate tasters"
49:50;49:52;"""in order to know you're putting high-quality products"
49:52;49:54;"""in the market consistently."
49:54;49:55;"""Sorry for the rant, but I tend to geek out"
49:55;49:56;"""on some of this stuff,"
49:56;49:58;"""which is why I love my job so much."""
49:58;50:03;"That is that type of job that is so specific"
50:03;50:05;"that it's like, if you're the type of person"
50:05;50:10;"who cares about chemistry, beer, and customer satisfaction,"
50:10;50:13;"it truly is a dream job."
50:13;50:15;"- Plus, when you're at the bar on a Friday night"
50:15;50:16;"and someone's like, ""What do you do, man?"""
50:16;50:19;"You're like, ""I taste beer for a living, man."""
50:19;50:22;"- Hanging out at the barbecue, talking to some random dude."
50:22;50:27;"We'll let some guy who just works in mid-level management"
50:28;50:31;"at an accounting firm, ""What about you, man?"""
50:31;50:33;"""Well, I'm a sensory technician."""
50:33;50:36;"""Bro, you're telling me you taste beer for a living?"""
50:36;50:38;"- It's like professional gamers or something."
50:38;50:39;"- Kind of."
50:39;50:40;"- I mean, that makes a lot of sense."
50:40;50:44;"I mean, I would think there'd be,"
50:44;50:46;"like the flavors with a microbrewer"
50:46;50:48;"would be so subtle and precise."
50:48;50:49;"- Right. - There'd be very little"
50:49;50:51;"variation that would be acceptable,"
50:51;50:52;"which again, like you were saying about Subway,"
50:52;50:54;"it doesn't matter."
50:54;50:56;"There's the bread, which is the same,"
50:56;50:59;"has that same perfumey kind of sweetness every time."
50:59;51:01;"But everything else is just sort of like,"
51:01;51:03;"yeah, you're getting some tomatoes and some turkey"
51:03;51:05;"and some mayo and mustard."
51:05;51:06;"There's no like variation there really."
51:06;51:09;"Or if there is, it's out of your hands anyway."
51:09;51:13;"- The Subway customer experience is like such a low bar."
51:13;51:15;"Yeah, I don't know if I'm just like putting too much"
51:15;51:17;"of my own personal experience with Subway into it,"
51:17;51:22;"but I just feel like you go to Subway with no expectations"
51:22;51:24;"other than that it's not McDonald's."
51:24;51:27;"It's like you just know it's not gonna be a great sandwich"
51:27;51:30;"if you get one and like that (beep) shredded lettuce"
51:30;51:32;"is like all is like messy in the wrap."
51:32;51:33;"It's like, you don't even complain at Subway."
51:33;51:35;"- It's food, it's function."
51:35;51:36;"- Right, exactly. - Okay,"
51:36;51:37;"here's a tough question."
51:37;51:40;"- Yeah. - Tough question for the show."
51:40;51:43;"If you had to eat at Subway or McDonald's every day"
51:43;51:45;"for the rest of your life, you had to choose one."
51:45;51:46;"Which one?"
51:46;51:49;"Let's say lunch every day, every day."
51:49;51:50;"- Same meal?"
51:50;51:52;"Or you have diversity in-- - No."
51:52;51:54;"You can put whatever you want."
51:54;51:56;"Just lunch, diversity of the menu."
51:56;51:58;"- McDonald's. - McDonald's."
51:58;51:59;"- I think-- - I think a challenge"
51:59;52:01;"at McDonald's. - Yeah, I think actually"
52:01;52:03;"McDonald's, it's a broader menu."
52:03;52:05;"I mean, of course there's a part of me"
52:05;52:08;"that still buys into this idea that Subway is healthier,"
52:08;52:10;"so I could punish myself with a veggie delight."
52:10;52:14;"- Lest I remind the whole crew what I sent"
52:14;52:19;"in the group text, which is they're being sued in Ireland"
52:19;52:22;"because their bread isn't technically bread."
52:22;52:26;"And the tuna, there's a legal battle in the US"
52:26;52:29;"because the tuna isn't technically tuna."
52:29;52:31;"- I'm not sure about the tuna story."
52:31;52:33;"I'm not sure I'd buy that, but the bread"
52:33;52:35;"has a ton of sugar in it for sure."
52:35;52:38;"- You know, I'm, what does that mean that it's not?"
52:38;52:42;"I'm looking at the Subway website now with their menu."
52:42;52:44;"Gotta say, it actually looks pretty good in the pictures."
52:44;52:48;"- I might go Subway in that hypothetical."
52:48;52:50;"- I mean, of course McDonald's would be more fun,"
52:50;52:55;"but okay, looking at Subway, I guess Subway does have salads."
52:55;52:56;"Oh, and they got wraps."
52:56;52:59;"I didn't know, oh, they got protein bowls now?"
52:59;53:00;"Okay, maybe I gotta go back to Subway."
53:00;53:02;"I've been really harsh on it."
53:02;53:05;"Oh, they have a breakfast, Subway has a breakfast menu."
53:05;53:09;"They have these funny kind of flatbread things"
53:09;53:12;"where you could get a bacon, egg, and cheese,"
53:12;53:14;"a black forest ham, egg, and cheese,"
53:14;53:16;"egg and cheese, steak, egg, and cheese."
53:16;53:17;"- You know what?"
53:17;53:20;"I feel like next episode, we all have to get"
53:20;53:22;"the Dunkin' Donuts avocado toast,"
53:22;53:25;"and we all have to get a Subway protein bowl"
53:25;53:27;"and review them."
53:27;53:29;"- Hey, what's the difference between ham"
53:29;53:30;"and black forest ham?"
53:30;53:32;"What makes it black forest?"
53:32;53:33;"- That's a good question."
53:33;53:38;"I mean, I picture black forest ham being dark on the edges."
53:38;53:41;"I guess it comes from the black forest region of Germany."
53:41;53:42;"- It sounds really cool."
53:42;53:45;"- It's a kind of Bavarian preparation of ham."
53:45;53:47;"- It's got ham."
53:47;53:48;"- It's not honey ham."
53:48;53:50;"It's not like a pink American ham."
53:50;53:54;"It's like a dark Bavarian ham"
53:54;53:58;"from the deepest, darkest parts of the black forest."
53:58;54:01;"- I'm picturing that Subway protein bowl being very soggy."
54:01;54:03;"- (laughs) Very soggy?"
54:03;54:06;"- The idea that they're just cutting up the meat,"
54:06;54:08;"like chopping up the thin meat"
54:08;54:10;"to make that the part of the protein."
54:10;54:12;"Do you know, it's so thin."
54:12;54:13;"- This is gross."
54:13;54:14;"Let's, we gotta move on."
54:14;54:16;"(laughs)"
54:16;54:18;"- Approaching slurry levels."
54:18;54:20;"- Yeah, we gotta move on."
54:20;54:22;"- All right, no more Subway bowls."
54:22;54:23;"But it's making me think like,"
54:23;54:27;"I wonder if I've ever had a day in my life,"
54:27;54:29;"and I'm sure many people have,"
54:29;54:33;"where it was Dunkin' for breakfast, Subway for lunch,"
54:33;54:34;"Mickey D's for dinner."
54:34;54:36;"- Oh, damn."
54:36;54:37;"I have not."
54:37;54:38;"- You should probably have some fun with that."
54:38;54:40;"- That's a good challenge though."
54:40;54:42;"Maybe that's the TC challenge."
54:42;54:43;"- Dunkin' for lunch."
54:43;54:44;"- Yeah, what is this?"
54:44;54:45;"This is a pathetic show."
54:45;54:47;"(laughs)"
54:47;54:49;"The TC challenge."
54:49;54:51;"We're basically just,"
54:51;54:53;"it's where, I think sometimes we do hit a place"
54:53;54:55;"with the show where it's like,"
54:55;54:58;"the critical perspective kind of runs"
54:58;55:00;"into the kind vibe side,"
55:00;55:01;"and it just kind of like,"
55:01;55:03;"they fizzle out into just basically"
55:03;55:06;"like a very straight ahead, just like,"
55:06;55:09;"all right gang, if you love fast food as much as we do,"
55:09;55:10;"you should try the TC challenge."
55:10;55:13;"We're doing Dunkin' for breakfast, Subway for lunch,"
55:13;55:14;"Mickey D's for dinner."
55:14;55:16;"Order what you want, but you gotta hit all three."
55:16;55:18;"(laughs)"
55:19;55:20;"- That is so weak."
55:20;55:22;"(laughs)"
55:22;55:26;"I hope, I don't want any listeners to actually do that."
55:26;55:27;"- Yeah, please don't."
55:27;55:28;"- On account of the show."
55:28;55:29;"I'm not gonna do it."
55:29;55:30;"There's no way I'm gonna do that."
55:30;55:33;"- Okay, how about Jake,"
55:33;55:34;"you can pick anyone you want,"
55:34;55:36;"but for one day,"
55:36;55:38;"each meal, breakfast, lunch, and dinner"
55:38;55:40;"has to be a Subway protein bowl."
55:40;55:41;"- Wait, what?"
55:41;55:44;"I have to eat three Subway protein bowls?"
55:44;55:45;"- Yeah, but they have a lot."
55:45;55:46;"So you could do, for instance,"
55:46;55:48;"you could do the Italian-"
55:48;55:50;"- Is there a breakfast bowl?"
55:50;55:52;"- No, but there's a,"
55:52;55:54;"you could do tuna bowl for breakfast,"
55:54;55:57;"meatball marinara for lunch,"
55:57;56:00;"chicken and bacon ranch."
56:00;56:03;"- Oh, ranch is so nasty."
56:03;56:09;"- The TC challenge is that you have to spend $20.14"
56:09;56:12;"annually at Subway."
56:12;56:14;"- Yeah, exactly."
56:15;56:17;"We don't care when you spend it,"
56:17;56:20;"but every year it's a 10-year challenge."
56:20;56:23;"- In honor of the late Fred DeLuca,"
56:23;56:25;"we're challenging all of our listeners"
56:25;56:27;"to hit Fred's financial goals."
56:27;56:28;"- Well, shout out to Subway."
56:28;56:30;"Shout out to Connecticut."
56:30;56:32;"- Connecticut pulling its weight."
56:32;56:35;"Jake, I did an interview with Goose this morning."
56:35;56:36;"- Oh, wow."
56:36;56:37;"- For Relics."
56:37;56:38;"- Cool."
56:38;56:39;"- I guess they're profiling Goose"
56:39;56:40;"and they wanna have a little sidebar thing"
56:40;56:41;"where we'd talk to them."
56:41;56:43;"The journalist from Relics asked,"
56:43;56:44;"had Goose first got on my radar?"
56:44;56:46;"So of course I explained, you know,"
56:46;56:48;"Stephen Hyden called him to the show."
56:48;56:50;"And he's like, so what made you interested in them"
56:50;56:50;"in the first place?"
56:50;56:52;"And I said, well, here's the thing."
56:52;56:54;"My co-host Jake is from Connecticut"
56:54;56:56;"and he often says Connecticut's not pulling its weight."
56:56;56:58;"So it was very exciting to hear about"
56:58;57:02;"a young band from Connecticut making some waves."
57:02;57:03;"Then they were talking about a lot of other bands"
57:03;57:05;"from the Connecticut jam band scene,"
57:05;57:07;"which we should probably go deeper on sometime."
57:07;57:09;"- Also Goose is just a great band name."
57:09;57:10;"I mean, that's such a catch."
57:10;57:11;"- Yes, I said the same thing."
57:11;57:11;"I was like, first of all-"
57:11;57:14;"- You were just like, wait, there's a band called Goose?"
57:14;57:16;"- A jam band called Goose from Connecticut."
57:16;57:20;"Like, that's already 90% of their,"
57:20;57:21;"and then the music's,"
57:21;57:23;"they're actually a great band, even better."
57:23;57:25;"♪ Stumble every time you do it ♪"
57:25;57:28;"♪ Ain't never gonna get used to it ♪"
57:28;57:30;"♪ Hanging on a garden rose ♪"
57:30;57:33;"♪ Untamed the way that my love grows ♪"
57:33;57:35;"♪ Oh Lord, I didn't see it coming ♪"
57:35;57:38;"♪ Arcadia's got me running ♪"
57:38;57:40;"♪ Just trying not to lose my breath ♪"
57:40;57:43;"♪ 'Cause hell, I'm gonna take that step ♪"
57:43;57:48;"♪ And though my blood is going way down the line ♪"
57:48;57:53;"♪ I'm just fine ♪"
57:55;57:59;"(upbeat music continues)"
58:32;58:37;"♪ All my luck is all that I have today ♪"
58:37;58:44;"♪ But it's no wonder that you found me ♪"
58:44;58:49;"♪ Buried underneath my weight ♪"
58:49;58:56;"♪ Well, I would still sing little red pills ♪"
58:56;59:01;"♪ Maybe you're all that hold me up ♪"
59:02;59:05;"♪ But you pulled the blinds ♪"
59:05;59:07;"♪ In this room of mine ♪"
59:07;59:11;"♪ It's just a little bit brighter since you came ♪"
59:11;59:14;"♪ Oh, I stumble every time you do it ♪"
59:14;59:16;"♪ Ain't never gonna get used to it ♪"
59:16;59:19;"♪ Hanging on a garden rose ♪"
59:19;59:21;"♪ Untamed the way that my love grows ♪"
59:21;59:24;"♪ Oh Lord, I didn't see it coming ♪"
59:24;59:26;"♪ Arcadia's got me running ♪"
59:26;59:29;"♪ Just trying not to lose my breath ♪"
59:29;59:32;"♪ 'Cause hell, I'm gonna take that step ♪"
59:32;59:37;"♪ Seep up all the light ♪"
59:37;59:43;"♪ From the bottom of the spine ♪"
59:43;59:48;"♪ Don't fret, don't hang your head ♪"
59:48;59:51;"♪ 'Cause I'm just fine ♪"
59:51;59:55;"- So we're hitting a lot of this show sucks moments."
59:55;59:58;"That's TC, we kind of get into that just like deep,"
59:58;01:00:02;"just kind of like dry fast food news."
01:00:02;01:00:03;"- Yeah."
01:00:03;01:00:05;"- That's a version of this show that we have to avoid"
01:00:05;01:00:07;"where it is just kind of like,"
01:00:07;01:00:11;"Wendy's announced a new spin on the Baconator."
01:00:11;01:00:12;"Jake, you try it?"
01:00:12;01:00:14;"- No, I haven't had the chance yet."
01:00:14;01:00:15;"- Let's say for the next episode,"
01:00:15;01:00:18;"we all try the new chicken Baconator."
01:00:18;01:00:19;"What else, what else?"
01:00:19;01:00:22;"I went to Taco Bell the other day."
01:00:22;01:00:26;"No, but there is legitimately some very TC news happening"
01:00:26;01:00:28;"with Taco Bell dropping what I believe is,"
01:00:28;01:00:30;"one of the first fast food NFTs."
01:00:30;01:00:34;"So who wants to explain what NFTs are?"
01:00:34;01:00:36;"I mean, Jake, do you already know?"
01:00:36;01:00:39;"- They're nifty fun toys, right?"
01:00:39;01:00:42;"- Jake spent five days in the hospital when he came out,"
01:00:42;01:00:46;"Taco Bell was making fricking NFTs."
01:00:46;01:00:47;"You're Rip Van Winkle."
01:00:47;01:00:50;"It's like you're in prison for 40 years,"
01:00:50;01:00:52;"come out to a totally new world."
01:00:52;01:00:54;"- Wait a second, corporations are making art,"
01:00:54;01:00:58;"like discreet art objects that you can buy one of a kind?"
01:00:58;01:01:01;"Imagine that, like Taco Bell was sort of like,"
01:01:01;01:01:03;"we're having a painting exhibition."
01:01:03;01:01:05;"Well, who did the paintings?"
01:01:05;01:01:08;"Taco Bell did the paintings."
01:01:08;01:01:10;"- I mean, honestly, that is the next phase of like,"
01:01:10;01:01:12;"you know, we've been covering this for years now,"
01:01:12;01:01:15;"but of all like the kind of gimmicky,"
01:01:15;01:01:17;"funny corporate (beep)"
01:01:17;01:01:22;"Oh, like Kentucky Fried Chicken made a lifetime movie."
01:01:22;01:01:25;"And somebody else did a, you know, a street wear drop"
01:01:25;01:01:27;"and, you know, McDonald's and Travis Scott's"
01:01:27;01:01:28;"and all this stuff."
01:01:28;01:01:29;"Like maybe it is eventually just getting back"
01:01:29;01:01:33;"to like old school corporate kind of like classy (beep)"
01:01:33;01:01:36;"where it's like not some big kind of viral joke,"
01:01:36;01:01:39;"where it is like Taco Bell has like a serious art collection."
01:01:39;01:01:41;"They exhibit it sometimes, like what?"
01:01:41;01:01:43;"You know, you think that's weird?"
01:01:43;01:01:45;"- Oh, that I could see that."
01:01:45;01:01:47;"- You think JP Morgan doesn't own a lot of art"
01:01:47;01:01:48;"that they exhibit here and there?"
01:01:48;01:01:50;"And it's like, they kind of lose"
01:01:50;01:01:52;"the millennial zany humor angle"
01:01:52;01:01:54;"and just kind of becomes like,"
01:01:54;01:01:57;"we're a major global corporation."
01:01:57;01:01:59;"We consider part of our mission,"
01:01:59;01:02:01;"not just making money and serving"
01:02:01;01:02:03;"great Mexican inspired cuisine."
01:02:03;01:02:05;"We also consider part of our mission"
01:02:05;01:02:07;"to like enrich people's lives."
01:02:07;01:02:10;"And we're doing a dead ass serious painting exhibition"
01:02:10;01:02:12;"where we're showing some of our collection."
01:02:12;01:02:14;"We paid top dollar from some of the best artists"
01:02:14;01:02:15;"around the world."
01:02:15;01:02:16;"You know, like start acting with like the prestige"
01:02:16;01:02:18;"of like investment banks."
01:02:18;01:02:20;"- LACMA is expanding."
01:02:20;01:02:23;"And one of their things that we're excited about"
01:02:23;01:02:24;"is the new Taco Bell wing."
01:02:24;01:02:25;"- Yeah, seriously."
01:02:25;01:02:26;"- At LACMA."
01:02:26;01:02:27;"I could see that."
01:02:27;01:02:29;"- Taco Bell stadium in Idaho, why not?"
01:02:29;01:02:32;"- I was making a weird joke of Taco Bell making,"
01:02:32;01:02:35;"'cause Taco Bell released NFTs, right?"
01:02:35;01:02:36;"Like Taco Bell released art."
01:02:36;01:02:39;"- So first we should actually explain what NFTs are for,"
01:02:39;01:02:42;"'cause this is something that two weeks ago,"
01:02:42;01:02:43;"very few people were talking about."
01:02:43;01:02:47;"And now it's like everyone and their mothers dropping NFTs."
01:02:47;01:02:48;"- It's so dumb."
01:02:48;01:02:52;"It screams like tulip bubble, if anything does."
01:02:52;01:02:53;"I mean, it's so funny."
01:02:53;01:02:54;"Seinfeld, do you want to jump in?"
01:02:54;01:02:55;"'Cause you had sent that article."
01:02:55;01:02:56;"I mean."
01:02:56;01:02:57;"- Did I send that?"
01:02:57;01:02:58;"I don't think I sent that."
01:02:58;01:03:02;"- Seinfeld, do you feel you can explain?"
01:03:02;01:03:04;"- Oh, I can do very high level."
01:03:04;01:03:07;"- I kind of consider you, I mean Seinfeld"
01:03:07;01:03:09;"as our kind of social media person,"
01:03:09;01:03:13;"that kind of makes you also our lead"
01:03:13;01:03:15;"science and technology reporter."
01:03:15;01:03:18;"- Yeah, I definitely consider myself a tech guru."
01:03:18;01:03:19;"- In the crew."
01:03:19;01:03:22;"And I'll tell you also that I did put an NFT"
01:03:22;01:03:24;"for Seinfeld 2008."
01:03:24;01:03:25;"- That's right."
01:03:25;01:03:28;"- Yeah, online or what I don't even think it's online,"
01:03:28;01:03:30;"but a couple of weeks ago."
01:03:30;01:03:33;"And let me tell you, it didn't meet the minimum price."
01:03:33;01:03:37;"So somebody bid one ether, which was the minimum reserve."
01:03:37;01:03:39;"And then they withdrew their bid."
01:03:39;01:03:41;"So I was like, oh,"
01:03:41;01:03:43;"'cause then I was looking at the conversion rate"
01:03:43;01:03:44;"and it was like $1,600."
01:03:44;01:03:47;"And I was like, this is the dumbest thing ever."
01:03:47;01:03:48;"Did I just make money out of thin air?"
01:03:48;01:03:50;"And then somebody probably came to their senses"
01:03:50;01:03:53;"and withdrew it before the auction ended."
01:03:53;01:03:55;"Anyway, I'm already going on a tangent here."
01:03:55;01:03:58;"NFT on its most basic level is what?"
01:03:58;01:04:02;"It's a digital sort of virtual--"
01:04:02;01:04:03;"- Token."
01:04:03;01:04:04;"- Token, there you go, thank you."
01:04:04;01:04:06;"That represents a piece of artwork."
01:04:06;01:04:09;"And I believe if you purchase one,"
