Start Timestamp;End Timestamp;Transcript
01:23:11;01:23:15;"loses the sandwich war and then spends time with his family."
01:23:15;01:23:19;"So really our hero is Mike Davis, you know, and how does."
01:23:19;01:23:22;"Right. By the way, Mike Davis is not Jersey Mike."
01:23:22;01:23:23;"He's upstate Mike."
01:23:23;01:23:25;"Oh, he's upstate."
01:23:25;01:23:30;"Mike Davis has been lost to history."
01:23:30;01:23:32;"He's a pure figure."
01:23:32;01:23:33;"Although it's funny."
01:23:33;01:23:36;"There's also the Southern California based writer Mike Davis."
01:23:36;01:23:37;"Yes."
01:23:37;01:23:40;"Maybe that's the same guy."
01:23:40;01:23:42;"All these Mike Davis's are the same guy."
01:23:42;01:23:44;"You got run out of town in upstate New York,"
01:23:44;01:23:49;"moved to LA and started writing about urbanism."
01:23:49;01:23:50;"As you do."
01:23:50;01:23:52;"As one does."
01:23:52;01:23:55;"Only one of them is non fungible."
01:23:55;01:23:58;"The non fungible Mike Davis."
01:23:58;01:23:59;"Mike Davis."
01:23:59;01:24:00;"Yeah."
01:24:00;01:24:02;"Someone gets sent back in time today and they're just like,"
01:24:02;01:24:04;"they really got NFTs on their mind."
01:24:04;01:24:07;"They get sent back to 1965 and all they can think about is, all right,"
01:24:07;01:24:11;"I'm going to be early on NFTs."
01:24:11;01:24:16;"But they like, but they know nothing about like 50 years of history that led up to it."
01:24:16;01:24:19;"Just know nothing about like actual like computers."
01:24:19;01:24:23;"Just rolling up to an IBM supercomputer where there's like 30 employees putting"
01:24:23;01:24:27;"giant punch cards in and just being like, all right, guys,"
01:24:27;01:24:28;"I'm about to blow your mind."
01:24:28;01:24:32;"Non fungible tokens."
01:24:32;01:24:34;"This is a million dollar idea."
01:24:34;01:24:37;"Grimes just made 6 million bucks selling them."
01:24:37;01:24:40;"With your guys' computer know-how and my vision of the future,"
01:24:40;01:24:43;"we can make some serious cash."
01:24:43;01:24:48;"Oh my God."
01:24:48;01:24:50;"Just got to wait like 60 years."
01:24:50;01:24:51;"You know what?"
01:24:51;01:24:52;"We've definitely done."
01:24:52;01:24:54;"I guess I'll open a Subway sandwich."
01:24:54;01:24:57;"We've definitely done a time travel bit on time crisis."
01:24:57;01:25:01;"I feel like it was, I think it was like we got sent back to San Francisco."
01:25:01;01:25:02;"Yeah."
01:25:02;01:25:06;"And we had to be really careful when we went to see like the Grateful Dead at"
01:25:06;01:25:11;"like Winterland or some shit because we wanted to catch the show but not to"
01:25:11;01:25:12;"have a butterfly effect."
01:25:12;01:25:14;"I think we also wanted to like."
01:25:14;01:25:17;"Travis Scott, back to the future."
01:25:17;01:25:18;"Wasn't there a whole."
01:25:18;01:25:20;"There's also Travis Scott back to the future."
01:25:20;01:25:24;"But I think we also wanted to like somehow spy and Charles Manson."
01:25:24;01:25:26;"Oh, maybe it was like chaos related."
01:25:26;01:25:30;"Yeah, it was like we wanted to go back and like just follow him around the"
01:25:30;01:25:35;"hate and like see if he was talking to like weird CIA like right operatives."
01:25:35;01:25:39;"But then while we're back there, we can also catch the dead at the Fillmore."
01:25:39;01:25:40;"Right?"
01:25:40;01:25:43;"I mean, if we're there, how could we not?"
01:25:43;01:25:46;"We get sent back to the mid 60s."
01:25:46;01:25:48;"We're just doing all sorts of stuff."
01:25:48;01:25:51;"We're investing early with Fred DeLuca and Subway."
01:25:51;01:25:58;"We're catching the first Warlocks gig at the pizzeria in Palo Alto or"
01:25:58;01:25:59;"whatever."
01:25:59;01:26:00;"Oh, in Menlo Park."
01:26:00;01:26:03;"We'd have to like make an itinerary before we went back."
01:26:03;01:26:04;"We have to write down all the dates."
01:26:04;01:26:05;"Right."
01:26:05;01:26:09;"You know, so we'd be like back in the East Coast dealing with Fred DeLuca."
01:26:09;01:26:12;"Then we'd be like, dude, Warlocks gig is in Palo Alto in two days."
01:26:12;01:26:15;"We got to get on a Pan Am flight in Toronto."
01:26:15;01:26:16;"Get out there."
01:26:16;01:26:18;"Forget about the butterfly effect for a second."
01:26:18;01:26:21;"But like we end up in the mid 60s and we're just like putting our heads"
01:26:21;01:26:24;"together just to remember every like historically significant thing."
01:26:24;01:26:29;"And like then one day, like we look back 10 years later and just like we're"
01:26:29;01:26:32;"super rich and just be like, yeah, these these two weird dudes."
01:26:32;01:26:34;"Nobody knew where they came from."
01:26:34;01:26:35;"Named Jake and Ezra."
01:26:35;01:26:39;"These guys have a significant stake in Subway."
01:26:39;01:26:42;"They own about 80 McDonald's in the Midwest."
01:26:42;01:26:45;"They managed the Grateful Dead."
01:26:45;01:26:48;"They invented non fungible tokens."
01:26:48;01:26:49;"Yeah."
01:26:49;01:26:50;"And they invented non fungible tokens."
01:26:50;01:26:52;"I mean, you know, just a really."
01:26:52;01:26:55;"They started Apple computers."
01:26:55;01:26:58;"Just a real interesting portfolio for these dudes."
01:26:58;01:27:00;"They wrote some great songs, too."
01:27:00;01:27:02;"I mean, wrote a lot of great songs."
01:27:02;01:27:04;"We could steal all the songs from the future."
01:27:04;01:27:05;"Oh, classic like written."
01:27:05;01:27:07;"Yeah, like the Beatles movie."
01:27:07;01:27:08;"Yeah."
01:27:08;01:27:13;"They financed Martin Scorsese's Taxi Driver."
01:27:13;01:27:16;"I wish there was more time travel movies like like that were fun, like"
01:27:16;01:27:19;"Back to the Future, not like super serious like."
01:27:19;01:27:20;"Right."
01:27:20;01:27:22;"I think for whatever the I think part of it is like fun."
01:27:22;01:27:25;"Back to the Future is just so good that it's like, yeah, it really sets"
01:27:25;01:27:26;"the bar high."
01:27:26;01:27:28;"Bill and Ted's Bill and Ted's fun."
01:27:28;01:27:30;"Bill and Ted's is cool."
01:27:30;01:27:34;"The part of Back to the Future when he's playing the Van Halen licks at"
01:27:34;01:27:36;"the 1955 dance."
01:27:36;01:27:39;"I mean, that's just one of the most amazing scenes."
01:27:39;01:27:42;"And then like Chuck Berry's cousin is calling."
01:27:42;01:27:46;"It's just like that's truly like the epitome of time travel movie right"
01:27:46;01:27:47;"there."
01:27:47;01:27:48;"That's it."
01:27:48;01:27:49;"Yeah."
01:27:49;01:27:50;"No, it's about as good as it gets."
01:27:50;01:27:51;"All right."
01:27:51;01:27:52;"Let's get in this top five."
01:27:52;01:27:54;"Number five, 1965."
01:27:54;01:27:56;"Herman's Hermits."
01:27:56;01:27:57;"Can't you hear my heartbeat?"
01:28:05;01:28:06;"Nice hand claps."
01:28:33;01:28:36;"What's DeLuca doing during this?"
01:28:39;01:28:47;"He's driving around in his 1959 Chevy going to various suppliers around"
01:28:47;01:28:49;"Bridgeport."
01:28:49;01:28:52;"He's got to go to the butcher, get the meat lined up, get the cheese"
01:28:52;01:28:53;"lined up."
01:28:53;01:28:56;"He's got to go to the produce salesman."
01:28:56;01:28:57;"Ooh, yeah."
01:28:57;01:29:01;"And then like after this, it's like 10 years earlier."
01:29:01;01:29:05;"And then we'll see him sort of more destitute, you know, or not destitute,"
01:29:05;01:29:07;"but needing."
01:29:07;01:29:09;"Yeah, this is definitely not in my neighborhood."
01:29:09;01:29:15;"This is much more like a industrious guy running errands on a Saturday."
01:29:15;01:29:19;"Yeah, this is not like mischievous, like in my neighborhood."
01:29:48;01:29:50;"Herman's Hermits have some gems."
01:29:50;01:29:51;"I mean, yeah, it's funny."
01:29:51;01:29:55;"Like that 1963 music still was very in my neighborhood."
01:29:55;01:29:59;"You listen to this '65, I mean, it's great."
01:29:59;01:30:02;"I guess it also makes you realize why like the Beatles were just like"
01:30:02;01:30:04;"blowing people's minds."
01:30:04;01:30:06;"It's got a little more swagger."
01:30:06;01:30:08;"Herman's Hermits are great."
01:30:08;01:30:11;"It doesn't get more square than the Herman's Hermits."
01:30:11;01:30:15;"It has a little more like groove and rock than the Beatles."
01:30:15;01:30:19;"It has a little more like groove and rock than some of that '63."
01:30:19;01:30:23;"But you can tell, you can see why like '66, '67 were just insanely"
01:30:23;01:30:27;"transformative years for rock and roll and pop music."
01:30:27;01:30:29;"Number four."
01:30:29;01:30:31;"Oh, this is a classic."
01:30:31;01:30:35;"Roger Miller, King of the Road, country music."
01:30:35;01:30:36;"You know this one, right?"
01:30:36;01:30:40;"Of course."
01:30:40;01:30:42;"Yeah, picture going from that Herman's Hermits to like"
01:30:42;01:30:49;"Jimi Hendrix two years later."
01:30:49;01:30:51;"Great vocal tone."
01:30:51;01:30:53;"Yeah, great singer."
01:31:22;01:31:24;"Banger man."
01:31:24;01:31:48;"Cool shout out."
01:31:48;01:31:51;"So he's like a guy like hopping trains?"
01:31:51;01:31:55;"Yeah, I actually, now I'm confused about what this song is really about."
01:31:55;01:32:03;"I've never listened to the lyrics before."
01:32:03;01:32:05;"It's funny because in the chorus he says,"
01:32:05;01:32:09;"""I'm a man of means, by no means, king of the road."""
01:32:09;01:32:11;"So is he saying, ""I'm not the king of the road?"""
01:32:11;01:32:14;"No, I think he's saying, ""I'm a man of means by no means."""
01:32:14;01:32:16;"Hmm."
01:32:16;01:32:19;"Like, he's not a man of means."
01:32:19;01:32:23;"Right."
01:32:23;01:32:26;"Pushing broom."
01:32:26;01:32:29;"So he's just living on the road, making money here and there?"
01:32:29;01:32:34;"Yeah."
01:32:34;01:32:37;"I think the first time I heard this song was in Swingers."
01:32:37;01:32:39;"It's in Swingers?"
01:32:39;01:32:43;"Yeah, it's a pretty big moment in Swingers."
01:32:43;01:32:44;"Maybe on the way to Vegas?"
01:32:44;01:32:45;"Really?"
01:32:45;01:32:47;"I can't remember exactly where it was, but."
01:32:47;01:32:54;"It's a good song."
01:32:54;01:32:59;"It's funny, it's like, that song is objectively cooler than Herman's Hermits."
01:32:59;01:33:04;"It's like, maybe because this new type of rock was still finding its footing,"
01:33:04;01:33:08;"whereas country was in this mature, cool place."
01:33:08;01:33:10;"Upright bass, the swagger."
01:33:10;01:33:13;"Yeah, I guess it's about a guy riding the rails."
01:33:13;01:33:20;"Also, a perfect song for a montage of Fred DeLuca pounding the pavement."
01:33:20;01:33:21;"Oh, yeah."
01:33:21;01:33:22;"King of the road, man."
01:33:22;01:33:24;"Not in my neighborhood, though."
01:33:24;01:33:25;"He's king of the road."
01:33:25;01:33:31;"He's driving around Southern Connecticut, comparing prices from all these different suppliers."
01:33:31;01:33:32;"Mm-hmm."
01:33:32;01:33:33;"He's getting quotes."
01:33:33;01:33:39;"He's looking to buy a bunch of used kitchen equipment, a meat slicer, a few fridges."
01:33:39;01:33:44;"He's got the want ads sitting on the front seat of the car."
01:33:44;01:33:45;"He's working."
01:33:45;01:33:46;"The supplier montage."
01:33:46;01:33:49;"It'd be a great time for some cameos."
01:33:49;01:33:52;"OK, I've never heard of this one at number three."
01:33:52;01:33:55;"Jewel Aikens, The Birds and the Bees."
01:34:03;01:34:04;"Strange sounds."
01:34:10;01:34:18;"So I think this is when he pulls up to the house to ask about the college loan."
01:34:18;01:34:19;"Yes, yes."
01:34:19;01:34:24;"Right, so it's a montage of the fancy Connecticut barbecue."
01:34:24;01:34:25;"Right."
01:34:25;01:34:33;"And he pulls in, and he's just gotten the semester fees, and he's like, ""I can't afford to go to college."""
01:34:33;01:34:34;"Yeah, yeah."
01:34:34;01:34:41;"Peter Buck's wife is pulling out this beautifully sumptuous stack of corn on the cob."
01:34:41;01:34:45;"There's the red and white checkered tablecloth on the picnic table."
01:34:45;01:34:46;"Right."
01:34:46;01:34:49;"Just the most lush vision of suburbia ever."
01:34:49;01:34:51;"Beautiful mid-'60s suburbia."
01:35:04;01:35:06;"You don't know this song?"
01:35:06;01:35:08;"I don't actually know this song, no."
01:35:21;01:35:24;"All right, so 1965 is still pretty square, too."
01:35:24;01:35:26;"Big time."
01:35:26;01:35:28;"I would have guessed this is more like early '60s."
01:35:28;01:35:31;"If you told me this was like '61, '62, I'd be like, ""Sure."""
01:35:48;01:35:59;"There's something about when you describe Michael Shannon, and there's something I was thinking about how, like Bill Murray in Royal Tenenbaums, you're just throwing golf balls in the pool."
01:35:59;01:36:01;"Oh, in Rushmore."
01:36:01;01:36:09;"In Rushmore, I mean, yeah, when he's just throwing golf balls in the pool and he's just talking to Buck and Buck is just throwing golf balls in the pool."
01:36:09;01:36:13;"Right, he's kind of like off, not-- like, totally avoiding the rest of the party."
01:36:13;01:36:20;"Fred DeLuca just kind of, like, spies him and he's like, ""Buck's always been kind of weird, but he's pretty smart."""
01:36:20;01:36:23;"Just like, doesn't even make eye contact."
01:36:23;01:36:30;"""Hey Pete, any ideas how I could pay for college?"" Doesn't even look up, still throwing the golf balls in."
01:36:30;01:36:35;"""You should open a chain of 32 submarine sandwich restaurants."""
01:36:35;01:36:40;"I like how your Peter Buck imitation sounds like your Jim Morrison impression."
01:36:40;01:36:44;"Oh, I mean, it is-- Jim Morrison's kind of a mystical guy."
01:36:44;01:36:49;"Yeah, maybe the birds and the bees fades out and we just kind of open with a little bit of, like, the end."
01:36:49;01:36:51;"[MIMICS GOLF BALLS]"
01:36:51;01:36:54;"Mystical dawning."
01:36:54;01:36:59;"The breakdown on Peace Frog. The spoken word breakdown on Peace Frog."
01:36:59;01:37:00;"Yeah, yeah."
01:37:11;01:37:20;"""On Don's sacred highway, you should open a chain of 32 submarine sandwich restaurants. Blood everywhere. Visions of-- dark visions of the future."""
01:37:20;01:37:25;"Also, you know, like, we've definitely talked on the show before about the-- I don't even know if you'd call it a meme,"
01:37:25;01:37:32;"but it's like something people say a lot when they're comparing the generations and people are kind of getting into generational warfare"
01:37:32;01:37:37;"and saying, ""Oh, boomers, conservative boomers, you guys don't know how easy you had it."
01:37:37;01:37:44;"Back in the day, you could-- college cost a few thousand bucks and you could get a Moray, all of which is true."
01:37:44;01:37:52;"But, like, so you see people use that in online debates a lot, but I would say if we have any listeners who get into those types of debates,"
01:37:52;01:37:57;"now you could say, ""Listen, guys, our generation is drowning in student debt."
01:37:57;01:38:03;"Back in 1965, you could go to college by opening a chain of 32 submarine sandwich restaurants."
01:38:03;01:38:09;"That's not on the table for millennials or Generation Z."
01:38:09;01:38:15;"I'm sorry that it's not 1965 and I can just start Subway to pay for college."
01:38:15;01:38:16;"[laughter]"
01:38:16;01:38:20;"I had to take out [bleep] loans, but--"
01:38:20;01:38:22;"[laughter]"
01:38:22;01:38:27;"Just say that to, like, some random boomer who had, like, a brutal job and they're, like, drowning in debt and they're just like,"
01:38:27;01:38:31;"""Kid, if you think every boomer's Fred DeLuca, I don't know what to tell you, man."
01:38:31;01:38:33;"It didn't pan out that way for me."""
01:38:33;01:38:35;"[laughter]"
01:38:35;01:38:37;"Oh, man."
01:38:37;01:38:43;"The number two song--okay, Stone Cold classic, The Supremes' ""Stop in the Name of Love."""
01:38:43;01:38:45;"Oh, I love this one."
01:38:45;01:38:49;"♪ Stop in the name of love ♪"
01:38:49;01:38:53;"A classic Holland Dozier Holland jam."
01:38:53;01:39:00;"Songwriter/producer Lamont Dozier explained that the title came while he was cheating on his girlfriend at a no-tell motel."
01:39:00;01:39:07;"When his girlfriend found out, she attempted to confront Dozier at the hotel at 2 a.m., began banging on the door."
01:39:07;01:39:12;"After helping the woman sneak out the bathroom window, he opened the door and attempted to lie about the affair,"
01:39:12;01:39:16;"explaining that he was working late at the studio and got the motel room because he was tired."
01:39:16;01:39:19;"His girlfriend stopped him and said, ""Stop in the name of love."""
01:39:19;01:39:21;"Huh."
01:39:21;01:39:23;"I wonder if he gave her any publishing."
01:39:23;01:39:28;"Wow, man. You have to be really detached and in your own creative headspace"
01:39:28;01:39:34;"to, like, being--getting busted for cheating, getting screamed at by your girlfriend, and being like, ""Ooh, that's a good title."""
01:39:34;01:39:37;"I mean, this sounds more like a movie, actually."
01:39:37;01:39:42;"I wonder if they ever did--they're very prolific, that Holland Dozier Holland team."
01:39:42;01:39:48;"♪ Stop in the name of love ♪"
01:39:48;01:39:52;"♪ Before you break my heart ♪"
01:39:52;01:39:56;"♪ Take it all back ♪"
01:39:56;01:39:59;"♪ Take it all back ♪"
01:39:59;01:40:05;"It's also funny that he reframed it as ""Stop in the name of love before you break my heart."""
01:40:05;01:40:10;"I imagine in this situation, the damage may have already been done."
01:40:10;01:40:17;"Just to make this Deluca story more interesting, maybe we should incorporate this story into the Deluca story."
01:40:17;01:40:21;"Then Fred Deluca's cheating on his girlfriend."
01:40:21;01:40:23;"And writes ""Stop in the name of love."""
01:40:23;01:40:25;"Right."
01:40:25;01:40:31;"I feel like our Deluca story is, like, about 25 minutes long or something."
01:40:31;01:40:33;"It's a short film."
01:40:33;01:40:36;"Generous, yes. Sundance short."
01:40:36;01:40:39;"Well, it would screen right after our Bob Marley short."
01:40:39;01:40:44;"Oh, yeah. Oh, damn. We gotta go deep on Bob Marley in Delaware. We'll save that for the next step."
01:40:44;01:40:48;"A lot of good stuff to talk about there. We only barely scratched the surface."
01:40:48;01:40:50;"♪ Before you break my heart ♪"
01:40:50;01:40:54;"♪ Take it all back ♪"
01:40:54;01:40:59;"♪ Take it all back ♪"
01:40:59;01:41:03;"♪ I've tried so hard, hard to be patient ♪"
01:41:03;01:41:07;"♪ Hoping you'll stop this infatuation ♪"
01:41:07;01:41:11;"♪ But each time you are together ♪"
01:41:11;01:41:16;"♪ I'm so afraid of losing you forever ♪"
01:41:16;01:41:19;"♪ Stop in the name of love before you break my heart ♪"
01:41:19;01:41:25;"She's dating a guy who's maybe also dating someone else or has his eye on someone else."
01:41:25;01:41:28;"Let me see the actual lyrics."
01:41:28;01:41:31;"Oh, you know what? Okay. I think she knows the dude's cheating."
01:41:31;01:41:33;"She's just saying ""stop cheating."""
01:41:33;01:41:34;"Yeah."
01:41:34;01:41:37;"""I'm trying hard to be patient. Wish you'd stop this infatuation."
01:41:37;01:41:41;"But each time I think of you together, I see myself losing you forever."""
01:41:41;01:41:44;"Okay, so she's, like, she's willing to take him back."
01:41:44;01:41:46;"Just stop."
01:41:46;01:41:51;"Okay, that's reasonable. Don't throw away some real love just for a motel fling."
01:41:51;01:41:55;"That's definitely, like, a top three Supreme song."
01:41:55;01:41:57;"Absolutely."
01:41:57;01:41:59;"Okay, we got a big one."
01:41:59;01:42:01;"Number one."
01:42:01;01:42:06;"This week in 1965, The Beatles with ""Eight Days a Week."""
01:42:06;01:42:09;"Oh, wow. This is 65-- I would have guessed that's, like, 64?"
01:42:09;01:42:11;"I guess four? Yeah."
01:42:11;01:42:14;"Yeah, 65, transitional year."
01:42:14;01:42:17;"I guess that's early '65, too."
01:42:17;01:42:19;"We're only in March."
01:42:19;01:42:20;"Right."
01:42:20;01:42:26;"""Hope you need my love, babe. Just like I need you."""
01:42:26;01:42:31;"Yeah, The Beatles had only been in America for a year at this point, I guess, so."
01:42:31;01:42:34;"Right, Ed Sullivan was 64?"
01:42:34;01:42:37;"Yeah, I think, like, February of '64."
01:42:37;01:42:43;"""Eight days a week. Love you every day, girl."""
01:42:43;01:42:46;"Check this out. This is, like, classic crazy Beatles."
01:42:46;01:42:49;"This came out early '64."
01:42:49;01:42:54;"They released an album called ""Beatles 6"" in June '65."
01:42:54;01:42:58;"And then just to give you a sense of what 1965 was like for them,"
01:42:58;01:43:01;"so this is the first half of 1965."
01:43:01;01:43:05;"August '65, they released the album ""Help,"""
01:43:05;01:43:10;"which, you know, was also the soundtrack to the film of the same name,"
01:43:10;01:43:15;"and that had other huge songs like ""Yesterday,"" ""Help,"" ""Ticket to Ride."""
01:43:15;01:43:20;"So that's August '65, and then December 3rd '65 is ""Rubber Soul."""
01:43:20;01:43:27;"So it's like in this year, they had at minimum three distinct,"
01:43:27;01:43:31;"like, hugely impactful eras all within one year."
01:43:31;01:43:34;"This part of the year, then the ""Help"" part of the year,"
01:43:34;01:43:38;"and then just at the very end, the ""Rubber Soul"" part of the year."
01:43:38;01:43:41;"I thought that was the following year. That's nuts."
01:43:41;01:43:43;"No, ""Revolver"" is the following year."
01:43:43;01:43:46;"Right. But this is the year they stopped touring, too."
01:43:46;01:43:49;"Like, they played the Shea Stadium show in '65, too."
01:43:49;01:43:53;"I think '66 is the last year they ever played Candlestick Park."
01:43:53;01:43:56;"Oh, really? How did they have time to make ""Rubber Soul""?"
01:43:56;01:43:59;"They banged that s--t out. I don't know."
01:43:59;01:44:04;"♪ ...week is not enough to show I care ♪"
01:44:04;01:44:11;"♪ I love you every day, girl, always on my mind ♪"
01:44:11;01:44:18;"♪ One thing I can say, girl, love you all the time ♪"
01:44:18;01:44:25;"♪ Hold me, love me, hold me, love me ♪"
01:44:25;01:44:29;"♪ I ain't got nothin' but love, babe ♪"
01:44:29;01:44:35;"♪ Hate day of the week, hate day of the week ♪"
01:44:35;01:44:40;"♪ Hate day of the week ♪"
01:44:40;01:44:42;"Look at the weird ending."
01:44:42;01:44:46;"[beatboxing]"
01:44:46;01:44:49;"Yeah, I've been thinking more about the Beatles lately."
01:44:49;01:44:50;"Yeah?"
01:44:50;01:44:53;"They got that ""Get Back"" documentary coming out."
01:44:53;01:44:57;"Peter Jackson is making with, like, footage, I guess,"
01:44:57;01:45:01;"that's never been used before from, like, the ""Let It Be"" era."
01:45:01;01:45:04;"I watched the trailer. I'm very excited about it."
01:45:04;01:45:07;"Just a very solid band. And influential."
01:45:07;01:45:10;"[laughs] Good band."
01:45:10;01:45:12;"You know, the Beatles are, like, classic."
01:45:12;01:45:16;"Like, you sometimes need to take a long time off from, like, thinking about them."
01:45:16;01:45:17;"Yeah."
01:45:17;01:45:19;"Let them kind of, like, fade into the background."
01:45:19;01:45:21;"But, like, it's always so fun to go deep."
01:45:21;01:45:25;"But, yeah, the output, truly insane."
01:45:25;01:45:27;"""Hate Day of the Week"" not, like..."
01:45:27;01:45:28;"Not my favorite."
01:45:28;01:45:29;"Yeah, me neither."
01:45:29;01:45:34;"Weird that that was a hit the same year that, like, ""In My Life"" came out."
01:45:34;01:45:39;"Also, it's crazy they put out, like, ""Help"" and ""Rubber Soul"" the same year."
01:45:39;01:45:44;"Like, yesterday and some of their most, like, beautiful songs coming out, like, four months apart."
01:45:44;01:45:45;"Right."
01:45:45;01:45:47;"♪ I'm looking through you ♪"
01:45:47;01:45:50;"Oh, yeah. ""I'm Looking Through You"" is, like..."
01:45:50;01:45:52;"That, to me, is, like, a major slept-on Beatles song."
01:45:52;01:45:54;"As far as, like, non-singles go."
01:45:54;01:45:56;"Right? You love that one, too, right?"
01:45:56;01:45:57;"Yeah."
01:45:57;01:45:59;"Or, ""I've Just Seen a Face."""
01:45:59;01:46:01;"I love that one, too."
01:46:01;01:46:03;"Those, like, McCartney acoustic numbers."
01:46:03;01:46:04;"Right."
01:46:04;01:46:07;"Things were changing very fast back then."
01:46:07;01:46:09;"♪ I'm looking through you ♪"
01:46:09;01:46:12;"♪ Where did you go? ♪"
01:46:12;01:46:15;"♪ I thought I knew you ♪"
01:46:15;01:46:18;"♪ What did I know? ♪"
01:46:18;01:46:20;"♪ You don't look different ♪"
01:46:20;01:46:23;"♪ But you have changed ♪"
01:46:23;01:46:26;"♪ I'm looking through you ♪"
01:46:26;01:46:28;"♪ You're not the same ♪"
01:46:28;01:46:34;"♪ Your lips are moving ♪"
01:46:34;01:46:37;"♪ I cannot hear ♪"
01:46:37;01:46:40;"♪ Your voice is soothing ♪"
01:46:40;01:46:43;"♪ But the words aren't clear ♪"
01:46:43;01:46:45;"♪ You don't sound different ♪"
01:46:45;01:46:48;"♪ I've learned the game ♪"
01:46:48;01:46:51;"♪ I'm looking through you ♪"
01:46:51;01:46:53;"♪ You're not the same ♪"
01:46:53;01:47:00;"♪ Why tell me why? ♪"
01:47:00;01:47:03;"♪ You're not the same, you're right ♪"
01:47:03;01:47:07;"♪ Love has been left to gather ♪"
01:47:07;01:47:10;"♪ In the feeling of the night ♪"
01:47:10;01:47:12;"♪ You're thinking of me ♪"
01:47:12;01:47:15;"♪ The same old way ♪"
01:47:15;01:47:18;"♪ You were above me ♪"
01:47:18;01:47:21;"♪ But not today ♪"
01:47:21;01:47:27;"♪ The only difference is your down dress ♪"
01:47:27;01:47:30;"♪ I'm looking through you ♪"
01:47:30;01:47:32;"♪ And you're nowhere ♪"
01:47:32;01:47:34;"I mean, yeah, Beatles, what else is there to say?"
01:47:34;01:47:37;"I mean, that's dumb."
01:47:37;01:47:39;"I was gonna say, I mean, it's really..."
01:47:39;01:47:42;"This is such like dorm room, like..."
01:47:42;01:47:44;"Alright, dude, favorite Beatles, straight up."
