Start Timestamp;End Timestamp;Transcript
24:59;25:02;"Well, also, they must have had to like practice for a while."
25:02;25:04;"I wonder how long the set was."
25:04;25:05;"Do we have any intel on that?"
25:05;25:07;"I also wonder, was it like a 20 minute set?"
25:07;25:08;"I would love to see a set list."
25:08;25:09;"Or did they just like rock out?"
25:09;25:12;"Oh, yeah. Is the set list on setlist.fm?"
25:12;25:18;"I like to think about one of these like health care CEOs coming up to me and being like, hey, you guys going to play that song Brown Eyed Girl tonight?"
25:18;25:22;"I love that one."
25:22;25:27;"They played a 15 song set opening with Let's Spend the Night Together."
25:27;25:28;"Strong."
25:28;25:30;"Tumbling Dice, Under My Thumb."
25:30;25:33;"This was at the Patriots Stadium."
25:33;25:35;"This was at Gillette Stadium."
25:35;25:37;"This was an amazing set list so far."
25:37;25:38;"Yeah."
25:38;25:39;"Under My Thumb."
25:39;25:40;"Birthday Party at the Stadium."
25:40;25:41;"I mean, that's right."
25:41;25:43;"That's actually pretty tight."
25:43;25:46;"Gimme Shelter, Start Me Up, Miss You."
25:46;25:50;"I guess that's maybe a tribute."
25:50;25:55;"Jumpin' Jack Flash, Two Encore, Street Fighting Man, and Satisfaction."
25:55;25:58;"I'm getting an alternate set list."
25:58;26:02;"They dropped in a 19th Nervous Breakdown, first performance since 2005."
26:02;26:05;"Maybe Kraft requested that specifically."
26:05;26:06;"It's a good song."
26:06;26:07;"Okay."
26:07;26:08;"Yeah, I don't judge them."
26:08;26:10;"I mean, at least they were playing a stadium."
26:10;26:12;"[Laughter]"
26:12;26:13;"Wait, wait, wait."
26:13;26:14;"Mick tweeted--"
26:14;26:17;"First gig after Charlie playing an empty stadium."
26:17;26:18;"Hang on."
26:18;26:21;"Mick tweeted a clip if you want to see what it looks like."
26:21;26:24;"I'm sending it to the thread."
26:24;26:28;"I mean, also, I guess in COVID times, it's like, to be really charitable,"
26:28;26:32;"I could also picture a bunch of older dudes, high risk group for COVID."
26:32;26:33;"Sure, sure."
26:33;26:36;"Maybe Mick is like, I'm dying to go perform again."
26:36;26:41;"And I'm too scared to go do a giant tour, a classic Stones tour"
26:41;26:47;"to stadiums full of 80,000 people singing and spitting in my direction."
26:47;26:49;"Because I'm not going to wear a mask on stage."
26:49;26:54;"And the vaccine is less effective than hoped for."
26:54;26:55;"So maybe Mick is like--"
26:55;26:58;"Then his manager is like, well, you know, Bobby Kraft,"
26:58;27:00;"he's got this offer for you."
27:00;27:01;"Come out to Gillette Stadium."
27:01;27:03;"It's only going to be 300 people in the whole stadium."
27:03;27:05;"Mick's like, let's do it."
27:05;27:06;"COVID wanted us to."
27:06;27:11;"And everyone's going to be vaxxed or have a test or whatever."
27:11;27:13;"The CEO of Moderna is there."
27:13;27:15;"You could actually test 300 people."
27:15;27:16;"Yeah."
27:16;27:17;"I could see that."
27:17;27:18;"Yeah."
27:18;27:20;"And Bob Kraft's like-- and by the way, tell Mick and the guys,"
27:20;27:22;"I don't [BLEEP] around my guest list."
27:22;27:24;"These are serious people, CEO of Moderna."
27:24;27:27;"So you're wondering if people are going to be vaccinated?"
27:27;27:28;"Yeah, there's your answer."
27:28;27:31;"These are the big boys."
27:31;27:34;"Do you think he did a few personally?"
27:34;27:37;"I got booster shots over here."
27:37;27:38;"Get your booster."
27:38;27:40;"Just pass them around."
27:40;27:41;"Find a bar."
27:41;27:44;"Just give people booster shots."
27:44;27:45;"Oh, absolutely."
27:45;27:46;"It's the one-on-one."
27:46;27:50;"You do one shot of tequila, then you get your Moderna booster."
27:50;27:51;"Private Select."
27:51;27:52;"It's like a cut above."
27:52;27:55;"It's like a more pure formula."
27:55;27:57;"Exactly."
27:57;27:59;"Straight from the factory."
27:59;28:00;"Oh, God."
28:00;28:03;"That's such a creepy flex to be like,"
28:03;28:10;"""When I get vaccines, they're administered personally by the CEO of the company."""
28:10;28:12;"Not a trained--"
28:12;28:15;"[LAUGHTER]"
28:15;28:17;"Not a trained medical professional."
28:17;28:18;"You know what?"
28:18;28:19;"I bet that was a good vibe."
28:19;28:22;"Well, I like that we ended on a positive note with that."
28:22;28:25;"I brought it up in sort of a mocking way, and then we talked it through,"
28:25;28:28;"and we found the positive spin."
28:28;28:29;"Yeah, totally."
28:29;28:32;"And for all we know, when Charlie was alive, he was on the email thread,"
28:32;28:34;"and everybody was like, ""Who's in for this?"""
28:34;28:35;"And Charlie was like, ""Hell yeah."
28:35;28:37;"I've been wishing to perform, too."
28:37;28:39;"That sounds great, and I love Bobby Craft."
28:39;28:41;"I would love to honor the man."
28:41;28:42;"I'm so in."""
28:42;28:46;"And then, you know, life throws some curveballs, and, you know,"
28:46;28:48;"he's sicker than he thought."
28:48;28:50;"And maybe the guys were like, ""You know, Charlie wanted to do this gig."
28:50;28:52;"Let's go f---ing do it."""
28:52;28:56;"Charlie's a rock-solid drummer, very professional, always showing up."
28:56;28:59;"I wouldn't say they necessarily dishonored him."
28:59;29:01;"Maybe that's just the future of gigs."
29:01;29:03;"300 people in a stadium."
29:03;29:07;"Dark."
29:42;29:49;"So anyway, back to ABBA."
29:49;29:51;"They dropped two new singles."
29:51;29:53;"Well, I just got to also double-check."
29:53;29:54;"What does this mean that these are--?"
29:54;29:58;"Okay, we need some backstory, because there is something where it's like,"
29:58;30:01;"I guess they have a new album called Voyage."
30:01;30:05;"Both songs were recorded in 2018 and were planned as single releases."
30:05;30:09;"However, ABBA expanded the singles into an album called Voyage."
30:09;30:11;"Okay, so am I missing any element of this?"
30:11;30:16;"Because I know that they're planning a tour that they won't actually perform in."
30:16;30:17;"Right?"
30:17;30:19;"They're doing a tour, a hologram tour?"
30:19;30:20;"Really?"
30:20;30:23;"Promotion for the album will include a concert series where the band will"
30:23;30:26;"perform as digital avatars of their younger selves,"
30:26;30:31;"performing as they looked in 1979, three years before the band split."
30:31;30:35;"Yeah, they were like, ""What era should we choose for our bodies?"
30:35;30:39;"Should we just pick up '82, year after?"""
30:39;30:41;"And they're just like, ""Let's dial back a few years."""
30:41;30:42;"Let's go to the prime."
30:42;30:44;"""Make it '79. We're in our f***ing peak."""
30:44;30:46;"That's real Black Mirror stuff."
30:46;30:50;"The musicians spent five weeks performing 22 songs in the 90-minute setlist"
30:50;30:53;"in order for the crew to capture every mannerism in motion"
30:53;30:55;"with performance capture techniques."
30:55;30:57;"So it's a little bit of an Irishman thing."
30:57;31:00;"They're going to de-age them."
31:00;31:01;"Oh, yeah."
31:01;31:04;"Like, they're new performances, but then they're de-aged."
31:04;31:05;"Right."
31:05;31:09;"And then I don't understand, if you go to the show, what are you looking at?"
31:09;31:11;"You're just at a hologram?"
31:11;31:13;"You're looking at holograms."
31:13;31:15;"I've never seen one of those in person."
31:15;31:18;"Well, you've seen the pictures of the first one that most people saw,"
31:18;31:21;"which was a Tupac hologram at Coachella."
31:21;31:22;"Right."
31:22;31:25;"But you know, the hologram appears to be life-size on the stage."
31:25;31:27;"Right. I mean, it looked like a hologram."
31:27;31:28;"It didn't-- Yeah."
31:28;31:30;"Well, it looks like someone's walking around,"
31:30;31:31;"but the idea is that--"
31:31;31:34;"I mean, as weird as it is to bring back someone from the dead,"
31:34;31:38;"there's something very weird about just wanting to go back to your prime"
31:38;31:39;"when you're alive."
31:39;31:40;"It's heavy."
31:40;31:41;"Yeah."
31:41;31:44;"A team of 850 people from Industrial Light & Magic"
31:44;31:46;"are building the concert experience"
31:46;31:49;"using the same technology used in Star Wars and Lord of the Rings."
31:49;31:50;"Whoa."
31:50;31:53;"The band thought their motion capture suits were so cool,"
31:53;31:56;"they released press photos of the members wearing them."
31:56;31:57;"Yeah, this is weird."
31:57;31:59;"I mean, this is going to be a big deal."
31:59;32:01;"I wonder if it's going to do well."
32:01;32:05;"Well, it says the band's TikTok account amassed 991,000 followers"
32:05;32:08;"and 5.5 million likes two days after creating the account."
32:08;32:11;"So I think the appetite for ABBA is there."
32:11;32:13;"I think they span the generations."
32:13;32:15;"People are going to roll out."
32:15;32:18;"Yeah, they've been marketing stuff for decades, as discussed,"
32:18;32:21;"so maybe they're feeling confident about this."
32:21;32:23;"You know, it raises an interesting--"
32:23;32:24;"Yeah?"
32:24;32:26;"I was going to say, it raises an interesting question"
32:26;32:28;"because if you're in a massive show"
32:28;32:31;"and you're sitting nowhere near the performer,"
32:31;32:35;"it's like, are you there to be in the same room"
32:35;32:38;"as Stevie Nicks or Mick Jagger or whatever?"
32:38;32:42;"Or is it just to experience the music and the vibe and--"
32:42;32:43;"The atmosphere."
32:43;32:47;"--and the whole festival element of it?"
32:47;32:50;"This really pushes that question to the fore"
32:50;32:53;"because you're not in the same room with the ABBA people"
32:53;32:56;"and then you're watching a movie, basically."
32:56;33:00;"Yeah, you're watching a 3D immersive film."
33:00;33:01;"Yeah."
33:01;33:02;"But I was just thinking,"
33:02;33:06;"you know who's going to be watching the whole rollout very closely,"
33:06;33:08;"seeing what works, what doesn't work,"
33:08;33:10;"how this plays out is Mick Jagger."
33:10;33:12;"I'm sure he heard about this and is just like,"
33:12;33:14;"""I want to know everything about this,"""
33:14;33:16;"because I'm sure he's a little bit split"
33:16;33:19;"because on the one hand, Mick is out there--"
33:19;33:23;"Famously, he goes just as hard, if not harder, on stage"
33:23;33:25;"as he's gotten older."
33:25;33:27;"So for him, it's kind of like a badge of honor"
33:27;33:31;"that it is flesh and blood, Mick Jagger,"
33:31;33:34;"same physique, same moves, same voice,"
33:34;33:36;"and that he's out there doing it."
33:36;33:39;"And I wonder if he looks at this and he's like,"
33:39;33:42;"""This is satanic. This is cheating."""
33:42;33:44;"Or if he looks at it and says, ""Hmm,"
33:44;33:46;"""I could get into some of this s--t."""
33:46;33:47;"He's a shrewd businessman."
33:47;33:49;"He just played Bob Craft's Birthday."
33:49;33:50;"Yeah."
33:50;33:52;"This really is like, ""Okay, we're going to--"
33:52;33:53;"""When the classic rock--"
33:53;33:56;"""When the final classic rock icons are dead,"
33:56;33:58;"""this is how it'll continue."""
33:58;34:00;"We will be living with the music"
34:00;34:03;"of all of those '60s and '70s legends"
34:03;34:05;"for the rest of our lives."
34:05;34:07;"They could do a whole digital Woodstock."
34:07;34:09;"It looks like there has been some prototype"
34:09;34:11;"of a Mick Jagger hologram."
34:11;34:15;"Five years ago, the hologram--"
34:15;34:17;"A company called Hologram USA"
34:17;34:19;"that did the Tupac hologram"
34:19;34:21;"did a showcase at,"
34:21;34:23;"looks like, the Beverly Hills Hotel."
34:23;34:25;"Mick Jagger, Mariah Carey, Janet Jackson,"
34:25;34:27;"Frank Sinatra, and Jimmy Kimmel"
34:27;34:28;"were all part of this."
34:28;34:30;"So I assume that Mick Jagger"
34:30;34:32;"would have had to give his permission"
34:32;34:34;"for his likeness to be used for this."
34:34;34:37;"Hmm. Mick likes the tech."
34:37;34:39;"He's not ready to sign on for the live tour,"
34:39;34:41;"but Mick likes the tech."
34:41;34:43;"And I'd love to get you guys in a room together"
34:43;34:46;"just to--you know, he'd love to pick your brain."
34:46;34:48;"So, you know, let's talk again next month"
34:48;34:50;"'cause Mick likes the tech."
34:50;34:51;"[laughs]"
34:51;34:52;"How about this?"
34:52;34:53;"They could start to phase it in"
34:53;34:56;"where after the Bobcraft birthday party,"
34:56;34:58;"Mick is realizing, you know,"
34:58;35:00;"coronavirus, it's endemic,"
35:00;35:01;"it's not going anywhere."
35:01;35:03;"He says, ""How about this?"
35:03;35:06;"""We play a stadium the night before."
35:06;35:08;"""We build the stage, bring all the gear,"
35:08;35:10;"""all the sh*t we need,"
35:10;35:12;"""and we play the stadium one night"
35:12;35:14;"""for 300 CEOs."""
35:14;35:16;"People could shell out, you know,"
35:16;35:19;"$500,000 a ticket, a million dollars, whatever."
35:19;35:20;"And then the next night,"
35:20;35:23;"you can fill the stadium to the f*cking rafters"
35:23;35:26;"and we'll have the digital avatars play."
35:26;35:29;"I'm on to the next city, enjoying myself,"
35:29;35:32;"and, you know, repeat over and over again."
35:32;35:34;"And the optics of that are really bad."
35:34;35:36;"Yeah, I mean, Mick and Keith are not going to play"
35:36;35:38;"for those savages anymore."
35:38;35:40;"Yeah, it's like, let those guys get the virus."
35:40;35:43;"The publicist is going to raise the point you just raised."
35:43;35:45;"But, you know, lucky for us,"
35:45;35:46;"and the Stones organization,"
35:46;35:49;"we have the COVID-19 pandemic."
35:49;35:52;"You want these legends, these absolute legends,"
35:52;35:54;"to go perform in a risky environment?"
35:54;35:55;"No, no, no."
35:55;35:57;"They could not possibly perform"
35:57;35:59;"for more than 300 people in a stadium"
35:59;36:01;"in flesh and blood."
36:01;36:02;"And of course, those 300 people"
36:02;36:04;"are going to have to be extraordinarily wealthy."
36:04;36:08;"But we do care so much about our average Joe fans,"
36:08;36:10;"the people who made the Stones what they are,"
36:10;36:13;"that we have invested heavily in new technology"
36:13;36:16;"to give them the show of their life the night after."
36:16;36:17;"Everybody wins."
36:17;36:20;"It breaks our hearts that we can't go play for you,"
36:20;36:22;"but I think they could sell it."
36:22;36:23;"And they could probably figure out a way"
36:23;36:24;"to make even more money that way."
36:24;36:28;"I think Mick and Keith have been secretly recording concerts"
36:28;36:32;"on a soundstage in case one of them goes."
36:32;36:34;"And that way, it's sort of like people"
36:34;36:36;"who freeze their genetic material"
36:36;36:38;"for possible reproduction in the future."
36:38;36:42;"This way, you know, they have their performances"
36:42;36:45;"and people then can, after they're gone,"
36:45;36:46;"turn them into holograms"
36:46;36:49;"and the Stones can live forever."
36:49;36:52;"I think it's already happened in a bunker underground."
36:52;36:54;"And certainly all their kids will be interested"
36:54;36:57;"in keeping the memory alive."
36:57;36:58;"I mean, that's a great idea."
36:58;37:03;"I mean, if there's just like 600 new live versions"
37:03;37:05;"and they can just go on after they're dead"
37:05;37:06;"and every time you go,"
37:06;37:08;"""Well, we've never seen this version before."""
37:08;37:12;"Yeah, they have to do like every song in their catalog."
37:12;37:13;"So they can really mix it up."
37:13;37:17;"They've got to do like variations on stage banter."
37:17;37:18;"I bet they're already working on this."
37:18;37:20;"I bet they've been working on this for years, secretly."
37:20;37:24;"I wonder if they could create an AI Jerry"
37:24;37:26;"that would actually like jams."
37:26;37:28;"Solo like Jerry?"
37:28;37:31;"Yeah, never before heard jams."
37:31;37:32;"You could totally do that."
37:32;37:36;"John Perry Barlow, love technology and the internet."
37:36;37:38;"Jerry loves the tech."
37:38;37:39;"Jerry loves the tech."
37:39;37:44;"(laughing)"
37:44;37:46;"But let's get to the songs."
37:46;37:47;"Yeah, okay."
37:47;37:48;"So I just want to double check"
37:48;37:51;"that the songs are not AI generated or something."
37:51;37:53;"This tour is kind of on some new tech,"
37:53;37:57;"but these songs were made traditionally ABBA style."
37:57;38:00;"They're written, I assume by Bjorn and Benny."
38:00;38:02;"Okay, here we go."
38:02;38:04;"Quote from guitarist Bjorn."
38:04;38:06;"""The first song, 'I Still Have Faith In You,'"
38:06;38:08;"when Benny Anderson played the melody,"
38:08;38:10;"I knew it just had to be out of us."
38:10;38:12;"It's about relaxing."
38:12;38:14;"That's inconceivable to be where we are."""
38:14;38:15;"I don't know what he's saying."
38:15;38:17;"""No imagination could dream that up."""
38:17;38:18;"I don't know."
38:18;38:19;"That was a kind of incoherent quote,"
38:19;38:22;"but basically he heard his friend play a melody"
38:22;38:24;"and he was like, ""Let's do this."""
38:24;38:25;"Oh, and I like this part."
38:25;38:28;"""To release a new album after 40 years"
38:28;38:29;"and still be the best of friends"
38:29;38:31;"and still be enjoying each other's company"
38:31;38:32;"and have total loyalty?"
38:32;38:34;"Who has experienced that?"
38:34;38:35;"Nobody."""
38:35;38:36;"Okay."
38:36;38:37;"Nobody."
38:37;38:38;"So Bjorn and Benny still going strong."
38:38;38:40;"You know, probably because"
38:40;38:42;"they went into the business business."
38:42;38:43;"They got out of the music business"
38:43;38:45;"and they went into the business business"
38:45;38:46;"in a timely fashion."
38:46;38:47;"All right, throw it on."
38:47;38:49;"Let's hear ""I Still Have Faith In You."""
38:49;38:51;"New music from ABBA."
38:51;38:59;"♪"
38:59;39:04;"♪ I still have faith in you ♪"
39:04;39:08;"♪ I see it now ♪"
39:08;39:09;"Sounds like ABBA."
39:09;39:14;"♪ Through all these years that faith lives on ♪"
39:14;39:17;"♪ Somehow ♪"
39:17;39:23;"♪ There was a union ♪"
39:23;39:27;"♪ A part of mine ♪"
39:27;39:33;"♪ The likes of which are rare and oh so hard ♪"
39:33;39:38;"♪ To find ♪"
39:38;39:42;"♪ Do I have it in me? ♪"
39:42;39:47;"♪ I believe it is in there ♪"
39:47;39:52;"♪ For I know I hear a bittersweet song ♪"
39:52;39:56;"♪ In the memories we share ♪"
39:56;40:02;"♪ I still have faith in you ♪"
40:02;40:07;"♪ And I will say ♪"
40:07;40:15;"♪ I never really thought I'd feel this way ♪"
40:15;40:21;"♪ But I remind myself ♪"
40:21;40:25;"♪ Of who we are ♪"
40:25;40:36;"♪ How inconceivable it is to reach this far ♪"
40:36;40:40;"♪ Do I have it in me? ♪"
40:40;40:45;"♪ I believe it is in there ♪"
40:45;40:50;"♪ For I know I hear a bittersweet song ♪"
40:50;40:55;"♪ In the memories we share ♪"
40:55;40:57;"♪ We do, and we need this ♪"
40:57;41:00;"Yeah, here we go."
41:00;41:01;"♪ This we require ♪"
41:01;41:02;"A plus."
41:02;41:04;"I'm in."
41:04;41:07;"♪ The joy and the sorrow ♪"
41:07;41:09;"♪ We have a story ♪"
41:09;41:14;"♪ And it's a rhyme ♪"
41:14;41:19;"♪ And we need one another ♪"
41:19;41:24;"♪ Like one, two, three ♪"
41:24;41:26;"♪ We need this together ♪"
41:26;41:28;"This sounds like they recorded it in 1981."
41:28;41:32;"Those drum sounds, like, kind of in the Air Tonight style."
41:32;41:36;"♪ I still have faith in you ♪"
41:36;41:40;"Yeah, they're not trying to, like, keep up with new trends."
41:40;41:45;"Imagine if the first ABBA song back was, like, Pop Trap."
41:45;41:47;"Oh, my God."
41:47;41:49;"Guess verse from Post Malone."
41:49;41:51;"[laughs]"
41:51;41:53;"Go right with Post."
41:53;41:57;"♪ Do I have it in me? ♪"
41:57;41:58;"♪ I believe it is in there ♪"
41:58;42:01;"This reminds me kind of like of, like, late Bruce Springsteen."
42:01;42:05;"He still knows how to make songs that have the energy of, like,"
42:05;42:10;"when Bruce still drops the glockenspiel in, like, a 2010s-era song."
42:10;42:13;"You're like, ""All right, yeah, you're still right in that tradition."
42:13;42:15;"It sounds like you."""
42:15;42:17;"I mean, these melodies are so ABBA."
42:17;42:20;"Yeah, if you told me that they started writing this song back then,"
42:20;42:21;"I'd totally believe it."
42:21;42:26;"And it makes sense that, like, they could still write the same exact sort of melodies"
42:26;42:28;"that they could 40 years ago."
42:28;42:32;"They're maybe not performed with the same, like, intensity,"
42:32;42:34;"although those choruses sound--"
42:34;42:35;"Yeah, although I like--"
42:35;42:38;"Choruses sound like classic, soaring ABBA."
42:38;42:39;"The voices sound great."
42:39;42:40;"Yeah."
42:40;42:42;"And it has a little bit of, like, an older--"
42:42;42:45;"you can tell the slightly richer quality."
42:45;42:48;"Yeah, the verse, she's seen really in that, like, low register,"
42:48;42:51;"which strikes me as very, like, older person,"
42:51;42:55;"like late period Dylan or something, or late Leonard Cohen."
42:55;42:56;"Just, like, so low."
42:56;42:57;"Yeah."
43:28;43:30;"What a set of pipes."
43:30;43:31;"Yeah."
43:31;43:32;"Truly--"
43:32;43:36;"Is it Agnetha was kind of, like, the lead singer?"
43:36;43:40;"I don't even know the names of the people in the band, I've got to be honest."
43:40;43:45;"Well, one way to remember it is that ABBA is their initials, A-B-B-A."
43:45;43:46;"Oh, wow."
43:46;43:47;"I'm sure I'm not--"
43:47;43:52;"Apologies to any Swedish people, but it's Agnetha, or maybe Agnetha, Bjorn,"
43:52;43:54;"Benny, and Anni-Frid."
43:54;43:55;"Hmm."
43:55;43:58;"But, yeah, Agnetha, just truly a magical performer."
43:58;44:01;"And I feel like she gets left out of the conversation a little bit,"
44:01;44:03;"because she was, like, you know, in this group,"
44:03;44:05;"but truly one of the best pop vocalists of all time."
44:05;44:07;"And she still sounds great."
44:07;44:11;"I want to go have a close listen by myself later, really."
44:11;44:15;"Go take a long walk, feel the autumn breeze,"
44:15;44:18;"and really take in that song, because I liked what I heard."
44:18;44:21;"And also, it's a moving sentiment, first single in 40 years,"
44:21;44:23;"and what did you come back to say?"
44:23;44:24;"I still have faith in you."
44:24;44:27;"Well, Abba, we still have faith in you,"
44:27;44:30;"and so does the younger generation, because we taught them well."
44:30;44:33;"We taught them to be fans of you, and we will be there."
44:33;44:37;"Grandparents, parents, children, grandchildren, great-grandchildren"
44:37;44:41;"will be there all together to watch your digital avatars perform"
44:41;44:43;"in stadiums across the world."
44:43;44:47;"They refer to those avatars as ""abatars,"" just to add a little color."
44:47;44:50;"The universe wanted it to happen, avatars."
44:50;44:55;"I wonder also, given that Bjorn and Benny seem like such keen investors"
44:55;44:58;"and business people, I wonder if they own any of the tech."
44:58;45:01;"Maybe they're reaching out to Mick and just being like,"
45:01;45:03;"""Mick, come down, see the rehearsals."
45:03;45:05;"You're going to want a piece of this."
45:05;45:07;"We'll give you a deal."""
45:07;45:09;"All right, should we listen to the other one, ""Don't Shut Me Down""?"
45:09;45:11;"I'm way down."
45:11;45:15;"A while ago I heard the sound of children's laughter"
45:15;45:20;"Now it's quiet, so I guess they left the park"
45:20;45:24;"This wooden bench is getting harder by the hour"
45:24;45:28;"The sun is going down, it's getting dark"
45:28;45:31;"This is pretty one-of-us energy."
45:31;45:33;"The rain begins to pour"
45:33;45:35;"As I watch the windows shut"
45:35;45:39;"So is it the same singer that sings lead on all the songs?"
45:39;45:41;"I think she almost always sang lead."
45:41;45:43;"I see."
45:43;45:48;"It's time at last to let him know"
45:48;45:50;"Oh, yes!"
45:50;45:52;"Hell yeah."
45:52;45:59;"This could have been on the last Daft Punk album."
45:59;46:04;"Or like, Ace of Base."
46:04;46:07;"That light-speeded reggae."
46:07;46:10;"And you wonder why I'm here today"
46:11;46:13;"And so you should, I would"
46:13;46:20;"When I left I felt I'd had enough"
46:20;46:26;"But in this shape and form I appear now"
46:26;46:29;"I have lived and hoped and loved and hoped"
46:29;46:33;"It's why I am here now"
46:36;46:41;"And now you see another me I've been reloading, yeah"
46:41;46:45;"I'm fired up, don't shut me down"
46:45;46:50;"I'm like a dream within a dream that's been decoded"
46:50;46:54;"I'm fired up, I'm hooked, don't shut me down"
46:54;46:57;"I'm not the one you knew"
46:57;46:59;"I'm now a mental mind"
46:59;47:02;"And I'm asking you to let me know"
47:02;47:05;"I mean, it's very obvious, but I've never had this conscious thought."
47:05;47:09;"But Abba was like the European counterpart to the Bee Gees."
47:09;47:12;"I just never even... Duh!"
47:12;47:14;"It's so Saturday Night Fever vibe."
47:14;47:17;"And like those high, those beautiful high harmonies."
47:17;47:22;"Yeah, arguably the Bee Gees have a similar relationship to Australia"
47:22;47:25;"that Abba has to Sweden."
47:25;47:28;"True. National heroes."
47:28;47:30;"Yeah."
47:34;47:37;"The apartment hasn't changed at all"
47:37;47:40;"I've got to say I'm glad"
47:40;47:44;"I like the thing about the Bee Gees and AC/DC hanging out at some point."
47:44;47:48;"Just like Australian rock royalty."
47:48;47:52;"Yeah, probably the first ten years of AC/DC it never would have happened."
47:52;47:56;"But then by the 90s they're basically all just rich people at the same party."
47:56;47:58;"Totally."
47:58;48:01;"Just Angus Young being like..."
48:01;48:04;"Barry, where do you keep your boat, man?"
48:04;48:07;"I'm having a hell of a time finding a good regatta in Sydney."
48:07;48:10;"Or in the Melbourne area."
48:10;48:12;"Keep it real with me, man."
