Start Timestamp;End Timestamp;Transcript
48:12;48:16;"During the 80s I got behind on my dues with the Sydney Yacht Club."
48:16;48:19;"And turned into a whole situation."
48:19;48:22;"And I'm looking for a new spot."
48:22;48:25;"Yeah, don't make the mistakes I made, dude."
48:25;48:30;"I'm asking you to have an open mind"
48:30;48:35;"I've got to say this time around"
48:35;48:40;"I'm fired up, don't shut me down"
48:40;48:45;"Ask me not to leave when here I am again"
48:45;48:50;"And I've got this feeling so I won't pretend"
48:50;48:55;"Seinfeld, are these songs ripping up the charts? At least in Sweden?"
48:55;49:00;"Yeah, these two singles, they've raced to the top of the streaming charts."
49:00;49:07;"They were first and third place on YouTube's trending rankings in 12 countries."
49:07;49:11;"On Friday, September 3rd, including the UK."
49:11;49:16;"4.4 million views for the first one we listened to. 1.4 million."
49:16;49:21;"Ok, I still have faith in you made it to number 2 on the Swedish charts."
49:21;49:23;"That's gotta feel good."
49:23;49:25;"Also number 3 in Germany."
49:25;49:28;"I guess that was the A side and Don't Shut Me Down was the B side."
49:28;49:31;"Oh no, Don't Shut Me Down made it to number 1 in Sweden."
49:31;49:36;"So ABBA had the number 1 and number 2 song in Sweden that week."
49:36;49:42;"They also broke Universal Music UK's record for biggest ever pre-order with this album."
49:42;49:46;"Wow, first album in 40 years. Unreal."
49:46;49:51;"Excited, we're going to be keeping our eyes on the whole rollout here at Time Crisis."
49:51;49:53;"ABBA, we're behind you."
49:53;49:59;"I bet they got a hell of a backlog of songs like, ""Oh man, I wrote this great melody 12 years ago."""
49:59;50:00;"Oh yeah, totally."
50:00;50:02;"I don't know where to put it, you know what I mean?"
50:02;50:04;"They probably amassed so much great material."
50:04;50:07;"Just busting out a 4-track tape from '95."
50:07;50:08;"Yeah."
50:08;50:13;"Just like, ""Oh yeah, this one. This one's great. This is going to be a monster album."""
50:13;50:17;"Oh yeah, 40 years of material just picking the cream of the crop."
50:17;50:19;"I cannot wait for Voyage."
50:19;50:22;"Alright, when's this dropping? November. Okay."
50:22;50:23;"Alright, what's it be?"
50:23;50:25;"I'm sure we'll get some more singles before then."
50:25;50:28;"Can you hear the drums, Fernando?"
50:28;50:35;"I remember long ago another starry night like this"
50:35;50:41;"In the choir like Fernando"
50:41;50:46;"You were humming to yourself and softly strumming your guitar"
50:46;50:53;"I could hear the disco drums and sounds of bugle calls were coming from afar"
50:54;50:58;"They were close now Fernando"
50:58;51:04;"Every hour, every minute seemed to last eternally"
51:04;51:10;"I was so afraid Fernando"
51:10;51:15;"We were young and full of life and none of us prepared to die"
51:15;51:23;"And I'm not ashamed to say the roar of guns and cannons almost made me cry"
51:23;51:27;"There was something in the air that night"
51:27;51:31;"The stars were bright Fernando"
51:31;51:36;"They were shining there for you and me"
51:36;51:40;"For liberty, Fernando"
51:40;51:44;"Though we never thought that we could lose"
51:44;51:47;"There's no regret"
51:47;51:51;"If I had to do the same again"
51:51;51:56;"I would, my friend, Fernando"
51:56;52:00;"If I had to do the same again"
52:00;52:04;"I would, my friend, Fernando"
52:04;52:07;"Okay, so I just want to read this email real quick."
52:07;52:09;"We got a cool email from Brandon."
52:09;52:11;"It's called Soul Movie Number Crunch."
52:11;52:15;"Hello Crisis Crew. When I looked up my soul movie, it was Titanic."
52:15;52:18;"And I remember that was one of the longest running movies at number one."
52:18;52:20;"So I ran a soul movie number crunch."
52:20;52:23;"Titanic was at number one for 15 weeks straight."
52:23;52:28;"So everyone born at the end of 1987 or the first quarter of 1988 has the same soul movie."
52:28;52:32;"It's important people. Sometimes you're going to share your soul movie with a lot of people."
52:32;52:36;"You could consider that lucky, unlucky, look at it however you want."
52:36;52:40;"But if you were born 10 years before a major hit film,"
52:40;52:43;"you're going to share the same soul movie as a lot of people."
52:43;52:46;"So Brandon looked up who he shared a soul movie with."
52:46;52:50;"It includes people like Rihanna, FKA Twigs, Big Sean, and Steph Curry."
52:50;52:54;"I wonder how sharing Titanic as a soul movie has influenced all of us."
52:54;53:00;"Well, it's, you know, if Brandon, it's kind of like, you know, it's like astrology or something."
53:00;53:03;"Does your sign and your moon and all those things influence your life?"
53:03;53:07;"Yes, to a big extent. Does that mean you don't have free will?"
53:07;53:12;"Of course not. People with the same sign, born at the same time, same place, same soul movie."
53:12;53:14;"There's going to be room for deviation."
53:14;53:18;"But the fact that Rihanna, FKA Twigs, Big Sean, and Steph Curry all have the same soul movie."
53:18;53:21;"I mean, I think that says something right there."
53:21;53:25;"They're all incredibly popular people, entertainers."
53:25;53:27;"Steph Curry is an athlete."
53:27;53:30;"He looked up what other soul movies had long stretches at number one."
53:30;53:32;"ET had a lot of weeks at number one in '82."
53:32;53:36;"So a lot of people born in '72 are going to have ET as their soul movie."
53:36;53:40;"From December 9th, '84 to March 3rd, '85, Beverly Hills Cop was number one,"
53:40;53:45;"making it the soul movie of Dax Shepard, Thomas Bangalter of Daft Punk,"
53:45;53:51;"Bradley Cooper, Big Boy from Outkast, Wes Borland from Limp Bizkit, and Drew Barrymore."
53:51;53:53;"Esteemed company there."
53:53;53:56;"All those people do have a lot in common."
53:56;54:01;"From November 18th, 1990 to February 3rd, 1991, Home Alone was the number one movie."
54:01;54:06;"It was the soul movie to Ryan Gosling, Christina Aguilera, Jake Gyllenhaal, Eliza Dusko,"
54:06;54:12;"rapper Mike Jones, Jared Kushner, Pitbull, Alicia Keys, Elijah Wood, and Justin Timberlake."
54:12;54:15;"That's some of the data. Now I'll turn it to you guys for analysis."
54:15;54:17;"Brandon from Phoenix. This is a great email."
54:17;54:22;"It doesn't surprise me that Ryan Gosling and Jared Kushner would have the same soul movie."
54:22;54:26;"I mean, just look. You get that essence, that soul essence."
54:26;54:30;"And the fact that it was Home Alone, I mean, we could spend hours talking about it,"
54:30;54:34;"but we have to get in the top five because we have a very special guest."
54:34;54:39;"We've got actress, writer, director, producer, Rashida Jones."
54:39;54:41;"She's calling back in for the top five."
54:41;54:48;"And if anybody remembers, she was on in late 2020 for the top five."
54:48;54:54;"And when she comes through, we tend to turn it into a Gen X top five, rock versus R&B thing"
54:54;55:00;"because two of the most important Gen X people in my life are Rashida and Jake."
55:00;55:04;"Jake's more of a rock guy. She's more of a R&B fan."
55:04;55:09;"It's perfect. It's a great way to get two Gen X icons together."
55:09;55:15;"But it's important to note that, you know, the people who make the art for a generation,"
55:15;55:19;"they tend to be almost a little bit out of that generation."
55:19;55:22;"A true Gen Xer was listening to that music."
55:22;55:26;"I mean, the people making that music, they were like borderline boomers."
55:26;55:29;"Some of them are very early Gen X."
55:29;55:36;"Just like we've discussed, the big boomer rock stars were actually all born before the baby boom started."
55:36;55:38;"They were wartime babies."
55:38;55:40;"Yeah, we're babies."
55:40;55:42;"But anyway, let's welcome her back to the program."
55:42;55:47;"Let's get Rashida on the horn and we'll get into a very special Gen X top five."
55:47;55:52;"Now, let's go to the Time Crisis Hotline."
55:52;55:55;"What's up?"
55:55;55:58;"Hi, welcome back to the program."
55:58;56:02;"So my first question for you, do you know what a soul movie is?"
56:02;56:04;"A soul movie?"
56:04;56:07;"Yeah, it's a very important concept to me at least."
56:07;56:09;"Like a black exploitation movie?"
56:09;56:12;"Oh, interesting guess, no."
56:12;56:16;"Well, your soul movie, for instance, is Down and Out in Beverly Hills."
56:16;56:18;"Does that movie mean anything to you?"
56:18;56:21;"Oh, it's like the year I was something?"
56:21;56:26;"Yes, it's the number one movie the year you turned 10."
56:26;56:28;"Oh, interesting."
56:28;56:30;"Yeah, that movie does mean something to me."
56:30;56:31;"I love that movie."
56:31;56:33;"Down and Out in Beverly Hills?"
56:33;56:35;"Yeah, I've actually never seen it."
56:35;56:37;"I love the makeover scene."
56:37;56:38;"I like the makeover scene of any movie."
56:38;56:40;"Who gets a makeover in that movie?"
56:40;56:45;"You know, Nick Nolte, because he's down and out and then they fix him up."
56:45;56:47;"Oh, have you guys ever seen this movie?"
56:47;56:48;"Oh, really?"
56:48;56:49;"No, not familiar."
56:49;56:51;"Is he like a bum and they fix him?"
56:51;56:52;"Yeah."
56:52;56:53;"He's like, ""Oh, I'm Nick Nolte."""
56:53;56:55;"You know, just weird gravity."
56:55;56:56;"I was trying to do a Nolte."
56:56;57:00;"It's a terrible class-dis movie."
57:00;57:03;"Is this like a Dirty Rotten Scoundrels vibe almost?"
57:03;57:06;"No, no, it's more earnest than that, because he's like,"
57:06;57:08;"""I can't remember everything because I was 10."""
57:08;57:13;"But he gets a makeover and then I feel like whatever crazy rich family"
57:13;57:17;"I remember the wife has the hots for him and tries to--"
57:17;57:19;"Played by Bette Midler."
57:19;57:21;"Oh, yeah. It's been a long time."
57:21;57:22;"From what I can see."
57:22;57:24;"Well, anyway, so that's your soul movie."
57:24;57:29;"Are you aware of the kind of political implications of the soul movie?"
57:29;57:30;"No."
57:30;57:32;"I haven't told you about any of this?"
57:32;57:34;"No. Have we met?"
57:34;57:37;"Have you been keeping up with Time Crisis?"
57:37;57:39;"That's maybe my mistake. No."
57:39;57:42;"Did you miss out on the last 10 episodes?"
57:42;57:43;"No."
57:43;57:46;"Earlier this year, the Biden administration announced"
57:46;57:50;"that you had to go watch or re-watch your soul movie"
57:50;57:53;"by the end of 2021."
57:53;57:54;"It's a mandate."
57:54;57:57;"Oh, wow. Like a vaccine mandate plus watch that movie."
57:57;57:59;"He's been a little bit vague about exactly why,"
57:59;58:03;"but he's brought it up many times in some of his speeches."
58:03;58:06;"And he's even in some of his meetings in the past couple weeks"
58:06;58:10;"with all the world leaders coming to the U.S. for the UN Assembly."
58:10;58:13;"He's also trying to encourage Boris Johnson to implement it in the U.K."
58:13;58:15;"He wants it to be a global thing,"
58:15;58:17;"but it's very important that you got to watch your soul movie"
58:17;58:19;"or re-watch it by the end of the year."
58:19;58:20;"I have a question about that."
58:20;58:21;"Yeah."
58:21;58:23;"If you're from the U.K., do you watch the movie"
58:23;58:26;"that was number one in the country that you were raised in?"
58:26;58:29;"That's a bit of a diplomatic issue."
58:29;58:31;"I don't think they've fully hashed it out yet."
58:31;58:33;"Right. It'll be interesting to see what happens."
58:33;58:36;"I mean, I think he said it was a project towards national unity."
58:36;58:39;"People from all different political stripes"
58:39;58:41;"are going to share the same soul movie."
58:41;58:43;"And if everyone watches their soul movie"
58:43;58:46;"and then they talk to someone from across the aisle"
58:46;58:51;"who shares that soul movie, then you can bond."
58:51;58:54;"It's like they used to get drinks after work."
58:54;58:56;"All the congressmen used to do that."
58:56;58:57;"So now it's the soul movie."
58:57;58:58;"Right."
58:58;59:01;"Maybe Mitch McConnell and Chuck Schumer have the same soul movie."
59:01;59:03;"Exactly. And people love talking about movies."
59:03;59:04;"That's what I was thinking."
59:04;59:06;"I think that's part of it."
59:06;59:09;"Also, to bring you up to speed, have you heard the new ABBA singles?"
59:09;59:11;"No, I have not."
59:11;59:12;"I'm going to play them for you later."
59:12;59:14;"They're pretty good, actually."
59:14;59:17;"They just dropped their first two singles in 40 years."
59:17;59:23;"Wow. And are they similar in genre and production quality"
59:23;59:26;"as the thing that they're beloved for?"
59:26;59:27;"Very much."
59:27;59:30;"It's as if the 40 years didn't even happen."
59:30;59:32;"It really sounds like classic ABBA."
59:32;59:34;"People need that right now."
59:34;59:36;"Don't they?"
59:36;59:39;"It really is. It's moving hearing that again."
59:39;59:41;"And you're a fan, right?"
59:41;59:43;"I am a fan. Yeah. I don't have a deep..."
59:43;59:46;"I'm not a Mamma Mia head, you know?"
59:46;59:50;"But I love Sweden."
59:50;59:53;"And I really enjoy their music. I find it very fun."
59:53;59:57;"But I know from you that it has a lot of dark undertones."
59:57;59:59;"Have you been to the ABBA museum?"
59:59;01:00:01;"No, I haven't."
01:00:01;01:00:03;"All right. Bucket list."
01:00:03;01:00:09;"It's time for the Top 5 on iTunes."
01:00:09;01:00:12;"So Gen X Top 5."
01:00:12;01:00:16;"We got two unimpeachable Gen Xers here."
01:00:16;01:00:20;"American Painter and radio host, radio personality,"
01:00:20;01:00:23;"Jake Longstreth, actress, director, producer,"
01:00:23;01:00:25;"writer Rashida Jones."
01:00:25;01:00:30;"And we're doing R&B versus rock, but everybody can chime in."
01:00:30;01:00:32;"I don't even remember. Did we have rules?"
01:00:32;01:00:35;"I'm just trying to basically see if you guys recognize this."
01:00:35;01:00:37;"Yeah. We were just vibing."
01:00:37;01:00:39;"We were just vibing."
01:00:39;01:00:41;"I mean, look, this is a Gen X event."
01:00:41;01:00:46;"We can't bring that kind of hardcore competitive atmosphere"
01:00:46;01:00:48;"of millennials or Gen Z."
01:00:48;01:00:51;"It's a Gen X. It's a laid back Gen X event."
01:00:51;01:00:52;"No rules."
01:00:52;01:00:55;"It's detached. It's ironic. It's unaffected."
01:00:55;01:00:58;"The only rule is no selling out."
01:00:58;01:01:00;"I don't want to see either one of you guys sell out"
01:01:00;01:01:02;"during this time."
01:01:02;01:01:04;"I wouldn't dream of it."
01:01:04;01:01:07;"Okay. Great."
01:01:07;01:01:09;"Okay. So we're going to start with the R&B chart."
01:01:09;01:01:15;"This was number 5 on the R&B chart this week in 1992."
01:01:15;01:01:17;"Good luck, Jake."
01:01:17;01:01:19;"Good luck to you."
01:01:19;01:01:23;"Yes, I got it."
01:01:23;01:01:24;"Yeah?"
01:01:24;01:01:26;"Oh, that's right. We tried to name it."
01:01:26;01:01:29;"Everyday People. Arrested Development?"
01:01:29;01:01:30;"Yes."
01:01:30;01:01:32;"Everyday People?"
01:01:32;01:01:35;"Yeah. Although, interestingly, because they sample"
01:01:35;01:01:37;"Sly and the Family Stones' Everyday People,"
01:01:37;01:01:40;"they called this song People Every Day."
01:01:40;01:01:41;"Smart."
01:01:41;01:01:43;"Yeah."
01:01:43;01:01:53;"You know this song, Jake?"
01:01:53;01:01:55;"Yeah. I remember this."
01:01:55;01:01:57;"I remember the video."
01:01:57;01:01:59;"It's so much slower than I remember."
01:01:59;01:02:01;"I remember being confused when the television show"
01:02:01;01:02:03;"Arrested Development started."
01:02:03;01:02:06;"Because I wasn't familiar with the term Arrested Development"
01:02:06;01:02:09;"as a larger kind of cultural term."
01:02:09;01:02:11;"I just thought there was..."
01:02:11;01:02:13;"Why is this named after the hip-hop group?"
01:02:13;01:02:15;"Yeah. I thought there was a rap group called Arrested Development."
01:02:15;01:02:17;"I was like, ""That's kind of a cool name."""
01:02:17;01:02:21;"I think this is a remix."
01:02:21;01:02:22;"It doesn't sound quite the same."
01:02:22;01:02:24;"It's not the original."
01:02:24;01:02:26;"That's funny because sometimes when we're doing the top 5"
01:02:26;01:02:29;"60s stuff, there'll be an awkward re-record"
01:02:29;01:02:31;"because someone didn't have the rights."
01:02:31;01:02:35;"It's funny to start thinking about that happening with 90s stuff."
01:02:35;01:02:44;"I'm waiting for that sample to come in."
01:02:44;01:02:45;"Yeah."
01:02:45;01:02:47;"It's not going to happen. It's the wrong version."
01:02:47;01:02:49;"Wait, but eventually..."
01:02:49;01:02:51;"Maybe..."
01:02:51;01:02:53;"Eventually, it'll come in."
01:02:53;01:02:55;"Sly Stone will come in and go..."
01:02:55;01:02:57;"Oh."
01:02:57;01:02:59;"Oh, there we go."
01:02:59;01:03:07;"I'm going to just say this is a different version and it's slower."
01:03:07;01:03:09;"Yeah, I was going to say this sounds very slow."
01:03:09;01:03:11;"And the beat is different."
01:03:11;01:03:12;"All right, Matt."
01:03:12;01:03:14;"Can we verify that this is..."
01:03:14;01:03:16;"A 2012 re-record?"
01:03:16;01:03:19;"We got multiple Gen Xers"
01:03:19;01:03:21;"saying this is the sell-out version."
01:03:23;01:03:25;"This is the version that's on Apple Music."
01:03:25;01:03:29;"Very corporate answer there."
01:03:29;01:03:33;"This is the version that's on Apple Music."
01:03:33;01:03:35;"But is it the original version?"
01:03:35;01:03:37;"This is the version that's on Apple Music."
01:03:37;01:03:39;"It is the version from the album."
01:03:39;01:03:41;"Okay, so this is the album version."
01:03:41;01:03:42;"Maybe the remix was the..."
01:03:42;01:03:43;"The single version."
01:03:43;01:03:45;"Maybe there's a single that was different."
01:03:45;01:03:47;"Also, it could be that we're old and we're like..."
01:03:47;01:03:49;"Yeah, this doesn't sound the same."
01:03:49;01:03:51;"We haven't heard this song in like 25 years."
01:03:51;01:03:53;"No, that's no."
01:03:53;01:03:55;"That would be a real Matrix moment."
01:03:55;01:03:57;"I hope not."
01:03:57;01:03:58;"That would be weird."
01:03:58;01:03:59;"Seinfeld what?"
01:03:59;01:04:00;"Seinfeld."
01:04:00;01:04:01;"What are you saying, Seinfeld?"
01:04:01;01:04:02;"The real one is now playing."
01:04:02;01:04:03;"What is this, Matt?"
01:04:03;01:04:05;"I can't hear it."
01:04:05;01:04:07;"Oh, that's really Matrixy."
01:04:07;01:04:08;"I can't hear anything."
01:04:08;01:04:10;"Oh, wait a second because I'm an idiot."
01:04:10;01:04:11;"I'm playing it on my own YouTube."
01:04:11;01:04:12;"That's what's going on."
01:04:12;01:04:13;"I'm sorry."
01:04:13;01:04:14;"I thought that was Matt."
01:04:14;01:04:16;"Oh, you guys can't hear it in my own head?"
01:04:16;01:04:18;"Can you confirm or disconfirm?"
01:04:18;01:04:20;"Seinfeld, what year were you born?"
01:04:20;01:04:21;"'82."
01:04:21;01:04:22;"I'm a Silverback."
01:04:22;01:04:25;"Oh, so you're a true Silverback millennial."
01:04:25;01:04:26;"Yeah."
01:04:26;01:04:31;"Seinfeld, can you confirm or disconfirm that it is a different version?"
01:04:31;01:04:33;"Oh, yeah."
01:04:33;01:04:34;"It's faster."
01:04:34;01:04:35;"The beat goes..."
01:04:35;01:04:36;"Not..."
01:04:36;01:04:37;"Right."
01:04:37;01:04:38;"You know, whatever."
01:04:38;01:04:39;"Yeah."
01:04:39;01:04:40;"Okay."
01:04:40;01:04:41;"Oh, yeah."
01:04:41;01:04:42;"It uses that famous sample."
01:04:42;01:04:43;"Is it that one?"
01:04:43;01:04:44;"Oh, yeah."
01:04:44;01:04:45;"Oh, it's not."
01:04:45;01:04:46;"That's something else."
01:04:46;01:04:47;"I know what you're thinking of."
01:04:47;01:04:48;"It's not that."
01:04:48;01:04:49;"Oh, it's not that?"
01:04:49;01:04:50;"The one that's used for ""Real Love"", Mary J. Blige."
01:04:50;01:04:51;"Yeah."
01:04:51;01:04:52;"No."
01:04:52;01:04:55;"Well, Gen X Top 5 is off to a chaotic start."
01:04:55;01:04:59;"I'm sorry to report that we sold out in the first song."
01:04:59;01:05:00;"Who knows?"
01:05:00;01:05:02;"Maybe there's a sample issue."
01:05:02;01:05:06;"That is something that Gen X has in common with now, which is that there are..."
01:05:06;01:05:09;"Like, the album version isn't always like the lit version."
01:05:09;01:05:10;"Sorry that I just used ""lit."""
01:05:10;01:05:13;"But, like, you know, I remember thinking..."
01:05:13;01:05:15;"You're using Silverback millennial terminology."
01:05:15;01:05:20;"You need to either use modern parlance or a Gen X word."
01:05:20;01:05:21;"Yeah."
01:05:21;01:05:24;"What was the lit of Gen X for the Gen X hip-hop fan?"
01:05:24;01:05:25;"Depends."
01:05:25;01:05:26;"Oh, for hip-hop?"
01:05:26;01:05:27;"Dope?"
01:05:27;01:05:28;"Fat."
01:05:28;01:05:29;"It wasn't the dope version?"
01:05:29;01:05:30;"Fat."
01:05:33;01:05:34;"With a PH."
01:05:34;01:05:35;"That's a little before..."
01:05:35;01:05:36;"Like, if that's late 80s."
01:05:36;01:05:38;"I feel like late 80s into early 90s is fat."
01:05:38;01:05:39;"PH, AT."
01:05:39;01:05:40;"How about tight?"
01:05:40;01:05:42;"Or is that more general usage?"
01:05:42;01:05:43;"Oh, you know what?"
01:05:43;01:05:46;"Actually, I use tight on the Chappelle Show."
01:05:46;01:05:47;"So that's..."
01:05:47;01:05:48;"And that's..."
01:05:48;01:05:49;"That feels..."
01:05:49;01:05:50;"That's like early 2000s."
01:05:50;01:05:51;"Tizzite."
01:05:51;01:05:52;"Tizzite I used."
01:05:52;01:05:53;"So maybe that's..."
01:05:53;01:05:55;"In that post-Snoop Dogg era."
01:05:55;01:05:58;"Well, we know Chappelle is a big fan of 90s hip-hop and R&B."
01:05:58;01:05:59;"Okay."
01:05:59;01:06:02;"Let's get into the number five song from the rock chart."
01:06:04;01:06:05;"Ooh."
01:06:05;01:06:06;"BJ."
01:06:06;01:06:07;"Jeremy."
01:06:09;01:06:11;"Would you have recognized it immediately, Rashida?"
01:06:11;01:06:12;"BJ?"
01:06:13;01:06:14;"PJ."
01:06:16;01:06:17;"Oh, Jeremy."
01:06:17;01:06:18;"Jeremy."
01:06:18;01:06:19;"Yeah."
01:06:19;01:06:20;"No, I wouldn't have."
01:06:20;01:06:21;"No."
01:06:21;01:06:22;"Would you have known it by now?"
01:06:25;01:06:26;"Yes."
01:06:26;01:06:29;"I would be like Pearl Jam."
01:06:29;01:06:32;"And then it probably would take me to the chorus to really..."
01:06:32;01:06:33;"Right."
01:06:33;01:06:34;"[Laughter]"
01:06:34;01:06:36;"Do you know, like, all the lyrics to this, Jake?"
01:06:36;01:06:37;"Is it that deep for you?"
01:06:37;01:06:39;"Yeah, it's pretty deep."
01:06:39;01:06:40;"Okay."
01:06:40;01:06:43;"I love this record back in '92."
01:06:54;01:06:57;"I remember the video played all the time on it."
01:06:57;01:06:58;"Oh, yeah."
01:06:58;01:07:00;"Oh, wow."
01:07:00;01:07:04;"Jeremy is based on the story of Jeremy Dell, a 15-year-old sophomore who killed himself"
01:07:04;01:07:10;"in front of his English class at Richardson High School in Richardson, Texas."
01:07:10;01:07:11;"Wow."
01:07:11;01:07:12;"Did he shoot himself?"
01:07:12;01:07:13;"He killed himself."
01:07:13;01:07:14;"He didn't kill his classmates."
01:07:14;01:07:15;"Right."
01:07:15;01:07:19;"But the video was edited in a way that made it unclear what happened."
01:07:19;01:07:23;"Actually, I read a chapter from something a friend of the show, Stephen Heiden, is working"
01:07:23;01:07:24;"on about Pearl Jam."
01:07:24;01:07:26;"It's an excellent Jeremy chapter."
01:07:26;01:07:31;"I actually don't want to blow the spot because I know quite a bit more now about Jeremy in"
01:07:31;01:07:33;"the video, having read it."
01:07:33;01:07:35;"People can wait to read his book."
01:07:35;01:07:37;"Cool low-key promo."
01:07:47;01:08:15;"I guess to the Gen Xers on the panel, I just want to ask, because actually I don't know"
01:08:15;01:08:18;"if I fully have the answer for either one of you."
01:08:18;01:08:20;"What's your relationship to Pearl Jam?"
01:08:20;01:08:23;"Jake, I'll start with you because you're the rock guy."
01:08:23;01:08:30;"Every TC head knows that Jake loves Pavement, you're a big Nirvana fan, GBV."
01:08:30;01:08:34;"Where did you fall on Pearl Jam in 1992?"
01:08:34;01:08:36;"Was way in in '92."
01:08:36;01:08:41;"Loved the first three records, Tanned, Versus, and Vitology, and then dropped off."
01:08:41;01:08:44;"Okay, but you still ride for early PJ."
01:08:44;01:08:47;"I don't think I ride for it, but I don't like Jeremy."
01:08:47;01:08:49;"Jeremy's not good."
01:08:49;01:08:51;"Jeremy's bad."
01:08:51;01:08:53;"It doesn't sound good to me."
01:08:53;01:08:55;"Not a fan of Jeremy."
01:08:55;01:08:56;"Not a fan of Alive."
01:08:56;01:08:58;"I've heard Alive too many times."
01:08:58;01:09:00;"The stuff on the first even flows terrible."
01:09:00;01:09:01;"Well, you're just saying it's..."
01:09:01;01:09:02;"Well, what do you mean that it's bad?"
01:09:02;01:09:03;"It's played out?"
01:09:03;01:09:04;"Let's just stick with Jeremy."
01:09:04;01:09:05;"I don't think it's like..."
01:09:05;01:09:06;"Okay."
01:09:06;01:09:07;"It's not a fun listen."
01:09:07;01:09:09;"I don't like the melodies."
01:09:09;01:09:11;"I don't like the tones."
01:09:11;01:09:14;"It's very..."
01:09:14;01:09:17;"With all due respect, Jake, a 15-year-old killing themselves in front of his English class."
01:09:17;01:09:18;"I'm sorry."
01:09:18;01:09:22;"It's not exactly light fare that Eddie and the boys were tackling here."
01:09:22;01:09:27;"So, yeah, I'm sorry if it didn't make you want to dance or whatever, but I don't think that was their intention."
01:09:27;01:09:29;"Rock out."
01:09:29;01:09:30;"I could have rocked out."
01:09:30;01:09:37;"I mean, like, yeah, maybe they're going for like a Pink Floyd kind of thing or something, where it's just like heavy and despairing."
01:09:37;01:09:38;"It's just..."
01:09:38;01:09:40;"I'm just not a fan of Jeremy."
01:09:40;01:09:41;"Let's see."
