Start Timestamp;End Timestamp;Transcript
01:09:41;01:09:50;"My favorite Pearl Jam songs are probably like Elderly Woman, Behind the Counter in a Small Town, Dissident, Corduroy, stuff that's a little later."
01:09:50;01:09:51;"How about you, Rashida?"
01:09:51;01:09:52;"Pearl Jam."
01:09:52;01:09:53;"Yeah, all those."
01:09:53;01:09:54;"No, I'm just kidding."
01:09:54;01:09:56;"I truly have no..."
01:09:56;01:09:59;"I know nothing except for Jeremy and Alive."
01:09:59;01:10:00;"That's it."
01:10:00;01:10:01;"Really?"
01:10:01;01:10:02;"You don't know..."
01:10:02;01:10:03;"Wow."
01:10:03;01:10:04;"How about Daughter?"
01:10:04;01:10:05;"Don't call me daughter."
01:10:06;01:10:07;"What about Better Man?"
01:10:07;01:10:08;"Oh, yeah."
01:10:08;01:10:09;"You're right."
01:10:09;01:10:10;"I don't know any better songs."
01:10:10;01:10:19;"But I remember that the cool girls in my high school class sang Alive at our senior retreat, like acoustic guitar."
01:10:19;01:10:23;"Wait, like on stage?"
01:10:23;01:10:28;"We had a talent show at the end of senior retreat, going away."
01:10:28;01:10:29;"Yeah."
01:10:29;01:10:32;"So it was just a bunch of your classmates just up on stage going..."
01:10:32;01:10:39;"Just like two girls and one dude on the guitar."
01:10:39;01:10:44;"I don't care if you're the best singers on earth, multiple people singing Alive?"
01:10:44;01:10:49;"It sounds insane."
01:10:49;01:10:52;"Was someone doing the riff too?"
01:10:52;01:10:55;"Was someone doing the lead guitar part?"
01:10:55;01:10:57;"I don't know, Jake."
01:10:57;01:11:02;"I need to know."
01:11:02;01:11:05;"Very hazy memory."
01:11:05;01:11:08;"We're going on 30 years here."
01:11:08;01:11:13;"Also, the verses of that song are also pretty dark."
01:11:13;01:11:16;"It's a funny song to picture two teen girls singing."
01:11:16;01:11:19;"Yeah, like popular girls."
01:11:19;01:11:22;"I don't think they were really feeling the essence of the song, to be honest."
01:11:22;01:11:25;"I think they were showing off their nice voices."
01:11:25;01:11:27;"And they love that chorus."
01:11:27;01:11:30;"Yeah, I think everybody joined in."
01:11:30;01:11:32;"Is she alive, she said."
01:11:32;01:11:35;"Well, I supposed to be."
01:11:35;01:11:36;"You like that song."
01:11:36;01:11:40;"I used to like that song, and it just has not stayed with me over the years."
01:11:40;01:11:41;"Let's put it that way."
01:11:41;01:11:49;"Wait, Rashida, I know I see a similar question last time, but I imagine you never owned a Pearl Jam CD back then?"
01:11:49;01:11:57;"No. Really, the only thing even close to that for me was REM, because I got a free CD."
01:11:57;01:11:58;"Oh, right."
01:11:58;01:12:07;"Are you aware that in some circles in the early '90s, there was kind of like a line in the sand drawn between Nirvana and Pearl Jam?"
01:12:07;01:12:11;"It kind of was all in the same bucket for me."
01:12:11;01:12:13;"So, no."
01:12:13;01:12:15;"That was like grunge."
01:12:15;01:12:32;"Again, my only reference point was like singles was probably the closest I got to kind of like, yeah, like Reality Bites and singles were like how I even heard any kind of music that was like grungy or what else would it be called?"
01:12:32;01:12:35;"Rock '90s, like Gen X-y rock."
01:12:35;01:12:36;"Alternative."
01:12:36;01:12:37;"Seattle sound. Alternative."
01:12:37;01:12:41;"But the singles soundtrack is like very important for Pearl Jam."
01:12:41;01:12:43;"It has some of their most beloved songs on it."
01:12:43;01:12:45;"Oh, so then I do know their songs. What are the other songs that are on there?"
01:12:45;01:12:47;"Oh, you have the single soundtrack?"
01:12:47;01:12:49;"Oh, I was in on that. Yeah."
01:12:49;01:12:52;"Wait, so do you know the Pearl Jam song State of Love and Trust?"
01:12:52;01:12:54;"You gotta sing it."
01:12:54;01:12:57;"This is a good, ""State of love and trust."""
01:12:57;01:12:59;"Yeah. It's kind of heavy."
01:12:59;01:13:04;"Unless it was like at a pivotal point in the movie that I don't know if I can cosign."
01:13:04;01:13:06;"Well, maybe you listen to it."
01:13:06;01:13:08;"It was a great Smashing Pumpkins song on that soundtrack."
01:13:08;01:13:12;"Wait, but just while we're on the topic of grunge, do you know any Soundgarden songs?"
01:13:12;01:13:15;"Is that Chris Cornell?"
01:13:15;01:13:16;"Yep."
01:13:16;01:13:17;"Yes."
01:13:17;01:13:20;"I like that. What's the one about the Black Hole Sun?"
01:13:20;01:13:22;"Yeah, yeah. Good call."
01:13:22;01:13:24;"Great video. Great video."
01:13:24;01:13:27;"Oh, yeah. Also great video. What about Alice in Chains?"
01:13:27;01:13:33;"I think they also might have had a soundtrack song somewhere. What would I know?"
01:13:33;01:13:35;"Man in the Box?"
01:13:35;01:13:38;"No. I know that name."
01:13:38;01:13:43;"That's like an indie group, right? Indie group. What am I saying? No."
01:13:43;01:13:46;"No, they're classically grunge. They're grunge."
01:13:46;01:13:52;"Okay. Cos I got confused just cos the Alice part, like Alice in Chains, Alice Cooper used to confuse me as a kid."
01:13:52;01:13:57;"I know it's different, but I got kind of stuck in that vortex."
01:13:57;01:13:58;"They both rock."
01:13:58;01:13:59;"So, no."
01:13:59;01:14:04;"Alright, let's get back to the R&B chart. The number four song this week, 1992 R&B chart."
01:14:04;01:14:06;"Let's listen."
01:14:07;01:14:11;"Yes. Real love. Mary J. Blige just said this."
01:14:11;01:14:13;"Yeah, we were just talking about the remix."
01:14:13;01:14:14;"The remix."
01:14:14;01:14:19;"So, this song, the original and the remix are both great, right?"
01:14:19;01:14:21;"Yes, they are. They are."
01:14:21;01:14:31;"And I feel like Mary has that distinction where like all of her remixes and all of her album cuts are equally as good."
01:14:31;01:14:36;"And this album, What's 411, is a classic. I had this on tape."
01:14:36;01:14:56;"This to me sounds like the definitive version that I've heard my whole life."
01:14:56;01:14:59;"You would know the other one. You'd know the other one."
01:14:59;01:15:00;"Really?"
01:15:00;01:15:02;"Yeah, get that remix queued up, Matt."
01:15:02;01:15:04;"Okay, so Jake, you're familiar with this song, though."
01:15:04;01:15:05;"Oh, of course."
01:15:05;01:15:17;"Truly, both versions are excellent."
01:15:17;01:15:20;"So good. Is this a dance hall sample?"
01:15:20;01:15:24;"No, it's like some 60s or 70s R&B soul."
01:15:24;01:15:25;"Oh, yes."
01:15:25;01:15:27;"Is this Do Right Woman or something?"
01:15:27;01:15:29;"Yes, that's what it is."
01:15:29;01:15:39;"But so, Rashida, for a true 90s R&B head, Mary J. Blige, What's 411, that's like Nirvana, Nevermind for a rock person, right?"
01:15:39;01:15:42;"Just like a giant of an album."
01:15:42;01:15:46;"Yeah, it really is. And I think it's one of those that you just..."
01:15:46;01:15:51;"It was at the time when people listened to albums over and over and over and over and over again."
01:15:51;01:16:00;"So, you know, we didn't have that, like the way that streaming services present songs to you not in their full album form."
01:16:00;01:16:08;"It was just, you did that. You got that one thing, you just wore it out, turn the tape over, wore it out some more, you know."
01:16:08;01:16:13;"What's the 411 like a top five 90s album for you? Like that level?"
01:16:13;01:16:24;"Oh, yeah. Also, to me, it was the first solo, female solo R&B artist, like new solo R&B artist."
01:16:24;01:16:32;"I say that because Janet Jackson had been famous for so long already that like really, I mean, she like grabbed the scene, you know,"
01:16:32;01:16:42;"because she came up from like the whole kind of like Andre Harrell, out of town era, Jodeci, Heavy D, Puffy, all of that."
01:16:42;01:16:48;"She just popped so hard. You remind me, I think was on like a soundtrack, Strictly Business soundtrack, and then she just popped so hard from there."
01:16:48;01:16:50;"But she was, that's why she's the queen."
01:16:50;01:16:56;"And there were so many groups that were really popular now. So she really stood out as a solo artist."
01:16:56;01:16:58;"So this is our first record."
01:16:58;01:17:03;"Yeah, she had a single before this on a soundtrack. This is her first record."
01:17:03;01:17:06;"Ezra, you came to the Mary J. Blige concert with me. Do you remember?"
01:17:06;01:17:13;"Yeah, that's true. We went to, we saw Mary J. at the Hollywood Bowl. That was, the energy was crazy."
01:17:13;01:17:25;"Everybody knows every word of every Mary song, like every guy, every girl, like people were so dialed in, like eyes closed and dialed into like their inner journey."
01:17:25;01:17:27;"It was so great. It was so good."
01:17:27;01:17:29;"Yeah, a lot of emotion."
01:17:29;01:17:31;"Nas was there too, but whatever."
01:17:31;01:17:33;"It was a co-headline tour with Nas. Don't forget him."
01:17:33;01:17:35;"Nas was great too."
01:18:02;01:18:07;"Obviously these things become more apparent in retrospect, but like, it's such a great name for a debut album."
01:18:07;01:18:11;"What's the 411? Just really kicking things off properly."
01:18:11;01:18:15;"Does 411 still exist? Like, is that still a thing you can call?"
01:18:15;01:18:16;"No."
01:18:16;01:18:17;"No more 411."
01:18:17;01:18:19;"Oh, wait, no, I think you can still call it."
01:18:19;01:18:21;"Was 411, was it information?"
01:18:21;01:18:26;"That was like phone service information, right? Or no, no, that was 611."
01:18:26;01:18:32;"Let's get, no, 411 was, so obviously 911 was for emergency."
01:18:32;01:18:35;"911 was for emergency, 411 is for info."
01:18:35;01:18:37;"What kind of info?"
01:18:37;01:18:46;"Like you call and say, hi, looking for a business in Santa Monica, like so-and-so chiropractor, and they would give you the number or they'd connect you."
01:18:46;01:18:48;"So it was like..."
01:18:48;01:18:51;"And it went to AT&T."
01:18:51;01:18:58;"But could you call and just be like, I'm looking for a chiropractor in Santa Monica, and then they would just tell you some?"
01:18:58;01:19:02;"They go through the Yellow Pages, yeah, like their database, Yellow Pages database."
01:19:02;01:19:06;"So if you didn't have the Yellow Pages for some reason."
01:19:06;01:19:08;"That's right, it was directory assistance."
01:19:08;01:19:14;"It was directory, okay, right. So you couldn't just hit them up with like questions?"
01:19:14;01:19:15;"No."
01:19:15;01:19:20;"Because, well, in New York, in New York at some point they had 311, which I think was questions about the city."
01:19:20;01:19:21;"They still have 311."
01:19:21;01:19:25;"Yeah, they still have 311 in New York, and that would be more like, hey, does..."
01:19:25;01:19:30;"You see a pothole, or you see like a street lamp that doesn't work."
01:19:30;01:19:32;"Did you have 611?"
01:19:32;01:19:34;"Yeah, I went to 611."
01:19:34;01:19:38;"611, I think that was like customer service almost, more like..."
01:19:38;01:19:40;"Like city customer service?"
01:19:40;01:19:43;"Like the payphone's broken, or like, oh, I can't..."
01:19:43;01:19:49;"Oh, you could still use that on some of your cell phones, you can call 611 and get somewhere with it."
01:19:49;01:19:50;"Oh, there you go."
01:19:50;01:19:52;"Matt, just kidding."
01:19:52;01:19:54;"[Laughter]"
01:19:54;01:19:57;"A truly different era."
01:19:57;01:19:59;"Do you remember Star 69?"
01:19:59;01:20:00;"Star 82?"
01:20:00;01:20:03;"Wait, Star 69 was calling somebody back?"
01:20:03;01:20:04;"Yeah."
01:20:04;01:20:09;"No, and it wasn't that when you wanted to block your number in case somebody did want to call you back?"
01:20:09;01:20:11;"No, it was a callback."
01:20:11;01:20:15;"No, because if you prank called somebody, there was a thing you could do that would block Star 69."
01:20:15;01:20:16;"Before you called."
01:20:17;01:20:19;"That's Star 67?"
01:20:19;01:20:21;"Yeah, that's right, Star 67."
01:20:21;01:20:24;"Star 82 would unblock you."
01:20:24;01:20:25;"What?"
01:20:25;01:20:26;"Yeah."
01:20:26;01:20:28;"I didn't even know that existed."
01:20:28;01:20:31;"And then there was emergency breakthroughs, but that's a whole other story."
01:20:31;01:20:32;"Remember those?"
01:20:32;01:20:33;"Jake, do you remember those?"
01:20:33;01:20:35;"I don't know any of this stuff."
01:20:35;01:20:37;"This is like the secret menu at In-N-Out or something."
01:20:37;01:20:39;"[Laughter]"
01:20:39;01:20:40;"This exists?"
01:20:40;01:20:42;"That was before call waiting."
01:20:42;01:20:49;"When you were on the phone in the 80s, your friends, you could spend a dollar and call the operator and be like, ""I need to do an emergency breakthrough."""
01:20:49;01:20:52;"And then they'd call and be like, ""You have an emergency breakthrough from Jake."""
01:20:52;01:20:53;"Oh, wow."
01:20:53;01:20:57;"And you could refuse it, which meant you spent a dollar for nothing."
01:20:57;01:20:59;"I don't know that existed."
01:20:59;01:21:03;"I always wondered, why did Star 67 exist?"
01:21:03;01:21:09;"Why would they create something that would make it not possible to like—it seemed like the prank call—"
01:21:09;01:21:10;"Privacy?"
01:21:10;01:21:13;"I guess, but it was such a prank call loophole."
01:21:13;01:21:15;"It's protecting prank calls."
01:21:15;01:21:17;"The First Amendment of the prank caller."
01:21:17;01:21:18;"Right."
01:21:18;01:21:26;"It truly is crazy about how the precursor to computer hackers were freakers."
01:21:26;01:21:33;"And all these dudes like the f***ing Steve Wozniak and all these people, they started out by doing crazy phone hacking."
01:21:33;01:21:38;"Even going back to the 60s, I think back in the day, you could just pick up a phone."
01:21:38;01:21:45;"I've only vaguely understand this, but I think you could buy a little, very simple machine that would play different tones."
01:21:45;01:21:53;"And you could literally pick up your phone, call somebody, and then basically play into the receiver like, ""Kee, brr."""
01:21:53;01:21:56;"And you could like, f***, hack the FBI."
01:21:56;01:22:00;"Landline culture was crazy."
01:22:00;01:22:01;"Crazy?"
01:22:01;01:22:02;"A truly lost era."
01:22:02;01:22:09;"But don't just picture that, f***, like Wozniak and Steve Jobs just picking up going, ""Beep, beep,"" and they were like launching missiles and s***."
01:22:09;01:22:16;"But isn't that sort of like—wasn't that whole thing that Cuban—whatever the Cuban—"
01:22:16;01:22:17;"Missile crisis?"
01:22:17;01:22:19;"Syndrome? No, the Havana syndrome."
01:22:19;01:22:20;"Oh, the new stuff."
01:22:20;01:22:26;"Isn't it like tones and frequencies? It's like wave-based terrorism, right?"
01:22:26;01:22:31;"Where they're just sending out sounds and people are like getting brain damage?"
01:22:31;01:22:33;"I bet a freaker developed it."
01:22:33;01:22:35;"Yeah, I bet they just used dial tones."
01:22:35;01:22:44;"I bet whatever intelligence agency is doing the Havana syndrome, probably they got somebody in the '70s, a freaker, and they were just like,"
01:22:44;01:22:54;"""Son, you got two choices. You can rot in a prison cell for the rest of your life, or you can join our intelligence agency and make your country proud."""
01:22:54;01:23:03;"And he's like, ""All right, I'll do it."" And now this person is in their 60s, and they're just like, ""All right, we need you to take out some American diplomats."""
01:23:03;01:23:08;"And he's like, ""Oh boy, do I have an idea for you. Just need some of my old tools."""
01:23:08;01:23:15;"Yeah, it does seem very Cold War, developing a radio wave or microwave that's going to cook someone's brain from across the street."
01:23:15;01:23:17;"Doesn't that seem so like—"
01:23:17;01:23:19;"Yeah, like the fear of the Cold War."
01:23:19;01:23:20;"1960s."
01:23:20;01:23:29;"Oh, by the way, coming full circle, the word ""freaker,"" I believe, is spelled P-H-R-E-A-K-E-R, so it's kind of like fat or fish."
01:23:29;01:23:30;"That's a nice tie-in."
01:23:30;01:23:37;"If we got any TC heads who are freakers, love to talk to you. Be a little nervous to get you on the phone, though."
01:23:37;01:23:39;"But I have so many questions about freaking."
01:23:39;01:23:43;"The number four song on the rock charts. Let's play it."
01:23:55;01:23:56;"Slow."
01:23:59;01:24:00;"Arrowsmith?"
01:24:00;01:24:01;"No."
01:24:03;01:24:05;"Not a bad guess, but—"
01:24:09;01:24:10;"Morrissey?"
01:24:10;01:24:12;"Yeah, you got to recognize the voice."
01:24:12;01:24:14;"Morrissey with ""Tomorrow."""
01:24:14;01:24:17;"This album, ""Your Arsenal,"" was big in the U.S."
01:24:23;01:24:29;"A little updated vocal effects for him. It's a little too clean for me."
01:24:29;01:24:31;"I've never heard this song in my life."
01:24:42;01:24:46;"Early '90s, solo Morrissey was selling out the Hollywood Bowl."
01:24:46;01:24:51;"Selling out, maybe, just in general. Like a non-Gen X way."
01:24:51;01:25:02;"I never connected with the solo Morrissey stuff, because it just seemed like the band he was playing with was so out of stock, kind of studio guy."
01:25:02;01:25:05;"He's missing Johnny Marr, basically, is what I'm saying."
01:25:05;01:25:10;"I mean, hard to compete with Johnny Marr. But his solo career does have many excellent songs."
01:25:10;01:25:13;"""Everyday"" is like Sunday. One of my faves."
01:25:13;01:25:19;"Just the production of it. There's no real atmosphere or vibe with his—"
01:25:19;01:25:22;"Yeah, he doesn't push it too far outside of his—"
01:25:32;01:25:36;"I like that bass. It was very classic."
01:25:36;01:25:39;"Yeah, very '90s. The Treble-y picked bass."
01:25:39;01:25:45;"And Morrissey also is like—he must be a bit older than Pearl Jam, right?"
01:25:45;01:25:51;"Oh, yeah. Because he was having a career much—first Smith's album's like '83? '84?"
01:25:51;01:25:56;"Yeah, he's probably like—what, in his—like he's probably around 30 here, I'm guessing? I don't know."
01:25:56;01:25:59;"What year was Morrissey born? Seinfeld's ""Good Number Crunch."""
01:26:24;01:26:28;"He was born in 1959. '62."
01:26:28;01:26:33;"Whoa! So he was 33 here?"
01:26:33;01:26:36;"So Morrissey's older than Obama."
01:26:36;01:26:43;"That's crazy. I love Morrissey. I'm from L.A. I feel like it's just like what you do."
01:26:43;01:26:51;"Even when you were at this age, 16, 17, you're in high school, you're listening to Mary J. Blige,"
01:26:51;01:26:58;"""What's the 411?"" over and over again. At that age, were you like aware of Morrissey and the Smiths?"
01:26:58;01:27:05;"Yeah, because they were popular when I was younger and it was so nostalgic. So yeah."
01:27:05;01:27:08;"So they were popular in your high school, the Smiths?"
01:27:08;01:27:10;"No, like grade school."
01:27:10;01:27:12;"Interesting."
01:27:12;01:27:16;"Because wasn't it—weren't they like popping like in the '80s?"
01:27:16;01:27:25;"I don't know if they were popping in America, but they were certainly a major cult band. Yeah, in the mid '80s."
01:27:25;01:27:35;"I feel like music was so much more shrunken that even though I grew up listening to a lot of whatever, R&B and jazz and stuff,"
01:27:35;01:27:42;"like Depeche Mode, Morrissey, New Order, those were all bands that were cool, you know,"
01:27:42;01:27:48;"and had like one or two hits that would be on the radio, on the bus."
01:27:48;01:27:57;"And there is something about the Smiths and Depeche Mode. Famously, the Smiths and Morrissey have this huge fan base in LA,"
01:27:57;01:28:02;"but so does Depeche Mode. Both of those bands weirdly I associate so much with."
01:28:02;01:28:08;"I mean, LA has a—LA, of all American cities, loves gothy, depressing English music."
01:28:08;01:28:13;"The Cure, too. At their height, The Cure sold out Dodger Stadium like multiple times."
01:28:13;01:28:15;"That's amazing."
01:28:15;01:28:17;"LA's depressing."
01:28:17;01:28:27;"I was going to say something about the gloomy, gothy English music is like the opposite of the sunny, sun-bleached LA vibe."
01:28:27;01:28:30;"It's also the subtext of that, you know?"
01:28:30;01:28:31;"Yes."
01:28:31;01:28:32;"It's really going on."
01:28:32;01:28:33;"Yin and yang."
01:28:33;01:28:42;"You know, it's funny. I saw people wearing Smiths shirts, like cool kids wearing Smiths shirts for years before I ever heard a note from the Smiths."
01:28:42;01:28:46;"I don't think I really even heard them until I was like out of college."
01:28:46;01:28:47;"Oh, really?"
01:28:47;01:28:52;"I don't—yeah, just for some reason when I was a kid, I was like, I didn't like '80s music."
01:28:52;01:28:56;"By the time, like, as the '90s progressed, I was like, I hate '80s music."
01:28:56;01:29:00;"I like like '60s and '70s music and '90s music."
01:29:00;01:29:07;"It took me a long time to finally go back into that like '80s, you know, replacements, Smiths, like all those kind of bands."
01:29:07;01:29:12;"Anyway, they weren't on MTV and they weren't on the radio, so I didn't hear them."
01:29:12;01:29:17;"Yeah, you probably needed just like no, like a head to get you in, at least in Connecticut."
01:29:17;01:29:22;"This is the number three song on the R&B charts this week in '92."
01:29:22;01:29:25;"I'm not familiar with it based on the name."
01:29:29;01:29:30;"You got to take off, Seinfeld."
01:29:30;01:29:31;"Bye, guys."
01:29:31;01:29:32;"All right."
01:29:32;01:29:33;"Peace."
01:29:33;01:29:34;"Classic drum fill there."
01:29:34;01:29:35;"It's a group."
01:29:35;01:29:36;"I've never—"
01:29:36;01:29:37;"I need to wear this if I got something."
01:29:37;01:29:38;"I'm not sure if I'm going to be able to do it."
01:29:46;01:30:07;"I'm not sure if I'm going to be able to do it."
01:30:07;01:30:30;"I'm not sure if I'm going to be able to do it."
01:30:30;01:30:59;"I'm not sure if I'm going to be able to do it."
01:30:59;01:31:08;"It's also their first song is a slow jam. It's very romantic. Like it's not sexy. It's just romantic."
01:31:16;01:31:23;"Let's keep moving. It is funny. There's something about these 92 rock ones. They're a little random."
01:31:23;01:31:28;"Next time we do this, let's move to 93 and see what happens. I don't think anybody's going to call this one."
01:31:28;01:31:35;"But let's throw it on. This is the number three song on the Billboard Modern Rock Tracks this week in 92."
01:32:04;01:32:10;"Is there a band or solo artist? Solo artist and I don't associate them with rock per se."
01:32:16;01:32:22;"Male or female? Female. A cool artist. I love a lot of this artist's work."
01:32:27;01:32:32;"Is it like Susanne Vega or something? Yes, yes. It's Susanne Vega. Really? Wow."
01:32:32;01:32:40;"It's called Blood Makes Noise. This is on the chart only because she had like two or three probably very good singles before this."
01:32:40;01:32:45;"So anything she was going to release next would be paid attention to. Right? Yes."
01:32:45;01:32:50;"Yeah, at least got played on the radio. I don't even know if this chart was a sales chart. It might have been a radio chart."
01:32:50;01:32:55;"What was the height of Susanne Vega's career? Like 89? Luca."
01:32:55;01:33:02;"Well, it's funny. It was around this time because she had Luca was a big song in the 80s."
01:33:02;01:33:08;"And then she had Tom's Diner. But you know, Tom's Diner was a acapella song on the same album as Luca."
01:33:08;01:33:15;"And it wasn't until the early 90s that there was the DNA remix. The sellout version."
01:33:15;01:33:20;"The truly famous version of Tom's Diner was the remix. And it was years later."
01:33:20;01:33:25;"The original Tom's Diner came out in the 80s and this one came out in the 90s. Let's listen to that remix."
01:33:25;01:33:47;"This and also Everything But The Girl, two songs where the remix was like so much bigger."
01:33:47;01:33:55;"What year is this remix? Yeah, what year is this remix? I don't know. But that's isn't that the exact same breakbeat as Soul to Soul?"
01:33:55;01:34:01;"Keep on moving. Could be. Yeah, it could be the same sample."
01:34:01;01:34:10;"1990. OK, so this is 1990 actually. All right. This is an unlikely hit. Yeah. Right? Yeah."
01:34:10;01:34:18;"As a non-Vega head, this strikes me as the height of Vega's career, which makes sense. Then in '92, this is '90."
01:34:18;01:34:23;"I don't even know that song. What is Luca? Really? Throw in Luca. I'm sure I'll know it when I hear it."
01:34:23;01:34:30;"We have to also note that once we recorded a time crisis at Tom's Diner, which the song is about."
01:34:36;01:34:45;"This is cool. Not placing it, though."
01:34:45;01:34:51;"You know. Long intro, man."
01:34:51;01:35:00;"My name is Luca. What year is this? '87. Wow."
01:35:00;01:35:08;"This is like very influential. Obviously, this really set the stage for a type of like '90s alternative."
01:35:08;01:35:14;"It reminds me of the Rembrandts. Yeah. And Lisa Loeb. I mean, there's none of that without those."
01:35:14;01:35:20;"Yeah, very Loeb. I don't actually know this song. Really?"
01:35:28;01:35:37;"I feel like this also reminds me of the beginning of VH1. Oh, totally. Oh, yeah. VH1 was like..."
01:35:37;01:35:43;"She's a pillar of early VH1. This might have had some sort of like stop motion video or something."
01:35:43;01:35:47;"Like, what was the video for this? Or maybe it's just her looking out a window. I can't picture it."
01:35:47;01:35:53;"I'm not mad at this Vega. Oh, no. '80s Vega? Excellent. All right, let's keep moving."
01:35:53;01:35:59;"The number two song on our beat charts. I don't know this artist."
01:35:59;01:36:11;"Yes."
01:36:18;01:36:22;"Oh, it's playing hard to get."
01:36:22;01:36:35;"Is it High Five? Yes. High Five with She's Playing Hard to Get."
01:36:35;01:36:42;"Jake, you know High Five? No. You might know their biggest hit is the kissing game."
01:36:42;01:36:48;"They were like little boys, little kids. I love this. It sounds great."
01:36:48;01:36:53;"Some great organ playing."
01:36:53;01:36:57;"So, is this kid like 15 or something singing?"
