Start Timestamp;End Timestamp;Transcript
48:47;48:54;"nailed it this is very tim heidecker or i think you should leave now you know like"
48:54;49:00;"in the studio just give me more"
49:00;49:13;"clearly we need a michael bolton doc i heard a lot of people say that the kenny g doc was great"
49:13;49:22;"yeah we need a michael bolton watch i like the idea of someone just trying on so many hats you"
49:22;49:28;"know not having like any real innate drive for any certain kind of music do you know just being like"
49:28;49:34;"oh i i'll just i mean i'll keep trying until it lands it's cool like rod stewart who totally i"
49:34;49:38;"don't think i'm dissing him by saying not at the same level just in terms of songwriting and stuff"
49:38;49:45;"but like just a guy with a voice that was gonna find its way to work doing roots doing kind of"
49:45;49:52;"like you know slightly slick 80s well it's funny though this is this is where where ct becomes"
49:52;49:58;"part of the scene because like rod stewart's coming up in london he's like he's meeting all"
49:58;50:04;"of these like cool people to start bands with ronnie lane ronnie wood you know like they grew"
50:04;50:10;"together but michael bolton's in southwest connecticut i mean if michael bolton was like"
50:10;50:18;"living in like you know wherever la san francisco mid-70s maybe he teams up with a different crew"
50:18;50:24;"yep maybe he's the american rod stewart well and maybe we don't know enough of the story about how"
50:24;50:29;"he his actual relationship with flying island guys maybe he and ray smith should have met earlier"
50:29;50:35;"ray smith could have been his ronnie wood and he could harness that powerful voice to some like"
50:35;50:41;"tasteful ahead of its time progressive guitar music i love it i mean ray's probably like man"
50:41;50:54;"rocks played out dog like it's 1975 dude like rocks over right"
50:54;51:04;"i'm actually pretty into this version play the beginning again"
51:04;51:14;"that's pretty sick it is a good version"
51:14;51:28;"yes it is"
51:31;51:38;"yeah this rules"
51:38;51:45;"now throw on his version of when a man loves a woman because that was a huge hit for him in the"
51:45;51:52;"90s which is also like a a big r&b yeah ballad"
51:52;52:00;"so in a way he's always kind of doing the same thing yeah i mean here he's gonna have"
52:00;52:06;"less to prove he's gonna like keep some of it to himself and not it's gonna be more restrained"
52:06;52:15;"more pro when a man loves a woman yeah he didn't have the grit on that"
52:15;52:25;"he's an amazing singer he's blowing the roof off the players tavern in westport"
52:25;52:34;"if she is bad he can't see it she can do no wrong"
52:34;52:41;"it's not that different than his time is on my side but it's a world of difference yeah"
52:41;52:50;"this also reminds me of office space when there's that character named michael bolton"
52:50;52:55;"oh yeah when he's like talking to like the consultants that are like"
52:55;53:00;"like gonna be firing like half the office like and the consultant guy is sort of like"
53:00;53:05;"man when michael bolton sings when a man loves a woman that really does it for me"
53:10;53:21;"sleep"
53:21;53:28;"his voice sounds great on this"
53:28;53:37;"we gotta get michael bolton on i mean he seems like a cool guy with a sense of humor"
53:38;53:44;"he's like done a bunch of stuff with the lonely island all right i mean that was a little bit of"
53:44;53:51;"the vibe of the kenny g doc was that like kenny g like had a sense of humor i mean he takes his"
53:51;54:04;"craft incredibly seriously that modulation but he also had a sense of humor yeah it'd be great"
54:04;54:10;"to talk to michael about the early days when we do it our flying island special you can call in"
54:10;54:15;"i think we just did oh we're gonna go much deeper on flying island okay all right well hold on guys"
54:15;54:22;"speaking of special flying island yes wait time for finish the thought oh yeah you know going"
54:22;54:29;"down the rabbit hole on jeff bova from flying island um he's had an incredible history of you"
54:29;54:35;"know he's worked with yoko ono cindy lopper he played on the bridge billy joel he's on the"
54:35;54:42;"michael jackson history album he he worked on the backstreet boys album katie perry like this guy"
54:42;54:50;"has is really soared from his humble roots i wonder if he and ray are still friends probably not"
54:50;54:59;"yeah probably dude well i mean raise off the grid raise off the grid he's off the grid it"
54:59;55:04;"hurt jeff when ray went off the grid he understood where he was coming from but he felt like come on"
55:04;55:09;"man you have to go fully off the grid race got his own life he's got a subaru a nice woman who loves"
55:09;55:15;"him cool ass steps on what more do you need life took him on different paths they both did a lot"
55:15;55:20;"cool stuff anyway speaking of specials let's not forget that this is a horse meat special"
55:20;55:24;"let's get down to the main event here the main course"
55:26;55:31;"well okay so here's what you gotta understand i don't know if it's illegal to eat horse meat"
55:31;55:38;"in america per se but in 2006 they passed the horse slaughter prevention act which effectively"
55:38;55:44;"ended the production of horse meat in america so keep that in mind as we talk about this okay"
55:44;55:48;"horse meat is a significant part of culinary traditions in many countries particularly in"
55:48;55:54;"europe and asia the eight countries that consume the most horse meat consume about 4.3 million"
55:54;56:01;"horses yearly i don't know if we have those eight countries but i'm guessing belgium japan but horse"
56:01;56:09;"meat is considered taboo in brazil poland israel and among romany and jewish people it is also not"
56:09;56:15;"eaten in the united states the united kingdoms south africa australia and ireland so the english"
56:15;56:20;"speaking world is very anti horse meat and let's also keep in mind that the book of leviticus from"
56:20;56:27;"the bible you guys probably already know this but leviticus 11 3 says you may eat any animal"
56:27;56:34;"that has a split hoof completely divided and that chews the cud but of those that only chew the cud"
56:34;56:42;"or only have a divided hoof you are not to eat complicated wait it's like a riddle you can eat"
56:42;56:46;"any animal that has a split hoof and that chews the cud but if it only chews the cud or only has"
56:46;56:53;"a divided hoof you can't eat it okay so i guess horse meat isn't kosher so our orthodox jewish"
56:53;56:59;"customers will have to have some options for them maybe like a nice chicken steak or something yeah"
56:59;57:05;"we'll have beef we'll have kosher beef for them in 732 pope gregory iii stopped the eating of"
57:05;57:13;"horse meat because it was an impure and detestable pagan meat so okay the the catholic church in 732"
57:13;57:19;"was anti horse meat it's gone back and forth it got very popular in france during the second french"
57:19;57:25;"empire 1852 to 1870 so it's just like all over the place it's not some thing where you could say"
57:25;57:29;"oh europe they don't eat it they eat it here it's like it's it's all over the place they don't eat"
57:29;57:36;"it in england they eat it in france and it continues to be a real dividing line between"
57:36;57:41;"people some people love horse meat and for other people they're horrified by it so for instance in"
57:41;57:47;"2013 traces of horse dna were found in the british and irish burger king hamburger patties the"
57:47;57:51;"discovery force silvercrest foods burger king's uk and irish supplier to shut down its production"
57:51;57:58;"line so you know you can imagine burger king fans in the british isles finding out they might have"
57:58;58:05;"been eating a little bit of horse meat they're very angry disgusted they even dropped their"
58:05;58:09;"supplier because they felt they couldn't trust them anymore but let's focus on america"
58:09;58:18;"now first thing people should know a lot of people think of the horse as being a eurasian animal"
58:18;58:25;"and they think it was brought to the the new world um in the age of conquest and colonization"
58:25;58:31;"but actually horses originated in north america they left around 12 000 bc and it became extinct"
58:31;58:37;"yeah so they went reverse over the land bridge between alaska and russia i guess that's the"
58:37;58:43;"theory and then they were isolated in asia and then the ones in north america disappeared"
58:43;58:49;"that's crazy and then it took the you know whatever the spanish invaders to bring them back"
58:49;58:56;"and um in america generally speaking americans have historically been against the eating of horse"
58:56;59:03;"but in the 1890s there's a brief moment of popularity partially this is interesting due"
59:03;59:08;"to the rise of a new invention called the automobile so suddenly people start strutting"
59:08;59:13;"their stuff driving around town in a car well guess what you got a lot of extra horses so"
59:13;59:21;"some smart entrepreneurs proposed canning unwanted horses for sale and that they you know maybe people"
59:21;59:29;"could eat it but i don't know the whole thing never quite caught on and basically it's been a"
59:29;59:35;"kind it's just like it hasn't been illegal it just never quite took off let's see in 1973 horsemeat"
59:35;59:40;"again saw a rise in sales this time after the oil crisis pushed up the price of beef in response"
59:40;59:47;"protesters picketed grocery stores on horseback and pennsylvania senator paul s schweiker floated"
59:47;59:51;"a bill banning the sale of horsemeat for human consumption clearly it's an emotional issue so"
59:51;59:58;"wait you could go into a grocery store in 1973 and just buy like horsemeat at the deli yes but"
59:58;01:00:04;"people weren't happy about it that's crazy i wonder if that was only in like a few places that's nuts"
01:00:04;01:00:10;"like i guess in pennsylvania maybe in 1973 it's like i don't know why the oil crisis would push"
01:00:10;01:00:17;"up the price of i guess like moving cows around or so you go into the grocery store the safe"
01:00:17;01:00:24;"way the iga or whatever in wilkes-barre pennsylvania and you're buying like ground horse i guess but it"
01:00:24;01:00:38;"never quite took off"
01:00:39;01:00:46;"is"
01:00:46;01:01:05;"a cleveland craft and utah planes sleeping under the stars"
01:01:05;01:01:07;"foreign"
01:01:07;01:01:32;"why did I never go home because the wild horse runs free forever oh yeah a wild horse runs free"
01:01:33;01:01:35;"forever"
01:01:35;01:01:45;"there's an interesting article that's uh from 2019 that was on politico that's called the strange"
01:01:45;01:01:51;"tale of biden's bid to ban horsemeat because this became a bit of a scandal and a lot of people"
01:01:51;01:01:57;"never really heard about it probably because it's kind of a bipartisan issue republicans we're not"
01:01:57;01:02:02;"going to go after biden for banning horsemeat but here's the thing it's kind of an interesting story"
01:02:02;01:02:10;"so as recently as 2013 horsemeat was still kind of legal uh facilities were allowed to slaughter"
01:02:10;01:02:17;"horses for meat but there was uh an oil pet food or uh that's not exactly clear i've never run into"
01:02:17;01:02:25;"horse i've just never in 2013 people are slaughtering horses for me i i mean just i have"
01:02:25;01:02:31;"to interject because i just found this story okay okay from 2013 which uh the title is horsemeat"
01:02:31;01:02:35;"scandal toronto deli owner doesn't eat any other kind of meat"
01:02:35;01:02:45;"he's the worst guy this is an ideal customer for you as larusso the owner of a toronto deli"
01:02:45;01:02:52;"cavalino carne equina and groceries feel so strongly about horsemeat it's not just the"
01:02:52;01:02:57;"only type of meat she sells it's the only kind of meat she eats we do not serve beef i do not"
01:02:57;01:03:02;"eat beef she says i eat only horse meat sounds like a woman after your own heart hold on hold on"
01:03:02;01:03:10;"in toronto this is in toronto so well first of all i want to make something clear i personally"
01:03:10;01:03:16;"don't really have any interest in eating horse meat but i'm a businessman i was saying from the"
01:03:16;01:03:22;"sort of the financial side you know from the right the entrepreneurial side you're like you're like"
01:03:22;01:03:28;"one of those like fast food ceos who like never eats the actual product the company he works for"
01:03:28;01:03:34;"or like one of those people what they want one of those like silicon valley dirt bags who's like"
01:03:34;01:03:40;"doesn't let their kids on facebook this uh this grocery like oh yeah i keep my kids the hell away"
01:03:40;01:03:45;"from screens they're not operational anymore but seinfeld what's the deal with horsemeat in canada"
01:03:45;01:03:49;"because when we were talking about horsemeat on the thread i can't remember exactly what you said"
01:03:49;01:03:53;"but i think you said growing up in montreal there was a horsemeat restaurant they used to go to"
01:03:53;01:03:58;"fairly regularly no am i remembering that correctly wait no i'm gonna nip this in the"
01:03:58;01:04:03;"bud right here wait did you work there that was one of your first jobs was was working in the"
01:04:03;01:04:08;"kitchen of the local horsemeat restaurant okay i would just like to clear this up right now um"
01:04:08;01:04:13;"you went there on special occasions no no no i've never been after you graduated high school"
01:04:13;01:04:18;"you were in their social media okay you ran through the air okay all right let's no no i"
01:04:18;01:04:24;"did not run the instagram um for this restaurant look there's a restaurant called because i was"
01:04:24;01:04:30;"looking it up before the show it was called the la coude cheval a steakhouse and raw bar"
01:04:30;01:04:37;"and it was a restaurant that we would pass in the car and it had a big horse logo like a big metal"
01:04:37;01:04:43;"horse in the front and i i asked my parents i said oh do they serve horse there and they said"
01:04:43;01:04:48;"yeah you know it's a delicacy in some places i was looking it up to try to sort of catch up on"
01:04:48;01:04:53;"what happened and all the rest of it and i've just learned that that restaurant actually never served"
01:04:53;01:04:58;"horse oh it's just called the tail of the horse but they were like just a straight up steakhouse"
01:04:58;01:05:04;"and my parents were either messing with me or they were incorrect and so all my life i believe this"
01:05:04;01:05:10;"this restaurant in montreal served horse anyway there are restaurants in montreal that do serve"
01:05:10;01:05:14;"horse but the one that i thought maybe your parents were just confused then because they"
01:05:14;01:05:19;"may have been so you know for a fact that there are or were horse meat restaurants in montreal"
01:05:19;01:05:24;"yes uh and i and i looked up a little bit which is your favorite no no i never i've never eaten"
01:05:24;01:05:31;"it in my life um i have no favorites but uh going back to this toronto one which is out of business"
01:05:31;01:05:37;"i just wanted to say that i was on their yelp just now and there's a story from someone who"
01:05:37;01:05:42;"visited in 2018 and the comment is i asked the man in the shop at the butcher counter where he"
01:05:42;01:05:47;"sourced the horses he was butchering and he yelled at me saying are you gonna buy something or not"
01:05:47;01:05:52;"ignore my question and trying to intimidate me i told him he was rude and that he should answer"
01:05:52;01:05:57;"my question and that's when i noticed that his apron was bloody the place reeked of blood"
01:05:57;01:06:04;"absolute nightmare so it sounds like kind of a gnarly well i have an answer for this yelp"
01:06:04;01:06:09;"this person went in with an agenda yeah in that same article canada has become a major"
01:06:09;01:06:14;"international horse meat supplier since the u.s federal court ruling in 2007 oh no it was the last"
01:06:14;01:06:19;"horse processing plant in the country in 2011 when it was reported that a hundred thousand live horses"
01:06:19;01:06:24;"were imported from the u.s to be slaughtered in canada each year the consumption of horse meat"
01:06:24;01:06:31;"became a national issue of ethics which is where most of the horse meat comes from are horses that"
01:06:31;01:06:39;"are shipped uh overseas american horses right because americans okay due to joe biden americans"
01:06:39;01:06:44;"are not allowed to slaughter their horses for meat so all they do is just send it to canada"
01:06:44;01:06:50;"to be slaughtered and now there's too much horse meat in canada all the good horse delis have"
01:06:50;01:06:59;"closed it's an issue"
01:07:00;01:07:05;"shooting down everybody you're classic in the wrong way"
01:07:05;01:07:10;"and we all know the end of the story"
01:07:10;01:07:17;"because everyone knows someone who kills the buzz every time they open up their mouth"
01:07:17;01:07:24;"yeah everyone knows someone who knows someone who thinks they're cooler than"
01:07:24;01:07:33;"everybody else and i think we keep saving up"
01:07:33;01:07:47;"you"
01:07:47;01:07:56;"me you and your heart"
01:07:56;01:08:02;"i just want to talk a little bit more about why horse meat is currently banned and i think"
01:08:02;01:08:07;"multiple presidents have supported this bill but the way it really went down it's interesting and"
01:08:07;01:08:15;"a bit scandalous is in 2013 an oil heiress her name is victoria mccullough she hired a florida"
01:08:15;01:08:22;"state senator to lobby the federal government on behalf of a pet cause no pun intended pet cause"
01:08:22;01:08:27;"banning the slaughter of horse meat so you know she's a wealthy oil heiress she got a lot of money"
01:08:27;01:08:31;"and this is her issue she doesn't think people should be allowed to uh slaughter horses for"
01:08:31;01:08:36;"meat in the u.s i don't think she's an animal rights person in a broad sense i don't think"
01:08:36;01:08:41;"she's like a pita vegan type i think she's just somebody with a fondness for horses"
01:08:42;01:08:48;"at the expense of cows pigs and chickens but whatever that's her pov so the florida state"
01:08:48;01:08:54;"senator she she hired to lobby it's a guy named joe abruzzo and he was a very close associate"
01:08:54;01:09:01;"of frank biden a guy we don't hear enough about this is joe biden's little brother frank and frank"
01:09:01;01:09:08;"biden uh lived in florida biden frankie biden frankie biden ran a charter school business"
01:09:08;01:09:14;"so this is this classic like kind of weird gray area and where people people can make a lot of"
01:09:14;01:09:18;"money with the right government contracts and connections like sometimes you hear about these"
01:09:18;01:09:24;"people make all this money selling like wheelchairs and stuff for medicare medicaid like there's all"
01:09:24;01:09:28;"these weird ways it's not necessarily legal but like a little weird people who have connections"
01:09:28;01:09:34;"to the government can get these contracts so anyway biden was looking for funding for his"
01:09:34;01:09:39;"charter school business and guess what this guy joe abruzzo the florida state senator sat on a"
01:09:39;01:09:44;"key appropriation subcommittee in the florida legislature i already have one question you"
01:09:44;01:09:51;"can just hire a sitting state senator to be a lobbyist nick you're from dc you're from the"
01:09:51;01:09:56;"swamp you're allowed to do this you just like hire i was sure it was illegal i mean it's literally"
01:09:56;01:10:03;"what they call the revolving door where you know sitting politicians sort of leave to go right into"
01:10:03;01:10:10;"else you know that l street lobbying i mean so no this sounds like news to me okay so then joseph"
01:10:10;01:10:16;"abruzzo he said to frank and he said this in a video we may need a little help from the vice"
01:10:16;01:10:20;"president who at the time was joe biden the administration talking to some senators and"
01:10:20;01:10:23;"frank biden said my brother's long-term relationships in the senate proved to be the final"
01:10:23;01:10:28;"nail in the coffin to be able to pull this thing forward but then it became a whole thing because"
01:10:28;01:10:33;"people said well hold on a second if somebody was getting paid and then you use your connections to"
01:10:33;01:10:39;"your brother that's not cool like for instance this guy joseph abruzzo received nine hundred"
01:10:39;01:10:47;"thousand dollars in lobbying fees and at some point after this the oil heiress hired frank"
01:10:47;01:10:52;"biden to work for her oil company and she was on record saying frank biden's very close to me he"
01:10:52;01:10:57;"worked for me and then when this got complicated she took it back and said actually he never worked"
01:10:57;01:11:03;"for me and frank biden he denies all of it he said i've never made a dime from any association"
01:11:03;01:11:08;"with my brother joey and it's just wrong to imply otherwise just wrong so he feels like it's not"
01:11:08;01:11:14;"fair but anyway i i don't really care about you know whatever politicians are crooks what else"
01:11:14;01:11:21;"is new it happens not here to judge but it is interesting to think that joe biden who's now"
01:11:21;01:11:26;"our current president played a key role in it and at least part of his connection to it was that his"
01:11:26;01:11:32;"brother it all started with one woman so anyway i rather than frame it negatively as a tale of"
01:11:32;01:11:35;"corruption or anything like that we could frame it positively saying one person can make a"
01:11:35;01:11:39;"difference if you have something you really care about you have nine hundred thousand dollars"
01:11:39;01:11:44;"and you know the right florida state senator who might know the brother of a vice president"
01:11:44;01:11:49;"or president you might be able to to get a random type of meat you don't like fully banned in the"
01:11:49;01:11:55;"u.s your issue us has to also be one that's like not controversial in the least or gonna impact"
01:11:55;01:12:00;"anyone's bottom line right yeah if you wanted to get so if you felt passionately about cows"
01:12:00;01:12:06;"and you wanted to get beef and beef steaks banned i think you're probably gonna need more like yeah"
01:12:06;01:12:10;"nine hundred thousand is not gonna cut it but it is like beating a dead horse or whatever"
01:12:10;01:12:17;"you know i mean i know this is you're going after no one was like the horse meat industry"
01:12:17;01:12:21;"can't stand up for itself it can't lobby for itself there's not enough money there"
01:12:21;01:12:27;"there's already a bias against horse meat in the u.s so yeah it's not difficult it probably wasn't a"
01:12:27;01:12:35;"lincoln style you know crazy 48 hours of you know franco brusso and frankie biden on the phone with"
01:12:35;01:12:41;"joey joey we got the votes we got the votes he's like oh i'm working on it we got the big horses"
01:12:41;01:12:49;"coming in oh you know we're still missing a few i wonder how bernie voted on that that should be"
01:12:49;01:12:54;"public record yeah this might be too hard to look up right now but anyway for some people maybe that"
01:12:54;01:13:00;"makes you love biden even more he played a significant role in getting horse meat and"
01:13:00;01:13:05;"i think it's kind of a non-issue because even some you know republican who hates biden i just don't"
01:13:05;01:13:11;"see them using this as the tool against him it doesn't really like serve anybody because"
01:13:11;01:13:16;"most americans are not interested in horse meat although couldn't you see like a funny like"
01:13:16;01:13:23;"tucker carlson segment on uh frankie biden like hunter biden style like the president's brother"
01:13:23;01:13:26;"yeah enough already with a hunter biden we're talking about frankie biden no i can totally"
01:13:26;01:13:33;"picture tucker carlson just being like and while you may not enjoy eating horse meat me personally"
01:13:33;01:13:39;"i prefer beefsteak what gives you the right to tell your fellow american that they cannot eat this"
01:13:39;01:13:46;"is it because the biden crime family decided that no longer shall any american eat this is this what"
01:13:46;01:13:52;"america is becoming that one person can ban this type of meat well hold on a second really think"
01:13:52;01:13:56;"about it is that the america you want to live in there's nothing about meat in the constitution"
01:13:56;01:14:03;"bernie co-sponsored the safeguard american food exports act which would prohibit the slaughter"
01:14:03;01:14:12;"of horse for meat so sanders is very decidedly anti-horse meat pro horse anti-horse meat"
01:14:12;01:14:26;"hey what's the matter you can't do all the things that we used to do and it sucks and it's bad"
01:14:26;01:14:37;"who's a good boy what's the kill joy got some money now we're fighting over new toys"
01:14:41;01:14:42;"isn't it sad"
01:14:42;01:14:55;"i'm sitting in my usual chair feeling the walls around me closing up in a state of disrepair"
01:14:55;01:15:00;"and try to make it till the morning"
01:15:00;01:15:05;"it's not enough it's not enough"
01:15:09;01:15:17;"every single day"
01:15:17;01:15:22;"the horses don't seem like also like the most efficient kind of vehicle for"
01:15:22;01:15:27;"raising a lot of meat they're very slimy animals yeah i still wouldn't think that"
01:15:27;01:15:31;"in the years that it takes to raise a horse i mean you're just not going to get"
01:15:31;01:15:36;"a lot of bang for your buck which is kind of a disgusting way to look at it but"
01:15:36;01:15:40;"maybe part of the issue is that they is that in america we do use horses for so much"
