Start Timestamp;End Timestamp;Transcript
01:15:40;01:15:49;"we watch them race they pull our carriages so much so there are a lot of there are a lot of"
01:15:49;01:15:54;"horses in america so maybe part of the issue is that are there horses being slaughtered and that"
01:15:54;01:16:02;"meat could have gone towards feeding the hungry is it an issue like that because again i said this"
01:16:02;01:16:07;"at the beginning i've seen this argument before whereas sometimes pedotypes will say all these"
01:16:07;01:16:11;"dogs and cats get put down all the time if people want to eat meat they should eat that"
01:16:11;01:16:15;"you know people say this and i don't know what the counter argument is"
01:16:15;01:16:19;"no it's an interesting argument and then you'd also just get into the life liberty and pursuit"
01:16:19;01:16:24;"of happiness thing you just get like somebody like seinfeld he comes from a country in a city"
01:16:24;01:16:28;"where people eat horse meat that might have emotional connections to him that might have"
01:16:28;01:16:34;"a cultural resonance to him and the idea that every that there could be enough horses in america to"
01:16:34;01:16:40;"at least supply uh you know one kind of hipster la restaurant where a guy like seinfeld can go and"
01:16:40;01:16:45;"and eat horse meat that you know i don't it's not ruining your life that you can't have it but it's"
01:16:45;01:16:53;"like when you you know the aroma the taste brings you back like these are you know food is culture"
01:16:53;01:16:58;"food is emotional for people it's a misrepresentation of my own relationship with"
01:16:58;01:17:03;"horse meat and i want to distance myself no judgment to anybody who does consume horse meat"
01:17:03;01:17:08;"just want to sort of you know i don't know why you're back wait i'm i mean it's okay all right"
01:17:08;01:17:12;"i wasn't no but seriously so you're saying there's there are still multiple montreal horsemeat"
01:17:12;01:17:17;"restaurants functioning right now that's what your research is showing that's what my my"
01:17:17;01:17:22;"calculations were showing that this can you still pull up the menu on one of those yeah give us some"
01:17:22;01:17:28;"more info on one of these all right like are we getting steaks are we getting like uh well jake"
01:17:28;01:17:34;"and i have had a similar experience i think we may be the only two then on here if seinfeld's telling"
01:17:34;01:17:40;"the truth that have eaten horse meat well that's right and we both ate it in japan we're separately"
01:17:40;01:17:47;"separate trips i would love to go to japan with you nick same maybe horse meat date but i was"
01:17:47;01:17:54;"served uh at an omok pasta restaurant like course number seven they brought out and i i really didn't"
01:17:54;01:17:59;"know you know they don't really sort of don't know what you're eating but they brought out um horse"
01:17:59;01:18:07;"carpaccio so just thinly sliced raw horse this is raw and is it what they squeeze some lemon on it"
01:18:07;01:18:13;"it's like italian some lemon and pepper yeah was it similar to beef carpaccio very and it was good"
01:18:13;01:18:19;"it is it's a little bit so it was good i mean the idea is a bit maybe sort of unsettling or off-putting"
01:18:19;01:18:24;"at first but it was very good and it's one of those situations where it was very small dining and i"
01:18:24;01:18:30;"just felt like oh i have to eat this and then i was with amantha who was had wanted nothing to do"
01:18:30;01:18:34;"with it but she also didn't want to look like her plate was full so i had to eat all of hers too"
01:18:34;01:18:41;"and so it was really an overload so it looked like we had cleaned the plate and then later i was"
01:18:41;01:18:45;"talking to a friend of mine in japan i said where do they get in they said oh that's interesting"
01:18:45;01:18:51;"and this is similar to what we've now discovered which is that there it's it is such a delicacy"
01:18:51;01:18:59;"and it is so expensive typically there because they bring in the horses from north carolina"
01:18:59;01:19:03;"or wherever they have to ship the horses there and then they're and then they have to slaughter"
01:19:03;01:19:10;"them in japan yeah and that's a trip yeah moving live horses i mean i wonder if they're flying them"
01:19:11;01:19:19;"probably just buy some weird like animal cargo plane oh god that's so heavy jake you also ate"
01:19:19;01:19:28;"horse meat in japan did you fly japan just to do that um no i was there like i was there 20 years"
01:19:28;01:19:34;"ago on tour with the uh american indie pop band dear nora oh yeah friend of the show friend of"
01:19:34;01:19:40;"the show katie yeah and so i yeah we were at like a sushi train kind of place you know where like"
01:19:40;01:19:46;"there's the the carousel kind of going around you can try moving around dishes off you know and it's"
01:19:46;01:19:51;"all fish and stuff and then i remember like there was one dish that kept passing me by that was like"
01:19:51;01:19:59;"just like just blood red just like the deepest deepest burgundy like just and then there was"
01:19:59;01:20:03;"like the chef's thing there and i was like what is that and he goes horse and i was like all right"
01:20:03;01:20:09;"well one in rome one in tokyo and honestly i don't really remember it i mean it was just sort"
01:20:09;01:20:15;"of like rich kind of like meaty kind of i don't yeah there may have been like a sauce on it i"
01:20:15;01:20:25;"honestly don't really remember it you know it's never easy to even try to please me sometimes i'm"
01:20:25;01:20:37;"such a tease and sometimes i'm a liar i've seen you get frustrated i've seen you aggravated"
01:20:38;01:20:41;"i've seen you agitated too"
01:20:41;01:20:50;"it's so easy to take the blame when everything i do comes back again"
01:20:50;01:20:56;"and i haven't felt the same my friend since you went away"
01:20:59;01:21:10;"all those times i made you cry and i didn't have an alibi there are things i can't deny since you"
01:21:10;01:21:22;"went away away it is funny that you can eat venison in america because i've had venison"
01:21:22;01:21:28;"like at least once or twice and actually i feel can i just do it like a quick poll here"
01:21:28;01:21:32;"are you guys grossed out by the idea of eating venison honestly yeah i have a very"
01:21:32;01:21:38;"unadventurous palate and so a little i'm a little grossed out by it um by anything that's not horse"
01:21:38;01:21:42;"i thought it's a very unadventurous thought anything outside of horse he's like"
01:21:42;01:21:48;"like a lot of people consider chicken is a regular kind of regular thing and seinfeld"
01:21:48;01:21:52;"but now i'm oh but this is interesting it's interesting i'm seeing chicken through your"
01:21:52;01:21:59;"eyes it's just like a horse meat guy and you're kind of like the feathers the beak it's like and"
01:21:59;01:22:05;"and you know this like pale weird color i can see how for a horse meat guy like you chicken is gross"
01:22:05;01:22:10;"and that's what's interesting about this whole conversation is that everybody has a different pov"
01:22:10;01:22:16;"you know i'm starting to feel like a horse myself because i'm being branded i'm being branded"
01:22:16;01:22:22;"somebody who enjoys horses and and i just want to dispel that notion um i just want to you know get"
01:22:22;01:22:30;"get that rumor um you know d d circulated um you were asking about what how horse was prepared in"
01:22:30;01:22:35;"montreal and i'm looking at an article from montreal eater um so a lot of these restaurants"
01:22:35;01:22:41;"this is from 2014 from i could tell are defunct but a couple are still in business and i'm seeing"
01:22:41;01:22:48;"there's a horse burger that was served at a restaurant called brisket um i'm seeing one"
01:22:49;01:22:55;"a lot of horse tartar um so that's raw again right yeah um there's a lot of raw horse being"
01:22:55;01:23:01;"eaten in this world yeah for sure and then um it's a restaurant called tripes and caviar that"
01:23:01;01:23:08;"serves horse marrow snails and morello cherries which is an odd combination and then there's a"
01:23:08;01:23:15;"restaurant with that restaurant again stripes and what it's called tripes and caviar jesus christ"
01:23:15;01:23:20;"tripes and caviar in montreal that kind of makes me think of there's a pet store in burbank called"
01:23:20;01:23:25;"scales and tails oh i spend a lot of time at scaling oh you go to scales and tells once a"
01:23:25;01:23:30;"week of a restaurant a restaurant in montreal called scales and tails and then finally there's"
01:23:30;01:23:36;"one here called joe beef and joe beef still seems to be joe beef is a famous oh i i know joe beef is"
01:23:36;01:23:41;"a famous restaurant that's like i've been there too yeah oh they serve horse well in montreal"
01:23:41;01:23:48;"joe beef at joe beef in montreal they serve a bacon wrapped tornado of horse that's a that's"
01:23:48;01:23:55;"like a fillet with beef frank and foie gras sauce so i mean you gotta have a real rare no joe beef"
01:23:55;01:24:00;"is like an influential beloved restaurant i've never been there but i've heard a lot about it"
01:24:00;01:24:03;"oh wow people are really into food it'll be like oh joe beef in montreal that's one of that's a"
01:24:03;01:24:11;"great restaurant oh joe beef serves horse they got open to joe horse all right well i think we"
01:24:11;01:24:16;"learned a lot about horse meat i'm still not interested in horse meat myself but uh you are"
01:24:16;01:24:20;"interested in the business of horse meat i'm interested in the business side and i do think"
01:24:20;01:24:25;"the vegan argument is compelling if you're going to eat animals like what are these bizarre lines"
01:24:25;01:24:29;"you're drawing i can see from it's really not hard to understand the point of view of somebody's like"
01:24:29;01:24:35;"i don't want to eat any animals and then somebody's like well yeah you're not going to catch me eating"
01:24:35;01:24:40;"horse but i would eat all these other to the the vegan perspective it's like what are you saying"
01:24:40;01:24:48;"man it doesn't make sense we've talked about um how ted turner oh ted turner he's a horse you know"
01:24:48;01:24:54;"no he's well he might be but you know he's a he's a buffalo guy oh and just to your point of like"
01:24:54;01:24:59;"where do you make these distinctions he really sort of doubled down and all ted's montana grill"
01:24:59;01:25:06;"which is an eatery in atlanta oh right and it's sort of a chain there they serve only buffalo"
01:25:07;01:25:10;"and i know a lot of people who would eat a buffalo burger who probably wouldn't eat horse"
01:25:10;01:25:16;"i mean it's not hard to understand where they're coming from but okay anyway the next seven"
01:25:16;01:25:21;"episodes are also about horse meat so you know we're just we're just we got a lot to get into um"
01:25:21;01:25:30;"now it's time for the top five it's time for the top five on itunes"
01:25:33;01:25:40;"this week we're going to be comparing the top five songs of 2006 this week in 2006 on the"
01:25:40;01:25:49;"billboard charts with the top five songs on apple music today why 2006 anybody well that was the"
01:25:49;01:25:55;"year of the uh bombshell legislation that the band horse meat it was probably the worst year of a lot"
01:25:55;01:26:02;"of american horse meat lovers lives 2006 but there's some great music and let's jump into it"
01:26:02;01:26:07;"the number five song this week in 2006 mary j blige with be without you"
01:26:07;01:26:20;"i wonder if legislation sort of colored the music oh this song is sick oh yeah"
01:26:28;01:26:29;"now this brings me back man"
01:26:29;01:26:36;"the final thriving days of american horse meat industry"
01:26:36;01:26:40;"all the horse meat restaurants starting to close their doors"
01:26:40;01:26:49;"we didn't build nothing overnight cause a love like this takes some time"
01:26:51;01:26:58;"people swore it off as a phase said we can't see that now from top to bottom they see that we did"
01:26:58;01:27:05;"that yes it's so true that yes we've been through it yes we got yeah see baby we've been too strong"
01:27:05;01:27:16;"for too long and i can't be without you baby oh yeah that's a great song"
01:27:16;01:27:22;"oh anybody who's ever loved you know just what i feel is this song about horse meat"
01:27:22;01:27:29;"nothing can replace it i don't think i realized the context at the time the you is horse me"
01:27:29;01:27:38;"i got a question for you you already know the answer still i want to ask you would you lie"
01:27:38;01:27:45;"no make me cry no do something behind my back and then try to cover it up well neither would i"
01:27:45;01:27:54;"baby my love is only yes enough i'll be faithful 2006 i was doing a lot of uh"
01:27:54;01:28:02;"grocery delivery in san francisco listening to the radio yeah a lot of radio i don't think yeah"
01:28:02;01:28:08;"it was like i was driving my boss's old beat-up minivan so like there was no way to do like an"
01:28:08;01:28:15;"aux in on the uh ipod just listen to radio just rocking san francisco radio"
01:28:15;01:28:29;"nothing can replace it"
01:28:30;01:28:37;"bad"
01:28:37;01:28:43;"all right let's move on to this year the number five song on apple music right now now this is a"
01:28:43;01:28:47;"very interesting story this is a giant hit i don't know if we've talked about on the show glass"
01:28:47;01:28:54;"animals with heat waves so glass animals basically people describe them as like an indie band and then"
01:28:56;01:29:01;"this song has become like one of the biggest songs ever the song went to number one on the"
01:29:01;01:29:05;"yeah this is song is giant it went to number one on the u.s charts"
01:29:05;01:29:21;"wait so what do you mean it's one of the biggest songs ever it's like the the biggest number one"
01:29:21;01:29:28;"from a uk artist since the spice girls it's like been on the charts for like a year plus"
01:29:28;01:29:34;"it was released in 2020 yeah so that's another element it took almost two years to go to number"
01:29:34;01:29:42;"one"
01:29:42;01:29:51;"wow"
01:29:51;01:30:10;"i mean i like this song i would not have called it to be like a giant number one smash"
01:30:11;01:30:21;"no i mean it sounds cool"
01:30:21;01:30:37;"i thought he said freaking me out i thought so too i like freaking more"
01:30:39;01:30:45;"yeah like damn it's hot like it's a little too hot for a june night yeah it's a little"
01:30:45;01:30:52;"uncomfortable he's talking about having kind of like a delusion road shimmer wiggling the vision"
01:30:52;01:30:59;"heat waves i'm swimming in the mirror"
01:31:06;01:31:12;"is he sort of like a solo kind of like a tame impala kind of thing i think it's kind of a"
01:31:12;01:31:17;"tame impala where it's like a band but it's really built around this guy dave bailey he wrote and"
01:31:17;01:31:23;"produced this song so that puts him in kind of like that rare camp of people like paul mccartney"
01:31:23;01:31:30;"soldier boy prince who performed wrote and produced a number one single"
01:31:30;01:31:44;"sometimes"
01:31:44;01:31:52;"sometimes i think about is you late nights in the middle of june he waves been freaking me out"
01:31:52;01:32:03;"who's that australian dude with the one one word name like goydia or what oh yeah go to go to go to"
01:32:03;01:32:10;"a he hasn't released any music since that huge hit yeah really that was like when was it like"
01:32:10;01:32:18;"five six seven years ago i think that was 2012 10 years ago 10 years ago good for him i really"
01:32:18;01:32:24;"was dope i really respect him just laying back in the cut he's probably got tons of money like"
01:32:24;01:32:29;"why does he need to rush why does he need to put out any music i mean thank you at this point it's"
01:32:29;01:32:37;"sort of like i mean yeah maybe he's just like moved on nailed it his record label calls him"
01:32:37;01:32:45;"10 years later and he's like what's the need to rush yeah don't rush me man you want another"
01:32:45;01:32:50;"somebody that i used to know i could need a little more time in the lab it is what it is"
01:32:50;01:32:58;"back off the number four song this week in 2006 the year the horse meat died james blunt with"
01:32:58;01:33:11;"you're beautiful"
01:33:16;01:33:22;"i didn't know james blunt had like huge hits like this this was his giant hit yeah i mean"
01:33:22;01:33:28;"it's kind of interesting going from the glass animals over to the james blunt like kind of"
01:33:28;01:33:35;"solo british guy right except glass animals has almost like a hip-hop beat yeah my life is"
01:33:35;01:33:46;"brilliant my love is pure i saw an angel oh wait dude i'm okay i'm totally confused i was thinking"
01:33:46;01:33:52;"of um james blake oh yeah yeah no yeah james james blake is like an electronic musician"
01:33:52;01:33:58;"who sings too right yeah yeah yeah yeah that's what i was thinking of i was like james blake"
01:33:58;01:34:04;"had a huge hit oh yeah okay sorry i was that's why i was confused this is like singers"
01:34:04;01:34:14;"no james blake is a beloved very talented musician who has big songs but not like a"
01:34:14;01:34:20;"number one billboard kind of thing so far that's who i was thinking of and i was like what the hell"
01:34:20;01:34:28;"is going on james blake okay james blunt you're beautiful james blunt is a is a little bit twitter"
01:34:28;01:34:34;"famous for being very self-deprecating when people try to oh yeah yeah it's sort of like a well-known"
01:34:34;01:34:39;"like i'm looking at some of his best stuff like like is this the type of thing that he would"
01:34:39;01:34:47;"tweet just like vladimir putin like exit the ukraine or i'll make you listen to my hit 2006"
01:34:47;01:34:52;"single you're beautiful on repeat just like uh i don't know i don't know if that's appropriate"
01:34:52;01:34:59;"dude no i mean a the song's not that bad b i don't know if it's appropriate you inserting"
01:34:59;01:35:05;"yourself into the the suffering of the ukrainian people and well where what are some actual examples"
01:35:05;01:35:12;"it kind of reminds me of like the eve six guy too being like hey kamala harris do you like the"
01:35:12;01:35:19;"heart and a blender song yeah it's like that that is funny yeah it's like that but about one just"
01:35:19;01:35:26;"the one song like okay here's here's some james blunt a fan not a fan somebody on twitter tweeted"
01:35:26;01:35:30;"at him why does james blunt have a million followers he stopped being relevant 2009"
01:35:30;01:35:37;"james blunt quote tweets it and goes 2006 actually another person says there's a best"
01:35:37;01:35:44;"of james blunt really james blunt yep it's called greatest hit greatest hit single damn"
01:35:44;01:35:51;"that's sad twitter kind of ruins everything like that'd be one thing if you met james blunt at like"
01:35:51;01:35:57;"a dinner party and some ass at the party was like what are you doing at this fancy dinner party"
01:35:58;01:36:02;"you haven't been relevant since 2009 and he's just like eating his horse stick and he looks up and"
01:36:02;01:36:08;"goes 2006 actually if you were somebody you'd be like and then you'd leave that dinner party and"
01:36:08;01:36:13;"say you know i was dining in english high society recently and you know you know who's actually"
01:36:13;01:36:18;"quite a wit james blunt and you tell that story and people be like that's funny wow he came up"
01:36:18;01:36:23;"with that he's like winston churchill he came up with that on the fly you're like that's amazing"
01:36:23;01:36:28;"yeah and then this other ass at the party said like asked him what he was up to and he said do"
01:36:28;01:36:31;"you know they're about to release my greatest sis they said you have a greatest tits and he said"
01:36:31;01:36:36;"well in all truth it should be called the greatest hit and i was like damn this guy's just funny"
01:36:36;01:36:43;"he's funny you know and then there's something about wild yeah he's oscar wild"
01:36:43;01:36:50;"i'm like james let's locate this oscar wilder and then then the fact that it's happening over"
01:36:50;01:36:55;"and over again on twitter is just like so much less cool i mean whatever i'm not dissing james"
01:36:55;01:37:01;"blunt these are just the times we live in i was once a twitter user myself i can't but i'm just"
01:37:01;01:37:06;"saying like the story would be so cool if it was just like this word of mouth thing where you're"
01:37:06;01:37:12;"just like my friends it's the difference between we really need to invite james blunt to the dinner"
01:37:12;01:37:20;"party do guys we cannot invite james blunt to the dinner party yeah we already heard all the best"
01:37:20;01:37:25;"ones yeah do you think james blunt has this is a bit of a different tone do you think james blunt"
01:37:25;01:37:30;"has run out of his you're beautiful money yet james blunt quote tweets it this is a year ago"
01:37:30;01:37:38;"ha ha ha ha ha ha ha no nice that's also when it's like it went from being charming and self-deprecating"
01:37:38;01:37:45;"to a little bit of just like go i want james blunt not even looking up from his horse steak and saying"
01:37:45;01:37:52;"2006 actually but also i i do want to say james blunt's a very interesting character because you"
01:37:52;01:37:57;"know he was a nato soldier so actually now i take it back he might actually have maybe he is handling"
01:37:57;01:38:03;"the peace negotiation i feel like there is some story yeah no it's true there is some story that"
01:38:03;01:38:10;"some people credit him with like averting world war iii in the 90s because he was like serving in"
01:38:10;01:38:17;"like kosovo or something and he his commander told him to like i don't know kill slobodan"
01:38:17;01:38:24;"milosevic and james blunt was like no sir i won't do that whatever it was he didn't do something"
01:38:24;01:38:28;"that would have exacerbated a situation i guess now we might as well look it up here's another"
01:38:28;01:38:34;"example of uh of one of his witticisms self-deprecating witticisms this one did make me"
01:38:34;01:38:39;"laugh though so uh right in the middle because this one seems unprompted this is just going"
01:38:39;01:38:46;"just inserting himself into the joe rogan neil young fiasco if that spotify doesn't remove"
01:38:46;01:38:53;"at joe rogan i will release new music on the platform okay you're right that is funny it's"
01:38:53;01:39:01;"a little convoluted but this is on uh bbcnews.com headline singer james blunt quote prevented world"
01:39:01;01:39:07;"war iii the kicker is he told the bbc he refused in order to attack russian troops when he was a"
01:39:07;01:39:13;"british soldier in kosovo a blunt said he was willing to risk a court martial by rejecting"
01:39:13;01:39:19;"the order from a u.s general but he was backed by british general sir mike jackson who said quote"
01:39:19;01:39:24;"i'm not going to have my soldiers be responsible for starting world war iii well okay it really"
01:39:24;01:39:32;"does fit into the current conflict james blunt as a soldier recognized that nato troops attacking"
01:39:32;01:39:40;"russian troops would cause quite the quagmire apparently when the american general gave him"
01:39:40;01:39:46;"the order james blunt said i won't do it and if you ask me again i'll release a hit song called"
01:39:46;01:39:53;"you're beautiful and the guy was like i don't get it and he said oh you will i will release"
01:39:53;01:39:58;"a song called you're beautiful that it'll be a bad song and he's like if it's a bad song"
01:39:59;01:40:04;"how would it be a big hit he's like don't worry about it you seem like a nice guy i can't i don't"
01:40:04;01:40:10;"understand why a song you release would be that bad that i would regret giving you this order"
01:40:10;01:40:15;"and james bunt's just like oh you just wait and see it'll be absolutely terrible and everyone"
01:40:15;01:40:22;"will love it he needs to quit beating himself up the number four song right now little jerk aha"
01:40:23;01:40:28;"it is like video everything i'm saying is more all props"
01:40:29;01:40:35;"is not really listening i'm gonna have to be smart fly fly man don't respond"
01:40:35;01:40:42;"i'm like you trippers get it go get it they dropping locations oh yeah we listened to this"
01:40:42;01:40:50;"before right i like this oh yeah because this is part of it like a back and forth with nba young boy"
01:40:52;01:40:58;"they really don't mean it he say it it's songs they really don't mean it he's playing"
01:40:58;01:41:02;"we've been slammed through they box and they don't know we have but he has got shot and we"
01:41:02;01:41:07;"ain't claiming but i can show his dad it's acting like they really like this is my brody dad just"
01:41:07;01:41:13;"get out the fans you bring up murder you like this one jake that's funny i was walking down"
01:41:13;01:41:20;"york boulevard yesterday and a car pulled up to the red light and like as soon as they like i was"
01:41:20;01:41:25;"like walking right past them and like this song started in that second and this car must have had"
01:41:25;01:41:30;"like the most amazing sound system because like the voice in the beginning sounded so crisp and"
01:41:30;01:41:36;"honestly it sounded amazing just the first like 10 seconds of the song and then the lights are"
01:41:36;01:41:42;"green and the car sped off and i was like what was that and honestly just hearing it right now"
01:41:43;01:41:45;"the best part was before the drums came in"
01:41:45;01:41:58;"what was like the first hit rap song with"
01:41:58;01:42:08;"the first song like yeah soldier boy uh pretty boy swag i think is probably what you're referring"
01:42:08;01:42:14;"oh yeah it's done done done done done done pretty boy he's talking about me and piss me off and i'm"
