Start Timestamp;End Timestamp;Transcript
50:54;50:58;"Well, it's so subjective anyway, but I'm just talking in terms of a feel-good story."
50:58;51:00;"I mean, I think they can both be feel-good."
51:00;51:04;"I mean, she'll have many more chances, that's true."
51:04;51:06;"She's so young."
51:06;51:08;"But I don't know."
51:08;51:11;"I just think that's also a feel-good story."
51:11;51:18;"I would have to judge them all based on just the work alone and not the story, you know?"
51:18;51:20;"Not based on the color of their skin."
51:20;51:22;"Jay-Z admitted to cheating."
51:22;51:23;"On the Grammys?"
51:23;51:24;"Yeah, on his album."
51:24;51:25;"Oh."
51:25;51:26;"Cheating on his album?"
51:26;51:27;"What do you mean?"
51:27;51:32;"Well, it was the whole thing about how he revealed that he cheated on Beyonce and that"
51:32;51:33;"was the big..."
51:33;51:34;"Oh, cheated on his wife."
51:34;51:35;"I thought you meant..."
51:35;51:38;"Sorry, I missed that completely."
51:38;51:39;"Maybe that was part of Jay-Z's Grammy campaign."
51:39;51:41;"Start up some drama."
51:41;51:43;"It's just like when you're running for office, sometimes you got to get some shit out of"
51:43;51:44;"the way."
51:44;51:45;"Well, I'm pushing for Bruno."
51:45;51:46;"Pushing for..."
51:46;51:47;"Oh my God."
51:47;51:52;"I thought there was going to be mass consensus that this is Kendrick's year."
51:52;51:55;"Kendrick 100% above Bruno."
51:55;52:01;"I'm not saying that I have the same glee that there's no white men in album of the year."
52:01;52:03;"I'm with it though."
52:03;52:05;"You know, there should be some..."
52:05;52:09;"I can't think of a white guy that's like, you know, should be on that list."
52:09;52:10;"Okay, but I'm just trying to go..."
52:10;52:11;"Besides Sheermag."
52:11;52:12;"I think it's all..."
52:12;52:14;"Which is fronted by a woman."
52:14;52:15;"Okay, look."
52:15;52:16;"I think it's all..."
52:16;52:17;"I think all of this is nonsense."
52:17;52:20;"Look, I think all the Grammys are nonsense."
52:20;52:27;"Although it feels good to win one as a Grammy winner, but it also feels bad to lose one"
52:27;52:28;"as a Grammy loser."
52:28;52:29;"That'd be a cool speech."
52:29;52:30;"Grammys are nonsense."
52:30;52:35;"No, the Bon Iver kind of did that once and everybody was like, ""Oh, shut up."
52:35;52:36;"Stay home then."""
52:36;52:37;"Right."
52:37;52:38;"And they're kind of right."
52:38;52:41;"He's kind of like the Jonathan Franzen gone, you know, like an Oprah being like, ""I don't"
52:41;52:43;"want to be part of your book club."""
52:43;52:45;"Honestly, your book club sucks."
52:45;52:46;"Yeah, no."
52:46;52:49;"It's like if you show up, be like a polite guest at least."
52:49;52:50;"Fair enough."
52:50;52:51;"Yeah."
52:51;52:56;"But I saw on the internet that people were excited that there were no white men nominated"
52:56;52:57;"this year."
52:57;52:59;"We've got bad white men in the White House."
52:59;53:01;"I understand why people feel that way."
53:01;53:02;"They want to see fine..."
53:02;53:03;"You know, for once."
53:03;53:04;"Yeah, but okay."
53:04;53:05;"Okay, I don't want to..."
53:05;53:06;"That's ridiculous."
53:06;53:07;"Okay."
53:07;53:08;"The White House?"
53:08;53:10;"Here's what I like."
53:10;53:13;"I like intellectual consistency."
53:13;53:14;"You know what I'm saying?"
53:14;53:15;"Yeah."
53:15;53:20;"So, if you think white guys are whack and shouldn't be winning so many albums of the"
53:20;53:21;"year..."
53:21;53:22;"Across the board."
53:22;53:23;"Yeah."
53:23;53:29;"Okay, but I'm just saying that the Kendrick and the Jay-Z album have the least number"
53:29;53:31;"of white guys working on the album."
53:31;53:33;"So, I'm just saying, if you really want to be..."
53:33;53:35;"I don't like politics."
53:35;53:40;"I don't like when somebody says something like, ""Finally, no white male artists,"" and then"
53:40;53:43;"don't look under the hood and say, ""We got some white guys hiding in there too."""
53:43;53:48;"So, I'm just saying, again, I'm not toying the anti-white male line."
53:48;53:53;"You know I love Van Morrison, Bob Dylan."
53:53;53:54;"I'm just..."
53:54;53:55;"Bruce Springsteen."
53:56;53:57;"All I'm saying, though, is like..."
53:57;53:58;"I hear ya."
53:58;53:59;"If this is..."
53:59;54:01;"And look, there's got to be themes every year."
54:01;54:04;"If this is the year that's like, white guys take a back seat, that's fine."
54:04;54:05;"Come on."
54:05;54:07;"White guys are taking the front seat so much."
54:07;54:10;"But I'm just saying, let's do it right then."
54:10;54:11;"Go all the way."
54:11;54:12;"Because here's the thing."
54:12;54:14;"If some of these albums win..."
54:14;54:16;"I actually wrestled with this last time with the Beyonce album."
54:16;54:21;"A very powerful album about Beyonce's experiences as a black woman in America."
54:21;54:23;"Me and Diplo were talking about it up to the last minute."
54:23;54:24;"Oh, yeah."
54:24;54:25;"Our R2."
54:25;54:28;"Do me and Diplo really want to be standing behind her when she..."
54:28;54:29;"Do you bum rush the stage?"
54:29;54:30;"I don't know."
54:30;54:31;"Yeah, I'm glad we didn't bum rush the stage."
54:31;54:37;"But anyway, if this is the year that people are excited that it's about recognizing talent,"
54:37;54:41;"that white guys don't have to be part of every little thing, if that's how some people feel,"
54:41;54:43;"then let's do it right."
54:43;54:44;"Bruno."
54:44;54:52;"If the theme of the prom is enchantment under the sea, let's have shrimp cocktail."
54:52;54:54;"Don't order pizza because it's tasty."
54:54;54:55;"You know what I'm saying?"
54:55;54:59;"Let's say it is about the pure talent of each artist."
54:59;55:00;"No such thing."
55:00;55:07;"There's like 10 producers on every single one of those artists' lists, except for Lorde,"
55:07;55:10;"which is just two people, herself included."
55:10;55:13;"There's a lot of people worked on that album, though."
55:13;55:14;"Is there?"
55:14;55:15;"We're getting into the weeds."
55:15;55:16;"Yes, we're getting into the weeds."
55:16;55:20;"But if you look at the Lorde album credits, it's a lot of people."
55:20;55:24;"All of these albums, Bruno is probably the artist who single-handedly did the most in"
55:24;55:27;"that he produces and performs."
55:27;55:31;"But whatever, all these people, I'm not saying to take anything away from any of these people."
55:31;55:36;"I'm just saying to the Grammy world, if the theme of this year's prom is no white guys"
55:36;55:40;"on stage at the end, choose wisely, my friend."
55:40;55:47;"Because when they do that wide shot, you might see a whole bunch of Caucasian males."
55:47;55:53;"Now we should also point out, as we talk about album of the year, there was one white guy"
55:53;55:57;"who was a real shocker not to see in the album of the year list."
55:57;55:58;"Who's that?"
55:58;55:59;"Babe Grohl."
55:59;56:00;"No."
56:00;56:06;"The big shocker is because he put out maybe one of the most commercially successful albums"
56:06;56:07;"of the year."
56:07;56:08;"Ed Sheeran."
56:08;56:09;"Interesting."
56:09;56:11;"Friend of the show."
56:11;56:12;"Snubbed."
56:12;56:13;"Shut out of every category."
56:13;56:14;"Really?"
56:14;56:17;"I think he got some random nomination."
56:17;56:18;"Bedsheets wasn't..."
56:18;56:19;"No bedsheets."
56:19;56:21;"Okay, well here's the thing."
56:21;56:24;"There's four categories that are called the big four."
56:24;56:27;"Album of the year, which we've discussed at length."
56:27;56:29;"Forty minutes in on album of the year."
56:29;56:33;"First new artist, which is going to be different every year."
56:33;56:35;"And then the last two are record of the year and song of the year."
56:35;56:38;"So you're saying what's the difference between record of the year and song of the year?"
56:38;56:42;"Record of the year is awarded to the artists and the producers and the recording engineers"
56:42;56:43;"and the mixers and blah, blah, blah."
56:43;56:46;"Because record of the year is about the recording."
56:46;56:50;"Song of the year, this one's for the songwriters."
56:50;56:55;"So for instance, if Sinead O'Connor was nominated for Nothing Compares to You, she could be"
56:55;56:59;"nominated for record of the year because that's the recording."
56:59;57:00;"Yeah."
57:00;57:05;"But if Nothing Compares to You wins song of the year, you're going to see Prince up there"
57:05;57:06;"because he wrote that song."
57:06;57:08;"Sinead did not write that song."
57:08;57:09;"That one's for the songwriters."
57:09;57:10;"Sometimes it's the same."
57:10;57:12;"We're going back to 1990 now."
57:12;57:13;"We're going back to 90."
57:13;57:19;"So anyway, so those are the two biggest categories for songs and Bedsheets, Shape of You, major"
57:19;57:21;"song this year, was shut out."
57:21;57:37;"It's been seven hours and 13 days since you took your love away."
57:37;58:00;"I go out every night and sleep all day since you took your love away."
58:00;58:09;"I can see whoever I choose."
58:09;58:15;"Eat my dinner in a fancy restaurant."
58:15;58:28;"But nothing, nothing can take away this feeling."
58:28;58:40;"Nothing compares to you."
58:40;58:47;"It's been so lonely without you here."
58:47;58:56;"I'm like a bird without a song."
58:56;59:02;"Nothing can stop this lonely rain."
59:02;59:11;"Tell me baby, where did I go wrong?"
59:11;59:32;"I'm like a bird without a song."
59:32;59:58;"Nothing can stop this lonely rain."
59:58;01:00:28;"Tell me baby, where did I go wrong?"
01:00:28;01:00:34;"I'm like a bird without a song."
01:00:34;01:00:41;"I'm like a bird without a song."
01:00:41;01:00:48;"Tell me baby, where did I go wrong?"
01:00:48;01:00:54;"I'm like a bird without a song."
01:00:54;01:01:01;"Nothing can stop this lonely rain."
01:01:01;01:01:08;"Tell me baby, where did I go wrong?"
01:01:08;01:01:14;"I'm like a bird without a song."
01:01:14;01:01:20;"Tell me baby, where did I go wrong?"
01:01:20;01:01:27;"I'm like a bird without a song."
01:01:27;01:01:35;"Tell me baby, where did I go wrong?"
01:01:35;01:01:42;"I'm like a bird without a song."
01:01:42;01:01:52;"Tell me baby, where did I go wrong?"
01:01:52;01:02:02;"I'm like a bird without a song."
01:02:02;01:02:10;"Tell me baby, where did I go wrong?"
01:02:10;01:02:20;"I'm like a bird without a song."
01:02:20;01:02:30;"Tell me baby, where did I go wrong?"
01:02:30;01:02:50;"I'm like a bird without a song."
01:02:50;01:03:10;"Tell me baby, where did I go wrong?"
01:03:10;01:03:20;"I'm like a bird without a song."
01:03:20;01:03:30;"Tell me baby, where did I go wrong?"
01:03:30;01:03:40;"I'm like a bird without a song."
01:03:40;01:03:50;"Tell me baby, where did I go wrong?"
01:03:50;01:03:58;"I'm like a bird without a song."
01:03:58;01:04:08;"Tell me baby, where did I go wrong?"
01:04:08;01:04:18;"I'm like a bird without a song."
01:04:18;01:04:28;"Tell me baby, where did I go wrong?"
01:04:28;01:04:38;"I'm like a bird without a song."
01:04:38;01:04:48;"Tell me baby, where did I go wrong?"
01:04:48;01:04:58;"I'm like a bird without a song."
01:04:58;01:05:08;"Tell me baby, where did I go wrong?"
01:05:08;01:05:18;"I'm like a bird without a song."
01:05:18;01:05:28;"Tell me baby, where did I go wrong?"
01:05:28;01:05:38;"I'm like a bird without a song."
01:05:38;01:05:48;"Tell me baby, where did I go wrong?"
01:05:48;01:05:58;"I'm like a bird without a song."
01:05:58;01:06:08;"Tell me baby, where did I go wrong?"
01:06:08;01:06:18;"I'm like a bird without a song."
01:06:18;01:06:28;"Tell me baby, where did I go wrong?"
01:06:28;01:06:38;"I'm like a bird without a song."
01:06:38;01:06:48;"Tell me baby, where did I go wrong?"
01:06:48;01:06:58;"I'm like a bird without a song."
01:06:58;01:07:08;"Tell me baby, where did I go wrong?"
01:07:08;01:07:18;"I'm like a bird without a song."
01:07:18;01:07:28;"Tell me baby, where did I go wrong?"
01:07:28;01:07:38;"I'm like a bird without a song."
01:07:38;01:07:48;"Tell me baby, where did I go wrong?"
01:07:48;01:07:58;"I'm like a bird without a song."
01:07:58;01:08:08;"Tell me baby, where did I go wrong?"
01:08:08;01:08:18;"I'm like a bird without a song."
01:08:18;01:08:28;"Tell me baby, where did I go wrong?"
01:08:28;01:08:38;"I'm like a bird without a song."
01:08:38;01:08:48;"Tell me baby, where did I go wrong?"
01:08:48;01:08:58;"I'm like a bird without a song."
01:08:58;01:09:08;"Tell me baby, where did I go wrong?"
01:09:08;01:09:18;"I'm like a bird without a song."
01:09:18;01:09:28;"Tell me baby, where did I go wrong?"
01:09:28;01:09:38;"I'm like a bird without a song."
01:09:38;01:09:48;"Tell me baby, where did I go wrong?"
01:09:48;01:09:58;"I'm like a bird without a song."
01:09:58;01:10:08;"Tell me baby, where did I go wrong?"
01:10:08;01:10:18;"I'm like a bird without a song."
01:10:18;01:10:28;"Tell me baby, where did I go wrong?"
01:10:28;01:10:38;"I'm like a bird without a song."
01:10:38;01:10:48;"Tell me baby, where did I go wrong?"
01:10:48;01:10:58;"I'm like a bird without a song."
01:10:58;01:11:08;"Tell me baby, where did I go wrong?"
01:11:08;01:11:18;"I'm like a bird without a song."
01:11:18;01:11:28;"Most girls are fine though far we are unstoppable."
01:11:28;01:11:38;"Most girls are fighting like every day."
01:11:38;01:11:48;"Most girls are fine though far we are unstoppable."
01:11:48;01:11:58;"Most girls are fighting like every day."
01:11:58;01:12:08;"Most girls are fine though far we are unstoppable."
01:58:28;01:58:30;"With Ezra King."
01:58:30;01:58:34;"Beats 1"
01:58:34;01:58:36;"(explosion)"