Start Timestamp;End Timestamp;Transcript
24:18;24:24;"I hope and actually believe, because broadband is so darn important to people's lives now,"
24:24;24:27;"that they will vote on these kind of issues."
24:27;24:34;"Well, yeah, let's hope the Democrats can figure out how to turn it into a simple issue."
24:34;24:36;"Yeah, well, it's hard, right?"
24:36;24:40;"I mean, that's why I think it's important to compare it to cable."
24:40;24:42;"Do you like your cable operator?"
24:42;24:48;"If you like your cable operator and your cable service, then you're going to love life without net neutrality."
24:48;24:50;"It's really that simple."
24:50;24:57;"If you like controlling what you do on the Internet and don't want anybody coming in between you and that choice,"
24:57;25:00;"then you're pro net neutrality."
25:00;25:05;"Well, thanks so much, Gigi. It's been great talking to you, and you really elucidated these topics for us."
25:05;25:07;"And again, we appreciate you fighting the good fight."
25:07;25:10;"Well, any time. I'm happy to come on."
25:10;25:13;"I know a lot more than just about net neutrality."
25:13;25:19;"Anything having to do with networks, I'd love to come back and talk about them again."
25:19;25:21;"Love to talk to you again. Have a good one."
25:21;25:22;"Take care now."
25:22;25:23;"All right, bye."
25:23;25:24;"Bye."
28:34;28:38;"Big thanks to Gigi Son for taking the time to educate us on net neutrality."
28:38;28:42;"So what do you think, Jake? Are you pro net neutrality or anti?"
28:42;28:43;"I'm pro."
28:43;28:44;"Really?"
28:44;28:46;"Is that a contentious statement?"
28:46;28:48;"No, that seems like the right thing. I mean, if you're going to have--"
28:48;28:51;"I was hoping that Gigi Son would be like, ""You know what? I worked at the FCC for a long time."""
28:51;28:53;"It's all BS."
28:53;28:55;"We got to destroy the internet."
28:55;28:57;"I was hoping she'd say-- I'd be like, ""I could get behind that."""
28:57;29:02;"But it's one of those things. It's like if there's going to be the internet, it might as well be free and open."
29:02;29:04;"Seems like a no-brainer."
29:04;29:07;"I would be into destroying the internet, but yeah, this doesn't work."
29:07;29:10;"Going back to the mid-90s? Sounds good to me."
29:10;29:14;"Anyway, we're now joined by a friend of the show, Kazzy David."
29:14;29:15;"Welcome back."
29:15;29:17;"Thank you for having me."
29:17;29:18;"Glad to have you back."
29:18;29:25;"You know, it's been a long time, and we've been criticized for this, since Time Crisis has had a female voice on the show."
29:25;29:27;"Today we have two."
29:27;29:29;"Was I the first? There's no way."
29:29;29:31;"Oh, ever on the show? No, no."
29:31;29:37;"And here's the thing. Maybe this is a cop-out, but I feel like generally Time Crisis has had less and less guests."
29:37;29:38;"Yep."
29:38;29:41;"And so boiled down with no guests--"
29:41;29:42;"It's real one-on-one."
29:42;29:46;"It's de facto two cis men."
29:46;29:48;"That is what the show--"
29:48;29:50;"Middle-aged."
29:50;29:53;"Wow, actually, when does middle-age start?"
29:53;29:55;"I'm middle-aged at this point."
29:55;29:56;"Once you hit 40?"
29:56;29:57;"38."
29:57;29:58;"Oh, really?"
29:58;29:59;"I don't know."
29:59;30:01;"I guess it depends on how long you live."
30:01;30:02;"Yeah."
30:02;30:03;"Oh, right."
30:03;30:07;"Well, if you lived to about 76, 38 would be smack dab in the mid."
30:07;30:09;"Okay, so I'm approaching middle-age now."
30:09;30:16;"But anyway, it's important to have more female voices on the show because we don't talk about gendered things really on the show."
30:16;30:18;"They shouldn't be at least."
30:18;30:20;"Tasteful palette of 70s rock, Home Depot."
30:20;30:22;"I guess those things are a little bit gendered."
30:22;30:24;"We're trying to stop that."
30:24;30:26;"Yeah, no one's going to argue with that."
30:26;30:29;"Anyway, we got to talk about Thanksgiving, guys."
30:29;30:30;"Yeah."
30:30;30:35;"We talked a little bit about how my family was in town for Thanksgiving, but what did you do, Kazzy?"
30:35;30:41;"I went with my dad and we visited his brother and his family who we haven't seen in a long time."
30:41;30:42;"Like years?"
30:42;30:45;"I haven't seen them in like, yeah, five, six years."
30:45;30:46;"Where do they live?"
30:46;30:48;"They live in San Diego."
30:48;30:49;"Really?"
30:49;30:55;"We just popped down for like three hours and got out of there pretty much as quick as we could."
30:55;30:57;"Shots fired."
30:57;30:58;"That would be a bummer."
30:58;31:01;"So it's like a three-hour drive down there."
31:01;31:02;"Yeah."
31:02;31:03;"Then you're there for three."
31:03;31:06;"Have they been watching the new season of Curb Your Enthusiasm?"
31:06;31:09;"Like no one's said anything, so maybe not."
31:09;31:11;"This is like an episode of Curb-- it didn't come up?"
31:11;31:12;"It did not come up."
31:12;31:13;"That's amazing."
31:13;31:15;"No showbiz talk whatsoever?"
31:15;31:18;"There was like, ""Did you see that movie?"""
31:18;31:19;"""Yeah, what'd you think?"""
31:19;31:21;"Like, ""Good, yeah, what'd you think?"""
31:21;31:23;"Had they seen your web series?"
31:23;31:24;"No."
31:24;31:25;"Did they ask about it?"
31:25;31:26;"No."
31:26;31:27;"What did they at least say?"
31:27;31:28;"""So what have you been up to?"""
31:28;31:29;"Yeah, they did."
31:29;31:30;"And I said, ""You know."""
31:31;31:33;"Wait, so when they're catching up with your dad,"
31:33;31:36;"there's not some conversation that's like,"
31:36;31:38;"""So what have you been up to, Larry?"""
31:38;31:42;"And he's like, ""Well, the new season of my show has been on TV."""
31:42;31:46;"Yeah, that's exactly how it happened, and then I don't--"
31:46;31:47;"there's no responses."
31:47;31:48;"No, I mean, yeah."
31:48;31:50;"We were asking most of the questions."
31:50;31:52;"Maybe they don't want to have all the showbiz talk."
31:52;31:54;"They want to get into the real stuff."
31:54;31:55;"Yeah, that's probably it."
31:55;31:58;"And this is a traditional Thanksgiving dinner?"
31:58;32:01;"I mean, it was at 2.30, so I don't--"
32:01;32:03;"You know, that's another question that I've had."
32:03;32:04;"Yeah, that's weird."
32:04;32:07;"I did not like the 2.30 dinner."
32:07;32:10;"When did your family have Thanksgiving?"
32:10;32:12;"Usually more of like a four."
32:12;32:13;"Okay, so still afternoon."
32:13;32:15;"This year we did noon."
32:15;32:16;"Whoa."
32:16;32:17;"So it was fully a lunch."
32:17;32:18;"It was a lunch."
32:18;32:19;"Okay."
32:19;32:21;"That's like a breakfast almost."
32:21;32:26;"We ate at the Red Lion Inn in Stockbridge, Massachusetts,"
32:26;32:29;"we were out there with Hannah, and we were with her parents"
32:29;32:33;"and her aunt and uncle, six of us in total,"
32:33;32:36;"and we were late in booking a reservation at the Red Lion,"
32:36;32:39;"so all that was left was a noon seating."
32:39;32:40;"Oh."
32:40;32:44;"Because people book out, you know, eight, ten months in advance."
32:44;32:45;"Maybe it's better that way."
32:45;32:46;"I liked it."
32:46;32:47;"Yeah, eat early."
32:47;32:52;"We got up, half a bagel, coffee at like 8 o'clock."
32:52;32:53;"Yeah."
32:53;32:54;"Then by noon--"
32:54;32:55;"Thanksgiving."
32:55;33:00;"--sat down, had like a small glass of wine at noon,"
33:00;33:02;"a little early in the day, but went for it."
33:02;33:06;"Great meal, and then went and saw Lady Bird at like 4."
33:06;33:08;"And then you're walking on air."
33:08;33:09;"Walking on air the rest of the day."
33:09;33:11;"You saw a great film."
33:11;33:12;"Yeah."
33:12;33:13;"Best ever Rotten Tomatoes review."
33:13;33:14;"You're just walking on air."
33:14;33:15;"Yeah."
33:15;33:16;"Late dinner."
33:16;33:17;"Yeah."
33:17;33:18;"Late dinner, hit the sack?"
33:18;33:19;"Yep."
33:19;33:21;"Love it."
33:21;33:23;"Noon."
33:23;33:24;"2.30 is awkward."
33:24;33:27;"Well, and also it was so warm in Southern California."
33:27;33:28;"Heard that."
33:28;33:32;"Yeah, being at kind of like a slow 2.30 p.m. Thanksgiving lunch."
33:32;33:34;"Then driving back three hours?"
33:34;33:40;"Just that San Diego sun burning through the shades."
33:40;33:42;"It's not what the pilgrims intended."
33:42;33:43;"What time did you eat, Ezra?"
33:43;33:45;"It was a straight-up dinner."
33:45;33:48;"Probably 8 p.m."
33:48;33:49;"Wow."
33:49;33:50;"Yeah."
33:50;33:51;"Strong."
33:51;33:52;"It was a real dinner."
33:52;33:53;"So we were here."
33:53;33:56;"My parents came out here, and we did Thanksgiving with Rashida's family."
33:56;33:58;"And they do more of a proper dinner."
33:58;34:00;"I think it was like us on the East Coast."
34:00;34:02;"We'd be doing it at 3 p.m."
34:02;34:03;"Right."
34:03;34:05;"But it was like a real dinner."
34:05;34:08;"You know, we were at somebody else's house, so it was like a big one."
34:08;34:09;"There were a lot of people there."
34:09;34:10;"But it was a nice vibe."
34:10;34:12;"And did you cook at all?"
34:12;34:13;"No."
34:13;34:14;"You make some like Brussels sprouts or anything?"
34:14;34:15;"No."
34:16;34:17;"Nothing."
34:17;34:19;"This was like a huge Thanksgiving dinner, so it was like buffet style."
34:19;34:24;"Not the type of thing you're just going to roll up with Brussels sprouts to."
34:24;34:27;"Did everyone help make it, or it was like catered?"
34:27;34:29;"Yeah, it was like more or less catered."
34:29;34:31;"More or less."
34:31;34:32;"I think, you know what?"
34:32;34:35;"Maybe like low-key, the thing to do with Thanksgiving is you have to be involved in the cooking."
34:35;34:37;"It does give it more meaning."
34:37;34:38;"That's for sure."
34:38;34:39;"Yeah."
34:39;34:40;"Next year."
34:41;34:42;"That's right."
34:42;34:43;"I'm going to be a chef."
34:43;34:44;"I think I'm going to be a chef."
34:44;34:45;"You're going to be a chef."
34:45;34:46;"I'm going to be a chef."
35:02;35:30;"I'm going to be a chef."
35:30;35:51;"I'm going to be a chef."
35:51;36:19;"I'm going to be a chef."
36:19;36:48;"I'm going to be a chef."
36:48;36:49;"I'm going to be a chef."
37:11;37:13;"This could be the last time."
37:13;37:16;"Maybe the last time."
37:16;37:19;"I don't know."
37:19;37:21;"Anyway, do you guys care about the Grammys?"
37:21;37:22;"Deeply."
37:22;37:25;"Were you even aware that the Grammy nominations came out?"
37:25;37:26;"No."
37:26;37:27;"This past week?"
37:27;37:28;"Yeah, I looked at them."
37:28;37:32;"Because what, you woke up and you had a phone full of texts?"
37:32;37:33;"I just like--"
37:33;37:34;"Kazzy, did you see?"
37:34;37:35;"Healthy haul."
37:35;37:37;"No, I look at the news every morning."
37:37;37:41;"But it's like sick, to the point where it's not healthy."
37:41;37:47;"So I look at just every single piece of news I missed since I fell asleep."
37:47;37:50;"And do you think that helps you--"
37:50;37:53;"does that put a pep in your step when you started the day?"
37:53;37:54;"No, I think it's awful."
37:54;37:57;"But I did see all the Grammy noms, of course."
37:57;37:58;"OK."
37:58;38:02;"I saw people were very excited that this is apparently the first year"
38:02;38:08;"that none of the artists nominated for album of the year are white men."
38:08;38:09;"Oh, I didn't know that."
38:09;38:10;"You didn't know that?"
38:10;38:11;"That was like the big headline."
38:11;38:13;"I did not see that headline."
38:13;38:19;"There was a year in the late '90s when everybody nominated was female,"
38:19;38:23;"but that included the band Garbage, which has a female singer,"
38:23;38:26;"but still some white men in the band."
38:26;38:27;"Butch Vig."
38:28;38:31;"But I'm always a bit of a contrarian."
38:31;38:33;"Garbage was nominated for album of the year?"
38:33;38:34;"Yes."
38:34;38:37;"They lost to Lauryn Hill."
38:37;38:39;"That sounds about right."
38:39;38:43;"I think Garbage is a good band."
38:43;38:44;"Anyway."
38:44;38:45;"It's neither here nor there."
38:45;38:47;"Let's start with album of the year."
38:47;38:53;"This year the nominees are Childish Gambino, Jay-Z, Kendrick Lamar,"
38:53;38:56;"Lorde, and Bruno Mars."
38:56;38:59;"I hate to be a contrarian, but maybe just because I'm a music industry insider,"
38:59;39:01;"the first thing that I thought of was, you know what?"
39:01;39:04;"There's a lot of white men producers on some of those albums."
39:04;39:07;"Is it?"
39:07;39:08;"Yeah."
39:08;39:11;"Can you name the producers of all those records just off the top of your head"
39:11;39:12;"going down?"
39:12;39:13;"Well, now I'm looking at it."
39:13;39:14;"No, but I know--"
39:14;39:15;"Then we're getting really picky."
39:15;39:16;"No, no."
39:16;39:19;"I know Ludwig, who works with Donald on Childish Gambino."
39:19;39:20;"Okay."
39:20;39:23;"I know the Jay-Z album is produced by No I.D."
39:23;39:26;"Kendrick Lamar, I know DJ Da, he worked on that, among others."
39:26;39:31;"I know the Lorde album is produced by Jack Antonoff, and the Bruno Mars album,"
39:31;39:33;"I didn't know who produced it, but it was basically him."
39:33;39:35;"Oh, Bruno self-produced."
39:35;39:37;"Well, it's credited to Shampoo, Press, and Curl."
39:40;39:43;"Which I think is really just him and maybe some other people."
39:43;39:45;"Well, so anyway, what do we think?"
39:45;39:47;"Is that a healthy haul?"
39:47;39:49;"Have you heard any of these albums?"
39:49;39:50;"I've heard the Bruno record."
39:50;39:52;"You've heard the whole Bruno record?"
39:52;39:53;"Yep, in a rental car."
39:53;39:55;"Listen to a full Bruno record."
39:55;39:56;"What was the situation?"
39:56;39:58;"My wife and I did."
39:58;40:00;"We were in D.C. for a wedding."
40:00;40:01;"Yeah."
40:01;40:02;"We were driving around."
40:02;40:03;"I don't know how it came up."
40:03;40:05;"We just threw it on."
40:05;40:07;"I would say we probably got to track eight or nine."
40:07;40:08;"Interesting."
40:08;40:11;"Some of the deep cuts hold up."
40:11;40:12;"I got a confession to make."
40:12;40:13;"Yeah?"
40:13;40:16;"This is the first year that I voted for the Grammy nominations."
40:16;40:18;"Oh, I blew it."
40:18;40:19;"Oh, you forgot to register."
40:19;40:20;"Remember?"
40:20;40:21;"I was supposed to register."
40:21;40:22;"Ah, yeah."
40:22;40:23;"See, that's the thing."
40:23;40:27;"Every year the Grammys come up and there's always a conversation that's about race and"
40:27;40:28;"who's voting."
40:28;40:29;"Right."
40:29;40:34;"And the truth is with the Grammys, the Grammys can truly be baffling sometimes."
40:34;40:38;"Like, obviously, there are a lot of old white dudes voting for the Grammys, but it's like"
40:38;40:41;"it doesn't always shake out the way that you think it's going to."
40:41;40:43;"Well, how does it work with nominations?"
40:43;40:44;"So with nominations--"
40:44;40:47;"Who did you vote for is the better question."
40:47;40:48;"I want to talk about this."
40:48;40:50;"We're building to that."
40:50;40:55;"So with nominations, I'd never voted in nominations before, sometimes because I would just miss"
40:55;40:57;"the registration."
40:57;40:59;"It's so annoying that you have to register."
40:59;41:03;"Like, you would think that if you're somebody who's got a few album credits, you could just"
41:03;41:05;"be on the rolls for a while."
41:05;41:06;"Right."
41:06;41:08;"It's hard enough to register for the election."
41:08;41:09;"Yes, seriously."
41:09;41:10;"I can't imagine."
41:10;41:11;"So I think it should just be easy."
41:11;41:12;"And I guess they're trying to make it easy."
41:12;41:15;"You have to pay $100, which I think is kind of lame, too."
41:15;41:16;"Yep."
41:16;41:17;"Like, they're taking in--"
41:17;41:18;"Is that every year?"
41:18;41:19;"I don't want to time it."
41:19;41:21;"Every year, you have to pay $100."
41:21;41:25;"And I think they have something that, like, for the younger people, that maybe they waive"
41:25;41:26;"the fee."
41:26;41:28;"Anyway, so you basically-- you log on to a website."
41:28;41:30;"It's a little convoluted."
41:30;41:31;"And then you vote."
41:31;41:38;"And just so everybody knows, before-- so this is when music industry insiders like me get"
41:38;41:41;"to throw our hat into the ring and say who we think should be nominated."
41:41;41:45;"But there was a process before this that I was not privy to."
41:45;41:49;"So, like, for instance-- and some Grammy person might get mad and say that I'm describing"
41:49;41:50;"this incorrectly."
41:50;41:51;"But this is my take."
41:51;41:52;"This is what I understand it to be."
41:52;41:54;"There's committees for each category."
41:54;41:56;"I know people who serve on various committees."
41:56;41:59;"Like, I got a friend who served on the electronic committee."
41:59;42:02;"That committee decides who's even eligible to be nominated, because obviously this is"
42:02;42:06;"somewhat subjective about what can be nominated for this and that."
42:06;42:14;"So, like, infamously, there was a year-- I've heard these stories-- that the committee that's"
42:14;42:17;"in charge of who can be nominated for best alternative album gets together."
42:17;42:21;"So it's a lot of guys who work at record labels, maybe a few musicians."
42:21;42:24;"I think it's predominantly, like, people who work at labels."
42:24;42:31;"And somebody that year was saying, well, the Shins should be eligible for best alternative."
42:31;42:33;"And somebody else said, I don't think so."
42:33;42:34;"This is, like, on their third or fourth album."
42:34;42:36;"They're like, Shins are too big now."
42:36;42:37;"They're not alternative anymore."
42:37;42:39;"And the guy's like, well, clearly they're still alternative."
42:39;42:42;"They're no bigger than, like, Radiohead or these bands."
42:42;42:46;"Their music still is-- even if it's gotten a little poppier, it's still in the lineage"
42:46;42:47;"of alternative rock."
42:47;42:48;"The genre is-- yeah."
42:48;42:50;"And somebody's like, no, they should either be in pop or rock."
42:50;42:51;"And they put their foot down."
42:51;42:56;"So keep in mind, these are people who have vested interests in terms of who should be."
42:56;43:01;"So for instance, let's imagine there's a dude from Vampire Weekend's record label serving"
43:01;43:02;"on the committee."
43:02;43:05;"And he knows it's a big year for Vampire Weekend."
43:05;43:07;"We got that great alternative sound."
43:07;43:08;"But he's a little nervous."
43:08;43:10;"He doesn't want too much competition in the category."
43:10;43:13;"So he comes in and says, can we agree Vampire Weekend's alternative?"
43:13;43:14;"Everybody says yes."
43:14;43:18;"And then another guy comes and says, can we agree that Dirty Projectors is alternative?"
43:18;43:20;"And my guy says, you know what?"
43:20;43:22;"Dirty Projectors is hip hop."
43:22;43:23;"It's their ninth album."
43:23;43:24;"Hear me out."
43:24;43:25;"Hear me--"
43:25;43:29;"Dave Longstreth, he's out there producing Solange."
43:29;43:31;"It's R&B or hip hop."
43:31;43:33;"And then imagine a few other guys are like, yeah, yeah, yeah."
43:33;43:34;"I agree."
43:34;43:38;"Next thing you know, Dave can't be nominated for best alternative album."
43:38;43:39;"He's screwed."
43:40;43:43;"And then he's not going to get the best R&B album nomination."
43:43;43:44;"Well--"
43:44;43:46;"OK, so anyway, just that's how it works."
43:46;43:48;"A group of people get together and make these decisions."
43:48;43:55;"So by the time I'm logging on to the Grammys portal, there have already been some strings pulled."
43:55;43:57;"So it's slightly corrupt."
43:57;43:58;"It's a little corrupt."
43:58;43:59;"So--"
43:59;44:00;"It's like the DNC."
44:00;44:03;"But it's like all those award ceremonies, like you have to kiss their ass too."
44:03;44:05;"Like it's not actually--"
44:05;44:06;"Well, it can be."
44:06;44:11;"That's why sometimes I get confused because sometimes I talk to people who get nominated for something and they're just like--"
44:11;44:13;"I'm like, were you like campaigning for it?"
44:13;44:14;"And they're like, no, it's random."
44:14;44:15;"So you don't know."
44:15;44:24;"But one thing I noticed is that the way the website loads, you have to click the four or five things that you want to pick to be nominated for a category."
44:24;44:27;"But in some of these categories, it's like 1,000 things are in there."
44:27;44:35;"So I also had this feeling like if your song or your name is going to be down towards the bottom, you might just miss out on a few clicks just because this thing loads so slowly."
44:35;44:39;"Like you would think that you'd be able to log in and just type in who you want to vote for."
44:39;44:42;"But instead, you have to like let this whole thing load and like scroll down and click."
44:42;44:43;"I don't remember everything."
44:43;44:44;"I hate this."
44:44;44:45;"Yeah, it's annoying."
44:45;44:46;"But whatever."
44:46;44:47;"I'm sure-- I don't know what it used to be like."
44:47;44:51;"I'm sure some people would say that this is a way better way of doing things that you can log on online and whatever."
44:51;44:54;"So you're working on the nominating process."
44:54;44:57;"There was like 1,000 records."
44:57;45:01;"Well, for some categories, like you click on Best New Artist and there might be 500 people."
45:01;45:03;"You click on Album of the Year."
45:03;45:04;"What the hell?"
45:04;45:08;"There's like 1,000 things, and I'm going through clicking and like something catches my eye, you know?"
45:08;45:12;"So then you can click five different nominees or you can click 20 or--"
45:12;45:16;"You can click five different nominees from the pre-approved mega list."
45:16;45:18;"Sheermag?"
45:18;45:20;"Oh, and I forgot to vote for Sheermag."
45:20;45:21;"Dude."
47:34;47:37;"Okay, here's what I remember."
47:37;47:44;"I definitely remember that I put Kendrick for Album of the Year, and that's who I tend to vote for in the general election."
47:44;47:46;"Stating it publicly."
47:46;47:48;"I wonder if that's against the rules."
47:48;47:49;"It's so hilarious."
47:49;47:50;"I've said this before."
47:50;47:51;"Pitchfork story."
47:51;47:54;"Ezra Koenig disqualified."
47:54;47:56;"Banned from the Grammys."
47:56;47:57;"It's so hilarious that--"
47:57;47:59;"White man, Ezra Koenig."
47:59;48:00;"Right."
48:00;48:01;"One less white man on that."
48:01;48:05;"Okay, well, at least there's that."
48:05;48:06;"I just think that the Kendrick album--"
48:06;48:07;"I think all those--"
48:07;48:12;"There's a lot of strong contenders in the Album of the Year, but Kendrick has lost before."
48:12;48:16;"They don't give Album of the Year enough to hip-hop, which is crazy."
48:16;48:19;"They got a real bad track record when it comes to hip-hop."
48:19;48:21;"And it's Kendrick's time."
48:21;48:23;"Who did he lose to before?"
48:23;48:24;"Was it Mumford?"
48:24;48:26;"Oh, that's rough."
48:26;48:27;"Can we get a fact check on that?"
48:27;48:29;"Wait, sorry, who are the nominees again?"
48:29;48:33;"Kendrick, Bruno, Lorde, Childish Gambino."
48:33;48:34;"Okay."
48:34;48:36;"Who won the last year, Album of the Year?"
48:36;48:37;"Last year was Adele."
48:37;48:38;"Oh, right."
48:38;48:39;"Which cost me a Grammy."
48:39;48:41;"Adele versus Beyonce."
48:41;48:43;"Yeah, I would have won that Beyonce Grammy."
48:43;48:44;"I lost it."
48:44;48:48;"Remember when Adele was doing that George Michael song, and he started in the wrong key?"
48:48;48:49;"That was so crazy."
48:49;48:51;"And then she was like, ""We gotta start over."""
48:51;48:52;"Good for her."
48:52;48:53;"I know, I felt terrible for her."
48:53;48:56;"I was like, ""That'd be so hard to be like, 'Guys, guys, guys.'"""
48:56;48:57;"She got praised for that."
48:57;48:58;"Yeah."
48:58;48:59;"I remember that."
48:59;49:00;"Oh, no, okay, sorry."
49:00;49:01;"Kendrick lost to Daft Punk."
49:01;49:02;"Oh, okay."
49:02;49:04;"You're voting for Kendrick."
49:04;49:05;"Is that your prediction?"
49:05;49:06;"You know what?"
49:06;49:13;"I am a little nervous, and other people have said this, that the hip hop vote may get split."
49:13;49:14;"Oh."
49:14;49:15;"Because-"
49:15;49:19;"Those damn Green Party people."
49:19;49:20;"Yeah, exactly."
49:20;49:26;"In this instance, Kendrick is Hillary, the person that the coastal elites think deserves"
49:26;49:27;"it."
49:27;49:28;"Jay-Z is Trump."
49:28;49:29;"No, no, no."
49:29;49:30;"I'm just-"
49:30;49:33;"Actually, I don't want to call anybody Trump."
49:33;49:37;"Let's just say that the two major parties here would probably be..."
49:37;49:40;"Well, see, here's the thing."
49:40;49:51;"As much as some people are excited that there's no white men in the album of the year, sometimes"
49:51;49:54;"a dopey white guy can serve as a good buffer."
49:54;49:56;"Just a non-entity."
49:56;49:57;"Just norm from Cheers."
49:57;49:58;"Right."
49:58;49:59;"You know what I mean?"
49:59;50:00;"So you're not splitting the vote."
50:00;50:05;"So this year, I think a lot of people want to see Kendrick win."
50:05;50:12;"And no disrespect to Lorde, but if we're really talking about righting a historical wrong,"
50:12;50:17;"which is the way in which white people have profited off black music in this country time"
50:17;50:23;"and time again, we want to honor black music, which is very important in this country."
50:23;50:29;"It would be a shame if in the year that finally you got rid of..."
50:29;50:31;"The white guys had a year where they took a backseat."
50:31;50:37;"If it goes to the one white person out of the five, I don't know."
50:37;50:39;"No woman points for her."
50:39;50:40;"Well, what do you think?"
50:40;50:41;"You're a Caucasian female."
50:41;50:45;"I mean, I just think her album's so..."
50:45;50:47;"It was so good."
50:47;50:48;"I love Melodrama."
50:48;50:50;"I thought it was like..."
50:50;50:51;"To me, it was the best album of the year."
50:51;50:53;"You thought it was better than Kendrick."
50:53;50:54;"Yeah."
