Start Timestamp;End Timestamp;Transcript
00:00;00:04;"Six may be the devil's number, but this is not going to be a devilish episode because"
00:04;00:08;"I'm joined by three people who I consider to be great people."
00:08;00:13;"The Longstreth brothers, Jake, and for the first time, Dave."
00:13;00:15;"As well as my own sister, Emma."
00:15;00:19;"It's a real family affair, and we'll be exploring topics like Thin Lizzy, the Billboard Charts"
00:19;00:24;"of 1985, and 2015's Question King, Justin Bieber."
00:24;00:31;"This is Time Crisis with Ezra Koenig."
00:38;00:45;"[applause]"
01:23;01:38;"[applause]"
01:58;02:08;"[applause]"
09:38;09:40;"[applause]"
09:40;09:44;"That was Dirty Projectors with Because Your Light Is Turning Green."
09:44;09:46;"This is a very exciting show."
09:46;09:49;"This is the first time on Time Crisis we've ever had two sets of siblings."
09:49;09:50;"Yeah."
09:50;09:52;"The Longstress and the Koenigs."
09:52;09:55;"Jake, a little later on you're going to be teaching us about Thin Lizzy."
09:55;09:56;"Yeah."
09:56;09:57;"Band from the 70s."
09:57;09:59;"A lot of people probably know Boyz R Back in Town."
09:59;10:00;"Yeah."
10:00;10:01;"But there's more to them than that."
10:01;10:02;"Yeah, absolutely."
10:02;10:03;"So we'll be getting to that a little bit later."
10:03;10:05;"Also we're going to try something different for the top five."
10:05;10:08;"Normally we count down the top five songs on iTunes on Time Crisis."
10:08;10:11;"But this time we're actually doing something that approaches a time crisis."
10:11;10:13;"Can't believe it took us this long to think of it."
10:13;10:17;"We're going to be juxtaposing the top five songs on Billboard right now"
10:17;10:21;"with the top five songs on Billboard 30 years ago in 1985."
10:21;10:22;"I'm psyched."
10:22;10:23;"So that's going to be crazy."
10:23;10:26;"But before we get into that, how's everybody been doing this week?"
10:26;10:27;"I've been good."
10:27;10:29;"Yeah, and what's the most exciting thing that happened to you this week?"
10:29;10:31;"I went to Palm Springs."
10:31;10:32;"Why?"
10:32;10:38;"I went for a birthday party and I didn't even end up going."
10:38;10:41;"I only went to the birthday party for like 30 minutes."
10:41;10:42;"Really?"
10:42;10:43;"It was too crazy."
10:43;10:48;"People were jumping on beds, people with their shoes on."
10:48;10:49;"Really?"
10:49;10:51;"And I felt like the people I was with, we couldn't get past that."
10:51;10:53;"Like in an Airbnb?"
10:53;10:54;"At a hotel."
10:54;10:55;"I don't respect that at all."
10:55;11:00;"Okay, and let me tell you why."
11:00;11:02;"I'm very excited."
11:02;11:06;"Okay, first of all, just because it's a hotel and they wash the sheets"
11:06;11:09;"in some weird industrial laundromat, it's still nasty."
11:09;11:13;"I don't know, if somebody's going to put their shoes on a bed, even at a hotel,"
11:13;11:15;"they might put their shoes anywhere."
11:15;11:16;"I think that's disgusting."
11:16;11:18;"And then you feel like you can't trust those people."
11:18;11:19;"Then you can't trust them."
11:19;11:20;"Everybody in here has stayed at a hotel before, right?"
11:20;11:22;"Yeah, it's a super douchey move."
11:22;11:26;"And we all know that when you're staying at a hotel, one of the biggest anxieties"
11:26;11:28;"is what's happened in this room before I got here."
11:28;11:29;"Right."
11:29;11:31;"Because you know what happened at your home or office."
11:31;11:32;"Hopefully."
11:33;11:35;"But at a hotel, you don't know what happened the day before."
11:35;11:37;"You don't know if people were having sex."
11:37;11:38;"Beating off."
11:38;11:41;"Or worst of all, jumping on the bed with their shoes on."
11:41;11:43;"So I got no respect for that."
11:43;11:45;"Your friends are trash."
11:45;11:49;"So there were a lot of concerns with the party, but we also went to the Integratron."
11:49;11:50;"Have you guys ever been there?"
11:50;11:51;"Yeah."
11:51;11:52;"Did you enjoy it?"
11:52;11:54;"Wait, is that the sound place with the bowls?"
11:54;11:56;"Yeah, yeah, the crystal bowls."
11:56;11:58;"It's very California."
11:58;12:02;"It's very California because also the guy who constructed it"
12:02;12:05;"apparently was given the blueprint by aliens."
12:05;12:08;"Well, that's super like desert vibe."
12:08;12:10;"Aliens might exist."
12:10;12:11;"It's true."
12:11;12:13;"I'm willing to believe it."
12:13;12:18;"Today on the music front, I was putting together a few songs, some ideas for the playlist today."
12:18;12:22;"I feel like Time Crisis is getting a reputation for playing a lot of old music from the 50s,"
12:22;12:24;"60s, and 70s."
12:24;12:28;"So I thought maybe today I'd make more of an effort to play some newer music, stuff"
12:28;12:30;"from the 90s."
12:30;12:33;"So I was thinking about some of my favorite 90s songs, and I put together a little rock"
12:33;12:34;"block."
12:34;12:36;"For some reason, all these songs go together."
12:36;12:39;"They're kind of like the rootsy side of the 90s."
12:39;12:44;"Some people would say Nirvana is what makes them feel like the ultimate early 90s music"
12:44;12:46;"or maybe like hip hop."
12:46;12:50;"But for me, this song just makes me feel like the early 90s so hard."
12:50;12:51;"I'm psyched to hear what it is."
12:51;12:52;"Me too."
12:52;12:56;"All right, let's see who can guess it first from the opening bars."
12:56;12:59;"Oh, Aerosmith?"
12:59;13:00;"Yeah, Aerosmith."
13:00;13:01;"Strong."
13:01;13:02;"Love this song."
13:03;13:04;"Do you?"
13:04;13:05;"Yeah."
13:06;13:15;"There was a time when I was so brokenhearted."
13:15;13:20;"Love wasn't much of a friend of mine."
13:20;13:29;"The tables have turned, yeah, and caused me in them ways I parted."
13:29;13:34;"That kind of love was the killing kind."
13:35;13:42;"Listen, all I want is someone I can't resist."
13:42;13:48;"I know all I need to know right away is I got you."
13:48;13:56;"I was crying when I met you, but now I'm trying to forget you."
13:56;14:02;"Love is sweet misery."
14:02;14:10;"I was trying just to get you, now I'm down 'cause I let you."
14:10;14:15;"Do what you do down on me."
14:15;14:23;"Now he's not in a waiting room, they're talking 'bout you and me."
14:23;14:26;"You, you cry when I make it loud."
14:26;14:30;"Must be what you were saying."
14:30;14:33;"It's down on me."
14:33;14:37;"Yeah, I got to tell you one thing."
14:37;14:39;"It's been on my mind."
14:39;14:42;"Girl, I gotta say."
14:42;14:47;"We're partners in crime."
14:47;14:51;"You got that certain something."
14:51;14:56;"What you give to me takes my breath away."
14:56;15:04;"All I know is true is the devil's in your kiss."
15:04;15:08;"If I let go, I'll be frozen to fire."
15:08;15:10;"I can't resist."
15:10;15:18;"I was crying when I met you, but now I'm trying to forget you."
15:18;15:23;"Love is sweet misery."
15:23;15:31;"I was trying just to get you, now I'm down 'cause I let you."
15:31;15:37;"Do what you do down on me."
15:38;15:41;"[guitar solo]"
15:41;15:58;"What you do is sad and why you let it stay."
15:58;16:01;"Yeah, I know, too late, I know."
16:01;16:05;"Do you give your heart away?"
16:05;16:08;"Yeah, I know."
16:08;16:16;"I was crying when I met you, but now I'm trying to forget you."
16:16;16:21;"Your love is sweet misery."
16:21;16:30;"I was trying just to get you, now I'm dying to let you."
16:30;16:38;"Do what you do, what you do, do, do, do, do, do, do, do."
16:38;16:41;"[guitar solo]"
17:09;17:17;"I was trying to meet you But I'm trying to forget you"
17:17;17:26;"Now I'm missing what is yours I was trying to meet you"
17:26;17:32;"But I'm doing it 'cause I met you Do what you do"
17:32;17:35;"I've got to, I've got to"
17:35;17:47;"I was trying to meet you But I'm trying to forget you"
17:47;17:51;"Now I'm missing what is yours"
17:51;18:10;"[Instrumental]"
18:10;18:15;"It looks like a road that you travel on When there's one day here and the next day gone"
18:15;18:19;"Sometimes you bend, sometimes you stand Sometimes you turn and you're back to the way"
18:19;18:24;"There's a world outside the darkened door Where blues won't haunt you anymore"
18:24;18:29;"With a brave heart, free love and soul Come ride with me to the distant shore"
18:29;18:34;"We won't hesitate Break down the guarded gate"
18:34;18:38;"There's not much time left today"
18:38;18:47;"Life is a highway I won't ride it all night long"
18:47;18:54;"Get your door in my way I won't drive it all night long"
18:54;19:01;"Through all these cities and all these towns It's in my blood and it's all around"
19:01;19:06;"I loved you now like I loved you then This is the road and these are the hands"
19:06;19:11;"From Mozambique to those Memphis nights The Kabyl Pass to Vancouver's lights"
19:11;19:16;"Knock me down, I'm back up again You're in my blood, I'm not a lonely man"
19:16;19:20;"With no load I can't hold Roads are rough, this I know"
19:20;19:25;"I'll be there when the light comes in Just tell 'em we're survivors"
19:25;19:34;"Life is a highway I won't ride it all night long"
19:34;19:44;"Get your door in my way I won't drive it all night long"
19:44;19:53;"Life is a highway I won't ride it all night long"
19:53;20:03;"Get your door in my way I won't drive it all night long"
20:03;20:13;"There was a distance between you and I"
20:13;20:23;"Misunderstanding once but now we're looking in the eye"
20:23;20:42;"[instrumental]"
20:42;20:46;"There ain't no load that I can't hold Roads are rough, this I know"
20:46;20:53;"I'll be there when the light comes in Just tell 'em we're survivors"
20:53;21:02;"Life is a highway I won't ride it all night long"
21:02;21:10;"Get your door in my way I won't drive it all night long"
21:10;21:12;"Gimme, gimme, gimme, gimme, yeah"
21:12;21:21;"Life is a highway I won't ride it all night long"
21:21;21:29;"Get your door in my way I won't drive it all night long"
21:29;21:31;"Gimme, gimme, gimme, gimme, yeah"
21:31;21:39;"Life is a highway I won't ride it all night long"
21:39;21:47;"Get your door in my way I won't drive it all night long"
21:47;22:01;"[instrumental]"
22:01;22:05;"That was Tom Cochran with ""Life is a Highway"" off his album ""Mad Mad World."""
22:05;22:11;"What's that full length like? Not familiar with any of the deeper cuts?"
22:11;22:16;"There's something about that Aerosmith crying ""and life is a highway"""
22:16;22:21;"You know, 'cause it's so '90s but it's also like, it was kind of backwards looking, like rootsy."
22:21;22:27;"Yeah, it was like the mainstream hits that were super out of step with what the cool thing that was happening in the mainstream was."
22:27;22:31;"Yeah, I mean Nirvana, why do I keep calling Aerosmith Nirvana?"
22:31;22:34;"That's the best mix-up ever."
22:34;22:40;"I feel like Aerosmith, was Aerosmith cool? You know, wait, does Beavis or Butthead wear an Aerosmith t-shirt?"
22:40;22:43;"No, Metallica and AC/DC."
22:43;22:46;"Does Wayne or Garth wear an Aerosmith t-shirt?"
22:46;22:55;"Wayne and Garth to our listeners who are under 25 are characters from the Wayne's World film franchise and SNL sketch."
22:55;23:02;"Okay, yeah, we just got word from our producers that somebody in Wayne's World wore an Aerosmith t-shirt."
23:02;23:05;"Yeah, 'cause Aerosmith was popping off in the '90s. Oh, it was Garth."
23:05;23:09;"Em and I were talking about earlier that Liv Tyler is our cousin."
23:09;23:10;"Just barely."
23:10;23:13;"Just barely, not even. You know, I met Liv Tyler once."
23:13;23:14;"Oh, did you?"
23:14;23:18;"And I walked right up to her and said, ""Hey, cuz, you're my cousin."""
23:18;23:25;"Nah, we like knew somebody in common and so we started talking and I said, ""This might sound weird, but supposedly we're cousins."""
23:25;23:31;"Basically, Liv Tyler's mom married a guy who is our cousin that we never met."
23:31;23:32;"Oh my God."
23:32;23:34;"That's about as deep as it goes."
23:34;23:36;"This episode's all about family. If you can't tell."
23:36;23:38;"That's a strong connection."
23:38;23:46;"I want to continue with the new music because, like I said, Time Crisis is not just about music from the '50s, '60s, and '70s."
23:46;23:50;"So I was trying to think of more recent hits, stuff more from the past 25, 30 years."
23:50;23:55;"And one song that came to mind is a song from the 2000s that I loved."
23:55;24:00;"And I realized I've been talking about this with some of the younger people at the office."
24:00;24:04;"And they don't really remember this song, but in some ways this song paved the way for a lot of what's going on today."
24:04;24:08;"This is a young guy named Eamon. E-A-M-O-N."
24:08;24:11;"I'm probably pronouncing that wrong, but he's a young man from Staten Island."
24:11;24:17;"And he made this song that was kind of a little bit like doo-wop, but had a lot of foul language."
24:17;24:21;"And it's basically a breakup song called ""F*ck It, I Don't Want You Back."""
24:21;24:23;"Oh, I remember this."
24:23;24:26;"This was a big song about 10, 12 years ago."
24:26;24:29;"But I feel like it's a--I don't know, people aren't really respecting it for its influence."
24:29;24:30;"Do you remember this one, Jake?"
24:30;24:31;"I might when you start playing it."
24:31;24:32;"All right, check it out."
24:33;24:40;"Whoa, ooh"
24:40;24:44;"No, no, no"
24:44;24:56;"See, I don't know why I liked you so much"
24:56;25:01;"I gave you all of my trust"
25:01;25:06;"I told you I loved you"
25:06;25:08;"Now that's all down the drain"
25:08;25:10;"You put me through a pain"
25:10;25:15;"I wanna let you know my fear"
25:15;25:18;"But I said it don't mean sh*t now"
25:18;25:22;"The presents might as well go now"
25:22;25:25;"All those kisses, they didn't mean jack"
25:25;25:29;"You, you, I don't want you back"
25:29;25:32;"But I said it don't mean sh*t now"
25:32;25:36;"The presents might as well go now"
25:36;25:39;"All those kisses, they didn't mean jack"
25:39;25:43;"You, you, I don't want you back"
25:43;25:52;"You thought you could keep this sh*t from me, yeah"
25:52;25:57;"You burned me, I heard the story"
25:57;26:03;"You played me, you even gave a m*rder"
26:03;26:05;"Now you're asking for me back"
26:05;26:07;"You're just another hack"
26:07;26:11;"Look out, sweat, 'cause you're done with me"
26:11;26:15;"But I said it don't mean sh*t now"
26:15;26:18;"The presents might as well go now"
26:18;26:22;"All those kisses, they didn't mean jack"
26:22;26:25;"You, you, I don't want you back"
26:25;26:28;"But I said it don't mean sh*t now"
26:28;26:32;"The presents might as well go now"
26:32;26:35;"All those kisses, they didn't mean jack"
26:35;26:38;"You, you, I don't want you back"
26:38;26:53;"Oh, oh, ah-ha, yeah"
26:53;26:59;"You questioned, did I care?"
26:59;27:03;"You could ask anyone"
27:03;27:07;"I even said you were my great one"
27:07;27:13;"Now it's over"
27:13;27:16;"But I do admit I'm sad, it hurts real bad"
27:16;27:21;"I can't sweat that 'cause I love the heart"
27:21;27:24;"But I said it don't mean sh*t now"
27:24;27:28;"The presents might as well go now"
27:28;27:31;"All those kisses, they didn't mean jack"
27:31;27:34;"You, you, I don't want you back"
27:34;27:59;"Oh, oh, ah-ha, yeah"
27:59;28:01;"That was Emon with ""F*ck It"""
28:01;28:03;"I don't know how I feel about it anymore, but whatever"
28:03;28:04;"But poignant"
28:04;28:06;"Poignant, people should know that it existed"
28:06;28:09;"We just, for the first time, opened up the mail bag"
28:09;28:11;"Here on Time Crisis"
28:11;28:12;"Do you have a favorite type of pasta?"
28:12;28:14;"For me, it's squid ink fettuccine"
28:14;28:16;"What's your opinion on Bernie Sanders?"
28:16;28:18;"Do you think he can win the Democratic bid?"
28:18;28:19;"Yes"
28:19;28:20;"People are excited about him"
28:20;28:21;"You think he can?"
28:21;28:23;"Yeah, yeah"
28:23;28:25;"I didn't think he could a few weeks ago, but"
28:25;28:27;"I don't know, there's a lot of momentum"
28:27;28:29;"How about you?"
28:29;28:31;"He seems like the best of the worst"
28:31;28:35;"Politicians are all trash, man"
28:35;28:37;"That's a hopeful message for the youth"
28:37;28:38;"This question is too political"
28:38;28:40;"Do you wear socks and sandals?"
28:40;28:41;"No, of course not"
28:41;28:43;"I don't wear sandals"
28:43;28:46;"I don't wear socks"
28:46;28:48;"Do you have a strict no sandals policy?"
28:48;28:49;"Yeah"
28:49;28:50;"Really?"
28:50;28:51;"Yeah"
28:51;28:52;"You wouldn't do Birkenstocks?"
28:52;28:53;"No"
28:53;28:56;"Okay, maybe we'll dig back into the questions bag"
28:56;28:57;"A little bit later"
28:57;29:01;"Thank you so much to everybody on Twitter for reaching out"
29:01;29:12;"Okay Jake, it's time to talk about"
29:12;29:14;"Thin Lizzy"
29:14;29:19;"Okay Jake, Thin Lizzy is a band from?"
29:19;29:20;"Dublin, Ireland"
29:21;29:24;"They're probably best known in the States for"
29:24;29:25;"The Boys Are Back in Town"
29:26;29:27;"You know that song, Emma?"
29:27;29:28;"Yes, I know that one"
29:28;29:29;"And you're not a big classic rock person"
29:29;29:30;"No"
29:30;29:31;"But you know the song The Boys Are Back in Town"
29:31;29:32;"Of course"
29:32;29:35;"But you would, so some people might even think of them as a one hit wonder"
29:35;29:37;"But you would say that's far from true"
29:37;29:40;"Yeah, that's off Jailbreak from 1976"
29:40;29:42;"Which I think is their sixth album"
29:42;29:43;"Whoa, really?"
29:43;29:46;"Yeah, yeah, so they were started, they formed in 1969 in Dublin"
29:46;29:48;"And put out their first record in '71"
29:48;29:51;"Yeah, I mean I think Thin Lizzy, I think the way"
29:51;29:54;"Kind of classic rock radio formatting has gone"
29:54;29:57;"They get kind of lumped in with pretty bad bands from that era"
29:57;30:00;"Bachman Turner Overdrive, Bad Company"
30:00;30:03;"You know, those kind of bands, AC/DC even"
30:03;30:05;"Wait, but you don't think AC/DC are bad"
30:05;30:08;"It's okay, I guess that's a whole other can of worms"
30:08;30:10;"I'll talk about that in two weeks"
30:10;30:13;"Okay, I would say AC/DC is in a different level than Bachman Turner Overdrive"
30:13;30:16;"Well you know, one interesting thing to me about Thin Lizzy and AC/DC as well"
30:16;30:21;"These are the rock bands that almost had a touch of punk in them"
30:21;30:24;"Bachman Turner Overdrive has zero percent punk"
30:24;30:27;"AC/DC, even though they're just kind of rock dudes"
30:27;30:30;"There's something about their attitude and even the production"
30:30;30:31;"That I think"
30:31;30:32;"And the simplicity"
30:32;30:36;"Yeah, they got written about in early issues of Punk Magazine"
30:36;30:37;"Interesting, I could see that"
30:37;30:40;"Which was this magazine in New York that was one of the first punk magazines"
30:40;30:44;"And even Thin Lizzy, there was something almost proto-New Wave about the sound"
30:44;30:47;"Yeah, I mean it was really like, sparse"
30:47;30:50;"Yeah, maybe it's the cymbals that are sparse"
30:50;30:53;"The singing was really idiosyncratic and unique to Phil Lynott"
30:53;30:55;"Right, well so let's just kick things off"
30:55;30:57;"Just for people who haven't heard him before"
30:57;30:59;"Let's listen a little bit of The Boys Are Back In Town"
30:59;31:01;"Just to remind people who Thin Lizzy is"
31:01;31:05;"Yeah, and this song might include my favorite lyrical rock couplet ever"
31:05;31:06;"Yeah, what's that?"
31:06;31:07;"Which is"
31:07;31:10;"Friday night they'll be dressed to kill down at Dino's Bar and Grill"
31:10;31:13;"Friday night they're dressed to kill"
31:13;31:16;"Down at Dino's Bar and Grill"
31:16;31:17;"It's an amazing line"
31:17;31:22;"It's so good, it's so funny but also evocative of the whole song"
31:22;31:23;"The 70s"
31:23;31:26;"The whole song is sort of this nostalgic look at"
31:26;31:30;"The guy is coming back into town and everyone's meeting at the bar on a Friday night"
31:30;31:34;"And it's a summer and the jukebox is blasting out my favorite song"
31:34;31:36;"At the bar and grill"
31:36;31:37;"Yeah"
31:37;31:38;"Here's Thin Lizzy with The Boys Are Back In Town"
31:38;32:02;"guitar solo"
32:02;32:05;"Guess who just got back today"
32:05;32:08;"Them wild-eyed boys that had been away"
32:08;32:11;"Haven't changed, had much to say"
32:11;32:14;"But man, I still think them cats are crazy"
32:14;32:17;"They were asking if you were around"
32:17;32:20;"How you was, where you could be found"
32:20;32:23;"Told them you were living downtown"
32:23;32:26;"Driving all the old men crazy"
32:26;32:28;"The Boys Are Back In Town"
32:28;32:31;"guitar solo"
32:31;32:35;"I said the boys are back in town"
32:35;32:37;"guitar solo"
32:37;32:40;"The boys are back in town"
32:43;32:56;"guitar solo"
32:56;32:59;"You know that chick that used to dance a lot"
32:59;33:02;"Every night she'd be on the floor shaking what she'd got"
33:02;33:05;"Man, when I tell you she was cool and she was red hot"
33:05;33:08;"I mean she was steaming"
33:08;33:11;"And that time over at Johnny's Place"
33:11;33:14;"Well, this chick got up and she slapped Johnny's face"
33:14;33:17;"Man, we just fell about the place"
33:17;33:19;"If that chick don't want to know, forget her"
33:19;33:25;"The boys are back in town"
33:25;33:29;"I said the boys are back in town"
33:29;33:31;"guitar solo"
33:31;33:34;"The boys are back in town"
33:37;33:53;"guitar solo"
33:53;33:56;"Spread the word around"
33:56;33:59;"Yes, who's back in town"
33:59;34:03;"guitar solo"
34:03;34:06;"You spread the word around"
34:06;34:13;"guitar solo"
34:13;34:16;"Friday night they'll be dressed to kill"
34:16;34:19;"Down at Dino's Bar and Grill"
34:19;34:22;"The drink will flow and blood will spill"
34:22;34:25;"And if the boys want to fight you better let 'em"
34:25;34:29;"That new box in the corner blasting out my favorite song"
34:29;34:32;"The nights are getting warmer, it won't be long"
34:32;34:34;"Won't be long 'til summer comes"
34:34;34:37;"Now that the boys are here again"
34:37;34:43;"The boys are back in town"
34:49;34:53;"The boys are back in town"
34:53;34:55;"Spread the word around"
34:55;34:58;"The boys are back in town"
34:58;35:00;"The boys are back"
35:00;35:29;"guitar solo"
35:29;35:39;"The boys are back in town again"
35:39;35:43;"They're hanging down at Dino's"
35:43;35:55;"The boys are back in town again"
35:55;35:58;"That was Tim Lizzy with The Boys Are Back in Town."
35:58;36:01;"So we were just talking before about the line about a bar and grill."
36:01;36:05;"I'm very interested in this concept of the bar and grill."
36:05;36:07;"What does it connote?"
36:07;36:10;"Because everybody knows what a bar is."
36:10;36:11;"Everybody knows what a grill is."
36:11;36:15;"But a bar and grill, it's like a grown up restaurant."
36:15;36:17;"Is there a just a grill restaurant?"
36:17;36:19;"Like it's like, welcome to so and so's grill."
36:19;36:21;"But if you're grilling, you're probably drinking."
36:21;36:22;"You're probably also a bar."
36:22;36:24;"But there's something about bar and grill."
36:24;36:26;"You know that TGI Fridays originally was like"
36:26;36:30;"just like this kind of like bar, I think in Times Square."
36:30;36:31;"I did know this."
36:31;36:32;"That people would go to."
36:32;36:35;"I feel like that's like it was almost like a swingers bar or something."
36:35;36:39;"I think it was like a hip New York City club for a few years."
36:39;36:40;"Maybe it was a bar and grill."
36:40;36:44;"So a bar and grill is a place where you can go up post up at the bar"
36:44;36:47;"and have a drink or you can be seated and there's table service."
36:47;36:50;"Yeah, I mean it's like an Applebee's or a Chili's."
36:50;36:54;"That's like the shitty modern corporate version of like the 70s bar and grill."
36:54;36:58;"I'll have you know Applebee's and Chili's both started in the mid 70s."
36:58;36:59;"Oh God."
36:59;37:00;"In Texas."
37:00;37:03;"So I think, so I think, and so I think, you know,"
37:03;37:07;"if we're wondering about Phil Lynott singing about Dino's Bar and Grill,"
37:07;37:08;"there's a couple options."
37:08;37:12;"One, there is a place in Dublin, Ireland called Dino's Bar and Grill that exists."
37:12;37:13;"Seems unlikely."
37:13;37:16;"Or, yeah, and like some sort of Americanization is already happening."
37:16;37:18;"In Dublin they have pubs."
37:18;37:19;"Right."
37:19;37:22;"That's the original bar and grill is a pub because you can usually get food at a pub."
37:22;37:23;"Absolutely."
37:23;37:28;"But he has like some fantasy of America and he's projecting that like Dino's Bar and Grill"
37:28;37:29;"is some place in like San Diego."
37:29;37:30;"Right."
37:30;37:32;"And even Dino sounds like more like an American guy."
37:32;37:33;"Yeah, like North Jersey."
37:33;37:34;"Yeah."
37:35;37:36;"You remember Mr. Dino's."
37:36;37:39;"Oh yeah, that was the local pizza place by where we grew up with Mr. Dino's."
37:39;37:43;"But something about Friday night they'll be dressed to kill down at Dino's Bar and Grill"
37:43;37:45;"has always been super evocative to me."
37:45;37:46;"Right."
37:46;37:51;"It's so specific and it's so funny, but also it's sung with such like emotion and heart."
37:51;37:53;"Yeah, there's no joke in there."
37:53;37:56;"No, there's zero joke, which is another thing about Thin Lizzy."
37:56;38:00;"Like a lot of their songs, especially like the later material, there is a lot of humor"
38:00;38:05;"in it and I don't know the extent to which it was deliberately kind of funny."
38:05;38:07;"You know that song Cowboy Song?"
38:07;38:08;"Yeah, maybe we should get into that one."
38:08;38:11;"That's probably one of their best known songs after the boys are back in town."
38:11;38:14;"Same record, Jailbreak from '76."
38:14;38:20;"Opening lyrics of Cowboy Song are ""I am just a cowboy, lonesome on the plane."""
38:20;38:22;"No, no, sorry, I f*cked it up."
38:22;38:23;"Wait, wait, wait."
38:23;38:25;"""I am just a cowboy."""
38:25;38:26;"Lonely on the trail."
