Start Timestamp;End Timestamp;Transcript
01:04:54;01:04:57;"Manouf bow hanging off my clip, boy."
01:04:57;01:05:00;"Run, run it like a skip, boy."
01:05:00;01:05:02;"I push you on my skip, boy."
01:05:02;01:05:04;"On my wrist, it's a brick, boy."
01:05:04;01:05:08;"Feels empire brick by brick, boy."
01:05:08;01:05:10;"Coke boys off the rip, boy."
01:05:10;01:05:12;"Hold me, oh my, my."
01:05:12;01:05:14;"Cut, cut, go need more quiet now."
01:05:14;01:05:15;"Off the rip."
01:05:15;01:05:17;"Hold me, oh my, my."
01:05:17;01:05:20;"Cut, cut, go need more quiet now."
01:05:20;01:05:21;"Off the rip."
01:05:21;01:05:23;"Phoney knock his head off, off the rip."
01:05:23;01:05:26;"Chopped top, beat, spit off, off the rip."
01:05:26;01:05:27;"Old gruds get the bloody money."
01:05:27;01:05:29;"Dirty cash, live me."
01:05:29;01:05:31;"Too smokey, cause C-Stag."
01:05:31;01:05:33;"You monkey walk, I'm hunchback."
01:05:33;01:05:35;"Speak quiet, talk about Mikasa."
01:05:35;01:05:36;"Scare the deaf when I pop up."
01:05:36;01:05:38;"I'ma ride with my dog off the rip."
01:05:38;01:05:41;"Cut the brown bag, paper tag off the rip."
01:05:41;01:05:44;"Shorty came through, bent it over, off the rip."
01:05:44;01:05:46;"Dope boy bag, pop the tags, off the rip."
01:05:46;01:05:48;"Start, start, started from the block."
01:05:48;01:05:50;"Dirty money, off the rip."
01:05:50;01:05:52;"Cut a short piece, top money, off the rip."
01:05:52;01:05:55;"Walk up in the building, 150, off the rip."
01:05:55;01:05:58;"My dog came home, buck 50, off the rip."
01:05:58;01:06:00;"Hold me, oh my, my."
01:06:00;01:06:03;"Cut, cut, go need more quiet now."
01:06:03;01:06:04;"Off the rip."
01:06:04;01:06:06;"Hold me, oh my, my."
01:06:06;01:06:08;"Cut, cut, go need more quiet now."
01:06:08;01:06:09;"Off the rip."
01:06:09;01:06:11;"Brody knock his head off, off the rip."
01:06:11;01:06:14;"Top V, Sparrow, hey, I'ma--"
01:06:14;01:06:16;"Started with a hootie, and I went and got a beam."
01:06:16;01:06:19;"Pull up in a boat, Titanic, La Marina."
01:06:19;01:06:22;"Shot the young gun and spent 100 on my timer."
01:06:22;01:06:24;"Looking through the smokey mirror, smoking, smoking wine."
01:06:24;01:06:27;"Rari and the Gotti and the Beamers and the Benz."
01:06:27;01:06:30;"I'ma start trying to knock my dog off the hench."
01:06:30;01:06:32;"Ride with some Cubans, they'll be fresh about the border."
01:06:32;01:06:35;"Making back a whole tank, breaking down the corridor."
01:06:35;01:06:38;"Drop head, getting, getting, riding through the wall."
01:06:38;01:06:41;"Hear them shots ringing, then I hear that money call."
01:06:41;01:06:43;"Counting out my blessings, count my money, give a dole."
01:06:43;01:06:46;"I drop head, white mink on when it's cold."
01:06:46;01:06:47;"I--"
01:06:47;01:06:49;"Hold me, oh my, my."
01:06:49;01:06:51;"Cut, cut, go need more quiet now."
01:06:51;01:06:52;"Off the rip."
01:06:52;01:06:55;"Brody knock his head off, off the rip."
01:06:55;01:06:58;"Top V, Sparrow, off the rip."
01:06:58;01:07:00;"Hold me, oh my, my."
01:07:00;01:07:02;"Cut, cut, go need more quiet now."
01:07:02;01:07:03;"Off the rip."
01:07:03;01:07:06;"Brody knock his head off, off the rip."
01:07:06;01:07:08;"Top V, Sparrow, off the rip."
01:07:08;01:07:10;"All the boys get the coke money."
01:07:10;01:07:12;"Plenty cash, live, live, the smoke."
01:07:12;01:07:13;"Paralyzed, found some C-Stats."
01:07:13;01:07:15;"You don't give up, I'm hunchbacked."
01:07:15;01:07:17;"Buck quiet, talk about Mikasa."
01:07:17;01:07:19;"You TMZ, got, got, got, got."
01:07:19;01:07:20;"Off the rip."
01:07:20;01:07:22;"Off the rip."
01:07:22;01:07:24;"Off the mother, mother, rip, boy."
01:07:34;01:07:36;"An unexpected French Montana block."
01:07:36;01:07:39;"That's what happens when you get Dave Longstreth in the studio."
01:07:39;01:07:46;"Um, Dave, one thing we like to do on Time Crisis is usually count down the top five songs on iTunes."
01:07:46;01:07:49;"As a way of exploring the pop cultural landscape."
01:07:49;01:07:52;"Today, because I knew we were going to have such a powerhouse panel,"
01:07:52;01:07:54;"two Kanics, two Longstreths,"
01:07:54;01:07:57;"we decided to get a little more complicated."
01:07:57;01:08:00;"And we're going to be examining, in real time, two top fives."
01:08:00;01:08:07;"The Billboard Top Five of this week, as well as the Billboard Top Five of this week, 30 years ago, in 1985."
01:08:07;01:08:09;"So we're going to be going song for song."
01:08:09;01:08:15;"So here is a very special, double Jeopardy edition of the Top Five."
01:08:15;01:08:20;"It's time for the Top Five."
01:08:20;01:08:23;"This is pretty Back to the Future II right now."
01:08:23;01:08:24;"Oh, what, the years?"
01:08:24;01:08:27;"Yeah, it was '85 and 2015."
01:08:27;01:08:32;"So Back to the Future took place in 1985 and he went ahead 30 years."
01:08:32;01:08:34;"Yup, when Biff was an old man."
01:08:34;01:08:36;"And he was like, ""Nobody knows how to start that car but me."""
01:08:36;01:08:37;"Right."
01:08:37;01:08:39;"Okay, so this is actually, alright, I like that you pointed that out."
01:08:39;01:08:41;"This is the Back to the Future edition."
01:08:41;01:08:47;"And in '80, and when he went back to '55, there was an emphasis on the music of that era."
01:08:47;01:08:48;"Right."
01:08:48;01:08:49;"Earth Angel."
01:08:49;01:08:51;"Well, get ready to have your mind blown."
01:08:51;01:08:52;"Because..."
01:08:52;01:08:53;"This is your cousin."
01:08:53;01:08:59;"So Dave, this might blow your mind, but the number five song on the Billboard charts 30 years ago"
01:08:59;01:09:02;"was Huey Lewis' ""The Power of Love,"" which is from Back to the Future."
01:09:02;01:09:04;"That only blows my mind that it's not number one."
01:09:04;01:09:06;"Yeah, it was only number five."
01:09:06;01:09:07;"Maybe it was number one."
01:09:07;01:09:08;"We're not going to look into that."
01:09:08;01:09:09;"So let's listen to a little bit of this."
01:09:09;01:09:11;"Huey Lewis and the News, ""The Power of Love."""
01:09:31;01:09:35;"The power of love is a curious thing"
01:09:35;01:09:39;"Make a one man weep, make another man sing"
01:09:39;01:09:43;"Change a hawk to a little white dove"
01:09:43;01:09:48;"Born with a feeling, that's the power of love"
01:09:51;01:09:55;"Toughen the diamonds, rich like cream"
01:09:55;01:09:59;"Stronger and harder than a bad girl's dream"
01:09:59;01:10:03;"Make a bad one good, make a wrong one right"
01:10:03;01:10:07;"Power of love will keep you home at night"
01:10:07;01:10:12;"Don't need money, don't take fame"
01:10:12;01:10:14;"Don't need no credit card to write your name"
01:10:14;01:10:18;"That's Huey Lewis and the News with ""The Power of Love,"" top five single in 1985."
01:10:18;01:10:22;"What's its counterpart this week in 2015?"
01:10:22;01:10:25;"It's one of our favorite songs of the summer. You know what I'm talking about."
01:10:25;01:10:27;"Only, ""Cheerleader."""
01:10:30;01:10:31;"Better song."
01:10:31;01:10:32;"Yeah."
01:10:32;01:10:33;"[laughter]"
01:10:33;01:10:34;"I agree."
01:10:34;01:10:38;"""Cheerleader"" mobs the floor with ""The Power of Love."" No disrespect to Huey Lewis, who's a great songwriter."
01:10:39;01:10:42;"When I need motivation"
01:10:42;01:10:44;"My one solution is my queen"
01:10:44;01:10:47;"'Cause she's this strong, yeah"
01:10:47;01:10:50;"She is always in my corner, right there"
01:10:50;01:10:53;"When I wanna, all these other girls are tempting"
01:10:53;01:10:55;"But I'm empty when you're gone"
01:10:55;01:10:58;"And they say, ""Do you need me?"""
01:10:58;01:11:00;"""Do you think I'm pretend?"""
01:11:00;01:11:02;"""Do I make you feel like cheating?"""
01:11:02;01:11:04;"I'm like, ""No, not really,"" 'cause"
01:11:04;01:11:09;"Oh, I think that I found myself a cheerleader"
01:11:09;01:11:12;"She is always right there when I need her"
01:11:12;01:11:15;"Oh, I think that I found myself a cheerleader"
01:11:15;01:11:17;"I just learned that he was saying ""cheerleader,"" like, a week ago."
01:11:17;01:11:18;"What'd you think it was?"
01:11:18;01:11:20;"I didn't know."
01:11:20;01:11:23;"Wait, so you heard that song on the radio, you had no idea that he was saying ""cheerleader""?"
01:11:23;01:11:24;"No, I was just content--"
01:11:24;01:11:26;"Cheerleader, yeah"
01:11:26;01:11:29;"--content to hear the melody without knowing what the words were."
01:11:29;01:11:31;"It's a beautiful song, so I guess--"
01:11:31;01:11:33;"So we're off to an interesting start."
01:11:33;01:11:38;"I think our first piece of evidence suggests that 2015 is better than 1985."
01:11:38;01:11:40;"[laughs]"
01:11:40;01:11:42;"And also more nuanced in feeling."
01:11:42;01:11:44;"I love that he's talking about, like,"
01:11:44;01:11:46;"I don't really feel that way."
01:11:46;01:11:48;"It's like, just a shade of a feeling."
01:11:48;01:11:53;"Whereas Huey Lewis is talking about this, just like, power of love, that sounds like, I don't know."
01:11:53;01:11:54;"Right, that's when people use--"
01:11:54;01:11:55;"Propagandist, like--"
01:11:55;01:12:00;"Like, yeah, when people believe that their narrative was universally true."
01:12:00;01:12:01;"Right."
01:12:01;01:12:02;"Now it's more specific."
01:12:02;01:12:04;"Yeah, and I also just want to point out another way to compare these songs is,"
01:12:04;01:12:10;"""Omi,"" ""Cheerleader,"" the big hit version is a remix by, like, a German teenager."
01:12:10;01:12:11;"Omi's from Jamaica."
01:12:11;01:12:17;"So this song is a Jamaican guy and a German guy who never met making a hit song together."
01:12:17;01:12:22;"Whereas the power of love is Huey Lewis and the News, a bunch of guys from the Bay Area."
01:12:22;01:12:23;"From Marin County."
01:12:23;01:12:25;"A Marin County bar band."
01:12:25;01:12:27;"Bar and grill band."
01:12:27;01:12:30;"A bar and grill band, which is not necessarily a bad thing."
01:12:30;01:12:32;"Okay, so now let's go back to 1985."
01:12:32;01:12:35;"The number four song this week in 1985."
01:12:35;01:12:37;"Man, I don't really remember this song."
01:12:37;01:12:40;"This is ""Cool and the Gang,"" who are an amazing band, with ""Cherish."""
01:12:40;01:12:43;"I feel like it's going to be a ballad."
01:12:43;01:12:44;"No idea."
01:13:00;01:13:06;"Let's take a walk together near the ocean shore."
01:13:06;01:13:10;"Hand in hand, you and I."
01:13:10;01:13:16;"Let's cherish every moment we have been given."
01:13:16;01:13:22;"The time is passing by."
01:13:22;01:13:30;"I often pray before I lay down by your side."
01:13:30;01:13:40;"If you receive your calling before I awake, could I make it through the night?"
01:13:40;01:13:44;"Cherish the love we have."
01:13:44;01:13:50;"We should cherish the life we live."
01:13:50;01:13:53;"Cherish the love."
01:13:53;01:13:55;"Cherish the love."
01:13:55;01:13:58;"Cherish the love."
01:13:58;01:14:01;"Now, I want to know, was that an intro, or was that like a verse?"
01:14:01;01:14:03;"Are we going to get more of that?"
01:14:03;01:14:05;"No, this is the chorus."
01:14:05;01:14:08;"No, no, I know this is, but that first section was so weak."
01:14:08;01:14:10;"Oh, like the drums are going to drop out again?"
01:14:10;01:14:11;"Yeah."
01:14:11;01:14:16;"Yeah, that's one of those songs where you're like, ""This sucks,"" and then the chorus drops, and you're like, ""Oh, yeah."""
01:14:16;01:14:19;"Which is kind of a good kind of song."
01:14:19;01:14:21;"This is an interesting comparison."
01:14:21;01:14:26;"So, ""Cool and the Gang,"" ""Cherish,"" number four on the charts in 1985."
01:14:26;01:14:28;"What's its counterpart today?"
01:14:28;01:14:32;"This is a song that's been in the news recently, ""Watch Me Whip, Watch Me Nae Nae."""
01:14:54;01:14:56;"I know the dance."
01:14:56;01:14:58;"It's like that."
01:14:58;01:15:00;"Okay."
01:15:06;01:15:09;"""Watch Me Whip, Watch Me Nae Nae,"" a great song."
01:15:09;01:15:10;"Wait, that's been in the news recently?"
01:15:10;01:15:20;"It's been in the news recently because everybody and their mother is now doing this dance, including the mother of Chelsea Clinton, Hillary."
01:15:20;01:15:23;"Yeah, she went on Ellen, and she did the ""Watch Me Whip."""
01:15:23;01:15:24;"That's brutal."
01:15:24;01:15:26;"Bernie got to do that."
01:15:26;01:15:27;"Yeah, Bernie wouldn't do that."
01:15:27;01:15:28;"No."
01:15:28;01:15:29;"Sure he would."
01:15:29;01:15:30;"No, he won't."
01:15:30;01:15:31;"We'll see."
01:15:31;01:15:33;"Bernie's saving up for a far more elaborate dance."
01:15:33;01:15:37;"Yeah, he's going to do the full Gangnam Style."
01:15:37;01:15:40;"He's going to do the Macarena."
01:15:40;01:15:41;"Yeah, I don't know."
01:15:41;01:15:42;"Hillary."
01:15:42;01:15:43;"What do you guys think about Hillary?"
01:15:43;01:15:45;"We were asked about Bernie earlier."
01:15:45;01:15:46;"Who asked you about Bernie?"
01:15:46;01:15:47;"Oh, somebody on Twitter?"
01:15:47;01:15:49;"Yeah, somebody from the question bag."
01:15:49;01:15:51;"I can't get excited about Hillary."
01:15:51;01:15:55;"I mean, so you imagine 1985, Reagan was-"
01:15:55;01:15:56;"They're chilling in Little Rock."
01:15:57;01:15:59;"Reagan is president."
01:15:59;01:16:00;"The actor?"
01:16:00;01:16:01;"The actor."
01:16:01;01:16:02;"Good call."
01:16:02;01:16:07;"Who's president in 1985, future boy?"
01:16:07;01:16:13;"Thirty years later, Hillary might be president, and she's whipping and nae-nae-ing on TV."
01:16:13;01:16:15;"I mean, that's just sad pandering."
01:16:15;01:16:16;"It's just like-"
01:16:16;01:16:17;"Is it?"
01:16:17;01:16:18;"Maybe she wants to whip, man."
01:16:18;01:16:20;"Maybe that's her true soul."
01:16:20;01:16:21;"No."
01:16:21;01:16:23;"Do you guys honestly think that for one second?"
01:16:23;01:16:24;"No."
01:16:24;01:16:29;"It was clearly her communications director was like, ""This is a popular song, and we"
01:16:29;01:16:32;"have this TV appearance lined up with-"" Was it Ellen?"
01:16:32;01:16:33;"It was Ellen, yes."
01:16:33;01:16:34;"Jesus."
01:16:34;01:16:35;"This is like-"
01:16:35;01:16:36;"Well, also-"
01:16:36;01:16:38;"Maybe I'm being too real."
01:16:38;01:16:45;"That's that part of politics where you have to- It's about drawing together different"
01:16:45;01:16:46;"constituencies."
01:16:46;01:16:47;"Why not?"
01:16:47;01:16:48;"She's dancing."
01:16:48;01:16:51;"It's about going viral in 2015."
01:16:51;01:16:52;"Politics."
01:16:52;01:16:53;"She's trying to go viral."
01:16:53;01:16:54;"She just wants to get those clicks."
01:16:54;01:16:56;"But in the most inauthentic way."
01:16:56;01:16:58;"Bernie's going viral on his own terms."
01:16:58;01:16:59;"Yeah."
01:16:59;01:17:00;"I don't think anyone sees-"
01:17:00;01:17:02;"What's an example of Bernie's virality, though?"
01:17:02;01:17:05;"He's leading in the polls in New Hampshire and Iowa."
01:17:05;01:17:10;"Yeah, he's doing okay, but deep down, Jake, you're a huge music fan, right?"
01:17:10;01:17:11;"Yeah."
01:17:11;01:17:13;"Music's a big part of your life, including popular music."
01:17:13;01:17:14;"Yeah."
01:17:14;01:17:22;"I think of a president who's committed to closing the income gap and bombing other countries"
01:17:22;01:17:26;"less, or a president who actually has their finger on the pulse of pop culture."
01:17:26;01:17:28;"You're right, Ezra."
01:17:28;01:17:29;"Hillary 2016."
01:17:29;01:17:34;"When I think of a candidate that has their finger on the pulse of pop culture, it's obviously"
01:17:34;01:17:35;"Hillary."
01:17:35;01:17:36;"That's right."
01:17:36;01:17:37;"Compared to Bernie."
01:17:37;01:17:38;"She makes Bernie look old."
01:17:38;01:17:43;"So, we've established across the board enthusiastic support for Hillary Clinton in the Time Crisis"
01:17:43;01:17:44;"studio."
01:17:44;01:17:48;"Back to 1985, Hillary's in Little Rock with Bill."
01:17:48;01:17:49;"Cherish the love."
01:17:49;01:17:52;"This was the number three song on the charts."
01:17:52;01:17:54;"This was by a little band called Dire Straits."
01:17:54;01:17:55;"Oh."
01:17:55;01:17:56;"Money for nothing."
01:18:37;01:18:58;"So, that was the number three song on the charts in 1985, Money for Nothing by Dire Straits."
01:18:58;01:19:04;"In the full version, that song is eight minutes and 26 seconds."
01:19:04;01:19:05;"That's amazing."
01:19:05;01:19:06;"Which is crazy."
01:19:06;01:19:07;"Amazing?"
01:19:07;01:19:08;"I don't know if it's amazing."
01:19:08;01:19:11;"By amazing, I mean appalling."
01:19:11;01:19:12;"Appalling."
01:19:12;01:19:18;"The number three song on the charts in 2015 is by another foreigner."
01:19:18;01:19:20;"Dire Straits were from England."
01:19:20;01:19:22;"This is another foreigner, Justin Bieber from Canada."
01:19:22;01:19:23;"What do you mean?"
01:19:23;01:19:26;"Coming in at a lean three minutes and 28."
01:19:26;01:19:28;"You guys already know I love this song."
01:19:28;01:19:33;"You know what I realized the other day when I heard this on the radio?"
01:19:33;01:19:34;"That's a clock ticking."
01:19:34;01:19:36;"Yeah, I was just thinking that."
01:19:39;01:19:53;"Yeah, the stuff from '85 is sounding super stiff."
01:19:53;01:19:55;"2015's mopping the floor."
01:19:55;01:19:56;"Kind of is."
01:19:56;01:19:57;"[laughs]"
01:19:57;01:19:59;"Sounding so, yeah, one-dimensional."
01:20:02;01:20:06;"The pitch bending on the pan flutes."
01:20:06;01:20:07;"Have you seen the video for this?"
01:20:07;01:20:10;"There's all these drawings projected on him while he's dancing."
01:20:10;01:20:12;"Oh, and he's like killing people?"
01:20:12;01:20:13;"No."
01:20:13;01:20:14;"Yeah."
01:20:14;01:20:16;"No, you're thinking of Where Are You Now, maybe."
01:20:16;01:20:17;"Oh."
01:20:17;01:20:18;"Oh, yeah, yeah, you're right."
01:20:18;01:20:20;"Where Are You Now, What Do You Mean?"
01:20:20;01:20:23;"This is kind of like the game, that movie with Michael Douglas."
01:20:23;01:20:24;"Right, that's the one I'm thinking of."
01:20:24;01:20:25;"Yeah."
01:20:25;01:20:26;"Fincher film."
01:20:26;01:20:28;"Number three on the charts, Justin Bieber, What Do You Mean?"
01:20:28;01:20:32;"Clearly a superior song to Money for Nothing by dire straits."
01:20:32;01:20:34;"The entire studio is in agreement."
01:20:34;01:20:35;"Yep."
01:20:35;01:20:36;"Such a beautiful song."
01:20:36;01:20:39;"You know, it was interesting, Dave, you were pointing out how all that music from the '80s"
01:20:39;01:20:44;"has this kind of aggressive rightness, like cheerleader."
01:20:44;01:20:47;"It's almost like, ooh, I think I found myself cheerleader."
01:20:47;01:20:50;"That stuff from the '80s is like, ""It's the power of love."""
01:20:50;01:20:51;"Yeah."
01:20:51;01:20:55;"It's almost like, it's aggressive, it's very sure of itself."
01:20:55;01:20:59;"One thing that's interesting about Justin Bieber lately is he's become pop music's question"
01:20:59;01:21:00;"king."
01:21:00;01:21:01;"What do you mean?"
01:21:01;01:21:02;"He's asking questions."
01:21:03;01:21:04;"What do you mean?"
01:21:04;01:21:05;"And the big single this summer was Where Are You Now."
01:21:05;01:21:06;"New phone, who is this?"
01:21:06;01:21:07;"That's a nice single."
01:21:07;01:21:08;"That's dropping next week."
01:21:08;01:21:09;"New phone, who's this?"
01:21:09;01:21:17;"So Justin Bieber, one of the biggest pop stars in the world, he's asking questions."
01:21:17;01:21:22;"In the '80s, pop stars would just come out and say declarative statements."
01:21:22;01:21:23;"Wow."
01:21:23;01:21:24;"Love this."
01:21:24;01:21:26;"Wait, Jake, think of a song in the '80s where they're asking questions."
01:21:26;01:21:29;"God, put me on the spot."
01:21:29;01:21:31;"There's got to be an epic one."
01:21:31;01:21:32;"I don't think so."
01:21:32;01:21:33;"All I'm saying is Justin Bieber."
01:21:33;01:21:34;"Reagan had the answers."
01:21:34;01:21:40;"No, because Ronald Reagan, he was all about this kind of old school American narrative."
01:21:40;01:21:45;"He was all about fighting the evil empire, black and white, right?"
01:21:45;01:21:46;"Whereas today-"
01:21:46;01:21:47;"It's all gray."
01:21:48;01:21:49;"It's gray."
01:21:49;01:21:50;"We got Obama talking about anime."
01:21:50;01:21:51;"You could say-"
01:21:51;01:21:55;"You could say Springsteen, Born in the USA was a question."
01:21:55;01:22:01;"It was a question disguised as an authoritative statement."
01:22:01;01:22:08;"It's a very triumphant, huge chorus declaring that I was born in the USA, but then the verses"
01:22:08;01:22:12;"are all just about these sad Vietnam vets that can't get jobs."
01:22:12;01:22:13;"So it is sort of like a question."
01:22:13;01:22:14;"It's a stretch."
01:22:16;01:22:19;"Justin Bieber is much better at posing questions than Springsteen."
01:22:19;01:22:20;"Let's get back to 19-"
01:22:20;01:22:27;"When it comes to ambiguity and rich songwriting, Bieber is just crushing Springsteen."
01:22:27;01:22:28;"That's right."
01:22:28;01:22:31;"Bieber Clinton 2016."
01:22:31;01:22:32;"Let's get back to 1985."
01:22:32;01:22:33;"Wow."
01:22:33;01:22:38;"A lot of soundtrack songs were in the charts in 1985 because we had The Power of Love from"
01:22:38;01:22:39;"Back to the Future."
01:22:39;01:22:44;"And then the number on the charts then was We Don't Need Another Hero from Mad Max."
01:22:44;01:22:49;"Speaking of things coming full circle, we just had a Mad Max film in the theaters."
01:22:49;01:22:51;"Thirty years ago, what did they have?"
01:22:51;01:22:53;"A Mad Max film in the theaters."
01:22:53;01:22:57;"Here's Tina Turner with We Don't Need Another Hero in parentheses."
01:22:57;01:22:58;"Thunderdome."
01:22:58;01:22:59;"What was that?"
01:22:59;01:23:00;"A little bit of a hand fluke."
01:23:00;01:23:01;"It kind of sounds like the Justin Bieber song."
01:23:01;01:23:02;"Yeah."
01:23:02;01:23:31;"Wow, she sounds like she's had a rough night."
01:23:31;01:23:32;"Some real character in that voice."
01:23:32;01:23:33;"I like it."
01:23:33;01:23:34;"I don't know this song."
01:23:34;01:23:35;"Some patina."
01:23:35;01:23:36;"You might recognize the chorus."
01:23:36;01:24:00;"I don't know the chorus."
01:24:00;01:24:15;"That was Tina Turner with We Don't Need Another Hero, Thunderdome from the film Mad Max Beyond"
01:24:15;01:24:16;"Thunderdome."
01:24:16;01:24:18;"That was the number two on the charts in 1985."
01:24:18;01:24:20;"What's its counterpart today?"
01:24:20;01:24:22;"Well, it's our old friend The Weeknd."
01:24:22;01:24:27;"He's been tearing up the charts all summer long with The Hills."
01:24:27;01:24:30;"A real hot summer song."
01:24:30;01:24:32;"Wait, is this the 531?"
01:24:32;01:24:33;"Yeah, this is the only one."
01:24:33;01:24:34;"It's half past five."
01:24:34;01:24:35;"What is he saying about Promo?"
01:24:35;01:24:57;"I don't know."
01:24:58;01:25:25;"I don't know."
01:25:25;01:25:29;"So Dave, to answer your question, the opening lyrics to this song are, ""Your man on the"
01:25:29;01:25:30;"road, he doing promo."
01:25:30;01:25:33;"You said keep our business on the low low."""
01:25:33;01:25:38;"Now, for people who don't work in the music industry, when you're out on the road doing"
01:25:38;01:25:42;"promo, that means you're doing interviews."
01:25:42;01:25:47;"I don't know what other industries besides showbiz people say people go on the road doing"
01:25:47;01:25:48;"promo."
01:25:48;01:25:49;"Roofing."
01:25:49;01:25:52;"Farm equipment."
01:25:52;01:25:58;"So it sounds to me like The Weeknd is having sex with somebody whose husband probably sells"
01:25:58;01:25:59;"farming equipment."
01:25:59;01:26:02;"He's probably out in Nashville for a conference."
01:26:02;01:26:05;"I didn't realize that this song was also about cheating."
01:26:05;01:26:09;"Authorized John Deere dealership."
01:26:09;01:26:14;"And little does he know The Weeknd is up in his mansion in the Hollywood Hills having"
01:26:14;01:26:15;"sex with his girlfriend."
01:26:15;01:26:16;"I don't know."
01:26:16;01:26:18;"Is the Tina Turner song better or The Weeknd song?"
01:26:18;01:26:19;"They're both kind of harsh."
01:26:19;01:26:21;"Kind of dark."
01:26:21;01:26:22;"Both have great voices."
01:26:22;01:26:23;"I think we got to go The Weeknd."
01:26:23;01:26:25;"I think we got to go The Weeknd."
01:26:25;01:26:29;"But I think what we're noticing, as Dave pointed out on the first song, the modern songs have"
01:26:29;01:26:31;"a lot of ambiguity."
01:26:31;01:26:38;"This song is literally about cheating on somebody and you only have sex with them at 530 AM."
01:26:38;01:26:41;"Everything about it is kind of ambiguous."
01:26:41;01:26:42;"What is it?"
01:26:42;01:26:43;"What kind of relationship is that?"
01:26:43;01:26:45;"I guess that's what the song's exploring."
01:26:45;01:26:47;"What does he say in the bridge?"
01:26:47;01:26:48;"On the hills?"
01:26:48;01:26:49;"Yeah."
01:26:49;01:26:50;"Is there..."
01:26:50;01:26:51;"The hills have eyes."
01:26:51;01:26:52;"The hills have..."
01:26:52;01:26:53;"You know what's really funny?"
01:26:53;01:26:57;"Just reading the lyrics without hearing the music, because this actually sounds like some"
01:26:57;01:26:59;"old timey preacher."
01:26:59;01:27:00;"Hills have eyes."
01:27:00;01:27:01;"The hills have eyes."
01:27:01;01:27:02;"Who are you to judge?"
01:27:03;01:27:04;"Hide your lies, girl."
01:27:04;01:27:05;"Hide your lies."
01:27:05;01:27:06;"Only you to trust."
01:27:06;01:27:07;"Only you."
01:27:07;01:27:09;"You heard it here first from The Weeknd."
01:27:09;01:27:10;"The hills have eyes."
01:27:10;01:27:13;"The hills have eyes is a horror film."
01:27:13;01:27:14;"Who are you to judge?"
01:27:15;01:27:19;"It's like The Weeknd is literally looking at the Hollywood Hills and saying, ""Don't"
01:27:19;01:27:20;"judge me, Hills."""
01:27:20;01:27:21;"You're all doing it."
01:27:22;01:27:23;"I like this song."
01:27:23;01:27:24;"This song's growing on me more and more."
