Start Timestamp;End Timestamp;Transcript
38:26;38:27;"Lonesome on the trail?"
38:27;38:28;"Yeah, lonesome on the trail."
38:28;38:30;"""Lord, I'm just thinking about a certain female."""
38:30;38:35;"Which also, we were talking about this earlier, the concept of calling a woman a female seemed"
38:35;38:37;"so '70s too."
38:37;38:39;"And hilarious."
38:39;38:40;"A female."
38:40;38:42;"Do you think he meant it as a joke?"
38:42;38:43;"No."
38:43;38:44;"Like it's a bad rhyme."
38:44;38:45;"""Lonesome on the trail."
38:45;38:47;"Lord, I'm just thinking about a certain female."""
38:47;38:48;"I mean..."
38:48;38:49;"It's almost like Proto R. Kelly."
38:49;38:50;"Yeah, in a way."
38:50;38:55;"What do you think, Emma, you're the only woman on the panel today, what do you think it implies"
38:55;38:58;"to call somebody a female versus a woman?"
38:58;38:59;"What does it connote?"
38:59;39:01;"It's hard to say."
39:01;39:03;"I mean, I think it's better than..."
39:03;39:07;"I think a lot of people have a problem with calling women girls, adult women girls."
39:07;39:12;"But there's no real casual equivalent for guy or a woman, you know?"
39:12;39:15;"There's guys and men and then there's girls and..."
39:15;39:17;"Well, it's dolls, guys and dolls."
39:17;39:19;"Right."
39:19;39:22;"But yeah, I think a female, I don't know if I've ever heard that used."
39:22;39:23;"""A certain female."""
39:23;39:25;"It does sound kind of R&B."
39:25;39:28;"I can't think of another use of the word female in a song."
39:28;39:30;"Usually it's like, ""Babe."""
39:30;39:31;"You know, that kind of stuff."
39:31;39:35;"So it's my instinct to say it's sincere and it's not offensive."
39:35;39:39;"It's a forced bad rhyme, but again, it's sung with such feeling."
39:39;39:42;"Well, it also just seems very uncowboyish to say female."
39:42;39:43;"But whatever."
39:43;39:45;"I mean, it's an anachronism."
39:45;39:49;"This is basically him digging into every trope of American cowboy songs"
39:49;39:51;"and just jamming them all into one song."
39:51;39:52;"And maybe getting it a little wrong."
39:52;39:53;"Yeah."
39:53;39:56;"All right, so here's Thin Lizzy with ""Cowboy Son."""
39:56;40:00;"I am just a cowboy"
40:00;40:06;"Lonesome on the trail"
40:06;40:08;"A starry night"
40:08;40:11;"A campfire light"
40:11;40:18;"The coyote call"
40:18;40:24;"And the howling winds wail"
40:24;40:29;"So I'll ride out"
40:29;40:33;"To the old sundown"
40:54;40:57;"I am just a cowboy"
40:57;41:01;"Lonesome on the trail"
41:01;41:07;"Lord, I'm just thinking 'bout a certain female"
41:07;41:11;"The nights we spent together"
41:11;41:15;"Riding on the road"
41:15;41:18;"Looking back"
41:18;41:22;"It didn't seem so strange"
41:22;41:26;"Roll me over and turn me around"
41:26;41:30;"Left me keep standing 'til I hit the ground"
41:30;41:34;"Roll me over and let me go"
41:34;41:37;"Right near the rodeo"
41:37;41:41;"I was took in Texas"
41:41;41:45;"I did not know her name"
41:45;41:48;"Lord, all these southern girls"
41:48;41:52;"They seem the same"
41:52;41:55;"Down below the water"
41:55;41:59;"In a town in Mexico"
41:59;42:01;"I got my job"
42:01;42:06;"Busting broncs for the rodeo"
42:06;42:09;"Roll me over and turn me around"
42:09;42:13;"Left me keep spinning 'til I hit the ground"
42:13;42:17;"Roll me over and let me go"
42:17;42:20;"Running free with a buffalo"
43:04;43:09;"Roll me over"
43:09;43:18;"And I'll turn around"
43:18;43:23;"And I'll move my fingers"
43:23;43:27;"Up and down"
43:47;43:51;"It's okay amigo"
43:51;43:58;"Just let me go"
43:58;44:01;"Right near the rodeo"
44:43;44:46;"Roll me over and turn me around"
44:46;44:50;"Left me keep spinning 'til I hit the ground"
44:50;44:53;"Roll me over and let me go"
44:53;44:57;"Right near the rodeo"
44:57;45:00;"Roll me over and set me free"
45:00;45:04;"Cowboy's life is the life for me"
45:09;45:11;"Thin Lizzy with the Cowboy Song."
45:11;45:14;"Interesting."
45:14;45:17;"Both those songs are off the Jailbreak album from '76,"
45:17;45:19;"which was their big commercial breakthrough."
45:19;45:23;"They had been grinding it out for a good 7 years prior to that,"
45:23;45:26;"putting out a lot of records, a lot of lineup changes in the band."
45:26;45:29;"A lot of the records went nowhere, kind of touring a lot."
45:29;45:32;"They kind of had their sound developed from the get-go,"
45:32;45:36;"and it took a while for their sound to sync up with sort of what was going to be popular at the time."
45:36;45:39;"We could listen to the first song off their first record."
45:39;45:41;"Yeah, let's put it in contrast. Let's go back to the very start."
45:41;45:45;"What's that? The friendly ranger at Klontarf Castle?"
45:45;45:46;"Exactly."
45:46;45:48;"Sounds like a Wes Anderson movie."
45:48;45:50;"He's probably a Thin Lizzy fan."
45:50;45:54;"I mean, one interesting thing about Thin Lizzy is that now we kind of take it for granted"
45:54;45:57;"that because U2 became one of the biggest bands in the world,"
45:57;46:02;"I think we take it for granted that musicians from Ireland can take over."
46:02;46:07;"U2, Riverdance, The Coors."
46:07;46:09;"Okay, I'm not counting Van Morrison."
46:09;46:11;"Elvis Costello? Wait, okay."
46:11;46:14;"Elvis Costello, I believe, is of Irish descent."
46:14;46:16;"Oh, he came up through London. I got you."
46:16;46:18;"Yeah, I mean, I think he was born and raised in the UK."
46:18;46:22;"But for Thin Lizzy at the time, Ireland, first of all, is a very small country."
46:22;46:24;"You know the population of Ireland is?"
46:24;46:25;"No."
46:25;46:26;"It's like four million."
46:26;46:27;"Really? Wow."
46:27;46:30;"Yeah, so about the same size as LA."
46:30;46:34;"And I think at the time, being a band from Ireland was probably not that different"
46:34;46:37;"than being a band from Denmark or something."
46:37;46:40;"You know, an incredibly rich musical history, but just in terms of on the world stage."
46:40;46:43;"Sure, sure. Outside of it, for sure."
46:43;46:45;"And as a band, I mean, they were unique."
46:45;46:50;"I mean, Phil Lynott, who was the lead singer and bass player and songwriter,"
46:50;46:54;"was a black Irishman, which was a really interesting visual component of the band."
46:54;46:57;"Because it was like two other guys with this long blonde hair,"
46:57;47:00;"and then the black Irishman playing bass up front with the huge afro."
47:00;47:04;"And also, he was like proudly Irish. There's like a lot of Irish mythology and stuff."
47:04;47:08;"Yeah, in the early records, they really, like Whiskey in the Jar, that kind of stuff,"
47:08;47:13;"they are taking the sort of ancient Celtic songs and then making them into these rock songs."
47:13;47:17;"And it's funny too, because it's like there is a lot of local Irish energy in their music,"
47:17;47:21;"but it's also this like weirdly international language of rock and roll."
47:21;47:25;"I guess in this first song that we're going to hear, the first song on their first record,"
47:25;47:31;"The Friendly Ranger at Clontarf Castle, it opens with a spoken word piece"
47:31;47:34;"that has this kind of like psychedelic Hendrix vibe."
47:34;47:36;"And you can kind of hear his Irish accent."
47:36;47:37;"Yeah."
47:37;47:40;"And then they kind of kick in, the band drops in, and he starts singing."
47:40;47:43;"And it turns into this like very distinctive vocal singing mode."
47:43;47:48;"Like I said, it stops sounding Irish. It just turns into his like rock voice."
47:48;47:49;"Right."
47:49;47:52;"Which he had developed like from the get-go."
47:52;47:54;"Right. Well, yeah, I'm excited to hear this."
47:54;47:56;"And then it goes out with harmonized guitars."
47:56;47:59;"The drums are super nimble and light. It's really sparse."
47:59;48:02;"The bass playing is like driving the whole song. It's so good."
48:02;48:03;"Anyway, let's get in."
48:10;48:13;"The friendly ranger paused"
48:13;48:16;"And scoobing a bowl of beans spreading them like stars"
48:16;48:20;"Falling like justice on different scenes"
48:20;48:23;"I'm damned, indeed comrade, I'm being bombed"
48:23;48:29;"And all the people's faces turn strawberry blonde"
48:29;48:32;"By the morning gate the friendly ranger waits"
48:32;48:35;"For the sun making sure it's not late"
48:35;48:39;"Just in time, no need to fear, well just in case"
48:39;48:44;"And all the people are happy for another year"
48:44;48:49;"And in the evening shade he climbs upon the sun"
48:49;48:52;"Getting its glow"
48:52;48:54;"He goes on"
48:54;48:56;"Singing the song"
48:57;48:59;"bass solo"
48:59;49:13;"To feel the goodness glowing inside"
49:13;49:17;"To walk down the street with my arms about your hips"
49:17;49:20;"Side by side"
49:20;49:25;"To play with a sad-eyed child till he smiles"
49:25;49:28;"To look at a starry sky at night"
49:28;49:32;"Realize the miles"
49:32;49:37;"To see the sunset behind the steeple"
49:37;49:44;"Plum-tarf castle, no king, queen or nightly people"
49:44;49:48;"A coal fire and its pouring rain"
49:48;49:52;"To wave goodbye to a very good friend"
49:52;49:55;"Never meet again"
49:55;50:01;"Little thoughts bring"
50:01;50:04;"Little memories"
50:04;50:07;"Of you to me"
50:07;50:16;"bass solo"
50:16;50:19;"guitar solo"
50:19;50:22;"bass solo"
50:29;50:32;"guitar solo"
50:32;50:35;"bass solo"
50:35;50:38;"guitar solo"
51:03;51:08;"Then Lizzie with the friendly ranger at Clontarf Castle."
51:08;51:10;"So Jay, we had some discussion in the studio before."
51:10;51:13;"Now, you were describing Phil Lynott."
51:13;51:15;"Lynott. I think that's how you say it."
51:15;51:20;"Phil Lynott as being black Irish because he was a person of partial African descent"
51:20;51:22;"but also Irish nationality."
51:22;51:23;"Right."
51:23;51:28;"But our producer in the studio is pointing out that there's another meaning for the phrase ""black Irish""."
51:28;51:29;"Which was?"
51:29;51:34;"Which I think just means when you're Irish and you have kind of like darker skin and darker hair."
51:34;51:37;"As opposed to being fair and having red hair?"
51:37;51:43;"As opposed to being, yeah, like super white with freckles and red hair, which is one classic Irish look."
51:43;51:50;"The way it's been explained to me is that Colin Farrell is a classic example of being, of what it means to be black Irish."
51:50;51:53;"I guess the term would be ""African Irish""."
51:53;51:54;"Yeah."
51:54;51:56;"For Phil Lynott."
51:56;52:00;"I think his father might have been African American and his mother was Irish."
52:00;52:02;"So yeah, he's African Irish."
52:02;52:03;"Are you Irish at all?"
52:03;52:05;"Maybe mildly."
52:05;52:08;"Mildly Irish."
52:08;52:11;"There's like a mix of British Isle stuff happening."
52:11;52:13;"Right. Western European."
52:13;52:15;"Okay, so I think you've made a strong case for Thin Lizzy."
52:15;52:19;"Notice how I haven't said this whole show that you think Thin Lizzy are trash."
52:19;52:24;"Because I think actually Thin Lizzy resonates with the kids today."
52:24;52:26;"What do you think, Ezra/Emma?"
52:26;52:28;"Kane Higgs?"
52:28;52:30;"I think Thin Lizzy are great."
52:30;52:31;"I love their sound."
52:31;52:33;"That's the kind of rock music that I like."
52:33;52:35;"Minimalist stuff."
52:35;52:36;"I like the guitar sound."
52:36;52:39;"And there's that feeling that it's like proto-New Wave to me."
52:39;52:41;"That's what I like."
52:41;52:43;"I like that and I like Dino's barn girl."
52:43;52:48;"Okay, Jake, so let's wrap things up with one last song from Thin Lizzy."
52:48;52:49;"Phil and the Boys."
52:49;52:50;"Okay."
52:50;52:54;"Let's do another one off of Jailbreak."
52:54;52:55;"One of my favorite songs by them."
52:55;52:57;"It's called ""Running Back."""
52:57;53:00;"And it's just like an awesome little pop song."
53:00;53:26;"♪"
53:26;53:28;"♪ I'm a fool now that it's over ♪"
53:28;53:30;"♪ Can you guess my name? ♪"
53:30;53:33;"♪"
53:33;53:36;"♪ I make my money singing songs about you ♪"
53:36;53:39;"♪ It's my claim to fame ♪"
53:39;53:40;"♪"
53:40;53:43;"♪ When they say it's over ♪"
53:43;53:46;"♪ It's not all over, there's still the pain ♪"
53:46;53:47;"♪"
53:47;53:49;"♪ And I'd come running ♪"
53:49;53:52;"♪ I'd come running back to you again ♪"
53:52;53:53;"♪"
53:53;53:55;"♪ Oh, I'd come running ♪"
53:55;53:56;"♪"
53:56;53:59;"♪ I'd come running back to you again ♪"
53:59;54:02;"♪"
54:02;54:04;"♪ If I said I was sorry ♪"
54:04;54:05;"♪"
54:05;54:07;"♪ Would you still leave me? ♪"
54:07;54:09;"♪"
54:09;54:11;"♪ I never thought you'd go ♪"
54:11;54:13;"♪ 'Til you did ♪"
54:13;54:14;"♪ Believe me ♪"
54:14;54:16;"♪"
54:16;54:17;"♪"
54:17;54:19;"♪ When they say it's over ♪"
54:19;54:22;"♪ It's not all over completely ♪"
54:22;54:23;"♪"
54:23;54:25;"♪ 'Cause I'd come running ♪"
54:25;54:27;"♪ I'd come running back to you again ♪"
54:27;54:29;"♪"
54:29;54:31;"♪ Yes, I'd come running ♪"
54:31;54:32;"♪"
54:32;54:34;"♪ I'd come running back to you again ♪"
54:34;54:37;"♪"
54:37;54:43;"♪"
54:43;54:44;"I miss that girl."
54:44;54:52;"♪"
54:52;54:58;"♪"
55:10;55:13;"♪"
55:13;55:14;"♪"
55:14;55:16;"♪ The show is over ♪"
55:16;55:18;"♪ And we must all go home ♪"
55:18;55:20;"♪"
55:20;55:22;"♪ Just leave me by myself ♪"
55:22;55:23;"♪"
55:23;55:25;"I'll be all right here on my own ♪"
55:25;55:27;"♪"
55:27;55:29;"♪ If it's all over ♪"
55:29;55:30;"♪"
55:30;55:31;"It's all over ♪"
55:31;55:33;"♪ And I'm all alone ♪"
55:33;55:34;"♪"
55:34;55:36;"♪ And I'd come running ♪"
55:36;55:39;"♪ I'd come running back to you again ♪"
55:39;55:42;"♪ Don't you know I'd come running ♪"
55:42;55:43;"♪"
55:43;55:45;"♪ I'd come running back to you again ♪"
55:45;55:46;"♪"
55:46;55:47;"♪ Now ♪"
55:47;55:53;"♪ Oh, ma-ma-ma-ma-ma-ma-ma-ma-ma-ma-ma-ma-ma-ma-ma-ma-ma-ma-ma-ma ♪"
55:53;55:54;"♪"
55:54;56:00;"♪ Oh, tra-la-la-la-la-la-la-la-la-la-la-la-la-la-la ♪"
56:00;56:01;"♪ Now ♪"
56:01;56:04;"♪ Oh, na-na-na-na-na-na-na-na-na ♪"
56:04;56:06;"That was Thin Lizzy with ""Running Back."""
56:06;56:09;"And that wraps up our Thin Lizzy segment."
56:09;56:12;"Thank you, Jake, for teaching the world..."
56:12;56:13;"Absolutely."
56:13;56:14;"...about Thin Lizzy in 2015."
56:14;56:17;"You're listening to..."
56:17;56:18;"Time Crisis..."
56:18;56:20;"...on Beats 1."
56:20;56:25;"We've just been joined in the studio by your brother, Dave Longstrap."
56:25;56:26;"Thanks for being here."
56:26;56:27;"[ Laughter ]"
56:27;56:29;"Thanks for coming, Dave."
56:29;56:30;"Good to be here."
56:30;56:33;"Um, we opened up the questions bag recently on Twitter,"
56:33;56:35;"and, uh, 'cause it's your first time on the show,"
56:35;56:39;"maybe we'll just get things started by asking you a few random Internet questions."
56:39;56:40;"Oh, Jesus."
56:40;56:42;"First one, this is an interesting question."
56:42;56:45;"You think Obama has ever watched hentai?"
56:45;56:46;"No, I don't."
56:46;56:47;"Okay."
56:47;56:48;"What's hentai?"
56:48;56:50;"Hentai is, like, anime porn."
56:50;56:51;"Mm."
56:51;56:55;"There was a funny time where Obama was, like, I think he was in Japan,"
56:55;56:58;"or maybe he was hosting the Japanese prime minister,"
56:58;57:02;"and, um, he was, like, kind of shouting him out, and in his speech he said..."
57:02;57:06;"Today's also a chance for Americans, especially our young people,"
57:06;57:09;"to say thank you for all the things we love from Japan,"
57:09;57:12;"like karate and karaoke."
57:12;57:13;"Karaoke."
57:13;57:14;"Manga."
57:15;57:16;"And anime."
57:16;57:17;"Anime."
57:17;57:19;"And, of course, emojis."
57:19;57:21;"[ Laughter ]"
57:21;57:24;"Basically he's saying karaoke, anime, and manga."
57:24;57:25;"Oh."
57:25;57:26;"I mean, I'm saying it with my American accent."
57:26;57:27;"Yeah, yeah."
57:27;57:30;"Probably somebody briefed him and was like, ""This is the most Japanese way to say it."""
57:30;57:31;"Oh, my God."
57:31;57:33;"But so the--and you can tell--look at the video."
57:33;57:38;"The Japanese prime minister is kind of just, like, so, like, kind of, like, shocked and amused by it."
57:38;57:41;"In America, we love your karaoke, anime."
57:41;57:42;"George Bush never would have done that."
57:42;57:43;"Anime."
57:43;57:44;"And manga."
57:45;57:48;"Obama just has the deepest Texan drawl."
57:48;57:49;"Anime."
57:50;57:52;"Karaoke."
57:52;57:53;"Karaoke."
57:53;57:55;"Here's an interesting one, Dave."
57:55;57:59;"This comes from a Twitter user, existentialbree."
57:59;58:04;"In a postmodern, hyperreal world, is music a fashion choice in musicians' designers?"
58:04;58:05;"Sure."
58:05;58:09;"You heard it here first, existentialbree."
58:09;58:10;"I'm not into that."
58:10;58:11;"You're not into that?"
58:11;58:12;"No."
58:12;58:13;"You know, giving in."
58:13;58:14;"Giving into what?"
58:14;58:15;"Fashion?"
58:15;58:16;"Just nothing meaning anything."
58:16;58:19;"The three of us have kind of had a similar conversation before."
58:19;58:25;"And Ezra, I always remember when you were like, ""Music is, like, one part fashion and one part art."""
58:25;58:26;"Did I say that?"
58:26;58:27;"Yeah, you did."
58:27;58:28;"I stand by that."
58:28;58:29;"Yeah."
58:29;58:30;"And--"
58:30;58:31;"Although maybe it's shifted."
58:31;58:34;"Maybe today, if you're cooking up some music, you might want to add two parts fashion, one"
58:34;58:36;"part art to one part art."
58:36;58:37;"New recipe."
58:37;58:39;"See, I liked it when it was one-to-one."
58:39;58:41;"Who do you feel like is a classic example?"
58:41;58:42;"Of one-to-one ratio?"
58:42;58:43;"One-to-one."
58:43;58:44;"The Beatles?"
58:44;58:46;"Right, and a lot of people-- I think we should point out that a lot of people are sitting"
58:46;58:50;"at home saying, ""I don't think the Beatles-- with fashion."""
58:50;58:55;"But the truth is, the Beatles, from day one, they were wearing a very specific type of suit."
58:55;58:57;"They were wearing those collarless suits."
58:57;58:58;"That was Brian Epstein's idea."
58:58;58:59;"Oh, was it his idea?"
58:59;59:00;"Mm-hmm."
59:00;59:01;"They hated those suits."
59:01;59:02;"The long hair."
59:02;59:04;"And plus, I mean, changing the look of every album."
59:04;59:06;"And all dressing the same way."
59:06;59:07;"It was super concerted."
59:07;59:08;"It was the first boy band."
59:08;59:14;"But what's weird, to receive that music as the children of boomers, is that the fashion"
59:14;59:20;"has faded, and we're more inclined to just see it as the music."
59:20;59:21;"Right."
59:21;59:22;"The art part of it."
59:22;59:23;"The fashion is disposable."
59:23;59:27;"And so that's why you get a lot of people today saying, ""Oh, look at all these people."
59:27;59:29;"Look at Miley Cyrus doing this and that."""
59:29;59:31;"The Beatles used to be about the music."
59:31;59:38;"If you look at Sgt. Peppers, that's one of the most fashion-y, artificial, weird albums ever."
59:38;59:39;"Yeah."
59:39;59:40;"We just got a follow-up question, Dave."
59:40;59:41;"I'm curious to hear this from you."
59:41;59:42;"Favorite Beatles song?"
59:42;59:43;"I don't know."
59:43;59:44;"That's hard."
59:44;59:46;"Least favorite Beatles song?"
59:46;59:50;"Maybe one of the George Harrison songs from the White Album."
59:50;59:51;"Sorry."
59:51;59:52;"Oh, like ""Piggies""?"
59:52;59:53;"That's what I was thinking of."
59:53;59:54;"I kind of like ""Piggies."""
59:54;59:55;"The other one."
59:55;59:56;"Savoy Truffle?"
59:56;59:57;"Yeah, exactly."
59:57;59:58;"That's a random one."
59:58;01:00:01;"I was going to suggest maybe we play some Beatles, but you actually are not allowed"
01:00:01;01:00:03;"to play Beatles on streaming services."
01:00:03;01:00:05;"And I wanted to do a Bob Seger segment next week."
01:00:05;01:00:07;"And you can't play Bob Seger either."
01:00:07;01:00:08;"Those are the big two."
01:00:08;01:00:09;"Guess that's out."
01:00:09;01:00:13;"I think what happened was Bob Seger put his foot down a while ago, and the Beatles kind"
01:00:13;01:00:17;"of said, ""Is Bob really not going to have his music on streaming services?"""
01:00:17;01:00:20;"Let's take a page from Bob."
01:00:20;01:00:24;"Let's take a page from the Seger playbook."
01:00:24;01:00:26;"How about we listen to..."
01:00:26;01:00:27;"French Montana."
01:00:28;01:00:30;"Here's French Montana with ""Don't Panic."""
01:00:30;01:00:33;"Don't panic."
01:00:39;01:00:42;"Shorty fell in love with a huss."
01:00:42;01:00:45;"Man, I took her from a bus."
01:00:45;01:00:47;"Keep talking like they know something."
01:00:47;01:00:49;"I slide on you like she hoes something."
01:00:49;01:00:51;"Don't panic."
01:00:51;01:00:52;"Don't panic."
01:00:52;01:00:53;"We're just getting started."
01:00:53;01:00:54;"Don't panic."
01:00:54;01:00:57;"Real, real getting kinda."
01:00:57;01:00:59;"Watch the fake, fake, kayak."
01:00:59;01:01:00;"Don't panic."
01:01:01;01:01:02;"We're just getting started."
01:01:02;01:01:03;"Don't panic."
01:01:05;01:01:07;"We're just getting started."
01:01:07;01:01:08;"Don't panic."
01:01:08;01:01:11;"Take a fist like the whole sand."
01:01:11;01:01:13;"See you from four planets."
01:01:13;01:01:14;"Just getting started."
01:01:14;01:01:15;"Don't panic."
01:01:15;01:01:18;"If you a star, I'm a whole planet."
01:01:18;01:01:20;"Act like she won't get it."
01:01:20;01:01:23;"Have her run through the team like Jerome Baddox."
01:01:23;01:01:25;"You don't wanna, don't look for it."
01:01:25;01:01:27;"Have your on the surfboard."
01:01:27;01:01:28;"Surfboard."
01:01:29;01:01:32;"If you want this money, gotta work for it."
01:01:32;01:01:34;"Pass what you looking at."
01:01:34;01:01:37;"What's a wide open making that?"
01:01:37;01:01:39;"Shorty fell in love with a huss."
01:01:39;01:01:42;"Man, I took her from a bus."
01:01:42;01:01:44;"Keep talking like they know something."
01:01:44;01:01:46;"I slide on you like she hoes something."
01:01:46;01:01:47;"Don't panic."
01:01:48;01:01:50;"We're just getting started."
01:01:50;01:01:51;"Don't panic."
01:01:51;01:01:54;"Real, real getting kaya."
01:01:54;01:01:56;"Watch the fake, fake kayak."
01:01:56;01:01:57;"Don't panic."
01:01:58;01:02:00;"We're just getting started."
01:02:00;01:02:01;"Don't panic."
01:02:03;01:02:05;"We're just getting started."
01:02:05;01:02:06;"Don't panic."
01:02:06;01:02:08;"Hey, I won't let her."
01:02:08;01:02:11;"Sipping that Ciroc on my ride."
01:02:11;01:02:13;"Real, real gonna wait on."
01:02:13;01:02:15;"Fake, fake gonna skate on."
01:02:15;01:02:18;"Real, real getting kaya."
01:02:18;01:02:20;"Fake, fake gonna hike."
01:02:20;01:02:23;"She a model on the 'gram."
01:02:23;01:02:25;"Guess what was the plan?"
01:02:25;01:02:27;"She on the third, need four."
01:02:27;01:02:30;"Take you to the crib, take no pictures."
01:02:30;01:02:32;"Air fat, let me get up on."
01:02:32;01:02:34;"Bounce back early in the morning."
01:02:34;01:02:37;"Shorty fell in love with a huss."
01:02:37;01:02:39;"Man, I took her from a bus."
01:02:39;01:02:41;"Keep talking like they know something."
01:02:41;01:02:44;"I slide on you like she hoes something."
01:02:44;01:02:45;"Don't panic."
01:02:46;01:02:48;"We're just getting started."
01:02:48;01:02:49;"Don't panic."
01:02:49;01:02:51;"Real, real getting kaya."
01:02:51;01:02:54;"Watch the fake, fake kayak."
01:02:54;01:02:55;"Don't panic."
01:02:56;01:02:58;"We're just getting started."
01:02:58;01:02:59;"Don't panic."
01:03:01;01:03:03;"We're just getting started."
01:03:03;01:03:04;"Don't panic."
01:03:04;01:03:07;"Don't panic."
01:03:07;01:03:09;"Don't panic."
01:03:09;01:03:12;"Don't panic."
01:03:12;01:03:15;"Shorty fell in love with a huss."
01:03:15;01:03:18;"Man, I took her from a bus."
01:03:18;01:03:20;"Keep talking like they know something."
01:03:20;01:03:23;"I slide on you like she hoes something."
01:03:23;01:03:24;"Don't panic."
01:03:25;01:03:26;"We're just getting started."
01:03:26;01:03:27;"Don't panic."
01:03:27;01:03:30;"Real, real getting kaya."
01:03:30;01:03:32;"Watch the fake, fake kayak."
01:03:32;01:03:33;"Don't panic."
01:03:34;01:03:36;"We're just getting started."
01:03:36;01:03:37;"Don't panic."
01:03:39;01:03:41;"We're just getting started."
01:03:41;01:03:43;"Don't panic."
01:03:43;01:03:46;"Hold me, oh my."
01:03:46;01:03:49;"Don't need no cry."
01:03:49;01:03:51;"Hold me, oh my."
01:03:51;01:03:53;"Don't need no cry."
01:03:53;01:03:56;"I'm a ride with my dog off the rip."
01:03:56;01:03:58;"Tucked brown bag, paper tag off the rip."
01:03:58;01:04:01;"Shorty came through, bent it over off the rip."
01:04:01;01:04:04;"Don't boy bag, pop the tags off the rip."
01:04:04;01:04:07;"Start, start, started from the block, dirty money off the rip."
01:04:07;01:04:10;"Cut a shark fin, tuck money off the rip."
01:04:10;01:04:12;"Walk up in the deal, 150 off the rip."
01:04:12;01:04:15;"My dog came home, buck 50 off the rip."
01:04:15;01:04:17;"Hold me, oh my, my."
01:04:17;01:04:20;"Cut, cut, don't need no cry now."
01:04:20;01:04:21;"Off the rip."
01:04:21;01:04:23;"Hold me, oh my, my."
01:04:23;01:04:25;"Cut, cut, don't need no cry now."
01:04:25;01:04:26;"Off the rip."
01:04:26;01:04:29;"Brody knocked his head off, off the rip."
01:04:29;01:04:32;"Chopped top, beat, spit off, off the rip."
01:04:32;01:04:34;"Rari looking good on the strip."
01:04:34;01:04:36;"Chunk a hundred mil, that's a month."
01:04:36;01:04:37;"Grip, grip, grip."
01:04:37;01:04:39;"Johnny Hancock, 10 million off the rip."
01:04:39;01:04:40;"Rip, rip."
01:04:40;01:04:42;"Shorty bought a friend's off the rip."
01:04:42;01:04:43;"Rip, rip."
01:04:43;01:04:45;"Set up an EM, EM off the rip."
01:04:45;01:04:48;"Westside getting blood money with a grip."
01:04:48;01:04:51;"My dog getting out, money on us off the rip."
01:04:51;01:04:54;"Spend a car note on my fit, boy."
