Start Timestamp;End Timestamp;Transcript
01:27:24;01:27:27;"The more we explore the lyrics, I love this song."
01:27:27;01:27:31;"Okay, are you guys ready for the number one songs of 1985 and 2015?"
01:27:31;01:27:32;"Oh yeah."
01:27:32;01:27:37;"The number one song this week in 1985 was also from a film."
01:27:37;01:27:42;"It was from St. Elmo's Fire, and the song is called St. Elmo's Fire by John Parr."
01:27:42;01:27:44;"Do you guys remember this?"
01:27:44;01:27:45;"Instrumental?"
01:27:45;01:27:46;"My bad."
01:27:46;01:27:49;"You're thinking of Beverly Hills Cops, too?"
01:27:49;01:27:50;"Yeah."
01:27:50;01:27:52;"Wait, who is this by?"
01:27:52;01:27:53;"John Parr."
01:28:25;01:28:27;"Is this the chorus?"
01:28:54;01:28:56;"That key change was so '80s."
01:28:56;01:28:57;"Yeah."
01:28:57;01:28:57;"Wait, guys."
01:28:57;01:28:59;"I don't really know this song well,"
01:28:59;01:29:02;"but I just remembered that I was told a hilarious story about it."
01:29:02;01:29:04;"I don't know this person well, but I"
01:29:04;01:29:07;"spent some time with Rob Lowe once, who was in this film."
01:29:07;01:29:08;"And he's a big music buff."
01:29:08;01:29:12;"And it was kind of amazing hearing him talk about '80s music."
01:29:12;01:29:13;"And I remember him telling this story,"
01:29:13;01:29:15;"but at the time I didn't know the song that was."
01:29:15;01:29:16;"I couldn't really put it into context."
01:29:16;01:29:20;"And he was saying, you know, the theme from ""St. Elmo's Fire"""
01:29:20;01:29:24;"is written by this very famous songwriter, David Foster."
01:29:24;01:29:26;"He's a very accomplished songwriter,"
01:29:26;01:29:28;"big in the music industry."
01:29:28;01:29:30;"And he told the story that David Foster"
01:29:30;01:29:35;"had agreed to write a theme song for a wheelchair-bound Canadian"
01:29:35;01:29:40;"man who was going across the country."
01:29:40;01:29:42;"And basically, a wheelchair-bound Canadian man who"
01:29:42;01:29:44;"was kind of doing an inspirational,"
01:29:44;01:29:48;"maybe to raise money, kind of tour across the country"
01:29:48;01:29:51;"where he was going to be making a way across Canada"
01:29:51;01:29:52;"in his wheelchair."
01:29:52;01:29:55;"But he'd also agreed to do the ""St. Elmo's Fire"" theme."
01:29:55;01:29:57;"And he didn't have time to write two songs."
01:29:57;01:29:57;"Oh my god."
01:29:57;01:29:58;"So--"
01:29:58;01:29:59;"Doubled up."
01:29:59;01:30:01;"So he wrote-- so technically, ""St. Elmo's Fire"""
01:30:01;01:30:04;"is called ""St. Elmo's Fire Man in Motion."""
01:30:04;01:30:06;"And if you look at the chorus, it's"
01:30:06;01:30:09;"""I can see the new horizon underneath the blazing sky."
01:30:09;01:30:12;"I'll be where the eagle's flying, higher and higher."
01:30:12;01:30:13;"Gonna be your man in motion."
01:30:13;01:30:15;"All I need is a pair of wheels."
01:30:15;01:30:19;"Take me where my future's lying, St. Elmo's Fire."""
01:30:19;01:30:20;"That is--"
01:30:20;01:30:21;"And I never saw ""St. Elmo's Fire,"""
01:30:21;01:30:22;"but I don't think there's anybody in a wheelchair."
01:30:22;01:30:23;"I don't believe so."
01:30:23;01:30:24;"Never saw it."
01:30:24;01:30:25;"I love it."
01:30:25;01:30:27;"David Foster, you're a legend for that one."
01:30:27;01:30:28;"Right."
01:30:28;01:30:31;"A true pragmatist there."
01:30:31;01:30:32;"A true 1980s--"
01:30:32;01:30:34;"Terrible song."
01:30:34;01:30:35;"OK, yeah."
01:30:35;01:30:38;"We didn't talk about the quality of the song."
01:30:38;01:30:39;"You're not feeling ""St. Elmo's Fire""?"
01:30:39;01:30:41;"This is the worst thing of the top five."
01:30:41;01:30:44;"That probably was the worst song that we've heard so far."
01:30:44;01:30:45;"But that was number one?"
01:30:45;01:30:47;"That was number one."
01:30:47;01:30:47;"Wow."
01:30:47;01:30:50;"Someone was buying a seven inch of that, a cassette single."
01:30:50;01:30:52;"B-side, instrumental version?"
01:30:52;01:30:53;"Yeah."
01:30:53;01:30:53;"I think--"
01:30:53;01:30:56;"David Parr, full length."
01:30:56;01:30:59;"I think we're about to come up with the most extreme contrast"
01:30:59;01:31:01;"of our top five experiment."
01:31:01;01:31:06;"The number one song in 1985 was ""St. Elmo's Fire,"""
01:31:06;01:31:11;"this weird half wheelchair, half '80s movie song."
01:31:11;01:31:16;"And the number one song in 2015 is this gem from The Weeknd."
01:31:16;01:31:23;"[MUSIC - THE WEEKND, ""ST. ELMO'S FIRE""]"
01:31:23;01:31:25;"And I know she'll be the death of me."
01:31:25;01:31:27;"At least we'll both be numb."
01:31:27;01:31:30;"And she'll always get the best of me."
01:31:30;01:31:32;"The worst is yet to come."
01:31:32;01:31:34;"But at least we'll both be beautiful"
01:31:34;01:31:36;"and stay forever young."
01:31:36;01:31:38;"This I know."
01:31:38;01:31:40;"This I know."
01:31:40;01:31:44;"She told me don't worry about it."
01:31:44;01:31:49;"She told me don't worry no more."
01:31:49;01:31:53;"We both know we can't go without it."
01:31:53;01:31:59;"She told me you'll never be alone."
01:31:59;01:32:03;"I can't feel my face when I'm with you."
01:32:03;01:32:05;"But I love it."
01:32:05;01:32:08;"But I love it."
01:32:08;01:32:12;"I can't feel my face when I'm with you."
01:32:12;01:32:14;"But I love it."
01:32:14;01:32:16;"But I love it."
01:32:16;01:32:19;"Oh, and I know she'll be the death of me."
01:32:19;01:32:21;"At least we'll both be numb."
01:32:21;01:32:23;"And she'll always get the best of me."
01:32:23;01:32:25;"The worst is yet to come."
01:32:25;01:32:26;"All the misery--"
01:32:26;01:32:29;"Song of the summer, still number one,"
01:32:29;01:32:30;"""The Weeknd"" with ""Can't Feel My Face."""
01:32:30;01:32:33;"I mean, that's an extreme contrast, ""St. Elmo's Fire"""
01:32:33;01:32:34;"versus ""Can't Feel My Face."""
01:32:34;01:32:35;"That's crazy."
01:32:35;01:32:38;"Again, 2015, mopping the floor."
01:32:38;01:32:39;"Mopping the floor."
01:32:39;01:32:41;"I wouldn't have thought that was the case."
01:32:41;01:32:42;"I want to point out, this was originally"
01:32:42;01:32:43;"Jake's idea to do this segment, was"
01:32:43;01:32:45;"to bring in the top five of 1985."
01:32:45;01:32:47;"Yeah, you didn't think it was going to be this bad."
01:32:47;01:32:49;"I didn't think it would be this bad."
01:32:49;01:32:51;"I mean, I thought '85 would be interesting."
01:32:51;01:32:52;"Right."
01:32:52;01:32:54;"I mean, nice round number 30 years ago."
01:32:54;01:32:55;"Right."
01:32:55;01:33:02;"'95, '75, it seemed like '85 was a good choice, but wow."
01:33:02;01:33:05;"This is also just a very strong top five right now."
01:33:05;01:33:06;"Yes."
01:33:06;01:33:07;"That we're having in 20--"
01:33:07;01:33:08;"Well, you know what's-- it's making me--"
01:33:08;01:33:09;"hearing the '85 stuff is making me"
01:33:09;01:33:11;"appreciate the 2015 stuff more."
01:33:11;01:33:15;"If we just did a cold listen on the 2015 stuff,"
01:33:15;01:33:18;"I'd probably be bringing a higher degree of skepticism"
01:33:18;01:33:18;"or something."
01:33:18;01:33:20;"It was something about the compare and contrast."
01:33:20;01:33:21;"I'm just like--"
01:33:21;01:33:23;"2015 is funky."
01:33:23;01:33:25;"Right, well, I think a lot of people--"
01:33:25;01:33:27;"people always forget how bad the past was,"
01:33:27;01:33:30;"because you can look at the past in rose-colored glasses."
01:33:30;01:33:32;"Well, the good stuff rises to the top, too."
01:33:32;01:33:34;"I mean, the stuff--"
01:33:34;01:33:38;"the chorus of Cherish by Kool and the Gang was dope."
01:33:38;01:33:39;"Yes."
01:33:39;01:33:41;"Yeah, I mean, there were good things going on in 1985,"
01:33:41;01:33:42;"right?"
01:33:42;01:33:42;"Yeah."
01:33:42;01:33:43;"President Reagan."
01:33:43;01:33:44;"For one."
01:33:44;01:33:46;"What was '85?"
01:33:46;01:33:47;"I mean, I'll just say in general--"
01:33:47;01:33:49;"No, maybe Making Sense was '84."
01:33:49;01:33:50;"1980-- I don't know if this--"
01:33:50;01:33:51;"Ghostbusters was '84."
01:33:51;01:33:53;"This stuff didn't necessarily come out in 1985."
01:33:53;01:33:57;"I'm just saying that was the era of Michael, Prince, Bruce,"
01:33:57;01:33:58;"Madonna."
01:33:58;01:34:00;"Those were the superstars of the era."
01:34:00;01:34:02;"And that's a pretty idiosyncratic mix."
01:34:02;01:34:03;"Yeah."
01:34:03;01:34:04;"No, for sure."
01:34:04;01:34:05;"Wrestlemania."
01:34:05;01:34:06;"That was the first one?"
01:34:06;01:34:08;"The first Wrestlemania was 1985."
01:34:08;01:34:11;"That's actually an interesting-- one of our producers"
01:34:11;01:34:13;"is pointing out that the first Wrestlemania was 1985."
01:34:13;01:34:15;"It's interesting, because in some ways,"
01:34:15;01:34:19;"modern pop culture actually has learned a lot from Wrestlemania."
01:34:19;01:34:21;"Oh my god, I just realized a really weird thing."
01:34:21;01:34:21;"What?"
01:34:21;01:34:22;"Oh my god, you guys."
01:34:22;01:34:25;"I just realized a super weird thing."
01:34:25;01:34:29;"1985, number one single was the questionable song,"
01:34:29;01:34:33;"""St. Elmo's Fireman in Motion,"" written by David Foster."
01:34:33;01:34:35;"30 years later, the number one song"
01:34:35;01:34:37;"is ""Can't Feel My Face"" by The Weeknd."
01:34:37;01:34:39;"And as we were Googling The Weeknd,"
01:34:39;01:34:41;"it said that he's dating something"
01:34:41;01:34:44;"Hadid, who is the stepdaughter of David Foster."
01:34:44;01:34:44;"Wow."
01:34:44;01:34:45;"Whoa."
01:34:45;01:34:45;"Crazy."
01:34:45;01:34:46;"Full circle."
01:34:46;01:34:48;"You know what that says to me, though, more than anything?"
01:34:48;01:34:52;"Is that powerful families maintain power at all costs."
01:34:52;01:34:54;"It doesn't surprise me--"
01:34:54;01:34:55;"The kingdom."
01:34:55;01:34:57;"Yeah, that's how power works."
01:34:57;01:34:59;"It doesn't surprise me that two number one singles,"
01:34:59;01:35:02;"30 years apart, could all kind of come back to one family."
01:35:02;01:35:04;"That's how America works."
01:35:04;01:35:05;"That's true."
01:35:05;01:35:07;"That's sad and dark and true."
01:35:07;01:35:09;"Now that I realize that, Jake, I"
01:35:09;01:35:12;"see why you like Bernie Sanders better than Hillary Clinton."
01:35:12;01:35:14;"Now I'm starting to see your point."
01:35:14;01:35:17;"I'm just the punk rock idealist over here."
01:35:17;01:35:20;"That was a hell of a top five."
01:35:20;01:35:24;"You're listening to Time Crisis on B1."
01:35:28;01:35:57;","
01:35:57;01:36:07;"[MUSIC PLAYING],"
01:36:07;01:36:27;"[MUSIC PLAYING],"