Start Timestamp;End Timestamp;Transcript
40:10;40:18;"You're a very politically engaged person and following the news and stuff, so probably somebody who knows you wouldn't be surprised that you might have strong feelings about like a major event like that."
40:18;40:26;"But yeah, maybe some people just like on the official Foster the People account were just kind of like, ""Yeah, what was the tweet before that? Like, hey, announcing new tour dates."""
40:26;40:30;"Yeah, we like just released a song."
40:30;40:41;"It's one of those things where it's like when I look at like this point in history, I guess what makes me furious is that it seems like the biggest government cover-up maybe since Lee Harvey Oswald and the Kennedy assassination."
40:41;40:43;"Oh, I just gotta say, just because you weren't here, we were talking about that."
40:43;40:49;"Jake's been to the plaza in Dallas, and he kind of looked out the window, and he was like, ""It wouldn't be hard to make the shot."""
40:49;40:50;"That was Jake's take."
40:50;40:52;"I went to the museum."
40:52;40:53;"I've been there."
40:53;40:54;"Yeah, yeah."
40:54;40:56;"So did you stand at the window?"
40:56;40:57;"Yeah, the final stop of the tour is the window."
40:57;41:00;"So when you were eyeballing it from the window, were you like—"
41:00;41:02;"Oh, I mean, no, I don't doubt that he did it."
41:02;41:03;"Yeah."
41:03;41:04;"Why?"
41:04;41:10;"But it's the fact that, you know, after 20 hours of being interrogated, none of it was released, and then the seals were filed for 75 years."
41:10;41:14;"And even when like Trump, you know, wanted to raise his public—"
41:14;41:16;"Oh, yeah, I forgot about that."
41:16;41:20;"—well, like he said he was going to release the Kennedy files, and then even then he couldn't release them all."
41:20;41:28;"And it's like if you can't release them all now, and you're the president, then there's something that obviously implicates your own government that you don't want people to see."
41:28;41:29;"Right."
41:29;41:30;"And so it's like—"
41:30;41:31;"50 years later, you still can't."
41:31;41:32;"Yeah."
41:32;41:33;"It's like everybody's dead."
41:33;41:34;"Yeah."
42:33;42:39;"So what is it about this one—obviously, we live in an insane world with injustices and cover-ups and lies every day."
42:39;42:45;"So what is it about this one that really like you couldn't think anything as crazy until going back 50 years?"
42:45;42:49;"Well, I'd known about Epstein for—I've heard about him for a long time."
42:49;42:53;"Like even in the early 2000s, I remember hearing about the Lolita Express."
42:53;42:59;"Basically, you know, this guy that would take underage girls to his island and was friends with all these really wealthy and powerful people."
42:59;43:02;"And then he got like busted. I didn't even know that he got busted."
43:02;43:06;"I just—I remember hearing kind of the rumors about this guy a long time ago."
43:06;43:09;"And then it all kind of coming to a head this year."
43:09;43:11;"He gets arrested, and I'm like, ""Oh my God."""
43:11;43:18;"You know, like justice is going to be—this guy that's like skated around the law for so long that we're actually going to get some answers."
43:18;43:25;"And I have a million questions, as I'm sure a lot of people do, of how this happened."
43:25;43:31;"It's like if you have this guy who's arguably one of the most important witnesses in custody in the history of the U.S."
43:31;43:40;"because he's got potentially incredibly damaging information on two presidents, one currently active, and who knows who else."
43:40;43:46;"You know, you got Prince Andrew in there. You got all these other people that have been implicated hanging out with Epstein on his island."
43:46;43:53;"And then this happens. And after Suicide Watch, and then you start to like look at the facts of the guards weren't checking on him."
43:53;43:57;"He was taken off Suicide Watch. His cellmate was transferred the day before."
43:57;44:03;"Well, that's what—I think maybe one of the reasons why your tweets really got a lot of people talking"
44:03;44:08;"was because when I kind of looked at social media and the news the day it came out,"
44:08;44:13;"the vast majority of like independent commentators, you know, maybe obviously not like the New York Times headliner,"
44:13;44:18;"but the vast majority of independent commentators were saying, ""This is fishy. I don't believe this guy died."""
44:18;44:21;"But you went a step beyond, which is interesting."
44:21;44:28;"And I've been doing some research, and even I was like looking up about this New York Post photo of his body being taken into the hospital and comparing it."
44:28;44:34;"And so I was looking at the Snopes article about it, and there's the Fuster the People tweet in the Snopes article about it."
44:34;44:40;"So in some ways, you've become—whether or not you want it to be, you're the voice for that particular theory."
44:40;44:46;"That's what I'm curious about is, was it the photo that set you off because you're like, ""I don't believe that's the same guy,"" or already you just didn't think—"
44:46;44:48;"Or did you read something somewhere?"
44:48;44:51;"No, no, no. I just saw the photo, and then I saw that side by side."
44:51;44:56;"What about before you saw the photo? Did you already in the back of your head think like, ""I bet he's not even dead""?"
44:56;45:01;"I think you go through all the realm of possibilities of like what happened, what could have happened."
45:01;45:07;"But the photo, to me—and look, I'm not a forensics expert. I put out a f***ing tweet, you know what I mean?"
45:07;45:15;"And then like just being a musician that wanted to put out a tweet and like start a public discourse on this guy."
45:15;45:21;"But it's like you look at the photo, and it's not the same guy. And I know that when people die—look."
45:21;45:28;"And just to fill everybody in, when I looked at the Snopes article—and obviously Snopes can't verify it's the same guy."
45:28;45:34;"But they were just saying, ""Here's one thing to keep in mind. The pictures that were side by side were taken 15 years apart, and they're from different sides of his face."
45:34;45:39;"So maybe?"" That's how they kind of put it. They weren't coming down hard one way or the other."
45:39;45:45;"15 years apart, sure. But I mean, even the photos of Epstein when he was arrested in court recently."
45:45;45:47;"Are there some profile shots?"
45:47;45:51;"I mean, there's some head-on shots. There's not like a profile shot that you can A/B."
45:51;45:56;"But even the head-on shot, like he looks much younger than the guy. The nose is different."
45:56;46:02;"He's got deep lines around his mouth. And the photo of the guy that's, you know, on the stretcher or whatever."
46:02;46:07;"Just that they don't exist. And I could be wrong. It could be him."
46:07;46:10;"And I know that when you die, things change. You physically change."
46:10;46:14;"And sometimes people look really different from photo to photo."
46:14;46:15;"Sure."
46:15;46:16;"Do you know what I mean?"
46:16;46:17;"Sure."
46:17;46:19;"Sometimes you're like, ""That's me?"""
46:19;46:20;"Sure. Totally."
46:20;46:21;"You know? I don't know."
46:21;46:28;"I mean, I think—I'm not going to hang my hat up and say, ""I believe that the body was switched,"" and stand by that."
46:28;46:30;"Right. You were asking the question."
46:30;46:34;"I mean, I think the bigger question is what really happened to Jeffrey Epstein and why. You know?"
46:34;46:42;"Right. Even in the most extreme circumstances, it's hard to understand why anybody would want to keep him alive."
46:42;46:44;"Like, it just seems easier to kill him."
46:44;46:45;"I have some theories."
46:45;46:52;"You want to talk? Because here's my question. You know, I've read a little bit. I don't know as much as you, but there's a lot of people."
46:52;46:55;"Okay. So people have wondered, ""What's Jeffrey Epstein's deal?"""
46:55;47:04;"I think it's a pretty simple thing from he could be an intelligence asset being used by multiple intelligence agencies from all around the world, the CIA, Mossad, whatever."
47:04;47:07;"I think that's 100%, by the way, that he's a spy."
47:07;47:11;"And even if somebody's a spy, it doesn't mean everything they do is spy-esque."
47:11;47:15;"It means that an intelligence agency saw how that person could be of value."
47:15;47:16;"Sure."
47:16;47:21;"So, you know, maybe he's already running the Lolita Express, and somebody's like, ""Ooh, powerful man up to no good on a plane."
47:21;47:25;"Let's talk to this guy and see if he can help us, or let's pressure him."""
47:25;47:33;"My feeling is that if you're dealing with these, like, hardcore intelligence agencies who are doing manipulative, sneaky stuff around the world,"
47:33;47:40;"and you got somebody who's in custody who might talk, you know, similar to, like, when mobsters have somebody who's going to testify against them,"
47:40;47:43;"the easiest thing to do would be to have them killed."
47:43;47:46;"So if you're going to go to the trouble of getting somebody into the prison,"
47:46;47:51;"explain to me why somebody might want to actually go through this extra hassle of keeping somebody alive."
47:51;47:59;"Well, I mean, A, I think that the island that he had set up, it seems to be like it was some sort of a honeypot situation to where it's like--"
47:59;48:01;"Get some footage of--"
48:01;48:03;"Get footage, and he was known for that."
48:03;48:07;"He was known for filming other people and their sexual exploits."
48:07;48:09;"He has tapes on a ton of powerful people."
48:09;48:15;"You know, Alexander Acosta, who resigned after being the Secretary of Labor--"
48:15;48:16;"And gave him the sweetheart deal."
48:16;48:17;"He gave him the sweetheart deal."
48:17;48:22;"In an interview, he said that when they were pressing him, saying, like, ""Why did you give him this sweetheart deal?"""
48:22;48:28;"He said, ""Basically, I was told that he was above my pay grade, that he was intelligence, and to stay away from him."""
48:28;48:30;"And that's documented."
48:30;48:32;"So who was this guy?"
48:32;48:33;"I don't know."
48:33;48:34;"You know, Mossad, GRU."
48:34;48:35;"What's GRU?"
48:35;48:37;"That's like the Russian intelligence."
48:37;48:38;"Oh, yeah."
48:38;48:39;"Or did he work for Saudi Arabia?"
48:39;48:42;"I mean, the passport that they found in the safe said that he was--"
48:42;48:44;"He lived in Saudi Arabia."
48:44;48:45;"He had an Austrian passport."
48:45;48:51;"And then the madam, the woman that, like, procured all these underage girls and kind of ran things for him as business partner,"
48:51;48:53;"her father was high up in the Mossad."
48:53;48:54;"Right."
48:54;48:55;"I read about that."
48:55;48:57;"The only thing that I'll say about some of these things is that--"
48:57;49:00;"This is certainly not to refute anything that you're saying."
49:00;49:03;"And I wonder if you find this, too, a couple of indie rock musicians."
49:03;49:05;"You know, we've seen--"
49:05;49:06;"I don't know."
49:06;49:07;"Probably neither of us define--"
49:07;49:09;"We would be incredible spies, by the way."
49:09;49:14;"I thought that there would be, like, a musician shit that would be a great spy for countries around the world."
49:14;49:15;"That's true."
49:15;49:17;"No one would suspect you guys."
49:17;49:19;"No, everybody is just like, ""This is a dumbass musician."
49:19;49:22;"What do you think he's doing?"""
49:22;49:25;"The handoff needs to happen at MoPOP in Detroit."
49:25;49:29;"No, but I'm saying, yeah, I don't know if either of us identify as indie rock musicians,"
49:29;49:37;"but I would just say, like, we're people who spend time in New York and L.A., meet powerful people, even just powerful media figures."
49:37;49:44;"I guess one thing that I've found as I've been around more powerful and rich people sometimes is that there's a certain mundane aspect to some of this."
49:44;49:49;"So, for instance, this is no way to stick up for Jeffrey Epstein or any of his buddies,"
49:49;49:58;"but when I would see a lot of people on the Internet saying stuff like, ""Yeah, you don't fly on a guy's private plane five times and don't know what he's up to."""
49:58;50:01;"And I was kind of like, ""Actually, you do."""
50:01;50:08;"Not that I've -- I haven't been on very many private planes in my life, but, like, when you're around even just, like, DJs,"
50:08;50:13;"there's a type of person who are just in settings where somebody's like, ""I'm ripping back to the Hamptons right now on the PJ."
50:13;50:16;"There's eight seats,"" and somebody would be like, ""Oh, I'll take it."""
50:16;50:22;"So this idea that there's an intimacy, to me, it's kind of the equivalent of just, like, you know, somebody would be like,"
50:22;50:28;"""You don't catch a ride five times with, like, a dude in your grad school program and not know what he's up to."""
50:28;50:36;"There is a way in which these seemingly big deal things are just a natural result of these people existing in the same kind of social milieu."
50:36;50:43;"So even I kind of wonder when people were talking about if Ghislaine Maxwell's father -- he's known as a Mossad agent or something."
50:43;50:52;"Just the idea that a wealthy guy who is a Mossad agent's daughter would end up becoming in the inner circle of another wealthy guy who might have intelligence connections."
50:52;50:59;"The crazy thing is that could borderline still be a coincidence just because powerful people tend to hang out together."
50:59;51:04;"So I'm sure there's all sorts of funny stuff where, like, somebody's like, ""Oh, what? You work for the Russians? That's crazy."
51:04;51:09;"My dad worked for Saudi Arabia."" And they're like, ""Wow, and we just met on the rowing team at Harvard. Wild."""
51:09;51:15;"And this never came up for 20 years. So anyway, that's my one caveat with some of this stuff."
51:15;51:20;"The funny thing about a global elite is it's going to create a lot of coincidences just because it's the global elite."
51:20;51:25;"It's a small group of people. But this Saudi Arabia thing is definitely fascinating."
51:25;51:26;"So that's why you --"
51:26;51:32;"Okay, so back to your original question. I mean, the only thing that I can think of -- and obviously it's a stretch --"
51:32;51:47;"but it's interesting to think about is that if he was working for a foreign government and if he was collecting this compromat for information that's damaging towards our politicians or billionaires or whatever, powerful people,"
51:47;51:56;"that they would most likely have a copy of it. If he was working for a foreign government and he was worth something to them, if he went into this and he's --"
51:56;52:08;"whatever relationship he has with them, if they want to protect him and they threaten Trump or our government with damning material that they'll release without the release of Epstein,"
52:08;52:16;"if he had diplomatic immunity while he was operating under this, which I think that he probably did based on the deal that he got from Acosta,"
52:16;52:23;"that maybe the U.S. was like, ""All right, technically we have to send him back to Saudi Arabia, so we're going to cook up this whole scheme."""
52:23;52:31;"I don't know. I mean, I don't know. I just wouldn't put it past -- it's -- why would that be harder for them to swap him out with somebody that looks somewhat like him"
52:31;52:38;"or to try to doctor somebody to look like him and swap him out in the middle of the night when they basically told the guards to back off,"
52:38;52:43;"they stopped monitoring his cell, they moved his cellmate out, they cleared it all out. It's the U.S. government."
52:43;52:45;"They could walk in there, swap him out, trade him back."
52:45;52:54;"Well, that seems easier to do than 9/11. Before you came in, I was also -- we were also talking about 9/11 conspiracy theories, which again --"
52:54;52:55;"It ain't hard."
52:55;53:02;"Because that's the thing also when I've talked to people who feel very strongly about 9/11 being an inside job, and as I was saying before you came here,"
53:02;53:08;"I'm a very live and let live, open-minded kind of guy. I'm like, ""Hey, man, I don't believe everything the New York Times says."""
53:08;53:15;"And they're like, ""Sure, tell me why you think that is."" But one thing about that is always like, ""Well, if that in fact was an inside job,"
53:15;53:21;"I'm glad they didn't ask me to help because that sounds like a lot of work. That sounds very, very complicated."""
53:21;53:27;"Well, you're right. Compared to that, like, you know, because maybe you could do that with five people. I don't know. I believe that."
53:27;53:30;"I believe you could -- you swap a body and get a guy on a --"
53:30;53:32;"I mean, if you're talking about somebody that has --"
53:32;53:39;"If you're talking about somebody that has information that's going to bring down your entire government, you know, from the top down,"
53:39;53:40;"they're not going to stop at anything."
53:40;53:46;"That's one question that I have is because -- and I know this is not what you're gesturing at, but within the world of conspiracy theorists,"
53:46;53:51;"there's kind of like a spectrum. There's people -- obviously on one end of the spectrum, you have people who are not conspiracy theorists who say,"
53:51;53:57;"""I believe what the mainstream media says. It's the truth."" And then on the other side, the most extreme side, you have people who say,"
53:57;54:03;"""Not only is that not the truth, the very nature of reality that you understand is not the truth,"
54:03;54:08;"and that these guys are hiding big secrets about, you know, the way the entire universe is structured."""
54:08;54:16;"And that seems a little bit extreme, too. And, you know, what you're saying is something in between about the way the intelligence community gathers information and blackmails."
54:16;54:20;"You're like, ""Sure, I believe that there's all sorts of stuff that we don't know about that exists in that world."""
54:20;54:25;"I guess one question that I have -- and again, I also want to make the point that it's very cool of you to come on the show"
54:25;54:30;"because your whole thing that you said when I actually read all of the tweets, when you said, ""Do your own research,"""
54:30;54:36;"you weren't actually encouraging Foster the People fans to fly to Saudi Arabia. This is your chance to clarify that, right?"
54:36;54:37;"Yeah, that's not --"
54:37;54:39;"Right. You were kind of just saying --"
54:39;54:44;"It was more of a broad statement of like, you know, you need to read information and not just watch television for your news."
54:44;54:46;"Right. And also your point about like, yeah, I'm an artist --"
54:46;54:48;"Or get your news from memes."
54:48;54:54;"I'm an artist and I'm just a person who kind of is just talking about stuff like -- yeah, so when I saw the whole context of it,"
54:54;54:59;"you're definitely not trying to like say, ""Guys, I'm an expert on this and I know what happened."""
54:59;55:02;"So I feel bad now peppering you with the questions. It's kind of like, ""Well, tell me about this."""
55:02;55:04;"But I just -- so I just want to make clear we're just talking about it."
55:06;55:09;"I'm gonna fight for how I want to live"
55:09;55:13;"Spark up the riots, guess I'm a criminal and a futurist"
55:13;55:18;"Well, the charges I've caught won't stand your trial"
55:18;55:21;"You can take it out on me"
55:21;55:26;"Yeah, I've been to hell, but I've learned to keep my cool"
55:26;55:31;"Hold on to the devil, got him by the throat 'cause I refuse"
55:31;55:35;"Yeah, I won't take my last breath in denial"
55:35;55:38;"But you can't take it from me"
55:38;55:43;"Yeah, I've seen peaks been released into the prisons below"
55:43;55:48;"My days here disappear, there's things that I can't ignore"
55:48;55:54;"The sweetest release might take a while"
55:54;55:58;"So take me out and starve"
55:58;56:02;"Yeah, you"
56:02;56:07;"Yeah, just take me out and starve"
56:07;56:13;"Oh, if you're gonna take me out, take me out and starve"
56:13;56:18;"So one thing that's crossed my mind thinking about it, and I could believe anything, man, almost anything, but why --"
56:18;56:27;"So what you're saying makes sense. Like, sure, there's a plausible explanation for why it might be important to get that guy out of there"
56:27;56:33;"and he's a foreign intelligence asset and the U.S. has a diplomatic community. I can believe that."
56:33;56:38;"But there's also a part of me that's like, why does the global elite care so much about these three knuckleheads?"
56:38;56:45;"Bill Clinton's basically on his last legs in terms of public standing. Trump kind of seems like more trouble than he's worth."
56:45;56:51;"Prince Andrew, not even Prince Charles. There's like a part of me that's like, okay, let's say there are like nine kind of powerful dudes."
56:51;56:54;"The global elite could keep on trucking, could be like, oh my God."
56:54;56:59;"I mean, if we're talking in that universe of the global elite making the call for this to happen,"
56:59;57:04;"I don't really think the global elite would have made the call for this to happen because I don't think they would care about something like that."
57:04;57:11;"I think that it would be Donald Trump, basically our government, protecting their own asses."
57:11;57:13;"In some ways specifically protecting Trump."
57:13;57:20;"The Clintons don't have the power. There's no way the Clintons could be behind -- that was like the one thing when all the fallout happened, all that stuff."
57:20;57:25;"It's like, okay, like they're out of power. They couldn't pull this off if they wanted to."
57:25;57:32;"But our current government could. And especially if you look at it, you know, Attorney General Bill Barr and you look at Acosta,"
57:32;57:36;"two guys that were closely related to Epstein and protecting Epstein."
57:36;57:41;"Barr was, he worked for the attorney's office that represented Epstein in the sweetheart deal."
57:41;57:45;"Acosta was the lawyer that gave him the deal."
57:45;57:49;"And both those guys were then promoted heavily by Donald Trump."
57:49;57:54;"He's keeping those people close to him that helped protect this guy that might have some dark secrets on him."
57:54;57:59;"Maybe that's been my question is because, you know, with spicy topics like this,"
57:59;58:06;"you'll see such a range of opinion and you'll see people taking it into like, well, you got to understand this is like the whole fate of the world hinges on this."
58:06;58:10;"And you're kind of saying, no, maybe it's actually, it's as simple as a mafia thing."
58:10;58:15;"It's as simple as one guy trying to protect his ass and using and the intelligence communities being like,"
58:15;58:19;"we don't want to really release details about how we do stuff."
58:19;58:26;"Yeah. Like maybe it's actually not. There's something about the word conspiracy theory that sometimes makes people think of like, you know, reptilians and like aliens and stuff."
58:26;58:30;"It could be as simple as just like a few people being like, whoa, let's see."
58:30;58:33;"There's probably only a handful of people that know what happened."
58:33;58:36;"I don't think that there's hundreds of people involved, that there's some order."
58:36;58:39;"It's like you can't keep a secret, you know, it's like, but you can keep a secret with five people."
58:39;58:43;"The darkest thing of all that I was saying is, and I wonder what you think about this."
58:43;58:47;"My feeling is that there's almost no way that this is a bad thing for Trump."
58:47;58:54;"The fact that the Clinton name is even remotely associated with this because Trump is the epitome of shamelessness."
58:54;59:07;"He's the point one percent of bacteria that don't get killed by bacterial sites because he clearly is the Teflon Don and his fans and supporters will turn anything into a win for him."
59:07;59:10;"And then you see him, you know, retweeting the Clinton body count stuff."
59:10;59:14;"There's a part of me that's like, there could be all sorts of stuff that comes out in the next few months."
59:14;59:18;"And I still have this weird feeling like it's going to be a win for him."
59:18;59:24;"Another reason why I think he's so desperate to protect, you know, now he's campaigning for the next election already."
59:24;59:31;"And he's so desperate to protect his name and to win again because he knows that if he wins again, he can hide behind executive privilege."
59:31;59:35;"He's protected for another four years from going to jail and all sorts of other lawsuits."
59:35;59:39;"You know, he's gotten he's skirted around pretty much any kind of law."
59:39;59:41;"There's no rule of law right now."
59:41;59:46;"Yeah. I mean, when it's applied to President Trump and anybody that's around him, he's made that clear."
59:46;59:55;"So I think like his number one fear right now is that he's going to get unseated and that he's going to have to, like, go to court and say to New York and federal level."
59:55;01:00:01;"All these open, you know, cases against him are going to come to fruition and he's going to who knows what will happen."
01:00:01;01:00:07;"Well, shifting gears to the message of hope, you still you still think there's anybody who could beat him?"
01:00:07;01:00:09;"You still like Bernie?"
01:00:09;01:00:12;"I think that every Democrat running right now has a chance to beat him."
01:00:12;01:00:14;"Yeah, I agree with that. They all have a chance."
01:00:14;01:00:16;"I think it's going to be interesting."
01:00:16;01:00:19;"I think it's the Dems to lose, which could easily happen."
01:00:19;01:00:21;"I just hope it's not Biden."
01:00:21;01:00:22;"I know."
01:00:22;01:00:25;"Biden's kind of the easiest one to see losing in a way."
