Start Timestamp;End Timestamp;Transcript
01:39:15;01:39:20;"Ariel, because Ariel's '90s band, the Hippos, like toured with them or something."
01:39:20;01:39:21;"Oh, wow."
01:39:21;01:39:23;"Anyway, I always like Smash Mouth."
01:39:23;01:39:24;"Where are we?"
01:39:24;01:39:25;"That's number 5."
01:39:25;01:39:26;"Okay."
01:39:26;01:39:27;"We got to pick up the pace."
01:39:27;01:39:31;"Number 5 of 99, number 5 today, Hot Girl Summer featuring Nicki Minaj and Ty Dolla $ign."
01:39:31;01:39:33;"This is Megan Thee Stallion."
01:39:40;01:39:42;"This song is called Hot Girl Summer?"
01:39:42;01:39:43;"Yeah."
01:39:43;01:39:44;"I've seen this reference on Twitter."
01:39:44;01:39:45;"Yeah, yeah, right."
01:39:45;01:39:46;"It's a big reference now."
01:39:46;01:39:51;"It's like-- I think Megan Thee Stallion popularized the phrase and then made the song."
01:39:51;01:39:52;"Is that the right sentence?"
01:39:52;01:39:53;"That's correct, yeah."
01:39:53;01:39:54;"What is the artist's name?"
01:39:54;01:39:55;"Megan Thee Stallion."
01:39:55;01:39:57;"Megan Thee Stallion?"
01:39:57;01:39:59;"Well, it's T-H-E-E."
01:39:59;01:40:00;"Yeah, Megan."
01:40:00;01:40:01;"Thee."
01:40:01;01:40:02;"Like M-E-G-A-N."
01:40:02;01:40:03;"Yep."
01:40:03;01:40:04;"V."
01:40:04;01:40:05;"Stallion."
01:40:05;01:40:06;"Oh, V."
01:40:15;01:40:18;"She would talk a lot about Hot Girl Sh*t and then it became Hot Girl Summer and then it"
01:40:18;01:40:23;"became a thing that a lot of people would use as like a hashtag almost."
01:40:23;01:40:25;"And she's applied to trademark."
01:40:25;01:40:26;"Right."
01:40:26;01:40:27;"I've seen that on Twitter."
01:40:27;01:40:28;"I'm glad the songs do well."
01:40:28;01:40:31;"I like the idea of a summer having a theme though."
01:40:31;01:40:32;"Right."
01:40:32;01:40:33;"That's fun."
01:40:33;01:40:36;"Like, wait, Seinfeld, you must have done a Summer of George Hot Girl Summer event."
01:40:36;01:40:38;"I did do a Hot Girl Summer of George tweet."
01:40:38;01:40:39;"Okay, there you go."
01:40:39;01:40:40;"Yeah."
01:40:40;01:40:41;"Well, yeah, didn't you have a Grateful Dead summer?"
01:40:41;01:40:46;"I had-- yeah, me and my buddy Steve, when we were roommates back in like 2000 in Portland,"
01:40:46;01:40:48;"we had a Grateful Dead summer."
01:40:48;01:40:49;"We had a Led Zeppelin summer."
01:40:49;01:40:52;"And then we had a Cooler in the Car summer."
01:40:52;01:40:54;"What does that mean?"
01:40:54;01:40:59;"Like if you show up to a buddy's house, there's a cooler of brew in the car."
01:40:59;01:41:00;"At all times?"
01:41:00;01:41:01;"At all times."
01:41:01;01:41:02;"Yes."
01:41:02;01:41:03;"And how does one have--"
01:41:03;01:41:04;"So you would always keep it in there."
01:41:04;01:41:06;"Yeah, it was always a cooler of brew."
01:41:06;01:41:07;"So you're always just filling it with ice?"
01:41:07;01:41:08;"Yeah."
01:41:08;01:41:10;"Get a lot of melted water situations."
01:41:10;01:41:11;"Yes."
01:41:11;01:41:13;"Just you doing this or this is a good community thing?"
01:41:13;01:41:15;"Yeah, small community."
01:41:15;01:41:16;"Hot Girl Summer."
01:41:16;01:41:19;"In my day, it was Cooler of Brew in the Car Summer."
01:41:19;01:41:20;"What happened?"
01:41:20;01:41:21;"Cooler Summer."
01:41:21;01:41:24;"What's a good like TC summer theme?"
01:41:24;01:41:27;"I don't want it to be some gross food."
01:41:27;01:41:28;"I don't know."
01:41:28;01:41:29;"Maybe just getting older."
01:41:29;01:41:31;"My mind just goes to like health-related things."
01:41:31;01:41:32;"Right."
01:41:32;01:41:33;"Vegan summer."
01:41:33;01:41:34;"Right, right, yeah."
01:41:34;01:41:35;"It's also the election year, right?"
01:41:35;01:41:36;"Summer of push-ups."
01:41:36;01:41:38;"Let's abstain from things."
01:41:38;01:41:39;"Summer of Bernie."
01:41:39;01:41:41;"And put ourselves through--"
01:41:41;01:41:42;"No Fap Summer."
01:41:42;01:41:43;"Physical exertion."
01:41:43;01:41:44;"[laughter]"
01:41:44;01:41:45;"What is it?"
01:41:45;01:41:46;"No Fap Summer?"
01:41:46;01:41:47;"No Fap?"
01:41:47;01:41:49;"Oh, God, this is a crazy episode."
01:41:49;01:41:51;"Jake, you're not familiar with the No Fap movement?"
01:41:51;01:41:52;"No, what's that?"
01:41:52;01:41:53;"Wait, F-A-P?"
01:41:53;01:41:54;"Yeah."
01:41:54;01:41:55;"God, I feel like a grandpa."
01:41:55;01:41:57;"I'm just like, ""What is-- who is this?"""
01:41:57;01:42:00;"Fap is internet slang for masturbation."
01:42:00;01:42:01;"Whoa, wait."
01:42:01;01:42:02;"I think it's onomatopoeia."
01:42:02;01:42:03;"What's the derivation?"
01:42:03;01:42:04;"Wait."
01:42:04;01:42:05;"Onomatopoeia."
01:42:05;01:42:06;"Oh, okay, gotcha."
01:42:06;01:42:09;"So anyway, there's been a movement for a long time"
01:42:09;01:42:11;"where people claim that there's health benefits,"
01:42:11;01:42:15;"mental clarity, things like that, to abstaining from--"
01:42:15;01:42:16;"Not mental clarity."
01:42:16;01:42:18;"It would be mentally clouding."
01:42:18;01:42:19;"There's an argument to the opposite effect,"
01:42:19;01:42:22;"that it focuses you up and makes you more attractive"
01:42:22;01:42:23;"to the opposite sex."
01:42:23;01:42:25;"I don't think it focuses you up."
01:42:25;01:42:26;"All right, Jake, you're the jink."
01:42:26;01:42:27;"I think it deludes you."
01:42:27;01:42:28;"I think it makes you insane."
01:42:28;01:42:31;"Right, but Jake, you don't know what you're walking into here."
01:42:31;01:42:34;"These are passionate community of people"
01:42:34;01:42:38;"who've spent years doing their own research on this,"
01:42:38;01:42:40;"and they feel very strongly about this,"
01:42:40;01:42:42;"so you're walking into a minefield right now."
01:42:42;01:42:44;"So how long would they go?"
01:42:44;01:42:45;"Some people have gone years."
01:42:45;01:42:48;"Are they having sex, or is it just no--"
01:42:48;01:42:49;"I think you can have sex,"
01:42:49;01:42:51;"but some people abstain from sex, too."
01:42:51;01:42:52;"I think the goal's forever."
01:42:52;01:42:55;"Well, it's also like, ""Fine, be my guest."
01:42:55;01:42:56;"""Don't [bleep] me."""
01:42:56;01:42:58;"Great. Good for you."
01:42:58;01:42:59;"So you're fine with it."
01:42:59;01:43:00;"Well, they don't need your--"
01:43:00;01:43:01;"I just don't understand--"
01:43:01;01:43:06;"Jake, I don't think they need your kind of condescending praise."
01:43:06;01:43:09;"These guys are at such a high level mentally that--"
01:43:09;01:43:11;"Yeah, but I don't need them dictating to me"
01:43:11;01:43:14;"how to achieve mental clarity."
01:43:14;01:43:16;"It's like, you do you."
01:43:16;01:43:18;"You don't have to attach all these other--"
01:43:18;01:43:20;"I don't know if they're fascists about it."
01:43:20;01:43:21;"I don't know if they want to impose it."
01:43:21;01:43:23;"They probably feel bad for you."
01:43:23;01:43:24;"And you."
01:43:24;01:43:25;"I'm a member of the community, Jake."
01:43:25;01:43:26;"Yeah, look, mask off."
01:43:26;01:43:27;"You know what?"
01:43:27;01:43:30;"How do you think I achieved this level of mental clarity?"
01:43:30;01:43:33;"You are very lucid today on the program."
01:43:33;01:43:34;"Yeah."
01:43:34;01:43:36;"I want to make this show better."
01:43:36;01:43:37;"New rules."
01:43:37;01:43:39;"Summer, fall, winter, spring."
01:43:39;01:43:40;"No pizza, no brew."
01:43:40;01:43:42;"Where does all this stuff take place, Seinfeld?"
01:43:42;01:43:43;"It's all on Reddit?"
01:43:43;01:43:44;"Reddit."
01:43:44;01:43:46;"I was reading about NoFap about a week ago, actually."
01:43:46;01:43:47;"Were you?"
01:43:47;01:43:50;"I was, yeah, because I was looking for clarity."
01:43:50;01:43:52;"And it originated on Reddit,"
01:43:52;01:43:54;"and then it actually became so popular, the subreddit,"
01:43:54;01:43:57;"that I believe it branched out into its own thing."
01:43:57;01:43:59;"Oh, it's like its own Reddit with subreddits"
01:43:59;01:44:01;"within the NoFap community?"
01:44:01;01:44:02;"I think it broke out."
01:44:02;01:44:03;"Okay."
01:44:03;01:44:04;"Yeah."
01:44:04;01:44:05;"Well, Jake, give it a try for the next two weeks"
01:44:05;01:44:07;"and report back for the next TC."
01:44:07;01:44:10;"Jake comes in here in two weeks just like walking on air,"
01:44:10;01:44:13;"super mental clarity, just like, you know, guys,"
01:44:13;01:44:17;"I used to do a cooler summer, and I bruised my friends."
01:44:17;01:44:19;"Man, I don't know what I was missing."
01:44:19;01:44:21;"This is what it's all about, fellas."
01:44:21;01:44:23;"The number four song in 99, ""Bills, Bills, Bills"""
01:44:23;01:44:25;"by Destiny's Child."
01:44:25;01:44:26;"Classic."
01:44:37;01:44:40;"I remember seeing this on MTV and being like 14."
01:44:40;01:44:42;"I think I've told this story that I've never felt like,"
01:44:42;01:44:45;"""Oh, I know what's going to happen for--"
01:44:45;01:44:47;"which artists are going to have, you know,"
01:44:47;01:44:48;"like who's going to flop and who's not."""
01:44:48;01:44:49;"You're not a producer."
01:44:49;01:44:50;"Yeah, not really."
01:44:50;01:44:52;"You're not a record industry man."
01:44:52;01:44:53;"Yeah."
01:44:53;01:44:55;"I have, like, impulses, but I tend to just think of it as like,"
01:44:55;01:44:58;"how does that affect what I'm doing, my own art?"
01:44:58;01:45:00;"I have impulses about what I'm doing."
01:45:00;01:45:03;"But every once in a while, I do think I make the right call,"
01:45:03;01:45:06;"and I do remember the first time I saw Destiny's Child on TV,"
01:45:06;01:45:08;"and I remember the album before this,"
01:45:08;01:45:10;"but specifically it was this song, ""Bills, Bills, Bills."""
01:45:10;01:45:13;"I just remember seeing one of the singers in this band."
01:45:13;01:45:15;"I just remember being like, ""She's incredible."""
01:45:15;01:45:16;"She's got something."
01:45:16;01:45:19;"I mean, I was 14, so I was just kind of like, who knows?"
01:45:19;01:45:21;"You were not doing no fap summer."
01:45:21;01:45:23;"Oh, God."
01:45:23;01:45:25;"I just knew that there was something special,"
01:45:25;01:45:30;"and that was just like a little payoff when her solo career--"
01:45:30;01:45:31;"God."
01:45:31;01:45:34;"All right, moving on."
01:45:34;01:45:36;"Number four this year, ""Senorita,"""
01:45:36;01:45:39;"Shawn Mendes and Camila Cabello."
01:45:39;01:45:40;"This was on last week."
01:45:40;01:45:41;"Yeah."
01:45:41;01:45:44;"♪ It's another tequila sunrise ♪"
01:45:44;01:45:46;"And the Sapphire Moonlight."
01:45:46;01:45:48;"You know they're together."
01:45:48;01:45:49;"No, I didn't know that."
01:45:49;01:45:50;"Shawn and Camila, they're--"
01:45:50;01:45:51;"Oh, that's great."
01:45:51;01:45:53;"I saw some pictures of them together on Instagram."
01:45:53;01:45:54;"They were horsing around."
01:45:54;01:45:56;"I couldn't tell if it was platonic or not."
01:45:56;01:45:58;"They're just kind of horsing around on the street,"
01:45:58;01:46:01;"taking a walk with smiles on their faces."
01:46:01;01:46:02;"Well, I'm glad to hear it."
01:46:02;01:46:04;"♪ Oh, la, la, la, la ♪"
01:46:04;01:46:06;"♪ It's true, la, la, la, la ♪"
01:46:06;01:46:08;"♪ Oh, I should be running ♪"
01:46:08;01:46:11;"♪ Oh, you keep me coming for you ♪"
01:46:11;01:46:13;"♪ Light in Miami ♪"
01:46:13;01:46:15;"♪ The air was hot from summer rain ♪"
01:46:15;01:46:17;"♪ Sweat dripping off me ♪"
01:46:17;01:46:19;"♪ Before I even knew her name ♪"
01:46:19;01:46:22;"♪ La, la, la ♪"
01:46:22;01:46:25;"♪ You felt like ooh, la, la, la ♪"
01:46:25;01:46:27;"♪ Yeah, no ♪"
01:46:27;01:46:29;"♪ Sapphire Moonlight ♪"
01:46:29;01:46:33;"♪ We danced for hours in the same tequila sunrise ♪"
01:46:33;01:46:36;"♪ Her body felt right in my hands ♪"
01:46:36;01:46:38;"♪ La, la, la ♪"
01:46:38;01:46:41;"♪ You felt like ooh, la, la, la ♪"
01:46:41;01:46:42;"♪ Yeah ♪"
01:46:42;01:46:46;"♪ I love it when you call me senorita ♪"
01:46:46;01:46:50;"♪ I wish I could pretend I didn't need you ♪"
01:46:50;01:46:52;"I like that they sing this part together."
01:46:52;01:46:56;"'Cause they're both saying, ""I like that you call me senorita."""
01:46:56;01:46:58;"They're not worried about..."
01:46:58;01:46:59;"The logic."
01:46:59;01:47:04;"No, or they're not worried about outmoded definitions of gender."
01:47:04;01:47:07;"♪ It's so damn hard to leave you ♪"
01:47:07;01:47:08;"Solid song."
01:47:08;01:47:10;"Number 399."
01:47:10;01:47:11;"Wow."
01:47:11;01:47:13;"I guess a lot of times in the summer,"
01:47:13;01:47:15;"people put out summer songs."
01:47:15;01:47:17;"Everybody's talking about the summer."
01:47:17;01:47:19;"Gotta speak to the moment."
01:47:19;01:47:21;"So this summer, we have ""Hot Girl Summer."""
01:47:21;01:47:25;"Back in '99, this was a song I remember being bemused by."
01:47:25;01:47:27;"It's called ""Summer Girls"" by LFO."
01:47:27;01:47:31;"♪ Yeah ♪"
01:47:31;01:47:34;"♪ I like it when the girls stop by ♪"
01:47:34;01:47:37;"I don't know if I know this one."
01:47:37;01:47:40;"Chinese food makes me sick. Problematic."
01:47:40;01:47:42;"LFO? What is this thing?"
01:47:42;01:47:44;"What's their story?"
01:47:44;01:47:46;"They're kind of like--"
01:47:46;01:47:48;"Oh, yeah, I vaguely remember this."
01:47:48;01:47:50;"They were kind of a boy band."
01:47:50;01:47:54;"♪ And I think it's fly when girls stop by for the summer ♪"
01:47:54;01:47:56;"♪ For the summer ♪"
01:47:56;01:47:59;"♪ I like girls that wear Abercrombie and Fitch ♪"
01:47:59;01:48:03;"Tragically, two of the three guys died young."
01:48:03;01:48:05;"They got sick. It's sad."
01:48:05;01:48:06;"They got sick?"
01:48:06;01:48:07;"Yeah, I remember hearing--"
01:48:07;01:48:08;"Like cancer?"
01:48:08;01:48:10;"Yeah, last summer, one dude died from cancer."
01:48:10;01:48:11;"Damn."
01:48:11;01:48:13;"You know what's interesting, too, looking back on this song,"
01:48:13;01:48:15;"this is a song about nostalgia."
01:48:15;01:48:16;"Right."
01:48:16;01:48:18;"So we're looking back 20 years ago to '99."
01:48:18;01:48:20;"They're talking about new kids on the block,"
01:48:20;01:48:22;"so they're probably talking about '89."
01:48:22;01:48:24;"♪ Something in your eyes went and drove me crazy ♪"
01:48:24;01:48:26;"♪ Now I can't forget you and it makes me mad ♪"
01:48:26;01:48:29;"♪ Left one day and never came back ♪"
01:48:29;01:48:31;"♪ Stayed all summer then went back home ♪"
01:48:31;01:48:33;"♪ McCarley, Culkin, was it-- ♪"
01:48:33;01:48:35;"Honestly, the production sounds good to me right now."
01:48:35;01:48:37;"""Home Alone"" was 1990."
01:48:37;01:48:39;"Okay."
01:48:39;01:48:42;"Reminds me of, like, Marky Mark and the Funky Bunch."
01:48:42;01:48:43;"Yeah."
01:48:43;01:48:44;"That kind of energy."
01:48:44;01:48:46;"♪ The kids on the block had a bunch of heads ♪"
01:48:46;01:48:48;"♪ Chinese food makes me sick ♪"
01:48:48;01:48:50;"♪ And I think it's fly away ♪"
01:48:50;01:48:53;"♪ 'Cause I fly for the summer, for the summer ♪"
01:48:53;01:48:56;"This is when the rock music got prominent, scratching."
01:48:56;01:48:59;"Right. Yeah, there's scratching on ""All Star"" too."
01:48:59;01:49:02;"This is kind of like a haunting, sad song."
01:49:02;01:49:05;"♪ Cherry pants, cold crotch, rock stud boogie ♪"
01:49:05;01:49:07;"♪ Used to hate school so I had to play hooky ♪"
01:49:07;01:49:09;"♪ Always been hip to the B-Boy style ♪"
01:49:09;01:49:14;"Is this like a sort of like a commercialized, sublime kind of sound?"
01:49:14;01:49:17;"Uh, it's not a million miles away from the sublime, like,"
01:49:17;01:49:19;"what I got acoustic guitar--"
01:49:19;01:49:22;"but there's so much acoustic guitar meets hip-hop in the '90s."
01:49:22;01:49:24;"♪ Hip-hop and rock and roll ♪"
01:49:24;01:49:26;"There you go."
01:49:26;01:49:29;"This is back when people liked hip-hop and rock and roll."
01:49:29;01:49:31;"[laughter]"
01:49:31;01:49:33;"♪ You know fun dip and cherry coke ♪"
01:49:33;01:49:36;"♪ I like the way you laugh when I tell a joke ♪"
01:49:36;01:49:38;"♪ When I met you I said my name was Rich ♪"
01:49:38;01:49:41;"♪ You look like a girl from Abercrombie and Fitch ♪"
01:49:41;01:49:43;"♪ New kids on the block, catapulting ♪"
01:49:43;01:49:45;"They really made me into that Abercrombie and Fitch."
01:49:45;01:49:48;"The funny thing is that it was a real kind of"
01:49:48;01:49:51;"Borghese-ian playfulness with time"
01:49:51;01:49:54;"because they're reminiscing about 1990."
01:49:54;01:49:56;"Yeah."
01:49:56;01:49:58;"But Abercrombie and Fitch wasn't popular then."
01:49:58;01:50:01;"Abercrombie and Fitch was popular when the song was made."
01:50:01;01:50:03;"So he's kind of collapsing the present and the past..."
01:50:03;01:50:05;"Damn, dude."
01:50:05;01:50:07;"...in this kind of eternal, haunted..."
01:50:07;01:50:09;"I don't know."
01:50:09;01:50:12;"I gotta say, of all the songs we've listened to so far,"
01:50:12;01:50:14;"this one's, like, hitting me the most."
01:50:14;01:50:16;"It's very warm."
01:50:16;01:50:18;"Yeah. It's actually pretty."
01:50:18;01:50:20;"♪ Summer and I bug 'cause I miss it ♪"
01:50:20;01:50:22;"♪ Like the color purple macaroni and cheese ♪"
01:50:22;01:50:24;"I'm hearing that we actually once got an e-mail"
01:50:24;01:50:26;"asking us to break down these lyrics."
01:50:26;01:50:29;"I don't know, man, that one just kind of made me emotional."
01:50:29;01:50:31;"You know, that's also what's funny too, is like, you know,"
01:50:31;01:50:33;"when you're 14, whatever taste of music you have,"
01:50:33;01:50:36;"me and my friends probably would have made fun of this a little bit"
01:50:36;01:50:39;"'cause the Chinese food lyric is just insane."
01:50:39;01:50:41;"♪ Chinese food made me sick ♪"
01:50:41;01:50:42;"[laughs]"
01:50:42;01:50:44;"Just all Chinese food?"
01:50:44;01:50:46;"I'm willing to give him the benefit of the doubt"
01:50:46;01:50:50;"that he's trying to make this impressionistic portrait"
01:50:50;01:50:52;"of one summer,"
01:50:52;01:50:56;"and rather than him being that much of a psycho piece of shit,"
01:50:56;01:50:59;"that he's just like, ""The cuisine of that one billion Chinese people"
01:50:59;01:51:01;"is absolutely disgusting."""
01:51:01;01:51:05;"I'm willing to believe that he's impressionistically referencing"
01:51:05;01:51:08;"like a time that summer when he got sick from eating too much Chinese food."
01:51:08;01:51:10;"The one spot at the strip mall, Chinese."
01:51:10;01:51:14;"But hey, if that explanation is not enough for, you know,"
01:51:14;01:51:16;"a Chinese restaurateur who probably heard this song"
01:51:16;01:51:19;"and it made their skin crawl, I'm not going to fight them on that."
01:51:19;01:51:23;"But that aside, New Kids on the Block had a bunch of hits."
01:51:23;01:51:25;"Painting a picture, Chinese food makes me sick."
01:51:25;01:51:27;"Crazy non sequitur."
01:51:27;01:51:29;"But that's also him letting you know that this is like,"
01:51:29;01:51:33;"you know, it's Proustian, another adjective based on an author's name"
01:51:33;01:51:36;"who I've read about 30 pages of."
01:51:36;01:51:37;"[laughter]"
01:51:37;01:51:39;"I've always been meaning to go deeper on Proust."
01:51:39;01:51:41;"You ever read Proust, Jake?"
01:51:41;01:51:45;"No, I'm heavy on Nosgaard, who's compared to Proust."
01:51:45;01:51:46;"Yeah."
01:51:46;01:51:49;"But Nosgaard's contemporary, so I gravitate to him."
01:51:49;01:51:51;"Yeah, one summer off."
01:51:51;01:51:52;"We should do Summer of Proust."
01:51:52;01:51:53;"Oh, dude."
01:51:53;01:51:55;"Proustian summer."
01:51:55;01:51:56;"TC's Proustian summer."
01:51:56;01:51:58;"Marcel Proust--"
01:51:58;01:51:59;"[laughter]"
01:51:59;01:52:01;"Marcel Proust makes me sick."
01:52:01;01:52:03;"'Cause Dave Makovich from Chromia, you know,"
01:52:03;01:52:07;"he studied French literature, so he's always talking about Proust."
01:52:07;01:52:08;"I did not know that."
01:52:08;01:52:11;"I think the writers of the song, they understand that"
01:52:11;01:52:13;"you can't sum up the past in a tidy way,"
01:52:13;01:52:16;"so immediately they're letting us know that this is an impressionistic song."
01:52:16;01:52:18;"New Kids on the Block had a bunch of hits."
01:52:18;01:52:22;"So you're like, okay, is this going to be like a CNN look back at 1990?"
01:52:22;01:52:24;"New Kids on the Block had a bunch of hits."
01:52:24;01:52:27;"George H.W. Bush was in the White House."
01:52:27;01:52:30;"And the stock market was recovering from the--"
01:52:30;01:52:31;"You know?"
01:52:31;01:52:33;"They're like, is that what they're setting us up for?"
01:52:33;01:52:35;"Then Crazy Left Turn, Chinese Food Makes Me Sick."
01:52:35;01:52:38;"They're mixing this kind of grand cultural thing,"
01:52:38;01:52:41;"what was playing on the radio, with this very specific,"
01:52:41;01:52:44;"problematic remembrance of a time Chinese food made him sick."
01:52:44;01:52:46;"And then he twists it yet again."
01:52:46;01:52:49;"And I think it's Fly When Girls Stop By For The Summer."
01:52:49;01:52:51;"Stop by?"
01:52:51;01:52:52;"Maybe he's like a townie."
01:52:52;01:52:54;"Oh, yeah, it's like a summer relationship."
01:52:54;01:52:55;"It's like a summer fling."
01:52:55;01:52:58;"He's a townie in a lake town."
01:52:58;01:53:00;"The rich girls from the suburbs coming up."
01:53:00;01:53:01;"Yeah."
01:53:01;01:53:03;"There's the small town Chinese restaurant."
01:53:03;01:53:05;"Yeah, he's a lake townie."
01:53:05;01:53:07;"The rich suburban girls come."
01:53:07;01:53:09;"He's working the landscaping gig in the summer."
01:53:09;01:53:10;"Yeah."
01:53:10;01:53:12;"Oh, and maybe when he says the Chinese food makes him sick,"
01:53:12;01:53:17;"again, he wouldn't dream of impugning the quality of one of the world's"
01:53:17;01:53:18;"great cuisine cultures."
01:53:18;01:53:20;"He's just saying, you know what?"
01:53:20;01:53:21;"I'm not a member of the country club."
01:53:21;01:53:25;"I can't go, you know, eat club sandwiches at the country club."
01:53:25;01:53:29;"So I had to use my meager paycheck to go to the worst Chinese restaurant in"
01:53:29;01:53:30;"town."
01:53:30;01:53:31;"And it made me sick."
01:53:31;01:53:33;"That's before the Panda opened."
01:53:33;01:53:35;"Yeah, we didn't have Panda Express."
01:53:35;01:53:38;"I know in your rich suburb, you'd probably go eat Panda Express at the mall."
01:53:38;01:53:41;"Here, in a lake town, it's not like that."
01:53:41;01:53:44;"We have one really bad Chinese restaurant."
01:53:44;01:53:46;"I like girls that wear Abercrombie and Fitch."
01:53:46;01:53:49;"Again, rich suburban mall girls."
01:53:49;01:53:51;"They eat Panda Express."
01:53:51;01:53:52;"It's not going to make you sick."
01:53:52;01:53:53;"It's going to make you feel good."
01:53:53;01:53:55;"And they wear Abercrombie and Fitch."
01:53:55;01:53:56;"It makes you feel great."
01:53:56;01:54:00;"I'd take her if I had one wish, but she's been gone since that summer."
01:54:00;01:54:02;"You know, it tracks."
01:54:02;01:54:03;"It really tracks."
01:54:03;01:54:05;"He's a working class lake townie."
01:54:05;01:54:07;"Search and quotes lake townie."
01:54:07;01:54:09;"Is that a thing?"
01:54:09;01:54:10;"It's got to be."
01:54:10;01:54:13;"There's all different types of townies, but a lake townie?"
01:54:13;01:54:14;"Yeah."
01:54:14;01:54:15;"Summer girls."
01:54:15;01:54:22;"So I found the phrase lake townie in the Hartford Courant in a review of the film Beethoven from 1993."
01:54:22;01:54:23;"Uh-huh."
01:54:23;01:54:29;"Referring to a motorcycling lake townie named Seth."
01:54:29;01:54:31;"[Laughter]"
01:54:31;01:54:33;"Played by a young Danny Masterson."
01:54:33;01:54:34;"Oh, wow."
01:54:34;01:54:36;"And then there's also the show Riverdale."
01:54:36;01:54:37;"More contemporary."
01:54:37;01:54:43;"Yeah, and Riverdale is set in Shadow Lake, and so they refer to this character Cassidy as a townie."
01:54:43;01:54:45;"So Shadow Lake townie Cassidy."
01:54:45;01:54:47;"She's a lake townie."
01:54:47;01:54:48;"Whoa."
01:54:48;01:54:50;"Hip-hop mama, spick and span, met you one summer and it all began."
01:54:50;01:54:52;"You're the best girl that I ever did see."
01:54:52;01:54:54;"The great Larry Bird, Jersey 33."
01:54:54;01:54:56;"When you take a sip, you buzz like a hornet."
01:54:56;01:54:59;"Billy Shakespeare wrote a whole bunch of sonnets."
01:54:59;01:55:00;"Love that."
01:55:00;01:55:03;"Call me when you miss me 'cause I can't speak, baby."
01:55:03;01:55:05;"Something in your eyes really drove me crazy."
01:55:05;01:55:07;"Let's listen to the rest of the song."
01:55:07;01:55:09;"This song's just hitting."
01:55:09;01:55:12;"What do you think of these little tasty guitar moments, Jake?"
01:55:12;01:55:13;"Pretty in."
01:55:13;01:55:16;"We're down in it."
01:55:16;01:55:20;"Summer so-so, summertime feels got it going on."
01:55:20;01:55:22;"Shake and wiggle to a hip-hop song."
01:55:22;01:55:24;"Ezra, you should cover this."
01:55:24;01:55:28;"Well, I'll admit, I don't love the rap verses."
01:55:28;01:55:29;"Oh, classic."
01:55:29;01:55:31;"I steal your honey like I steal your butt."
01:55:31;01:55:35;"And I think it's fly when girls start fighting for the summer."
01:55:35;01:55:37;"For the summertime."
01:55:37;01:55:40;"I like girls that wear every crime being fair."
01:55:40;01:55:45;"I like the, like, sustained synth strings that glow in the mix."
01:55:45;01:55:47;"Yeah, it's pretty."
01:55:52;01:55:53;"Kind of abrupt ending."
01:55:53;01:55:54;"Summer's over."
01:55:54;01:55:56;"That's how it ends, dude."
01:55:56;01:55:57;"Beautiful song, man."
01:55:57;01:55:58;"I'm glad to hear that one."
01:55:58;01:56:02;"The number three song this summer, ""Truth Hurts"" by Lizzo."
01:56:05;01:56:07;"Oh, yeah, we heard this last time."
