Start Timestamp;End Timestamp;Transcript
01:21:57;01:22:02;"You give it one last try"
01:22:02;01:22:05;"In a horror movie"
01:22:05;01:22:08;"When the car won't start"
01:22:08;01:22:13;"You give it one last try"
01:22:13;01:22:20;"Guinevere orders one more beer"
01:22:20;01:22:24;"In the smoky pickup bar"
01:22:24;01:22:31;"Burnout tramp by the exit ramp"
01:22:31;01:22:34;"Waits for one more car"
01:22:34;01:22:37;"One more car"
01:22:37;01:22:44;"The Latin teacher always smelled like piss"
01:22:44;01:22:52;"Census figures come out wrong"
01:22:52;01:22:57;"There's an extra in our midst"
01:22:57;01:23:04;"Census figures come out wrong"
01:23:04;01:23:09;"There's an extra in our midst"
01:23:09;01:23:11;"Well, rest in peace, David Berman."
01:23:11;01:23:13;"Maybe you guys should throw together a playlist."
01:23:13;01:23:14;"Can do."
01:23:14;01:23:16;"I'd like to listen to that."
01:23:16;01:23:20;"So, guys, we got a new song from Patrick."
01:23:20;01:23:22;"How did you guys already hear this song?"
01:23:22;01:23:24;"He DM'd me, or us."
01:23:24;01:23:25;"I think all of us."
01:23:25;01:23:27;"Maybe he's not throwing you in that thread."
01:23:27;01:23:29;"He's just like, ""I want to keep my respectful distance"
01:23:29;01:23:32;"""from the masthead of the brand,"
01:23:32;01:23:34;"""the flagship over here."""
01:23:34;01:23:36;"Yeah, I don't think I got it."
01:23:36;01:23:38;"It's called ""The Crisis Crew is Back."""
01:23:38;01:23:39;"You're going to like it."
01:23:39;01:23:41;"Oh, okay."
01:23:41;01:23:44;"Rocks play down, dog."
01:23:44;01:23:47;"Guess who just got back today?"
01:23:47;01:23:50;"The team convened at the studio out in L.A."
01:23:50;01:23:53;"Seinfeld, Nick, Jake, Colin, and Ezra Kay"
01:23:53;01:23:55;"Fresh episodes, man, we're going to get 'em"
01:23:55;01:23:56;"Making this"
01:23:56;01:23:59;"Sunday, we'll all be listening to what they say"
01:23:59;01:24:02;"While enjoying some products made by Frito-Lay"
01:24:02;01:24:05;"Russian sour patch kids cereal all the way"
01:24:05;01:24:07;"'Cause if the boys want a snack, you better let 'em"
01:24:07;01:24:11;"The crisis crew is back, the crisis crew is back"
01:24:11;01:24:13;"Pretty tough tone"
01:24:13;01:24:18;"The crisis crew is back, the crisis crew is back"
01:24:18;01:24:19;"Brutal"
01:24:19;01:24:22;"Pretty tough tone"
01:24:22;01:24:24;"Rocks play down, dog."
01:24:24;01:24:26;"Does Patrick make all the tracks himself?"
01:24:26;01:24:27;"Yeah, he does it all."
01:24:27;01:24:30;"So he didn't just like find an instrumental"
01:24:30;01:24:32;"karaoke version of this one?"
01:24:32;01:24:33;"Oh, I thought you meant, like,"
01:24:33;01:24:35;"is he writing, recording, producing?"
01:24:35;01:24:37;"Is he tracking the drums live?"
01:24:37;01:24:39;"I don't think so."
01:24:39;01:24:41;"I mean, clearly he's musical."
01:24:41;01:24:43;"I bet he plays guitar and, you know."
01:24:43;01:24:45;"Why don't we have him call in?"
01:24:45;01:24:46;"Yeah, yeah."
01:24:46;01:24:47;"Yeah, he's never called in."
01:24:47;01:24:48;"No."
01:24:48;01:24:49;"It's about time."
01:24:49;01:24:50;"It's time."
01:24:50;01:24:52;"Well, thanks for another great song, Patrick."
01:24:52;01:24:54;"It's about time to get into the top five."
01:24:54;01:24:58;"It's time for the top five"
01:24:58;01:25:00;"on iTunes."
01:25:00;01:25:04;"This week, we're comparing the top five hits of today"
01:25:04;01:25:08;"on the iTunes store, the short-lived iTunes store,"
01:25:08;01:25:10;"with the top five songs of 1999."
01:25:10;01:25:12;"Why 1999?"
01:25:12;01:25:13;"A few reasons."
01:25:13;01:25:14;"Yeah."
01:25:14;01:25:15;"This is episode 99."
01:25:15;01:25:16;"You're kidding."
01:25:16;01:25:17;"That we're recording right now."
01:25:17;01:25:19;"That was one of the questions from the TC Wiki,"
01:25:19;01:25:22;"was you have anything special planned for episode 100?"
01:25:22;01:25:23;"Well, we're coming up on it."
01:25:23;01:25:25;"Yeah, we gotta figure something out."
01:25:25;01:25:28;"And I graduated college in '99."
01:25:28;01:25:29;"Wow."
01:25:29;01:25:30;"And it's 20 years ago."
01:25:30;01:25:32;"'99 was kind of a big year for me."
01:25:32;01:25:34;"Oh, or maybe '98."
01:25:34;01:25:35;"You were still in high school?"
01:25:35;01:25:37;"My freshman year was '98 to '99."
01:25:37;01:25:39;"Yeah, '99 was like--"
01:25:39;01:25:42;"I do think those are like interesting stages."
01:25:42;01:25:43;"When you first get to middle school,"
01:25:43;01:25:44;"when you first get to high school,"
01:25:44;01:25:45;"when you first get to college,"
01:25:45;01:25:50;"those kind of feel like moving up into degrees of consciousness."
01:25:50;01:25:51;"And then after college,"
01:25:51;01:25:55;"it's all just kind of like a-- melts into one endless nightmare."
01:25:55;01:25:59;"But I have actually very vivid memories of the summer of '98."
01:25:59;01:26:01;"Spent a lot of time at my friend's house,"
01:26:01;01:26:03;"and I think TRL was new."
01:26:03;01:26:05;"So we were watching Total Request Live,"
01:26:05;01:26:08;"and I felt like from ages 10 to 13,"
01:26:08;01:26:10;"I was kind of just like taking it all in, figuring [bleep] out,"
01:26:10;01:26:13;"and then I was like, ""Okay, '98. Summer '98."
01:26:13;01:26:15;"Next year I'm entering high school."
01:26:15;01:26:17;"What's going on? Britney Spears."
01:26:17;01:26:19;"Eminem. Eminem. Fastball."""
01:26:19;01:26:21;"It really did kind of felt like me entering high school"
01:26:21;01:26:24;"also was just like this new era of pop culture too."
01:26:24;01:26:26;"But maybe that's how you always feel."
01:26:26;01:26:28;"It's like you turn 14, and you're just kind of like,"
01:26:28;01:26:30;"""Okay, like what's up with the world?"""
01:26:30;01:26:32;"Yeah, because when you say that,"
01:26:32;01:26:35;"those are not big cultural moments. Fastball and--"
01:26:35;01:26:37;"Okay, yeah, I was kidding about Fastball."
01:26:37;01:26:39;"No, I know that was a Britney Spears."
01:26:39;01:26:41;"No, no, Britney Spears and Eminem looking back, that was--"
01:26:41;01:26:42;"Eminem? Okay, sure."
01:26:42;01:26:44;"That changed the world. Rap rock."
01:26:44;01:26:45;"Well, I wouldn't say that."
01:26:45;01:26:48;"And then rap rock. So I remember like '98 to 2000,"
01:26:48;01:26:50;"I was very familiar with that time period, and I was like,"
01:26:50;01:26:51;"I was like, ""This is weird."""
01:26:51;01:26:53;"Were you into that stuff?"
01:26:53;01:26:56;"No, because I was already like a little hipster."
01:26:56;01:26:58;"Right. Thank God, dude."
01:26:58;01:27:02;"Well, I definitely wasn't on some like, ""Britney Spears sucks."""
01:27:02;01:27:04;"No, no, I'm talking-- I'm not talking about Britney."
01:27:04;01:27:07;"I'm talking about Limp Bizkit and Slipknot."
01:27:07;01:27:09;"I made the best of it."
01:27:09;01:27:12;"Well, basically, I've always been kind of a straight shooter."
01:27:12;01:27:18;"The period where I was the biggest hater was like 6th grade."
01:27:18;01:27:21;"Because, you know, I was 12. I was still a child."
01:27:21;01:27:23;"In the Jewish faith, you'd become a man at 13"
01:27:23;01:27:25;"when you're bar mitzvahed."
01:27:25;01:27:27;"But when I was 12, I still was a child."
01:27:27;01:27:29;"I hadn't put away childish things."
01:27:29;01:27:32;"I still had this kind of like chip on my shoulder about like,"
01:27:32;01:27:35;"""I'm into cool music, and I don't know what music you guys like,"
01:27:35;01:27:36;"but it sucks."""
01:27:36;01:27:39;"So for instance, there's a punk band from New Jersey"
01:27:39;01:27:41;"called The Bouncing Souls."
01:27:41;01:27:42;"Are you familiar with them, Jake?"
01:27:42;01:27:43;"No."
01:27:43;01:27:45;"That's fair. That's a Jake not knowing something. That's fair."
01:27:45;01:27:47;"But Bouncing Souls are-- I think they're still a band,"
01:27:47;01:27:48;"a great band."
01:27:48;01:27:51;"They had like one or two albums that I just like thought were great."
01:27:51;01:27:53;"One of them was called Maniacal Laughter."
01:27:53;01:27:55;"And so I just loved Bouncing Souls."
01:27:55;01:27:57;"I love that they're from New Jersey."
01:27:57;01:27:59;"I feel like they wore sambas a lot."
01:27:59;01:28:01;"I don't know if they played soccer, but wearing sambas,"
01:28:01;01:28:03;"Adidas sambas, was part of their aesthetic."
01:28:03;01:28:07;"And I was just like, ""The songs are great. I love this band."""
01:28:07;01:28:10;"And I bought a T-shirt from some mail-order catalog."
01:28:10;01:28:14;"It was a Bouncing Souls T-shirt that on the back said MTV"
01:28:14;01:28:16;"in like the anti-circle."
01:28:16;01:28:17;"Right, right, right."
01:28:17;01:28:18;"Like MTV crossed out."
01:28:18;01:28:19;"Like the Ghostbusters logo."
01:28:19;01:28:20;"Yeah, anti-MTV."
01:28:20;01:28:22;"So some part of me-- you know, I was like 12,"
01:28:22;01:28:24;"so I was just kind of like, ""Well, I like Bouncing Souls,"
01:28:24;01:28:27;"and they're clearly anti-MTV, and I guess it makes sense"
01:28:27;01:28:30;"because they're an independent, samba-wearing,"
01:28:30;01:28:32;"New Jersey punk band."
01:28:32;01:28:33;"These are my people."
01:28:33;01:28:35;"They speak for me, and they don't like MTV."""
01:28:35;01:28:38;"And also, as discussed on the program, I didn't have MTV,"
01:28:38;01:28:40;"so I didn't feel like super loyal to it."
01:28:40;01:28:41;"I thought you were going to go the other way."
01:28:41;01:28:43;"I thought you were going to say, ""Now hold on here."
01:28:43;01:28:46;"A band is part music and part image."""
01:28:46;01:28:47;"Right."
01:28:47;01:28:50;"And a band embracing having their image on TV"
01:28:50;01:28:53;"is not antithetical to the authenticity of their music."
01:28:53;01:28:54;"No, I wasn't there yet, man."
01:28:54;01:28:55;"I'm out with the Bouncing Souls now."
01:28:55;01:28:56;"No, no, no."
01:28:56;01:28:57;"No, no, okay."
01:28:57;01:28:58;"I would never be out with the Bouncing Souls."
01:28:58;01:29:02;"But like I said, I was 12, so I just kind of went along with it,"
01:29:02;01:29:04;"and I think it made me feel good to be like,"
01:29:04;01:29:07;"""Oh, kids in my school, they learn about music from MTV,"
01:29:07;01:29:09;"but they don't even know about Bouncing Souls,"
01:29:09;01:29:12;"and here I am wearing a T-shirt that shows my solidarity"
01:29:12;01:29:16;"with the Bouncing Souls and shows that I don't like MTV."""
01:29:16;01:29:17;"You're legit."
01:29:17;01:29:20;"And, you know, again, in my small town,"
01:29:20;01:29:21;"it didn't really mean much."
01:29:21;01:29:24;"So I do remember somebody I was friendly with just being like,"
01:29:24;01:29:27;"""Hey, what's up with that shirt? What's wrong with MTV?"""
01:29:27;01:29:29;"And I just remember kind of like thinking about it,"
01:29:29;01:29:33;"and I felt like myself about to say whatever super--"
01:29:33;01:29:34;"Talking point."
01:29:34;01:29:38;"--talking point to like, ""Well, MTV, they only play garbage,"" and blah, blah."
01:29:38;01:29:40;"And I just remember I kind of just like--"
01:29:40;01:29:44;"It was like almost the moment that I shifted into the person I am today,"
01:29:44;01:29:46;"and I was just kind of like, ""I don't know."
01:29:46;01:29:47;"These guys don't like MTV."""
01:29:47;01:29:49;"You're right. There's some good stuff on MTV."
01:29:49;01:29:50;"I didn't really have it in me."
01:29:50;01:29:51;"That's when Vampire Weekend started."
01:29:51;01:29:53;"And that's when Vampire Weekend started,"
01:29:53;01:29:57;"which is equal parts Bouncing Souls and equal parts mid-'90s MTV."
01:29:57;01:30:01;"And I think the truth is, of course, there's a lot of things wrong with MTV."
01:30:01;01:30:04;"At the time, you could be like, ""They're ignoring things that deserve it,"""
01:30:04;01:30:05;"and blah, blah."
01:30:05;01:30:09;"But when I really look back as an adult and I think about the fact that they like--"
01:30:09;01:30:12;"Well, this isn't about music, but the fact that they put on like"
01:30:12;01:30:15;"Beavis and Butthead and Daria and like, you know,"
01:30:15;01:30:20;"the world Nirvana videos and helped popularize rap"
01:30:20;01:30:23;"to like kids who probably only listen to rock and like--"
01:30:23;01:30:24;"And, you know, they played a lot of good videos."
01:30:24;01:30:26;"I'm kind of like, ""I can't be that mad at it."""
01:30:26;01:30:28;"Like there's way worse things."
01:30:28;01:30:29;"But, you know."
01:30:29;01:30:32;"Yeah, looking back, '90s MTV is like a utopian--"
01:30:32;01:30:33;"[laughs]"
01:30:33;01:30:36;"--like college station, practically."
01:30:36;01:30:38;"Right, and it got a lot worse, but, you know, whatever."
01:30:38;01:30:39;"No, no, no, that's terrible."
01:30:39;01:30:42;"And I still respect the Bouncing Souls for feeling that way."
01:30:42;01:30:46;"I just felt myself like about to say something that I didn't really like know if I felt."
01:30:46;01:30:47;"Right."
01:30:47;01:30:49;"And I was like, ""Yeah, I'm a poser because even though I'm not--"
01:30:49;01:30:53;"I wasn't a big enough poser to wear a shirt from a band that I didn't listen to."""
01:30:53;01:30:54;"Right."
01:30:54;01:30:58;"I had too much self-respect for that, but I was a poser in that I was about to just like--"
01:30:58;01:30:59;"And you know what?"
01:30:59;01:31:02;"I'd like to think that the Bouncing Souls would have been proud of me for checking myself"
01:31:02;01:31:04;"and not just regurgitating their talking points"
01:31:04;01:31:06;"because they're an open-minded punk rock band."
01:31:06;01:31:10;"So anyway, that's all to say that age 12, 6th grade,"
01:31:10;01:31:13;"that was my peak kind of contrarianism."
01:31:13;01:31:17;"And then in 7th grade, I became kind of just like full music nerd"
01:31:17;01:31:21;"because I remember I got some gift certificates for my bar mitzvah."
01:31:21;01:31:23;"It's easy to remember."
01:31:23;01:31:26;"I guess it's easy to remember when you're Jewish, like your 13th birthday is such a big deal"
01:31:26;01:31:28;"because you do have to learn all this stuff."
01:31:28;01:31:32;"So I remember like I went to Tower Records in the city with like a family friend"
01:31:32;01:31:33;"and I got to buy all this--"
01:31:33;01:31:37;"And that's when I was like obsessed with like ska and reggae,"
01:31:37;01:31:40;"and I started getting new stuff in from the 60s and like I started getting into garage rock"
01:31:40;01:31:44;"and I got this compilation called Back From The Crypt Vol. 2."
01:31:44;01:31:46;"Very influential in my life."
01:31:46;01:31:48;"So anyway, that's when I just became like a music nerd"
01:31:48;01:31:52;"and then next summer, you know, now I'm 14 and seeing Britney Spears."
01:31:52;01:31:54;"And by that point, I was just like listening to too much music"
01:31:54;01:31:56;"to have like strong feelings about anything."
01:31:56;01:31:59;"So I was kind of like, Britney Spears, okay."
01:31:59;01:32:00;"Definitely didn't make me angry."
01:32:00;01:32:02;"I was kind of like, this is weird."
01:32:02;01:32:03;"Kind of catchy."
01:32:04;01:32:08;"And then when all the new metal stuff hit, I was kind of like, huh, Limp Bizkit."
01:32:08;01:32:12;"Like, this is weird, but I kind of like the song that DJ--"
01:32:12;01:32:14;"I like the hip-hop side of it."
01:32:14;01:32:18;"Like there's a song DJ Premier produced, and I always liked System of a Down."
01:32:18;01:32:20;"So that's what I mean like I made the best of it."
01:32:20;01:32:23;"I was like, you know, when that stuff was playing everywhere, I'd be like,"
01:32:23;01:32:27;"okay, I'm not fully down with Limp Bizkit, and I don't think they're a great band,"
01:32:27;01:32:29;"but this is my favorite of their songs."
01:32:29;01:32:33;"And I do think the best band of this genre is System of a Down."
01:32:33;01:32:37;"I just didn't have like this kind of like, oh, this [bleep] sucks."
01:32:37;01:32:39;"You know, I was older."
01:32:39;01:32:40;"I was like, this [bleep] sucks."
01:32:40;01:32:41;"And I was right."
01:32:41;01:32:42;"Except for System."
01:32:42;01:32:46;"Yeah, System, I was like, okay, well, this is like mathy and kind of proggy."
01:32:46;01:32:48;"And also, I always loved Rage Against the Machine, too."
01:32:48;01:32:49;"Oh, hell yeah."
01:32:49;01:32:50;"But so when that music hit--"
01:32:50;01:32:52;"But Rage is like '93 or '94."
01:32:52;01:32:54;"No, no, of course, they were the godfathers."
01:32:54;01:32:58;"But when that music hit, I saw how these were people who liked Rage,"
01:32:58;01:33:00;"and I couldn't fully hate on it."
01:33:00;01:33:02;"That first Rage record, dude."
01:33:02;01:33:03;"And the second one."
01:33:03;01:33:06;"Actually, Rage never made a bad album."
01:33:06;01:33:07;"Audioslave."
01:33:07;01:33:08;"I'm in, dude."
01:33:08;01:33:09;"I'm not even mad at Audioslave."
01:33:09;01:33:11;"I'm in on Audioslave."
01:33:11;01:33:13;"Like a stone."
01:33:13;01:33:14;"That's a good song."
01:33:14;01:33:15;"Yeah, great song."
01:33:15;01:33:16;"Like a stone is a good song."
01:33:16;01:33:18;"All right, let's get in this top five."
01:33:18;01:33:25;"It's time for the top five on iTunes."
01:33:25;01:33:29;"So this week in '99, number five song, Smash Mouth All-Star."
01:33:29;01:33:42;"[MUSIC - SMASH MOUTH ALL-STAR, ""SMASH MOUTH ALL-STAR""]"
01:33:42;01:33:45;"It's kind of good production."
01:33:45;01:33:50;"[MUSIC - SMASH MOUTH ALL-STAR, ""SMASH MOUTH ALL-STAR""]"
01:33:50;01:33:55;"Oh, double track vocal comes in there."
01:33:55;01:33:59;"This song is so popular with kids now."
01:33:59;01:34:00;"Still."
01:34:00;01:34:01;"Oh, yeah."
01:34:01;01:34:02;"Why?"
01:34:02;01:34:03;"It's still used in movies."
01:34:03;01:34:05;"Was that on like Shrek or something?"
01:34:05;01:34:06;"Yeah."
01:34:06;01:34:13;"[MUSIC - SMASH MOUTH ALL-STAR, ""SMASH MOUTH ALL-STAR""]"
01:34:13;01:34:15;"Wait, am I misremembering this?"
01:34:15;01:34:17;"Did they play the Trump inauguration?"
01:34:17;01:34:18;"No, they're very anti-Trump."
01:34:18;01:34:19;"Right, right."
01:34:19;01:34:21;"But that was like an internet joke or something"
01:34:21;01:34:22;"that people believed."
01:34:22;01:34:24;"See, I don't even remember it."
01:34:24;01:34:25;"It was like all--"
01:34:25;01:34:29;"No, they recently just like went hard on Trump on Twitter."
01:34:29;01:34:30;"Oh, no, no."
01:34:30;01:34:32;"Someone was covering this song, I think."
01:34:32;01:34:33;"Oh."
01:34:33;01:34:34;"Was that what it was?"
01:34:34;01:34:37;"Oh, it was Three Doors Down covering Smash Mouth."
01:34:37;01:34:39;"That is so deep."
01:34:39;01:34:41;"Three Doors covered Smash Mouth?"
01:34:41;01:34:42;"Smash Mouth."
01:34:42;01:34:44;"There's no way Smash Mouth [BLEEP] Three Doors."
01:34:44;01:34:45;"Three Doors."
01:34:45;01:34:48;"That band's brutal."
01:34:48;01:34:50;"I prefer Smash Mouth."
01:34:50;01:34:52;"I'm very diplomatic of you."
01:34:52;01:34:53;"No, Smash Mouth is cool."
01:34:53;01:34:54;"Where are they from?"
01:34:54;01:34:55;"What's their band?"
01:34:55;01:34:56;"Definitely SoCal, right?"
01:34:56;01:34:57;"San Jose."
01:34:57;01:34:58;"Oh, Northern California."
01:34:58;01:34:59;"Oh, wow, weird."
01:34:59;01:35:02;"How do you get a band going out of San Jose?"
01:35:02;01:35:04;"Like, there's no like--"
01:35:04;01:35:06;"are you playing in San Francisco and Oakland a lot?"
01:35:06;01:35:08;"That's a major metropolitan area, man."
01:35:08;01:35:09;"Yeah, but it's like--"
01:35:09;01:35:12;"it has very little like cultural impact."
01:35:12;01:35:13;"Whoa."
01:35:13;01:35:14;"San Jose?"
01:35:14;01:35:16;"I feel like we just got another Connecticut situation on our hands."
01:35:16;01:35:19;"Jake just going in on a beloved place."
01:35:19;01:35:21;"I'm not going in on it."
01:35:21;01:35:23;"I don't think it's beloved."
01:35:23;01:35:25;"Tell that to the Sharks fan."
01:35:25;01:35:31;"I think it's adjacent to Silicon Valley and like 45 miles from San Francisco."
01:35:31;01:35:33;"It's really not close to San Fran."
01:35:33;01:35:35;"It's probably 45 miles."
01:35:35;01:35:38;"Yeah, with traffic, it's like an hour and a half."
01:35:38;01:35:39;"Yeah, OK."
01:35:39;01:35:42;"Talk a little Bay Area."
01:35:42;01:35:45;"You got that 101 corridor through Redwood City."
01:35:45;01:35:47;"Yeah, you spend much time in San Jose when you used to live up there?"
01:35:47;01:35:48;"No."
01:35:48;01:35:50;"You've never been to the Winchester Mystery House?"
01:35:50;01:35:52;"No, I never have."
01:35:52;01:35:53;"Well, I have."
01:35:53;01:35:54;"Have you?"
01:35:54;01:35:55;"And it's very spooky."
01:35:55;01:35:56;"I'm not ripping in San Jose."
01:35:56;01:36:00;"I'm saying for a city of that size in that part of the world--"
01:36:00;01:36:02;"This guy's ripping on San Jose."
01:36:02;01:36:04;"--in Northern California, it's a bit of a ghost, man."
01:36:04;01:36:08;"I'm just wondering how Smash Mouth got their career going out of San Jose."
01:36:08;01:36:10;"I'm just intrigued by those mechanics."
01:36:10;01:36:14;"I think it's the same as in any major metropolitan area."
01:36:14;01:36:18;"They're not from like a one stoplight town in West Texas, you know."
01:36:18;01:36:21;"San Jose, you're talking about a thriving metropolitan area."
01:36:21;01:36:25;"I'm sure there were many clubs, organizations, places for them to play."
01:36:25;01:36:27;"Organizations."
01:36:27;01:36:30;"And yeah, I bet they probably ripped up to the Bay--"
01:36:30;01:36:31;"Well, I guess they are the Bay."
01:36:31;01:36:32;"Yeah, yeah."
01:36:32;01:36:33;"North Bay."
01:36:33;01:36:34;"They ripped up to San Fran."
01:36:34;01:36:37;"Do you think Smash Mouth ever played at-- what's the punk club in--"
01:36:37;01:36:38;"Oh, Gilman?"
01:36:38;01:36:39;"Gilman."
01:36:39;01:36:40;"Gilman Street in Berkeley?"
01:36:40;01:36:42;"That's actually a good question."
01:36:42;01:36:43;"Early Smash Mouth gigs."
01:36:43;01:36:44;"I bet they did."
01:36:45;01:36:47;"You also got to assume bands like Smash Mouth, when they came out,"
01:36:47;01:36:51;"because their first set was, ""You might as well be walking on the sun."""
01:36:51;01:36:55;"They were like a little more Hawaiian shirts, rockabilly."
01:36:55;01:36:56;"Yeah."
01:36:56;01:36:57;"They seem very SoCal."
01:36:57;01:36:59;"Very Orange County."
01:36:59;01:37:02;"But guys like that always have roots in punk rock."
01:37:02;01:37:06;"You don't turn into like a Hawaiian shirt guy unless you start with punk rock."
01:37:06;01:37:07;"It's so true, dude."
01:37:07;01:37:11;"I went through that transition from 6th to 7th grade."
01:37:11;01:37:12;"Exotica."
01:37:12;01:37:14;"You familiar with what people call Exotica?"
01:37:14;01:37:15;"No."
01:37:15;01:37:19;"Around the time that there was this kind of surf-- and I always loved surf music."
01:37:19;01:37:22;"I always buy like obscure '60s surf records."
01:37:22;01:37:26;"Around the time there was kind of a surf and garage revival in the '90s,"
01:37:26;01:37:33;"there was also a renewed interest in music made by people like Esquivel and Martin Denny."
01:37:33;01:37:36;"It was like related to big band music and sometimes Latin music."
01:37:36;01:37:39;"Yeah, it was kind of like Hawaiian shirt, hi-fi music,"
01:37:39;01:37:44;"like a record to put on while you made like Mai Tais in your suburban basement bar."
01:37:44;01:37:45;"You can picture what that stuff sounds like."
01:37:45;01:37:46;"Life's good, man."
01:37:46;01:37:47;"Like Oregon music."
01:37:47;01:37:48;"Oh, yeah."
01:37:48;01:37:53;"Kind of slightly creepy, vibey, Hawaiian shirt Mai Tai music."
01:37:53;01:37:57;"And so anyway, in a lot of these magazines and catalogs that would cover it,"
01:37:57;01:38:00;"it would always be featuring the best surf, garage, and Exotica."
01:38:00;01:38:02;"I'm sure the Smash Mouth guys know what I'm talking about."
01:38:02;01:38:04;"So did Smash Mouth--"
01:38:04;01:38:05;"Ever play Gilman Street?"
01:38:05;01:38:09;"Ever play Gilman-- and what's it called, 624 Gilman?"
01:38:09;01:38:11;"I thought it was just called Gilman Street."
01:38:11;01:38:12;"924 Gilman?"
01:38:12;01:38:16;"Ever cross paths-- well, I guess at that point Green Day was already really big."
01:38:16;01:38:18;"Play a show with Rancid or something?"
01:38:18;01:38:21;"If they did, the Internet doesn't remember it."
01:38:21;01:38:23;"Maybe it was such a thriving scene in San Jose."
01:38:23;01:38:26;"By the way, Seinfeld, this is a true number crunch."
01:38:26;01:38:27;"Oh, yeah."
01:38:27;01:38:31;"So Jake's talking about San Jose like it's some podunk town."
01:38:31;01:38:34;"Where does San Jose fall in terms of the size of American cities?"
01:38:34;01:38:36;"Is it top 10?"
01:38:36;01:38:37;"I bet it's right--"
01:38:37;01:38:38;"Oh, I don't think so."
01:38:38;01:38:39;"I bet it's right at number 10."
01:38:39;01:38:41;"10 or 11 or 9 or--"
01:38:41;01:38:43;"You think you know American cities that well, Seinfeld?"
01:38:43;01:38:44;"Yeah."
01:38:44;01:38:46;"I mean, I would vouch that it's not--"
01:38:46;01:38:48;"I bet it's the second biggest city in California."
01:38:48;01:38:49;"Oh, my God."
01:38:49;01:38:50;"It's number 10."
01:38:50;01:38:51;"It's number 10?"
01:38:51;01:38:52;"Called it, dude."
01:38:52;01:38:54;"It's the 10th biggest city in America?"
01:38:54;01:38:56;"Well, because it's definitely bigger than-- San Francisco's a small city."
01:38:56;01:38:57;"Wow."
01:38:57;01:38:58;"Yeah, San Francisco's 700,000."
01:38:58;01:39:01;"It's just over a million people."
01:39:01;01:39:03;"Second to Dallas, Texas."
01:39:03;01:39:07;"Oh, Dallas, you shine with an evil light."
01:39:07;01:39:08;"You mean Dallas is number 9?"
01:39:08;01:39:09;"Dallas is number 9."
01:39:09;01:39:13;"Well, anyway, I want to get some of the Smash Mouth guys on."
01:39:13;01:39:15;"You know who knows them from back in the days?"
