Start Timestamp;End Timestamp;Transcript
00:00;00:03;"Time Crisis, back once again."
00:03;00:08;"It's a dark summer, and this episode, we'll tackle it head on."
00:08;00:15;"We'll be talking about everything from conspiracy theories, to David Berman, and so much more."
00:15;00:23;"We'll also be counting down the top 5 songs on iTunes, and the top 5 Billboard hits of 1999."
00:23;00:26;"This is a summary..."
00:26;00:30;"Time Crisis, with Ezra King."
00:30;00:32;"B-B-B-B-Beasts."
00:32;00:34;"One."
00:35;00:41;"They passed me by, all of those great romances"
00:41;00:48;"The world I felt, wobbly, all my rightful chances"
00:48;00:56;"My picture clear, everything seemed so easy"
00:56;01:03;"And so I dealt to the blow, when the bus had to go"
01:03;01:07;"Now it's different, I want you to know"
01:07;01:13;"One of us is crying, one of us is lying"
01:13;01:17;"Leave it all on me baby"
01:17;01:20;"Time Crisis, back once again."
01:20;01:23;"People are going wild for these fresh eps, man."
01:23;01:26;"They were sick of the banked eps, now we're getting some fresh eps."
01:26;01:28;"Seinfeld, how was the reaction to the last episode?"
01:28;01:31;"People are loving it."
01:31;01:33;"People are into it?"
01:33;01:35;"Yeah, people can't get enough of the fresh eps."
01:35;01:37;"You can taste the difference, you know."
01:37;01:42;"There's just a difference between an ep that's just been delivered fresh from the produce section,"
01:42;01:44;"versus been sitting on a shelf."
01:44;01:45;"It's fresher."
01:45;01:46;"Yeah, it's not a canned ep."
01:46;01:48;"It's definitely a fresher ep."
01:48;01:50;"Well Jake, how have you been the last two weeks?"
01:50;01:51;"Pretty solid."
01:51;01:55;"I like you got the Showtime Documentary Films Patagonia back on."
01:55;01:58;"This is a truly random item of clothing."
01:58;02:01;"This has come up on the show before."
02:01;02:03;"It lives in my car or in my studio."
02:03;02:05;"So you're not wearing it very often?"
02:05;02:06;"No."
02:06;02:11;"Just to paint a picture for everybody, this is a Patagonia half zip."
02:11;02:14;"It's not a heavy pile, it's a light pile."
02:14;02:20;"And on the right upper sleeve, it says Showtime Documentary Films."
02:20;02:28;"What happened was I somehow ended up in a situation where I was taking an Uber here"
02:28;02:30;"because my car broke down yesterday."
02:30;02:32;"Oh, your car broke down?"
02:32;02:34;"And I normally keep clothes in my car."
02:34;02:39;"Because I'm anticipating that the AC is going to be jacked in the Apple Music Studios,"
02:39;02:40;"and I'm not wrong."
02:40;02:41;"It's pretty jacked."
02:41;02:43;"It's frigid in here."
02:43;02:45;"And in the Uber ride over here, it was frigid."
02:45;02:47;"The guy had the temp at 60."
02:47;02:48;"[laughs]"
02:48;02:49;"God."
02:49;02:51;"It's not even that warm outside."
02:51;02:53;"No, it's like upper 70s."
02:53;02:54;"It's an LA evening."
02:54;02:55;"Yeah."
02:55;02:56;"Mid-70s."
02:56;03:00;"So I was like, ""Uh-oh, I don't have my normal wardrobe in my car."""
03:00;03:06;"I usually have a couple shirts and stuff just kind of hanging out in the passenger seat of the car."
03:06;03:07;"No car."
03:07;03:11;"This is this filthy, beat-up polar fleece."
03:11;03:13;"Basically on the floor of my studio."
03:13;03:14;"Grabbed it."
03:14;03:16;"Yeah, it's got some dog hair on it."
03:16;03:17;"Yeah, dog hair, paint."
03:17;03:18;"It smells."
03:18;03:19;"[laughs]"
03:19;03:21;"Like, really terrible."
03:21;03:22;"I look like a dirtbag right now."
03:22;03:23;"It's not your go-to."
03:23;03:24;"No."
03:24;03:26;"You don't look like that much of a dirtbag."
03:26;03:27;"That's cool."
03:27;03:31;"Real quick, lint roller on that, and actually you'd look kind of bourgeois."
03:31;03:33;"I'd look like a member of Empire Weekend."
03:33;03:35;"[laughs]"
03:35;03:36;"I mean, I have--"
03:36;03:38;"You know, like a thin polar fleece and some shorts."
03:38;03:41;"I've been pretty into this one half zip lately."
03:41;03:42;"Sorry, what's the--"
03:42;03:44;"Oh, okay, half zip is just zips halfway down."
03:44;03:46;"It's more like a third of the way down."
03:46;03:48;"That's a half zip."
03:48;03:50;"I'm not going to split hairs here."
03:50;03:53;"Well, yeah, I guess there's such a thing as a quarter zip,"
03:53;03:57;"but I just feel like it's either you're wearing a full zip or a half zip."
03:57;03:59;"Is there a three-quarter zip?"
03:59;04:00;"That would be so awkward."
04:00;04:03;"Picture if you had it all the way down, three-quarter zip."
04:03;04:05;"Let's get a number crunch on that."
04:05;04:06;"That's a good one."
04:06;04:08;"Maybe with a pocket blocking it."
04:08;04:09;"That's the reason."
04:09;04:11;"Okay, you know what, Jake?"
04:11;04:12;"I stand corrected."
04:12;04:14;"I think you're wearing a quarter zip."
04:14;04:19;"I stand corrected."
04:19;04:23;"But that's one of those little quirky things that makes me me."
04:23;04:27;"You know, as discussed on the program, I call buffalo wings buffalo wangs,"
04:27;04:29;"and I call quarter zips half zips."
04:29;04:34;"Although when you search half zip, you see stuff that's in the ballpark."
04:34;04:36;"Look, here's the thing about zips."
04:36;04:40;"The average consumer, they just want to know, does this go down all the way"
04:40;04:43;"or does this stop somewhere around my nipples?"
04:43;04:47;"You know, nobody's going to send a half zip home saying this is more like a third zip."
04:47;04:49;"Yeah, this is exactly the same level as my nips."
04:49;04:52;"The bottom of it is exactly the same level as your nips?"
04:52;04:53;"Yeah, so there's no such thing."
04:53;04:54;"It should just be called a nip zip."
04:54;04:57;"I'm putting a level on it as we speak."
04:57;04:59;"Confirmed."
04:59;05:04;"Three-quarter zip doesn't exist, but I'm seeing people calling a quarter zip a three-quarter zip."
05:04;05:06;"Oh, because three-quarters are not zipped?"
05:06;05:07;"That's right, yeah."
05:07;05:08;"They're going the opposite way."
05:08;05:10;"I've always been fascinated by the half zip."
05:10;05:13;"It kind of struck me as like--I still actually haven't seen the show,"
05:13;05:15;"but you know, a succession kind of look."
05:15;05:18;"Like a certain type of rich dude wears half zips."
05:18;05:20;"Wow, I should get more half zips, maybe."
05:20;05:21;"You should get more half zips."
05:21;05:23;"But actually, I don't like wearing them that much."
05:23;05:26;"You know, there's this one--and also, this is not a fleece."
05:26;05:28;"It's a sweater, which I think is a little bit different,"
05:28;05:32;"but there's this blue half zip that I got on a music video shoot, and I liked it so much"
05:32;05:36;"I've been wearing it on stage a bunch, and I actually got a second one."
05:36;05:38;"Sweater or fleece?"
05:38;05:39;"A sweater."
05:39;05:40;"On stage?"
05:40;05:41;"Yeah."
05:41;05:42;"Full show?"
05:42;05:46;"Yeah, I realized I don't wear a t-shirt under it, and sometimes I'll wear shorts,"
05:46;05:48;"and I'm like, ""You know what? I'm good, man."""
05:48;05:49;"We've played it."
05:49;05:52;"And as discussed, we've played some very cold shows this year."
05:52;05:53;"Chicago, notably."
05:53;05:54;"Frigid."
05:54;05:56;"I could have been wearing two half zips."
05:56;06:01;"But a fleece half zip, it's interesting because outside of on stage,"
06:01;06:03;"I always want to be able to zip something all the way down."
06:03;06:06;"I don't like taking things on and off over my head in public."
06:06;06:10;"Right, you get the t-shirt tangled up in there."
06:10;06:11;"Hair gets all static-y."
06:11;06:13;"People are like, ""Are you taking your shirt off right now? What's going on?"""
06:13;06:16;"And then also, just like, it's dangerous."
06:16;06:19;"One way or another, you're going to be--even just for a millisecond--"
06:19;06:22;"you're going to be momentarily blinded when you take a half zip off."
06:22;06:25;"Even if you do it in kind of like--you know, not like a little kid,"
06:25;06:28;"like full inside-out, over-the-head way."
06:28;06:30;"You do it in a more grown-up, like gradual, like--"
06:30;06:31;"Yeah."
06:31;06:33;"It's an awkward thing, and I don't like it."
06:33;06:35;"I like to zip all the way down."
06:35;06:36;"And I feel like you feel the same way."
06:36;06:38;"That's why this is not your go-to."
06:38;06:41;"I'm not in love with this shirt. It was a desperate move."
06:41;06:42;"But it does look good. It's a good color."
06:42;06:45;"But I'm glad I brought it because it's frigid in here."
06:45;06:46;"Yeah."
06:46;06:47;"Why do people keep everything so cold?"
06:47;06:48;"I don't know."
06:48;06:50;"It's so hard to find, like, a middle ground."
06:50;06:52;"I keep the house at 77."
06:52;06:55;"That's very warm, especially in L.A."
06:55;06:57;"Yeah, but it feels cool if it's 90 degrees out."
06:57;06:59;"You go inside, it's 77. It feels great."
06:59;07:02;"And then, you know, naturally, it'll drop to about 72, 73"
07:02;07:04;"over the course of the night."
07:04;07:05;"Right."
07:05;07:06;"Ceiling fan?"
07:06;07:07;"Oh, yeah, yeah."
07:07;07:09;"Go to sleep, and it's like 75 in the house with a ceiling fan."
07:09;07:10;"You're golden."
08:21;08:24;"All right, well, what do we want to talk about today?"
08:24;08:25;"Great question."
08:25;08:26;"Epstein?"
08:26;08:28;"I just did a, uh..."
08:28;08:31;"I just did a Q&A for the Time Crisis Wiki."
08:31;08:32;"Oh, really? What?"
08:32;08:33;"Yeah."
08:33;08:34;"The website?"
08:34;08:35;"That's what it is, a website, right?"
08:35;08:37;"What's it called, TCU?"
08:37;08:39;"Universe Wiki."
08:39;08:42;"Is it the Wikipedia page, or is it the..."
08:42;08:43;"No, no, no."
08:43;08:44;"It is, like, another thing."
08:44;08:46;"I thought somebody made a wiki for Time Crisis."
08:46;08:47;"Yeah, it's..."
08:47;08:50;"Like, or not a wiki, a Wikipedia page, but a Time Crisis wiki."
08:50;08:51;"It's the Time Crisis Universe."
08:51;08:55;"What's the difference between the Time Crisis wiki and the Wikipedia page?"
08:55;08:59;"A wiki is like a format for a kind of website."
08:59;09:03;"So, you know, you could do for something, you know, a Star Wars wiki"
09:03;09:07;"that's like the whole thing is about Star Wars."
09:07;09:08;"Yeah?"
09:08;09:10;"Has nothing to do with Wikipedia."
09:10;09:12;"It's almost like you build your own Wikipedia about whatever you want."
09:12;09:13;"Gotcha."
09:13;09:15;"So is that what it is?"
09:15;09:16;"Yeah, yeah."
09:16;09:17;"No, you nailed it."
09:17;09:21;"It's the Time Crisis Universe Wiki through Fandom.com."
09:21;09:22;"Yeah, I did a Q&A."
09:22;09:25;"Somebody who runs it hit me up on Instagram,"
09:25;09:28;"and I thought, you know, they're providing real service for the fan community."
09:28;09:29;"Must take a lot of work, right?"
09:29;09:31;"Was this over, like, DM, email?"
09:31;09:36;"They DM'd me, and then I had them, you know, email one of my associates to pass on."
09:36;09:38;"What sort of questions did they have?"
09:38;09:40;"One of them was, ""How do you guys prepare?"""
09:40;09:41;"And I kept it real."
09:41;09:43;"We don't really prepare, but the producers prepare."
09:43;09:45;"They give us information."
09:45;09:48;"Print out emails from listeners."
09:48;09:51;"It would be incorrect to say that there's no preparation for this show."
09:51;09:53;"Just Jake and I do very little of it."
09:53;09:58;"And the truth is we have the Time Crisis text thread to talk about topics."
09:58;10:05;"I feel like there's almost daily additions to the Time Crisis either email thread or text thread,"
10:05;10:09;"which is you and I, Nick and Seinfeld, and then Matt and Colin."
10:09;10:10;"That's right."
10:10;10:11;"That's like six people."
10:11;10:12;"Deep thread."
10:12;10:16;"And the truth is if we ever, like, you know, if we ever got in trouble with Apple,"
10:16;10:20;"and they're just like, ""Guys, this show's a mess. You're all over the place,"""
10:20;10:25;"we want you coming in with, you know, seven to ten topics every single time,"
10:25;10:27;"and we want you to move quickly through them."
10:27;10:29;"The listeners don't like these tangents."
10:29;10:31;"We're going to produce short little segments."
10:31;10:32;"Professional-like."
10:32;10:33;"Very professional."
10:33;10:38;"Every week there is a plethora of Time Crisis-esque--we can't even keep track."
10:38;10:40;"There's so much Time Crisis stuff in the universe."
10:40;10:41;"Yeah."
10:41;10:43;"Like, stuff sounds like it's made for Time Crisis."
10:43;10:47;"Sometimes it's not particularly Time Crisis, like you brought up Jeffrey Epstein."
10:47;10:50;"We got an email from somebody."
10:50;10:51;"Who was that email from?"
10:51;10:53;"I sent a text to the thread."
10:53;10:56;"There was a Stereogum article about Mark Foster."
10:56;10:57;"Oh, yeah."
10:57;11:03;"From Foster the People going in on some, like, kind of deep-end conspiracy theories."
11:03;11:07;"Body double, Epstein's still alive, he's in Saudi Arabia getting plastic surgery."
11:07;11:08;"A lot of people--"
11:08;11:10;"Like some serious face-off kind of stuff."
11:10;11:11;"And then we got an email--"
11:11;11:13;"From Kyle Santilli."
11:13;11:14;"What did he say?"
11:14;11:21;"Well, he said his two favorite things to listen to is, number one, Come Town, which is a podcast."
11:21;11:25;"And then he also likes Time Crisis, and, you know, my understanding is Come Town."
11:25;11:29;"And I've been aware of some of these guys via Twitter."
11:29;11:31;"Always seem like funny, smart dudes."
11:31;11:33;"And I know people who swear by the show."
11:33;11:35;"I don't listen to that many podcasts, period, though."
11:35;11:37;"One day I'll listen to it from front to back, I'm sure."
11:37;11:40;"I feel like on the road you'd have time, right?"
11:40;11:41;"If I was dry--but that's the thing."
11:41;11:44;"I think the best times to listen to podcasts are when you're driving."
11:44;11:45;"Right."
11:45;11:49;"Here and there, if somebody really tells me to listen to something, I might have it on the plane."
11:49;11:53;"But, I don't know, there's something about--I'm used to being entertained all the time."
11:53;12:02;"I'm like, okay, the plane, I'm going to be watching a movie, I'm going to have my iPad loaded up with a very engaging TV series."
12:02;12:04;"And then, so the idea of--"
12:04;12:08;"The idea of, like, a poorly recorded podcast."
12:08;12:10;"Just, like, staring at the seat in front of me."
12:10;12:11;"Eh."
12:11;12:13;"I mean, no, but maybe I could get into it."
12:13;12:15;"Like, I think we've talked about this before, Jake."
12:15;12:18;"You have the ultimate job for a podcast listener."
12:18;12:20;"Oh, yeah, I'm big into pods."
12:20;12:21;"I'm painting all day."
12:21;12:22;"Because you're painting all day."
12:22;12:23;"Yeah."
12:23;12:24;"How often do you listen to music, even?"
12:24;12:25;"It's just a mood thing."
12:25;12:26;"Yeah."
12:26;12:27;"I'll throw in music."
12:27;12:28;"I've been doing a lot of Silver Jews last week."
12:28;12:29;"Right."
12:29;12:34;"I'll do, like, an hour or two of music a day, and maybe three or four hours of pods."
12:34;12:36;"So you're listening to, like--"
12:36;12:37;"I'm all over the place."
12:37;12:39;"I subscribe to, like, dozens and dozens of pods."
12:39;12:42;"15 to 25 hours of pods a week."
12:42;12:43;"Oh, easy."
12:43;12:45;"And what's your absolute fav?"
12:45;12:46;"I don't have one."
12:46;12:47;"All depends on your mood."
12:47;12:48;"I love Chapo."
12:48;12:49;"Mm-hmm."
12:49;12:50;"I love Bill Simmons."
12:50;12:52;"What else do I like?"
12:52;12:53;"Oh, I love Red Scare."
12:53;12:54;"Nick, turn me on to Red Scare."
12:54;12:56;"You listen to Joe Rogan?"
12:56;12:57;"I do listen to Rogan."
12:57;12:58;"I listen to Bernie on Rogan."
12:58;12:59;"Good ep."
12:59;13:00;"I subscribe to Rogan."
13:00;13:01;"I'll check in."
13:01;13:02;"I listen to maybe one out of every--"
13:02;13:03;"Oh, I got to--"
13:03;13:04;"I'd like to hear Bernie on Rogan."
13:04;13:06;"Maybe one out of every five or six episodes."
13:06;13:08;"I mean, you've heard the talking points from Bernie."
13:08;13:09;"Yeah, yeah."
13:09;13:11;"Yeah, maybe it's not that interesting."
13:11;13:12;"Eh, it's kind of--"
13:12;13:13;"Well, anyway--"
13:13;13:14;"It's an interesting collision of personalities."
13:14;13:15;"The dude who emailed--"
13:15;13:17;"And so from what I understand,"
13:17;13:21;"Comptown, the Epstein story, conspiracy, scandal,"
13:21;13:23;"it's, like, super up their alley."
13:23;13:27;"You know, I'm sure that's, like, Christmas for their listeners."
13:27;13:29;"You know, it's like that's the type of specific,"
13:29;13:32;"you know, weirdo story that they're into."
13:32;13:34;"But this guy's like, ""You guys should talk about it, too."""
13:34;13:37;"It was like, you know, and I kind of appreciated that."
13:37;13:38;"I get that."
13:38;13:40;"You're into two different things, and you're like,"
13:40;13:42;"""Why don't you guys talk about it, too?"""
13:42;13:45;"But, yeah, I mean, what's the time crisis angle here?"
13:45;13:46;"I think you had a good one, Jake."
13:46;13:49;"It's that you said Mark Foster from Foster the People,"
13:49;13:50;"who I like."
13:50;13:51;"You know, I know him personally."
13:51;13:53;"Was he at the Bernie thing in Iowa?"
13:53;13:54;"Yes."
13:54;13:55;"Okay, he was."
13:55;13:57;"I'd met him here and there over the years,"
13:57;13:59;"but I think the Bernie thing was the first time"
13:59;14:00;"I, like, really talked to him."
14:00;14:01;"We all went out to a bar afterwards,"
14:01;14:03;"and I was like, ""Hell yeah."""
14:03;14:05;"We did--just for listeners who don't know--"
14:05;14:11;"we did an episode in January of '16 from Iowa"
14:11;14:12;"when Bernie was there speaking."
14:12;14:13;"Yeah."
14:13;14:15;"And then we played music and--"
14:15;14:17;"Yeah, and Mark performed, too."
14:17;14:20;"And I think he was just out there also just doing some campaigning,"
14:20;14:22;"knocking on doors and stuff."
14:22;14:26;"But I guess he or somebody in the Foster the People organization"
14:26;14:29;"has been chiming in on the Epstein saga"
14:29;14:33;"and specifically thinks that he is still alive,"
14:33;14:35;"the corpse is a body double,"
14:35;14:39;"and is getting plastic surgery in Saudi Arabia specifically."
14:39;14:40;"Yes, that's what I saw."
14:40;14:45;"The best part of the thread, though, was ""Do your own research,"""
14:45;14:47;"which I love when people tell me to do my own research"
14:47;14:52;"on massive global news events that I'm nowhere near."
14:52;14:54;"Do you mean, like, look at Twitter?"
14:54;14:55;"Right."
14:55;14:56;"It's not like you're watching a cooking show,"
14:56;14:58;"and they're just like, ""This is how much sugar I put in,"""
14:58;14:59;"but you know what?"
14:59;15:00;"You figure it out."
15:00;15:02;"You do it to taste."
15:02;15:05;"You're not going to nail this recipe the first time,"
15:05;15:08;"but just do some research."
15:08;15:11;"I mean, obviously, there's something fishy about this story,"
15:11;15:13;"although it's all like an odds game, right?"
15:13;15:17;"Many, many global events seem fishy,"
15:17;15:22;"and it doesn't mean that the official events are absolutely impossible."
15:22;15:24;"It's a question of how likely are they."
15:24;15:26;"Is it a 4 out of 5 probability they're true,"
15:26;15:27;"or is it more like a 1 out of 10?"
15:27;15:28;"Who knows?"
16:28;16:30;"But yeah, do your own research."
16:30;16:32;"That's a tough one because for most people,"
16:32;16:35;"research involves being extremely online,"
16:35;16:39;"which it's very hard to research the truth on the Internet"
16:39;16:41;"because you'll find so many people saying different things"
16:41;16:42;"that are the truth."
16:42;16:44;"You'll find things that you want to find."
16:44;16:46;"Yeah, so then to do your own research sounds like"
16:46;16:48;"some, like, Alex Jones man on the street,"
16:48;16:50;"just, like, at the prison in Manhattan."
16:50;16:51;"I've seen documents."
16:51;16:54;"Yeah, standing in front of his townhouse on the Upper East Side."
16:54;16:57;"""Let me in. I'm a citizen journalist."""
16:57;17:00;"""I have a petition here, e-signed,"
17:00;17:02;"by over 1,000 people on Twitter"
17:02;17:05;"demanding that I come in there."""
17:05;17:06;"""Sir?"""
17:06;17:09;"Yeah, obviously the Epstein death seems fishy as hell."
17:09;17:10;"Yeah."
17:10;17:12;"In case people are confused by our tone."
17:12;17:15;"I don't think he's getting facial reconstruction surgery."
17:15;17:17;"Hey, I believe that anything's possible,"
17:17;17:19;"but I just do want to say something."
17:19;17:22;"And like I said, I like Mark and I respect him,"
17:22;17:25;"but just in terms of his advice,"
17:25;17:27;"and he's totally in his right to give his advice,"
17:27;17:29;"but I want to say to all the Foster the People fans"
17:29;17:31;"and the Imagine Dragons fans,"
17:31;17:33;"because, you know, they squash their beef."
17:33;17:34;"Full circle."
17:34;17:36;"So because Mark is one of the only people"
17:36;17:38;"who had the balls to apologize to Dan from Imagine Dragons,"
17:38;17:40;"I think there's probably a lot of Imagine Dragons fans"
17:40;17:42;"who said, ""You know what?"
17:42;17:44;"We're still waiting on the guy from 1975,"
17:44;17:47;"but we're going to follow Mark Foster because he's a good dude."""
17:47;17:48;"I like the cut of his jib."
17:49;17:50;"And you know what?"
17:50;17:52;"Sometimes you can trust somebody even more"
17:52;17:54;"when they admit they're wrong."
17:54;17:55;"Is virtue untested?"
17:55;17:57;"Is it really virtue at all, man?"
17:57;17:58;"But Mark's virtue was tested."
17:58;18:00;"Somebody said, ""You know what? You hurt my feelings."""
18:00;18:02;"And Mark said, ""You know what? You're right."""
18:02;18:04;"And he checked himself and he apologized."
18:04;18:07;"So anyway, I'm more concerned about the Imagine Dragons fans"
18:07;18:09;"who now probably follow him."
18:09;18:12;"Don't fly to Saudi Arabia to try to figure this out."
18:12;18:14;"A, you probably-- Do you speak Arabic?"
18:14;18:15;"I don't know."
18:15;18:17;"How are you going to get around?"
18:17;18:19;"B, I don't know if it's a smart idea"
18:19;18:21;"for a citizen to go to another country"
18:21;18:23;"and start poking their nose around."
18:23;18:25;"I mean, if this really goes all the way to the top,"
18:25;18:27;"I just don't think you should do it."
18:27;18:29;"Not going to like what you find."
18:29;18:32;"That would be like-- God."
18:32;18:34;"That would be, like, so brutal."
18:34;18:38;"Just like when the number one Foster the People fan in Brazil"
18:38;18:41;"who runs, like, the Foster the People Brazil account"
18:41;18:43;"just, like, flies to Saudi Arabia,"
18:43;18:46;"tries to break in somewhere, immediately imprisoned,"
18:46;18:48;"got international situation on our hands."
18:48;18:49;"And I know, Mark's a good guy."
18:49;18:51;"He would feel terrible just like he felt bad"
18:51;18:53;"when he imagined dragon's beef."
18:53;18:55;"But I'm just saying, do your own research has limits."
18:55;18:57;"And in some ways, it's impossible."
18:57;18:59;"The thing that I think is interesting about this--"
18:59;19:00;"This is the tweet."
19:00;19:03;"What he's saying that's really applicable to you"
19:03;19:05;"is that more than ever, artists need to speak up"
19:05;19:07;"because they're not getting paid by sponsors"
19:07;19:10;"or told how to spin a story by their bosses."
19:10;19:12;"Rupert Murdoch isn't controlling their narrative."
19:12;19:15;"Support your artists. Support real journalism."
19:15;19:17;"Fact-check everything. Do your own research."
19:17;19:19;"Really, what he's saying is the musicians, the artists--"
19:19;19:21;"He's actually calling us-- --should be the citizen journalists."
19:21;19:22;"I love the jump from--"
19:22;19:26;"Wait, what was it? Support artists do real journalism?"
19:26;19:28;"Yeah. Two different professions."
19:28;19:29;"No, but I know what he means."
19:29;19:31;"Man, I wish we'd thought about this before."
19:31;19:32;"This is my bad."
19:32;19:34;"I would actually love to get Mark on the phone."
19:34;19:37;"Well, this is classic not prepping for the show."
19:37;19:38;"This is what happens when we don't prep."
19:38;19:39;"We don't prep."
19:39;19:40;"All right, I'll see if we can get him on the phone."
19:40;19:41;"Well, let's get Mark on the next one."
19:41;19:42;"Let's try to get him on for the next one."
19:42;19:44;"Let's have the show rolls."
19:44;19:46;"Yeah, 'cause I'd love to hear more of what he has to say"
19:46;19:48;"'cause it's true up to a point."
19:48;19:50;"I mean, most artists, Mark, myself included,"
19:50;19:53;"we've made money in some sense from sponsorship"
19:53;19:55;"of some type of major corporation."
19:55;19:58;"The whole music world is sponsored."
19:58;19:59;"And even if you're not sponsored,"
19:59;20:02;"you're written about on websites that are sponsored."
20:02;20:04;"The only people who are fully outside that ecosystem"
20:04;20:08;"are some true DIY types."
20:08;20:09;"But I know what he means."
20:09;20:11;"He's saying, like, speak up."
20:11;20:14;"Yeah, the tough part of living in these troubled times"
20:14;20:17;"is that that's what everybody's saying, you know?"
20:17;20:18;"Speak up?"
20:18;20:21;"He's 100% correct, but this idea that you're saying,"
20:21;20:24;"""Listen, you can't trust most of what's going on."
20:24;20:25;"""And me, I'm a straight shooter,"
20:25;20:28;"""and here's why those other people are compromised"
20:28;20:30;"""or they're cowardly."""
20:30;20:31;"You know, that's why you gotta trust me."
20:31;20:34;"It's the same thing that Trump says, Alex Jones says,"
20:34;20:37;"Glenn Greenwald, somebody who I actually agree with"
20:37;20:38;"most of the time."
