Start Timestamp;End Timestamp;Transcript
01:01:00;01:01:02;"There must be rules that drives through for cars only."
01:01:02;01:01:03;"But that's (beep) up."
01:01:03;01:01:06;"What if you don't have a car, but you really need a coffee?"
01:01:06;01:01:07;"- I don't think there's an answer to that."
01:01:07;01:01:10;"I guess new times, new reality."
01:01:10;01:01:13;"But anyway, I sped through El Paso for that reason."
01:01:13;01:01:16;"I was hoping to make it all the way to Santa Fe"
01:01:16;01:01:19;"so I could still see that store from the inside."
01:01:19;01:01:21;"That one was a close, it was just too far."
01:01:21;01:01:24;"I made it to Las Cruces-- - That's really far."
01:01:24;01:01:26;"- Yeah, I thought it was closer."
01:01:26;01:01:28;"Once I plotted it out, it was really far."
01:01:28;01:01:30;"So that picture that I posted in Las Cruces"
01:01:30;01:01:33;"was the last one that I was able to take"
01:01:33;01:01:35;"from inside Starbucks."
01:01:35;01:01:38;"Honestly, like I told the baristas, I said,"
01:01:38;01:01:39;"""It feels kind of sad."
01:01:39;01:01:40;"""It's gonna be my last time inside a Starbucks"
01:01:40;01:01:42;"""for the foreseeable future."""
01:01:42;01:01:45;"The only other picture of a mural"
01:01:45;01:01:47;"that I was able to post during that trip"
01:01:47;01:01:50;"was in Asylum Springs, Arkansas."
01:01:50;01:01:53;"I just happened and put it through the drive-thru window."
01:01:53;01:01:55;"They're like, ""Oh man, that is a cool mural."
01:01:55;01:01:57;"""I really wanna get a picture of it."""
01:01:57;01:02:01;"And then I thought, well, it's pretty well lit"
01:02:01;01:02:02;"on the inside."
01:02:02;01:02:05;"What happens if I just go up to the door"
01:02:05;01:02:07;"and shoot through the window?"
01:02:07;01:02:09;"The picture came out pretty nice,"
01:02:09;01:02:14;"but I do have to wonder what the baristas were thinking."
01:02:14;01:02:18;"- I've had the cops call on me quite a few times"
01:02:18;01:02:21;"when I've been shooting the architecture"
01:02:21;01:02:24;"of fast food restaurants and corporate retail."
01:02:24;01:02:26;"The one where I was really asking for it,"
01:02:26;01:02:29;"it was probably a year or two after 9/11."
01:02:29;01:02:31;"I set up, it was in the middle of the night."
01:02:31;01:02:32;"It was like 11 o'clock or midnight"
01:02:32;01:02:34;"at a Taco Bell in Portland, Oregon."
01:02:34;01:02:38;"And I set up a camera on a tripod,"
01:02:38;01:02:39;"'cause it was dark out,"
01:02:39;01:02:42;"right next to the drive-thru of a Taco Bell."
01:02:42;01:02:44;"So the people working at the drive-thru"
01:02:44;01:02:46;"and the customers going through could,"
01:02:46;01:02:49;"I was like four feet away from them."
01:02:49;01:02:51;"- So you're on the Taco Bell property?"
01:02:51;01:02:53;"- Yes, I'm sort of like, I was setting,"
01:02:53;01:02:54;"I'd set the tripod up,"
01:02:54;01:02:56;"sort of like the legs of the tripod were sort of"
01:02:56;01:02:58;"in and among like the landscaping"
01:02:58;01:03:00;"adjacent to the drive-thru."
01:03:00;01:03:02;"I waved at everyone to kind of indicate"
01:03:02;01:03:04;"that I was like not like a psycho"
01:03:04;01:03:07;"and I was like a perfectly like friendly person,"
01:03:07;01:03:10;"but people were like really weirded out,"
01:03:10;01:03:11;"which I understand."
01:03:11;01:03:14;"And there's a guy with a tripod shooting pictures of you"
01:03:14;01:03:16;"getting your food from a Taco Bell."
01:03:16;01:03:19;"And then the cop showed up and I just was like,"
01:03:19;01:03:21;"hey, I'm an artist, I'm a photographer,"
01:03:21;01:03:22;"I'm just shooting this stuff."
01:03:22;01:03:24;"- Did you have to like pull up your website?"
01:03:24;01:03:25;"- I don't think I did that,"
01:03:25;01:03:28;"but I did like get into a bit of an art history talk."
01:03:28;01:03:30;"I was like, you know that famous painting by Edward Hopper,"
01:03:30;01:03:33;"the Nighthawks of the guys in the diner,"
01:03:33;01:03:35;"like sitting alone in the diner eating?"
01:03:35;01:03:36;"- Oh yeah, there was a viral tweet"
01:03:36;01:03:38;"of that picture being emptied."
01:03:38;01:03:39;"- That's true, that's true."
01:03:39;01:03:40;"- Yeah, right, recently."
01:03:40;01:03:42;"So the cops knew it?"
01:03:42;01:03:43;"- Yeah, they were sort of like, oh, okay, yeah,"
01:03:43;01:03:44;"I get it, I get it."
01:03:44;01:03:46;"It's like, this is like an update on that."
01:03:46;01:03:47;"It's just like a Taco Bell."
01:03:47;01:03:50;"And then they're like, okay, I kind of get that."
01:03:50;01:03:51;"You still have to pack it up and leave."
01:03:51;01:03:54;"Taco Bell is, this is private property."
01:03:54;01:03:54;"- Yeah."
01:03:54;01:03:56;"- Have you had the cops called a lot on you, Winter?"
01:03:56;01:03:58;"- Oh, Jesus Christ."
01:03:58;01:04:01;"If I ever write a book,"
01:04:01;01:04:04;"an entire chapter is gonna be my experiences"
01:04:04;01:04:07;"with police and or security."
01:04:07;01:04:08;"I mean, just like- - I can only imagine."
01:04:08;01:04:11;"- I mean, we could do an entire show,"
01:04:11;01:04:15;"which is just Winter getting hassled by security."
01:04:15;01:04:17;"- Yeah, we gotta have you,"
01:04:17;01:04:18;"especially during these quarantine times."
01:04:18;01:04:21;"We have a lot of shows we're doing weekly."
01:04:21;01:04:24;"We can really get into some deeper Winter stories."
01:04:24;01:04:27;"I mean, but just real quick, I gotta ask,"
01:04:27;01:04:31;"there's something about a tripod that is kind of scary."
01:04:31;01:04:32;"- Yeah."
01:04:32;01:04:34;"- And you probably had like this big camera."
01:04:34;01:04:37;"- I had like a big, weird, old film camera."
01:04:37;01:04:39;"- 'Cause a tripod, it's like, you know,"
01:04:39;01:04:42;"there's like those little tripods that snipers use."
01:04:42;01:04:42;"- Okay."
01:04:42;01:04:44;"- It's, I'm just saying."
01:04:44;01:04:46;"- Yeah, it's a knockout."
01:04:46;01:04:48;"No, it's dark out."
01:04:48;01:04:50;"- It's not a million miles away"
01:04:50;01:04:53;"from some sort of like military equipment"
01:04:53;01:04:54;"or, you know, just something like freaky."
01:04:54;01:04:57;"But Winter, I mean, I understand that"
01:04:57;01:04:59;"you're in a lot of different situations"
01:04:59;01:05:00;"'cause you're constantly traveling,"
01:05:00;01:05:04;"but you're not, all you're rolling with"
01:05:04;01:05:06;"is just in your cup and your phone, really."
01:05:06;01:05:07;"There's nothing,"
01:05:07;01:05:10;"you're not carrying a lot of gear with you."
01:05:10;01:05:14;"- No, but I do shoot in the US and Canada."
01:05:14;01:05:16;"I shoot with a DSLR."
01:05:16;01:05:19;"I don't set up a tripod anymore, but you know,"
01:05:19;01:05:20;"- Oh, you used to though."
01:05:20;01:05:23;"- I used to, that drew a lot of attention."
01:05:23;01:05:26;"I finally decided that I just didn't need to do that."
01:05:26;01:05:27;"I used to do it to try and get"
01:05:27;01:05:29;"really nice photographs at night."
01:05:29;01:05:33;"Now what I do is I'll take the photograph at night,"
01:05:33;01:05:35;"hold the camera in my hand, it may be a little blurry,"
01:05:35;01:05:38;"but I'll make a notation on my map to come back later"
01:05:38;01:05:40;"and take another picture in the daylight."
01:05:40;01:05:41;"- You know, it's so funny."
01:05:41;01:05:43;"This is how I found your work all those years ago, Winter,"
01:05:43;01:05:47;"because you had that website, starbuckseverywhere.net,"
01:05:47;01:05:49;"and you had thousands of photographs of Starbucks."
01:05:49;01:05:52;"And I was really deep into that world as well"
01:05:52;01:05:54;"from my own art practice."
01:05:54;01:05:56;"And anyway, it's just funny, like 15 years later,"
01:05:56;01:05:58;"we're talking about this."
01:05:58;01:06:00;"- Yeah, so that, - Crazy."
01:06:00;01:06:01;"- We were in, where were we?"
01:06:01;01:06:04;"We were in Asylum Springs, Arkansas."
01:06:04;01:06:07;"That was the, I think the only,"
01:06:07;01:06:10;"one of two stores that I saw that day"
01:06:10;01:06:11;"because everything was shutting down."
01:06:11;01:06:14;"I also got to see the new roastery"
01:06:14;01:06:18;"for Onyx Coffee in Rogers, Arkansas."
01:06:18;01:06:21;"Actually, one of the, either TC fans"
01:06:21;01:06:23;"or one of the people who saw the Vice video"
01:06:23;01:06:24;"sent me an email saying,"
01:06:24;01:06:27;"""Hey, I noticed that you've been to our old location."
01:06:27;01:06:30;"""You gotta come and see this roastery."""
01:06:30;01:06:32;"But that was towards the tail end of the shutdown."
01:06:32;01:06:36;"By that point, most of the places where I'm at"
01:06:36;01:06:39;"are shut down, even to the extent that Discount Tire,"
01:06:39;01:06:41;"I had to get my tire repaired"
01:06:41;01:06:43;"'cause I had a split in the slide wall."
01:06:43;01:06:46;"They were only doing critical repairs."
01:06:46;01:06:48;"They wanted you to wait out in your car."
01:06:48;01:06:51;"They wanted to minimize people in the lobby once you paid."
01:06:51;01:06:53;"Like, they didn't want you to wait inside the lobby."
01:06:53;01:06:55;"They were slower than usual"
01:06:55;01:06:57;"because instead of the normal,"
01:06:57;01:06:59;"they pull your car into the bay,"
01:06:59;01:07:00;"they didn't wanna get into people's cars."
01:07:00;01:07:03;"So they were having people pull their own cars into the bay."
01:07:03;01:07:05;"- Wow, this is in Rogers, Arkansas?"
01:07:05;01:07:07;"- No, that was Clovis, New Mexico."
01:07:07;01:07:11;"That was the store that I saw after Las Cruces."
01:07:11;01:07:12;"So again, I took a route"
01:07:12;01:07:15;"that took me through a remote store"
01:07:15;01:07:19;"just to maximize driving, minimize social interaction."
01:07:19;01:07:22;"- Wait, wait, so you drove from Orlando to New Mexico"
01:07:22;01:07:25;"and then from New Mexico back to Rochester, New York?"
01:07:25;01:07:30;"- Yeah, I did Las Cruces to Rochester in roughly two days."
01:07:31;01:07:33;"- Ouch. - Oh my God."
01:07:33;01:07:35;"All right, so just bring us to the end."
01:07:35;01:07:37;"Explain those two days from New Mexico"
01:07:37;01:07:38;"to Rochester, New York."
01:07:38;01:07:40;"What's that, like 2,000 miles?"
01:07:40;01:07:42;"- Yeah, yeah, it's about 2,000 miles."
01:07:42;01:07:44;"Just, you know, pretty much all driving"
01:07:44;01:07:47;"except for that stop in Asylum Springs"
01:07:47;01:07:49;"and the stop in Terre Haute, Indiana."
01:07:49;01:07:52;"I had to skip Festus, Missouri"
01:07:52;01:07:55;"because, oh, here's something else on the Starbucks front."
01:07:55;01:07:59;"Even though they were having their drive-thru stores open,"
01:07:59;01:08:01;"they could not maintain all of them open"
01:08:01;01:08:04;"because this is a really great thing that Starbucks did."
01:08:04;01:08:08;"They committed to paying their partners for first two weeks"
01:08:08;01:08:10;"and then they extended that to 30 days"
01:08:10;01:08:13;"even if they weren't willing to come in for safety."
01:08:13;01:08:18;"So because of that, a city like Springfield, Missouri,"
01:08:18;01:08:20;"where I stopped to reshoot some stores,"
01:08:20;01:08:24;"only had one store open out of like six maybe."
01:08:24;01:08:27;"And then lots of stores in the St. Louis market"
01:08:27;01:08:30;"were shut down, including the one that I needed to see."
01:08:30;01:08:33;"Other stores had reduced hours."
01:08:33;01:08:35;"So I didn't get to see Westfield, Indiana"
01:08:35;01:08:38;"because it shut down early because of the slowdown."
01:08:38;01:08:40;"And so then my next final one"
01:08:40;01:08:42;"was going to be Reynoldsburg, Ohio."
01:08:42;01:08:44;"It was supposed to shut down at 10 p.m."
01:08:44;01:08:45;"and I would have just barely made it"
01:08:45;01:08:48;"like if I floored it all the way out there,"
01:08:48;01:08:49;"but they were gonna shut down early,"
01:08:49;01:08:51;"again, because of a staffing issue."
01:08:51;01:08:53;"So that was pretty much the end of my"
01:08:53;01:08:56;"""Things Fall Apart"" Starbucks tour."
01:08:56;01:08:57;"- Crazy."
01:08:57;01:09:00;"So my last question is just when you're beelining it"
01:09:00;01:09:02;"and you're doing an epic drive like that for two days,"
01:09:02;01:09:04;"how much are you sleeping at night?"
01:09:04;01:09:08;"- Depends on whether it's an extended trip"
01:09:08;01:09:11;"or whether I know I'm gonna get a chance to catch up."
01:09:11;01:09:14;"This time around, I knew that once I got to my job"
01:09:14;01:09:17;"in Rochester and rolled in like Monday around lunchtime,"
01:09:17;01:09:20;"I could just check in, put in a few hours of work"
01:09:20;01:09:22;"before I got tired and then catch up on sleep."
01:09:22;01:09:27;"But if I'm like beelining because I'm going to see a concert"
01:09:27;01:09:30;"or because I'm going to a Scrabble competition"
01:09:30;01:09:33;"and then beyond that, I'm gonna keep traveling,"
01:09:33;01:09:36;"I try not to push myself on the sleep too much"
01:09:36;01:09:39;"because it does screw up with your immune system."
01:09:39;01:09:41;"And right now- - Oh, definitely important."
01:09:41;01:09:45;"- With the assumption that possibly two thirds"
01:09:45;01:09:48;"of the American population are going to get this virus,"
01:09:48;01:09:51;"I want to have a strong immune system"
01:09:51;01:09:53;"so I can fight it off if I'm gonna get it anyway."
01:09:53;01:09:55;"I'm in New York, you know that New York"
01:09:55;01:09:59;"is now the epicenter of COVID in the US."
01:09:59;01:10:02;"As of yesterday, 6% of all global cases."
01:10:02;01:10:05;"I happen to have lucked out that I'm in Monroe County,"
01:10:05;01:10:08;"which is Rochester, which had the, of the big areas,"
01:10:08;01:10:10;"it had the lowest number."
01:10:10;01:10:13;"But you never know, I just don't want to exhaust myself."
01:10:13;01:10:15;"I want to stay healthy, stay stress-free"
01:10:15;01:10:17;"and just fight off that virus when I get it."
01:10:17;01:10:19;"- Hell yeah. - Jake and I,"
01:10:19;01:10:21;"and most of the people that we're in direct contact with"
01:10:21;01:10:23;"have basically been staying put,"
01:10:23;01:10:25;"quarantined the past couple of weeks."
01:10:25;01:10:27;"So I can't even imagine being in the situation"
01:10:27;01:10:29;"where you had to be on the road"
01:10:29;01:10:31;"and like you're kind of seeing these things in real time."
01:10:31;01:10:32;"- Yeah. - It must've been"
01:10:32;01:10:35;"a very strange time to be out there on the road."
01:10:35;01:10:36;"- It was rather surreal."
01:10:36;01:10:39;"I'm kind of glad that I got to see it from the ground"
01:10:39;01:10:41;"rather than seeing all these reports."
01:10:41;01:10:44;"And I'm kind of glad that I got to talk to the owners"
01:10:44;01:10:45;"of some of these independent cafes,"
01:10:45;01:10:47;"because, you know, I'll say it again,"
01:10:47;01:10:50;"my heart is really with America's small businesses."
01:10:50;01:10:53;"I don't want to live in a country"
01:10:53;01:10:55;"that's all Starbucks and McDonald's and Best Buy"
01:10:55;01:10:59;"and Walmart when we get to the other side of this."
01:10:59;01:11:02;"- Yep, true words. - Absolutely."
01:11:02;01:11:04;"Well, glad you made it."
01:11:04;01:11:05;"Yeah, you keep staying safe"
01:11:05;01:11:07;"and we'll check in with you real soon"
01:11:07;01:11:09;"'cause we've got plenty more to talk about."
01:11:09;01:11:11;"- All right, folks. - All right, good seeing you."
01:11:11;01:11:12;"- Have a good talk and you again."
01:11:12;01:11:13;"- Good to see you. - Anytime."
01:11:13;01:11:14;"- Thank you, thanks for taking the time."
01:11:14;01:11:15;"- Bye-bye."
01:11:15;01:11:20;"♪ We've been through some things together ♪"
01:11:20;01:11:26;"♪ With trunks of memories still to come ♪"
01:11:26;01:11:33;"♪ We found things to do in stormy weather ♪"
01:11:33;01:11:39;"♪ Long may you run ♪"
01:11:39;01:11:44;"♪ Long may you run ♪"
01:11:44;01:11:47;"♪ Long may you run ♪"
01:11:47;01:11:52;"♪ Although these changes have come ♪"
01:11:52;01:11:59;"♪ With your chrome hearts shining in the sun ♪"
01:11:59;01:12:04;"♪ Long may you run ♪"
01:12:04;01:12:08;"- Time Crisis with Ezra Koenig."
01:12:08;01:12:10;"- This show rules."
01:12:10;01:12:12;"- So Jake, on our previous episode,"
01:12:12;01:12:16;"we talked about you putting together a new playlist"
01:12:16;01:12:19;"for all the TC heads who are quarantined."
01:12:19;01:12:20;"- Yeah."
01:12:20;01:12:21;"- Or if they're not quarantined,"
01:12:21;01:12:23;"they're out there putting their necks on the line"
01:12:23;01:12:25;"for other people."
01:12:25;01:12:29;"So no matter what, people need some good music"
01:12:29;01:12:31;"and you put together the Old Wisdom playlist."
01:12:31;01:12:33;"I can't remember, what exactly was the prompt?"
01:12:33;01:12:35;"I remember we were talking about that now's a good time"
01:12:35;01:12:38;"to dig into some of that older music"
01:12:38;01:12:40;"and try to draw some of that older wisdom out of it."
01:12:40;01:12:43;"What did you go into making this playlist with?"
01:12:43;01:12:45;"What were your parameters?"
01:12:45;01:12:46;"- Yeah, I mean, I guess it's a little bit"
01:12:46;01:12:48;"of an open-ended prompt."
01:12:48;01:12:51;"I ended up finding music that I thought"
01:12:51;01:12:56;"sort of addressed hardship and difficulty and struggle,"
01:12:56;01:12:59;"but at the end of the day was sort of like redemptive"
01:12:59;01:13:02;"in its own, like the music is not despairing."
01:13:02;01:13:06;"- Did you keep it explicitly 1970s?"
01:13:06;01:13:08;"- No, it's 60s and 70s heavy."
01:13:08;01:13:10;"I mean, it's me, you know."
01:13:10;01:13:12;"- Oh yeah, I just saw there's some Little Wings in there."
01:13:12;01:13:14;"So you made all the way to the 2000s."
01:13:14;01:13:17;"- Yeah, there was like a Silver G song, a Little Wing song,"
01:13:17;01:13:20;"just songs that I just felt like, yeah,"
01:13:20;01:13:23;"like acknowledged some like struggle and hardship,"
01:13:23;01:13:25;"but also kind of saw light at the end of the tunnel."
01:13:25;01:13:27;"It's a loose prompt."
01:13:27;01:13:29;"- Yeah, see, we've got a lot of some good country,"
01:13:29;01:13:33;"some 80s Bonnie Raitt, Ricky Nelson, ""Garden Party."""
01:13:33;01:13:36;"I got really into that song recently, actually."
01:13:36;01:13:37;"- Yeah, that's a great song."
01:13:37;01:13:38;"You know, that's a song he wrote"
01:13:38;01:13:41;"about playing in Madison Square Garden."
01:13:41;01:13:43;"- I know, it's such a witty title."
01:13:43;01:13:44;"- Yeah."
01:13:44;01:13:46;"- I was reading about it, that basically Ricky Nelson,"
01:13:46;01:13:49;"he was really big in like the, he was on TV"
01:13:49;01:13:50;"and he was an early rock and roll guy"
01:13:50;01:13:52;"who was also known as an actor."
01:13:52;01:13:54;"So he was really big in the 50s and like early 60s."
01:13:54;01:13:55;"- Yeah."
01:13:55;01:13:58;"- And I guess by the 70s, he was probably saying,"
01:13:58;01:14:00;"""Well, it's official, buddy."
01:14:00;01:14:01;"""I'm a has-been."""
01:14:01;01:14:03;"- Yeah, exactly."
01:14:03;01:14:03;"- To his personal assistant."
01:14:03;01:14:05;"- Very Rick Dalton-ed out."
01:14:05;01:14:07;"- Yeah, very Rick Dalton-ed out, yeah."
01:14:07;01:14:10;"But so Ricky Nelson, he was a bit of a has-been by the 70s,"
01:14:10;01:14:12;"but you know, you're still like this kind"
01:14:12;01:14:13;"of early rock and roll guy."
01:14:13;01:14:18;"And I guess he went to some kind of like rock and roll"
01:14:18;01:14:22;"revival kind of fun nostalgia event"
01:14:22;01:14:25;"with some really big names at Madison Square Garden."
01:14:25;01:14:28;"Everybody from Bob Dylan, John Lennon were there,"
01:14:28;01:14:30;"some early rock and roll greats."
01:14:30;01:14:33;"And he went on stage and at some point,"
01:14:33;01:14:35;"he got booed by the audience."
01:14:35;01:14:37;"- And do you remember the story, Jake?"
01:14:37;01:14:39;"It's like some people claim that he misunderstood"
01:14:39;01:14:40;"what the booing was for."
01:14:40;01:14:43;"He felt like they were booing him 'cause he was a has-been,"
01:14:43;01:14:44;"they didn't wanna hear him,"
01:14:44;01:14:46;"but really they were booing something else."
01:14:46;01:14:48;"- Yeah, I don't remember that part."
01:14:48;01:14:51;"I remember just having sort of a vague awareness"
01:14:51;01:14:53;"that the show didn't go that well."
01:14:53;01:14:54;"- And he wrote a song about it."
01:14:54;01:14:56;"- And then, yeah, he was sort of skeptical"
01:14:56;01:15:00;"of this whole like retro kind of like revival,"
01:15:00;01:15:03;"like rock and roll revival nostalgia act."
01:15:03;01:15:04;"And he's just sort of like,"
01:15:04;01:15:06;"♪ If memories were all I sang ♪"
01:15:06;01:15:09;"♪ I'd rather drive a truck ♪"
01:15:09;01:15:11;"But like the chorus is sort of like,"
01:15:11;01:15:14;"you can't please everyone, so you gotta please yourself."
01:15:14;01:15:15;"- Yeah. - That's a good advice."
01:15:15;01:15:17;"It's sort of like, you have to follow your own instinct"
01:15:17;01:15:20;"and your own gut and don't be beholden"
01:15:20;01:15:21;"to other people's opinions."
01:15:21;01:15:23;"- It's like saying you gotta roll with the punches."
01:15:23;01:15:26;"Like there's always gonna be somebody"
01:15:26;01:15:27;"that's got an issue with you."
01:15:27;01:15:29;"There's always gonna be something in life that bothers you"
01:15:29;01:15:31;"and you just gotta keep on trucking."
01:15:31;01:15:33;"- And just like Madison Square Garden,"
01:15:33;01:15:34;"calling it Garden Party."
01:15:34;01:15:35;"- Yeah. - Great."
01:15:35;01:15:37;"- I actually thought of you when I,"
01:15:37;01:15:40;"'cause I actually read about that song somewhat recently."
01:15:40;01:15:41;"I mean, I've loved that song for decades,"
01:15:41;01:15:43;"but somehow I ended up on the,"
01:15:43;01:15:46;"well, I was listening to some Ricky Nelson"
01:15:46;01:15:47;"full-length records from the early '70s,"
01:15:47;01:15:49;"which are pretty good."
01:15:49;01:15:51;"And then I ended up on the Garden Party Wikipedia page"
01:15:51;01:15:55;"and I was like, oh, that's so witty."
01:15:55;01:15:56;"And I totally thought of you."
01:15:56;01:15:57;"- Oh, really?"
01:15:57;01:15:58;"- I was like someone that would appreciate"
01:15:58;01:16:00;"that sort of like pun."
01:16:00;01:16:01;"- Oh yeah, no, absolutely."
01:16:01;01:16:02;"Yeah, it's so funny."
01:16:02;01:16:05;"I really got into that song like sometime in the past year."
01:16:05;01:16:09;"Well, maybe if one day people gather in large groups again"
01:16:09;01:16:12;"for live music and Vampire Weekend plays"
01:16:12;01:16:14;"Madison Square Garden again,"
01:16:14;01:16:17;"bring Jake out for a Mountain Brews Garden Party."
01:16:17;01:16:18;"One, two, punch."
01:16:18;01:16:19;"- That'd be sick, man."
01:16:19;01:16:20;"(laughing)"
01:16:20;01:16:21;"That'd be huge."
01:16:21;01:16:22;"- Oh, man."
01:16:22;01:16:25;"♪ I went to a garden party ♪"
01:16:25;01:16:28;"♪ To reminisce with my old friends ♪"
01:16:28;01:16:32;"♪ A chance to share old memories ♪"
01:16:32;01:16:35;"♪ And play our songs again ♪"
01:16:35;01:16:38;"♪ When I got to the garden party ♪"
01:16:38;01:16:42;"♪ They all knew my name ♪"
01:16:42;01:16:45;"♪ No one recognized me ♪"
01:16:45;01:16:48;"♪ I didn't look the same ♪"
01:16:48;01:16:52;"♪ But it's all right now ♪"
01:16:52;01:16:55;"♪ I learned my lesson well ♪"
01:16:55;01:16:58;"♪ You see, you can't please everyone ♪"
01:16:58;01:17:01;"♪ So you got to please yourself ♪"
01:17:01;01:17:05;"- Well, you know, I also went out to the TC crew on Twitter"
01:17:05;01:17:08;"and I included a few suggestions that people had."
01:17:08;01:17:09;"- Oh, cool."
01:17:09;01:17:12;"- And I think Garden Party actually was suggested by someone"
01:17:12;01:17:14;"and when I saw that, I was like, oh yeah, that's perfect."
01:17:14;01:17:16;"- I've got to give a shout out to friend of the show,"
01:17:16;01:17:18;"Kyle Field, Little Wings."
01:17:18;01:17:19;"- Yeah."
01:17:19;01:17:21;"- 'Cause he's got probably one of his most famous songs"
01:17:21;01:17:22;"is on this list."
01:17:22;01:17:23;"- Yeah."
01:17:23;01:17:24;"- And I feel like, you know, last time he was on the show,"
01:17:24;01:17:27;"we talked a bunch about surfing"
01:17:27;01:17:29;"and we were just kind of shooting the (beep)"
01:17:29;01:17:32;"we didn't talk all that much about his music."
01:17:32;01:17:33;"- Yeah."
01:17:33;01:17:34;"- And maybe 'cause we don't want to make him"
01:17:34;01:17:36;"like feel embarrassed, but he, you know,"
01:17:36;01:17:39;"he's kind of a, he's a legend of music"
01:17:39;01:17:41;"and Jake, you've been friends with him"
01:17:41;01:17:43;"and a fan for a long time."
01:17:43;01:17:45;"So maybe you can contextualize"
01:17:45;01:17:48;"and tell us a little bit about one of his signature songs,"
01:17:48;01:17:49;"""Look at What the Light Did Now."""
01:17:49;01:17:53;"- I've been a fan, but also a band member for years."
01:17:53;01:17:53;"- Oh, right. Yeah, yeah."
01:17:53;01:17:56;"- Kyle thinks of the band as sort of,"
01:17:56;01:17:59;"'cause there's a lot of local gigs in SoCal,"
01:17:59;01:18:00;"but he kind of thinks of the band"
01:18:00;01:18:01;"as sort of like a men's softball league."
01:18:01;01:18:04;"It's sort of like, if you can show up and play,"
01:18:04;01:18:06;"I'd love to have you, but if you can't make it, I get it."
01:18:06;01:18:09;"- Practice on Tuesday nights."
01:18:09;01:18:11;"- Little Wings is absolutely no practice ever."
01:18:11;01:18:13;"It's always just like- - No practice ever."
01:18:13;01:18:15;"- Do a little brush up on your own."
