Start Timestamp;End Timestamp;Transcript
41:33;41:35;"So I was hitting Starbucks in Maryland,"
41:35;41:37;"Virginia, North Carolina, South Carolina,"
41:37;41:40;"Georgia, Florida, until I flew out."
41:40;41:41;"- Okay, so you're Starbucksing"
41:41;41:42;"all the way down to Orlando."
41:42;41:44;"You go to Panama."
41:44;41:46;"You have this kind of crazy experience."
41:46;41:47;"Get out of Panama in the nick of time,"
41:47;41:49;"back in Orlando."
41:49;41:50;"Once you're back in Orlando,"
41:50;41:52;"how much did things change?"
41:52;41:53;"- Okay. - 'Cause we've been hearing"
41:53;41:56;"Florida has been relatively lax as a state."
41:56;42:00;"- First of all, my flight was delayed for over an hour"
42:00;42:04;"because they had to pull a kid off the plane"
42:04;42:05;"and his dad, the kid was crying"
42:05;42:08;"because they'd heard him coughing in the bathroom."
42:08;42:10;"So they did a medical check and they pulled him off."
42:10;42:11;"So that was interesting."
42:11;42:15;"I arrived back in Orlando around 5 p.m."
42:15;42:19;"and I immediately bolt to as many Starbucks as I could."
42:19;42:22;"At that time, I can still go in them"
42:22;42:24;"and hang out, charge my batteries,"
42:24;42:26;"charge my computer, charge my phone."
42:26;42:28;"That's critical stuff for me."
42:28;42:30;"Talk to the managers or supervisors."
42:30;42:31;"Everything's fine."
42:31;42:35;"- And in terms of the number of people in these Starbucks,"
42:35;42:37;"it felt like a typical day?"
42:37;42:39;"- Absolutely."
42:39;42:42;"The very last one that I went to in Davenport, Florida"
42:42;42:45;"was completely busy, business as usual."
42:45;42:46;"- What was the date around that?"
42:46;42:50;"- This was Saturday, March the 14th."
42:50;42:52;"- So Saturday, March 14th,"
42:52;42:55;"you have some people beginning quarantine in the US,"
42:55;42:58;"but as far as the Starbucks that you're hitting in Florida,"
42:58;43:00;"you wouldn't have guessed anything was happening."
43:00;43:01;"- Exactly."
43:01;43:02;"Everything was normal."
43:02;43:05;"There was an email from Kevin Johnson several days later"
43:05;43:09;"saying it was a possibility that stores would move"
43:09;43:12;"to grab and go or drive-through only."
43:12;43:13;"But I hadn't heard of that happening."
43:13;43:17;"Kevin Johnson is the CEO who replaced Howard Schultz."
43:17;43:19;"- Oh, okay."
43:19;43:21;"- Well, Sunday morning, I wake up,"
43:21;43:24;"I go to my first Starbucks in, coincidentally enough,"
43:24;43:26;"Winter Haven, Florida."
43:26;43:29;"And I notice that something seems off."
43:29;43:31;"There's no cars in the parking lot."
43:31;43:34;"There's a white piece of paper on the door."
43:34;43:37;"I go up to the door and boom,"
43:37;43:41;"this store is open to serve you for grab and go only."
43:41;43:43;"And they have closed the restrooms."
43:43;43:46;"- Grab and go means you could still enter the store"
43:46;43:48;"as usual, just can't sit."
43:48;43:49;"- That's correct."
43:49;43:52;"As soon as I went to plug in my laptop on my phone,"
43:52;43:54;"the supervisor told me that I couldn't hang out."
43:54;43:56;"I said, ""Okay, yeah, I understand."
43:56;43:57;"I'm just gonna get my coffee."""
43:57;44:00;"Unfortunately, I couldn't use the restroom."
44:00;44:02;"At that point, by the way, I'm thinking,"
44:02;44:05;"""Okay, all thoughts of asking for a sample are gone."
44:05;44:06;"I'm just gonna have to suck it up"
44:06;44:09;"and pay $2.25 for a coffee"
44:09;44:12;"for however many stores I go to in the next week."""
44:12;44:13;"You know, it's not the end of the world."
44:13;44:14;"It's a pandemic."
44:14;44:17;"So I adjust to the new reality."
44:17;44:18;"- But the bathroom thing,"
44:18;44:19;"you tweeted about this a little bit."
44:19;44:21;"Generally, when you Starbucks,"
44:21;44:23;"you're not staying in hotels,"
44:23;44:25;"you'll sleep in the car most nights."
44:25;44:25;"- That is correct."
44:25;44:27;"So one of the first things I do"
44:27;44:29;"to when I get that first Starbucks in the morning,"
44:29;44:32;"typically, is I wanna wash my hands."
44:32;44:33;"I wanna wash my face."
44:33;44:35;"I just wanna wash up."
44:35;44:37;"And during this pandemic,"
44:37;44:40;"when everybody was telling people not to touch their face"
44:40;44:42;"and to wash their hands, I ramped that up."
44:42;44:45;"So I was basically washing my hands"
44:45;44:47;"every time I went into a Starbucks."
44:47;44:50;"Basically, anytime I was anywhere and I touched anything,"
44:50;44:52;"I was just washing my hands."
44:52;44:53;"And all of a sudden I can't do that anymore."
44:53;44:55;"And I'm like, ""Okay, I gotta adjust."""
44:55;44:58;"So my adjustment is stop for gas more often"
44:58;45:02;"and use the bathroom there to wash my hands."
45:02;45:04;"So two stores were like that."
45:04;45:07;"Third store, further north,"
45:07;45:09;"that one was still open for business."
45:09;45:12;"Different district, different region."
45:12;45:15;"So I learned at that one from talking to the manager"
45:15;45:20;"who was wearing an N95 mask because she had cystic fibrosis."
45:20;45:23;"So getting COVID for her is a big deal."
45:23;45:24;"- Oh God, yeah."
45:24;45:25;"- So I really felt bad for her"
45:25;45:27;"and I understood why she was being so cautious,"
45:27;45:29;"but she decided that she was gonna keep the store open"
45:29;45:31;"that day, she was gonna go the next day."
45:31;45:33;"And basically I learned that stores had been given"
45:33;45:38;"until Thursday to make the switch over, to grab and go."
45:38;45:40;"And some decided to go immediately."
45:40;45:41;"Some decided to go a little bit later."
45:41;45:43;"She explained that for some it had to do"
45:43;45:47;"with how many COVID cases were reported in the area"
45:47;45:49;"and the proximity."
45:49;45:52;"So that's what I discovered for the rest,"
45:52;45:53;"for the next few days."
45:53;45:55;"Some were open, some weren't."
45:55;45:59;"In some cities like Gainesville, Florida,"
45:59;46:03;"I actually met up with the brother of Bill Tangeman"
46:03;46:07;"who directed the ""Starbucking"" documentary back in 2007."
46:07;46:08;"So he's been following me,"
46:08;46:11;"but I was able to hang out there and chat with him."
46:11;46:13;"Then I go to another store in Gainesville,"
46:13;46:15;"it's only open for grab and go."
46:15;46:19;"♪ After two days in the desert sun ♪"
46:19;46:23;"♪ My skin began to turn red ♪"
46:23;46:27;"♪ After three days in the desert fun ♪"
46:27;46:31;"♪ I was looking at a river bed ♪"
46:31;46:35;"♪ And the story it told of a river that flowed ♪"
46:35;46:39;"♪ Made me sad to think it was dead ♪"
46:39;46:41;"♪ You see I've been through the desert ♪"
46:41;46:43;"♪ On a horse with no name ♪"
46:43;46:46;"♪ It felt good to be out of the rain ♪"
46:46;46:50;"♪ In the desert you can't remember your name ♪"
46:50;46:52;"♪ 'Cause there ain't no one ♪"
46:52;46:54;"♪ Born to give you no pain ♪"
46:54;46:57;"So that's Florida and Georgia and Alabama."
46:57;47:01;"Wasn't even able to go to one in Alabama"
47:01;47:02;"because it closed early."
47:02;47:04;"Don't know if that was related to COVID"
47:04;47:06;"or if that was just a Sunday closure."
47:08;47:12;"Here's funny thing, Panama City Beach was closed"
47:12;47:14;"before I got there, not because of COVID,"
47:14;47:16;"but because they had a boil water order"
47:16;47:18;"in all of Panama City Beach."
47:18;47:21;"So that was kind of ironic."
47:21;47:24;"- Boil water order means that there's something"
47:24;47:25;"in the water supply,"
47:25;47:27;"meaning that you can't drink tap water?"
47:27;47:28;"- That's correct."
47:28;47:29;"So all of the Starbucks in Panama City Beach"
47:29;47:32;"were shut down for several days."
47:32;47:35;"So I had to skip that one and head straight to New Orleans."
47:35;47:39;"And that was Monday morning, 16th."
47:39;47:41;"And that was an interesting experience"
47:41;47:45;"because the first Starbucks that I went to"
47:45;47:47;"did not have a drive-through."
47:47;47:48;"It was completely open,"
47:48;47:51;"but the managers were talking about"
47:51;47:54;"how they were gonna be switching to a grab-and-go model."
47:54;47:55;"And I was already starting to wonder,"
47:55;47:58;"okay, what's that gonna do to the people"
47:58;47:59;"who just hang out at Starbucks?"
47:59;48:02;"New Orleans has a lot of indigent, of course."
48:02;48:04;"They'll hang out, they'll charge their devices,"
48:04;48:05;"they'll use the wifi."
48:05;48:08;"So that's obviously going to affect them."
48:08;48:10;"The next store that I went to"
48:10;48:13;"had already switched to grab-and-go,"
48:13;48:17;"but the next day it was switching to drive-through only."
48:17;48:20;"So they were getting ahead of the drive-through curve."
48:20;48:23;"The third store I went to was on the other side of the river"
48:23;48:25;"in the Algiers neighborhood."
48:25;48:28;"That manager actually got a little bit snippy with me."
48:28;48:33;"I went in, I plugged in my laptop, my phone on the floor."
48:33;48:34;"I wasn't really working there."
48:34;48:37;"I was just getting my coffee, took a picture, went back in,"
48:37;48:38;"asked her some questions"
48:38;48:41;"about where New Orleans was going with this."
48:41;48:43;"And after some point, I guess I wore up my welcome"
48:43;48:45;"and she said, ""I'm gonna have to ask you to leave."
48:45;48:47;"""Get your stuff and go."""
48:47;48:50;"Okay, well, in the middle of a pandemic,"
48:50;48:53;"people's nerves start to fray, so I totally understood that."
48:53;48:55;"My next stop was more interesting."
48:55;49:00;"That was Congregation Coffee in Algiers Point,"
49:00;49:02;"a independent coffee shop"
49:02;49:04;"that was actually selected by ""Food & Wine"" magazine"
49:04;49:07;"last year as their favorite coffee roaster"
49:07;49:10;"in the state of Louisiana."
49:10;49:14;"There, that gave me an opportunity to talk to the owners"
49:14;49:16;"about what they thought this pandemic"
49:16;49:17;"was gonna do to the business."
49:17;49:20;"And the owner was quite frank in saying"
49:20;49:22;"he didn't think they were gonna make it"
49:22;49:24;"to the other side of this."
49:24;49:26;"And that was something that I'd been reading already"
49:26;49:29;"about how this was going to start hurting small businesses."
49:29;49:32;"And my focus is Starbucks,"
49:32;49:33;"but I'm really trying to promote"
49:33;49:35;"and talk up the small coffee houses."
49:35;49:38;"I have a keen interest in what's gonna happen to them."
49:38;49:40;"And I feel really bad that a lot of them"
49:40;49:42;"are not gonna make it through this pandemic."
49:42;49:44;"So I was glad that I was able to give them"
49:44;49:47;"a little bit of business for a while and talk up his cafe."
49:47;49:49;"I hope he sells a lot of beans"
49:49;49:51;"because that's how they're gonna have to survive"
49:51;49:54;"when they can't actually sell coffee with everything closed."
49:54;49:56;"- You make a good point, Winter,"
49:56;49:58;"is that people talk so much about,"
49:58;50:02;"obviously this is a very difficult time for restaurants"
50:02;50:05;"and especially the people who work at restaurants,"
50:05;50:08;"servers and things like that who are being let go."
50:08;50:09;"They don't need the whole staff."
50:09;50:11;"I guess the only thing you could hope for"
50:11;50:15;"that at a restaurant, there's still people ordering food"
50:15;50:16;"and they can still be preparing stuff,"
50:16;50:19;"but a coffee shop, you know,"
50:19;50:21;"you're not gonna find a ton of people"
50:21;50:23;"putting in big orders for coffee"
50:23;50:26;"to be delivered to their homes or something."
50:26;50:28;"So even more than restaurants, I can imagine"
50:28;50:30;"that these kind of like cool,"
50:30;50:34;"kind vibe little coffee shops, independent ones"
50:34;50:37;"are really gonna be hit because outside of selling beans,"
50:37;50:39;"what can they do?"
50:39;50:41;"So as you're making it through,"
50:41;50:43;"you're noticing the tensions rising"
50:43;50:46;"with some of the managers, you're noticing things changing."
50:46;50:48;"You barely got out of Panama, you made it to Florida,"
50:48;50:49;"you're traveling to the South."
50:49;50:51;"By the time you're in New Orleans,"
50:51;50:54;"there must be a pretty big black cloud"
50:54;50:56;"hanging over your whole trip."
50:56;50:59;"Do you think about just bailing on the Texas car stuff"
50:59;51:01;"and just getting back to Rochester?"
51:01;51:05;"Like, did you kind of feel like the doors were closing?"
51:05;51:06;"You know?"
51:06;51:08;"- Yes, I did feel like the doors were closing."
51:08;51:10;"No, I didn't consider bailing."
51:10;51:11;"It's not an option."
51:11;51:12;"I have to renew my license."
51:12;51:14;"I have to renew my registration"
51:14;51:16;"or I'm gonna get arrested at some point."
51:16;51:18;"I wanna see my dentist under the wire"
51:18;51:19;"and I need to get those glasses too"
51:19;51:21;"because I'm having trouble driving at night."
51:21;51:22;"It's a safety issue."
51:22;51:26;"So I was gonna go to Texas no matter what"
51:26;51:29;"and the process was actually stressful."
51:29;51:31;"Typically, Starbucks is relaxing."
51:31;51:32;"It's like, it's great."
51:32;51:34;"I'm getting away from work, I'm doing my thing,"
51:34;51:36;"I'm talking to the managers,"
51:36;51:39;"taking all these great pictures, posting on Instagram."
51:39;51:42;"This time around, it was just a constant day by day,"
51:42;51:45;"how do I adapt to the new situation?"
51:45;51:47;"How do I keep my phone charged?"
51:47;51:49;"How do I keep my laptops charged?"
51:49;51:50;"How do I keep my camera battery charged?"
51:50;51:52;"Where do I wash my hands?"
51:52;51:53;"All that kind of thing."
51:53;51:55;"And as I kept traveling, where do I eat?"
51:55;51:57;"What restaurants are gonna be closed?"
51:57;52:00;"That was pretty much the rest of the week for me"
52:00;52:04;"as I was documenting the slow rolling shutdown"
52:04;52:09;"of the United States for essentially a seven day period,"
52:09;52:11;"seeing it from the front lines."
52:11;52:15;"It was quite educational, but it was also stressful"
52:15;52:19;"and it was depressing because I was seeing"
52:19;52:21;"that all these people were starting to lose their jobs"
52:21;52:23;"with all these places closed"
52:23;52:25;"and it's just gonna be devastating"
52:25;52:27;"for the people who work in the service economy"
52:27;52:29;"and I really, really feel bad for them."
52:29;52:31;"- Yeah, seriously."
52:31;52:33;"So by the time you got to Texas,"
52:33;52:37;"you were still able to accomplish all of your tasks,"
52:37;52:40;"your dentist and optometrist and all this stuff."
52:40;52:42;"- Yeah, yeah, yeah, I got everything done."
52:42;52:45;"I checked in on my dad just to see if he was okay."
52:45;52:47;"Didn't hug him, didn't shake his hand,"
52:47;52:48;"tried to stay a little bit away,"
52:48;52:52;"but he had his issues a couple of years ago"
52:52;52:54;"and I just needed to make sure that he was okay"
52:54;52:58;"and not just saying he was okay over the phone."
52:58;53:01;"And then I left Texas, went up to Dallas"
53:01;53:05;"and by that point, it was all grab and go."
53:05;53:07;"So I didn't get to see,"
53:07;53:09;"go into any of the Starbucks in the Dallas market"
53:09;53:11;"and at that point, I made a decision"
53:11;53:16;"that in keeping with the whole idea of social distancing,"
53:16;53:18;"I was going to put a heavy emphasis"
53:18;53:21;"on re-photographing old stores,"
53:21;53:23;"stores that I'd been to at night"
53:23;53:26;"or stores for which I'd lost the photograph"
53:26;53:28;"when my computer was stolen, et cetera, et cetera."
53:28;53:30;"That way I'd go to fewer stores"
53:30;53:32;"and I'd go to more remote stores."
53:32;53:34;"So I went ahead and went out of the way"
53:34;53:36;"to College Station, Texas,"
53:36;53:39;"where sadly, one of your TC fans,"
53:39;53:42;"Starbucking fans wanted to meet me,"
53:42;53:44;"but I was supposed to meet people in Dallas"
53:44;53:47;"and College Station in Austin and San Antonio,"
53:47;53:48;"but because of the pandemic,"
53:48;53:51;"that just wasn't gonna happen."
53:51;53:52;"Exactly."
53:52;53:55;"And that was sad because I feel like"
53:55;53:57;"if somebody's going through the trouble"
53:57;53:58;"of sending me an email"
53:58;54:01;"and taking an interest in my Starbucking project,"
54:01;54:03;"I'm happy to have a cup of coffee with them"
54:03;54:05;"and that just wasn't gonna happen,"
54:05;54:08;"but this is the new reality that we live with."
54:08;54:11;"I went down from Dallas market"
54:11;54:15;"all the way out to Weatherford, Mineral Wells,"
54:15;54:19;"down some towns outside of Austin, San Antonio,"
54:19;54:20;"all the way out to Uvalde,"
54:20;54:22;"and then I decided that I was gonna go ahead"
54:22;54:25;"and drive all the way out to El Paso."
54:25;54:27;"And some TC heads probably saw my tweet"
54:27;54:30;"where I said that with all the stress"
54:30;54:32;"of adapting to the nation shutting down,"
54:32;54:36;"the seven hour drive to El Paso"
54:36;54:38;"was actually the most relaxing part of my week"
54:38;54:40;"because I didn't have to worry about,"
54:40;54:43;"I mean, it was about as socially isolated as you can get."
54:43;54:44;"Other than stopping for gas,"
54:44;54:46;"it was just driving, driving, driving."
54:46;54:50;"Well, it's funny because anybody"
54:50;54:53;"who's been a touring musician or a resident of Texas"
54:53;54:56;"has at some point done the kind of epic drive"
54:56;55:00;"from the really dense populated part of Texas."
55:00;55:01;"I don't know if you call it East Texas,"
55:01;55:03;"but you know where all the big cities"
55:03;55:04;"aren't that far away from each other."
55:04;55:07;"They're within two to four hours of each other."
55:07;55:11;"And then you have this huge expanse of West Texas"
55:11;55:12;"until you get to El Paso,"
55:12;55:15;"which sometimes that drive feels like"
55:15;55:17;"you're not seeing a lot of other cars,"
55:17;55:19;"you're not seeing a lot of civilization,"
55:19;55:21;"there's only a handful of places to stop."
55:21;55:24;"And Jake, actually, I may have done that drive"
55:24;55:25;"for the first time with you, Jake,"
55:25;55:27;"when we were touring with Dirty Projectors."
55:27;55:29;"And I'm pretty sure this is a,"
55:29;55:33;"West Texas to me is a very Jake type place."
55:33;55:36;"And I'm pretty sure, Jake, that you told me"
55:36;55:38;"that Cormac McCarthy,"
55:38;55:40;"who wrote the post-apocalyptic novel ""The Road"""
55:40;55:43;"was inspired by driving through West Texas."
55:43;55:44;"- Right."
55:44;55:47;"I remember reading that he had the idea for ""The Road"""
55:47;55:52;"when he was staying at a motel in El Paso"
55:52;55:54;"with his infant son"
55:54;55:57;"and looking out on the lights of El Paso Juarez."
55:57;56:01;"And I think maybe having this very vulnerable baby"
56:01;56:04;"in his care and thinking about,"
56:04;56:08;"yeah, just the barren wilds out there."
56:08;56:11;"- Right, 'cause West Texas is very beautiful,"
56:11;56:14;"but it feels very empty compared to other parts of Texas."
56:14;56:15;"And yeah, I imagine even,"
56:15;56:17;"I'm sure he probably said it more eloquently,"
56:17;56:21;"but I've also had this experience of being in El Paso,"
56:21;56:22;"actually with you, Jake,"
56:22;56:24;"I remember the first time I ever had Migos"
56:24;56:27;"was at an IHOP in El Paso."
56:27;56:29;"- I remember the IHOP in El Paso."
56:29;56:31;"- So we hit an IHOP in El Paso,"
56:31;56:32;"a lot of touring musicians have."
56:32;56:34;"But there's something about being in El Paso"
56:34;56:37;"and then you look and you see Juarez."
56:37;56:40;"And I don't know if there's any other,"
56:40;56:43;"obviously there's a lot of border cities in America."
56:43;56:45;"I don't think there's any cities as big as El Paso"
56:45;56:46;"on the US border"
56:46;56:49;"where you can just see Mexico quite so clearly."
56:49;56:51;"And you see that big mountain that says,"
56:51;56:53;"""La Biblia es la verdad."""
56:53;56:55;"And there is something about being in El Paso"
56:55;56:58;"and you're staring at another country"
56:58;57:00;"that also kind of reminds you too,"
57:00;57:04;"how arbitrary and flimsy this idea of like,"
57:04;57:08;"these like civilizational ideas of like borders are."
57:08;57:11;"So I can imagine maybe that played some factor,"
57:11;57:12;"the West Texas vibe."
57:12;57:13;"And then just kind of,"
57:13;57:15;"you're like looking across this imaginary border"
57:15;57:16;"that means so much to people."
57:16;57:17;"And you're just like,"
57:17;57:19;"a few things change in the world,"
57:19;57:20;"this border is meaningless."
57:20;57:23;"You know, it makes you think about like,"
57:23;57:25;"civilization and all that kind of (beep)"
57:25;57:28;"So anyway, it kind of seems almost mystical to me,"
57:28;57:31;"Winter, that you and Cormac McCarthy,"
57:31;57:32;"he who wrote a post-apocalyptic novel,"
57:32;57:35;"and you who had a somewhat apocalyptic"
57:35;57:36;"starbucking journey,"
57:36;57:38;"both end up in El Paso."
57:38;57:41;"Like it kind of weird synergy to me."
57:41;57:43;"And it all converged in El Paso."
57:43;57:45;"- His was post-apocalyptic,"
57:45;57:47;"mine was pre-apocalyptic."
57:47;57:48;"- Yeah, exactly."
57:48;57:52;"You finally pulled into the West Texas town of El Paso."
57:52;57:54;"What was the vibe there?"
57:54;57:56;"- I saw the four stores there,"
57:56;57:57;"grab and go."
57:57;58:00;"The partners were all kind of laid back."
58:00;58:00;"- Whoa, whoa, whoa."
58:00;58:02;"- Nope, no bad vibes."
58:02;58:04;"- Wait, there's only four Starbucks in El Paso?"
58:04;58:05;"- New ones, four new Starbucks."
58:05;58:07;"- Okay, all right, all right."
58:07;58:09;"- Yeah, I saw them."
58:09;58:11;"- How many total do you know offhand?"
58:11;58:13;"- Oh, geez."
58:13;58:14;"Just trying to make a mental image."
58:14;58:17;"I would say about 10, roughly."
58:17;58:18;"Don't quote me on that."
58:18;58:19;"I have to check my database."
58:19;58:21;"- Yeah, El Paso's 20."
58:21;58:23;"- Yeah, I would have guessed easily 20."
58:23;58:24;"Interesting."
58:24;58:26;"- But I managed to clear them all out so quickly."
58:26;58:29;"And the reason that I went so fast"
58:29;58:32;"was because either in El Paso or maybe Uvalde,"
58:32;58:33;"I think it was Uvalde,"
58:33;58:35;"I was told by one of the partners"
58:35;58:38;"that they were switching to the drive-through model"
58:38;58:40;"starting Saturday nationwide."
58:40;58:41;"- Right."
58:41;58:43;"- So that was my last shot."
58:43;58:44;"- And that's where we're at now"
58:44;58:46;"in terms of nationwide Starbucks"
58:46;58:47;"is for the past five days."
58:47;58:50;"- Saturday the 21st."
58:50;58:51;"- They're all drive-through only."
58:51;58:54;"- Yes, except for that handful for first responders."
58:57;58:58;"♪ I was born free ♪"
58:58;59:02;"♪ 'Cause the desert had turned to sea ♪"
59:02;59:05;"♪ There were plants and birds and rocks and things ♪"
59:05;59:10;"♪ There was sand and hills and rings ♪"
59:10;59:13;"♪ The ocean is a desert with its life underground ♪"
59:13;59:17;"♪ And a perfect disguise above ♪"
59:17;59:21;"♪ Under the city's eyes a heart made of brown ♪"
59:21;59:25;"♪ But the humans will give no love ♪"
59:25;59:27;"♪ See I've been through the desert ♪"
59:27;59:29;"♪ On a horse with no name ♪"
59:29;59:33;"♪ It felt good to be out of the rain ♪"
59:33;59:37;"♪ In the desert you can remember your name ♪"
59:37;59:41;"♪ 'Cause there ain't no one born to give you no pain ♪"
59:41;59:43;"- You raised the question on Twitter,"
59:43;59:48;"are they allowing pedestrians to use the drive-through?"
59:48;59:51;"- Yes, I was hoping that somebody would chime in,"
59:51;59:53;"but nobody's given me an answer yet."
59:53;59:54;"I'm sure that's one-- - Oh, so you don't know."
59:54;59:56;"You're not hearing about it? - No, no, I'm sure that"
59:56;59:59;"once this airs, somebody who is a Starbucks partner"
59:59;01:00:01;"and a TC fan will know the answer to that."
01:00:01;01:00:03;"- I guarantee you they're not,"
01:00:03;01:00:04;"'cause that would be a lawsuit waiting to happen."
01:00:04;01:00:08;"And I feel like, isn't like a classic stoner movie,"
01:00:08;01:00:10;"like the guy trying to walk through the jack in the box,"
01:00:10;01:00:12;"drive through at two in the morning,"
01:00:12;01:00:13;"and they're like, ""Sir."""
01:00:13;01:00:15;"I've tried to do that before."
01:00:15;01:00:16;"And I remember being told like,"
01:00:16;01:00:18;"""Sir, you need to be in a car."
01:00:18;01:00:21;"""It's for your safety and to protect ourselves"
01:00:21;01:00:22;"""against lawsuits."""
01:00:22;01:00:24;"- I've also done that. - In fact, have you?"
01:00:24;01:00:26;"- I feel like I have a memory."
01:00:26;01:00:30;"My mom telling me some story about me being like a baby"
01:00:30;01:00:31;"or a toddler."
01:00:31;01:00:34;"I can't imagine where, I guess New Jersey, I don't know."
01:00:34;01:00:37;"She was somewhere pushing me in a stroller"
01:00:37;01:00:41;"and she tried to hit a drive-thru McDonald's with a stroller."
01:00:41;01:00:44;"Maybe she was thinking, ""I'm not just a pedestrian."
01:00:44;01:00:47;"""I have a vehicle."" (laughs)"
01:00:47;01:00:50;"- That is-- (laughs)"
01:00:50;01:00:52;"- But she told me that-- - That's straight up reckless."
01:00:52;01:00:55;"- Yeah, that's actually kind of out of character."
01:00:55;01:00:57;"Maybe I'm misremembering the story,"
01:00:57;01:00:59;"but she was not allowed to."
01:00:59;01:01:00;"But yeah, you're probably right."
