Start Timestamp;End Timestamp;Transcript
23:04;23:09;"where I was like, ""Oh, could it be cool to have anything like a scissor lift on stage?"""
23:09;23:11;"So can you picture like a scissor lift?"
23:11;23:14;"Yes, I love where your head's at with that."
23:14;23:17;"So we were talking, ""Would a scissor lift be interesting?"""
23:17;23:21;"And we were talking about kind of that kind of X shape in a scissor lift."
23:21;23:24;"You know, that just got me thinking, right, because maybe that's--"
23:24;23:26;"because sometimes with the set stuff, it can get tricky,"
23:26;23:28;"because you have to fabricate stuff yourself."
23:28;23:31;"And there's these companies that specialize in this,"
23:31;23:34;"and they're doing huge arena shows, and it's kind of like--"
23:34;23:38;"you know, even for a small show, if you have a specific idea,"
23:38;23:42;"you might need somebody to kind of fabricate a certain shape"
23:42;23:44;"and put in the video wall behind it."
23:44;23:47;"And even if you want your video wall to be round and--"
23:47;23:49;"you know, somebody's got to build all that stuff."
23:49;23:52;"So I was thinking about things that wouldn't require much time."
23:52;23:55;"So I was like, ""Well, a scissor lift, you could just get that anywhere."""
23:55;23:58;"Drive it right on stage, or-- I was looking at those like--"
23:58;24:01;"I was thinking about funny little vehicles like that, things that you could drive."
24:01;24:05;"Wait, so would you rent a scissor lift in each city,"
24:05;24:08;"or would you travel with a scissor--"
24:08;24:10;"Travel with a scissor lift."
24:10;24:12;"I would need my guys to price it out."
24:12;24:14;"But I was just thinking, if there could be--"
24:14;24:16;"Yeah, I don't know. I imagine--"
24:16;24:18;"I like that for my guys."
24:18;24:20;"Yeah, I like that for my guys."
24:20;24:22;"[laughs]"
25:20;25:27;"But somehow that conversation led to being like,"
25:27;25:29;"""Could a forklift play a role at all?"""
25:29;25:31;"And I was saying, ""Well, you know, this kind of--"
25:31;25:34;"the forklift meme, being forklift certified,"
25:34;25:37;"it's been around for years now. It's probably on its last legs."
25:37;25:42;"If there was ever a tour where as somehow part of the tour,"
25:42;25:45;"I or a member of the band should get forklift certified,"
25:45;25:47;"this would be it, you know?"
25:47;25:49;"I can't wait any longer."""
25:49;25:51;"This is very weird. It's--"
25:51;25:54;"It's very Guns N' Roses,"
25:54;25:56;"Use Your Illusion era."
25:56;25:59;"Axl would wear like a full catcher's outfit."
25:59;26:00;"Yeah."
26:00;26:05;"And like, I could just see like a weird stage stunt"
26:05;26:07;"that era of Guns N' Roses with Axl,"
26:07;26:11;"like driving a forklift like off the stage or something."
26:11;26:15;"Do you think the, you know, forklift,"
26:15;26:19;"you know, operator community would be--"
26:19;26:24;"I think it's a little bit of sort of stealing valor."
26:24;26:27;"I think if I got certified, they can't say sh*t."
26:27;26:31;"Maybe at some point, you know, the band's just sh*t cooking,"
26:31;26:34;"got a nasty groove happening,"
26:34;26:35;"and I go, ""Oh, hold on a second."""
26:35;26:38;"I come out in a hard hat, drive the forklift on stage,"
26:38;26:40;"and I pick up a pallet."
26:40;26:42;"You know, showmanship stuff."
26:42;26:45;"I don't know, and maybe I document my journey,"
26:45;26:49;"but like, you know, I'm sorry, but if I'm certified,"
26:49;26:52;"I don't care how many years you spend in the warehouse."
26:52;26:56;"Like, technically, we are both allowed to operate a forklift."
26:56;26:58;"I like some, like, longshoremen at the show just being like,"
26:58;27:02;"""You know what, man? My culture, that's not your--"
27:02;27:04;"you know, that's not for you to take and just--"""
27:04;27:06;"""That's not your costume."""
27:06;27:09;"""My culture is not your costume,"" Ezra Koenig."
27:09;27:11;"I want to say, though, real quick,"
27:11;27:14;"I like this idea of this person thinking that"
27:14;27:17;"while all the members of the band,"
27:17;27:20;"they're all just like bumper cars,"
27:20;27:22;"on stage driving forklifts."
27:22;27:25;"Forklifts just crashing into each other."
27:25;27:27;"That sounds real dangerous, guys."
27:27;27:29;"Brian Cross is going to have a heart attack."
27:29;27:31;"The whole show could be--"
27:31;27:33;"Yeah, well, also, I guess if you take it to its extreme,"
27:33;27:35;"actually, the band-- maybe the band can't play."
27:35;27:37;"We're going to do all tracks,"
27:37;27:40;"so there's no gear on stage other than boxes and pallets"
27:40;27:42;"that we can, like, move."
27:42;27:44;"Big hit with the fans."
27:44;27:47;"Yep. I guess-- and also, I think as a way to pay tribute"
27:47;27:50;"to people who actually work in warehouses,"
27:50;27:53;"longshoremen, things of that nature,"
27:53;27:56;"I would try to make sure that they understood"
27:56;27:58;"that I was doing it."
27:58;28:00;"I wasn't trying to literally steal their valor."
28:00;28:03;"Like, if I came out, and I'm wearing kind of like a--"
28:03;28:06;"you know, a car heart and a hard hat,"
28:06;28:08;"maybe that's too much."
28:08;28:10;"Maybe what I need to do is take a page"
28:10;28:13;"from our fellow Apple Music host,"
28:13;28:15;"Elton John's book,"
28:15;28:18;"and you remember when he played Dodger Stadium"
28:18;28:20;"in the '70s,"
28:20;28:24;"he famously came out in this, like, very--"
28:24;28:28;"like, probably 10,000-sequin Dodgers outfit"
28:28;28:30;"that was so sparkly,"
28:30;28:32;"and he came out with, like, a baseball bat."
28:32;28:35;"He was wearing this, like, insane, sparkly Dodgers outfit"
28:35;28:37;"and kind of, like, did, like, a fake crack of the bat"
28:37;28:40;"and then sat down and was, like, ripping on piano."
28:40;28:42;"So maybe I'll do, like, a kind of--"
28:42;28:45;"a warehouse forklift operator outfit,"
28:45;28:49;"but just covered in sequins, bedazzled to the hilt,"
28:49;28:51;"just shining, kind of like Liberace"
28:51;28:54;"meets a warehouse employee."
28:54;28:56;"And then they'll see that I'm kind of like--"
28:56;28:58;"I'm paying tribute to them,"
28:58;29:00;"but I'm not trying to pretend I am them."
29:00;29:03;"I'm recognizing that I come from show business,"
29:03;29:05;"and I'm meeting them halfway."
29:05;29:07;"- You are an effete coastal elite."
29:07;29:08;"- That's right."
29:08;29:10;"- The moment you have to encounter"
29:10;29:12;"the real forklift operator,"
29:12;29:14;"and you're wearing the sequined outfit."
29:14;29:16;"- Yeah. [laughs]"
29:16;29:18;"- So good."
29:18;29:20;"- But I just do it, like, so campy,"
29:20;29:22;"just like, ""Should I do it?"""
29:22;29:25;"And maybe even, like, then on the video screen,"
29:25;29:28;"like, we play, like, a montage"
29:28;29:31;"of me getting forklifts certified in the city of commerce,"
29:31;29:33;"and then I actually come out,"
29:33;29:35;"and just, like, the crowd goes nuts."
29:35;29:37;"I mean, look, all I'm saying is there's a--"
29:37;29:41;"there's a ticking clock when it comes to"
29:41;29:44;"bringing the house down with a forklift--"
29:44;29:48;"a certified forklift operator bit in a rock concert."
29:48;29:52;"I don't think it's gonna play in four years from now."
29:52;29:54;"I think this is the sweet spot."
29:54;29:56;"- You gotta seize the moment."
29:56;29:58;"- This is the time to do it."
29:58;29:59;"- No argument here."
29:59;30:01;"- What if Baio is standing on a pallet,"
30:01;30:03;"and then--and he's just, like,"
30:03;30:05;"he's, like, rippin' a bass solo."
30:05;30:08;"[imitates bass solo]"
30:08;30:10;"And he comes over, and it's like,"
30:10;30:12;"""Oh, here comes the forklift."""
30:12;30:14;"I put the prongs into the pallet."
30:14;30:17;"I lift him up, and he's looking around like, ""What?"""
30:17;30:18;"[imitates bass solo]"
30:18;30:20;"And he's just going higher and higher and higher."
30:20;30:22;"And then I bring him back down."
30:22;30:25;"I mean, that right there is a showstopper."
30:25;30:27;"- This could be, like, your--you know how, like,"
30:27;30:30;"Pink likes to do the aerial flying stuff with, like, the rope?"
30:30;30:34;"This could be, like, the thing that you do for decades."
30:34;30:36;"This could be your, like, your visual--"
30:36;30:38;"- I've always wanted more stuff like this."
30:38;30:40;"- I just want to flag, though,"
30:40;30:43;"you cannot have any alcohol before the show."
30:43;30:46;"You can't have any drinks and then operate heavy machinery, okay?"
30:46;30:48;"- Oh, boy. All right."
30:48;30:50;"- No tequila shot before you go on stage"
30:50;30:52;"if you're gonna be operating a forklift,"
30:52;30:54;"especially if you're, you know,"
30:54;30:56;"ferrying your band members around."
30:56;30:58;"- If I just do, like, a full Motley Crue bit,"
30:58;31:00;"where... [laughs]"
31:00;31:02;"It's just, like, I kind of come out with, like--"
31:02;31:04;"- A bottle of Jack. - A bottle of Jack,"
31:04;31:06;"and I'm just, like, chugging it, and I'm like,"
31:06;31:08;"""Should I operate this forklift?"""
31:08;31:10;"The crowd's like, ""Hell yeah!"""
31:10;31:12;"[laughter]"
31:12;31:15;"And I'm just like, ""They don't want me to."""
31:15;31:17;"Like, we have, like, one of the Crue guys come out"
31:17;31:20;"dressed as a cop, and I'm just like, ""Whatever, man."""
31:20;31:23;"And then later I get arrested, and I'm just like,"
31:23;31:25;"""No, no, no."" I guess, like, I have to write, like,"
31:25;31:28;"a letter to, you know, the city of Milwaukee"
31:28;31:30;"that was pure performance."
31:30;31:33;"There was apple juice in that bottle of Jack Daniels."
31:33;31:36;"I really apologize to Milwaukee PD"
31:36;31:40;"for making their life difficult under no circumstances."
31:40;31:45;"Should anybody ever drink and operate heavy machinery,"
31:45;31:47;"I'm sorry to have even joked about it."
31:47;31:49;"- You can also go the opposite moment,"
31:49;31:52;"sort of NWA kind of style,"
31:52;31:54;"where you have actors as cops"
31:54;31:56;"always come out to arrest you..."
31:56;31:58;"- Right. Yeah. - Nice."
31:58;32:00;"- ...and then you're just waiting, wasted."
32:00;32:02;"- Oh, yeah, but then we have, like, a Keystone Cops moment"
32:02;32:04;"where I kind of, like, I shimmy out of, like, the cuffs,"
32:04;32:06;"and I get it back in the forklift,"
32:06;32:08;"and they're chasing me all around the stage."
32:08;32:10;"And you know what? This is where you get"
32:10;32:12;"into true showmanship, is that I'm like,"
32:12;32:14;"""Vrrr, can't go right."
32:14;32:16;"""Brr-brr-brr, back up. Vrrr, can't go back."""
32:16;32:18;"And then I turn to the audience,"
32:18;32:20;"and then they don't realize that this thing"
32:20;32:22;"is rigged on invisible wires,"
32:22;32:24;"and I forklift over the audience."
32:24;32:26;"[laughter]"
32:26;32:28;"- Meanwhile, the band's just vamping"
32:28;32:30;"on, like, the cruddiest funk groove."
32:30;32:32;"- [laughs]"
32:32;32:34;"- 12-minute bit."
32:34;32:36;"- [laughs]"
32:36;32:38;"Just doing a..."
32:38;32:40;"[laughs]"
32:40;32:42;"[imitates music]"
32:42;32:44;"- Sounds like a hell of a show."
32:44;32:46;"- There's something here."
32:46;32:48;"- Then you go, ""Thank you."
32:48;32:50;"""The next song is called 'Hannah Hunt.'"""
32:50;32:52;"[laughter]"
32:52;32:54;"[Hannah Hunt's ""Hannah Hunt"" plays]"
32:54;32:56;"- ♪ I'm in a diamond Hannah ♪"
32:56;32:58;"♪ There's no fiction ♪"
32:58;33:00;"♪ There's no answer ♪"
33:00;33:02;"♪ Don't remember when you left, darling ♪"
33:02;33:04;"♪ You and me, we got our hopes in the dime ♪"
33:16;33:18;"- What's a forklift weigh? I'm gonna guess, like,"
33:18;33:20;"1,500 pounds."
33:20;33:22;"- Didn't Drake have, in one of his shows"
33:22;33:25;"in the last five years, he had a car fly, right?"
33:25;33:27;"- Did he? Oh, no, I was the one where he stood"
33:27;33:30;"on this weird kind of, like, a platform"
33:30;33:32;"that would then sort of go above the crowd"
33:32;33:34;"while he would sing to them individually."
33:34;33:36;"That was some tour that I went to."
33:36;33:38;"I don't remember him getting a car fly."
33:38;33:40;"- Oh, yeah. He had a flying-- - He had a car fly."
33:40;33:42;"- Yeah, it was a Ferrari. - Flying Lamborghini?"
33:42;33:44;"- Ferrari. - Ferrari, uh, five years ago."
33:44;33:46;"Looks like on one of his tours."
33:46;33:48;"Wow, it looks pretty crazy. I've never seen this."
33:48;33:50;"It's just, like, levitating. - So the Ferrari would fly over the crowd."
33:50;33:53;"So probably-- - A forklift weighs 9,000 pounds."
33:53;33:55;"- What?! [laughter]"
33:55;33:57;"- Wait, that was just a Ferrari weigh."
33:57;33:59;"- Okay, but that's the thing."
33:59;34:01;"We'll have to talk to Drake's team"
34:01;34:04;"because I'm sure it was not a full Ferrari."
34:04;34:06;"It was probably some sort of fabricated fiber."
34:06;34:08;"- A Ferrari's around 4,000 pounds."
34:08;34:10;"- Yeah, there's no way they were flying"
34:10;34:13;"4,000 pounds over the audience."
34:13;34:15;"No one's gonna insure that."
34:15;34:17;"So it must have been a lightweight thing."
34:17;34:19;"You got any info, Seinfeld?"
34:19;34:21;"- Well, no, I was just gonna suggest you could do, like,"
34:21;34:23;"the Ikea version of a forklift, you know?"
34:23;34:25;"Like, if you go to Ikea, you pick up television."
34:25;34:27;"- Of the small ones? - It's like--"
34:27;34:29;"Just, like, it's like a plastic, like, facsimile."
34:29;34:31;"I guess it would still have to work, though."
34:31;34:34;"- We're gonna have a special effects team."
34:34;34:36;"We're gonna have Industrial Light and Magic"
34:36;34:38;"put this together, and I'm gonna say,"
34:38;34:40;"""Guys, here's the thing."
34:40;34:43;"""I need a forklift that can move a little bit."
34:43;34:46;"""It has lights, and the fork can move,"
34:46;34:49;"""but it's gotta be--it's gotta weigh--"
34:49;34:51;"it tops 400 pounds."" - I think it's achievable."
34:51;34:53;"- It's a custom forklift."
34:53;34:56;"It has to be able to lift, like, at least 200 pounds."
34:56;34:58;"Pallet plus, like, a dude."
34:58;35:00;"- Yeah, maybe it doesn't-- - Wait a second."
35:00;35:03;"- Maybe we just gotta use sleight of hand for the--"
35:03;35:05;"- If you're gonna get certified, though,"
35:05;35:07;"you've gotta be--"
35:07;35:09;"Like, would the rules apply"
35:09;35:11;"if it's a new kind of forklift?"
35:11;35:13;"Do you know what I'm saying?"
35:13;35:15;"Like, would you need to get certified"
35:15;35:17;"if it's not a real forklift? No,"
35:17;35:19;"but I would still do it for love of the game."
35:19;35:22;"- Fair. - Also, does certification"
35:22;35:24;"work across state lines? I mean, I'm picturing Ezra"
35:24;35:26;"rolling into the show in Phoenix,"
35:26;35:28;"and part of the pre-show ritual"
35:28;35:32;"is that there is a certified forklift instructor..."
35:32;35:34;"- [laughs] - Waiting for him at the venue."
35:34;35:36;"- This is too good. - They do a quick--"
35:36;35:38;"- I mean, this is-- - They do a quick, like,"
35:38;35:40;"40-minute primer."
35:40;35:42;"Ezra does a written test and demonstrates"
35:42;35:44;"his facility with the machine."
35:44;35:47;"He's done in an hour."
35:47;35:50;"But that is, for insurance purposes,"
35:50;35:52;"a crucial part of your pre-game ritual."
35:52;35:55;"The bus generally pulls into town"
35:55;35:57;"around 5 a.m."
35:57;35:59;"I'll sleep a few more hours."
35:59;36:02;"Up and at 'em at 8, grab a cup of coffee"
36:02;36:04;"while the crew is starting to put up the lights."
36:04;36:06;"I do a little bit of exercise,"
36:06;36:10;"and then I go get forklift certified"
36:10;36:12;"in whatever city I'm in."
36:12;36:15;"Back at the venue for a sound check,"
36:15;36:19;"and that's how we stay one step ahead of the law."
36:19;36:21;"There's gotta be a Guinness--"
36:21;36:23;"like, a Guinness World Record you could get"
36:23;36:25;"for, like, most certifications,"
36:25;36:27;"or, like, the only guy to be certified"
36:27;36:30;"- across America. - That's for the fucking 50 states."
36:30;36:33;"I mean, the forklift certified tour is pretty good."
36:33;36:35;"- [laughs] - It's pretty--"
36:35;36:38;"I mean, this is the last year to do it, man."
36:38;36:40;"It's had a hell of a run as a meme,"
36:40;36:43;"as a concept, but it's not gonna last forever."
36:43;36:45;"That is so, like, hair metal band."
36:45;36:48;"The forklift certification tour."
36:48;36:51;"[laughs]"
36:51;36:53;"- All right, guys. - Should we call our guys?"
36:53;36:55;"- Yeah, we gotta call the boys. - Oh, yeah."
36:55;36:57;"- We gotta call our guys. - You wanna set 'em up?"
36:57;36:59;"These guys are the talk of the town."
36:59;37:01;"- They really are. - Zachary Schweitz"
37:01;37:03;"and Christian Hansen, they made"
37:03;37:06;"the octopus murders for Netflix."
37:06;37:08;"It's a big hit."
37:08;37:11;"It's been top ten on Netflix for a couple weeks."
37:11;37:14;"It's a show about conspiracy theories"
37:14;37:17;"involving the death of journalist Danny Casolaro"
37:17;37:19;"in 1991."
37:19;37:21;"He was a journalist who was uncovering"
37:21;37:23;"what he called the octopus,"
37:23;37:26;"a series of interrelated covert actions"
37:26;37:29;"involving the U.S. government, the CIA,"
37:29;37:32;"and all sorts of bad stuff."
37:32;37:34;"These guys kind of picked up the case"
37:34;37:37;"and said, ""What happened to this guy, Danny Casolaro?"""
37:37;37:40;"A lot of people believe he was killed for what he knew."
37:40;37:42;"So these guys revisit his death,"
37:42;37:44;"and they kind of get back into the same stuff"
37:44;37:47;"that Danny Casolaro was researching himself."
37:47;37:49;"A lot of twists and turns."
37:49;37:51;"It's a great documentary,"
37:51;37:53;"and clearly it's resonating with people."
37:53;37:58;"And we know someone in common with Zachary,"
37:58;38:01;"so we actually got an email a couple weeks ago,"
38:01;38:03;"""Would you wanna have these guys on?"""
38:03;38:06;"And we'd actually heard that they had listened to"
38:06;38:09;"our interview with Tom O'Neill about his book ""Chaos."""
38:09;38:11;"So I said, ""All right."""
38:11;38:12;"Absolutely."
38:12;38:16;"And it feels like perfectly TC, so let's get 'em on."
38:16;38:20;"Now let's go to the Time Crisis Hotline."
38:20;38:23;"[beeping]"
38:23;38:25;"All right, fellas, welcome to the show."
38:25;38:26;"Very happy to have you."
38:26;38:28;"Thanks so much. It's great to be here."
38:28;38:31;"Congratulations on the success of your documentary."
38:31;38:33;"It's clearly resonating with people,"
38:33;38:35;"and we've all watched, and we think it's great."
38:35;38:36;"Amazing."
38:36;38:38;"I guess for anybody,"
38:38;38:42;"any listeners who live under a rock"
38:42;38:45;"and they don't know about your doc series"
38:45;38:46;"or what it's about,"
38:46;38:49;"can you just give the quick summary of how it started"
38:49;38:51;"and the impetus behind making it?"
38:51;38:54;"It actually started for me with a--"
38:54;38:56;"I was writing a paper in college"
38:56;38:58;"about the private prison industry,"
38:58;39:04;"and that led me to this company called Wackenhut,"
39:04;39:08;"which was the second-largest private prison company in America"
39:08;39:11;"and was involved in a lot of other things"
39:11;39:13;"other than private prisons."
39:13;39:16;"It was a giant multinational security company."
39:16;39:19;"The board of directors were department heads"
39:19;39:25;"from the FBI, the NSA, generals in the Air Force, CIA."
39:25;39:30;"The outside counsel was Reagan's CIA director."
39:30;39:34;"Turns out they were-- I was digging into it,"
39:34;39:37;"and it turned out that they formed this joint venture"
39:37;39:39;"with the Native American Reservation"
39:39;39:42;"in the Coachella Valley outside of India, California."
39:42;39:45;"And this journalist named Danny Castellaro"
39:45;39:50;"had been looking into this particular event"
39:50;39:53;"and what was going on on this reservation"
39:53;39:55;"with this security company."
39:55;40:01;"And this reporter died a year into his research,"
40:01;40:06;"and it shocked me that I'd never heard of him before,"
40:06;40:09;"and he seemed like such a cool guy."
40:09;40:12;"And the book, from what I could gather,"
40:12;40:17;"that he was writing seemed just fascinating and bizarre."
40:17;40:20;"And I just started looking into it,"
40:20;40:22;"and, like, it's-- you know,"
40:22;40:24;"it ended up being like a 12-year odyssey."
40:24;40:26;"- So it starts when you're in college."
40:26;40:28;"You're looking into it in your free time."
40:28;40:33;"As you show in the doc, you were working as a--"
40:33;40:36;"your day job is being a photographer."
40:36;40:39;"- It's a little confusing because I had dropped out of college,"
40:39;40:42;"and I was working in New York as a photographer"
40:42;40:45;"for The New York Times as a freelance photographer."
40:45;40:49;"Then I went back to college to finish my degree,"
40:49;40:51;"finally, after several years."
40:51;40:53;"- Okay. - Yeah."
40:53;40:58;"That's--it's a little--my--my sort of own chronology"
40:58;40:59;"is a little bit confusing."
40:59;41:01;"- Well, and you guys are old friends?"
41:01;41:04;"- Yeah, we grew up--we grew up together."
41:04;41:06;"- Wait, so you're both from Kentucky?"
41:06;41:07;"- Yeah, we're from Louisville."
41:07;41:10;"- Okay, so you both--and you both know"
41:10;41:12;"a friend of the show, Morgan Leibis?"
41:12;41:14;"- That's Zach's cousin. - Right, so--okay."
41:14;41:17;"So Morgan is your cousin. - Yeah."
41:17;41:20;"- So anyone who's trying to create a time crisis octopus,"
41:20;41:24;"you're gonna be drawing lines between me and Jake and Morgan,"
41:24;41:27;"Morgan to Zach, Zach to you."
41:27;41:28;"Okay."
41:28;41:30;"- There's more. There's more to it."
41:30;41:37;"There's--we edited our show in the Chilin Island offices,"
41:37;41:39;"and I love time crisis."
41:39;41:42;"It's the best--well, it's an Internet radio show."
41:42;41:45;"It's the best of the bunch."
41:45;41:48;"And there was one day where I was listening to time crisis,"
41:48;41:51;"looking at some spreadsheet, and for all the dangerous,"
41:51;41:56;"exciting stuff that I have to do in the course of my research"
41:56;42:00;"and this project, there's, like, five times more, you know,"
42:00;42:02;"boring, tedious things, and the best thing to do"
42:02;42:05;"is to hang out with you guys, you know?"
42:05;42:08;"- Oh, hell yeah. - Your bi-weekly radio show."
42:08;42:12;"And I'm sitting there listening to time crisis,"
42:12;42:14;"and Deathspot walks in the office,"
42:14;42:17;"'cause he was, you know, obviously the producer"
42:17;42:19;"of Chilin Island. - Right."
42:19;42:22;"- I didn't say anything. It was just too--it was too bizarre."
42:22;42:25;"- ♪ This little piggy got a house made of bricks ♪"
42:25;42:28;"♪ Hand over hand over hand over this ♪"
42:28;42:31;"♪ This little piggy got a house made of bricks ♪"
42:31;42:34;"♪ Pup and pup, you ain't blowing down ♪"
42:34;42:38;"♪ This little piggy got a house made of bricks ♪"
42:38;42:41;"♪ Hand over hand over hand over this ♪"
42:41;42:44;"♪ This little piggy got a house made of bricks ♪"
42:44;42:47;"♪ Pup and pup, you ain't blowing down ♪"
42:47;42:50;"- There's the Nick connection"
42:50;42:52;"through our producer Rachel, too."
42:52;42:54;"- Yeah, which is very strange. - Right?"
42:54;42:57;"- So where a friend of the show, Morgan Levis,"
42:57;43:00;"is, you know, related to these guys,"
43:00;43:04;"it turns out that my niece is the segment producer"
43:04;43:07;"of Octopus Murders."
43:07;43:09;"- Your niece? - Amantha's niece, yeah."
43:09;43:13;"- Okay, so we really have a mini octopus on our hands here."
43:13;43:15;"- Absolutely. - I know, absolutely."
43:15;43:18;"- And then while me and Zach were driving around the country"
43:18;43:20;"knocking on people's doors and trying to, like,"
43:20;43:23;"come up with the mystery of the octopus,"
43:23;43:26;"we would go on the--you know, be driving for hours and hours"
43:26;43:29;"and we'd listen to the show."
43:29;43:31;"And it was while listening to the show that we learned"
43:31;43:35;"about Tom O'Neill, who became our friend eventually"
43:35;43:39;"and mentor and hero. - Author of ""Chaos."""
43:39;43:42;"So you were literally--the two of you are driving around"
43:42;43:46;"the country being Tom O'Neills, and then you hear Tom O'Neill."
43:46;43:48;"- Yeah, yeah, yeah. - And you're like--"
43:48;43:50;"- On your show. - Wow."
43:50;43:52;"So you instantly must have been like,"
43:52;43:54;"""This man is our spiritual brother."""
43:54;43:57;"- Exactly, yeah. - I mean, wow."
43:57;43:59;"Like, there's so many questions we could ask"
43:59;44:02;"about the show itself, but as I think about it,"
44:02;44:05;"I really just encourage anybody who hasn't seen it,"
44:05;44:09;"go watch it, because we could be in here talking about"
44:09;44:14;"Amazon, Wackenhut, and Michael--"
44:14;44:16;"- Oh, my gosh. - We could talk about--"
44:16;44:19;"- Philip Arthur Thompson. - Yeah."
44:19;44:21;"But the truth is, you should just go watch it."
44:21;44:23;"I think--I just want our audience,"
44:23;44:25;"anybody who hasn't seen it, to understand"
44:25;44:29;"that you were basically two childhood friends."
44:29;44:31;"Zach, you have a background in film."
44:31;44:33;"You've directed movies. You worked on movies,"
44:33;44:36;"doing other stuff. Christian, you were getting deeper into this."
44:36;44:39;"Zach is kind of talking about it with you,"
44:39;44:41;"decides to make a documentary. I just want people--"
44:41;44:44;"they should go watch it to understand the depth of it."
44:44;44:48;"But I think for us, what I'm kind of interested in"
