Start Timestamp;End Timestamp;Transcript
47:44;47:51;"but I know that there, follow me on this, that he was on just, there's no dispute that he was the"
47:51;47:57;"head of marketing, right? Well, not that part is true. No, I not, I'm again, this is a timeline"
47:57;48:02;"situation and chronology we'll figure out. But I think there's a version where he is the head"
48:02;48:07;"and they're making this thing and it's a lab and the story and he's the head of marketing goes,"
48:07;48:12;"you know, it'd be the best story is what if I made it? Yeah. I mean, you just can't,"
48:12;48:19;"he has a story about building his own mythology into this to make it work culturally, to make it"
48:19;48:25;"work marketing wise. The stories that you tell yourselves become history. It's like when Brian"
48:25;48:32;"Williams thought he went to Iraq or whatever. Remember that famous story? Oh yeah. The journalist,"
48:32;48:38;"the, the like, very like erudite NBC journalist was like, yeah, Brian's. Yeah. They were shooting"
48:38;48:41;"at us. Oh yeah. He's like, he went to Iraq or Afghanistan. He was like, they were shooting"
48:41;48:45;"us. And then it was like, and then it was almost like, no, you were never even there, man."
48:45;48:55;"And he, I think he was legitimately like, Whoa, I love this. Like a sort of almost like adaptation."
48:55;48:58;"Like there's something about, yeah, the stories we tell ourselves. And he's like,"
48:58;49:03;"at some point has told so many people, this story, such a good story. And he's gone to some,"
49:03;49:08;"and then someone's like, but it's not, that's the story. Everyone also wants to believe."
49:08;49:12;"They've studied that with memory, even though, even, I guess, even with a fake memory,"
49:12;49:17;"like they've studied this with memories that like the ones, the memories that you replay the most"
49:17;49:23;"are like the most degraded. It's like a VHS tape that you keep playing over and over again. So"
49:23;49:27;"like, think about episodes in your life that you've thought about a lot and reflect on a lot."
49:27;49:33;"Those memories are likely like wildly, wildly off. Cause you've like reflected. And each time"
49:33;49:40;"you think about it, it sort of like degrades a little bit more. And then if you have like a"
49:40;49:44;"random memory about something you haven't thought about in years, you ever have that happen?"
49:44;49:48;"And it's like, and it's like, comes in a flash and you're like, Oh yeah. And it's like,"
49:48;49:49;"there's a, there's like a clarity to it."
49:49;49:50;"That's pure."
49:50;49:55;"Right. And that's especially crazy because if it's a memory that you return to often,"
49:55;50:01;"you would tend to think, well, this is one I can really count on because I think about it all the"
50:01;50:06;"time. It's, you know, so, so obviously it's more true, but what you're saying is the opposite."
50:06;50:10;"Which is, yeah, there was like a radio lab about that years ago that I remember like,"
50:10;50:12;"kind of like blew my mind."
50:12;50:18;"Yeah. I mean, I bet Montanye's get him on a lie detector test. He invented flaming hot Cheetos."
50:18;50:23;"That's what it's going to say. And I mean, to take Frito-Lay's side for a second,"
50:24;50:32;"they did not throw him too hard under the bus. They, a legitimate journalist wrote something,"
50:32;50:37;"did his research. They had to respond. And they said the nicest thing they possibly could say"
50:37;50:45;"about somebody who their records did not support. Somebody whose story the records did not support."
50:45;50:51;"So it's too bad that Montanye's, but I guess in his world. So like for us, I remember kind of"
50:51;50:55;"thing like, well, it's lame. They didn't invite him to the white house, but life goes on. They"
50:55;51:01;"made a hit movie based on his story. And it was even nominated for best song of the Oscars. Like"
51:01;51:07;"life is good. But I guess in month for Montanye's, it didn't feel that way. His speaking fees,"
51:07;51:15;"dwindle, et cetera. You know what? Because, because Biden did Montanye's so dirty by not"
51:15;51:19;"inviting him to the screening. He even just could have been invited as a guest."
51:19;51:22;"He's in the movie. He's in the movie. He acted in the film."
51:22;51:26;"Not invited him just to be like, yeah, as a, as talent in the movie."
51:26;51:30;"Even if his memories are not correct about inventing flame and hot Cheetos,"
51:30;51:36;"if you were him and you saw that the white house premiere of flame and hot Cheetos,"
51:36;51:46;"and you heard Biden, whatever he said about, you know, diversity and the Hispanic contribution"
51:46;51:50;"to American culture, you heard all that stuff. I can see you're sitting at home. You're, you're,"
51:50;51:57;"you're, you're, you're Montanye's and you're saying like, you're, you're using my story to sell"
51:57;52:03;"your vision of America and to tell the feel good. Like, how am I not invited to this?"
52:03;52:06;"You didn't invite me to a movie premiere because you said I didn't invite,"
52:06;52:11;"invent flaming hot Cheetos about a movie where I invented flaming hot Cheetos."
52:12;52:16;"Yeah, it's totally, it's, it's totally incoherent. And I think the only"
52:16;52:20;"correct thing, I don't know if, uh, if a president has this kind of power,"
52:20;52:25;"cause I think normally when a president pardoned somebody, it's because they were convicted of a"
52:25;52:31;"crime. I don't know if they're allowed to just do kind of presidential pardon. That's that basically"
52:31;52:37;"tells the country you have to believe this guy's story. I think it'd be kind of unprecedented,"
52:37;52:44;"but I think, uh, Biden on his way out should pardon in his last hundred days Montanye's and"
52:44;52:49;"give him lifetime immunity from, from people saying he didn't invent flaming hot Cheetos."
52:49;52:53;"I think it's the only right thing to do. I mean, they say that as far as the president's here"
52:53;52:59;"are constantly expanding. So I think this would be, you know, the next frontier for Joe."
52:59;53:03;"Oh, I like, I do like that the white house being able to say what the truth is"
53:04;53:08;"from now on. The truth is he invented flaming hot. Yeah. There's no problems with that."
53:08;53:13;"They're already doing that more or less in these, these, yeah. And in politics,"
53:13;53:19;"these lying politicians, it also be a shame in a high stakes election."
53:19;53:24;"When there's a lot of discussion about the Hispanic vote, people were very disturbed to see"
53:24;53:29;"that Trump had a higher share of the Hispanic vote than some previous Republican candidates."
53:29;53:36;"Well, remember this Biden, you took, you took a, you disrespected a great amount."
53:36;53:41;"As far as the democratic party is concerned, Richard Montanye's invented flaming hot Cheetos."
53:41;53:53;"Folks, Montanye, they treated him very bad. Didn't they folks? Ooh, Joe Biden showed the movie,"
53:53;53:59;"didn't invite him to the white house. It's not nice. Ooh, that's not nice folks. Frankly,"
53:59;54:08;"I could see it. I can see Trump going. I was there. He invented flaming at Cheetos."
54:08;54:18;"Yeah. It's good. Spicy. I feel like we, we went down this exact same line of"
54:23;54:28;"Montanye's, Montanye's goes far right and campaigns for Trump."
54:50;54:54;"I like this for the remicade movie though. Like the political involvement,"
54:54;54:58;"don't you understand this goes right up to the white house. Like one of those."
54:58;55:02;"Oh, absolutely. Third act right in the uncovering of it."
55:02;55:06;"Yeah. If Trump caught wind of this story, he would completely jump on it and be like,"
55:06;55:12;"can you believe this? They're disrespecting this great entrepreneur. If someone pushes across"
55:12;55:18;"Trump's desk, it would, he would just run with it. I mean, Kamala really has an opportunity here to"
55:18;55:25;"kind of break with the past, you know, get some new talking points in for the Democrats and, you"
55:25;55:31;"know, come with something a little tougher and more coherent than Joe. Oh, I love, I love Joe."
55:31;55:38;"I love Joe. One of the greatest presidents we've ever had, but did it make sense not to invite"
55:38;55:44;"Montanye's to his own movie? Of course not, you know, and that's not going to happen under Harris"
55:44;55:49;"administration. She could have like a movie night at the vice president. She'll resident, you know,"
55:49;55:54;"the vice president's residence and invite him and Eva Longoria more to like a movie night. I mean,"
55:54;55:59;"it's not gonna be big, but they could take like Instagram posts and stuff, you know, in front of"
55:59;56:06;"her like 70 inch TV or whatever. Yeah. Maybe they could let, um, Doug Emhoff, the first Jewish second"
56:06;56:16;"gentleman. That was where we went, we went on that on TC. Just that still is the Kamala talk."
56:16;56:20;"Now just truly one of my favorite phrases of all time. The first Jewish second gentleman"
56:20;56:28;"as the first Jewish second gentleman, I know a thing about breaking barriers. Mr. Montanye's."
56:28;56:36;"It is my honor to have you here for this screening of Flamin' Hot. The first Hispanic Frito-Lay"
56:36;56:44;"marketing executive and the first Jewish second gentleman walk into a bar and save democracy."
56:44;56:48;"It is pretty funny to think about him just like chilling in the white house."
56:48;56:53;"If he wins when he becomes the first Jewish first gentleman, it doesn't have the same ring to it."
56:53;56:57;"It does. I'm sorry. First Jewish second gentleman is so much better than first"
56:57;57:02;"Jewish first gentleman. Yeah. He was the first Jewish second gentleman."
57:05;57:15;"Oh God. Yeah. I really, what a mess. Also, is this just a last ditch effort for Montanye's?"
57:15;57:21;"Like maybe he knows deep down that could the truth be somewhere in between just guys drop"
57:21;57:27;"the lawsuit and give him a speaking engagements back. Come on. Yeah. Well, no, but I mean,"
57:27;57:33;"they've been rescinded just because his reputation has been so damaged. He's bringing the lawsuit."
57:34;57:36;"You guys aren't going to like, you're not going to..."
57:36;57:37;"Reputation up in public."
57:37;57:43;"I just still have this feeling that he's been a patsy by Frito-Lay for this the whole time."
57:43;57:51;"That Frito-Lay is essentially financing this lawsuit. That they want him to go against them"
57:51;57:58;"for the marketing side of this. We want this story to be real. I don't think it's going to"
57:58;58:02;"go very far, but I think that he's still sort of been put up to this lawsuit."
58:02;58:05;"Wait, wait, this is really thick. You're going full like..."
58:05;58:08;"I'm going full chaos on this. Yeah."
58:08;58:10;"You're saying Frito-Lay wants to be sued?"
58:10;58:14;"Yes. At least wants the idea of the lawsuit because they want this story to be real."
58:14;58:18;"Like they want this. It's more important that the narrative..."
58:18;58:20;"How is this going to prove that this only..."
58:20;58:27;"It doesn't even have to go to trial. He just needs to, it just needs to exist."
58:27;58:28;"Right. Like..."
58:28;58:32;"The market, it's like a supreme coffin, right? We always talk about it just has to be out there."
58:33;58:35;"Right. So then they can just say, you know what? They settled out of court."
58:35;58:41;"His reputation improved slightly. He gets to speak engagements back and the legend continues."
58:41;58:44;"I'm just throwing it out there. Do your own research."
58:44;58:47;"To me, this is, again, it's more the Errol Morris doc thing."
58:47;58:49;"It's the ambiguity of truth."
58:49;58:52;"It's so murky, we'll never know. It's an enigma wrapped... What's the"
58:52;58:57;"Joe Pesci line in Jet K? It's an enigma wrapped in a mystery, wrapped in, you know."
58:57;58:58;"Right."
58:58;59:00;"We'll never know. We'll never get to the bottom of it."
59:00;59:06;"We talk all the time about TC Productions. We 100% should be financing a Montaigne's"
59:06;59:07;"documentary right now."
59:07;59:11;"It's probably their most, yeah, sort of commercial work."
59:11;59:16;"Okay. Call Lance Oppenheim. Call Montaigne's. Let's make this happen."
59:16;59:26;"We've had so many $100,000 ideas before on this show. We could have been the next A24 by now,"
59:26;59:32;"but we're too busy with our day jobs. Let's do this. Montaigne's doc now."
59:32;59:38;"We've always supported him. We're interested in him. It's going to be unbiased, but let's give"
59:38;59:45;"him a platform and let's shoot it in a kind of artful, long-strething way."
59:45;59:47;"Can I pitch a title?"
59:47;59:48;"Yep."
59:48;59:50;"Up in Flames."
59:50;59:51;"Oh, perfect."
59:51;59:53;"You like that?"
59:53;59:53;"Nailed it."
59:53;59:54;"Yeah."
59:54;59:54;"Thank you."
59:54;59:55;"Thanks."
59:55;59:58;"Okay. So you guys just start making calls."
59:58;59:59;"We'll circle back."
59:59;01:00:08;"I've seen summons buried in moor air, buried in space."
01:00:08;01:00:22;"And I just lie down in the snow, buried in space."
01:00:26;01:00:35;"I've seen moss-covered stones and diamond light taking on shapes."
01:00:35;01:00:44;"Black wooden mythologies. I know a place."
01:00:44;01:00:49;"Oh, you know what I thought could be fun is just to get back into some music."
01:00:49;01:00:52;"I've just been thinking about this song and I've been curious."
01:00:52;01:00:54;"Mr. Brightside?"
01:00:54;01:00:59;"Yeah, what Jake's relationship is to it, because as discussed at the top of the show,"
01:00:59;01:01:04;"at every Vampire Weekend show, we do a request section where it kind of very,"
01:01:04;01:01:09;"usually it's pretty chaotic, where we try to just play songs that people request in the audience,"
01:01:09;01:01:10;"whether or not we know them."
01:01:10;01:01:17;"Now that people know about the request section, you're getting all sorts of stuff out there."
01:01:17;01:01:22;"You're getting some deadheads requesting Eyes of the World."
01:01:23;01:01:26;"You're getting people requesting classic rock."
01:01:26;01:01:31;"You're getting younger people requesting-- somebody requests a Chapel Rhone song,"
01:01:31;01:01:37;"who I know is kind of like an exciting new pop star, but I don't know the song."
01:01:37;01:01:41;"People are coming with all sorts of different requests, but it's interesting to see"
01:01:41;01:01:47;"what's consistent night to night when you see a couple hundred phones go up with the"
01:01:47;01:01:50;"name and song titles on them."
01:01:50;01:01:52;"What's consistent?"
01:01:52;01:01:53;"Mountain Bruise."
01:01:53;01:01:55;"Mountain Bruise is pretty consistent."
01:01:55;01:01:59;"And one of the most non-Mountain Bruise songs that we consistently see"
01:01:59;01:02:02;"is Mr. Brightside by The Killers."
01:02:02;01:02:09;"Luckily for us, Ray, who's a new touring member, who's shredding on violin,"
01:02:09;01:02:14;"pedal steel, guitar, you name it, amazing musician, he toured with The Killers--"
01:02:14;01:02:15;"Oh, wow."
01:02:15;01:02:15;"--back in the day."
01:02:15;01:02:18;"So he knows how to play that song pretty well."
01:02:18;01:02:25;"So a couple of times we've gone into it, and the energy is just insane."
01:02:25;01:02:27;"People go nuts screaming every word."
01:02:27;01:02:37;"And I was curious, Jake, are you aware of how iconic and massive the song Mr. Brightside is?"
01:02:37;01:02:38;"No."
01:02:38;01:02:39;"I don't know the song."
01:02:39;01:02:42;"If I hear it, maybe we'll recognize it."
01:02:42;01:02:43;"That's amazing."
01:02:43;01:02:45;"But I know that it's a big title."
01:02:47;01:02:49;"It's by far their most famous song."
01:02:49;01:02:52;"I don't know if I can sing you one Killer song, to be honest."
01:02:52;01:02:54;"What do you know about The Killers?"
01:02:54;01:02:58;"Well, I know that each member has made their own hot sauce."
01:02:58;01:03:00;"Yeah, because they came on TC."
01:03:00;01:03:01;"Yep."
01:03:01;01:03:03;"I know they're from Las Vegas."
01:03:03;01:03:05;"I know that the singer's named Brandon Flowers."
01:03:05;01:03:06;"Correct."
01:03:06;01:03:10;"I know they made a record like five years ago that sounded like War on Drugs."
01:03:10;01:03:15;"Yeah, they had some War on Drugs influence, I think, and some of the later stuff."
01:03:15;01:03:17;"Yep."
01:03:17;01:03:18;"That's about all I know."
01:03:18;01:03:19;"Let's throw on the song."
01:03:19;01:03:24;"Sound familiar so far?"
01:03:24;01:03:24;"Nope."
01:03:24;01:03:27;"Okay."
01:03:27;01:03:30;"I've heard this."
01:03:30;01:03:30;"Now it's familiar?"
01:03:30;01:03:31;"Yep."
01:03:40;01:03:45;"And she's calling a cab, while he's having a smoke, and she's taking a drink."
01:03:45;01:03:52;"Now they're going to bed, and my stomach is sick, and it's all in my head, but she's touching his chest."
01:03:52;01:03:59;"Now, he takes off her dress. Now, let me go."
01:03:59;01:04:09;"I just can't look, it's killing me."
01:04:10;01:04:14;"And taking control."
01:04:14;01:04:24;"Jealousy, turning six into the sea, swimming through syphilis."
01:04:24;01:04:31;"I'm a vice, choking on your love. I'm a vice, but it's just the price I pay."
01:04:31;01:04:43;"Destiny is calling me, open up my eager eyes, 'cause I miss the bright side."
01:04:43;01:04:50;"As you hear it, Jake, are you like, ""Oh, of course I know this."" Or do you like, ""Sounds familiar."""
01:04:50;01:05:00;"Yeah, somewhere in between there. It's more than, I know the song, but I've been in enough, you know, sports bars to have heard that song."
01:05:00;01:05:05;"I don't know if I just heard that, and someone was like, ""Who is this?"" I don't know if I would place it as the killers."
01:05:05;01:05:06;"Really?"
01:05:06;01:05:07;"I'm not sure."
01:05:07;01:05:13;"You know, even just the opening line alone, ""Coming out of my cage."" That's kind of a meme, right, Seinfeld?"
01:05:13;01:05:14;"Yeah."
01:05:14;01:05:21;"I don't know how it would be used as a meme, but I feel like that's a whole thing, ""Coming out of my cage."""
01:05:21;01:05:31;"It's like something people put on an Instagram caption, or they might pair it with a funny picture that subverts the lyric on Twitter."
01:05:31;01:05:33;"Yeah, it's definitely a thing."
01:05:33;01:05:37;"Meaning, like, ""I'm ready to go, I'm going out for the night, I'm ready to party."""
01:05:37;01:05:43;"And actually, I've always wanted to look at these lyrics, because I think the Killers are a great band."
01:05:43;01:05:48;"I've always thought of Brandon like, super cool, interesting guy."
01:05:48;01:05:52;"And some people have compared this song to ""Don't Stop Believing."""
01:05:52;01:05:59;"That song is for, like, older millennials. This song is for, like, younger millennials and Zoomers."
01:05:59;01:06:00;"Maybe for everybody."
01:06:00;01:06:03;"Like, in some ways, the Killers are bigger than ever."
01:06:03;01:06:09;"The status of this song has just grown and grown and grown, which is pretty amazing for, like, a rock band."
01:06:09;01:06:16;"But I always wanted to kind of do a deep dive on the lyrics, and especially because it gets requested so much, maybe it's good for me to learn them a little bit."
01:06:16;01:06:21;"But, yeah, opening line, ""Coming out of my cage, and I've been doing just fine."
01:06:21;01:06:25;"Gotta, gotta be down, because I want it all."
01:06:25;01:06:28;"It started out with a kiss, how did it end up like this?"
01:06:28;01:06:30;"It was only a kiss."
01:06:30;01:06:32;"It was only a kiss."""
01:06:32;01:06:37;"So, in the beginning, it kind of sounds like a guy who's, like, ready to have a good time."
01:06:37;01:06:44;"Like, maybe, I don't know if it's, like, a dude who had, like, just got out of a dark period or something, and he's, like, trying to be optimistic."
01:06:44;01:06:48;"""Coming out of my cage."" Maybe he was in a mental hospital for a while."
01:06:48;01:06:51;"Maybe he was laying real low."
01:06:51;01:06:55;"Maybe he went through a bad breakup, or who knows."
01:06:55;01:06:59;"But he's coming out of his cage, and he's been doing just fine."
01:06:59;01:07:02;"And then, when he says, ""It started out with a kiss, how did it end up like this?"
01:07:02;01:07:03;"It was only a kiss."
01:07:03;01:07:04;"It was only a kiss."""
01:07:04;01:07:07;"You can picture the song going a few different ways."
01:07:07;01:07:10;"Is this about a guy who, like, messed with the wrong girl?"
01:07:10;01:07:16;"He kissed her, and now, you know, she's saying the baby is his, you know?"
01:07:16;01:07:18;"Like, a Billie Jean thing."
01:07:18;01:07:19;"Yeah."
01:07:20;01:07:21;"Is this guy, like, a playboy?"
01:07:21;01:07:25;"But he, you know, played the wrong girl?"
01:07:25;01:07:26;"Or, you know, or did it just start out with a kiss?"
01:07:26;01:07:30;"I wasn't looking for anything too serious, but now it got serious?"
01:07:30;01:07:36;"So, at first, you assume, you know, that he kissed somebody, and whatever."
01:07:36;01:07:39;"It's creating an unexpected situation."
01:07:39;01:07:41;"But then, there's the interesting turn."
01:07:41;01:07:46;"""Now I'm falling asleep, and she's calling a cab."
01:07:46;01:07:50;"While he's having a smoke, and she's taking a drag."
01:07:50;01:07:56;"Now they're going to bed, and my stomach is sick, and it's all in my head."
01:07:56;01:08:00;"But she's touching his chest now."
01:08:00;01:08:03;"He takes off her dress now."
01:08:03;01:08:04;"Let me go."
01:08:04;01:08:05;"And I just can't look."
01:08:05;01:08:07;"It's killing me."
01:08:07;01:08:09;"They're taking control."""
01:08:09;01:08:10;"Great pre-chorus."
01:08:10;01:08:11;"And then, the chorus."
01:08:11;01:08:14;"""Jealousy, turning saints into the sea."
01:08:14;01:08:16;"Swimming through sick lullabies."
01:08:16;01:08:18;"Choking on your alibi."
01:08:18;01:08:20;"But it's just the price I pay."
01:08:20;01:08:22;"Destiny is calling me."
01:08:22;01:08:24;"Open up my eager eyes."
01:08:24;01:08:26;"'Cause I'm Mr. Brightside."""
01:08:26;01:08:29;"This is a very interesting song."
01:08:29;01:08:30;"What's your guys' take?"
01:08:30;01:08:31;"Obviously, it's about jealousy."
01:08:31;01:08:38;"But when he says, ""It's all in my head,"" is this like he's a dude with a retroactive jealousy"
01:08:38;01:08:39;"issue?"
01:08:39;01:08:41;"Is this girl actually his girlfriend?"
01:08:41;01:08:47;"But he keeps picturing some wack ex she had?"
01:08:47;01:08:49;"What's happening here?"
01:08:49;01:08:52;"Is this a negative fantasy?"
01:08:52;01:08:56;"Because also, he was kissing her, then he's falling asleep, and she's calling a cab."
01:08:56;01:09:00;"But then this other dude appears who's having a smoke, and she's taking a drag."
01:09:00;01:09:01;"What's your guys' take?"
01:09:01;01:09:05;"""I didn't mean to hurt you."""
01:09:05;01:09:08;"I feel like I've now read the true story."
01:09:08;01:09:10;"So I want to weigh in."
01:09:10;01:09:11;"I'm going to weigh in after."
01:09:11;01:09:13;"No, I'm going to weigh in after."
01:09:13;01:09:14;"No, no."
01:09:14;01:09:15;"No spoilers."
01:09:15;01:09:18;"I'm surprised there is-- I mean, I guess I'm not surprised there's a true story."
01:09:18;01:09:20;"That makes sense that there'd be a true story."
01:09:20;01:09:25;"But I think they leave it deliberately, narratively ambiguous."
01:09:25;01:09:31;"The most interesting part to me is the last part in the title, ""Open Up My Eager Eyes."""
01:09:31;01:09:33;"Because he's such a downer the whole song."
01:09:33;01:09:35;"He's such a neg head."
01:09:35;01:09:41;"He's either a jealous guy who's freaking out about some ex, or they've broken up and she's"
01:09:41;01:09:44;"met someone immediately."
01:09:44;01:09:48;"And he's just completely in a spiral of jealousy."
01:09:48;01:09:52;"But it's just the price you pay, destiny is calling me."
01:09:52;01:09:53;"Open up my eager eyes."
01:09:53;01:09:57;"Is that maybe sarcastic?"
01:09:57;01:09:59;"I never look on the bright side."
01:09:59;01:10:02;"I'm totally a-- you're like, ""Oh, yeah, you know me."
01:10:02;01:10:04;"I'm Mr. Brightside over here."""
01:10:04;01:10:05;"He's actually being sarcastic."
01:10:05;01:10:06;"Right."
01:10:06;01:10:12;"This dude's hanging out with his friends at the bar and just being like, ""It's crazy,"
01:10:12;01:10:13;"man."
01:10:13;01:10:14;"She's probably cheating on me right now."""
01:10:14;01:10:16;"And they're like, ""I don't know, man."
01:10:16;01:10:17;"She seems pretty cool."
01:10:17;01:10:18;"I don't think she would do that."""
01:10:18;01:10:23;"He's like, ""No, it's definitely that dude and the guy with the chest that she's always"
01:10:23;01:10:24;"touching."""
01:10:24;01:10:25;"And they're like, ""Chill, dude."""
01:10:25;01:10:26;"And he's like, ""Yeah, yeah, yeah."
01:10:26;01:10:27;"Right, right."
01:10:27;01:10:28;"Yeah, sure, sure."
01:10:28;01:10:29;"Yeah, I'm Mr. Brightside."
01:10:29;01:10:30;"Right."
01:10:30;01:10:31;"Yeah, it's all good."""
01:10:31;01:10:32;"Yeah."
01:10:32;01:10:33;"There's an element of that."
01:10:33;01:10:34;"So maybe that's what it is."
01:10:34;01:10:35;"That would make the most logical sense."
01:10:35;01:10:37;"Because otherwise, it's like, ""Whoa."""
01:10:37;01:10:48;"And the tone of the song is very sneering and relentlessly negative headspace."
01:10:48;01:10:52;"There's no turn in the music that makes me think that, ""Oh, he actually is like..."""
01:10:52;01:10:54;"This character is a bit of a negative creep."
01:10:54;01:10:57;"A little bit of a negative creep."
01:10:57;01:11:02;"There's no turn in the music or the performance that makes me think that he actually has an"
01:11:02;01:11:06;"expansive worldview and that he's going to get through it."
01:11:06;01:11:11;"I also wonder if there's, rather than being sarcastic, another interpretation is that"
