Start Timestamp;End Timestamp;Transcript
00:00;00:03;"Time Crisis, back again."
00:03;00:12;"This week, we jump back in to the endless Flamin' Hot War."
00:12;00:21;"Plus, we listen to music from Bruce Springsteen, Pearl Jam, and the Killers."
00:21;00:28;"This is Time Crisis with Ezra Koenig."
00:33;00:39;"They passed me by, all of those great romances"
00:39;00:46;"The war I felt, robbing me of my rightful chances"
00:46;00:54;"But picture clear, everything seemed so easy"
00:54;01:01;"And so I dealt to the blow, one of us had to go"
01:01;01:05;"Now it's different, I want you to know"
01:05;01:11;"One of us is crying, one of us is lying"
01:11;01:15;"Leave it on me, babe"
01:15;01:18;"Time Crisis, back again."
01:18;01:20;"The boys are hot to trot."
01:20;01:24;"We're, uh, this is not a banked up, not super banked."
01:24;01:28;"I'm talking to you guys live from the great city of Chicago."
01:28;01:31;"My last trip to Chicago, I think, uh, Jake, you were here."
01:31;01:35;"I was just gonna ask, are you in the same hotel?"
01:35;01:36;"Doesn't look like it."
01:36;01:37;"No, this is a different hotel."
01:37;01:42;"So I remember, um, yeah, our famed trip to Chicago in 2019,"
01:42;01:47;"when we stayed in that really beautiful, old, ornate hotel."
01:47;01:51;"We did an episode with, um, the dude that's in that punk band."
01:51;01:54;"Oh yeah, Existential Arby's."
01:54;01:56;"Oh right, Existential Arby's."
01:56;02:01;"We played the same venue as 2019, except we did two nights."
02:01;02:02;"Nihilist Arby's."
02:02;02:03;"Nihilist Arby's."
02:03;02:06;"Apologies to Nihilist Arby's."
02:06;02:08;"Was it warmer this time?"
02:08;02:14;"Yeah, I was thinking about that because it was really cold in June 2019."
02:14;02:18;"This is actually some, like, the most perfect, like, Chicago weather I've ever seen."
02:18;02:23;"Just really nice days, like highs in the mid 80s."
02:23;02:27;"When we're hitting the stage, nice breeze coming off the lake, like in the 70s."
02:27;02:29;"Two perfect nights."
02:29;02:30;"That rules."
02:30;02:33;"What did you do, uh, encore-wise last night?"
02:33;02:37;"Well, night two encore, what did we get?"
02:37;02:40;"It's a bit of a blur between the two nights."
02:40;02:44;"I know, I know we actually pulled off, like, a decent beast of burden."
02:44;02:46;"Okay."
02:46;02:48;"That kind of, like, sounded like the song."
02:48;02:51;"Oh, of course, somebody reques- somebody right up front had a sign."
02:51;02:54;"And we kind of prepared for it because we thought this might be the case."
02:54;02:56;"Because the second show was a Saturday."
02:56;03:00;"And so somebody up front had a sign saying ""Saturday in the Park, Chicago."""
03:00;03:01;"Nice."
03:01;03:04;"So we actually learned the verse through the chorus."
03:04;03:07;"It's a very sophisticated song."
03:07;03:11;"I was having a hard time, you know, the beginning is, like, pretty straight ahead."
03:11;03:14;"""Saturday in the park, must have been the fourth of July."
03:14;03:16;"I think it was the fourth of July."""
03:16;03:19;"And then that next chord change is really hard for me to remember."
03:19;03:28;"♪ People dancing, people laughing, a man selling ice cream, singing Italian songs. ♪"
03:28;03:32;"It seems very complex and no shocker there, it's Chicago."
03:32;03:34;"It's, uh, jazz prog."
03:34;03:41;"And this was a Saturday in the park, in, not on the fourth of July, but in late July in Chicago."
03:41;03:43;"So that was a request."
03:43;03:46;"There's just been so many over this tour."
03:46;03:52;"And I've been debating if, now that we know some of, like, the classic requests, you know,"
03:52;03:57;"I know sometimes people just make a blanket request for a band or an artist or the songs."
03:57;04:00;"And I've wondered, should we, like, learn these songs better?"
04:00;04:01;"And then I realized, no."
04:01;04:04;"I love the vibe of just being on stage and just everybody like,"
04:04;04:06;"""Uh, I think maybe it goes like this."
04:06;04:07;"Like, I think we got to keep it loose."""
04:07;04:16;"♪ Saturday in the park, I think it was the fourth of July. ♪"
04:16;04:24;"♪ Saturday in the park, I think it was the fourth of July. ♪"
04:24;04:37;"♪ People dancing, people laughing, a man selling ice cream, singing Italian songs. ♪"
04:37;04:44;"♪ If your body says nothing, can you dig it? ♪"
04:44;04:50;"♪ Yes, I can. I've been waiting such a long time. ♪"
04:50;04:55;"♪ Saturday. ♪"
04:55;04:58;"I mean, I don't know if you want to, like, peek too much behind the curtain,"
04:58;05:02;"but, like, is there someone googling the song and bringing up the chords on,"
05:02;05:06;"on a, on like a teleprompter or, like, are you just totally..."
05:06;05:09;"No, no, I mean, maybe we could try that eventually."
05:09;05:11;"It would still be pretty loose."
05:11;05:15;"We kind of just have a system where generally see if any of the people playing, you know, like,"
05:15;05:19;"harmonic instruments know where to start."
05:19;05:24;"So it's usually, most of the time, be Colin on guitar, Will on keys."
05:24;05:27;"And if one of them knows it, they're kind of standing next to each other"
05:27;05:30;"and Baio's over there kind of being like, ""Oh, wait, wait, wait."""
05:30;05:33;"So sometimes they're just kind of talking to each other."
05:33;05:36;"Oh, there's Cranberries Linger the other day."
05:36;05:40;"We get a decent amount of requests for Mountain Brews,"
05:40;05:42;"which I'd like to get back in rotation."
05:42;05:45;"I attempted it one night, but I was kind of on the fly trying to remember,"
05:45;05:48;"like, ""Oh, yeah, that's a minor five."""
05:48;05:49;"I'll send you those chords."
05:49;05:50;"Yeah."
05:50;05:52;"♪ Sunday morning, why don't we go for a hike? ♪"
05:52;05:54;"♪ Meet at the trailhead ♪"
05:54;05:55;"I got to remember that's minor there."
05:55;05:58;"♪ Meet at the trailhead, lie around a quarter to three ♪"
05:58;05:59;"Yeah, it's a G minor there."
05:59;06:01;"That's another funny thing."
06:01;06:03;"Sometimes we're doing it totally in the wrong key."
06:03;06:05;"And, like, I started singing and it's so high."
06:05;06:07;"It seems really hard to do."
06:07;06:09;"I mean, even if, like, I mean, you said,"
06:10;06:12;"""Wait, what did you just say before Mountain Brews?"""
06:12;06:13;"Oh, Cranberries Linger."
06:13;06:14;"Oh, Linger."
06:14;06:18;"I was like, it's such like a weird kind of slippery melody in the verse."
06:18;06:19;"You know, it's like..."
06:19;06:21;"Oh, yeah, I can't remember the verse at all."
06:21;06:25;"Luckily, I've always had this, even going back to, like, my high school days,"
06:25;06:28;"my middle school days, Sophisticated Up's days."
06:28;06:30;"I mean, I can get embarrassed about all sorts of stuff."
06:30;06:32;"But one thing I've never been embarrassed about is"
06:32;06:36;"standing on a stage in front of people and going, ""Nah, nah, nah."""
06:36;06:37;"I don't know why."
06:37;06:40;"Like, if I forget the words to our song or..."
06:40;06:43;"Because we used to, like, with the stuff I played on the show"
06:43;06:47;"when we had, like, Wes on, we're going into our early work."
06:47;06:50;"We would just go play these songs and, like, I would never even finish the lyrics."
06:50;06:54;"And I just kind of sometimes make it up on the fly."
06:54;06:56;"So, yeah, it is hard."
06:56;06:59;"And sometimes we start it and I'll just be like, ""Oh, I can't remember the verse."""
06:59;07:02;"And, you know, we keep it extremely loose."
07:02;07:04;"So you have no lyrical prompt either."
07:04;07:06;"Like, I wouldn't know the first words of Linger."
07:07;07:08;"No, no, no."
07:08;07:08;"Not on..."
07:08;07:08;"♪ If I were to you ♪"
07:08;07:11;"♪ And I'm not a new ♪"
07:11;07:13;"No, I couldn't remember the verse at all."
07:13;07:14;"All I could remember was,"
07:14;07:19;"♪ Do you have to, do you have to, do you have to let it linger ♪"
07:19;07:22;"Yeah, it's funny how often you feel like you know a song"
07:22;07:24;"and then you totally blank on the verse."
07:24;07:28;"♪ You know I'm such a fool for you ♪"
07:28;07:31;"Wow."
07:31;07:36;"♪ If you could return ♪"
07:36;07:39;"♪ Don't let it burn ♪"
07:39;07:41;"♪ Don't let it fade ♪"
07:41;07:43;"♪ I'm sure I'm not the new ♪"
07:43;07:46;"♪ But it's just your attitude ♪"
07:46;07:48;"♪ It's tearing me apart ♪"
07:48;07:52;"♪ It's ruining everything ♪"
07:52;07:56;"♪ For I've been so out of control ♪"
07:56;08:00;"♪ I'm having so much fun ♪"
08:00;08:04;"♪ So why are you holding your head ♪"
08:04;08:06;"♪ Is that the way we stand ♪"
08:06;08:09;"♪ We're lying all the time ♪"
08:09;08:11;"♪ Was it just a game to you ♪"
08:11;08:16;"♪ Let it mix and blend ♪"
08:16;08:19;"♪ You know I'm such a fool for you ♪"
08:19;08:23;"♪ You got me wrapped around your finger ♪"
08:23;08:29;"♪ Do you have to let it linger ♪"
08:29;08:30;"♪ Do you have to ♪"
08:31;08:34;"♪ Do you have to let it linger ♪"
08:34;08:37;"It would be great to get Mountain Brews back in rotation"
08:37;08:40;"and take a harder look at it."
08:40;08:42;"But the people are hungry for it."
08:42;08:45;"I bet I've seen people requesting that four or five times."
08:45;08:47;"I'd love to hear it."
08:47;08:48;"Oh, and I was just going to say,"
08:48;08:50;"speaking of Chicago and Mountain Brews,"
08:50;08:52;"I remember that episode we did in the hotel."
08:52;08:55;"That was the week that I uploaded Mountain Brews"
08:55;08:58;"to the streaming services."
08:58;08:59;"Oh, crazy."
08:59;09:01;"And we did, we listened to like,"
09:01;09:03;"maybe the whole EP, I forget,"
09:03;09:06;"on that episode in the hotel room."
09:06;09:09;"So Mountain Brews was like brand new June of 2019."
09:09;09:11;"Five years of brews."
09:11;09:13;"Five years of brews, bro."
09:13;09:15;"I was revisiting some brews recently."
09:15;09:18;"♪ It's a strong choice, my friend ♪"
09:18;09:24;"♪ You to show up with a hand to lend ♪"
09:24;09:25;"Not going to hold you to it,"
09:25;09:30;"but we all may be in New York at the MSG shows."
09:30;09:33;"Would you bring Jake out to do Mountain Brews?"
09:33;09:34;"Definitely consider it."
09:34;09:36;"Yeah, I think the streets might want it."
09:36;09:38;"Definitely consider it."
09:38;09:43;"Yeah, I think we're planning on going to the matinee show."
09:43;09:44;"Yeah, that'll be fun."
09:44;09:47;"I mean, maybe I would go to both if I could swing it."
09:47;09:48;"We're going to be there with our kid and stuff,"
09:48;09:51;"but I want to bring her to the matinee show."
09:51;09:54;"And then if I do brews,"
09:54;09:56;"I would just blow her lid."
09:56;09:58;"Bring the house down."
09:58;10:02;"Oh yeah, seeing daddy on stage at the garden."
10:02;10:05;"Seeing your favorite band on stage too."
10:05;10:07;"Lizzie's a vampire head."
10:07;10:08;"Yeah, she is."
10:08;10:10;"She always says vampire."
10:10;10:11;"Yeah."
10:11;10:12;"Love that."
10:12;10:13;"Yeah."
10:13;10:15;"There's an interesting conversation happening"
10:15;10:18;"that is pure TC just before I jumped on,"
10:18;10:21;"which is that Jake is drinking..."
10:21;10:23;"Drake."
10:24;10:25;"Well, I was wondering what Jake..."
10:25;10:27;"Ladies and gentlemen, Drake."
10:27;10:30;"Filling in for Seinfeld today."
10:30;10:34;"I asked Jake what he was drinking"
10:34;10:35;"because it looked like tequila"
10:35;10:38;"and we're on the early side,"
10:38;10:40;"but we're getting in."
10:40;10:41;"We're getting into it."
10:41;10:43;"And he said he was drinking..."
10:43;10:45;"What is it?"
10:45;10:47;"Glacial Cherry Gatorade."
10:47;10:49;"Yeah, and I held up the glass."
10:49;10:53;"It does look exactly like tequila and soda"
10:53;10:54;"with some lime juice in there."
10:54;10:57;"Wait, but it's a glacial cherry."
10:57;11:00;"The color is like a slightly milky white."
11:00;11:02;"Yeah, it's a milky white."
11:02;11:03;"I guess that's a little cooler than..."
11:03;11:06;"If this was like a tequila and soda"
11:06;11:07;"with a little lime in there,"
11:07;11:08;"it'd be a little warmer."
11:08;11:10;"That could be a margarita."
11:10;11:12;"A kind of pale margarita."
11:12;11:13;"What?"
11:13;11:15;"A pale margarita."
11:15;11:16;"Yeah."
11:16;11:17;"Pale margarita."
11:17;11:18;"I like that as a title."
11:18;11:20;"Yeah, that'd be a good song."
11:20;11:21;"But I'm drinking this Gatorade"
11:21;11:25;"because I'm recovering from a slight surgery,"
11:25;11:27;"a small surgery I had last week."
11:27;11:29;"This is great internet radio."
11:29;11:32;"I had a deviated septum corrected last week."
11:32;11:34;"So I'm still recovering from this surgery."
11:34;11:37;"So I'm not feeling great."
11:37;11:38;"I've been sleeping terribly."
11:38;11:42;"I'm on like day five of this recovery."
11:42;11:44;"I'm pretty congested if you can hear that."
11:44;11:48;"But I've had this crooked piece of cartilage"
11:48;11:52;"in my nose for the last 45 years or whatever."
11:52;11:54;"And I got it corrected because my sleep"
11:54;11:57;"and my nasal breathing has been kind of"
11:57;11:58;"worsening over the years."
11:58;12:01;"And so I'm drinking Gatorade tonight."
12:01;12:03;"I've heard a lot of people say that surgery"
12:03;12:05;"changed their life for the better."
12:05;12:07;"The people I've talked to are like,"
12:07;12:09;"""Oh my God, my breathing,"
12:09;12:10;"especially when I'm sleeping,"
12:10;12:10;"is so much better."""
12:10;12:12;"So I'm psyched."
12:12;12:13;"But I'm just..."
12:13;12:15;"It's been a little earlier"
12:15;12:16;"than I maybe thought it was going to be"
12:16;12:17;"in terms of the recovery."
12:18;12:19;"Mm-hmm."
12:19;12:21;"I mean, yeah, like general anesthesia, no joke."
12:21;12:24;"That'll make you feel weird?"
12:24;12:26;"Yeah, it makes your bowels weird."
12:26;12:30;"It's just been like a funky five days."
12:30;12:30;"So I'm a little..."
12:30;12:33;"Rolling a little slow."
12:33;12:35;"So your doctor prescribed you..."
12:35;12:35;"Glacial."
12:35;12:37;"Glacial Cherry Gatorade."
12:37;12:38;"Now is that over the counter?"
12:38;12:39;"Jake, I'm gonna..."
12:39;12:41;"Just on this pad."
12:41;12:42;"Jake, I'm gonna write you a prescription here"
12:42;12:43;"for Glacial Cherry."
12:43;12:47;"To be clear, I looked it up."
12:47;12:50;"It is Glacier Cherry."
12:50;12:50;"Okay."
12:50;12:53;"Because the Glacier Cherry"
12:53;12:57;"is also a cherry that I've found"
12:57;12:58;"that was..."
12:58;13:00;"It's a dark red cherry"
13:00;13:01;"introduced and patented"
13:01;13:04;"by Washington State University."
13:04;13:06;"So it's a variety of cherry"
13:06;13:08;"that they bred."
13:08;13:09;"Yes, they bred."
13:09;13:11;"It says it's crack resistant"
13:11;13:13;"and very flavorful."
13:13;13:16;"I don't know what crack resistant means."
13:16;13:17;"But so this is a..."
13:17;13:19;"So they've taken this lab cherry"
13:19;13:22;"and they're making this."
13:22;13:23;"And it's a dark red cherry,"
13:23;13:25;"but I assume maybe on the inside"
13:25;13:26;"is more of that milky..."
13:26;13:27;"Wait, so you're telling me"
13:27;13:28;"on the Gatorade bottle,"
13:28;13:31;"it says Glacier Cherry?"
13:31;13:31;"Yes."
13:31;13:33;"So there's no such thing as Glacial Cherry?"
13:33;13:35;"That might be a..."
13:35;13:38;"A Mandela effect?"
13:38;13:39;"A Mandela effect."
13:39;13:41;"Yes, exactly."
13:41;13:43;"Wait, so if the University of Washington"
13:43;13:45;"patented the Glacier Cherry,"
13:45;13:47;"does that mean they're making big..."
13:47;13:49;"Major bank off this Gatorade?"
13:49;13:50;"Mint."
13:50;13:51;"Wait, didn't Gatorade come"
13:51;13:53;"from the University of Florida too?"
13:53;13:56;"This is an extremely collegiate drink."
13:56;13:58;"If you want to support"
13:58;14:00;"two of the great public institutions"
14:00;14:01;"of higher learning in America,"
14:01;14:03;"University of Florida"
14:03;14:04;"and Washington State,"
14:04;14:07;"drink a Glacier Cherry Gatorade."
15:21;15:22;"Actually, I'm surprised"
15:22;15:23;"we never got into this."
15:23;15:25;"Is the University of Florida"
15:25;15:27;"making bank off Gatorade?"
15:27;15:28;"That's a great question."
15:28;15:31;"I gotta think at this point,"
15:31;15:32;"it's, you know, run by some huge..."
15:32;15:35;"beverage conglomerate."
15:35;15:37;"Like they must have bought them out years ago."
15:37;15:40;"I'm gonna guess that."
15:40;15:41;"I think that was developed"
15:41;15:42;"for like the football team"
15:42;15:43;"because those crazy like..."
15:43;15:47;"practicing in that Florida humidity"
15:47;15:47;"in the summer."
15:47;15:50;"Gotta replenish those electrolytes, boys."
15:50;15:52;"I'm not sure how,"
15:52;15:54;"but it does say here"
15:54;15:55;"that Gatorade has brought"
15:55;15:57;"more than $80 million"
15:57;15:58;"to the University of Florida."
15:58;16:00;"Yeah, I mean, even if they're just getting"
16:00;16:01;"like 1% or something,"
16:01;16:03;"that's pretty good."
16:03;16:04;"So how much money"
16:04;16:05;"has the Glacier Cherry made"
16:05;16:08;"for the University of Washington?"
16:08;16:09;"It's correct in the books."
16:09;16:09;"Unclear."
16:09;16:12;"We gotta get Seinfeld on those numbers."
16:12;16:13;"So it's Gatorade"
16:13;16:15;"because of the Gator football team?"
16:15;16:15;"Yeah."
16:15;16:16;"Because of the Gators."
16:16;16:16;"All right."
16:16;16:17;"Yeah."
16:17;16:19;"We haven't talked about this?"
16:19;16:20;"On the show?"
16:20;16:22;"I'm sure that part's..."
16:22;16:24;"I'm sure it's come up before."
16:24;16:26;"But Jake, what drew you to Glacier Cherry"
16:26;16:28;"in your time of need?"
16:28;16:29;"I think the appearance of it."
16:29;16:31;"It is the sort of like"
16:31;16:32;"very neutral,"
16:32;16:33;"almost kind of dishwater looking."
16:33;16:37;"When you put it that way,"
16:37;16:38;"it doesn't sound that appealing."
16:38;16:40;"It doesn't sound that good, does it?"
16:40;16:41;"Is it the milkiness?"
16:41;16:43;"I think it's the milkiness."
16:43;16:45;"It doesn't have like an obvious..."
16:45;16:47;"It's the milk of human kindness."
16:47;16:48;"Yeah, something..."
16:48;16:50;"I mean, I've never been a fan of like"
16:50;16:51;"that sort of like"
16:51;16:52;"engine coolant blue,"
16:52;16:55;"that flavor that's really like a popular one."
16:55;16:58;"I've always been a classic lemon lime,"
16:58;16:58;"you know, but I just..."
16:58;17:01;"That felt like a little bit too acidic"
17:01;17:05;"and it was a little too"
17:05;17:09;"souped up for my situation."
17:09;17:10;"Yeah, so then maybe the milkiness"
17:10;17:12;"seemed kind of..."
17:12;17:14;"I'm in sort of a vulnerable spot right now."
17:14;17:15;"So I needed..."
17:15;17:15;"Yeah."
17:15;17:17;"Just kind of a more mellow Gatorade."
17:17;17:18;"And I've been drinking it"
17:18;17:20;"with a lot of ice."
17:20;17:21;"Let the ice kind of melt."
17:22;17:25;"Kind of chill the Gatorade out a little bit."
17:25;17:25;"Dilute it."
17:25;17:27;"Melting Glacier."
17:27;17:29;"Melting Glacier Cherry."
17:29;17:31;"Melting Glacier would be like the cocktail version"
17:31;17:33;"that actually does have tequila."
17:33;17:36;"You put one of those giant ice cubes"
17:36;17:39;"they have at like artisanal cocktail bars"
17:39;17:42;"and watch it melt into a glass filled"
17:42;17:44;"with Glacier Cherry Gatorade,"
17:44;17:47;"tequila and I don't know,"
17:47;17:50;"some Angostura."
17:51;17:52;"Something feels very..."
17:52;17:54;"I think like a weird dystopian cocktail"
17:54;17:56;"where they have like those huge ice cubes,"
17:56;17:57;"but they're actually like..."
17:57;18:01;"This is actually from a glacier in Antarctica."
18:01;18:03;"Right."
18:03;18:07;"True like 0.1% like billion stuff."
18:07;18:08;"I thought you were going to say"
18:08;18:11;"the ice cube is a giant Gatorade."
18:11;18:12;"Oh, that'd be cool too."
18:12;18:16;"Wait, are you talking about the Icelandic water"
18:16;18:18;"that's the bottle is shaped like a mountain?"
18:18;18:20;"And it's very expensive."
18:20;18:21;"No, not that one."
18:21;18:25;"No, no, but that seems like a solid water."
18:25;18:27;"I think we uncovered something very interesting"
18:27;18:29;"that Glacier Cherry Gatorade"
18:29;18:31;"is probably one of the only"
18:31;18:34;"mainstream beverages on the market"
18:34;18:38;"which shares proceeds with two public universities."
18:38;18:39;"I find that fascinating."
18:39;18:43;"There must be all sorts of other weird stuff like that,"
18:43;18:46;"like some kind of technology developed at a school"
18:46;18:48;"that then gets used in..."
18:49;18:50;"Military application."
18:50;18:52;"Yeah, or computers."
18:52;18:54;"Yeah, how about that Seinfeld?"
18:54;18:55;"Let's see if you can find anything just like"
18:55;19:01;"schools that own extremely lucrative patents."
19:01;19:04;"I wonder if it was like a team that developed Gatorade"
19:04;19:06;"or it might've just been one dude."
19:06;19:10;"I'm honestly surprised it was not like some HBO movie"
19:10;19:12;"about like the creation of Gatorade."
19:12;19:16;"That's Jerry Seinfeld's next film for Netflix."
19:18;19:20;"Or that's our version of his ""Unfrosted"""
19:20;19:22;"which I don't know if we ever talked about on the show,"
19:22;19:23;"but if you haven't seen it,"
19:23;19:27;"that's Jerry Seinfeld's highly zany satirical"
19:27;19:35;"take on the true story of the toaster cake wars"
19:35;19:38;"between Kellogg's and Post."
19:38;19:40;"So it's basically about the development"
19:40;19:42;"of the Pop-Tart in the '60s."
19:42;19:44;"Yeah, it could be something about like Gatorade"
19:44;19:45;"versus Powerade."
19:45;19:47;"I could see it being kind of a cool movie"
19:48;19:50;"like if it was, yeah, just sort of like that."
19:50;19:51;"If you really get the, like,"
19:51;19:55;"you capture the time and place of like early '80s"
19:55;19:57;"college football in Florida."
19:57;20:00;"Well, I think it's more like '60s, isn't it?"
20:00;20:01;"Oh, is it?"
20:01;20:02;"Okay, well, here we go."
20:02;20:03;"Yeah, what do we got?"
20:03;20:05;"Oh, we got an article here from Forbes,"
20:05;20:08;"top patent revenue generating universities."
20:08;20:11;"A lot of pharmaceuticals,"
20:11;20:16;"mostly pharmaceuticals is what I'd tell you right here."
20:17;20:17;"Number one."
20:17;20:18;"Oh, really?"
20:18;20:21;"I thought it was gonna be mostly beverages."
20:21;20:22;"That's disappointing, but go on."
20:22;20:23;"Very low on the Bev."
20:23;20:27;"Number one, New York University,"
20:27;20:30;"Remicade, a rheumatoid arthritis drug"
20:30;20:35;"brings in hundreds of millions a year for NYU."
20:35;20:36;"Really?"
20:36;20:37;"That's funny 'cause isn't that famously"
20:37;20:40;"one of like the most expensive school in America?"
20:40;20:42;"It's up there."
20:42;20:45;"Where's all that Remicade money going NYU?"
20:45;20:48;"I guess that's why they buy all that expensive real estate."
20:48;20:51;"How about number two, Wake Forest University?"
20:51;20:53;"Cashing in on that."
20:53;20:56;"Kinetic Technologies virtual endoscopy machine,"
20:56;21:00;"licensed to GE Medical, a unit of General Electric."
21:00;21:04;"Wake Forest is like, is a big name in college sports."
21:04;21:05;"I feel like I always hear it."
21:05;21:09;"So somewhere there's definitely somebody who hates them"
21:09;21:12;"and roots for their rival and has to get a virtual endoscopy."
21:12;21:16;"Some UNC fan is just pulling a gasket."
21:16;21:20;"Just a hardcore football fan from Chapel Hill willing to die."
21:20;21:22;"You gotta do your research folks."
21:22;21:27;"If you're a college sports nut, you have no idea"
21:27;21:30;"what kind of money you're putting out to your enemies"
21:30;21:32;"just in day-to-day life."
21:32;21:34;"What's number three on that list?"
21:34;21:35;"This is actually more interesting"
21:35;21:36;"than I thought it was gonna be."
21:36;21:39;"Well, Jake, you know all about HydroGlobe, right?"
21:39;21:41;"Which removes lead and arsenic from water."
21:42;21:43;"Okay, you're gonna love this."
21:43;21:44;"Use it every day."
21:44;21:45;"You're gonna love this."
21:45;21:49;"It was sold to Graver Technologies, a filtration manufacturer."
21:49;21:54;"And next year, let me check the date of this article."
21:54;21:58;"Oh, it's from 2008."
21:58;22:02;"This article may be more than 15 years old."
22:02;22:07;"It takes so many years to patent something."
22:07;22:10;"I feel like as far as we're concerned, this is current."
22:10;22:14;"Okay, but what's the upshot with this HydroGlobe technology?"
22:14;22:19;"Well, in '09, it was on track to make $50 million just that year."
22:19;22:20;"Wait, for what university?"
22:20;22:24;"Oh, that was from the Stevens Institute of Technology."
22:24;22:25;"Where's that?"
22:25;22:26;"Is that in New Jersey?"
22:26;22:30;"Stevens Institute."
22:30;22:32;"That's actually in Hoboken, yeah."
22:32;22:34;"I knew it."
22:34;22:35;"Nailed it."
22:35;22:36;"You can't get Jersey facts past me."
22:37;22:42;"All right, everybody, keep removing that lead and arsenic from your water"
22:42;22:45;"and send those sweet dollars back to Hoboken."
22:45;22:47;"The numbers are crazy though."
22:47;22:49;"That's a real game changer."
22:49;22:56;"You know, and also, you think about how much people talk about the emphasis on sports"
22:56;22:57;"and some people are like, ""You know what?"
22:57;22:59;"There's too much emphasis on sports at the college level."""
22:59;23:02;"And then people say, ""You know how much money that brings in for the school?"""
23:03;23:07;"Next time somebody says that, I got one word for you."
23:07;23:08;"Remicade."
23:08;23:10;"Oh, virtual..."
23:10;23:14;"And virtual endoscopy."
23:14;23:16;"I got one word for you."
23:16;23:19;"I got one, two words for you."
