Start Timestamp;End Timestamp;Transcript
23:19;23:21;"I got one, two word phrase for you."
23:21;23:24;"Virtual endoscopy."
23:25;23:30;"I remember the 35 sweet goodbyes"
23:30;23:36;"When you put me on the Wolverine of Duane and Dare"
23:36;23:42;"It was still September"
23:42;23:45;"When your daddy was quite surprised"
23:45;23:51;"To find you with the working girls in the county jail"
23:52;23:58;"I was smoking with the boys upstairs"
23:58;24:01;"When I heard about the whole affair"
24:01;24:07;"I said, ""Whoa, no, William and Mary won't do that"""
24:07;24:13;"Well, I did not think the girl could be so cruel"
24:16;24:22;"And I'm never going back to my old school"
24:22;24:33;"It's also funny because NYU is famously the least athletic major school in America."
24:33;24:40;"Because even the Ivy League schools do have a real sports tradition."
24:41;24:48;"Even at the schools like Harvard and Yale, which are famous, have these..."
24:48;24:54;"For lack of a better word, super nerds go there."
24:54;24:57;"Even they have these famous football games and this and that."
24:57;24:59;"NYU, no football team."
24:59;25:02;"Downtown Manhattan, just not a sports school."
25:02;25:08;"And I do find this very interesting that if anybody is ever like,"
25:08;25:10;"""Oh yeah, NYU, no school spirit."
25:10;25:13;"They don't have a football team to rally behind or get excited about."""
25:13;25:15;"It's like, ""Yeah, they have something else to get excited about."
25:15;25:16;"Ramacade."""
25:16;25:21;"And it makes more money than the whole f*** Crimson Tide."
25:21;25:26;"So for all you college sports fans, look into pharmaceuticals."
25:26;25:28;"I'm a college pharmaceuticals fan."
25:28;25:30;"Get off the field and into the lab, fellas."
25:30;25:33;"I'm a fan of that real estate portfolio."
25:33;25:34;"Yeah."
25:34;25:39;"There's going to be a fugitive style thing where there's some weird..."
25:40;25:44;"Corruption and murders happening around NYU."
25:44;25:49;"And they discover that all the proceeds from Ramacade"
25:49;25:52;"are being funneled into real estate deals in Manhattan."
25:52;25:54;"Oh, it's very John Grisham."
25:54;25:57;"Ramacade is such a perfect name for a movie like that."
25:57;26:01;"Just like somebody's dying and is just like, ""Tell me, what is it?"""
26:01;26:03;"And the guy's just like, ""Ramacade."""
26:03;26:06;"""Ramacade."""
26:06;26:09;"You can picture a movie where people throughout the whole movie are just going..."
26:09;26:14;"Just flipping through like a thousand page dossier and it's just ""Ramacade."""
26:14;26:15;"""Ramacade."""
26:15;26:17;"All this says so much ""Ramacade."""
26:17;26:18;"It was Ramacade the whole time."
26:18;26:24;"The art department would have a lot of fun designing that Ramacade vial."
26:24;26:25;"Don't you think?"
26:25;26:29;"The Ramacade vial that dramatically falls in slow motion and shatters on the ground at one point."
26:29;26:31;"Ramacade."
26:31;26:32;"It wasn't Benzedrine."
26:32;26:32;"It was Ramacade."
26:32;26:34;"It was Ramacade the whole time."
26:34;26:36;"Wait, wait."
26:36;26:38;"Actually, maybe I glossed over this before."
26:38;26:39;"What's Ramacade for?"
26:39;26:41;"Rheumatoid arthritis."
26:41;26:42;"Perfect."
26:42;26:46;"So like the Michael Clayton character or whatever,"
26:46;26:51;"be visiting a really old person who's just like can't write or type."
26:51;26:53;"And you know, it's like, there's somebody who's involved in the labs."
26:53;26:55;"It's an old professor."
26:55;26:57;"Yes."
26:57;26:57;"Forget it, Jake."
26:57;26:58;"It's Ramacade."
26:58;27:05;"I've been scrolling down this list and I got to number eight."
27:05;27:06;"And you're going to love this."
27:06;27:09;"It's the University of Florida with Gatorade."
27:09;27:10;"Right in the mix."
27:10;27:11;"Number eight."
27:11;27:12;"Great."
27:12;27:13;"Top 10."
27:13;27:14;"How much are they pulling in a year?"
27:14;27:15;"2008."
27:15;27:17;"Doesn't say."
27:17;27:21;"Oh, well, it looks like it's in the $40 million range."
27:21;27:22;"Per year?"
27:22;27:24;"Nothing to sneeze at."
27:24;27:26;"Yeah, that was in '06."
27:26;27:28;"Oh, wait a second, though."
27:28;27:35;"They're also spending $450 million on research across the board."
27:35;27:35;"For Gatorade?"
27:36;27:38;"For all research at the university."
27:38;27:42;"So I don't think this is a net."
27:42;27:44;"This is not a net profit situation for."
27:44;27:45;"Yeah, I don't like that."
27:45;27:46;"I don't like that."
27:46;27:48;"You got to know when to hold them and know when to fold them."
27:48;27:50;"University of Florida, you got a good thing going."
27:50;27:53;"$40 million a year to spend all research."
27:53;27:56;"I know you think you're going to find another Gatorade,"
27:56;27:58;"but that might be a once a century kind of thing."
27:58;28:03;"Close down all of your research departments, shut down the labs,"
28:03;28:04;"and just let that money flow in."
28:05;28:09;"And you can have more ice cream socials for the students,"
28:09;28:15;"multiple shows every semester with really weird bills."
28:15;28:18;"Yo, Gatorade campaign."
28:18;28:23;"Gatorade wipes out all student debt just at the University of Florida."
28:23;28:25;"Think about that."
28:25;28:30;"Meaning that nobody goes into debt who goes to the University of Florida."
28:30;28:31;"There's no student loans."
28:32;28:36;"Retroactively, any alumni of the University of Florida who owns student debt,"
28:36;28:38;"Gatorade wipes it out."
28:38;28:42;"And they put that into a big marketing spot that airs during the Super Bowl."
28:42;28:43;"That's sweet."
28:43;28:44;"That's tight."
28:44;28:45;"Thank you."
28:45;28:47;"I don't know if NYU is doing that with Remicade."
28:47;28:50;"An underscore share."
28:50;28:53;"Gatorade 1965."
28:53;28:56;"Yeah, because it was just a powder at first."
28:56;28:58;"When you picture the powder, it's way more 60s."
28:58;28:58;"Like Tang."
28:58;29:00;"Space age."
29:00;29:01;"Yeah."
29:01;29:05;"So an undisclosed share of the Gatorade profits flow to a Gatorade trust."
29:05;29:10;"And that trust then shares 20% of the profits to the university."
29:10;29:13;"But, you know, redacted."
29:13;29:14;"The Gatorade trust."
29:14;29:18;"Well, maybe now is not the time, but we'll do some research one of these days,"
29:18;29:20;"because I'm curious about it too."
29:20;29:24;"Obviously, the research came out of the university, but was it a whole team?"
29:24;29:26;"Was it a, you know, a decades long?"
29:26;29:27;"It was a professor."
29:27;29:30;"It employed the professor who invented the drink."
29:30;29:31;"I mean, this is one guy."
29:31;29:32;"So what does he get?"
29:32;29:34;"What's his name?"
29:34;29:36;"Let me find his name."
29:36;29:39;"I have a feeling this is one of those situations."
29:39;29:44;"I've been in this situation where you just do not own any of the IP"
29:44;29:47;"because you were employed by a larger company."
29:47;29:51;"I think he took security over risk."
29:51;29:53;"And so I bet he sees none of it."
29:53;29:55;"You would help develop a sports drink, Nick?"
29:55;29:57;"I'm like my friend, Robert Cade."
29:58;30:05;"At born in San Antonio in 1927, inventor of Gatorade."
30:05;30:09;"So, oh, so the aid comes from his name, Cade."
30:09;30:11;"Interesting."
30:11;30:14;"I think it's meant to aid the Florida Gators."
30:14;30:19;"Yes, but it has more than a coincidence."
30:19;30:21;"His name is Cade."
30:21;30:23;"But it's spelled A-D-E like in his name."
30:23;30:24;"Last name is C-A-D-E."
30:24;30:25;"Yes."
30:25;30:25;"Oh, yeah."
30:25;30:26;"Good call."
30:26;30:27;"It's not Gator A-I-D."
30:28;30:30;"God, imagine you're that guy or his family."
30:30;30:35;"And well, let's try to do some research about how much he got paid."
30:35;30:38;"But also, you helped create a new suffix."
30:38;30:42;"So then you see the Coca-Cola company invents Powerade."
30:42;30:47;"And you know that damn well that that came in a sense from your own your family name."
30:47;30:52;"Your family who worked the mean streets of San Antonio,"
30:52;30:57;"who toiled the hard earth of Texas for centuries."
30:57;31:02;"And you invent something amazing that has an influence all around the world"
31:02;31:04;"and even sparks other products."
31:04;31:06;"He led a research team."
31:06;31:07;"It wasn't just him."
31:07;31:11;"But I mean, I feel like he's it's his product."
31:12;31:16;"My mouth is red from day to day."
31:16;31:20;"I wish that I could make a trade."
31:20;31:22;"The sun is hot."
31:22;31:29;"I try not to see my friends with clocks for heads."
31:29;31:35;"Makes me think about it more instead."
31:38;31:42;"Everybody's reaching out to me."
31:42;31:51;"Everybody's reaching out to me."
31:51;31:55;"Well, I heard actually he took a lot of the credit for it."
31:55;32:01;"There was actually a janitor at the University of Florida who came up with a fundamental idea."
32:01;32:02;"The marketing team."
32:02;32:05;"His name was Richard Montanez."
32:05;32:12;"Yeah, this is a good transition because there's a major TC story out there in the world right now."
32:12;32:17;"And it has to do with this idea of A) working for a larger company."
32:17;32:18;"You help out with something."
32:18;32:23;"But you know, not everybody is going to always have equity."
32:23;32:26;"And even this idea of like, well, who invented a product?"
32:26;32:30;"Can it really be one person who took the credit?"
32:30;32:34;"Or is it sometimes something more boring like a whole team?"
32:34;32:36;"Like maybe a guy's running a team or something."
32:36;32:38;"Which actually kind of makes you think about Oppenheimer too."
32:38;32:41;"He was running a team, but he's..."
32:41;32:44;"They named the movie after him."
32:44;32:45;"Not any of those other dudes."
32:45;32:50;"I wonder if any of those guys, if they were alive today, would just be like,"
32:50;32:52;"""You call the movie Oppenheimer?"
32:52;32:53;"Come on."""
32:53;32:59;"Like, you know, like the Scotty Pippen of the atomic bomb just being like, ""We were a team, man."""
32:59;33:04;"I love that connection you're drawing between Flamin' Hot Cheetos and the atomic bomb."
33:04;33:09;"Just amazing American inventions."
33:09;33:10;"The atomic bomb."
33:10;33:15;"Oppenheimer and his research team."
33:15;33:19;"And in the middle of that, in the days between, Gatorade."
33:19;33:23;"I mean, both the bomb and the chips, they're both Flamin' Hot."
33:23;33:27;"Arguably, both very spicy in their own ways."
33:27;33:29;"That's right."
33:29;33:30;"That's one way to put it."
33:30;33:32;"Oppenheimer, at first, he just wanted to..."
33:32;33:35;"They said, ""What do you want to call it?"""
33:35;33:36;"And he's like, ""It's just a bomb."""
33:36;33:40;"And they said, ""Yeah, but it's like something special about this bomb."
33:40;33:41;"It's not just any bomb."
33:41;33:42;"It's a new kind of bomb."""
33:42;33:46;"And he said, ""Yeah, just Flamin' Hot bomb?"
33:46;33:48;"Spicy bomb?"""
33:48;33:57;"What's the scene in Flamin' Hot where they keep trying the different Cheetos with the sun,"
33:57;33:59;"and he's finally like, ""Bad spicy."""
33:59;33:59;"Oh, yeah."
33:59;34:00;"It's that runner."
34:00;34:02;"Yeah, and they go, ""Good or bad spicy?"
34:02;34:04;"Good spicy or bad spicy?"""
34:04;34:06;"""Good spicy."""
34:06;34:08;"Scene like that in Oppenheimer would have been nice."
34:08;34:09;"Well, yeah."
34:09;34:11;"What about cool?"
34:11;34:12;"What about cool when they're testing the weapon?"
34:12;34:16;"Just at Los Alamos, they finally..."
34:16;34:22;"The first successful nuclear detonation just cuts to Benny Safdie with the sunglasses"
34:22;34:24;"and the sunscreen on his face."
34:24;34:26;"And he just goes, ""Good spicy."""
34:26;34:27;"""Good spicy."""
34:27;34:33;"Just Cheetos dust all over the goggles for some reason."
34:33;34:38;"Now that's what I call good spicy."
34:38;34:40;"This is also like..."
34:40;34:46;"We were about to talk about something so uniquely current for TC, the Montañez lawsuit,"
34:46;34:51;"and yet now we're talking about a movie so associated with last summer."
34:51;34:54;"But we never did an Oppenheimer rundown on this."
34:54;35:00;"I guess it's understood that Oppenheimer was the team leader, and he did have a dream team."
35:00;35:03;"But it makes sense to focus on him."
35:03;35:09;"And I guess also the movie is not just about the development of the atomic bomb."
35:09;35:10;"It's also about what happened to him after."
35:10;35:15;"So it makes sense to call the movie Oppenheimer."
35:15;35:18;"Yeah, I was okay with it being called Oppenheimer."
35:18;35:19;"""Remicade."""
35:19;35:21;"It's interesting."
35:21;35:24;"Gatorade and ""Remicade"" could be a good song."
35:24;35:29;"Circling back to that, I'm just picturing all those luxury condos in Tribeca that are"
35:29;35:33;"sitting empty because it's all part of the ""Remicade"" scam."
35:33;35:34;"Right."
35:34;35:38;"All these leases are made out to ""Remicade."""
35:38;35:39;"Yeah."
35:39;35:41;"Okay, wait, let's..."
35:41;35:41;"Hold on."
35:41;35:42;"We're all over the place."
35:42;35:44;"This is a mess of an episode."
35:44;35:47;"Let's drill down on Montañez."
35:47;35:48;"Okay."
35:49;35:51;"So, I mean, we almost had a perfect segue."
35:51;35:56;"So if you haven't heard, major, major news."
35:56;36:01;"This is a story that we've been covering doggedly for years."
36:01;36:07;"I mean, I feel like Jake first brought up this story about Flaminato Cheetos years before"
36:07;36:08;"the movie."
36:08;36:12;"I just remember Jake simply saying, ""Did you know that the Flaminato Cheetos were invented"
36:12;36:14;"by a janitor at Frito-Lay?"""
36:14;36:15;"We love the story."
36:15;36:17;"We love Montañez."
36:17;36:19;"We talked about him."
36:19;36:20;"We were excited for the movie."
36:20;36:28;"But right around the time the movie was coming out, the LA Times wrote a piece basically"
36:28;36:34;"trying to say that Montañez was telling a bit of a tall tale and that Flaminato Cheetos"
36:34;36:39;"was developed by a team at Frito-Lay and he wasn't particularly involved in the development,"
36:39;36:44;"but he still was a beloved icon of Hispanic marketing."
36:44;36:48;"And Frito-Lay didn't really have anything bad to say about him."
36:48;36:52;"They just put out a statement saying something along the lines of, ""Oh, we love Richard."
36:52;36:57;"That's not exactly how it went down, but he's a great dude."""
36:57;37:00;"Nothing in our records indicate his involvement."
37:00;37:06;"Yeah, they said something about as nice as they could, considering that they were basically"
37:06;37:07;"calling him a liar."
37:07;37:10;"But so whatever, Frito-Lay wasn't taking him down."
37:10;37:14;"But of course, he still felt the heat, no pun intended."
37:14;37:21;"And we talked about the fact on this show that the Biden White House hosted a screening"
37:21;37:25;"of Flamin' Hot and they invited the stars of the film."
37:25;37:30;"They invited Eva Longoria, who directed it, but they didn't invite Richard Montañez,"
37:30;37:34;"which I can't remember where we fell on it last time we talked about it."
37:34;37:38;"But as I think about it now, I kind of feel like either invite Montañez or don't show"
37:38;37:39;"the movie."
37:39;37:40;"How about that?"
37:40;37:41;"Check it out."
37:41;37:45;"Oh, you got places to go"
37:45;37:47;"You're not going this slow"
37:47;37:50;"Oh, no, no, no, no, no"
37:50;37:54;"They will tell you you're crazy"
37:54;37:55;"They will call you a fool"
37:55;37:58;"They will think they can stop you"
37:58;38:00;"But there's no stopping you"
38:00;38:06;"They can't put out what you got inside you"
38:06;38:10;"No way to put out that flame"
38:10;38:13;"Nothing can hold you back"
38:13;38:14;"No one can kill you back"
38:14;38:19;"When you got the fire inside"
38:19;38:21;"When you got the fire inside"
38:21;38:25;"And oh, you're gonna own this life"
38:25;38:29;"'Cause you got the fire inside"
38:29;38:32;"'Cause you got the fire, you got the fire"
38:34;38:40;"My theory on this is that Montañez is a bit of a loose cannon and potential,"
38:40;38:45;"not PR, potential PR issue for that film."
38:45;38:51;"Bringing him along for these events may have changed the narrative that they were trying"
38:51;38:53;"to put out there. That's just my theory."
38:53;38:54;"Yet he's in the movie."
38:54;38:57;"Wait, how though? Like what could he possibly say?"
38:57;39:03;"So don't get him on the mic, but this is one way or another, this movie is his story."
39:04;39:08;"I'm not gonna say it's a true story, but it's his story."
39:08;39:12;"Let him come to the White House, let him take a picture with Joe and Jill,"
39:12;39:15;"and you know, you don't have to let him on the mic, but like,"
39:15;39:20;"I just think, yeah, don't show the movie if you're not gonna invite Montañez."
39:20;39:25;"But anyway, this all happened a couple years ago, and now, on July 18th,"
39:25;39:28;"this is the most current we've ever been on this show,"
39:28;39:31;"Richard Montañez has filed a lawsuit against PepsiCo,"
39:31;39:36;"which of course is Frito-Lay's parent company, accusing the corporation of orchestrating"
39:36;39:37;"a smear campaign against him."
39:37;39:43;"The complaint claims Montañez was the victim of fraud, racial discrimination,"
39:43;39:47;"defamation, and violations of California's unfair competition law."
39:47;39:53;"By rejecting the claims that he invented the Flamin' Hot Cheetos in 1992,"
39:53;40:00;"the company has damaged Montañez's mental health and livelihood by causing unwarranted distrust."
40:00;40:04;"The complaint says, it continues, ""Defendants' false statements concerning Mr. Montañez have"
40:04;40:10;"made the public and potential business partners distrustful of him and his narrative."
40:10;40:14;"His livelihood and mental health have directly suffered as a result."""
40:14;40:20;"So, you know, Montañez hasn't worked at Frito-Lay in a while, but he was making real money"
40:20;40:25;"selling his books and doing a lot of public speaking engagements,"
40:25;40:31;"because you can only imagine what a killer kind of company retreat that might be."
40:31;40:36;"You know, you work for, you know, Dunder Mifflin or some sh*t, and then you go out to the company"
40:36;40:41;"retreat and it's like, ""Now, we want to talk to you. We want you lower-level employees to realize"
40:41;40:43;"that, you know, nothing is impossible."""
40:43;40:48;"And here's a story from a guy who went from a janitor to the inventor of Flamin' Hot Cheetos."
40:48;40:53;"Crowd goes wild, gets everybody pumped up. They go back to their"
40:53;41:00;"job full of vim and vigor. I'm sure he was an incredible speaker. I remember checking out his"
41:00;41:08;"social media and he always had kind of fun little phrases and, you know, he's kind of had a magnetic"
41:08;41:15;"personality. So he was probably traveling the country, maybe the world, talking about his story."
41:15;41:22;"According to the lawsuit, his speaking engagements have dwindled from like 80 to 4."
41:22;41:25;"So it definitely affected his livelihood. And here's what Montanez said himself."
41:25;41:32;"""I created Flamin' Hot Cheetos not only as a product, but as a movement. And as a loyal"
41:32;41:38;"executive for PepsiCo, PepsiCo believed in me as a leader because they knew people would follow me."
41:38;41:43;"And they did because they knew my soul is my community. We built this into a $2 billion"
41:43;41:48;"industry and I cannot let them take away my legacy or destroy my reputation. I will not"
41:48;41:50;"let them silence me."""
41:50;41:51;"What do we think, guys? This is-"
41:51;41:56;"Frito-Lay previously said that none of their records show that Montanez was involved in any"
41:56;42:03;"capacity in the Flamin' Hot test market. According to a 2021 Los Angeles Times investigation,"
42:03;42:09;"they added, ""That doesn't mean we don't celebrate Richard, but the facts do not support the urban"
42:09;42:16;"legend."" Now, I wonder what is in it for them to like go up, kind of correct the record."
42:16;42:20;"They were responding to the LA Times article, so they probably felt like they had to say"
42:20;42:24;"something. So they, I'm sure they had a meeting. Yeah."
42:24;42:26;"So the LA Times went digging."
42:26;42:28;"Yes."
42:28;42:36;"And they, they uncovered the story that all was not well in the narrative of Flamin' Hot Cheetos."
42:36;42:40;"Yeah. And they, you know, and they went and interviewed people who claimed to be on the"
42:40;42:47;"team that developed them, which I seem to recall was like Chicago based. So it wasn't even like"
42:47;42:54;"a story of like two people at the same factory and one, and you know, they're saying, ""No, no,"
42:54;42:57;"no. That was my idea. You were there."" But these people were saying like, ""No, no, we were literally"
42:57;43:01;"in a different part of the country developing this. We have documentation about what we were"
43:01;43:08;"working on. We didn't even know him."" So, you know, and I, as I recall in that, in the LA Times"
43:08;43:14;"article, some of those people seemed a little bit annoyed about it because they felt like, ""No,"
43:14;43:20;"I was on the team that did it."" So yeah, LA Times went digging. They, that's what they found. So"
43:20;43:25;"you imagine that when Frito-Lay made this statement, the one that you just read, they were"
43:25;43:30;"really trying to thread a difficult needle. Right."
43:30;43:37;"You know, because they, they recognize that Montaigne's is out there telling a story. And"
43:37;43:45;"also a major part of this too, is the fact that that product was developed and targeted"
43:45;43:49;"at the Hispanic community. He's telling a story they want told."
43:49;43:53;"Yeah, exactly. This has been my theory from day one."
43:53;43:55;"Frito-Lay wishes it was true. Yes."
43:55;44:00;"But then they don't want to lie either and say like, ""No, no, this iconic product, which helped,"
44:01;44:07;"you know, help us expand into the Hispanic marketplace and make us billions of dollars."
44:07;44:11;"It was actually developed by a team of non-Hispanic people in Chicago."""
44:11;44:15;"Yeah. In the lab."
44:15;44:16;"Yeah. PhDs in chemistry."
44:16;44:18;"No good spicy. This is..."
44:18;44:22;"That's bad. That's what I call bad spicy."
44:23;44:23;"What they do?"
44:24;44:26;"It's not in your face."
44:26;44:29;"All the time they want to take your place, the backstabbers."
44:29;44:31;"Backstabbers."
44:31;44:33;"It's not in your face."
44:33;44:37;"All the time they want to take your place, the backstabbers."
44:37;44:39;"Backstabbers."
44:39;44:46;"All you fellas who have someone and you really care. Yeah. Yeah."
44:46;44:52;"Then it's all in your feathers. Better beware. Yeah. Yeah."
44:53;44:58;"Yeah. It's a mess. It's a mess. And I sort of wish that the LA Times guy just had"
44:58;45:04;"left this one alone. This was a stone that I don't think needed to be unchurned."
45:04;45:12;"Yeah. This was a real woodward and Bernstein level investigation this guy did."
45:12;45:17;"I mean, I wonder what the impetus of it was. I mean, we covered this years ago,"
45:17;45:19;"so I don't remember when that article dropped."
45:19;45:25;"Yeah. I can't remember actually. And I feel like we know somebody who knows him. I mean, look,"
45:25;45:29;"the guys, I think this guy's a respected journalist and stuff. So he probably just"
45:29;45:38;"saw, I'm sure he wasn't trying to ruin Montaigne's speaking engagement. Who knows? Maybe he just"
45:38;45:41;"talked to some of those people and he was just, he was just curious. What's the truth here?"
45:41;45:48;"Obviously there's a disagreement. So I'm not gonna, not gonna diss the journalist."
45:49;45:52;"I mean, it sounds like the truth is for us to make up our minds, we're going to have to"
45:52;45:58;"pour over hundreds of pages, if not thousands of pages of internal, uh, free to lay documents,"
45:58;46:05;"because that's the only way that we can, we can actually know what's going on here. And then also"
46:05;46:11;"like, we have filed a FOIA request on behalf of the show. Haven't, haven't we for this?"
46:11;46:16;"No, we should, we're going to get to get the octopus murders guys to help us."
46:16;46:21;"Right. But maybe, maybe we don't want to go any deeper than this. I mean, yeah,"
46:21;46:25;"you got to feel for everybody. We also, I believe Jake, the last time we talked about it,"
46:25;46:34;"you suggested that perhaps this was an emotional truth for Montaigne's and, you know, he,"
46:34;46:38;"cause, cause one thing I said this last time, and I'll say it again. The one thing that's a"
46:38;46:45;"hundred percent true about Montaigne's is that he came from a working class immigrant family"
46:46;46:53;"and went from being a janitor at a company to a high level marketing executive. That's true."
46:53;46:58;"That's undisputed. That's undisputed. And that in, in and of itself is a rare story."
46:58;47:03;"It is a story worth celebrating. I'm sure everybody at Frito-Lay would agree. That's"
47:03;47:11;"a story worth celebrating. It just doesn't have that perfect, uh, tagline elevator pitch,"
47:11;47:18;"a janitor created Flamin' Hot Cheetos. Like that's what like, you know, that's what takes a"
47:18;47:24;"kind of good story that probably requires, you know, a long explanation and turns it into a"
47:24;47:31;"soundbite. And if in fact, you know, the, the LA Times reporting is correct, we can forgive"
47:31;47:38;"Montaigne's for maybe over the years, simplifying his own story into something punchy. I just have"
47:38;47:44;"this feeling like there's a really good courtroom drama type movie here in a sequel to this thing,"
