Start Timestamp;End Timestamp;Transcript
01:11:11;01:11:23;"this song takes place at the exact moment when a extremely jealous guy, who maybe actually"
01:11:23;01:11:30;"is getting cheated on, this song takes place at the exact moment of repression."
01:11:30;01:11:36;"He's seeing something so harsh that makes him so insanely jealous that this is literally"
01:11:36;01:11:41;"the moment that he pushes it down, where he's literally in the jealousy moment."
01:11:41;01:11:44;"It's like next level jealousy."
01:11:44;01:11:45;"What is happening?"
01:11:45;01:11:49;"It started out with a kiss."
01:11:49;01:11:54;"Our relationship simply began with a kiss, and now I'm being tortured."
01:11:54;01:12:02;"Watching the love of my life touch this guy's chest and they're taking off their clothes."
01:12:02;01:12:05;"He's literally in hell, and he's just sitting in jealousy."
01:12:05;01:12:10;"And then he's choking, and you're choking on your alibi using this really intense language,"
01:12:10;01:12:12;"swimming through sick lullabies."
01:12:12;01:12:15;"And then this is the moment where he goes, ""But you know what?"
01:12:15;01:12:19;"This is just the price I pay for having a really fine girlfriend."
01:12:19;01:12:20;"It's my destiny."""
01:12:20;01:12:21;"Chin up."
01:12:21;01:12:22;"""So all good."""
01:12:22;01:12:25;"Yeah, so he's not even being sarcastic."
01:12:25;01:12:30;"This is the moment that he forces himself back into the delusion that it's all good."
01:12:30;01:12:33;"The truth is too painful kind of thing."
01:12:33;01:12:35;"But now I'm curious."
01:12:35;01:12:38;"Before Nick, let's just look at verse two and see if there's anything else."
01:12:38;01:12:39;"Let's listen to verse two."
01:12:39;01:12:40;"It's all the same lyric."
01:12:40;01:12:43;"Oh yeah, same line."
01:12:43;01:12:46;"Oh yeah, you're right."
01:12:46;01:12:53;"Verse two is exactly the same."
01:12:53;01:12:56;"Except for that phone call, ""It was only a kiss."""
01:12:56;01:12:57;"I love that."
01:12:57;01:13:05;"I love the confidence of being like, ""We wrote such a banger that it's just…"""
01:13:05;01:13:06;"Twice."
01:13:06;01:13:09;"Second verse, same as the first."
01:13:09;01:13:10;"Yeah."
01:13:10;01:13:14;"And honestly, it couldn't matter less."
01:13:14;01:13:16;"Like, it's probably good he repeated it."
01:13:16;01:13:21;"I'm on the Genius page and there's a little note at the top that says, ""This was the"
01:13:21;01:13:25;"Killers' first ever recorded song for their 2002 demo."""
01:13:25;01:13:26;"Amazing."
01:13:26;01:13:29;"Coming out of the gates hot."
01:13:29;01:13:57;"They were coming out of their cage."
01:13:57;01:14:03;"I want to say just narratively, the idea that he's this obsessive and paranoid, it actually"
01:14:03;01:14:05;"works that he repeats all the lyrics."
01:14:05;01:14:06;"Do you know what I mean?"
01:14:06;01:14:09;"It doesn't feel like lazy."
01:14:09;01:14:13;"There's something about the whole tone that I'd be like, ""Oh yeah, this guy's obsessed"
01:14:13;01:14:14;"with this girl."""
01:14:14;01:14:15;"Oh yeah, that's a good point."
01:14:15;01:14:17;"It actually works that he'd be like, ""I'm just going to say the same thing to my friends"
01:14:17;01:14:20;"at the bar that I just said five times in a row."""
01:14:20;01:14:21;"Like he's…"
01:14:21;01:14:22;"Or in his head."
01:14:22;01:14:23;"He's just on a loop in his head."
01:14:23;01:14:24;"Yeah, it works."
01:14:24;01:14:26;"Yeah, that's a great point."
01:14:26;01:14:29;"It's because they do change, his delivery changes a little bit."
01:14:29;01:14:34;"And in the second verse, there's that, ""It was only a kiss."""
01:14:34;01:14:35;"Like the phone call."
01:14:35;01:14:41;"It's another part of his subconscious, his Jungian shadow calling him, ""It was only"
01:14:41;01:14:42;"a kiss."""
01:14:42;01:14:44;"Yeah, I love that interpretation."
01:14:44;01:14:48;"This dude is just like such a live wire that it's just like, ""You got anything else to"
01:14:48;01:14:49;"say in the second verse?"""
01:14:49;01:14:54;"And he's just like, ""Coming out of my cage."""
01:14:54;01:14:56;"He's forcing himself into a situation."
01:14:56;01:14:58;"Okay, but now I'm too curious."
01:14:58;01:14:59;"What is the real story?"
01:14:59;01:15:01;"Somehow I've never heard this."
01:15:01;01:15:06;"So we're all right, but there is a real story to it."
01:15:06;01:15:08;"It's incredible that Flowers will tell it."
01:15:08;01:15:14;"So it depicts the true story of Flowers."
01:15:14;01:15:15;"Brandon was a young guy."
01:15:15;01:15:19;"He took a trip to Southern California and he happened to meet a janitor who worked at"
01:15:19;01:15:20;"Frito-Lay."
01:15:20;01:15:23;"And the story this guy told him, he couldn't get out of his head."
01:15:23;01:15:24;"He went back to Vegas."
01:15:24;01:15:28;"He told Ronnie Vannucci and the boys, ""You wouldn't believe what happened to this guy."""
01:15:28;01:15:29;"Okay, sorry."
01:15:29;01:15:30;"Now tell the real story."
01:15:30;01:15:33;"It's the true story."
01:15:33;01:15:37;"So it depicts a true story of Flowers' jealousy and paranoia when he walked into a bar in"
01:15:37;01:15:40;"Las Vegas and found his girlfriend cheating on him."
01:15:40;01:15:46;"And so this is interesting because it also, I think part of the surreal, dreamy vibe."
01:15:46;01:15:52;"So here's the quote, ""I was asleep and I knew something was wrong,"" Flowers said."
01:15:52;01:15:54;"""I have these instincts."
01:15:54;01:15:58;"So I went to the Crown and Anchor, a bar in Vegas, and my girlfriend was there with another"
01:15:58;01:15:59;"guy."""
01:15:59;01:16:02;"So he was literally woken up out of a dream."
01:16:02;01:16:03;"Got dressed."
01:16:03;01:16:04;"I got it."
01:16:04;01:16:05;"Yeah, gets dressed."
01:16:05;01:16:09;"Also, I think famously sober, right?"
01:16:09;01:16:10;"Mormon sober?"
01:16:10;01:16:11;"I think so."
01:16:11;01:16:13;"Yeah, I don't think he drinks."
01:16:13;01:16:14;"Yeah, I think he's..."
01:16:14;01:16:16;"So he gets up and he goes, ""I'm going to go to this bar."""
01:16:16;01:16:18;"Yeah, practicing Mormon."
01:16:18;01:16:21;"Gets up and goes to the bar and he goes, ""Ooh, I just don't have a good feeling."
01:16:21;01:16:22;"My paranoia."""
01:16:22;01:16:24;"It's right."
01:16:24;01:16:25;"And that's it."
01:16:25;01:16:27;"So there you go."
01:16:27;01:16:28;"Proven right."
01:16:28;01:16:29;"That's also interesting."
01:16:29;01:16:32;"Yeah, that's interesting too because in the..."
01:16:32;01:16:36;"So I guess in real life, he was having uneasy dreams."
01:16:36;01:16:39;"Okay, first of all, we got to get Brandon back on the show."
01:16:39;01:16:43;"I want to ask him about if he's psychic."
01:16:43;01:16:46;"People just are so interested in the song that he tells the story and you're like, ""Wait,"
01:16:46;01:16:47;"back up."
01:16:47;01:16:49;"Have you ever had any other kind of visions?"""
01:16:49;01:16:53;"By the way, at the time I'm finding he did drink."
01:16:53;01:17:00;"So not that it has anything to do with it, but it almost makes it even..."
01:17:00;01:17:03;"It was stranger to me that here's this guy that doesn't drink, doesn't..."
01:17:03;01:17:06;"It probably goes to bars with his friends or whatever, but it's like, ""Oh, my girlfriend's"
01:17:06;01:17:07;"at a bar."""
01:17:07;01:17:10;"But even so, there must be a million bars in Vegas."
01:17:10;01:17:13;"No, he was like, he woke up and he's like, ""Crown and anchor."""
01:17:13;01:17:15;"Crown and anchor."
01:17:15;01:17:17;"I wonder how psychic he is."
01:17:17;01:17:19;"Brandon, what's going to happen in the election?"
01:17:19;01:17:22;"Brandon, what other kind of visions have you had?"
01:17:22;01:17:24;"Imagine he was just like..."
01:17:24;01:17:25;"Did Richard Montanos."
01:17:25;01:17:26;"This was..."
01:17:26;01:17:29;"He's like, ""This was the first of many visions I had."""
01:17:29;01:17:32;"Oh, did any of your visions inspire other killer songs?"
01:17:32;01:17:37;"He's like, ""My other visions are too dark to share with the world."""
01:17:37;01:17:40;"And there would be mass hysteria if people knew."
01:17:40;01:17:45;"But yeah, so in real life, he's having an uneasy sleep and he has this vision and he's"
01:17:45;01:17:51;"drawn to this bar and this uneasy feeling, this vision of his girlfriend cheating on"
01:17:51;01:17:53;"him is true."
01:17:53;01:17:54;"But it's even crazier."
01:17:54;01:17:55;"I agree."
01:17:55;01:17:59;"The song is so surreal because in the song, it's not like, ""And I couldn't sleep and I"
01:17:59;01:18:00;"went to the bar."""
01:18:00;01:18:02;"He says, ""Now I'm falling asleep and she's calling a cab."""
01:18:02;01:18:05;"So in this version, he's in almost..."
01:18:05;01:18:06;"He's in the..."
01:18:06;01:18:07;"What do you call it?"
01:18:07;01:18:08;"Like alpha state?"
01:18:08;01:18:09;"Alpha wave?"
01:18:09;01:18:10;"Whatever."
01:18:10;01:18:14;"We're like half asleep and your brain is just like on a different vibration."
01:18:14;01:18:19;"So that vision of him half asleep and he's kind of actually there."
01:18:19;01:18:21;"He's doing remote viewing."
01:18:21;01:18:25;"So he's in bed at his house, but he's also kind of seeing what's happening at the bar."
01:18:25;01:18:27;"He's astral projecting."
01:18:27;01:18:31;"He's astral projecting and he has crazy sleep paralysis."
01:18:31;01:18:32;"Just like, ""What the fuck?"
01:18:32;01:18:33;"What the fuck?"""
01:18:33;01:18:40;"And then maybe because it's a Schrodinger's cat thing, because he's astral projecting,"
01:18:40;01:18:42;"it is in a sense a dream."
01:18:42;01:18:47;"So maybe he still hopes that by being Mr. Brightside, he can kind of bargain it away"
01:18:47;01:18:50;"from being reality."
01:18:50;01:18:51;"Very interesting song."
01:18:51;01:18:53;"I mean, obviously, it's a catchy song."
01:18:53;01:18:54;"It's energetic."
01:18:54;01:18:56;"People go nuts for it."
01:18:56;01:19:00;"And then the outro is, he just goes, ""I never"" over and over again."
01:19:00;01:19:01;"""I never."""
01:19:01;01:19:02;"Play the outro."
01:19:02;01:19:32;"Yeah, I"
01:19:32;01:19:41;"think about the song as like a surreal, like, it feels very like Cronenberg or something."
01:19:41;01:19:48;"Dude's fucking astral projecting and having this weird psychological nightmare."
01:19:48;01:19:52;"And then just for, I guess when I'm used to listening to the song and I just hear him"
01:19:52;01:19:56;"saying ""I never"" at the end, I don't think I even really knew what the song was about."
01:19:56;01:20:00;"Some people might say I still don't know what the song is about, but I never had my own"
01:20:00;01:20:01;"interpretation."
01:20:01;01:20:04;"And I just, when I just heard him saying ""I never,"" I just thought of it kind of as being"
01:20:04;01:20:06;"like, ""Why, I never."
01:20:06;01:20:07;"Well I never."""
01:20:07;01:20:11;"But now I hear it as like this eerie, incomplete sentence."
01:20:11;01:20:14;"Like this dude half asleep, being like tortured."
01:20:14;01:20:15;"And he's just like, ""I never."""
01:20:15;01:20:16;"And it's like, ""I never what?"""
01:20:16;01:20:17;"And it's like, ""Bam, bam, bam."""
01:20:17;01:20:18;"And it just like ends."
01:20:18;01:20:22;"No, because it could be like, ""I never should have started dating you."
01:20:22;01:20:24;"I never should have shown up to the bar."""
01:20:24;01:20:25;"Like you have no idea."
01:20:25;01:20:27;"Like, if he didn't show up to the bar, he wouldn't know."
01:20:27;01:20:29;"Yeah, it's very weird."
01:20:29;01:20:33;"I think that's why this is a tremendous piece of art."
01:20:33;01:20:37;"And I would say kind of a deeper song than ""Don't Stop Believing."""
01:20:37;01:20:38;"I'll do ""Respect a Journey."""
01:20:38;01:20:42;"That's an amazing song, but if it gets people pumped up, like they just want to sing."
01:20:42;01:20:45;"This has, I think this has shades of Cronenberg."
01:20:45;01:20:49;"A little bit of like the, I don't know, I keep thinking of Psycho Killer."
01:20:49;01:20:51;"Just like, ""Don't touch me, I'm a real live wire."""
01:20:51;01:20:55;"Just like a dude alone in his apartment kind of vibe."
01:20:55;01:21:01;"I don't think this guy's a killer, but just like the weird loner dude."
01:21:01;01:21:07;"And it's funny to think it's so anthemic that just like, you know, at a bar in like downtown"
01:21:07;01:21:11;"Memphis, like frat dudes are grabbing each other going like, ""Oh, never."""
01:21:11;01:21:15;"Yeah, it's interesting to have like an emotionally ambiguous anthem."
01:21:15;01:21:21;"Because yeah, like you said, ""Don't Stop Believing"" is like, it's unambiguous."
01:21:21;01:21:28;"It's ""Don't Stop Believing"" in yourself and in your love and all, you know, your dreams."
01:21:28;01:21:32;"But this is just sort of like, why did I think of ""Don't Stop""?"
01:21:32;01:21:34;"It doesn't sound like ""Don't Stop Believing."""
01:21:34;01:21:38;"It's a totally different emotional palette and sonic."
01:21:38;01:21:40;"I just understood, like, what is the connection?"
01:21:40;01:21:44;"Even though, and for some reason it popped into my head too when we were listening to"
01:21:44;01:21:45;"it."
01:21:45;01:21:46;"What is it?"
01:21:46;01:21:52;"I think it serves a similar role in that you could play it at a bar or a party and"
01:21:52;01:21:55;"a similar type of person will be like, ""Oh, ****."
01:21:55;01:21:56;"Like let's **** sing."""
01:21:56;01:22:04;"I think also something about like the soaring melody just makes people want to like sing"
01:22:04;01:22:06;"and it's, I don't know."
01:22:06;01:22:07;"Interesting."
01:22:07;01:22:09;"In some ways, yeah, a very different song."
01:22:09;01:22:12;"And look, above all, they're just both two massive songs."
01:22:12;01:22:20;"Like the biggest, probably the biggest rock songs of the 21st century."
01:22:20;01:22:23;"These are just my back of the envelope calculations."
01:22:23;01:22:30;"I think the biggest rock songs of the 21st century would be ""Mr. Brightside,"" ""Seven"
01:22:30;01:22:33;"Nation Army"" by the White Stripes."
01:22:33;01:22:40;"And you know, those like Arctic Monkey songs, you know, those big riff Arctic Monkey songs."
01:22:40;01:22:45;"I guess you could throw in like ""Kings of Leon."""
01:22:45;01:22:48;"What about like ""21 Pilots"" or whatever?"
01:22:48;01:22:49;"Yeah, that's big."
01:22:49;01:22:53;"They're a fusion of hip hop and rock, so I'd put it in a slightly different category."
01:22:53;01:22:54;"Different thing."
01:22:54;01:22:56;"But you're saying straight rock."
01:22:56;01:23:01;"Yeah, maybe this is how you remind me by Nickelback, who we talked about last time."
01:23:01;01:23:02;"But I don't know."
01:23:02;01:23:07;"But for me, like true, true global songs, for me, this is what comes to mind."
01:23:07;01:23:12;"""Seven Nation Army,"" ""Mr. Brightside,"" and ""Do I Wanna Know."""
01:23:12;01:23:16;"And ""Do I Wanna Know"" is also-- but that's not a triumphant song."
01:23:16;01:23:17;"Those lyrics are also about a guy."
01:23:17;01:23:18;"Do I wanna know?"
01:23:18;01:23:21;"It's like, it's also about a kind of insecure guy."
01:23:21;01:23:23;"Do I wanna know if I'm getting cheated on?"
01:23:23;01:23:28;"But even that, it's like, you know, the vibe of that song."
01:23:28;01:23:30;"Do I wanna know?"
01:23:30;01:23:34;"It's like, that's maybe similar emotional terrain, but it's less ambiguous."
01:23:34;01:23:37;"""Seven Nation Army"" is just like a rocker."
01:23:37;01:23:40;"Yeah, this one is-- this is the eeriest one."
01:23:40;01:23:46;"So, but you were saying that it's really grown in stature in the last five, ten years."
01:23:46;01:23:49;"So it came out like 20 years ago."
01:23:49;01:23:53;"It was unambiguously a hit when it came out."
01:23:53;01:23:57;"The Killers have always been a big band, but it went beast mode in the last five to ten"
01:23:57;01:23:58;"years."
01:23:58;01:23:59;"But how?"
01:23:59;01:24:02;"This organic, sort of zeitgeist, cultural thing that just sort of happens?"
01:24:02;01:24:06;"I mean, was there like a-- obviously with ""Don't Stop Believin'"" it was rediscovered"
01:24:06;01:24:07;"because of The Sopranos."
01:24:07;01:24:08;"Right."
01:24:08;01:24:09;"There was a reappraisal."
01:24:09;01:24:11;"I remember there was a reappraisal."
01:24:11;01:24:17;"There was a moment on Twitter where it felt like people had collectively rediscovered"
01:24:17;01:24:18;"the song and were like--"
01:24:18;01:24:22;"I also think that The Killers are a band that has just sort of never left, right?"
01:24:22;01:24:27;"In their own way, they just like have-- they've been consistent and growing, especially internationally."
01:24:27;01:24:36;"Yeah, well I know because I had some friends who went to their run of shows at the O2 in"
01:24:36;01:24:41;"London, and they did some unprecedented number of shows in a row there."
01:24:41;01:24:47;"And so they're-- I know as a touring act, they're bigger than ever."
01:24:47;01:24:51;"And I think in no small part thanks to-- I mean, they have a strong catalog, but I mean,"
01:24:51;01:24:52;"this song is just--"
01:24:52;01:24:55;"They should do a hometown show at the Sphere, huh?"
01:24:55;01:24:56;"Oh, that's great."
01:24:56;01:24:57;"Oh, Killers run?"
01:24:57;01:24:58;"Killers at the Sphere?"
01:24:58;01:25:03;"I want to read this quote from Flowers in 2012, just because it feels very TC."
01:25:03;01:25:09;"And he said that when they were making this record-- so they were very depressed after"
01:25:09;01:25:12;"hearing the Strokes album, ""Is This It?"""
01:25:12;01:25:15;"And that record was just so perfect, Flowers said."
01:25:15;01:25:20;"We threw away everything we were working on, and the only song that remained on the cut"
01:25:20;01:25:22;"was ""Mr. Brightside."""
01:25:22;01:25:24;"Gauntlet was thrown."
01:25:24;01:25:31;"And all due respect to the Stone Cold classic ""Is This It?"" but even ""Last Night"" is dwarfed"
01:25:31;01:25:34;"by the cultural footprint of ""Mr. Brightside."""
01:25:34;01:25:37;"Not in my car."
01:25:37;01:25:38;"Until today."
01:25:38;01:25:39;"Last night, she said, ""Oh, baby, I feel so down."""
01:25:39;01:25:40;"Oh, it turned me on when I feel left out."
01:25:40;01:25:41;"So I, I turned around and I looked around, and I saw a man with a gun."
01:25:41;01:25:42;"And I said, ""Oh, I'm gonna kill him."""
01:25:48;01:26:16;"And I said, ""Oh, I'm gonna kill him."""
01:26:16;01:26:43;"And I said, ""Oh, I'm gonna kill him."""
01:26:43;01:27:11;"And I said, ""Oh, I'm gonna kill him."""
01:27:11;01:27:40;"And I said, ""Oh, I'm gonna kill him."""
01:27:40;01:28:10;"And I said, ""Oh, I'm gonna kill him."""
01:28:10;01:28:11;"And I said, ""Oh, I'm gonna kill him."""
01:28:12;01:28:16;"Although maybe that was weirdly a curse, because England, of course, did not go all the way"
01:28:16;01:28:17;"in the Euros."
01:28:17;01:28:23;"Maybe it's like, hey, an amazing song, but don't get too hyped up about an ambiguous"
01:28:23;01:28:25;"song about a psychological nightmare."
01:28:25;01:28:29;"Is that really what you want to be, you know, yelling at the top of your lungs?"
01:28:29;01:28:31;"Is that the kind of energy you want to be giving your national team?"
01:28:31;01:28:33;"It's like, ""We will rock you."""
01:28:33;01:28:34;"Another classic ambiguous song."
01:28:34;01:29:00;"I wanted to play another song on this show."
01:29:00;01:29:03;"Sometimes we forget about the radio part of Internet Radio Show, and that we have the"
01:29:03;01:29:11;"amazing ability to play music, which not everybody has, especially on podcasts."
01:29:11;01:29:17;"But there's a solo Brandon Flowers song that I've always loved, and I feel like not enough"
01:29:17;01:29:29;"people know it, because we're talking about Brandon's fascinating lyrics and the killers"
01:29:29;01:29:30;"and stuff."
01:29:30;01:29:32;"I just wanted to throw this out there, because I always liked this song."
01:29:32;01:29:34;"It's called ""Still Want You."""
01:29:34;01:29:40;"I think it's from his second solo album, and it's produced by a friend of the show, Ariel"
01:29:40;01:29:43;"Rechshied, which is probably why I'm so familiar with it, because I kind of remember when he"
01:29:43;01:29:45;"was working on this song."
01:29:45;01:29:49;"But I've always thought this is a very interesting song, and more people should know it."
01:29:49;01:29:50;"Let's listen to it."
01:29:50;01:29:51;"[MUSIC - BRANDON FLOWERS, ""STILL WANT YOU""]"
01:29:51;01:30:15;"[MUSIC - BRANDON FLOWERS, ""STILL WANT YOU""]"
01:31:03;01:31:07;"I love that it's kind of like this light, kind of funky groove."
01:31:07;01:31:10;"Little bit of a '70s Bowie vibe."
01:31:10;01:31:11;"It's ""Rules."""
01:31:11;01:31:14;"I like this so much more than the killers."
01:31:14;01:31:15;"I gotta check out the Brandon Flowers solo."
01:31:15;01:31:16;"You should check out more of it."
01:31:16;01:31:17;"You should check out this whole album."
01:31:17;01:31:18;"Yeah."
01:31:18;01:31:22;"I feel like I can hear the Ariel in there, too."
01:31:22;01:31:23;"Yeah."
01:31:23;01:31:26;"There's a lot of classic Ariel-isms in this."
01:31:26;01:31:30;"[MUSIC - BRANDON FLOWERS, ""STILL WANT YOU""]"
01:31:30;01:31:34;"Yeah, that's a good call on young Americans."
01:31:34;01:31:35;"Yeah."
01:31:35;01:31:37;"It's kind of feel of Bowie."
01:31:37;01:31:38;"Yeah."
01:31:38;01:31:40;"[MUSIC - BRANDON FLOWERS, ""STILL WANT YOU""]"
01:31:40;01:31:42;"Yeah, those backing vocals on the chorus."
01:31:42;01:31:45;"[MUSIC - BRANDON FLOWERS, ""STILL WANT YOU""]"
01:31:45;01:31:47;"This part sounds like the killers."
01:31:47;01:31:53;"[MUSIC - BRANDON FLOWERS, ""STILL WANT YOU""]"
01:31:53;01:31:55;"He's just so good at melodies."
01:31:55;01:31:59;"[MUSIC - BRANDON FLOWERS, ""STILL WANT YOU""]"
01:31:59;01:32:01;"Also has that Kate Bush on--"
01:32:01;01:32:02;"Yeah."
01:32:02;01:32:03;"--backing vocals."
01:32:03;01:32:16;"[MUSIC - BRANDON FLOWERS, ""STILL WANT YOU""]"
01:32:16;01:32:18;"I love this."
01:32:18;01:32:23;"I like his vocal sound a lot more."
01:32:23;01:32:28;"I guess like Mr. Bright said, it's so arch and kind of unrelenting."
01:32:28;01:32:32;"It just doesn't-- it doesn't move me the way this does."
01:32:32;01:32:35;"[MUSIC - BRANDON FLOWERS, ""STILL WANT YOU""]"
01:32:35;01:32:36;"(SINGING) And the time is passing by."
01:32:36;01:32:37;"I still want you."
01:32:37;01:32:38;"(SINGING) Time is on the rise."
01:32:38;01:32:39;"Still want you."
01:32:39;01:32:41;"Move the earth astray."
01:32:41;01:32:44;"Was this a single off the record, or was this a deep cut?"
01:32:44;01:32:45;"I think it was--"
01:32:45;01:32:47;"I think-- yeah, I think there was a video."
01:32:47;01:32:48;"Not the first single."
01:32:48;01:32:49;"(SINGING) Still want you."
01:32:49;01:32:50;"Still want you."
01:32:50;01:32:52;"Even more than I did."
01:32:52;01:32:57;"Even more than I did before."
01:32:57;01:32:59;"Maybe Vampire should cover this song."
01:32:59;01:33:01;"I feel like we could get into that."
01:33:01;01:33:03;"I feel like you guys would crush it."
01:33:03;01:33:06;"It did remind me a little bit of Vampire."
01:33:06;01:33:08;"But maybe that was the REL, or--"
01:33:08;01:33:12;"I don't know, it just has that kind of light touch that you guys have."
01:33:12;01:33:14;"So a little bouncier."
01:33:14;01:33:16;"Maybe that's why I'm drawn to it."
01:33:16;01:33:19;"But also just like when you actually--"
01:33:19;01:33:24;"the verses are kind of about connecting with somebody."
01:33:24;01:33:27;"And then I just love the--"
01:33:27;01:33:31;"the opening lines of the chorus always pop into my mind."
01:33:31;01:33:33;"(SINGING) Time is passing by."
01:33:33;01:33:34;"I still want you."
01:33:34;01:33:36;"Crime is on the rise."
01:33:36;01:33:37;"I still want you."
01:33:37;01:33:38;"I love that."
01:33:38;01:33:39;"Crime is on the rise."
01:33:39;01:33:41;"I still want you."
01:33:41;01:33:44;"And then it pays off so well at the end of the chorus."
01:33:44;01:33:46;"(SINGING) Hurricanes and floods, I still want you."
01:33:46;01:33:49;"Even more than I did before."
01:33:49;01:33:51;"[VOCALIZING]"
01:33:51;01:33:55;"This advertisement was paid for by the committee"
01:33:55;01:33:57;"to elect Ezra Koenig."
01:33:57;01:34:02;"For some reason, that would be an amazing campaign song."
01:34:02;01:34:03;"(SINGING) Crime is on the rise."
01:34:03;01:34:04;"I still want you."
01:34:04;01:34:06;"I still want you."
01:34:06;01:34:07;"Climate change and debt."
01:34:07;01:34:09;"Those are the actual lyrics."
01:34:09;01:34:10;"Really?"
01:34:10;01:34:14;"I love this idea of you guys working up a full cover of this."
01:34:14;01:34:18;"Back in the day when people would cover their contemporaries"
01:34:18;01:34:19;"all the time."
01:34:19;01:34:20;"Oh, yeah."
01:34:20;01:34:24;"You know, just like Joe Cocker doing like a--"
01:34:24;01:34:26;"or Jimi Hendrix doing like a Beatles song or something."
01:34:26;01:34:27;"Right."
01:34:27;01:34:28;"Like the week the album came out."
01:34:28;01:34:29;"Right."
01:34:29;01:34:32;"It's like, oh, let's work one of those up."
01:34:32;01:34:34;"The Dead covering Dylan all the time."
01:34:34;01:34:35;"Of course."
01:34:35;01:34:36;"Yeah."
01:34:36;01:34:37;"I think I even wrote this down years ago."
01:34:37;01:34:38;"It was like covers."
01:34:38;01:34:41;"But I guess the tough part is with covers,"
01:34:41;01:34:43;"when it's not in the request zone,"
01:34:43;01:34:46;"is that then when you're actually kind of like working on a set"
01:34:46;01:34:49;"list, and you're like, oh, but if people don't know the song,"
01:34:49;01:34:52;"but maybe in some ways talking about it on time crisis"
01:34:52;01:34:54;"is the way to get the ball rolling."
01:34:54;01:34:57;"That's kind of what happened with Joker, man."
01:34:57;01:34:58;"Right."
