Start Timestamp;End Timestamp;Transcript
46:32;46:35;"I was in a band once, and we had a song called ""White Glass."""
46:35;46:37;"What does that mean, ""White Glass""?"
46:37;46:38;"Like a cocaine thing?"
46:38;46:42;"I didn't write the song, but I think it was just trying to sound like Glass Tiger."
46:42;46:44;"# White glass #"
46:44;46:45;"Yeah, basically."
46:45;46:46;"# Black velvet #"
46:46;46:49;"Their big hit was called ""Don't Forget Me When I'm Gone."""
46:49;46:50;"It goes like this."
46:50;46:54;"[rock music]"
46:54;46:55;"Oh, yeah."
46:55;46:59;"[rock music]"
46:59;47:01;"Very poppy."
47:01;47:02;"[rock music]"
47:02;47:04;"Not even really rock."
47:04;47:09;"Yeah, just like '80s wholesome pop."
47:09;47:10;"Yeah."
47:10;47:11;"You know this song?"
47:11;47:12;"No."
47:12;47:17;"# You take my breath away #"
47:17;47:22;"# Oh, love #"
47:22;47:25;"# Flames and tears #"
47:25;47:27;"[imitates guitar]"
47:27;47:30;"Got that slight '80s shuffle."
47:30;47:32;"Ooh, key change."
47:32;47:36;"So '80s to do that really abrupt key change to the chorus."
47:36;47:39;"# I'm in love with you #"
47:39;47:44;"# Oh, can this be true? #"
47:44;47:46;"[rock music]"
47:46;47:48;"# If you were a good singer #"
47:48;47:50;"I can't handle the '80s production right now."
47:50;47:53;"I'm not saying it's bad, but you gotta be in a certain mood,"
47:53;47:57;"'cause the big horns, the snare, the reverb."
47:57;48:00;"So anyway, that was Glass Tiger."
48:00;48:04;"And the bassist in Glass Tiger,"
48:04;48:06;"he's already a very successful guy."
48:06;48:07;"What's his name?"
48:07;48:09;"His name's Wayne Parker."
48:09;48:10;"I know that sounds made up."
48:10;48:13;"Why does that sound made up, Wayne Parker?"
48:13;48:14;"I don't know."
48:14;48:15;"It just sounds like a made-up name."
48:15;48:18;"So anyway, Wayne Parker was the bassist in Glass Tiger,"
48:18;48:21;"and he now is the owner of SkyShed POD,"
48:21;48:24;"a company that sells personal observatory domes"
48:24;48:26;"to amateur astronomers."
48:26;48:29;"They're located just outside of Stratford, Ontario."
48:29;48:30;"I guess these guys are Canadian."
48:30;48:31;"So what are you getting?"
48:31;48:32;"I don't even understand what that is."
48:32;48:35;"I think you're getting some form of telescope."
48:35;48:37;"A personal observation dome?"
48:37;48:40;"I think it's like a telescope with--"
48:40;48:41;"I don't know, man."
48:41;48:43;"It's something for amateur astronomers"
48:43;48:45;"to, like, behold the universe."
48:45;48:46;"That's cool, man."
48:46;48:48;"That's super niche."
48:48;48:50;"First of all, shout-out to Wayne Parker."
48:50;48:51;"That's cool."
48:51;48:56;"But, like, do you ever, like, think about hobbies"
48:56;48:58;"and just, like, get depressed?"
48:58;48:59;"What do you mean?"
48:59;49:02;"Like, grown men trading baseball cards?"
49:02;49:03;"[laughs]"
49:03;49:04;"Yeah, that's a good example."
49:04;49:05;"That's depressing."
49:05;49:07;"I remember I used to be really into cards when I was a kid,"
49:07;49:09;"and I'd go to the baseball card shop in the strip mall"
49:09;49:10;"near my house,"
49:10;49:13;"and there'd be, like, 35-year-old dudes in there."
49:13;49:16;"And I remember even being, like, 12 and just being like,"
49:16;49:18;"""What's up with-- What's going on here?"""
49:18;49:20;"They were probably looking at you, like,"
49:20;49:21;"""What's this little 12-year-old twerp doing?"
49:21;49:23;"He doesn't appreciate baseball cards."""
49:23;49:24;"Yeah."
49:24;49:25;"You know what it is, man?"
49:25;49:27;"I feel like I've probably said this before on the show."
49:27;49:31;"It's, like, I hate that our society gives us"
49:31;49:34;"very mixed messages about hobbies."
49:34;49:36;"So say you're an amateur astronomer,"
49:36;49:38;"and you're, like, really passionate about it,"
49:38;49:40;"and it's like, ""Hey, I'm just doing this for me."
49:40;49:41;"I'm interested in reading what, like,"
49:41;49:42;"professional scientists are up to,"
49:42;49:44;"and I like checking out the stars and stuff."""
49:44;49:45;"I don't know."
49:45;49:47;"There's so much pressure in our culture to, like, go pro."
49:47;49:48;"Mm."
49:48;49:50;"So I feel like the same way it's kind of like"
49:50;49:52;"with the weekend warrior local dude"
49:52;49:54;"playing covers at the barn grill."
49:54;49:55;"I don't know."
49:55;49:57;"Like, our culture doesn't respect it."
49:57;49:59;"And maybe I think about that a lot, 'cause, like,"
49:59;50:01;"yeah, I've played music professionally,"
50:01;50:02;"but at one point in my life,"
50:02;50:04;"I might just be, like, living in the suburbs,"
50:04;50:06;"you know, just getting a few, like,"
50:06;50:09;"dads from my son's school together"
50:09;50:12;"to just, you know, play Mumford & Sons covers."
50:12;50:15;"I'm thinking that there's a slot for you in pics down the road."
50:15;50:16;"It's very possible."
50:16;50:17;"But I'm just saying, like, why--"
50:17;50:18;"I don't know."
50:18;50:21;"For some reason, the phrase ""amateur astronomer"""
50:21;50:22;"made me melancholic."
50:22;50:23;"Wow."
50:23;50:24;"'Cause I love it."
50:24;50:25;"Hell yeah, man."
50:25;50:26;"Like, be an amateur astronomer."
50:26;50:28;"But then we live in this culture where it's like"
50:28;50:30;"if you're not Neil deGrasse Tyson,"
50:30;50:32;"you're a weirdo."
50:32;50:34;"Like, sorry, maybe this dude didn't have time"
50:34;50:36;"to go get a PhD in astronomy."
50:36;50:37;"Yeah."
50:37;50:39;"Maybe he was, like, you know, working three jobs."
50:39;50:42;"Maybe he got in a hometown jam or something."
50:42;50:44;"Like, things didn't go his way."
50:44;50:45;"But you know what I mean?"
50:45;50:47;"It's like our culture doesn't respect amateurs."
50:47;50:49;"If you're an amateur, you're putting time and energy"
50:49;50:52;"into not being ""productive."""
50:52;50:54;"Right, because our society values everything"
50:54;50:56;"in terms of, like, productivity."
50:56;50:58;"And if you're not making money doing it--"
50:58;51:00;"I'm thinking of this from a male perspective"
51:00;51:01;"'cause I identify as male."
51:01;51:03;"But, like, you're out with the wife."
51:03;51:04;"Yeah."
51:04;51:06;"Maybe it's a double date, her friend from work."
51:06;51:07;"Mm-hmm."
51:07;51:09;"And you're talking to her husband,"
51:09;51:10;"and maybe you're like--"
51:10;51:11;"he's like, ""What are you up to?"""
51:11;51:15;"And you're like, ""I'm a bit of an amateur astronomer."""
51:15;51:18;"I'd rather talk amateur astronomy with him, though,"
51:18;51:19;"than, like, his job."
51:19;51:20;"Well, exactly."
51:20;51:21;"Yeah."
51:21;51:23;"I mean, that is kind of what makes people human."
51:23;51:24;"Exactly."
51:24;51:25;"All right, now I got it."
51:25;51:26;"Okay."
51:26;51:28;"What makes people human is not your job, necessarily."
51:28;51:29;"It could be."
51:29;51:31;"But it's, like, you know, what makes you happy"
51:31;51:32;"and passionate and curious."
51:32;51:35;"And yet, I don't like that our culture"
51:35;51:38;"draws such a hard line between professional and amateur."
51:38;51:40;"♪ Didn't know what time it was ♪"
51:40;51:43;"♪ The lights were low, oh, oh ♪"
51:43;51:48;"♪ I leaned back on my radio, oh, oh ♪"
51:48;51:51;"♪ Some cat was laying down some rock and roll ♪"
51:51;51:55;"♪ At the service end ♪"
51:55;51:59;"♪ Then the loud sounds, it seemed, took flight ♪"
51:59;52:04;"♪ Came back like a slow voice on a wave of fight ♪"
52:04;52:09;"♪ That one old DJ that was high as a cosmic tide ♪"
52:13;52:18;"♪ There's a star man waiting in the sky ♪"
52:18;52:20;"♪ He'd like to come and meet us ♪"
52:20;52:23;"♪ But he thinks he'd blow our minds ♪"
52:23;52:28;"♪ There's a star man waiting in the sky ♪"
52:28;52:30;"♪ He's told us not to blow it ♪"
52:30;52:34;"♪ 'Cause he knows it's all worthwhile, he told me ♪"
52:34;52:36;"♪ Let the children lose it ♪"
52:36;52:38;"♪ Let the children use it ♪"
52:38;52:41;"♪ Let all the children boogie ♪"
52:41;52:57;"♪ ♪"
52:57;53:02;"♪ I had to phone someone so I picked on you, oh, oh ♪"
53:02;53:07;"♪ Hey, that's far out, so you heard him too, oh, oh ♪"
53:07;53:12;"♪ Switch on the TV, we may pick him up on channel two ♪"
53:12;53:19;"♪ Look out your window, I can see his light ♪"
53:19;53:23;"♪ If we can sparkle, he may land tonight ♪"
53:23;53:28;"♪ Don't tell your papa or he'll get us locked up in tight ♪"
53:32;53:37;"♪ There's a star man waiting in the sky ♪"
53:37;53:39;"♪ He'd like to come and meet us ♪"
53:39;53:41;"♪ But he thinks he'd blow our minds ♪"
53:41;53:46;"♪ There's a star man waiting in the sky ♪"
53:46;53:48;"♪ He's told us not to blow it ♪"
53:48;53:52;"♪ 'Cause he knows it's all worthwhile, he told me ♪"
53:52;53:54;"♪ Let the children lose it ♪"
53:54;53:56;"♪ Let the children use it ♪"
53:56;53:59;"♪ Let all the children boogie ♪"
53:59;54:03;"♪ There's a star man waiting in the sky ♪"
54:03;54:05;"♪ He'd like to come and meet us ♪"
54:05;54:08;"♪ But he thinks he'd blow our minds ♪"
54:08;54:13;"♪ There's a star man waiting in the sky ♪"
54:13;54:15;"♪ He's told us not to blow it ♪"
54:15;54:18;"♪ 'Cause he knows it's all worthwhile, he told me ♪"
54:18;54:21;"♪ Let the children lose it ♪"
54:21;54:23;"♪ Let the children use it ♪"
54:23;54:25;"♪ Let all the children boogie ♪"
54:25;54:29;"- Art and music and all that stuff is pointless,"
54:29;54:31;"which is what makes it so human and awesome."
54:31;54:33;"Like, when you started playing music,"
54:33;54:36;"you weren't doing it to make a lot of money"
54:36;54:37;"and have it be a career."
54:37;54:39;"It was doing it 'cause you were like,"
54:39;54:41;"""I'm a human, humans play music."
54:41;54:42;"I love doing this."
54:42;54:44;"This is, like, something that's not utilitarian."
54:44;54:46;"You're not learning, like, long division."""
54:46;54:48;"- That's why one of my pet peeves about, like--"
54:48;54:50;"you know, and also, I think music criticism"
54:50;54:53;"is really important, but then occasionally,"
54:53;54:55;"one of the things that bothers me in a review--"
54:55;54:57;"not necessarily, like, a Vampire Weekend review,"
54:57;54:59;"but just when I read a review of anything,"
54:59;55:01;"and there's--it's one thing to be like,"
55:01;55:03;"""I like this, I don't like this."
55:03;55:05;"I think this aspect of it's problematic."
55:05;55:07;"I think it would've been better if it sounded--"""
55:07;55:08;"But there's something, like,"
55:08;55:09;"when somebody reviews an album,"
55:09;55:11;"and they're just kind of like, ""What's the point?"
55:11;55:13;"They didn't need that song on the record."""
55:13;55:16;"And there's something about that that also just makes me sad,"
55:16;55:18;"'cause it's like, man, say you don't like it,"
55:18;55:20;"but it's like, there's just something so cruel"
55:20;55:22;"about, like, why did they put that on?"
55:22;55:24;"- Unnecessary. - Yeah, unnecessary."
55:24;55:27;"- Well, it's like, newsflash, none of it's necessary, bro."
55:27;55:29;"- Our lives are not necessary."
55:29;55:33;"It's as if human existence is pointless."
55:33;55:35;"- Well, no, I would draw a distinction."
55:35;55:37;"- Right. - I'm not gonna get so harsh"
55:37;55:39;"that they'll say our lives aren't necessary,"
55:39;55:42;"but music is not necessary,"
55:42;55:44;"and that's what's so amazing about it."
55:44;55:45;"- Yeah. - That's my thesis."
55:45;55:46;"- I guess what I'm saying is, yeah,"
55:46;55:49;"that the part of a review that says,"
55:49;55:51;"""Album started strong, but, like,"
55:51;55:53;"didn't need that skit in the middle."""
55:53;55:55;"I'm making up an example, like,"
55:55;55:56;"""What was the purpose of that"
55:56;55:58;"John Mellencamp cover, track eight?"
55:58;56:00;"That was totally unnecessary."""
56:00;56:02;"That's just, like, some middle management type"
56:02;56:03;"that's kind of like,"
56:03;56:06;"""Hey, we got a big presentation coming up."
56:06;56:08;"Let's cut out all the unnecessary slides"
56:08;56:09;"in our PowerPoint."""
56:09;56:11;"- What about if there was internet radio critics,"
56:11;56:14;"and they were like, ""When those guys went off"
56:14;56:15;"on that five-minute tangent..."""
56:15;56:18;"- ""Oh, we'd get slaughtered."""
56:18;56:20;"Thank God nobody--actually,"
56:20;56:21;"I don't want to speak too soon."
56:21;56:23;"There's probably somewhere out there"
56:23;56:25;"hating on Time Crisis, but it's like,"
56:25;56:26;"""You know what, man? Don't listen"
56:26;56:28;"if it's not your cup of tea."""
56:28;56:30;"- Take it or leave it, man."
56:30;56:32;"Maybe it's not your bag."
56:32;56:33;"- It is what it is."
56:33;56:38;"Go listen to another internet radio station, man."
56:38;56:39;"What song should we listen to?"
56:39;56:43;"- Let's listen to the new Dinosaur Junior single,"
56:43;56:44;"""Tiny."""
56:44;56:46;"- Oh!"
56:46;56:47;"Okay."
56:47;56:48;"What?"
56:48;56:49;"Yeah, it's great. I love it."
56:49;56:50;"- All right."
56:50;56:51;"- It's a great song."
56:51;56:53;"- New Dinosaur Junior."
56:53;56:54;"- Yeah."
56:54;56:55;"- That's tight."
56:55;56:56;"- Let's throw it on."
56:56;56:57;"- Man, they've been together for 30 years."
56:57;56:58;"- Mm-hmm."
56:58;57:00;"- Happy 30th anniversary to Dinosaur Junior."
57:00;57:01;"Here's your new single, ""Tiny."""
57:01;57:04;"- ♪ Calling out, I'm deep in doubt ♪"
57:04;57:07;"♪ I need you ♪"
57:07;57:13;"♪ Calling out ends always with a stare ♪"
57:13;57:20;"I can give you yes, but I mean to."
57:20;57:25;"I'll pretend, but I don't see it there."
57:25;57:28;"I want to go."
57:28;57:31;"I want to go."
57:31;57:34;"I want to roam."
57:34;57:38;"I want to know."
57:38;57:41;"Replace a friend, I'm overwhelmed."
57:41;57:44;"I need to."
57:44;57:50;"The fear is good, you understood it wrong."
57:50;57:56;"The box is overflowing, and I see you."
57:56;58:02;"The fear is that I can't be friends for long."
58:02;58:05;"I want to go."
58:08;58:11;"I want to roam."
58:11;58:13;"I want to know."
58:13;58:24;"I know, and I know for sure."
58:24;58:30;"I've blown, and I've known in return."
58:30;58:36;"Did I show you my good to learn?"
58:36;58:40;"I know, and I know, and--"
59:03;59:07;"I want to go."
59:07;59:10;"I want to go."
59:10;59:13;"I want to roam."
59:13;59:16;"I want to know."
59:16;59:22;"Calling out to you is for a friend, a friend too."
59:22;59:28;"Calling to take you back to the end of where."
59:28;59:35;"Call your friends, and all your friends are me too."
59:35;59:40;"Call me back, I'll get on track, I swear."
59:40;59:43;"I want to go."
59:46;59:48;"I want to roam."
59:52;01:00:07;"Time Crisis with Ezra Koenig, Beats 1."
01:00:07;01:00:09;"So you're listening to Time Crisis."
01:00:09;01:00:12;"We've been talking a lot about the meaning of life,"
01:00:12;01:00:17;"second careers, amateur versus professional."
01:00:17;01:00:20;"It's tough out there, man, I got to say."
01:00:20;01:00:24;"I don't know how people find meaning in modern American life."
01:00:24;01:00:25;"It's tough."
01:00:25;01:00:26;"Smell the roses, man."
01:00:26;01:00:27;"That's what I'm saying."
01:00:27;01:00:30;"So that in mind, we're going to take a moment"
01:00:30;01:00:35;"to appreciate rock history and the present."
01:00:35;01:00:39;"And we're going to do that with a segment we call Top 5."
01:00:39;01:00:46;"It's time for the Top 5 on iTunes."
01:00:46;01:00:47;"So this week's Top 5, we're going"
01:00:47;01:00:52;"to do a more complicated one, as we sometimes do on Time Crisis,"
01:00:52;01:00:56;"where we compare the Top 5 songs on iTunes currently,"
01:00:56;01:00:59;"right now, 2016, with the Top 5 Billboard"
01:00:59;01:01:03;"hits of this same week in 1968."
01:01:03;01:01:04;"Love it."
01:01:04;01:01:06;"Why did we choose 1968, Jake?"
01:01:06;01:01:08;"Well, this has been a theme recently"
01:01:08;01:01:13;"on the show the last few months because of the election."
01:01:13;01:01:15;"And people are drawing-- especially during the primaries,"
01:01:15;01:01:19;"people were drawing a lot of comparisons to 1968."
01:01:19;01:01:21;"Tumultuous time in the country."
01:01:21;01:01:22;"Exactly."
01:01:22;01:01:28;"I mean, with Trump being the nominee, I mean, that is--"
01:01:28;01:01:33;"we are on the precipice of a serious, tumultuous, crazy time."
01:01:33;01:01:37;"It's already tumultuous, racism, people getting killed."
01:01:37;01:01:38;"It's horrible."
01:01:38;01:01:40;"And now, yeah, we're holding our breath."
01:01:40;01:01:44;"Is it going to get better, worse, or the same?"
01:01:44;01:01:45;"A lot of people would accept the same."
01:01:45;01:01:48;"But whatever, 1968 was also a crazy time."
01:01:48;01:01:53;"So how does the popular music of an era reflect the time?"
01:01:53;01:01:53;"Does it?"
01:01:53;01:01:54;"If it-- maybe not."
01:01:54;01:01:55;"Maybe not at all."
01:01:55;01:01:58;"So let's start by going back to the number 5 song--"
01:01:58;01:02:00;"Young Girl."
01:02:00;01:02:01;"It's not Young Girl."
01:02:01;01:02:06;"This week in 1968, America was in flames."
01:02:06;01:02:09;"And the number 5 song on the charts"
01:02:09;01:02:14;"was the 1910 Fruit Gum Company with 1, 2, 3, Red Light."
01:02:14;01:02:16;"Are you familiar with that group, the 1910 Fruit Gum"
01:02:16;01:02:16;"Company?"
01:02:16;01:02:17;"I've heard of it."
01:02:17;01:02:19;"Let's see if you recognize this."
01:02:19;01:02:21;"[MUSIC - THE FRUIT GUM COMPANY, ""1, 2, 3, RED LIGHT""]"
01:02:21;01:02:34;"Every time I try to prove I love you, 1, 2, 3, red light."
01:02:34;01:02:36;"You stop me."
01:02:36;01:02:40;"Baby, you ain't right to stop me."
01:02:40;01:02:42;"1, 2, 3, red light."
01:02:42;01:02:44;"You stop me."
01:02:44;01:02:51;"Every time I make a move to love you, 1, 2, 3, red light."
01:02:51;01:02:53;"You stop me."
01:02:53;01:02:57;"Baby, every night you stop me."
01:02:57;01:03:00;"1, 2, 3, red light."
01:03:00;01:03:04;"Stop the game."
01:03:04;01:03:08;"You've got too much to lose."
01:03:08;01:03:12;"If you stop me again, that's when we might end."
01:03:12;01:03:14;"So please don't refuse."
01:03:14;01:03:24;"Every time I make a move to love you, 1, 2, 3, red light."
01:03:24;01:03:26;"Don't stop me."
01:03:26;01:03:30;"Baby, you ain't right to stop me."
01:03:30;01:03:33;"1, 2, 3, red light."
01:03:33;01:03:34;"Don't stop me."
01:03:34;01:03:41;"Every time I try to prove I love you, 1, 2, 3, red light."
01:03:41;01:03:45;"Don't stop me when I know I'm right."
01:03:45;01:03:47;"Don't stop me."
01:03:47;01:03:48;"1, 2, 3, red light."
01:03:48;01:03:54;"Wait, hold on a second."
01:03:54;01:03:56;"The lyrics of this song are, every time I make a move"
01:03:56;01:03:59;"to love you, you stop me?"
01:03:59;01:04:00;"1, 2, 3, red light?"
01:04:00;01:04:01;"Yeah."
01:04:01;01:04:03;"That's not going to do well on the charts in 26."
01:04:03;01:04:04;"So basically, this guy--"
01:04:04;01:04:06;"this is a song about being annoyed that somebody"
01:04:06;01:04:07;"doesn't want to have sex with you?"
01:04:07;01:04:10;"It's almost a lateral move from Gary Puckett."
01:04:10;01:04:11;"Yeah."
01:04:11;01:04:15;"God, what kind of nonsense was on the charts back then?"
01:04:15;01:04:18;"OK, that's a pretty big difference from 2016."
01:04:18;01:04:21;"Nobody's trying to listen to a pop song about--"
01:04:21;01:04:23;"1, 2, 3, red light."
01:04:23;01:04:27;"--where a guy is being cutesy about, like, damn,"
01:04:27;01:04:30;"I'm trying to have sex with you, and you keep saying no."
01:04:30;01:04:31;"It's bothering me."
01:04:31;01:04:33;"1910 Fruit Company."
01:04:33;01:04:34;"That's a terrible band name, by the way."
01:04:34;01:04:35;"It's a terrible band name."
01:04:35;01:04:38;"It's a terrible sentiment for a song."
01:04:38;01:04:40;"No wonder they're called the 1910 Fruit Gum Company,"
01:04:40;01:04:43;"because it sounds like their morality is, like,"
01:04:43;01:04:45;"early 20th century, man."
01:04:45;01:04:47;"It's weird, too."
01:04:47;01:04:50;"I think we've touched on this, how, like, the top five"
01:04:50;01:04:53;"from '68 is, like, shockingly square."
01:04:53;01:04:53;"It's bubble gum."
01:04:53;01:04:54;"And just, yeah."
01:04:54;01:04:56;"Yummy, yummy, yummy."
01:04:56;01:04:56;"Right."
01:04:56;01:04:58;"It's always these, like, really cheesy songs."
01:04:58;01:04:59;"It's really--"
01:04:59;01:05:02;"This picture, like, you and your buddies are in Vietnam."
01:05:02;01:05:03;"Yeah."
01:05:03;01:05:05;"You got, like, shrapnel in your arm playing cards,"
01:05:05;01:05:07;"and, like, this is just coming over the radio."
01:05:07;01:05:09;"1, 2, 3, red light."
01:05:09;01:05:11;"You stop me."
01:05:11;01:05:13;"I'm sort of like, where's the Creedence Clearwater?"
01:05:13;01:05:15;"Where's the, you know--"
01:05:15;01:05:16;"You know, look, man."
01:05:16;01:05:16;"--the Beatles?"
01:05:16;01:05:17;"A lot of times--"
01:05:17;01:05:18;"The stuff that you kind of remember."
01:05:18;01:05:20;"Well, yeah, you remember it."
01:05:20;01:05:21;"Or we remember it, culturally."
01:05:21;01:05:22;"Yeah."
01:05:22;01:05:24;"But that doesn't mean that's what was popping then."
01:05:24;01:05:24;"Right."
01:05:24;01:05:26;"So let's see what's going on in today's world."
01:05:26;01:05:29;"The equivalent of that song, number five on iTunes,"
01:05:29;01:05:34;"this week in 2016 is Kiara with a song called ""Gold."""
01:05:34;01:05:37;"[MUSIC - KIARA, ""GOLD""]"
01:05:37;01:05:40;"Wow."
01:05:40;01:05:41;"I mean, right off the bat--"
01:05:41;01:05:42;"Trippy."
01:05:42;01:05:44;"--they didn't even know how to do that in 1968."
01:05:44;01:05:48;"You could have gotten the best producers and engineers in 1968"
01:05:48;01:05:50;"given them a year, and they could not have"
01:05:50;01:05:52;"done a vocal edit like that."
01:05:52;01:05:52;"Nope."
01:05:52;01:05:54;"So thank you, Steve Jobs."
01:05:54;01:05:57;"[MUSIC - KIARA, ""GOLD""]"
01:05:57;01:06:16;"I miss you in the basement?"
01:06:16;01:06:16;"Yeah."
01:06:16;01:06:19;"[MUSIC - KIARA, ""GOLD""]"
01:06:19;01:06:19;"What?"
01:06:19;01:06:20;"What is this about?"
01:06:20;01:06:21;"I want to look up the lyrics."
01:06:21;01:06:25;"[MUSIC - KIARA, ""GOLD""]"
01:06:49;01:06:50;"That's cool."
01:06:50;01:06:52;"This is like the chorus."
01:06:52;01:06:54;"What did you say?"
01:06:54;01:06:55;"Roof is falling."
01:06:55;01:06:56;"Let me love me falling."
01:06:56;01:06:59;"I just know."
01:06:59;01:07:01;"What does that mean?"
01:07:01;01:07:07;"I think it's-- she's in a difficult time in her--"
01:07:07;01:07:10;"everything's falling apart, and the chopped up vocals"
01:07:10;01:07:17;"metaphorically depict the confusion of the narrator's--"
01:07:17;01:07:18;"Emotional."
01:07:18;01:07:19;"Emotional landscape."
01:07:19;01:07:23;"[MUSIC - KIARA, ""GOLD""]"
01:07:23;01:07:29;"I missed you in the basement."
01:07:29;01:07:30;"That's like some Bob Dylan lyrics."
01:07:30;01:07:32;"Basement."
01:07:32;01:07:34;"I missed you in the basement, but your brother"
01:07:34;01:07:36;"was a good substitute for you."
01:07:36;01:07:37;"That sounds weird."
01:07:37;01:07:40;"Maybe she was in a party that took place in a basement,"
01:07:40;01:07:44;"and she made out with the brother or something."
01:07:44;01:07:45;"Geez."
01:07:45;01:07:48;"[MUSIC - KIARA, ""GOLD""]"
01:07:48;01:07:51;"Without ever letting you know."
01:07:51;01:07:53;"Without ever letting you know."
01:07:53;01:07:54;"Roof is falling."
01:07:54;01:07:55;"Let me love me falling."
01:07:55;01:07:56;"I just know."
01:07:56;01:07:57;"Roof is falling."
01:07:57;01:07:58;"Let me love me falling."
01:07:58;01:07:59;"Without ever letting you know."
01:07:59;01:08:00;"Roof is falling."
01:08:00;01:08:01;"Let me love me falling."
01:08:01;01:08:02;"I just know."
01:08:02;01:08:03;"Roof is falling."
01:08:03;01:08:04;"Let me love me falling."
01:08:04;01:08:05;"Without ever letting you know."
01:08:05;01:08:06;"Roof is falling."
01:08:06;01:08:07;"Let me love me falling."
01:08:07;01:08:08;"I just know."
01:08:08;01:08:09;"Roof is falling."
01:08:09;01:08:10;"Let me love me falling."
01:08:10;01:08:11;"Without ever letting you know."
01:08:11;01:08:12;"Roof is falling."
01:08:12;01:08:13;"Let me love me falling."
01:08:13;01:08:14;"I just know."
01:08:14;01:08:15;"Without ever letting you know."
01:08:15;01:08:18;"Caught up in my-- caught up in my teeth."
01:08:18;01:08:20;"Caught up in my teeth."
01:08:20;01:08:23;"Taste like money when I speak."
01:08:23;01:08:26;"Caught up in my teeth."
01:08:26;01:08:29;"And I miss you in the basement."
01:08:29;01:08:32;"Caught up in my teeth."
01:08:32;01:08:34;"Body's on the pavement."
01:08:34;01:08:40;"And if you love me, love me, but you never let me go."
01:08:40;01:08:45;"And the roof was on fire."
01:08:45;01:08:47;"There's a lot to unpack here."
01:08:47;01:08:51;"Definitely a cooler song, just in terms of like mood."
01:08:51;01:08:52;"Sure."
01:08:52;01:08:53;"A cooler song than the 1910--"
01:08:53;01:08:54;"what do you think, Jake?"
01:08:54;01:08:57;"You're not a big pop guy."
01:08:57;01:09:00;"I mean, at the end of the day, probably equally innocuous."
01:09:00;01:09:04;"Maybe I prefer the palette of late '60s bubble gum"
01:09:04;01:09:10;"to like 2016 chopped up pop music."
01:09:10;01:09:12;"You just like that analog sound."
01:09:12;01:09:14;"Yeah, it's warm."
01:09:14;01:09:18;"I don't know what to do with the palette that we just listened to."
01:09:18;01:09:19;"But that's my perspective."
01:09:19;01:09:20;"You're just not a modern guy."
01:09:20;01:09:21;"Well--"
01:09:21;01:09:24;"I mean, like, which would you rather listen to at the gym?"
01:09:24;01:09:26;"And I'm talking about like the end, when your trainer's like"
