Start Timestamp;End Timestamp;Transcript
00:00;00:07;"Time Crisis in a time of crisis, united by FaceTime to make this Time Crisis."
00:07;00:14;"On this episode, we talk red hot chili peppers, also Munch's make-believe band."
00:14;00:20;"All that, plus the top 5 hits of 1977 and 2020."
00:20;00:24;"This is a spicy Neapolitan."
00:24;00:28;"Time Crisis with Ezra Koenig."
00:28;00:30;"Let's dig in."
26:25;26:34;"I was thinking about a band that maybe could have taken the mantle from Aerosmith in terms of huge American bands with multi-decade runs."
26:34;26:39;"Chili Peppers. Did anyone bring them up as the greatest American band?"
26:39;26:40;"Yeah."
26:40;26:42;"Did we get an email about Chili Peppers?"
26:42;26:46;"Like about the Chili's being the greatest American band? I mean that's preposterous, but..."
26:46;26:50;"They've sold 80 million albums worldwide. Huge."
26:50;26:51;"I'm not a fan."
26:51;26:54;"[Explosion]"
26:54;26:57;"I love Blood Sugar Sex Magic and I'm out."
26:57;26:59;"Guys, we did get an email about this."
26:59;27:01;"We did get an email, right? What does the email say?"
27:01;27:04;"It's a long one, but I think the key phrase is..."
27:04;27:05;"Yeah, summarize it."
27:05;27:11;"Whether we'd like to admit it or not, RHCP was, for a period, at least the most popular rock band in the world."
27:11;27:15;"Second only to U2. I'll forward it to you."
27:15;27:17;"Second only to U2."
27:17;27:26;"Well, first of all, Jake, that's kind of harsh to say that you are not a fan when you would also say you love one of their albums."
27:26;27:28;"Yeah, Blood Sugar Sex Magic is sick."
27:28;27:32;"I just don't need any more music from them outside of that record."
27:32;27:34;"You just think that was a perfect album?"
27:34;27:36;"I think that's Rick Rubin's finest work."
27:36;27:45;"It is a pretty amazing moment and anybody who hasn't seen it, I highly recommend Funky Monks, which is hard to track down sometimes,"
27:45;27:50;"but that's a black and white documentary about the making of Blood Sugar Sex Magic."
27:50;27:58;"And that's when they're at that mansion in Laurel Canyon and you get Rick in there, Chaz Smith riding his motorcycle."
27:58;28:00;"It is pretty amazing."
28:00;28:07;"This might be a generational thing, Jake, but I find some people really love Californication,"
28:07;28:12;"which came out six or seven years after that."
28:12;28:17;"Because I think for a lot of people, they love Under the Bridge and that kind of RHCP vibe."
28:17;28:20;"And then Californication was almost like an album of that."
28:20;28:22;"Do you remember when you first heard Scar Tissue?"
28:22;28:25;"That's a beautiful song. Would you agree?"
28:25;28:31;"Yeah, no, sure. The Californication period and after is just too slick."
28:31;28:38;"There's no grit. There's no texture to it. It's just very cold and corporate sounding to me."
28:38;28:43;"Blood Sugar, there's a real sense of atmosphere. It's like music from Big Pink or something."
28:43;28:51;"In what sense? Just an American band at the height of their powers hold up in a residential home?"
28:51;28:56;"Yes, a residential recording situation. No, I do love the mythology of that."
28:56;29:04;"But also, that's a crazy sounding album. Breaking the Girl, the production on that, all those acoustics,"
29:04;29:07;"it almost sounds like Rubber Soul or something."
29:07;29:10;"When you look Under the Hood on that album, because for whatever reason,"
29:10;29:17;"when I think of Blood Sugar Sex Magic, I just picture the black and white video for Suck My Kiss."
29:17;29:20;"And I just picture funky rapping, right out Chili Peppers."
29:20;29:25;"Oh, wait, by the way, Seinfeld, real quick, go to Anthony Kiedis' Wikipedia page."
29:25;29:29;"I have a feeling I know what it says. What's his opening line?"
29:29;29:34;"Like Jake is an American painter and radio personality. What's Anthony Kiedis'?"
29:34;29:38;"Anthony Kiedis is an American singer, songwriter and rapper."
29:38;29:43;"Yeah, that's what I thought. I feel like I was on his page a while ago and that just stuck with me."
29:43;29:47;"The first track on Blood Sugar Sex Magic is that song, The Power of Equality."
29:47;29:49;"I mean, he's straight up rapping, right?"
29:49;29:53;"Yeah, he's kind of, or I guess straight up rapping. I haven't heard it in a long time."
29:53;29:57;"But I remember thinking at the time, oh damn, Kiedis is rapping."
29:57;30:02;"Yeah, and I think he raps on some of the early records too. That's a part of what they did."
30:02;30:06;"So yeah, he's an American singer, songwriter and rapper."
30:06;30:09;"Also author. He wrote a great memoir."
30:09;30:12;"But I know what you mean. Because when I think of that record, what I was starting to say is that"
30:12;30:16;"I think of Suck My Kiss, just like funky, pow, pow."
30:16;30:22;"And just him rapping and just like that kind of, you know, basically bass, guitar, drums, vocals."
30:22;30:26;"You know, that kind of stuff. But then when you look under the hood on some of those songs,"
30:26;30:31;"Breaking the Girl and Under the Bridge, like Under the Bridge at the end, a choir comes in"
30:31;30:37;"and they're like banging on like oil cans or something. It's not like a simple minimalist album"
30:37;30:41;"where every song is just like, you know, a killer three piece plus vocals."
30:41;30:45;"There are these like really interesting moments that kind of give that album color"
30:45;30:48;"and tie it into the classic rock tradition."
30:48;30:52;"In terms of like nasty American rock bands, Aerosmith and Chili Peppers."
30:52;30:57;"I don't think it's fair to put them together. I don't think that's fair."
30:57;30:59;"What's your definition of nasty?"
30:59;31:04;"Just like kind of nasty, like funk and like blues. It's just like..."
31:04;31:07;"But you mean nasty in a negative way?"
31:07;31:11;"Not like Flea and Chad, you guys were so locked in tonight. It was nasty."
31:11;31:15;"Thanks Jake, I really appreciate that."
31:15;31:20;"I kind of mean it in both ways. I mean, obviously like, yeah, they're nasty in that sense"
31:20;31:24;"that they're like completely crushing it. Absolutely sick groove."
31:24;31:31;"But the grooves are nasty, like in a subjective aesthetic sense that I think is gross."
31:31;31:37;"And also, yeah, if I follow your logic, when you talk about the dead,"
31:37;31:42;"the dead is not nasty in either way. It's like even an amazing moment with the dead,"
31:42;31:48;"just like Jerry just doing like a lightning fast riff or everybody's really locked in."
31:48;31:53;"It's still not like a white boy stank face moment. It's still not, ""Oh!"""
31:53;31:59;"It's like the light touch of like a Kreutzmann or a Garcia is never like, ""Oh yeah!"""
31:59;32:01;"Like it's never that kind of nasty."
32:01;32:04;"It's never House of Blues. It's never a Guitar Center. It's never House of Blues."
32:04;32:08;"Nastiness is not necessarily negative, but it is..."
32:08;32:11;"I could see the way your taste leans away from it."
32:11;32:17;"And I guess also there's something like, there's something just like more sexual about those bands"
32:17;32:21;"in like not exactly a cool way."
32:21;32:23;"You know what I mean?"
32:23;32:25;"No, absolutely, dude."
32:25;32:30;"Just like some like Howard Stern, like obviously there's plenty of good sexy music."
32:30;32:35;"It's a part of human life, but there's something like, yeah, there's like Howard Stern nasty."
32:35;32:39;"Just like, ""Ugh!"" Like, ""Yeah!"""
32:39;32:44;"80s Stern sensibility."
32:44;32:47;"80s Stern meets Guitar Center."
32:47;32:50;"It's rough. It's rough stuff."
32:50;32:52;"Big overlap."
32:52;32:55;"That could be a later Mountain Bruise EP."
32:55;33:01;"Jake's mood board is a picture of 80s Howard Stern and a picture of Guitar Center."
33:01;33:07;"Have you guys heard Out in L.A., Red Hot Chili Peppers' first track that featured Anthony Kiedis rapping?"
33:07;33:10;"That's 80s? Is that like from Freaky Stylie or something?"
33:10;33:14;"Yeah, I think it was when the band was called Defunct."
33:14;33:18;"I threw on their first record about five years ago, and it was unlistenable."
33:19;33:22;"This sounds like the Talking Heads."
33:22;33:24;"Yeah."
33:49;33:51;"[coughing]"
33:55;33:57;"Okay."
33:57;33:59;"Kiedis got better."
33:59;34:01;"It's like a Graymaster Flash kind of cadence."
34:01;34:06;"Yeah, it reminds me of, ""Have you ever gone over to a friend's house to eat and the chicken just ate no good?"""
34:06;34:10;"I guess to be fair, you got to give them props too for even like,"
34:10;34:14;"when you consider that you had like the David Crosby's of the world and the Old Heads,"
34:14;34:20;"even George Harrison, I'm sad to report, I saw that recently, in the 80s just being like, ""Rap is not music."""
34:20;34:22;"Actually, that's maybe worth telling the story."
34:22;34:28;"I saw somebody posted this like old clip, like a newspaper clipping from the New York Post that was,"
34:28;34:30;"must have been the late 80s."
34:30;34:36;"And basically, they had a little news item about how George Harrison did an interview where somebody was like,"
34:36;34:40;"""What do you think about this, you know, the emerging form of hip-hop?"""
34:40;34:45;"And George Harrison was just like, ""I'm sorry, but it all sucks, man. You know?"
34:45;34:47;"Yeah, it's really not good. It's not music, man."""
34:47;34:54;"Or whatever, he made a derogatory comment about hip-hop, which most of the Old Heads were doing, sad to report, at the time."
34:54;35:01;"And then some journalist, I guess, went up to Chuck D, and this is in the early days, you know,"
35:01;35:08;"of like public enemy becoming this huge rap group, and I guess mentioned it to him or asked him what he thought."
35:08;35:13;"And then Chuck D just like, with a withering response, just said back, ""Who would you say it was, Harrison?"""
35:13;35:16;"""All right, well, you know, he's third string."""
35:16;35:21;"""If it was Lennon or McCartney, I might have to pause and think about it for a second, but Harrison, get the f*** out of here."""
35:21;35:28;"Which, a lot of people now, it's like cool to say Harrison's your favorite Beatle, but you have to respect that."
35:28;35:29;"That's hilarious."
35:29;35:33;"Harrison making like a pretty just kind of like uneducated comment about hip-hop."
35:33;35:36;"Just like, ""It all sucks."" And so he clearly wasn't giving it the time of day."
35:36;35:40;"Then you ask Chuck D, and Chuck D like knows his Beatles well enough to be like,"
35:40;35:44;"""Well, you know, Harrison's got a couple songs, but he's really not a top tier Beatle."
35:44;35:47;"Always going to be in the shadow of Lennon and McCartney."" You just like hit him where it hurt."
35:47;35:48;"And you're like, ""Fair play."""
35:48;35:49;"I love it."
35:49;35:55;"But anyway, that's all to say that like, even if it sounds a little awkward now, I do kind of respect Chili Pepper,"
35:55;36:03;"young Chili Peppers, 80s LA just being like, ""We love funk music, Led Zeppelin, hip-hop, and the Lakers."""
36:03;36:08;"It's like a real enthusiasm. It doesn't seem like, you know, some like..."
36:08;36:10;"No, it's not super calculated."
36:10;36:13;"Yeah, so you've got to love it. And also, I would also make the case that"
36:13;36:19;"people who hate on the Chili Peppers, it's often... I've seen it so many times, and it bothers me."
36:19;36:23;"I don't like it. When you see somebody make fun of the Chili Peppers, and the first thing they go is like,"
36:23;36:26;"""A bit of butter, but like, a bang, bing, a dang, wing, a ding."""
36:26;36:32;"They like pick up on... There's like a handful of Kiedis lyrical moments where he gets into his like,"
36:32;36:36;"""Wing-a-ding-dang"" type thing. And people love to make fun of that."
36:36;36:40;"And so sometimes I've seen people be like, ""Oh man, I mean like, listen, they got a few songs,"
36:40;36:45;"""Under the Bridge, whatever, but you know, the wing-a-ding-dang-a-dang, California Mop."""
36:45;36:48;"And also like, they make fun of him talking about California so much."
36:48;36:52;"But there's a part of me that's like, ""You know what? I mean, this goes back to the"
36:52;36:57;"""Everything dope has a touch of cringe, every silver lining has a chunk of dunk."""
36:57;37:02;"I'm kind of like, the fact that Kiedis can just get into his wing-a-ding-ding stuff,"
37:02;37:09;"and then also write these truly beautiful ballads about like, vulnerability and stuff."
37:09;37:12;"I'm like, that contrast makes me like them even more."
37:12;37:18;"I appreciate ""Under the Bridge"" more because it's on the same album as ""Suck My Kiss,"" for instance."
37:18;37:23;"You keep bringing up ""Suck My Kiss."" I think it's my favorite of like, the nasty Chili's like, funk songs."
37:23;37:30;"""When I'm sailing."" But yeah, I do feel you on the like... Yeah, without the ballads,"
37:30;37:35;"""Aerosmith"" to me is nothing, and Chili's to me are nothing."
37:35;37:39;"[laughter]"
37:39;37:43;"Anthony, listen to me. Without the ballads, you are nothing."
37:43;37:49;"You are absolutely nothing to me. You are garbage and trash with the ballads."
37:49;37:51;"However, you are something."
37:51;37:56;"They're sublime, Anthony. I'm like a curator. I'm a German curator."
37:56;38:02;"Anthony, your ballads. Kiedis definitely like, developed his own completely idiosyncratic vocal style,"
38:02;38:06;"much like Steve and Tyler, which is why I thought of the Chili's."
38:06;38:10;"To me, there's a Kiedis-Tyler through line."
38:10;38:15;"They're different generations, but they are very similar in their vibe."
38:15;38:20;"They've got deep souls, as is evidenced by the lyrics they wrote for their ballads."
38:20;38:24;"But they also got a streak of nasty that not everybody has."
38:24;38:27;"They're not bashful about their sexuality."
38:27;38:29;"[laughter]"
38:29;38:35;"Yeah, we just think back to the Chili Peppers just wearing socks on their d***s."
38:35;38:36;"Oh my God."
38:36;38:37;"And their light bulb heads."
38:37;38:38;"That was crazy."
38:38;38:42;"They are such an iconic mix of depth and goofiness."
38:42;38:45;"They are actually a very fascinating American band."
38:45;38:49;"I think whoever wrote that email deserves props."
38:49;38:51;"But again, it gets back to the same thing."
38:51;38:55;"Every American band you could think of, there's always this caveat where you're like,"
38:55;39:00;"you can just picture the person in the conversation just laughing it out of the room."
39:00;39:06;"Just be like, you know, you picture you're at Hank Azaria's poker night."
39:06;39:11;"And people are like, ""Alright, who's the American band that can go toe-to-toe"
39:11;39:13;"with the Stones, Led Zeppelin, whoever?"""
39:13;39:15;"And you're just like, ""RHCP."""
39:15;39:17;"Yeah, it doesn't track."
39:17;39:19;"That's just America, isn't it?"
39:19;39:23;"That the bands we're talking about, there's always something funny."
39:23;39:24;"So where do we end up?"
39:24;39:28;"Eagles, Aerosmith, and the Chili Peppers."
39:28;39:32;"Honorable mention for the Beach Boys."
39:32;39:35;"And the good old Grateful Dead, man."
39:35;39:38;"But part of the reason that we love the Dead is similar to the Chili Peppers,"
39:38;39:44;"is they have these like, ""What the f***"" moments that not everybody gets."
39:44;39:47;"It's like, why are they just..."
39:47;39:52;"Mostly Bob Weir's contributions."
39:52;39:57;"I can see the Dead through the eyes of somebody who would have been more into"
39:57;39:59;"Led Zeppelin and The Who or something."
39:59;40:05;"I can totally imagine somebody who was into that specific type of big-name rock bands"
40:05;40:10;"and them going to a Dead show in the late '70s and seeing these guys"
40:10;40:15;"just do a 15-minute version of ""Not Fade Away"" and just be like,"
40:15;40:17;"""What the f*** is this?"""
40:17;40:19;"And be like, ""No, but Jerry's really good."""
40:19;40:21;"And then even that, just not being able to..."
40:21;40:22;"I can see it through the haters' eyes."
40:22;40:26;"But anyway, the last thing I'll say is that one thought I have about this"
40:26;40:30;"is that maybe America also is just like, it's too big of a country."
40:30;40:36;"So we don't have a Rolling Stones, but we have Leonard Skinner and the Allman Brothers."
40:36;40:40;"You can't pick a Southern rock band to represent all of America."
40:40;40:44;"They represent where they're from and their beloved bands and their institutions."
40:44;40:47;"Or even Red Hot Chili Peppers are so California."
40:47;40:53;"A British band can be super British-y because it's a smaller country."
40:53;40:58;"And I'm sure English people would obviously still have their own regional biases"
40:58;41:02;"about which artists they feel represent them or their point of view."
41:02;41:05;"But all these bands, they're just so specific to their place."
41:05;41:08;"Red Hot Chili Peppers is obviously such an LA band."
41:08;41:12;"The idea of them representing the Purple Mountains of Majesty,"
41:12;41:15;"the Badlands of North Dakota."
41:15;41:17;"That's a really good point."
41:17;41:22;"The artist that makes me think that they sort of did that would be Springsteen in the '80s."
41:22;41:27;"Not a band, as discussed, but he was definitely reaching for that."
41:27;41:29;"That evens the playing field or something."
41:29;41:32;"If somebody was like, a lot of great bands started in London."
41:32;41:34;"The Clash, the Rolling Stones, whatever."
41:34;41:36;"What great band started in New York?"
41:36;41:38;"And then you'd be like, oh man, where to start? Velvet Underwear?"
41:38;41:42;"There's something about that conversation that suddenly feels like an even playing field."
41:42;41:45;"Or even just being like, if you went city by city,"
41:45;41:49;"what are great bands from LA or San Francisco as opposed to Manchester?"
41:49;41:52;"And you'd be like, well Manchester, of course you have the Smiths, Neogala."
41:52;41:57;"But San Francisco, you have the Grateful Dead and Green Day."
41:57;41:58;"The Dead Kennedys."
41:58;41:59;"Dead Kennedys."
41:59;42:04;"Something about that conversation, suddenly I can see it in focus more."
42:04;42:06;"And I'm kind of like, oh yeah, of course."
42:06;42:11;"These American cities have amazing histories, as do those English cities."
42:11;42:13;"It just all makes more sense that way."
42:13;42:17;"America never really had a fair shot. It's just too big of a country."
42:17;42:18;"Great thesis."
42:18;42:19;"Thank you."
42:19;42:23;"I've got a bad disease"
42:23;42:30;"Off from my brain is where I bleed"
42:30;42:34;"Insanity it seems"
42:34;42:41;"Has got me by my soul to squeeze"
42:41;42:45;"Without a love for me"
42:47;42:52;"Without a dietary's I squeeze"
42:52;42:57;"The angels in my dream"
42:57;43:03;"In turn to demons of greed that's me"
43:03;43:08;"Where I go I just don't know"
43:08;43:14;"Like I took, I took, I took it slow"
43:14;43:19;"When I find my peace of mind"
43:19;43:24;"I'm gonna give you some of my good time"
43:24;43:28;"We just took a short break and we started talking about coffee."
43:28;43:33;"And then suddenly everybody's got some, no pun intended, hot takes."
43:33;43:39;"So Jake and Nick just said to me that the first cup of the day has got to be hot."
43:39;43:46;"And these are two Angelinos living in this godforsaken desert town"
43:46;43:51;"with the cloudless skies and the sun beating down on you."
43:51;43:57;"And even in this environment, you two are insisting that the first cup of the day has got to be hot?"
43:57;43:58;"Absolutely."
43:58;43:59;"Yeah."
43:59;44:04;"I think my palate is what you, it doesn't matter what's going on with the temperature."
44:04;44:08;"My palate wants just sort of a hot coffee."
44:08;44:13;"Obviously in quarantine, I imagine people's options are somewhat limited"
44:13;44:20;"because it's not like you can just go take a bleary-eyed walk to the local coffee shop and get an iced coffee."
44:20;44:24;"So yeah, at home, the easiest way to make coffee generally is hot coffee."
44:24;44:29;"But wait, Seinfeld, from a Canadian perspective, you're also agreeing first cup of the day's got to be hot?"
44:29;44:34;"No, I wouldn't say, like, well, I think in Canada it's a little different."
44:34;44:39;"You don't want to be drinking cold coffee on, like, a February morning, for sure."
44:39;44:42;"Right, but then, you know, of course it can get hot in the summer in Canada."
44:42;44:48;"Yeah, but then I think you're in the habit of drinking hot coffee because of those winters, so it just sort of carries through."
44:48;44:52;"I mean, I guess there are certain people who will switch over, but that's never been my..."
44:52;44:55;"Yeah, but that doesn't make any sense because in the winter,"
44:55;45:00;"an average Canadian also gets in the habit of wearing a toque and snowshoes."
45:00;45:04;"That's a habit you break in the summer."
45:04;45:09;"Some people wear those toques year-round, though. Some people are going to wear a toque in July."
45:09;45:14;"I got to ask you, am I using that correctly? Does a toque imply kind of like a heavy-ish, like, knit winter hat?"
45:14;45:19;"It does, and I got to say, what do you call it here, beanie?"
45:19;45:21;"Yeah, often it's a beanie."
45:21;45:26;"A beanie, for me, is one of those, like, kids' multicolored hats with a propeller on top."
45:26;45:28;"Oh, right, like a '50s..."
45:28;45:32;"Like a 1950s, yeah, with, like, the spinning propeller."
45:32;45:38;"That's something I got to admit, is that any American who thinks that ""toque"" is a funny word,"
45:38;45:41;"there's nothing funnier about the word ""toque"" than ""beanie."""
45:41;45:43;"Arguably, ""beanie"" is even goofier."
45:43;45:45;"""Beanie"" sounds insane."
45:45;45:51;"But Seinfeld, what about now that you live in the godforsaken desert town of Los Angeles?"
45:51;45:57;"I'm drinking the cold brew. I'll have a bunch in the fridge, so I'll grab one in the morning,"
45:57;45:59;"but it doesn't really hit me. Like, I need more than that,"
45:59;46:05;"so the cold brew is almost just like a precursor to the main course, which is like a second cup of coffee."
46:05;46:06;"A hot coffee."
46:06;46:09;"The hot coffee. Yeah, I'm building up to that hot coffee."
46:09;46:13;"And there's no kind of temperature whiplash happening in your body?"
46:13;46:16;"Well, I'm doing this over the course of, let's say, an hour, an hour and a half,"
46:16;46:20;"so it's not like I'm just, like, pounding the cold brew then immediately into the hot coffee."
46:20;46:25;"I just got to say that I have such great memories of, in the old world,"
46:25;46:31;"not having a coffee yet, and bleary-eyed rolling up to a restaurant and ordering an iced coffee,"
46:31;46:35;"and it's coming out cold as f*** with some big ice cubes,"
46:35;46:41;"and just slurping down that restaurant-quality iced coffee, and just being off to the races,"
46:41;46:43;"often getting a second one very quickly."
46:43;46:48;"Or, you know, walking around on a hot New York day and just rolling up to Dunkin' Donuts"
46:48;46:53;"to get my big iced coffee, and just hitting that, and the combination of the caffeine"
46:53;46:58;"and the Arctic freeze of the ice, just an amazing feeling."
46:58;47:01;"I think the disadvantage of the ice, though, is that it melts,"
47:01;47:07;"so that by the end of the coffee, you're drinking, like, watery, diluted, kind of swill coffee."
47:07;47:09;"I think that's part of the charm of the iced coffee."
47:09;47:15;"I guess also I consume things so quickly. I'm a fast eater, I'm a fast drinker,"
47:15;47:19;"that that's not too much of a problem for me. I guess I see what you're saying."
47:19;47:25;"Sometimes when I'm having my third or fourth iced coffee of the day, like a 3pm one,"
47:25;47:29;"and it's like... I mean, I'm not saying it's not more. There's people who have 10."
47:29;47:31;"I'm saying third or fourth is like the end."
47:31;47:32;"Ice coffees?"
47:32;47:38;"Maybe. I'm picturing a small one. I'm picturing 3pm, rolling up to some coffee shop,"
47:38;47:42;"and not exactly needing it, but getting it to be social, and then holding it,"
47:42;47:46;"and then it gets watered down and feeling kind of gross about the whole situation."
47:46;47:49;"I agree. That's a bad feeling. But I'm just saying, first things first."
47:49;47:51;"I love that Arctic Blast."
47:51;47:57;"I like the concept of getting the iced coffee to be social. It's like it's booze."
47:57;47:58;"Totally."
47:58;48:04;"At a bar. I've done that move of like, ""I don't need this eighth beer, but I'm just going to nurse it."
48:04;48:09;"I'm going to hold it."" But doing that with iced coffee at 3pm is so funny."
48:09;48:14;"No, but you know what's funny? That's such a more familiar feeling to me than what you're talking about."
48:14;48:19;"Because even though I can on occasion drink, I'm not anti-drinking."
48:19;48:23;"It's just one of those things though where I just-- maybe sometime in college,"
48:23;48:27;"where people always pressure you to drink, I think maybe I just had one too many times"
48:27;48:31;"of getting too f***ed up or something, and I was like, ""I'm not going to not drink."""
48:31;48:36;"But a flip switched in me where I was just kind of like, ""I will never be forced to drink again."""
48:36;48:42;"And I'm very impressionable, but that was just one thing where I put my foot down,"
48:42;48:45;"and I did get to a point where it's kind of like, ""Yo, yo, come on. No, are you serious?"
48:45;48:47;"Come on, have another drink. I'm getting drinks."""
48:47;48:51;"That's just one thing where I put my foot down. I'm like, ""Friend, you can buy it."
48:51;48:54;"You can put it in front of me. I will not drink it. Save yourself the cash."
48:54;48:56;"I don't want it. I don't need it. I'll have a water."""
