Start Timestamp;End Timestamp;Transcript
01:25:15;01:25:17;"and what instrument does Pasquale play?"
01:25:17;01:25:19;"he's the pizza guy"
01:25:19;01:25:21;"so he just"
01:25:21;01:25:23;"it looks like he just hangs out"
01:25:23;01:25:25;"he's kind of a hype man?"
01:25:25;01:25:26;"oh wait no no no no no no"
01:25:26;01:25:28;"okay Pasquale's the drummer"
01:25:28;01:25:30;"he's like the Bob Nisdanovich"
01:25:30;01:25:32;"of Spank"
01:25:32;01:25:34;"just holding it down"
01:25:34;01:25:36;"Bob Nisdanovich was like the second drummer"
01:25:36;01:25:38;"he was like the hype man"
01:25:38;01:25:40;"second drummer of Pavement"
01:25:40;01:25:42;"and there's a guy in the Mighty Mighty Boss Duns"
01:25:42;01:25:43;"who just danced right?"
01:25:43;01:25:44;"yes exactly"
01:25:44;01:25:46;"maybe that's like Pasquale"
01:25:46;01:25:48;"I can imagine somebody from Chuck E. Cheese"
01:25:48;01:25:50;"when the story blew up"
01:25:50;01:25:52;"just being like are you guys f***ing stupid?"
01:25:52;01:25:54;"it's called Pasquale's"
01:25:54;01:25:56;"do you think that that's"
01:25:56;01:25:58;"in some way trying to obfuscate"
01:25:58;01:26:00;"the connection to Chuck E. Cheese?"
01:26:00;01:26:02;"I mean if Disney"
01:26:02;01:26:04;"opened a place called"
01:26:04;01:26:06;"Donald Duck Pizza"
01:26:06;01:26:08;"would you think they're trying to hide"
01:26:08;01:26:10;"something? Are you f***ing stupid?"
01:26:10;01:26:12;"It's Pasquale"
01:26:12;01:26:14;"of course it's Chuck E. Cheese"
01:26:14;01:26:16;"affiliated. If somebody opened"
01:26:16;01:26:18;"a Captain America"
01:26:18;01:26:20;"themed restaurant, would you be shocked"
01:26:20;01:26:22;"to understand that it's connected to the Avengers?"
01:26:22;01:26:24;"Are you f***ing stupid?"
01:26:24;01:26:26;"yeah don't blame Chuck E. Cheese"
01:26:26;01:26:28;"for your own ignorance. If you know Chuck E. Cheese"
01:26:28;01:26:30;"you know Pasquale, you know what he does"
01:26:30;01:26:32;"and you know that there's no lie there"
01:26:32;01:26:34;"there's no untruth being told"
01:26:34;01:26:36;"that's super like Kellyanne Conway"
01:26:36;01:26:38;"just coming out guns blazing"
01:26:38;01:26:40;"to talk to the press and just being like"
01:26:40;01:26:42;"okay first of all for you to imply"
01:26:42;01:26:44;"that Pasquale"
01:26:44;01:26:46;"is not part of"
01:26:46;01:26:48;"I mean you hear Pasquale, you first think of Chuck E. Cheese"
01:26:48;01:26:50;"Pasquale's probably even more famous than Chuck E. Cheese"
01:26:50;01:26:52;"are you? Oh my god"
01:26:52;01:26:54;"everyone knows that Pasquale"
01:26:54;01:26:56;"is the Bob Nostanovich of the Chuck E. Cheese"
01:26:56;01:26:58;"band. Everyone knows it"
01:26:58;01:27:00;"[laughter]"
01:27:00;01:27:02;"Chuck E. Cheese"
01:27:02;01:27:04;"just hires like a few famous"
01:27:04;01:27:06;"drummers to kind of do a PSA to get them"
01:27:06;01:27:08;"out of hot water like Ringo is just like"
01:27:08;01:27:10;"now listen"
01:27:10;01:27:12;"us drummers, we're the heartbeat of"
01:27:12;01:27:14;"the whole band and I can't tell you"
01:27:14;01:27:16;"there are many times that people"
01:27:16;01:27:18;"would talk about me as if I"
01:27:18;01:27:20;"you know I wasn't at the same level as"
01:27:20;01:27:22;"Paul and John but you know there's no Beatles without"
01:27:22;01:27:24;"Ringo and I gotta say Pasquale"
01:27:24;01:27:26;"he's my brother"
01:27:26;01:27:28;"peace and love"
01:27:28;01:27:30;"peace and love, give Pasquale a chance"
01:27:30;01:27:32;"I think Pasquale, he's got two jobs"
01:27:32;01:27:34;"right? He's making pizza"
01:27:34;01:27:36;"and wings and he's also drumming in a band"
01:27:36;01:27:38;"what's more relatable than that?"
01:27:38;01:27:40;"Yeah. You know? Gig economy"
01:27:40;01:27:42;"man of the people"
01:27:42;01:27:44;"I also like too"
01:27:44;01:27:46;"that they chose Pasquale because"
01:27:46;01:27:48;"in bands in the past"
01:27:48;01:27:50;"you know when you think of like John Bonham"
01:27:50;01:27:52;"or Keith Moon there's this idea"
01:27:52;01:27:54;"that the drummer is this kind"
01:27:54;01:27:56;"of like party animal"
01:27:56;01:27:58;"less refined kind of character"
01:27:58;01:28:00;"you know when you think of those"
01:28:00;01:28:02;"real classic rock bands"
01:28:02;01:28:04;"driving their car into the pool"
01:28:04;01:28:06;"partying harder you know and I like the"
01:28:06;01:28:08;"fact that with Pasquale"
01:28:08;01:28:10;"they said no no no that stereotype"
01:28:10;01:28:12;"of drummers being the wild"
01:28:12;01:28:14;"ones of the group that's very"
01:28:14;01:28:16;"ignorant. Pasquale actually"
01:28:16;01:28:18;"when he goes into the kitchen to make pizza"
01:28:18;01:28:20;"he makes something more refined"
01:28:20;01:28:22;"and elegant than Chuck E Cheese"
01:28:22;01:28:24;"the front man. Yeah he's like the Neil Peart"
01:28:24;01:28:26;"Yeah exactly"
01:28:26;01:28:28;"he's very bookish and actually by the way"
01:28:28;01:28:30;"Pasquale writes the lyrics"
01:28:30;01:28:32;"[laughter]"
01:28:32;01:28:34;"So guys Matt just shared me"
01:28:34;01:28:36;"on the Pasquale bio"
01:28:36;01:28:38;"and you know Pasquale's got actually"
01:28:38;01:28:40;"quite a back story. His full name is"
01:28:40;01:28:42;"Pasquale P. Pieplate"
01:28:42;01:28:44;"and he's from Naples, Italy"
01:28:44;01:28:46;"shortly after his birth his parents"
01:28:46;01:28:48;"Priscilla and Petro immigrated to"
01:28:48;01:28:50;"America where they opened Pasquale's"
01:28:50;01:28:52;"Pizza which they named after him"
01:28:52;01:28:54;"just a little bit more"
01:28:54;01:28:56;"growing up Pasquale isolated himself"
01:28:56;01:28:58;"from sports and other activities to study the"
01:28:58;01:29:00;"art of pizza making hoping"
01:29:00;01:29:02;"to one day inherit his parents store"
01:29:02;01:29:04;"he also taught his"
01:29:04;01:29:06;"younger sister Paola"
01:29:06;01:29:08;"everything he learned about pizza"
01:29:08;01:29:10;"[laughter]"
01:29:10;01:29:12;"This is so epic"
01:29:12;01:29:14;"but also"
01:29:14;01:29:16;"did they create this back story last week?"
01:29:16;01:29:18;"This is unbelievable"
01:29:18;01:29:20;"Was this always"
01:29:20;01:29:22;"part of Chuck E Cheese's lore or did they"
01:29:22;01:29:24;"create this entry last week to kind of"
01:29:24;01:29:26;"explain why Pasquale's"
01:29:26;01:29:28;"was this online pizza"
01:29:28;01:29:30;"I have an answer for that. Could you imagine"
01:29:30;01:29:32;"that they were thinking"
01:29:32;01:29:34;"holy sh*t we gotta really backtrack"
01:29:34;01:29:36;"here. We gotta paper over this"
01:29:36;01:29:38;"[laughter]"
01:29:38;01:29:40;"I also just love the idea"
01:29:40;01:29:42;"too of being like to really"
01:29:42;01:29:44;"emphasize why Pasquale's"
01:29:44;01:29:46;"is different than Chuck E Cheese and to be like"
01:29:46;01:29:48;"listen Pasquale ended up"
01:29:48;01:29:50;"kind of coming into the"
01:29:50;01:29:52;"fold with the Chuck E Cheese crew"
01:29:52;01:29:54;"and joining Munch's Make Believe band"
01:29:54;01:29:56;"that was as a drummer"
01:29:56;01:29:58;"but you gotta understand something"
01:29:58;01:30:00;"performing night after night in this kind"
01:30:00;01:30:02;"of corporate American pizzeria"
01:30:02;01:30:04;"environment that was really hard"
01:30:04;01:30:06;"for an Italian immigrant whose"
01:30:06;01:30:08;"parents made real Neapolitan"
01:30:08;01:30:10;"pizza so every"
01:30:10;01:30:12;"night Pasquale"
01:30:12;01:30:14;"he's wailing away on the drums but he's looking out at these kids"
01:30:14;01:30:16;"eating this dog sh*t American pizza"
01:30:16;01:30:18;"and you know as an Italian"
01:30:18;01:30:20;"that was painful for him on a"
01:30:20;01:30:22;"cultural level and he"
01:30:22;01:30:24;"always said to Chuck E can't we"
01:30:24;01:30:26;"make the pizza a little bit better"
01:30:26;01:30:28;"I can't get down with this sh*t. Chuck E always brushed"
01:30:28;01:30:30;"him aside so the COVID"
01:30:30;01:30:32;"19 pandemic really"
01:30:32;01:30:34;"allowed him to finally have"
01:30:34;01:30:36;"the time away from drumming"
01:30:36;01:30:38;"to kind of get in the kitchen"
01:30:38;01:30:40;"and create a pizza that was up to"
01:30:40;01:30:42;"his standards and"
01:30:42;01:30:44;"listen if"
01:30:44;01:30:46;"any members of the press are also"
01:30:46;01:30:48;"Italian immigrants with a"
01:30:48;01:30:50;"story like that by all means"
01:30:50;01:30:52;"raise your hand but I think"
01:30:52;01:30:54;"the rest of us should probably"
01:30:54;01:30:56;"check our privilege and let Pasquale"
01:30:56;01:30:58;"do what he wants to do"
01:30:58;01:31:00;"as an immigrant drummer"
01:31:00;01:31:02;"There's a dark side to Pasquale's"
01:31:02;01:31:04;"story. Oh no."
01:31:04;01:31:06;"After his parents split up"
01:31:06;01:31:08;"and settled in America, Pasquale"
01:31:08;01:31:10;"gained full control of their restaurant"
01:31:10;01:31:12;"Determined to not only attract"
01:31:12;01:31:14;"customers through pizza but also through"
01:31:14;01:31:16;"entertainment, he performed live stand-up"
01:31:16;01:31:18;"comedy, recruited his nephew Gino"
01:31:18;01:31:20;"to help make pizzas, and added"
01:31:20;01:31:22;"arcade games as a mainstay"
01:31:22;01:31:24;"However his plan backfired due to"
01:31:24;01:31:26;"the negative reception of his jokes"
01:31:26;01:31:28;"Faced with a slow decline"
01:31:28;01:31:30;"of customers, Pasquale"
01:31:30;01:31:32;"intended to close the restaurant but"
01:31:32;01:31:34;"a surprise encounter with a singing"
01:31:34;01:31:36;"mouse began to bring in more"
01:31:36;01:31:38;"customers, prompting Pasquale"
01:31:38;01:31:40;"to rename his restaurant"
01:31:40;01:31:42;"Chuck E. Cheese's after his new star"
01:31:42;01:31:44;"and he and Chuck E. Cheese"
01:31:44;01:31:46;"remained friends ever since. So he's the founder"
01:31:46;01:31:48;"of Chuck E. Cheese. Pasquale's the brains of the operation"
01:31:48;01:31:50;"Yeah. Chuck E. Cheese"
01:31:50;01:31:52;"is just the front man. Okay but it still"
01:31:52;01:31:54;"stands that Pasquale's an Italian immigrant"
01:31:54;01:31:56;"who links up with this"
01:31:56;01:31:58;"American guy and then next"
01:31:58;01:32:00;"thing you know they're this big"
01:32:00;01:32:02;"mainstream rock act"
01:32:02;01:32:04;"and children's pizza joint"
01:32:04;01:32:06;"Pasquale's is kind of, if he was a musician"
01:32:06;01:32:08;"this is like his back to basics album"
01:32:08;01:32:10;"You know this is Bono being like, ""Listen, at the"
01:32:10;01:32:12;"end of the day, we're just a couple Irish"
01:32:12;01:32:14;"kids who love punk rock"
01:32:14;01:32:16;"and this song is dedicated to Joey Ramone."""
01:32:16;01:32:18;"Or the Rolling Stones being like"
01:32:18;01:32:20;"""Listen, we're just still those kids"
01:32:20;01:32:22;"who love collecting blues records."""
01:32:22;01:32:24;"Okay so Pasquale's got an interesting story"
01:32:24;01:32:26;"Can I also just sort of say"
01:32:26;01:32:28;"something that's kind of obvious, which is"
01:32:28;01:32:30;"that this is psychotic"
01:32:30;01:32:32;"that there's no story"
01:32:32;01:32:34;"of Pasquale"
01:32:34;01:32:36;"There's no TV show"
01:32:36;01:32:38;"or anything, they literally had"
01:32:38;01:32:40;"Seinfeld, where are you reading this?"
01:32:40;01:32:42;"This is Wikipedia?"
01:32:42;01:32:44;"This is the Chuck E. Cheese"
01:32:44;01:32:46;"fandom page, the sub-wiki"
01:32:46;01:32:48;"of it, the entry under"
01:32:48;01:32:50;"Pasquale. I mean"
01:32:50;01:32:52;"I guess this predates the whole scandal, I don't know"
01:32:52;01:32:54;"Well clearly there's more"
01:32:54;01:32:56;"than meets the eye to the Chuck E. Cheese universe"
01:32:56;01:32:58;"and maybe should have been called Pasquale's from the start"
01:32:58;01:33:00;"That's what it sounds like to me"
01:33:00;01:33:02;"Alright, should we bang out a top 5?"
01:33:02;01:33:04;"It's time for the"
01:33:04;01:33:06;"Top 5"
01:33:06;01:33:08;"5 on iTunes"
01:33:08;01:33:10;"This week's"
01:33:10;01:33:12;"top 5, we're comparing"
01:33:12;01:33:14;"the top 5 Billboard hits"
01:33:14;01:33:16;"this week in 1977"
01:33:16;01:33:18;"with the top 5 Apple"
01:33:18;01:33:20;"music songs right now"
01:33:20;01:33:22;"2020. Why"
01:33:22;01:33:24;"1977? Is it because"
01:33:24;01:33:26;"Jake and Kanye were born"
01:33:26;01:33:28;"that year? No, I think you know"
01:33:28;01:33:30;"why, but Jake, tell them"
01:33:30;01:33:32;"in case they forgot"
01:33:32;01:33:34;"I mean, we've been talking about it for about an hour now"
01:33:34;01:33:36;"Chuck E. Cheese was founded in"
01:33:36;01:33:38;"1977 in San Jose, California"
01:33:38;01:33:40;"As we"
01:33:40;01:33:42;"go through these hits of 1977"
01:33:42;01:33:44;"we can kind of imagine"
01:33:44;01:33:46;"that we're watching"
01:33:46;01:33:48;"the Leonardo DiCaprio"
01:33:48;01:33:50;"Nolan Bushnell"
01:33:50;01:33:52;"biopic, and this is the soundtrack"
01:33:52;01:33:54;"So the number 5 song"
01:33:54;01:33:56;"this week in 1977"
01:33:56;01:33:58;"Marvin Gaye, ""Got to Give It Up"""
01:33:58;01:34:00;"Let's take a listen"
01:34:00;01:34:04;"And I guess this is a live version"
01:34:04;01:34:10;"Or maybe this is kind of like a fake live"
01:34:10;01:34:12;"version"
01:34:12;01:34:14;"It's like ""What's Going On"" had that sort of"
01:34:14;01:34:16;"synesthetic, like fake crowd"
01:34:16;01:34:18;"This song was a response to a request"
01:34:18;01:34:20;"from Gaye's record label that he performed"
01:34:20;01:34:22;"disco music"
01:34:22;01:34:24;"Right, kind of disco, but"
01:34:24;01:34:26;"such a good song"
01:34:26;01:34:28;"And this is infamously the song"
01:34:28;01:34:30;"that Blurred Lines"
01:34:30;01:34:32;"was inspired by"
01:34:32;01:34:34;"and the Gaye estate sued"
01:34:34;01:34:36;"Robin Thicke and Pharrell and all those people"
01:34:36;01:34:38;"What happened"
01:34:38;01:34:40;"with that lawsuit? Who won that?"
01:34:40;01:34:42;"The Marvin Gaye's family did"
01:34:42;01:34:44;"I mean, it's very similar"
01:34:44;01:34:46;"It's similar, but as I've said before"
01:34:46;01:34:48;"they're different songs"
01:34:48;01:34:50;"At some point, you shouldn't be able to copyright"
01:34:50;01:34:52;"buy"
01:34:52;01:34:58;"I don't know any musicians who really like that"
01:34:58;01:35:00;"decision"
01:35:00;01:35:02;"because I think people just felt like"
01:35:02;01:35:04;"nobody's even defending Blurred Lines or anything"
01:35:04;01:35:06;"or being like, no, Blurred Lines is original"
01:35:06;01:35:08;"because it's not about that"
01:35:08;01:35:10;"You just don't want to be in positions when"
01:35:10;01:35:12;"people play me sh*t all the time"
01:35:12;01:35:14;"like, ""Yo, doesn't this sound like Vampire Weekend?"""
01:35:14;01:35:16;"And I've always been kind of like"
01:35:16;01:35:18;"""Eh, maybe"""
01:35:18;01:35:20;"I think that the common elements that we maybe put together"
01:35:20;01:35:22;"or something that we didn't own in the first place"
01:35:22;01:35:24;"the idea that somebody does it"
01:35:24;01:35:26;"if they change it enough"
01:35:26;01:35:28;"I kind of feel like if somebody does something"
01:35:28;01:35:30;"that's obviously egregiously inspired"
01:35:30;01:35:32;"by something else"
01:35:32;01:35:34;"the price they should have to pay is just kind of like"
01:35:34;01:35:36;"embarrassment"
01:35:36;01:35:38;"Like, ""Alright, I see what you're going for"""
01:35:38;01:35:40;"You're doing like a pastiche"
01:35:40;01:35:42;"Sometimes when you listen to two things, you're like"
01:35:42;01:35:44;"""Oh, those are pretty similar"""
01:35:44;01:35:46;"But then, when they can't prove that the melody's the same"
01:35:46;01:35:48;"or the bassline's the same"
01:35:48;01:35:50;"the thing that always kind of kills it for me"
01:35:50;01:35:52;"is when you actually see the legal language"
01:35:52;01:35:54;"and I've seen this for other"
01:35:54;01:35:56;"lawsuits like this"
01:35:56;01:35:58;"where somebody will describe what the infringement is"
01:35:58;01:36:00;"and so their lawyer has to put that into writing"
01:36:00;01:36:02;"and sometimes it'll be like"
01:36:02;01:36:04;"""The mix of repetitive percussion"
01:36:04;01:36:06;"distorted vocal sounds"
01:36:06;01:36:08;"atmospheric keyboards"
01:36:08;01:36:10;"and angular guitar"""
01:36:10;01:36:12;"They'll describe sh*t like that and be like"
01:36:12;01:36:14;"""Yo, you're just describing genres of music now"""
01:36:14;01:36:16;"So I understand why"
01:36:16;01:36:18;"and I think they were even on record as being like"
01:36:18;01:36:20;"""Oh yeah, our song's inspired by 'Got To Give It Up'"""
01:36:20;01:36:22;"But it's like, at a certain point"
01:36:22;01:36:24;"you're basically saying to somebody"
01:36:24;01:36:26;"""It was my idea to use a cowbell and minimalist"
01:36:26;01:36:28;"vibe on a song"
01:36:28;01:36:30;"It's a very slippery slope"
01:36:30;01:36:32;"It's a bad vibe"""
01:36:32;01:36:34;"Great song though."
01:36:34;01:36:36;"The craziest lawsuit ever was the one that"
01:36:36;01:36:38;"I remember being like ""What the hell?"""
01:36:38;01:36:40;"Was the George Harrison ""My Sweet Lord"""
01:36:40;01:36:42;"Well, he took the whole melody"
01:36:42;01:36:44;"and he's like ""Oh damn, oops, I forgot"""
01:36:44;01:36:46;"But talk about different vibes"
01:36:46;01:36:48;"It was like 60s Motown"
01:36:48;01:36:50;"and then George's"
01:36:50;01:36:52;"70s sort of like"
01:36:52;01:36:54;"Hare Krishna, like hippie music"
01:36:54;01:36:56;"Totally different vibes"
01:36:56;01:36:58;"Yeah, you could even argue that"
01:36:58;01:37:00;"To me, I always grew up being like"
01:37:00;01:37:02;"""Alright, there's a certain length of melody"
01:37:02;01:37:04;"that once somebody"
01:37:04;01:37:06;"makes that, that's theirs"
01:37:06;01:37:08;"and if you copy that exact same melody and chord progression"
01:37:08;01:37:10;"you are kind of entering this thing"
01:37:10;01:37:12;"where it's the same song"""
01:37:12;01:37:14;"I buy that, but I'd be open to even a deeper"
01:37:14;01:37:16;"interpretation, but I just think once you're"
01:37:16;01:37:18;"describing elements of music together"
01:37:18;01:37:20;"you start to describe genres"
01:37:20;01:37:22;"and it's kind of like, that gets weird"
01:37:22;01:37:24;"That's where you get into shit where you're like"
01:37:24;01:37:26;"""Should Radiohead be allowed to sue Muse?"""
01:37:26;01:37:28;"Just like, gigantic lawsuit"
01:37:28;01:37:30;"just like ""We're shutting down Muse"""
01:37:30;01:37:32;"The elements of Muse's"
01:37:32;01:37:34;"entire career are clearly inspired"
01:37:34;01:37:36;"by the mix of"
01:37:36;01:37:38;"prog rock, soaring, yearning"
01:37:38;01:37:40;"vocals by an Englishman"
01:37:40;01:37:42;"that we perfected on our album"
01:37:42;01:37:44;"""OK Computer"""
01:37:44;01:37:46;"We're asking for Muse to cease operations"
01:37:46;01:37:48;"Anyway, the number 5 song"
01:37:48;01:37:50;"in 2020"
01:37:50;01:37:52;"is ""Polo G"" flex featuring"
01:37:52;01:37:54;"Juice WRLD"
01:37:54;01:37:56;"RIP to Juice WRLD"
01:37:56;01:37:58;"He died last December"
01:37:58;01:38:00;"at the age of 21, but this is the"
01:38:00;01:38:02;"6th single featuring"
01:38:02;01:38:04;"Juice WRLD since his death"
01:38:04;01:38:06;"Sorry, who's the artist?"
01:38:06;01:38:08;"This is ""Polo G"""
01:38:08;01:38:10;"but it's featuring Juice WRLD"
01:38:10;01:38:12;"who died"
01:38:12;01:38:14;"""Polo G"""
01:38:14;01:38:16;"I like the general vibe"
01:38:16;01:38:18;"In my situation, I can't get the lyrics"
01:38:18;01:38:20;"in front of me right now"
01:38:20;01:38:22;"which I think for new rappers"
01:38:22;01:38:24;"is a little bit of a shame"
01:38:24;01:38:26;"but I like it"
01:38:26;01:38:28;"I like the ""Polo G"""
01:50:22;01:50:24;"And then Leonard Cohen said, ""Somebody sued them on my behalf."""
01:50:26;01:50:28;"Hmm."
01:50:30;01:50:32;"When I need you"
01:50:34;01:50:36;"Just close my eyes"
01:50:36;01:50:38;"And I'm with you"
01:50:40;01:50:42;"And all of that I so wanna give you"
01:50:46;01:50:48;"Very slow BPM here."
01:50:48;01:50:50;"Okay, I hear the famous Blue Raincoat thing, but"
01:50:50;01:50:52;"it is a very slow song."
01:50:52;01:50:54;"When I need love"
01:50:56;01:50:58;"I hold out my hands"
01:51:00;01:51:02;"And I touch love"
01:51:02;01:51:04;"I feel like I can hear the Albert Hammond in this."
01:51:04;01:51:06;"He really wrote some"
01:51:06;01:51:08;"powerful ballads."
01:51:10;01:51:12;"Now, he wrote ""The Air That I Breathe"""
01:51:12;01:51:14;"and correct me if I'm wrong,"
01:51:14;01:51:16;"did Radiohead get sued?"
01:51:16;01:51:18;"Yes. I don't know if it was him or the publisher,"
01:51:18;01:51:20;"but ""The Air That I Breathe"""
01:51:20;01:51:22;"by the Hollies, they sued"
01:51:22;01:51:24;"Radiohead over Creep."
01:51:24;01:51:26;"And actually, if you look up"
01:51:26;01:51:28;"Creep right now, Albert Hammond"
01:51:28;01:51:30;"is credited as one of the writers"
01:51:30;01:51:32;"of Creep. Wow."
01:51:32;01:51:34;"It has the same chord progression,"
01:51:34;01:51:36;"which is kind of notable, the way it"
01:51:36;01:51:38;"goes to this major three, but they"
01:51:38;01:51:40;"specifically sued over"
01:51:40;01:51:42;"Tom York's bridge melody."
01:51:42;01:51:44;"It basically is ""The Air That I Breathe."""
01:51:44;01:51:46;"Da-na-na-na-na-na-na."
01:51:48;01:51:50;"Which is the verse of ""The Air That I Breathe."""
01:51:52;01:52:02;"Bees"
01:52:02;01:52:04;"came up on me"
01:52:04;01:52:06;"and then"
01:52:06;01:52:08;"bees"
01:52:08;01:52:10;"made me breathe."
01:52:10;01:52:12;"Although, you know, once you have"
01:52:12;01:52:14;"the same chord progression, it's natural"
01:52:14;01:52:16;"that different minds might go to some of the same"
01:52:16;01:52:18;"places in the scale."
01:52:18;01:52:20;"I feel like that's the same chord progression"
01:52:20;01:52:22;"as ""Lay, Lady, Lay,"" too."
01:52:22;01:52:24;"It's like A,"
01:52:24;01:52:26;"C-sharp, major, D, right?"
01:52:26;01:52:28;"Right, yeah, the major third."
01:52:28;01:52:30;"It's a classic move, because it's"
01:52:30;01:52:32;"outside the key. It's surprising"
01:52:32;01:52:34;"a little bit. It's like a nice moment to get that"
01:52:34;01:52:36;"major third, because you expect a minor third"
01:52:36;01:52:38;"kind of. The number two"
01:52:38;01:52:40;"song in"
01:52:40;01:52:42;"2020 is another future song called"
01:52:42;01:52:44;"""Trillionaire,"" featuring Youngboy Never"
01:52:44;01:52:46;"Broke Again."
01:52:46;01:52:50;"Interestingly,"
01:52:50;01:52:52;"there's just a news article projecting"
01:52:52;01:52:54;"that Jeff Bezos is going to become the"
01:52:54;01:52:56;"world's first trillionaire."
01:52:56;01:52:58;"Brutal. Around 2026."
01:52:58;01:53:00;"So I don't know if Future knew"
01:53:00;01:53:02;"about that when he wrote this song."
01:53:02;01:53:04;"This is kind of a congratulations to Jeff"
01:53:04;01:53:06;"Bezos. What the hell is Bezos"
01:53:06;01:53:08;"doing, man? Yeah, it's"
01:53:08;01:53:10;"bad vibes. Give it away, man."
01:53:10;01:53:12;"Give it"
01:53:12;01:53:14;"away now."
01:53:14;01:53:16;"Give it away, give it away, give it"
01:53:16;01:53:18;"away now."
01:53:18;01:53:20;"No one's going to think that's cool."
01:53:20;01:53:22;"I'm just saying"
01:53:22;01:53:24;"what a power move it would be for one"
01:53:24;01:53:26;"of the truly iconic"
01:53:26;01:53:28;"rappers of our era to"
01:53:28;01:53:30;"on a future"
01:53:30;01:53:32;"album, be like, ""Who are the features on your album?"""
01:53:32;01:53:34;"Be like, ""Well, we got Drake,"
01:53:34;01:53:36;"Youngboy Never Broke Again,"
01:53:36;01:53:38;"all these different names."""
01:53:38;01:53:40;"And be like, ""And then actually, you know"
01:53:40;01:53:42;"what? On track 14, there's actually"
01:53:42;01:53:44;"an Anthony Kiedis feature."" And people"
01:53:44;01:53:46;"would be like, ""Anthony Kiedis from the Chili Peppers?"""
01:53:46;01:53:48;"And be like, ""Look at his Wikipedia page, man."
01:53:48;01:53:50;"He's a singer, songwriter, and rapper."""
01:53:50;01:53:52;"Be like, ""Yeah, I guess"
01:53:52;01:53:54;"you could put it that way."" Just like Anthony Kiedis"
01:53:54;01:53:56;"coming in on the second"
01:53:56;01:53:58;"verse of this song, that'd be so sick."
01:53:58;01:54:00;"That would be very sick. For some reason,"
01:54:00;01:54:02;"I thought you were going to say"
01:54:02;01:54:04;"a Jeff Bezos type of song."
01:54:04;01:54:06;"That's where I thought you were going to."
01:54:06;01:54:08;"A future featuring"
01:54:08;01:54:10;"Anthony Kiedis and Jeff Bezos."
01:54:10;01:54:12;"Oh my god. Bezos"
01:54:12;01:54:14;"just desperate street cred."
01:54:14;01:54:16;"Oh, yeah, yeah, yeah. I'll do like a spoken"
01:54:16;01:54:18;"word thing on your track."
01:54:18;01:54:20;"Jeff Pesos?"
01:54:20;01:54:22;"Oh, yeah."
01:54:22;01:54:24;"I'm sure there will be somebody,"
01:54:24;01:54:26;"a rapper, a musician, somebody called"
01:54:26;01:54:28;"Jeff Pesos at some point."
01:54:28;01:54:30;"Or at the very least, somebody will have a"
01:54:30;01:54:32;"line about like,"
01:54:32;01:54:34;"maybe somebody talking about how they're broke."
01:54:34;01:54:36;"""I'm not Jeff Bezos."
01:54:36;01:54:38;"I've got five pesos."" Or I guess you could also"
01:54:38;01:54:40;"say, ""I've got pesos like Bezos."""
01:54:40;01:54:42;"Because Jeff Bezos has a lot of pesos."
01:54:42;01:54:44;"It's not a great rhyme."
01:54:44;01:54:46;"I don't think Future actually"
01:54:46;01:54:48;"is shouting out Jeff Bezos."
01:54:48;01:54:50;"I wonder how many rappers are"
01:54:50;01:54:52;"actually shouting out Jeff Bezos."
01:54:52;01:54:54;"Because obviously in rap, there's a long"
01:54:54;01:54:56;"tradition, and in all"
01:54:56;01:54:58;"types of music, of kind of"
01:54:58;01:55:00;"valorizing the gangsters"
