Start Timestamp;End Timestamp;Transcript
01:07:25;01:07:28;"Atari was absolutely crushing it in '82,"
01:07:28;01:07:33;"but by '84 they were way on the outs."
01:07:33;01:07:36;"- There is a book that I read once called,"
01:07:36;01:07:38;"I think it was called Console Wars."
01:07:38;01:07:40;"It's basically about the war between Nintendo and Sega."
01:07:40;01:07:41;"- I remember you telling me about this."
01:07:41;01:07:43;"- Yeah, it's actually a pretty interesting book."
01:07:43;01:07:46;"And I think there was also a Hollywood,"
01:07:46;01:07:48;"like a variety article saying like,"
01:07:48;01:07:49;"that Seth Rogen optioned it."
01:07:49;01:07:51;"You know, that'd be kind of a tight movie."
01:07:51;01:07:52;"I must've referenced that, I'm sure,"
01:07:52;01:07:54;"probably like 100 episodes ago,"
01:07:54;01:07:56;"because it's actually a really interesting story"
01:07:56;01:07:58;"about like corporate (beep)"
01:07:58;01:08:00;"because the guy who turned Sega around"
01:08:00;01:08:01;"wasn't a video game guy."
01:08:01;01:08:03;"He was a guy from Mattel,"
01:08:03;01:08:06;"who had kind of like spearheaded like He-Man"
01:08:06;01:08:08;"and like Strawberry Shortcake and (beep) like that."
01:08:08;01:08:10;"And they brought this guy and he's like,"
01:08:10;01:08:11;"""Listen, I don't know a lot about video games,"
01:08:11;01:08:14;"""but what I do know is branding and IP"
01:08:14;01:08:16;"""and winning the hearts and minds of children."""
01:08:16;01:08:19;"And so anyway, Sega really gave Nintendo"
01:08:19;01:08:20;"a run for their money"
01:08:20;01:08:22;"and they actually overtook them briefly in the '90s."
01:08:22;01:08:26;"But before that, before Nintendo just took over the world,"
01:08:26;01:08:28;"the picture that they paint in this book"
01:08:28;01:08:30;"is that with the kind of collapse of Atari"
01:08:30;01:08:31;"in the early '80s,"
01:08:31;01:08:33;"there was this weird period in the mid '80s"
01:08:33;01:08:35;"where people were like, ""Video games are over."""
01:08:35;01:08:36;"- Yeah."
01:08:36;01:08:38;"- In the world of toys and entertainment,"
01:08:38;01:08:40;"I guess the vibe everybody got was like,"
01:08:40;01:08:43;"Atari had its run, which is always funny to think."
01:08:43;01:08:44;"I guess hindsight's 20/20,"
01:08:44;01:08:48;"but these moments in history where people looked at something"
01:08:48;01:08:50;"and they were like, ""Yeah, no, that was cool."""
01:08:50;01:08:51;"I bet people also felt that way"
01:08:51;01:08:53;"about all sorts of like musical genres."
01:08:53;01:08:55;"I'm sure there was a moment when after,"
01:08:55;01:08:58;"in like the early '80s, after like ""Rapper's Delight,"""
01:08:58;01:09:00;"people were like, ""Well, rap was a cool kind of like"
01:09:00;01:09:04;"""sub-genre of disco, did its thing for a year."
01:09:04;01:09:06;"""That's fun, but you know, what's up next?"""
01:09:06;01:09:09;"Like people not understanding what's a trend"
01:09:09;01:09:12;"versus what is like the new way of looking at the world."
01:09:12;01:09:14;"And yet, but so there was this feeling of like,"
01:09:14;01:09:15;"""Video games are done."""
01:09:15;01:09:18;"That was like Christmas '81 was all about the Atari,"
01:09:18;01:09:22;"but now the kids are back to whatever other bullsh*t toys"
01:09:22;01:09:23;"they're into."
01:09:23;01:09:27;"♪ Planet D, arcade, the Defender is there ♪"
01:09:27;01:09:31;"♪ Down off of Broadway, who's there playing its games? ♪"
01:09:31;01:09:35;"It's very dangerous putting money down on Overtron"
01:09:35;01:09:42;"Oh, I'm a great defender and I really know just how to get along"
01:09:42;01:09:49;"Down at the arcade, down at the arcade"
01:09:49;01:09:53;"Down at the arcade, down at the arcade"
01:09:53;01:09:58;"Down at the arcade, down at the arcade"
01:10:00;01:10:04;"Oh, I'm a great defender and I really think I got it made"
01:10:04;01:10:09;"I did stumble across an article about the video game crash of 1983"
01:10:09;01:10:12;"Jake, before we get to the great video game crash of 1983"
01:10:12;01:10:19;"Matt just found something that he sent to Seinfeld which is kind of like a third strike for Nolan Bushnell"
01:10:19;01:10:26;"So not only was he kicked off the Atari board and then he missed out on owning a third of Apple"
01:10:26;01:10:33;"It turns out that his connection to Pixar is not just the vague Steve Jobs connection in children's entertainment"
01:10:33;01:10:37;"It goes even a little deeper. So check this out. What was just unearthed?"
01:10:37;01:10:41;"Yeah, so Bushnell was one of the people behind a company called Cadaveroscope"
01:10:41;01:10:45;"which was a very early attempt at computer animation"
01:10:45;01:10:52;"That company was then sold to Lucasfilm which ultimately became Pixar"
01:10:52;01:10:53;"Damn"
01:10:53;01:10:56;"That's even funnier that he knew Steve Jobs personally"
01:10:56;01:11:05;"but this like other, I guess like company/portfolio of computer animation technology he helped develop"
01:11:05;01:11:07;"ended up backing Jobs' hands later"
01:11:07;01:11:10;"meaning that he missed out on owning a third of Apple"
01:11:10;01:11:14;"and in a weird way he kind of like almost missed out on being part of Pixar"
01:11:14;01:11:20;"and apparently his computer animation company, they made a TV movie"
01:11:20;01:11:23;"What was it called? It was about Chuck E. Cheese?"
01:11:23;01:11:27;"It was called Chuck E. Cheese, The Christmas That Almost Wasn't"
01:11:27;01:11:31;"and it was under the subsidiary of the Chuck E. Cheese Pizza Time Theater's company"
01:11:31;01:11:33;"What year was that?"
01:11:33;01:11:34;"'83"
01:11:34;01:11:35;"Oh man"
01:11:35;01:11:37;"I wonder what that animation looked like back then"
01:11:37;01:11:38;"Raw"
01:11:38;01:11:42;"It just looked like the Dire Straits music video"
01:11:42;01:11:46;"Clearly like Nolan Bushnell, he's like a Nikola Tesla or something"
01:11:46;01:11:48;"You know, one of these guys who's just like"
01:11:48;01:11:49;"He did do very well"
01:11:49;01:11:54;"I mean, he used to sell Atari for $28 million in 1977"
01:11:54;01:12:00;"and he did like a ton of other ventures after that that didn't really take off to the same extent"
01:12:00;01:12:03;"He did okay, but it's just like the fact that he"
01:12:03;01:12:07;"as far as like the cushy life of a corporate tech guy goes"
01:12:07;01:12:13;"it's kind of hard knocking that he was lost control of two companies that he helped start"
01:12:13;01:12:16;"and he had these very notable forks in the road"
01:12:16;01:12:20;"and he missed out on being part of something truly gigantic"
01:12:20;01:12:25;"I just mean like in this case, maybe Steve Jobs is like Thomas Edison and he's like Tesla"
01:12:25;01:12:28;"We know the name today, there's a car named after it"
01:12:28;01:12:33;"He still had his very special contributions to science and technology"
01:12:33;01:12:36;"He just didn't quite get to be the electricity guy"
01:12:36;01:12:39;"That's actually this other movie that I've been kind of like"
01:12:39;01:12:41;"that kind of came and went that I was stoked about"
01:12:41;01:12:43;"I don't even remember what the name is, do any of you guys know?"
01:12:43;01:12:45;"It basically was like the electricity movie"
01:12:45;01:12:50;"and it's like somebody plays Edison, somebody plays Tesla, and somebody plays Westinghouse"
01:12:50;01:12:52;"Is it called like Current Wars?"
01:12:52;01:12:53;"Yeah"
01:12:53;01:12:54;"The Current War?"
01:12:54;01:12:55;"Tom Holland"
01:12:55;01:12:56;"That's funny"
01:12:56;01:12:59;"Maybe one day when Seth Rogen makes Console Wars the movie"
01:12:59;01:13:03;"we can do a double feature of Console Wars and The Current War"
01:13:03;01:13:09;"But anyway, was there any resolution to this Pasquale's thing?"
01:13:09;01:13:10;"Does anybody know?"
01:13:10;01:13:13;"If I could just set the record straight a little bit"
01:13:13;01:13:16;"You know, Pasquale's Pizza and Wings"
01:13:16;01:13:20;"it's not quite the same product as what Chuck E. Cheese sells"
01:13:20;01:13:23;"It's a different pizza, it's got a thicker crust"
01:13:23;01:13:27;"it's got extra sauce, and it's got new blends of cheeses and spices"
01:13:27;01:13:30;"Look at Seinfeld going to the mat for Pasquale's"
01:13:30;01:13:31;"Well I just don't like"
01:13:31;01:13:36;"Seinfeld, if you've also been hired to do social media and branding work for Chuck E. Cheese"
01:13:36;01:13:37;"you legally have to tell us"
01:13:37;01:13:39;"I'm just passionate about the brand"
01:13:39;01:13:43;"You picture Seinfeld being like"
01:13:43;01:13:48;"""You know, I have a really interesting portfolio of clients and brands that I work with"
01:13:48;01:13:50;"everything from Chuck E. Cheese to Time Crisis"
01:13:50;01:13:55;"I help maintain those brands, make sure that they have social media presence that grows the brands"""
01:13:55;01:13:59;"But Seinfeld, is that like a press release that Chuck E. Cheese put out that's like"
01:13:59;01:14:02;"""Hold up guys, don't pretend that we're trying to scam people"
01:14:02;01:14:03;"we're giving a different product to you"""
01:14:03;01:14:04;"Yeah, I mean that was"
01:14:04;01:14:08;"I'm paraphrasing a statement made by a representative for Chuck E. Cheese"
01:14:08;01:14:09;"but I stand by it"
01:14:09;01:14:12;"Your gut is that they're good people"
01:14:12;01:14:16;"Well, okay, but this is also something I've been wanting to talk about on Time Crisis for a while"
01:14:16;01:14:19;"and we probably don't have time to go super deep today"
01:14:19;01:14:21;"but the world of food delivery"
01:14:21;01:14:24;"modern food delivery with apps and all this sh*t"
01:14:24;01:14:26;"is bananas"
01:14:26;01:14:29;"It's the wild west, totally insane"
01:14:29;01:14:32;"None of these companies, Grubhub, DoorDash, anybody, Uber Eats"
01:14:32;01:14:34;"is making any money"
01:14:34;01:14:37;"and in fact, I sent you guys this article that I found"
01:14:37;01:14:40;"that's about, like, called ""Pizza Arbitrage"" or something"
01:14:40;01:14:43;"where basically a guy writes about his friend owned a pizza place"
01:14:43;01:14:45;"a real pizza place"
01:14:45;01:14:47;"and they didn't do delivery"
01:14:47;01:14:51;"This guy was like ""I'm not about delivery, I want people to come to my pizzeria and eat the pizza"""
01:14:51;01:14:54;"and he starts getting phone calls at the pizzeria"
01:14:54;01:14:57;"with people being like ""Hey man, I ordered a pizza from you guys"""
01:14:57;01:14:59;"and it showed up really cold"
01:14:59;01:15:03;"and this guy kind of responded by being like ""Well, we don't do delivery, it wasn't us"""
01:15:03;01:15:05;"and basically this guy finds out that DoorDash"
01:15:05;01:15:08;"put his business on their service without asking"
01:15:08;01:15:09;"Insane"
01:15:09;01:15:11;"and they put a menu up"
01:15:11;01:15:13;"and, you know, I guess it's legal"
01:15:13;01:15:15;"in the sense that they can just"
01:15:15;01:15:17;"you're paying somebody to go to the pizza place"
01:15:17;01:15:19;"and buy something for you and bring it to your house"
01:15:19;01:15:21;"but there's no coordination"
01:15:21;01:15:24;"so guys are just like rolling up without the"
01:15:24;01:15:26;"thermal pizza bags"
01:15:26;01:15:29;"and just bringing cold ass pizza to people's houses"
01:15:29;01:15:31;"and this guy's like ""I never signed up for this, what is this?"""
01:15:31;01:15:34;"and in fact he realized that DoorDash was even"
01:15:34;01:15:36;"undercutting his own prices"
01:15:36;01:15:38;"he had a pizza that cost 20 bucks"
01:15:38;01:15:40;"and they were selling it on their service for 15 bucks"
01:15:40;01:15:42;"and in this article"
01:15:42;01:15:45;"this guy's friend, who's an economist or something"
01:15:45;01:15:47;"convinced him to see if he could profit by"
01:15:47;01:15:50;"buying his own pizzas via DoorDash for the lower price"
01:15:50;01:15:52;"and pocketing the extra money"
01:15:52;01:15:54;"the whole thing was crazy"
01:15:54;01:15:57;"but basically you realize that all these companies are"
01:15:57;01:15:59;"A) they're not making any money"
01:15:59;01:16:02;"they're kind of going the Amazon model"
01:16:02;01:16:05;"of basically being like ""who will get to own this entire business?"""
01:16:05;01:16:07;"with terrible margins"
01:16:07;01:16:11;"and one day, after losing billions and billions of dollars"
01:16:11;01:16:13;"when all the competitors are defeated"
01:16:13;01:16:15;"and you control the entire food delivery"
01:16:15;01:16:16;"for the world"
01:16:16;01:16:18;"then you could maybe start turning a profit"
01:16:18;01:16:20;"but in the meantime"
01:16:20;01:16:22;"you're giving terrible deals to the restaurants"
01:16:22;01:16:26;"you're paying your workers, your drivers like sh*t"
01:16:26;01:16:27;"with no benefits"
01:16:27;01:16:30;"and it's kind of like this weird thing where nobody's happy"
01:16:30;01:16:31;"but anyway"
01:16:31;01:16:34;"that's one whole aspect of this bizarre world of food delivery"
01:16:34;01:16:35;"which on the face of it"
01:16:35;01:16:36;"obviously"
01:16:36;01:16:38;"time crisis"
01:16:38;01:16:39;"finance talk"
01:16:39;01:16:40;"we don't know what we're talking about"
01:16:40;01:16:42;"I've always been blown away"
01:16:42;01:16:44;"that I understand with like tech stuff"
01:16:44;01:16:45;"people being like"
01:16:45;01:16:49;"""well, you know, like, it's hard to figure out how to monetize Twitter"""
01:16:49;01:16:50;"right?"
01:16:50;01:16:51;"like I get it"
01:16:51;01:16:54;"you're like ""yeah, you got this product, you got millions of people using it"""
01:16:54;01:16:57;"but you can't just start charging people for it"
01:16:57;01:16:58;"like that's not gonna work"
01:16:58;01:17:01;"and ads can get kind of messy"
01:17:01;01:17:02;"I understand that"
01:17:02;01:17:04;"it's like you have this hit thing"
01:17:04;01:17:06;"and people use it"
01:17:06;01:17:09;"but how do you turn Twitter into like a money making machine?"
01:17:09;01:17:11;"I can imagine why that's complicated"
01:17:11;01:17:13;"and I've always thought to myself"
01:17:13;01:17:16;"well, too bad they're not in like a straightforward business"
01:17:16;01:17:19;"like Uber or DoorDash or something"
01:17:19;01:17:23;"where you get paid every single time somebody uses your app"
01:17:23;01:17:26;"like how are those places not making money?"
01:17:26;01:17:28;"maybe some TCA who actually knows what they're talking about"
01:17:28;01:17:29;"would be like ""well, here's why"""
01:17:29;01:17:30;"but in the meantime"
01:17:30;01:17:31;"they're losing loads of money"
01:17:31;01:17:33;"and they're just trying to kind of like"
01:17:33;01:17:37;"hope that they can ultimately just grow so far"
01:17:37;01:17:39;"and so big"
01:17:39;01:17:41;"that eventually they'll be in the black"
01:17:41;01:17:42;"but one phenomenon"
01:17:42;01:17:43;"I don't think we've ever talked about it"
01:17:43;01:17:46;"this might require actually like a fully researched episode"
01:17:46;01:17:51;"one phenomenon that also complicates this whole bizarre ecosystem"
01:17:51;01:17:56;"of restaurants and drivers and apps and customers"
01:17:56;01:17:58;"is the concept of the ghost kitchen"
01:17:58;01:18:00;"and I think I mentioned that on the thread, Jake"
01:18:00;01:18:02;"and you weren't familiar with the ghost kitchen"
01:18:02;01:18:04;"no, it was referenced a few times in that article you sent"
01:18:04;01:18:06;"which was a great read, by the way"
01:18:06;01:18:08;"but I still don't have a handle on it"
01:18:08;01:18:10;"my understanding is basically"
01:18:10;01:18:12;"and for all you know"
01:18:12;01:18:14;"you may have ordered from a ghost kitchen before"
01:18:14;01:18:17;"that people realized"
01:18:17;01:18:20;"okay, these delivery apps"
01:18:20;01:18:23;"they connect customers with restaurants"
01:18:23;01:18:24;"pretty straightforward"
01:18:24;01:18:26;"but at a certain point"
01:18:26;01:18:27;"if there's these restaurants"
01:18:27;01:18:30;"and 90% of their income is delivery"
01:18:30;01:18:31;"why do you even need to be"
01:18:31;01:18:33;"like a public facing restaurant?"
01:18:33;01:18:35;"and some of these apps"
01:18:35;01:18:38;"suddenly have these app only places"
01:18:38;01:18:41;"that only do cauliflower crust pizza"
01:18:41;01:18:43;"or some kind of special burrito"
01:18:43;01:18:44;"because people realize like"
01:18:44;01:18:48;"we don't need to provide the ambience"
01:18:48;01:18:51;"or the seating for an actual restaurant"
01:18:51;01:18:53;"we can literally just be like"
01:18:53;01:18:55;"a weird anonymous kitchen"
01:18:55;01:18:57;"that sends food out"
01:18:57;01:18:58;"and I found some article"
01:18:58;01:18:59;"where somebody in San Francisco"
01:18:59;01:19:01;"found a really dingy ghost kitchen"
01:19:01;01:19:02;"but on the app"
01:19:02;01:19:04;"it's a little bit Chuck E. Cheese vibe"
01:19:04;01:19:05;"that on the app it's billed as like"
01:19:05;01:19:08;"Signore Mario's authentic Italian pizza"
01:19:08;01:19:10;"and then you go and it's literally just like"
01:19:10;01:19:12;"one metal table"
01:19:12;01:19:16;"in like a dystopian fluorescent light"
01:19:16;01:19:18;"it's like Domino's or Papa John's"
01:19:18;01:19:20;"like you don't eat at Domino's or Papa John's"
01:19:20;01:19:22;"it's all carry out or delivery"
01:19:22;01:19:24;"yeah, I guess in the case of those places though"
01:19:24;01:19:27;"people are very familiar with the brand"
01:19:27;01:19:28;"and what it looks like"
01:19:28;01:19:29;"and with the vibe"
01:19:29;01:19:32;"whereas now it's even weirder"
01:19:32;01:19:33;"because people are just kind of like"
01:19:33;01:19:34;"I want pizza"
01:19:34;01:19:36;"and you might just get some sh*t that pops up"
01:19:36;01:19:38;"that's just like Mario's pizza"
01:19:38;01:19:39;"and you're like well I also want Chinese"
01:19:39;01:19:42;"and it's just like Fat Dragon Chinese"
01:19:42;01:19:44;"and literally for all you know"
01:19:44;01:19:46;"they could be the same metal table"
01:19:46;01:19:49;"in a giant industrial kitchen somewhere"
01:19:49;01:19:50;"and that's where you get to me"
01:19:50;01:19:52;"like one step beyond"
01:19:52;01:19:53;"I'm not saying it doesn't make sense"
01:19:53;01:19:54;"but it's a little bit like"
01:19:54;01:19:56;"one step beyond Domino's"
01:19:56;01:19:58;"but so there is something to be said about like"
01:19:58;01:20:00;"it's not like Chuck E. Cheese is like"
01:20:00;01:20:01;"inventing this idea"
01:20:01;01:20:02;"they're probably like"
01:20:02;01:20:04;"well we have a network of kitchens"
01:20:04;01:20:06;"all over the country"
01:20:06;01:20:07;"they're essentially turning"
01:20:07;01:20:09;"Chuck E. Cheese into ghost kitchens"
01:20:09;01:20:11;"in fact I think people like"
01:20:11;01:20:12;"found it really funny to imagine"
01:20:12;01:20:14;"somebody ordering from a place"
01:20:14;01:20:15;"called Pasquale's"
01:20:15;01:20:16;"and just getting a sh*t"
01:20:16;01:20:17;"Chuck E. Cheese pizza"
01:20:17;01:20:19;"but it's also like"
01:20:19;01:20:20;"they might as well just start making"
01:20:20;01:20:21;"like other sh*t too"
01:20:21;01:20:22;"yeah"
01:20:22;01:20:23;"you know they can start making like pies"
01:20:23;01:20:26;"I think it is Pasquale's pizza and wings"
01:20:26;01:20:27;"yeah they make wings too"
01:20:27;01:20:30;"did Chuck E. Cheese traditionally have wings?"
01:20:30;01:20:31;"I think so"
01:20:31;01:20:32;"I don't know I can't speak to that"
01:20:32;01:20:33;"I'm assuming"
01:20:33;01:20:35;"well Seinfeld have you had Pasquale's pizza"
01:20:35;01:20:37;"and was it noticeably different than Chuck E. Cheese pizza?"
01:20:37;01:20:40;"you know I haven't had it personally"
01:20:40;01:20:44;"but I feel like I understand where they're coming from"
01:20:44;01:20:47;"but no I haven't tasted it myself"
01:20:47;01:20:48;"well we gotta taste it"
01:20:48;01:20:49;"very diplomatic"
01:20:49;01:20:52;"let's see if we can find some for the next episode"
01:20:52;01:20:53;"we all order it to our homes"
01:20:53;01:20:54;"oh my god"
01:20:54;01:20:56;"I think there's another funny thing too"
01:20:56;01:20:57;"where it's like"
01:20:57;01:21:00;"as dystopian as Domino's and Papa John's might be"
01:21:00;01:21:02;"you understand what Domino's pizza tastes like"
01:21:02;01:21:04;"and you understand when you order from Domino's"
01:21:04;01:21:08;"you're getting it from that place called Domino's"
01:21:08;01:21:10;"that you drive past and never go into"
01:21:10;01:21:12;"you understand where it is"
01:21:12;01:21:14;"with some of these ghost kitchens"
01:21:14;01:21:16;"it literally might be the same oven"
01:21:16;01:21:17;"the same kitchen"
01:21:17;01:21:18;"the same place"
01:21:18;01:21:23;"that's billed as four or five different establishments"
01:21:23;01:21:25;"you know like for instance"
01:21:25;01:21:27;"let's say you're a closed"
01:21:27;01:21:29;"I'm not saying that they went this far"
01:21:29;01:21:32;"but this would be like the ghost kitchen way of doing things"
01:21:32;01:21:34;"let's say that you're a closed Chuck E. Cheese"
01:21:34;01:21:36;"and you say to yourself"
01:21:36;01:21:38;"nobody wants to buy Chuck E. Cheese pizza"
01:21:38;01:21:39;"but they might want to buy Pasquale's"
01:21:39;01:21:40;"which as Seinfeld said"
01:21:40;01:21:42;"has a thicker crust"
01:21:42;01:21:44;"what else?"
01:21:44;01:21:45;"more spices"
01:21:45;01:21:46;"a variety of spices"
01:21:46;01:21:48;"it's really an elevated version"
01:21:48;01:21:49;"zestier"
01:21:49;01:21:51;"for sure zestier"
01:21:51;01:21:53;"so maybe they decide that"
01:21:53;01:21:56;"Pasquale's pizza and wings that works"
01:21:56;01:21:57;"they could also say"
01:21:57;01:21:58;"but you know what"
01:21:58;01:22:00;"the oven's only at half capacity"
01:22:00;01:22:01;"even with the Pasquale's orders"
01:22:01;01:22:04;"why don't we create a cut above Pasquale's"
01:22:04;01:22:06;"that's called"
01:22:06;01:22:07;"you know"
01:22:07;01:22:08;"Neapolitan Arcade"
01:22:08;01:22:09;"or something like that"
01:22:09;01:22:11;"and at Neapolitan Arcade"
01:22:11;01:22:14;"it's actually the price point's a little bit higher than Pasquale's"
01:22:14;01:22:16;"but it's a really nice thin crust pizza"
01:22:16;01:22:18;"and it has nicer cheese"
01:22:18;01:22:19;"and it's got"
01:22:19;01:22:20;"bougier toppings"
01:22:20;01:22:22;"like you get a prosciutto pizza there"
01:22:22;01:22:23;"and so then you open the app"
01:22:23;01:22:24;"and you see like"
01:22:24;01:22:25;"Chuck E. Cheese"
01:22:25;01:22:26;"you're like nope"
01:22:26;01:22:27;"Pasquale's be like"
01:22:27;01:22:28;"what's up with this place?"
01:22:28;01:22:29;"look at the menu, not for me"
01:22:29;01:22:30;"and then you see like"
01:22:30;01:22:31;"Neapolitan Arcade"
01:22:31;01:22:32;"and you're just kind of like"
01:22:32;01:22:33;"oh"
01:22:33;01:22:35;"and maybe they choose a picture"
01:22:35;01:22:37;"to put as their banner up top"
01:22:37;01:22:39;"that kind of makes it look like a hipster place"
01:22:39;01:22:40;"and you're like oh prosciutto"
01:22:40;01:22:41;"I'll get it"
01:22:41;01:22:42;"and for all you know"
01:22:42;01:22:43;"it's like the exact same person"
01:22:43;01:22:44;"just be like"
01:22:44;01:22:45;"oh we got an order for"
01:22:45;01:22:46;"we got a Neapolitan"
01:22:46;01:22:48;"alright can you grab me the thin one"
01:22:48;01:22:50;"and you just put it in next to the big sh*t pizza"
01:22:50;01:22:52;"I think stuff like that's happening"
01:22:57;01:23:07;"[coughing]"
01:23:52;01:23:54;"you know I don't really like how"
01:23:54;01:23:55;"Chuck E. Cheese"
01:23:55;01:23:57;"you're sort of mischaracterizing them"
01:23:57;01:23:59;"as having not a lot of integrity"
01:23:59;01:24:01;"but Pasquale is actually a member"
01:24:01;01:24:03;"of Munch's Make Believe band"
01:24:03;01:24:05;"which is part of the Chuck E. Cheese IP"
01:24:05;01:24:07;"and I feel like it's not like"
01:24:07;01:24:09;"Chuck E. Cheese was trying to like"
01:24:09;01:24:11;"you know lie to the public or anything like that"
01:24:11;01:24:13;"they're not trying to pull the wool"
01:24:13;01:24:14;"this is all part of the Chuck E. Cheese"
01:24:14;01:24:16;"they're very transparent about it"
01:24:16;01:24:17;"and uh just"
01:24:17;01:24:18;"wait so Pasquale is"
01:24:18;01:24:20;"he's part of the Chuck E. Cheese universe"
01:24:20;01:24:21;"he's a member of"
01:24:21;01:24:22;"what's it called the Make Believe band?"
01:24:22;01:24:24;"Munch's Make Believe band"
01:24:24;01:24:25;"but who's Munch?"
01:24:25;01:24:27;"is it Munch apostrophe?"
01:24:27;01:24:29;"like the Make Believe band belongs to Munch?"
01:24:29;01:24:32;"so Munch's Make Believe band"
01:24:32;01:24:33;"is an animatronic band"
01:24:33;01:24:35;"that's featured at all Chuck E. Cheeses"
01:24:35;01:24:37;"and have been there since 1989"
01:24:37;01:24:38;"what kind of music do they play?"
01:24:38;01:24:39;"Same year as Pump"
01:24:39;01:24:41;"they play a variety of different"
01:24:41;01:24:43;"you know genres"
01:24:43;01:24:45;"I feel like it's like a Huey Lewis-esque mix"
01:24:45;01:24:47;"of rock and R&B"
01:24:47;01:24:49;"it's very wholesome"
01:24:49;01:24:51;"it doesn't ever get nasty"
01:24:51;01:24:54;"they flirted with getting a little bit nasty"
01:24:54;01:24:56;"after they heard Blood Sugar Sex Magic"
01:24:56;01:24:57;"for the first time"
01:24:57;01:24:59;"but ultimately they knew"
01:24:59;01:25:00;"you know that's not us"
01:25:00;01:25:01;"we can't get nasty like that"
01:25:01;01:25:03;"corporate shut that down"
01:25:03;01:25:05;"no they're known for playful pop rock"
01:25:05;01:25:08;"and they do Chuck themed covers of hit songs"
01:25:08;01:25:10;"they actually do a version of"
01:25:10;01:25:12;"The Vapors turning Japanese"
01:25:12;01:25:14;"the 1980 hit song"
01:25:14;01:25:15;"they do their own take on it"
