Start Timestamp;End Timestamp;Transcript
48:03;48:05;"because I happened upon that."
48:05;48:09;"I was just doing the YouTube deep dive, you know,"
48:09;48:11;"that can never end sometimes."
48:11;48:15;"You come across some blues, some Paul Butterfield thing,"
48:15;48:17;"and then right over here you see Muddy Waters"
48:17;48:20;"and Howlin' Wolf do it, and you go, ""Okay, go into that,"""
48:20;48:22;"and then you see Sonny Boy Williamson,"
48:22;48:24;"this nasty as bad as [bleep]"
48:24;48:26;"and, you know, you just go down that rabbit hole"
48:26;48:27;"and it's beautiful."
48:27;48:31;"But somehow in their offerings, you know,"
48:31;48:34;"the algorithm thinks it knows what you like,"
48:34;48:37;"of course, so it's setting me up"
48:37;48:40;"with some Pat Metheny material,"
48:40;48:42;"and one of them was his diatribe,"
48:42;48:46;"you know, his screed, his PG screed."
48:46;48:48;"So I actually listened to that."
48:48;48:49;"It's hilarious you bring this up,"
48:49;48:50;"'cause I just actually listened to that"
48:50;48:52;"about an hour and a half, two hours."
48:52;48:53;"- Whoa. - What?"
48:53;48:55;"- Perfect timing. - And thought, ""Whoa,"
48:55;48:57;"this is harsh."""
48:57;49:00;"Yeah, so I tend to not be that guy."
49:00;49:04;"My mother taught me the old thumper saying"
49:04;49:05;"in the Bambi movie,"
49:05;49:07;"""If you don't have something nice to say,"
49:07;49:09;"don't say nothing at all."""
49:09;49:12;"So that makes me a bit of an anodyne figure,"
49:12;49:13;"you know?"
49:13;49:15;"But, okay, so people have always asked me"
49:15;49:18;"if I'm gonna write a book, 'cause--"
49:18;49:19;"memoir, I guess."
49:19;49:22;"- Oh, yeah, great idea. - I actually should read"
49:22;49:23;"you guys some of this Jeremy Dink."
49:23;49:25;"It's so--it's so good."
49:25;49:28;"Anyway, my book would mostly be funny stories,"
49:28;49:30;"and I try to find some true-lie"
49:30;49:32;"that connect to these stories."
49:32;49:35;"But there won't be the rag-fest in my book."
49:35;49:37;"If I ever get around to doing it,"
49:37;49:38;"it would never happen."
49:38;49:41;"I will not do that, because,"
49:41;49:44;"I don't know, golden rule, what the hell."
49:44;49:46;"Always a good policy."
49:46;49:48;"And I also think that if there ever was gonna be"
49:48;49:50;"a Pat Metheny, Kenny G,"
49:50;49:52;"kind of like meet-up and truce,"
49:52;49:54;"you could facilitate that."
49:54;49:57;"Well, I know Pat a whole lot better than I know Kenny."
49:57;49:59;"I really don't know Kenny G."
49:59;50:01;"Just run into him, again, those three times."
50:01;50:04;"A Pat Metheny, Bruce Hornsby, Kenny G record would rule."
50:04;50:06;"That'd be--I would love that."
50:06;50:07;"You would have to be in charge."
50:07;50:09;"You'd have to be the boss of the project."
50:09;50:12;"I have to say, and I think this probably rankles Pat,"
50:12;50:14;"'cause I've told him this, and he just laughs about it."
50:14;50:17;"I've told him this, that I'll be in an airport gate,"
50:17;50:20;"and some--this hasn't happened in years,"
50:20;50:23;"but it used to happen in the late '80s, early '90s,"
50:23;50:26;"back in our heyday of being, you know, hit people."
50:26;50:28;"Yuppie women would come up to me and go,"
50:28;50:31;"""You know what? I just love your music."
50:31;50:35;"My husband and I, we make love to you,"
50:35;50:37;"Pat Metheny, and Kenny G."""
50:37;50:39;"[laughter]"
50:39;50:41;"Oh, God. There you go."
50:41;50:43;"There's your album title, ""We Make Love."""
50:43;50:45;"We make love to y'all."
50:45;50:47;"Pat Metheny's an amazing guy."
50:47;50:50;"You know, he played on a couple of my records in the '90s,"
50:50;50:53;"Harbor Lights and Odd House '93, '95."
50:53;50:56;"So he was down here at Odd House '92, '94,"
50:56;50:58;"and he was just ridiculous."
50:58;51:00;"He was just an amazing musician, and one time he played--"
51:00;51:03;"he was on these ridiculous flights of fancy,"
51:03;51:06;"and I had to just stop what we were doing and say,"
51:06;51:07;"""Hey, you know what?"
51:07;51:13;"At the height of your intense dealing with your instrument,"
51:13;51:16;"how much did you practice every day?"""
51:16;51:21;"And he said, ""Well, for about five years,"
51:21;51:27;"from age 13 to 18, I practiced 12 hours a day."""
51:27;51:30;"Because that's the sort of stuff that the Jeremy Danks do."
51:30;51:32;"You know, if you're a concert pianist"
51:32;51:37;"and you want to have a career of any worth and length,"
51:37;51:41;"that's the requirement is 8 to 12 hours a day."
51:41;51:46;"And you know Art Tatum and his disciple,"
51:46;51:49;"Art Tatum II was Oscar Peterson."
51:49;51:51;"Those guys were that way too."
51:51;51:52;"They practiced 12 hours a day."
51:52;51:55;"They would just--Art Tatum would get up and play all day"
51:55;51:58;"until he went to bed with a couple of food breaks."
51:58;52:05;"And so talk about a reason for that otherworldly virtuosity."
52:05;52:06;"That's the reason."
52:06;52:10;"So Pat was that guy, and he said--his statement was amazing."
52:10;52:13;"He said, ""Yes, I practiced 12 hours a day."
52:13;52:18;"I felt I needed to do that if I wanted to deal with Coltrane."""
52:18;52:20;"Because Coltrane was that guy too."
52:20;52:23;"He was that kind of heavy, as we call it, woodshedder."
52:23;52:27;"He was a real woodshedder, like Sonny Rollins on the bridge."
52:27;52:30;"I don't know if you guys know that story."
52:30;52:35;"Yeah, so Pat--there's a reason why he's a freaky musician"
52:35;52:36;"because he put in the work."
52:36;52:38;"He's incredible."
52:38;52:39;"Yeah, it's incredible."
52:39;52:41;"I always thought I was a heavy shedder until I heard--"
52:41;52:46;"I was a 5-hour-a-day guy in college and a little bit post-college"
52:46;52:49;"until I got into songwriting and got more focused on that."
52:49;52:55;"But I spent one semester out of school, living in a farmhouse out in the country"
52:55;52:59;"where they cut up the venison, and I practiced 8 hours a day."
52:59;53:03;"And it's amazing how much better--how much improvement you can make"
53:03;53:08;"in 4 months, say, when you're in the shed 8 hours a day."
53:08;53:09;"So yeah, that's--"
53:09;53:12;"Well, what's funny is that Matheny's beef with Kenny G"
53:12;53:16;"was not his lack of virtuosity, it was his taste,"
53:16;53:19;"which I can't account for because Kenny G is obviously a virtu--"
53:19;53:20;"And Kenny G was definitely playing--"
53:20;53:21;"He's a woodshedder."
53:21;53:22;"Yeah."
53:22;53:25;"In the doc he says now he's down to only 3 hours a day,"
53:25;53:28;"but this is him in his 60s."
53:28;53:30;"Yeah, so that's impressive, yes."
53:30;53:34;"When we do this summit, I think Kenny and Pat, they'll--"
53:34;53:39;"yeah, you get older and you get a little less passionate about issues of taste,"
53:39;53:42;"and they'll probably just relate to each other as just 2 woodshedders."
53:42;53:48;"Also, jazz has receded as a kind of ascendant cultural art form."
53:48;53:54;"In the late 20th century, we were still at the tail end of the jazz era,"
53:54;53:58;"where if Kenny G and Pat Matheny are coming up in the 70s,"
53:58;54:03;"they're right after the fusion period of Miles and all that."
54:03;54:06;"But now we're 50 years past all that,"
54:06;54:11;"so it's sort of like those very vital aesthetic arguments"
54:11;54:17;"that almost kind of religious arguments that Matheny and Kenny G were representing"
54:17;54:20;"in their polar opposite approaches."
54:20;54:22;"The waters have sort of settled."
54:22;54:25;"I understand well, and you may feel that way,"
54:25;54:27;"and in certain circles you may be right, but not in his circles."
54:27;54:28;"He's--"
54:28;54:29;"It's still--"
54:29;54:32;"It's still a spiritual thing."
54:32;54:37;"It's still a deep commitment and a deep aesthetic consciousness"
54:37;54:41;"regarding the jazz scene."
54:41;54:42;"And so--"
54:42;54:43;"I mean, that's great."
54:43;54:44;"I mean, you know."
54:44;54:45;"It is."
54:45;54:49;"It's virtual religion to these people."
54:49;54:53;"You know, I made a jazz record in '07 with Christian McBride and Jack DeJanette,"
54:53;54:55;"and Jack is a guy-- Jack came up."
54:55;54:58;"In fact, there's a great record I have right here."
54:58;55:00;"Speaking of them."
55:00;55:02;"Were you guys ever into the EC-- Can you see this record?"
55:02;55:03;"It's called--"
55:03;55:04;"Yeah."
55:04;55:07;"--New High, G-N-U High."
55:07;55:11;"The record by a trumpet player named Kenny Wheeler and Manfred Eicher,"
55:11;55:14;"the ECM guy, the head of ECM."
55:14;55:16;"He had a lot of cool with these amazing guys."
55:16;55:19;"You see the other names, Keith Tiarat, Dave Holland, and Jack DeJanette."
55:19;55:22;"This is a fantastic record, by the way."
55:22;55:28;"And supposedly the story has it that Manfred Eicher got Keith to play on the record,"
55:28;55:31;"but I guess he wasn't that into it, so he--"
55:31;55:32;"The story has it."
55:32;55:35;"Now, don't quote me on this because this is just what I've heard,"
55:35;55:39;"so it could be completely apocryphal, but it may also be true."
55:39;55:41;"That Keith-- I don't know if you knew Kenny Wheeler,"
55:41;55:45;"but he knew and had played with Dave Holland and Jack DeJanette for years."
55:45;55:49;"Jack DeJanette, he played with Keith for 50 years, you know,"
55:49;55:54;"in various-- from Charles Lloyd all the way up through the Keith Tiarat trio"
55:54;55:56;"with Gary Peacock and Jack."
55:56;56:00;"Supposedly Keith walked into the session, walked to the piano."
56:00;56:02;"There was some charts there, lead sheets."
56:02;56:06;"Didn't speak to anyone the entire time."
56:06;56:13;"Played his ass off, played so beautifully like Keith does and always has."
56:13;56:19;"And then when it was over, walked out, never spoke to anyone."
56:19;56:23;"It's interesting to know that when listening to ""New High"""
56:23;56:28;"because his playing transcended on that."
56:28;56:30;"Didn't need to talk."
56:30;56:33;"He did his talking with his playing and always did."
56:33;56:38;"You know, he was-- I have a son named Keith, and that's who he's named for."
56:38;56:41;"Son named Russell, named for Leon Russell."
56:41;56:44;"And we just like the names, too, you know."
56:44;56:47;"I wanted to go with Keith and Leon, but my wife wasn't feeling Leon."
56:47;56:51;"So Russell was good."
56:54;56:57;"[trombone solo]"
57:13;57:15;"(jazz music)"
57:44;57:46;"- Hey, Ezra, you saw that Keith told me"
57:46;57:50;"that you reposted his Instagram post"
57:50;57:52;"about ""Sidelines,"" about our--"
57:52;57:54;"- Oh yeah, yeah, that was cool"
57:54;57:57;"that your son was shouting out the song"
57:57;58:00;"and saying something nice about me being a part of it."
58:00;58:02;"Well, yeah, and I was about to pivot to that"
58:02;58:06;"'cause, yeah, I wanted to cover ""Horsemeat"" and Kenny G."
58:06;58:09;"Okay, now we should, I guess I'm through my checklist."
58:09;58:11;"Now we can talk about the new song."
58:11;58:12;"- Yes."
58:12;58:14;"- First of all, I'm so thrilled"
58:14;58:16;"that you invited me to be a part of the song."
58:16;58:19;"Should we just listen to it first?"
58:19;58:20;"- Matt, throw it on."
58:20;58:21;"- Well, you can if you want."
58:21;58:23;"Before we listen to it, let me just say this, okay?"
58:23;58:26;"You and Arielle did a session together."
58:26;58:27;"I had never heard it,"
58:27;58:30;"and then the three of us got together last year,"
58:30;58:31;"last May or so."
58:31;58:34;"We did the verses, but when I heard later on,"
58:34;58:38;"'cause I didn't hear them until you guys sent me this stuff,"
58:38;58:40;"when I heard your choruses,"
58:40;58:43;"I thought, ""Well, my choruses, I like them."
58:43;58:44;"They're fine, they're pretty good."""
58:44;58:47;"You singing the choruses was a whole different feeling,"
58:47;58:49;"and I just said, ""You know what?"
58:49;58:52;"He is now the lead on every chorus that he sings on."""
58:52;58:55;"You didn't sing on the first chorus, that's just me."
58:55;58:57;"So it gives the song a place to build,"
58:57;58:58;"a couple of places to go."
58:58;59:03;"And then the breakdown, Jake, he was very creative."
59:03;59:06;"He created his own sort of acapella breakdown,"
59:06;59:09;"or at least that's how we used it."
59:09;59:10;"We were playing it live, Ezra,"
59:10;59:13;"and we're not doing that part."
59:13;59:18;"It's so complex, and the range is two octaves plus."
59:18;59:20;"(Ezra howls)"
59:20;59:22;"- Oh yeah, we were having some fun."
59:22;59:24;"- We said, ""We're not tackling this."
59:24;59:25;"We're gonna do it."
59:25;59:26;"We're not gonna do it like the record."
59:26;59:29;"We're gonna do it the way the record was before."""
59:29;59:32;"You forced the issue with this great new section"
59:32;59:37;"that we just inserted as sort of a prelude"
59:37;59:38;"to the third chorus."
59:38;59:39;"So there you go."
59:39;59:43;"So yeah, this is, it has my name first."
59:43;59:45;"It should probably be your name first, really."
59:45;59:46;"- Oh, no, no, no."
59:46;59:47;"I mean, you guided me."
59:47;59:50;"It's actually really fun too,"
59:50;59:52;"because most of what I do is just Vampire Weekend,"
59:52;59:56;"to actually hear a song and just do my best"
59:56;59:58;"to kind of just sing it."
59:58;59:59;"You already had all the lyrics,"
59:59;01:00:01;"I think that's great lyrics."
01:00:01;01:00:03;"Yeah, I mean, the first time you sent me the demo,"
01:00:03;01:00:05;"I was like, ""Oh, this is a great song."
01:00:05;01:00:06;"Love to be a part of it."""
01:00:06;01:00:08;"Well, yeah, let's throw it on."
01:00:08;01:00:09;"Blake Mills is-"
01:00:09;01:00:12;"- Oh yeah, and Blake Mills, big part of the song, right?"
01:00:12;01:00:13;"- Yes."
01:00:15;01:00:27;"♪ I'm traveling down to Salem ♪"
01:00:27;01:00:32;"♪ I'm a Georgian Jewelry shop ♪"
01:00:32;01:00:37;"♪ Got to get there by morning sunrise ♪"
01:00:38;01:00:43;"♪ Got to save someone's innocent life ♪"
01:00:43;01:00:46;"♪ I'm coming up, but without a hysteria ♪"
01:00:46;01:00:49;"♪ Figured that I had a fever, bitch ♪"
01:00:49;01:00:52;"♪ Fever streets, walk, don't walk ♪"
01:00:52;01:00:53;"♪ Crowded sky, oh ♪"
01:00:53;01:00:54;"♪ Ventilators, oh ♪"
01:00:54;01:00:56;"♪ Antennas, oh ♪"
01:00:56;01:01:01;"♪ Under the moving sky, moving sky ♪"
01:01:06;01:01:11;"♪ Moving mobile boats flying by ♪"
01:01:11;01:01:16;"♪ Rental cars, tubes and tires and chains ♪"
01:01:16;01:01:21;"♪ Then everything around me silently linked ♪"
01:01:21;01:01:27;"♪ Such an irregular reality ♪"
01:01:27;01:01:30;"♪ I'm coming up, but without a hysteria ♪"
01:01:30;01:01:33;"♪ Figured that I had a fever, bitch ♪"
01:01:33;01:01:36;"♪ Fever streets, walk, don't walk ♪"
01:01:36;01:01:37;"♪ Crowded sky, oh ♪"
01:01:37;01:01:38;"♪ Ventilators, oh ♪"
01:01:38;01:01:39;"♪ Antennas, oh ♪"
01:01:39;01:01:44;"♪ Under the moving sky, moving sky ♪"
01:01:44;01:01:46;"- Where did Bruce go?"
01:01:49;01:02:16;"♪ Now wealthy, service lethal ♪"
01:02:16;01:02:21;"♪ Wipe it down and change your mood ♪"
01:02:21;01:02:26;"♪ I've shaped this creepy, glowing thing ♪"
01:02:26;01:02:32;"♪ A Salem, Barristers, Waterloo ♪"
01:02:32;01:02:35;"♪ Open up, open up, hysteria ♪"
01:02:35;01:02:38;"♪ Figured I had a fever, bitch ♪"
01:02:38;01:02:40;"♪ Fever streets, walk, don't walk ♪"
01:02:40;01:02:42;"♪ Crowded sky, oh ♪"
01:02:42;01:02:43;"♪ Ventilators, oh ♪"
01:02:43;01:02:44;"♪ Antennas, oh ♪"
01:02:44;01:02:48;"♪ Under the moving sky, moving sky ♪"
01:02:48;01:02:51;"♪ Open up, open up, hysteria ♪"
01:02:51;01:02:53;"♪ Figured I had a fever, bitch ♪"
01:02:53;01:02:56;"♪ Fever streets, walk, don't walk ♪"
01:02:56;01:02:57;"♪ Crowded sky, oh ♪"
01:02:57;01:02:58;"♪ Ventilators, oh ♪"
01:02:58;01:02:59;"♪ Antennas, oh ♪"
01:02:59;01:03:03;"♪ Under the moving sky, moving sky ♪"
01:03:03;01:03:07;"♪ As we sit on the sidelines ♪"
01:03:07;01:03:11;"♪ As we sit on the sidelines ♪"
01:03:11;01:03:35;"- All right."
01:03:37;01:03:39;"Yeah, I really think it turned out great, Bruce."
01:03:39;01:03:42;"Yeah, really psyched to be a part of it."
01:03:42;01:03:45;"I'm curious, like, so how did the lyrics start?"
01:03:45;01:03:47;"You wrote the lyrics with Blake Mills?"
01:03:47;01:03:50;"- No, no, the song, the origin story,"
01:03:50;01:03:53;"the genesis story of the song is this."
01:03:53;01:03:57;"I was making the Absolute Zero record in 2018,"
01:03:57;01:04:02;"and there's a song on there Justin sang fantastically on it."
01:04:02;01:04:04;"It's called ""Meds."""
01:04:04;01:04:06;"So we got Blake to play on it."
01:04:06;01:04:08;"You know, Blake and Tony have their business"
01:04:08;01:04:11;"out at Sound City, and they run it together"
01:04:11;01:04:12;"out in the Valley."
01:04:12;01:04:15;"And so we're setting up for Blake,"
01:04:15;01:04:17;"setting the engineers out of the studio,"
01:04:17;01:04:20;"doing something with Blake's amp, whatever, biking it up."
01:04:20;01:04:23;"And so it's just Blake and I in the control room,"
01:04:23;01:04:28;"and he's kind of jamming along to the same,"
01:04:28;01:04:33;"to a click track for the song, for the ""Meds"" song."
01:04:33;01:04:35;"And he's playing this thing,"
01:04:35;01:04:37;"and I was really taken with it,"
01:04:37;01:04:40;"just sort of hypnotic and beautiful."
01:04:40;01:04:42;"I said, ""Hey, Blake, would you just press record"
01:04:42;01:04:45;"""and just record a little bit of that for me?"
01:04:45;01:04:48;"""I think I feel like I can do something with that."""
01:04:48;01:04:49;"And so he did."
01:04:49;01:04:54;"And so then fast forward to the shutdown,"
01:04:54;01:04:57;"the beginning of the shutdown era, March of 2020."
01:04:57;01:05:01;"All my tours had been postponed or canceled,"
01:05:01;01:05:03;"just like everyone else's."
01:05:03;01:05:04;"And so I can't go anywhere."
01:05:04;01:05:06;"So I thought, ""Well, okay, I'm gonna take the deep dive."""
01:05:06;01:05:08;"Again, I had a sequel to ""Absolute Zero,"""
01:05:08;01:05:11;"""Non-Secure Connection"" coming out in a few months."
01:05:11;01:05:14;"So I said, ""Well, okay, I'm gonna do this again."""
01:05:14;01:05:16;"And so the first, I remember this little,"
01:05:16;01:05:18;"what we called our Blake bit."
01:05:18;01:05:20;"And I said to my engineer,"
01:05:20;01:05:22;"set me up with a session with that,"
01:05:22;01:05:25;"with the click and this thing."
01:05:25;01:05:27;"And so I just wrote to it."
01:05:27;01:05:32;"I turned it on with the click and the guitar part."
01:05:32;01:05:36;"And I just decided to scat the first melody"
01:05:36;01:05:37;"that came into my head."
01:05:37;01:05:41;"So, you know, I'm a bit of a Schoenberg"
01:05:41;01:05:43;"and Euler melodicism kind of guy."
01:05:43;01:05:44;"So I scatted the,"
01:05:44;01:05:47;"(scatting)"
01:05:47;01:06:00;"You know, that melody came intact."
01:06:00;01:06:01;"It was the first time I sang it."
01:06:01;01:06:02;"I listened to it back."
01:06:02;01:06:04;"I said, ""Well, I like that."""
01:06:04;01:06:06;"I don't know if it's a little, again,"
01:06:06;01:06:09;"little angular for the average person,"
01:06:09;01:06:10;"but I don't care about that."
01:06:10;01:06:13;"I thought it was arresting to me, interesting, unique."
01:06:13;01:06:17;"And so that went from there and that's how it happened."
01:06:17;01:06:18;"So then I wrote the lyrics."
01:06:18;01:06:21;"And so we're in this shutdown era,"
01:06:21;01:06:25;"this COVID pandemic, beginning of the pandemic."
01:06:25;01:06:26;"And so I thought,"
01:06:26;01:06:30;"""Well, this is a bit of hysteria going on."""
01:06:30;01:06:32;"It's funny because the third verse,"
01:06:32;01:06:34;"if you remember,"
01:06:34;01:06:37;"there was a big fear at first about surfaces."
01:06:37;01:06:38;"- Oh, right."
01:06:38;01:06:39;"Every surface lethal."
01:06:39;01:06:41;"- Now every surface lethal,"
01:06:41;01:06:43;"wipe it down and change your mood."
01:06:43;01:06:44;"You know, you'll be less fearful"
01:06:44;01:06:46;"after you wipe down your whole kitchen,"
01:06:46;01:06:48;"you know, that whole idea."
01:06:48;01:06:50;"But I didn't want to make it so specifically"
01:06:50;01:06:52;"the whole song about this thing."
01:06:52;01:06:57;"So I made it just about various types of hysteria."
01:06:57;01:06:59;"The first verse being obviously"
01:06:59;01:07:00;"the Salem Witch Trials,"
01:07:00;01:07:02;"I'm traveling now to Salem."
01:07:02;01:07:05;"I'm a judge in a jury trial, et cetera."
01:07:05;01:07:07;"But the second verse is the most odd."
01:07:07;01:07:10;"Your verse is the most odd."
01:07:10;01:07:12;"It comes out of,"
01:07:12;01:07:14;"I'm a big Don DeLillo guy."
01:07:14;01:07:19;"Okay, so here's my DeLillo section,"
01:07:19;01:07:23;"which goes all the way across."
01:07:23;01:07:27;"A lot, up to the pinch and then learn."
01:07:27;01:07:29;"So in his great book, ""Underworld,"""
01:07:29;01:07:31;"I think it may be my favorite of his."
01:07:31;01:07:33;"He's got so many that I love."
01:07:33;01:07:36;"There was a bit in there about"
01:07:36;01:07:38;"this person just driving around"
01:07:38;01:07:40;"and getting into this strange mindset"
01:07:40;01:07:43;"where he sees, it takes place,"
01:07:43;01:07:45;"a guy's going to airport where you're passing"
01:07:45;01:07:48;"all these billboards for rental cars"
01:07:48;01:07:51;"and tires and chains and Applebee's."
01:07:51;01:07:54;"And then all of a sudden in real life,"
01:07:54;01:07:56;"everything he's seeing on the billboards"
01:07:56;01:07:59;"is not everything he sees happening in front of him."
01:07:59;01:08:04;"So that's just a very obtuse, inscrutable,"
01:08:04;01:08:09;"semi-inscrutable idea of one person's hysteria."
01:08:09;01:08:12;"So that's the most out verse."
01:08:12;01:08:13;"- Right, but now, yeah, but I see,"
01:08:13;01:08:15;"they're all linked by hysteria."
01:08:15;01:08:17;"It's good to have an out verse though."
01:08:17;01:08:19;"- Look, I'm not--"
01:08:19;01:08:20;"- Otherwise it's too by the,"
01:08:20;01:08:21;"kind of paint by numbers."
01:08:21;01:08:22;"- Absolutely."
01:08:22;01:08:24;"- That's right, exactly right."
01:08:24;01:08:25;"Realist painting."
01:08:25;01:08:27;"You want a little Krasner in there."
01:08:27;01:08:29;"- Yeah, you need some weirdness."
01:08:29;01:08:32;"- You need some Lee Krasner, not all Edward Hopper."
01:08:32;01:08:35;"- And I think you got a great balance in the lyrics"
01:08:35;01:08:38;"'cause you could foresee if it just felt"
01:08:38;01:08:41;"like a COVID song coming out now,"
01:08:41;01:08:43;"it'd be like, nobody wants to think about it,"
01:08:43;01:08:47;"but you have this kind of oblique reference to it,"
01:08:47;01:08:50;"which people will always serve as a reminder,"
01:08:50;01:08:51;"people listening to the future."
01:08:51;01:08:52;"But I love the opening,"
01:08:52;01:08:54;"just opening with this kind of Salem"
01:08:54;01:08:56;"witch trials, like,"
01:08:56;01:08:58;"♪ I'm traveling down to Salem ♪"
01:08:58;01:09:01;"♪ I'm a judge in a jury trial ♪"
01:09:01;01:09:03;"'Cause also, there's something about where you're like,"
01:09:03;01:09:06;"so is this taking place in like the 17th century?"
01:09:06;01:09:09;"Or, you know, Salem is still a town in Massachusetts."
01:09:09;01:09:12;"Maybe it's just some dude in modern day Massachusetts"
01:09:12;01:09:15;"who's just got to get down to Salem for a trial."
01:09:15;01:09:16;"And it's got this like,"
01:09:16;01:09:19;"kind of weird caught between worlds feeling."
01:09:19;01:09:20;"And that actually brings me to one other thing"
01:09:20;01:09:21;"that I was kind of interested in."
01:09:21;01:09:26;"So this upcoming album is part of this trilogy."
01:09:26;01:09:27;"- Yes."
01:09:27;01:09:29;"- Talking about the last one, ""Non-Secure Connection."""
01:09:29;01:09:32;"And so much of it has to do with a lot of the language"
01:09:32;01:09:37;"and the lyrics and the themes are about technology,"
01:09:37;01:09:40;"hysteria, science, paranoia."
01:09:40;01:09:42;"And so it's interesting to me that you're a big like,"
01:09:42;01:09:44;"Delilo fan and stuff like that,"
01:09:44;01:09:45;"'cause your work is known,"
01:09:45;01:09:47;"especially your early work for not being shy"
01:09:47;01:09:51;"about trying new technology, new sense and things like that."
01:09:51;01:09:54;"But it's interesting to me that you live out in the woods."
01:09:54;01:09:58;"As you said, you spend a lot of time playing piano,"
01:09:58;01:10:01;"an instrument that's hundreds of years old,"
01:10:01;01:10:03;"and yet you're also so interested"
01:10:03;01:10:08;"in this kind of like technological world."
01:10:08;01:10:10;"So I'm curious how that plays out in your life."
01:10:10;01:10:13;"Are you kind of like, by living out in nature"
01:10:13;01:10:16;"and kind of like dedicating yourself to a craft"
01:10:16;01:10:18;"that's existed for a long time,"
01:10:18;01:10:19;"is there like a tension in your life"
01:10:19;01:10:24;"between traditionalism and the strange world that we live in?"
01:10:24;01:10:28;"Are you critical of it in your work?"
01:10:28;01:10:30;"It's an interesting juxtaposition."
01:10:30;01:10:33;"- Well, that's a multi-tiered question."
01:10:33;01:10:34;"So let me try to answer it"
01:10:34;01:10:36;"with a couple of different answers."
01:10:36;01:10:40;"Okay, so I don't consider myself to be an intellectual,"
01:10:40;01:10:43;"but I'm truly intellectually curious."
01:10:43;01:10:47;"And I'm really interested in everything"
01:10:47;01:10:52;"from string theory to ornithology,"
01:10:52;01:10:55;"everything from the Large Hadron Collider"
