Start Timestamp;End Timestamp;Transcript
01:17:05;01:17:06;"It's time to live for fun"
01:17:06;01:17:09;"Your brain gets smart but your head gets dumb"
01:17:09;01:17:10;"So much to do, so much to see"
01:17:10;01:17:13;"So what's wrong with taking the back streets?"
01:17:13;01:17:15;"You'll never know if you don't go"
01:17:15;01:17:18;"You'll never shine if you don't glow"
01:17:18;01:17:20;"Hey now, you're an all star"
01:17:20;01:17:23;"Get your game on, go play"
01:17:23;01:17:25;"Hey now, you're an all star"
01:17:25;01:17:28;"Get your game on, go play"
01:17:28;01:17:31;"Hey now, you're an all star"
01:17:31;01:17:34;"Get your game on, go play"
01:17:34;01:17:37;"Hey now, you're an all star"
01:17:37;01:17:40;"Get your game on, go play"
01:17:40;01:17:43;"Hey now, you're an all star"
01:17:43;01:17:46;"Get your game on, go play"
01:17:46;01:17:49;"Hey now, you're an all star"
01:17:49;01:17:52;"Get your game on, go play"
01:17:52;01:17:55;"Hey now, you're an all star"
01:17:55;01:17:58;"Get your game on, go play"
01:17:58;01:18:01;"Hey now, you're an all star"
01:18:01;01:18:04;"Get your game on, go play"
01:18:04;01:18:07;"Hey now, you're an all star"
01:18:07;01:18:10;"Get your game on, go play"
01:18:10;01:18:13;"Hey now, you're an all star"
01:18:13;01:18:16;"Get your game on, go play"
01:18:16;01:18:19;"Hey now, you're an all star"
01:18:19;01:18:22;"Get your game on, go play"
01:18:22;01:18:25;"Hey now, you're an all star"
01:18:25;01:18:28;"Get your game on, go play"
01:18:28;01:18:31;"Hey now, you're an all star"
01:18:31;01:18:34;"Get your game on, go play"
01:18:34;01:18:37;"Hey now, you're an all star"
01:18:37;01:18:40;"Get your game on, go play"
01:18:40;01:18:43;"Hey now, you're an all star"
01:18:43;01:18:46;"Get your game on, go play"
01:18:46;01:18:49;"Hey now, you're an all star"
01:18:49;01:18:52;"Somebody once asked, could I spare some change"
01:18:52;01:18:57;"Well guess I need to get myself away from this place"
01:18:57;01:19:00;"I said, yeah, what a concept"
01:19:00;01:19:02;"I could use a little fuel myself"
01:19:02;01:19:07;"And we could all use a little change"
01:19:07;01:19:10;"Well, the years start coming and they don't stop coming"
01:19:10;01:19:12;"Back to the rules and I'll hit the ground running"
01:19:12;01:19:14;"Did it make sense not to live for fun?"
01:19:14;01:19:16;"You can get smart but your head gets dumb"
01:19:16;01:19:18;"So much to do, so much to see"
01:19:18;01:19:21;"So what's wrong with taking the back streets?"
01:19:21;01:19:23;"You'll never know if you don't go"
01:19:23;01:19:25;"You'll never shine if you don't glow"
01:19:25;01:19:27;"Hey now, you're an all star"
01:19:27;01:19:30;"Get your game on, go play"
01:19:30;01:19:33;"Hey now, you're an all star"
01:19:33;01:19:36;"Get your game on, go play"
01:19:36;01:19:39;"Hey now, you're an all star"
01:19:39;01:19:42;"Get your game on, go play"
01:19:42;01:19:45;"Yeah, I'm sick of all these anti-summer songs"
01:19:45;01:19:48;"You know that I've caught it"
01:19:48;01:19:50;"Bad, bad boy, sunny toy"
01:19:50;01:19:52;"This song came out four years ago"
01:19:52;01:19:54;"But it's currently having a resurgence"
01:19:54;01:19:56;"Due to Swift's The Errors Tour"
01:19:56;01:19:58;"Which kicked off in March 2023"
01:19:58;01:20:01;"She would open each show with the lover section"
01:20:01;01:20:04;"With Cruel Summer being the second song played"
01:20:04;01:20:08;"Are you aware of this Jake, that Taylor Swift is the new Grateful Dead?"
01:20:08;01:20:11;"I do see a lot of hubbub in the media about this tour"
01:20:11;01:20:14;"What exactly is so insane about this tour?"
01:20:14;01:20:16;"Can someone explain it to me?"
01:20:16;01:20:19;"It is going to be the biggest tour of all time"
01:20:19;01:20:21;"At least in terms of money"
01:20:21;01:20:23;"Because the tickets are so much?"
01:20:23;01:20:25;"I mean obviously she's playing huge"
01:20:25;01:20:27;"Well I've seen tons of tickets"
01:20:27;01:20:29;"She's filling the stadiums"
01:20:29;01:20:32;"I guess she hasn't done a big tour in a while"
01:20:32;01:20:34;"Because of COVID and stuff"
01:20:34;01:20:37;"Her popularity has ascended to this place where"
01:20:37;01:20:40;"And because she's calling it the Errors Tour"
01:20:40;01:20:42;"It's like she's digging into the archives"
01:20:42;01:20:44;"It's a really long show"
01:20:44;01:20:48;"She's playing stuff from throughout her whole career"
01:20:48;01:20:50;"The set list is fairly consistent"
01:20:50;01:20:53;"But there's a surprise song or two every night"
01:20:53;01:20:56;"To me it sounds a little more like a Bruce Springsteen show"
01:20:56;01:20:58;"Than a Grateful Dead show"
01:20:58;01:21:00;"I think just why you're hearing so much about it"
01:21:00;01:21:03;"Outside of it being one of the largest tours"
01:21:03;01:21:06;"There's a lot of news around how it's saved"
01:21:06;01:21:08;"Certain economies"
01:21:08;01:21:13;"You know, it's GDP is insane"
01:21:13;01:21:15;"What does it say?"
01:21:15;01:21:18;"Swift could add over $4.6 billion in consumer spending"
01:21:18;01:21:20;"To the US economy"
01:21:20;01:21:22;"That's a lot of nachos"
01:21:24;01:21:26;"So I think that's been a huge part"
01:21:26;01:21:29;"When she does two nights at the Taco Bell Dome or something"
01:21:29;01:21:31;"People are buying hotels"
01:21:31;01:21:33;"Renting cars"
01:21:33;01:21:35;"Okay"
01:22:03;01:22:05;"Alright, no hot takes"
01:22:05;01:22:07;"Other than I didn't know that"
01:22:07;01:22:10;"St. Vincent Andy Clark was a songwriter on this song"
01:22:10;01:22:12;"Learn something new every day"
01:22:12;01:22:15;"The number four song this week in 1999"
01:22:15;01:22:17;"Wow"
01:22:17;01:22:20;"These 1999 songs, I know this so well"
01:22:20;01:22:22;"Isn't that a thing people say"
01:22:22;01:22:24;"Or they're like, there's something about"
01:22:24;01:22:26;"The summer you were 14"
01:22:26;01:22:30;"Is some kind of meaningful thing"
01:22:30;01:22:32;"This is actually the summer I was"
01:22:32;01:22:34;"This is the summer I was 15"
01:22:34;01:22:36;"But I just know this so well"
01:22:36;01:22:38;"I know all these songs so well"
01:22:38;01:22:40;"This is LFO with Summer Girls"
01:22:42;01:22:44;"It's from 1999"
01:22:44;01:22:46;"This is pro summer"
01:22:46;01:22:48;"This is pre-9/11"
01:22:48;01:22:50;"When you could still enjoy the summer"
01:22:50;01:22:52;"Back in '99"
01:22:52;01:22:54;"If you got a triple digit day"
01:22:54;01:22:56;"You didn't cry"
01:22:56;01:22:58;"You said ""Wa wa wee wa"""
01:22:58;01:23:00;"And you said high five to your friend"
01:23:00;01:23:02;"Gosh darn it's hot outside"
01:23:02;01:23:04;"Ooh boy"
01:23:04;01:23:06;"Another triple digit day"
01:23:06;01:23:08;"Let's go get milkshakes"
01:23:22;01:23:24;"I noticed this is the song"
01:23:24;01:23:26;"They credit Gary Cherone and Nudel Benincourt"
01:23:26;01:23:28;"Who are in that band Extreme"
01:23:28;01:23:30;"So I'm assuming this is like a sample"
01:23:30;01:23:32;"Oh yeah, it's the guitar sample"
01:23:32;01:23:34;"I'm assuming"
01:23:34;01:23:36;"Yeah, it's more than words"
01:23:36;01:23:38;"Right"
01:23:46;01:23:48;"People always clown on this song"
01:23:48;01:23:50;"But I've always found it kind of pointy"
01:23:50;01:23:52;"It's got a little bit of"
01:23:52;01:23:54;"We Didn't Start the Fire in it"
01:23:54;01:23:56;"It does"
01:24:00;01:24:02;"Oh yeah, we did do a whole thing on this"
01:24:02;01:24:04;"It's that crazy line"
01:24:04;01:24:06;"""Chinese food makes me sick"""
01:24:06;01:24:08;"I'd like to be charitable"
01:24:08;01:24:10;"Towards LFO"
01:24:10;01:24:12;"He probably had"
01:24:12;01:24:14;"Maybe had one bad experience"
01:24:14;01:24:16;"At a Chinese restaurant"
01:24:16;01:24:18;"But not that cool to say ""Chinese food makes me sick"""
01:24:22;01:24:24;"I wonder if Ed Sheeran was thinking about this song"
01:24:24;01:24:26;"When he wrote"
01:24:26;01:24:28;"What's that song?"
01:24:28;01:24:30;"Yeah, what is that song that we talked about a thousand times?"
01:24:30;01:24:32;"I don't remember. ""Shape of You"""
01:24:32;01:24:34;"Yeah, that's a TC classic"
01:24:34;01:24:36;"I kind of like this song"
01:24:36;01:24:38;"I mean, I like this kind of like"
01:24:38;01:24:40;"Mellow, like whisper rap"
01:24:40;01:24:42;"Like last episode we went out on that"
01:24:42;01:24:44;"80s LL Cool J song"
01:24:44;01:24:46;"""I Need Love"""
01:24:46;01:24:48;"I kind of just like this kind of like"
01:24:48;01:24:50;"Just chill"
01:24:50;01:24:52;"Kind of breezy, summery"
01:24:52;01:24:54;"Rap ballad"
01:24:54;01:24:56;"It's sweet and sad"
01:24:56;01:24:58;"I like a rap ballad"
01:25:00;01:25:02;"""I think it's fly when girls stop by for the summer"""
01:25:02;01:25:04;"""For the summer"""
01:25:04;01:25:06;"""I like girls that wear"""
01:25:06;01:25:08;"I can also just like picture this dude so well"
01:25:08;01:25:10;"This could be a good Netflix series"
01:25:10;01:25:12;"Just like"
01:25:12;01:25:14;"[Laughs]"
01:25:14;01:25:16;"Three young white hip hop fans"
01:25:16;01:25:18;"Have one unforgettable summer"
01:25:18;01:25:20;"These kind of like"
01:25:20;01:25:22;"Want to be tough guys"
01:25:22;01:25:24;"[Laughs]"
01:25:24;01:25:26;"Maybe could have Chet Hanks in it"
01:25:26;01:25:28;"He could play one of the guys"
01:25:28;01:25:30;"And he's like they're kind of learning to express their emotions a little bit"
01:25:30;01:25:32;"And there could be like a pivotal scene"
01:25:32;01:25:34;"Where like"
01:25:34;01:25:36;"He like can't tell the girl he loves her"
01:25:36;01:25:38;"But he's just like"
01:25:38;01:25:40;"""You know I just want to say"""
01:25:40;01:25:42;"""It was pretty fly that you stopped by this summer"""
01:25:42;01:25:44;"She's realized he's doing his best"
01:25:44;01:25:46;"And she's like"
01:25:46;01:25:48;"""Thanks, anyway have fun at Harvard"""
01:25:48;01:25:50;"[Laughs]"
01:25:50;01:25:52;"""I'm just going to stay in this town"""
01:25:52;01:25:54;"Wait Chet Hanks is supposed to be a teenager?"
01:25:54;01:25:56;"In this version?"
01:25:56;01:25:58;"Like it's like a 19 year old?"
01:25:58;01:26:00;"Yeah he can do high school"
01:26:00;01:26:02;"Classic casting"
01:26:02;01:26:04;"But you know I mean adulthood starts so late now"
01:26:04;01:26:06;"He could be 40"
01:26:06;01:26:08;"[Laughs]"
01:26:08;01:26:10;"Yeah maybe yeah"
01:26:10;01:26:12;"She's not going to Harvard"
01:26:12;01:26:14;"She's just like moving for work"
01:26:14;01:26:16;"He met a lawyer on Raya"
01:26:16;01:26:18;"She's taking the summer off"
01:26:18;01:26:20;"Between jobs"
01:26:20;01:26:22;"She's about to move to Singapore"
01:26:22;01:26:24;"To work for some international finance company"
01:26:24;01:26:26;"But she goes back to her family's shore house"
01:26:26;01:26:28;"For one last summer"
01:26:28;01:26:30;"Chet Hanks plays this kind of like townie"
01:26:30;01:26:32;"He used to rap"
01:26:32;01:26:34;"It's a little bit like 8 Mile"
01:26:34;01:26:36;"[Laughs]"
01:26:36;01:26:38;"He's working"
01:26:38;01:26:40;"Where's he working?"
01:26:40;01:26:42;"That she runs into him all the time"
01:26:42;01:26:44;"Originally I was going to say he's working at the Jersey Mike's"
01:26:44;01:26:46;"But she's not popping into the Jersey Mike's"
01:26:46;01:26:48;"Maybe he used to be the lifeguard"
01:26:48;01:26:50;"He used to be the lifeguard at the local pool"
01:26:50;01:26:52;"Then they were like"
01:26:52;01:26:54;"You know what man you're just too old"
01:26:54;01:26:56;"It's kind of like creeping people out"
01:26:56;01:26:58;"Like normally the oldest lifeguard is like 25"
01:26:58;01:27:00;"And you're like 41"
01:27:00;01:27:02;"And he's like what?"
01:27:02;01:27:04;"But I work here every summer"
01:27:04;01:27:06;"And they're just like"
01:27:06;01:27:08;"You know what actually the old janitor just"
01:27:08;01:27:10;"[Laughs]"
01:27:10;01:27:12;"The old janitor just died"
01:27:12;01:27:14;"You can be the janitor now"
01:27:14;01:27:16;"And he's just like"
01:27:16;01:27:18;"Oh hell no"
01:27:18;01:27:20;"[Laughs]"
01:27:20;01:27:22;"Oh hell no"
01:27:22;01:27:24;"[Laughs]"
01:27:24;01:27:26;"The elderly"
01:27:26;01:27:28;"The elderly janitor just died"
01:27:28;01:27:30;"Chet has been demoted"
01:27:30;01:27:32;"From lifeguard"
01:27:32;01:27:34;"He's like cleaning up puke"
01:27:34;01:27:36;"Super burned out"
01:27:36;01:27:38;"And then there's like a cool"
01:27:38;01:27:40;"Single 38 year old"
01:27:40;01:27:42;"Lawyer in between jobs"
01:27:42;01:27:44;"Back staying at the family"
01:27:44;01:27:46;"House"
01:27:46;01:27:48;"And you know she's got her own problems"
01:27:48;01:27:50;"But they have this like summer romance"
01:27:50;01:27:52;"And um"
01:27:52;01:27:54;"I don't know"
01:27:54;01:27:56;"He tells her it was pretty fly that she stopped by"
01:27:56;01:27:58;"You know and there's a little bit of like"
01:27:58;01:28:00;"Something about Mary Energy"
01:28:00;01:28:02;"Of course we're going to have a real"
01:28:02;01:28:04;"Iconic gross out humorous scene"
01:28:04;01:28:06;"At the Chinese restaurant"
01:28:06;01:28:08;"With projectile vomiting"
01:28:08;01:28:10;"Oh yeah"
01:28:10;01:28:12;"He's got to run to the bathroom"
01:28:12;01:28:14;"You know and there's no bathroom you can't use it"
01:28:14;01:28:16;"It's only for employees"
01:28:16;01:28:18;"[Laughs]"
01:28:18;01:28:20;"It's going to be full on"
01:28:20;01:28:22;"Oh yeah wait he's got"
01:28:22;01:28:24;"Triangle of sadness"
01:28:24;01:28:26;"He's got hardcore IBS"
01:28:26;01:28:28;"But he goes there to impress her"
01:28:28;01:28:30;"Because she likes Chinese"
01:28:30;01:28:32;"But the IBS is just like"
01:28:32;01:28:34;"It's uncontrollable"
01:28:34;01:28:36;"And it's going to be extremely graphic"
01:28:36;01:28:38;"All over the buffet"
01:28:38;01:28:42;"She looks in her bag for a second"
01:28:42;01:28:44;"He pukes into his food"
01:28:44;01:28:46;"But he doesn't want to admit it at first"
01:28:46;01:28:48;"[Laughs]"
01:28:48;01:28:50;"And she's like"
01:28:50;01:28:52;"Chet aren't you going to eat some more of that"
01:28:52;01:28:54;"Delicious Chinese food"
01:28:54;01:28:56;"[Laughs]"
01:28:56;01:28:58;"This is going to be a legendary"
01:28:58;01:29:00;"It could be a movie it could be a series"
01:29:00;01:29:02;"Anyway it's called Summer Girls"
01:29:02;01:29:04;"It's going to be on Hulu"
01:29:04;01:29:06;"Next June"
01:29:06;01:29:08;"The number 4 song this week"
01:29:08;01:29:10;"On Apple Music"
01:29:10;01:29:12;"Travis Scott featuring Drake with Meltdown"
01:29:12;01:29:14;"Jake you check out the new Travis Scott album?"
01:29:14;01:29:16;"I have not yet"
01:29:16;01:29:18;"Who has?"
01:29:18;01:29:20;"Have you scoped it?"
01:29:20;01:29:22;"I have"
01:29:22;01:29:24;"I give it a scan"
01:29:24;01:29:26;"It's um"
01:29:26;01:29:28;"I mean it's pretty"
01:29:28;01:29:30;"The only way I could describe it"
01:29:30;01:29:32;"Is that it does sound like"
01:29:32;01:29:34;"An AI"
01:29:34;01:29:36;"You basically said make a"
01:29:36;01:29:38;"Kanye album with Travis Scott"
01:29:38;01:29:40;"It's very strange"
01:29:40;01:29:42;"There's always been a connection"
01:29:42;01:29:44;"Between Travis Scott and Kanye"
01:29:44;01:29:46;"And you know he's his"
01:29:46;01:29:48;"Protg but there's something about this"
01:29:48;01:29:50;"That feels"
01:29:50;01:29:52;"It feels weird and I think that there's"
01:29:52;01:29:54;"I read some"
01:29:54;01:29:56;"Review that said that"
01:29:56;01:29:58;"Travis Scott was single white femaling"
01:29:58;01:30:00;"Kanye"
01:30:00;01:30:02;"Which I thought was actually"
01:30:02;01:30:04;"Really accurate very funny and very accurate"
01:30:04;01:30:06;"Yeah it's definitely a new hip hop"
01:30:06;01:30:08;"Classic"
01:30:08;01:30:10;"Is it a new hip hop? Well I mean it's huge"
01:30:38;01:30:40;"Kanye"
01:30:40;01:30:42;"This is honestly this is probably the only song"
01:30:42;01:30:44;"That's not if you put on the first or second"
01:30:44;01:30:46;"Song I mean it's pretty weird"
01:30:46;01:30:48;"I mean I would say put on the first song"
01:30:48;01:30:50;"If you want to hear it"
01:30:50;01:30:52;"You don't need to I find it a bit"
01:30:52;01:30:54;"Sort of disappointing and sad"
01:30:54;01:30:56;"As a huge"
01:30:56;01:30:58;"I mean I'm hearing this song for the first time"
01:30:58;01:31:00;"Via FaceTime"
01:31:00;01:31:02;"But it's no"
01:31:02;01:31:04;"Summer Girls I'm sorry but"
01:31:04;01:31:06;"Hip hop peaked in 1999"
01:31:06;01:31:08;"The number"
01:31:08;01:31:10;"Three song in 99"
01:31:10;01:31:12;"KC and JoJo"
01:31:12;01:31:14;"Tell me it's real"
01:31:18;01:31:20;"So KC and JoJo just crushed it"
01:31:20;01:31:22;"In the 90s first with"
01:31:22;01:31:24;"Jodeci and then they branched out"
01:31:24;01:31:26;"On their own"
01:31:26;01:31:28;"I'm trying to remember this one I definitely remember"
01:31:28;01:31:30;"All my life oh this one"
01:31:30;01:31:32;"This song is awesome"
01:31:32;01:31:34;"Oh it sounds so good"
01:31:58;01:32:00;"Those 99 keyboard sounds"
01:32:06;01:32:08;"Very similar palettes of Mariah Carey"
01:32:08;01:32:10;"Always be my baby"
01:32:10;01:32:12;"Loving this BPM"
01:32:12;01:32:14;"Yeah this feels good"
01:32:34;01:32:36;"Beautiful"
01:32:46;01:32:48;"What was their story?"
01:32:48;01:32:50;"I don't know anything about these dudes"
01:32:50;01:32:52;"Do you know anything about them?"
01:32:52;01:32:54;"They were in this group Jodeci"
01:32:54;01:32:56;"That was like huge"
01:32:56;01:32:58;"Let's see"
01:32:58;01:33:00;"Jodeci was formed in 1989"
01:33:00;01:33:02;"In Charlotte, North Carolina"
01:33:16;01:33:18;"KC and JoJo went and did their own thing"
01:33:18;01:33:20;"Tight"
01:33:20;01:33:22;"So they're from North Carolina"
01:33:22;01:33:24;"Yeah"
01:33:30;01:33:32;"But KC and JoJo are brothers"
01:33:32;01:33:34;"Oh really? Blood Harmony"
01:33:34;01:33:36;"Yeah"
01:34:04;01:34:06;"Tell me it's real"
01:34:06;01:34:10;"The feeling that we feel"
01:34:10;01:34:14;"Tell me that it's real"
01:34:14;01:34:18;"Don't let love come just to pass you by"
01:34:18;01:34:20;"You better try"
01:34:20;01:34:24;"It's all we have to do"
01:34:24;01:34:28;"It's up to me and you"
01:34:28;01:34:32;"To make this special love last forever"
01:34:32;01:34:34;"Tell me it's real"
01:34:34;01:34:38;"The feeling that we feel"
01:34:38;01:34:42;"Tell me that it's real"
01:34:42;01:34:48;"Don't let love come just to pass you by"
01:34:48;01:34:50;"Try"
01:34:50;01:34:52;"It's all we have to do"
01:34:52;01:34:56;"The number three song on the charts right now"
01:34:56;01:34:58;"Or on the Apple Music charts"
01:34:58;01:35:04;"Jungkook and Lotto with ""7"""
01:35:04;01:35:06;"Jake, you know where Jungkook comes from?"
01:35:06;01:35:08;"I'm gonna guess South Korea"
01:35:08;01:35:10;"Yep"
01:35:10;01:35:14;"And he's a member of a pretty well-known group"
01:35:14;01:35:16;"Built this bill?"
01:35:16;01:35:18;"Built this bill"
01:35:24;01:35:26;"And kind of UK two-step vibe"
01:35:26;01:35:30;"This is a throwback to early 2000s sound"
01:35:36;01:35:38;"I guess this is a summer song"
01:35:38;01:35:42;"We thought about who would be the best rapper for this summer song"
01:35:42;01:35:46;"One of the producers recommended Lotto"
01:35:54;01:35:58;"I'm getting the vibe this is a pro summer song"
01:35:58;01:36:00;"Yeah"
01:36:12;01:36:14;"It's the way that we could ride"
01:36:16;01:36:18;"We could match up in another life"
01:36:18;01:36:20;"It'll break me up another time"
01:36:20;01:36:22;"You're up around me and you give me life"
01:36:22;01:36:28;"and that's why I'll be loving you"
01:36:28;01:36:31;"Monday, Tuesday, Wednesday, Thursday, Friday, Saturday, Sunday"
01:36:31;01:36:34;"Week, Monday, Tuesday, Wednesday, Thursday, Friday, Saturday"
01:36:34;01:36:40;"Week, every hour, every minute, every second, through no matter if at night"
01:36:40;01:36:42;"I'll be loving you, every Saturday"
01:36:42;01:36:46;"Week, Monday, Tuesday, Wednesday, Thursday, Friday, Saturday"
01:36:46;01:36:50;"Week, Monday, Tuesday, Wednesday, Thursday, Friday, Saturday"
01:36:50;01:36:55;"Week, every hour, every minute, every second, through no matter if at night"
01:36:55;01:36:58;"I'll be loving you, every Saturday"
01:36:58;01:37:02;"This went to number one on the Billboard Hot 100"
01:37:02;01:37:06;"making Jungkook the second member of BTS with the number one single"
01:37:06;01:37:08;"Alright, let's keep moving"
01:37:08;01:37:11;"This song's such a throwback that it might"
01:37:11;01:37:13;"kind of intersect with the '99 stuff"
01:37:13;01:37:16;"The number two song this week in '99"
01:37:16;01:37:19;"another classic, Destiny's Child with ""Bills, Bills, Bills"""
01:37:19;01:37:20;"Oh, great song"
01:37:20;01:37:25;"Listen to those '99 sounds"
01:37:25;01:37:26;"Uh-huh"
01:37:26;01:37:28;"So many like, kind of"
01:37:28;01:37:31;"like, fake guitar and harpsichord sounds"
01:37:31;01:37:33;"and harps in this era"
01:37:33;01:37:39;"At first we started out real cool"
01:37:39;01:37:42;"Taking me places I ain't ever been"
01:37:42;01:37:44;"But now you're getting comfortable"
01:37:44;01:37:46;"Ain't doing those things you did no more"
01:37:46;01:37:48;"You're slowly making me pay for things"
01:37:48;01:37:50;"Your money should be handling"
01:37:50;01:37:54;"And now you ask to use my car"
01:37:54;01:37:57;"Drive it all day and don't fill up the tank"
01:37:57;01:38:01;"And you have the audacity to even come and step to me"
01:38:01;01:38:03;"Ask to hold some money from me"
01:38:03;01:38:05;"Until you get your check next week"
01:38:05;01:38:07;"You're trifling"
01:38:07;01:38:08;"Good for nothing type of brother"
01:38:08;01:38:11;"A very specific song"
01:38:11;01:38:12;"is dating broke dudes"
01:38:12;01:38:16;"I mean, you borrow someone's car and you don't fill up the tank"
01:38:16;01:38:18;"That's a low, low blow"
01:38:18;01:38:19;"Yeah"
01:38:19;01:38:22;"Keep paying my bills"
01:38:22;01:38:23;"Keep paying myself on bills"
01:38:23;01:38:25;"Keep paying my automobile"
01:38:25;01:38:27;"Stick a diddle and maybe we could chill"
01:38:27;01:38:30;"I love you"
01:38:30;01:38:33;"So you"
01:38:33;01:38:34;"Are too"
01:38:34;01:38:35;"Ba-ba-da-ba-ba-ba"
01:38:35;01:38:36;"Keep paying my bills"
01:38:36;01:38:37;"I love that little"
01:38:37;01:38:39;"Ba-ba-da-ba-ba-ba"
01:38:39;01:38:42;"It gives it this little air of like, intrigue"
01:38:42;01:38:43;"It's like a"
01:38:43;01:38:45;"I don't know, it's like the Pink Panther or something"
01:38:45;01:38:45;"Yeah"
01:38:45;01:38:48;"Like a late 60s comedy about a spy"
01:38:48;01:38:50;"You're a new moon"
01:38:50;01:38:53;"Now you've been maxing on my car"
01:38:53;01:38:54;"Car"
01:38:54;01:38:55;"Gave me back credit"
01:38:55;01:38:57;"Yeah, this is very Pink Panther"
01:38:57;01:38:58;"It's like, a tight call"
01:38:58;01:38:59;"Yeah"
01:38:59;01:39:02;"This must have come out not long after"
01:39:02;01:39:03;"No Scrubs"
01:39:03;01:39:04;"TLC"
01:39:04;01:39:05;"Yes"
01:39:05;01:39:06;"Which has similar themes"
01:39:06;01:39:08;"And you used my cell phone"
01:39:08;01:39:11;"Yeah, late 90s there were a lot of scrubs"
01:39:11;01:39:13;"(laughs)"
01:39:13;01:39:13;"A lot of"
01:39:13;01:39:15;"Oh, same writers"
01:39:15;01:39:16;"Same songwriter"
01:39:16;01:39:17;"Really?"
01:39:17;01:39:18;"Wow"
01:39:18;01:39:19;"I didn't know that"
01:39:19;01:39:20;"More than once"
01:39:20;01:39:22;"You're trifling"
01:39:22;01:39:24;"Good for nothing type of brother"
01:39:24;01:39:25;"Silly"
01:39:25;01:39:26;"Oh, Kandi Burruss"
01:39:26;01:39:28;"She's a Real Housewife, right?"
01:39:28;01:39:29;"Oh, yeah"
01:39:29;01:39:30;"When times get hard"
01:39:30;01:39:31;"Need someone to help me out"
01:39:31;01:39:32;"What a career"
01:39:32;01:39:32;"Still"
01:39:32;01:39:33;"A scrub like you"
01:39:33;01:39:35;"Who don't know what a man's about"
01:39:35;01:39:37;"Can you pay my bills?"
01:39:37;01:39:39;"Keep paying my cell phone bills"
01:39:39;01:39:40;"Keep paying my automobile bills"
01:39:40;01:39:43;"Keep paying my cachetto"
01:39:43;01:39:45;"I don't think you do"
01:39:45;01:39:50;"So you and me are through"
01:39:50;01:39:52;"Can you pay my bills?"
01:39:52;01:39:54;"Keep paying my cell phone bills"
01:39:54;01:39:55;"Keep paying my automobile bills"
01:39:55;01:39:58;"Keep paying my cachetto"
01:39:58;01:40:00;"I don't think you do"
01:40:00;01:40:05;"So you and me are through"
01:40:05;01:40:07;"You're trifling"
01:40:07;01:40:09;"Good for nothing type of brother"
01:40:09;01:40:10;"Silly"
01:40:10;01:40:12;"The harpsichord is such a bold choice"
01:40:12;01:40:13;"Yeah"
01:40:13;01:40:14;"You're trifling"
01:40:14;01:40:17;"Good for nothing type of brother"
01:40:17;01:40:18;"Silly"
01:40:18;01:40:20;"Oh"
01:40:20;01:40:21;"It's an interesting song"
01:40:21;01:40:23;"because in the beginning"
01:40:23;01:40:25;"you sympathize with the singer"
01:40:25;01:40:28;"like, ""Oh, your guy just sounds like"
01:40:28;01:40:29;"not very thoughtful"""
01:40:29;01:40:30;"Deadbeat"
01:40:30;01:40:31;"He borrows the car"
01:40:31;01:40:33;"He doesn't fill up the tank"
01:40:33;01:40:34;"Like"
01:40:34;01:40:35;"But then it kind of goes to the next level"
01:40:35;01:40:36;"where it's like"
01:40:36;01:40:37;"It's like, ""You know what?"
01:40:37;01:40:38;"F*** you"
01:40:38;01:40:40;"You have to pay for all my s*** now"
01:40:40;01:40:42;"You pushed me to the edge"""
01:40:42;01:40:44;"Like the guy's like,"
01:40:44;01:40:45;"""You know what? I can do better"""
01:40:45;01:40:46;"You're right"
01:40:46;01:40:47;"It was really"
01:40:47;01:40:48;"It was really wasn't thoughtful"
01:40:48;01:40:50;"that I brought the car back"
01:40:50;01:40:52;"and it was empty"
01:40:52;01:40:53;"I'll make sure I always bring it back full"
01:40:53;01:40:54;"And it's like, ""No, no"
01:40:54;01:40:57;"Now you got to pay my telephone bills"""
