Start Timestamp;End Timestamp;Transcript
28:59;29:09;"Transformers, but I would have been just sort of like a metaphorical leap that it could make and you're right"
29:09;29:11;"It's both because like this could also be the third generation"
29:11;29:16;"Like this this plow has been giving three generations of farmers"
29:16;29:18;"Like action like this is like an old truck"
29:18;29:27;"I don't like it as much but again, I"
29:27;29:31;"Love it. I love that. He's on the on the side of the road"
29:31;29:36;"Like I mean we've all been on like little farm roads and had to go around swerve around a dude driving a huge"
29:36;29:40;"Come to combine, but I love his vibe is like get on the interstate man. If you're in a hurry"
29:40;29:43;"I'm sorry that I'm in your way, but that's what the freeways"
29:43;29:57;"Five miles an hour"
29:57;30:01;"Yeah, and when I said I didn't like it as much I just there was a moment"
30:01;30:05;"I was really into the idea of him writing it from the point of view of the machine"
30:05;30:12;"I love the idea. I love the idea that it is a transform. Actually that game has anybody ever tried to make like farmer Transformers"
30:12;30:16;"I think you're gonna say has anyone ever written a song from the perspective of a transformer"
30:16;30:19;"probably"
30:19;30:24;"Optimus Prime yeah"
30:24;30:28;"Decepticon so Tigra so so this one off in the bar you're saying yeah"
30:28;30:32;"Well, it was the bar was pretty empty, but I'm like listening to the song"
30:32;30:35;"I'm like kind of tapping my foot and I heard the beginning where it's like I hear the sky"
30:35;30:41;"I'm a god-fearing third-generation farmer and maybe because I was in a place that I'm not at that much a"
30:41;30:46;"Small town surrounded by farmland. I was like oh, this is like a farmer song"
30:46;30:50;"And then I just saw people going on minute like I saw just a few people yelling out"
30:50;30:54;"I'm an international harvester, so I was like okay. What is this song and"
30:54;30:57;"when I first heard it in the bar I"
30:58;31:03;"Mostly just uh you know hearing that opening line. I was like oh, this is like a guy"
31:03;31:06;"Just kind of being like I'm a proud farmer"
31:06;31:10;"Which is what the chorus is kind of art, but then I didn't realize that actually yeah"
31:10;31:13;"He's a proud farmer, but this is like a song about a situation"
31:13;31:17;"Which is that he's on he's on the country road"
31:17;31:18;"He's doing his job"
31:18;31:24;"And all these people all these jerks are just so annoyed that he's going five miles an hour"
31:24;31:28;"And they have to get to work and stuff, and he's just like man. I don't give a shit"
31:28;31:31;"I'm a proud farmer, and you know what this has been a hard year"
31:31;31:36;"It was not a bumper crop this year. Just shut up. It's like get on the interstate"
31:36;31:42;"He's doing the fall harvest and there's all these looky-loos out from the city out there to see the like fall foliage colors"
31:42;31:48;"Right and they're just like in a hurry to like get you know to the scenic overlook to see all the orange and red trees"
31:48;31:55;"Yep, they got a reservation at the farm to table restaurant. They're saying that a cute little Airbnb for the"
31:55;32:01;"Take for a week, and he's just like this is my life out here. Well, and then it's some of them"
32:01;32:03;"He has some sympathy"
32:03;32:05;"he says"
32:05;32:10;"Well, I know you got your own deadline, but cussing me won't save you no time haas"
32:10;32:14;"Yeah, this big wheel wide load ain't going any faster"
32:14;32:17;"so just smile and wave and tip your hat to the man on the tractor and"
32:17;32:20;"then I watched the video and"
32:21;32:27;"Of course, you know when they have to show like the different people caught behind it there's some kind of just like"
32:27;32:30;"annoying businessman and"
32:30;32:32;"In a convertible just like oh, come on"
32:32;32:40;"For sake I got to get to work. So it is I guess it also just makes the song way funnier"
32:40;32:42;"Cuz like you could imagine a kind of like serious"
32:42;32:49;"Song where the guy's just like I'm proud to be a farmer. I got my kids have you in the 4-h Club?"
32:49;32:51;"Yeah, I'm married to a woman from a forget go to hell"
32:51;32:57;"whereas then suddenly he's like painting this just like comical picture where the guys just got now it now I kind of like"
32:57;32:59;"That's because at first I'm like, oh, what who is this guy?"
32:59;33:03;"Yeah, what's he so angry about and then you're kind of like then I'm just picture him going five miles an hour"
33:03;33:09;"And he's just kind of like yeah. Yeah. Yeah. I'm doing my job. All right"
33:09;33:12;"This is this is just like a funny moment in time"
33:12;33:18;"And there's also something extra good about that the the company that makes the combine is called international harvester"
33:18;33:23;"But also like he could not be describing a more local story. Yeah"
33:23;33:26;"It couldn't be more just like"
33:26;33:29;"Yep, I don't leave the farm much you're on my little street"
33:29;33:34;"Go to hell. Well, like what you said is it's also like really great advice"
33:34;33:39;"Right for the guy behind the guy cut up and say hey chill out"
33:39;33:44;"You got nowhere to be it reminds me of a recent essay from a friend of the show"
33:44;33:50;"Jonah Weiner in his blackbird spy plane newsletter. Did you read this one called go glam mode?"
33:50;33:53;"Now the whole essay"
33:53;33:55;"GLM give the light a miss"
33:55;34:01;"Where he sort of rails on people who try to like cross the street very fast when they see the lights about the church"
34:01;34:04;"You know, they're like I got to get across the street and you go. Hey, you know what?"
34:04;34:06;"Give the light a miss just hang out"
34:06;34:12;"You got what's the extra 30 seconds for you to run across the street your whole life would be better if you just"
34:13;34:17;"Know it could even be dangerous. Where are you gonna get to? Why are you gonna push some lady out of the way?"
34:17;34:21;"You know just to get across the street a little bit faster. I don't know"
34:21;34:23;"I think that there's it's definitely true of"
34:23;34:28;"Driving when you think about some of the dangerous maneuvers people pull to shave three minutes off a drive"
34:28;34:31;"Yeah, like some guy pulling right around"
34:31;34:37;"You know this guy's combine right into the other side of the lane trucks barreling down the road just to get around"
34:37;34:40;"I'm sure that's happened. And actually I was thinking to"
34:40;34:42;"this song"
34:42;34:44;"clearly was a big hit and"
34:44;34:48;"I actually imagine that this song has saved lives because"
34:48;34:55;"I'm not even kidding because like this was like a big country song of its era. Let's say"
34:55;35:00;"You know in certain parts of the country everybody listens to country music whether you're a farmer"
35:00;35:07;"Whether you're a lawyer in the city, whatever and just like all over, you know people from different walks of life"
35:07;35:12;"Have to you know share the same communities sometimes and I could totally picture like some hotshot"
35:12;35:16;"Want to move out to the country outside of like Nashville or something?"
35:16;35:22;"He drives his fancy car into the city to go work at the law office. Every once in a while"
35:22;35:24;"he might get caught behind a combine and"
35:24;35:30;"Probably is angry and I bet this song once it came out diffused a few of those situations"
35:30;35:36;"Like somebody who's about to lay on the horn or like or do something kind of dangerous like pull around or like into the shoulder"
35:36;35:39;"You know, whatever probably like laugh to themselves and just was like"
35:39;35:46;"International harvester man. All right. All right. This is just one of those situations. I'm gonna wait patiently"
35:46;35:51;"Haha, I don't want to be like that guy profound wisdom. I love it reminds me of"
35:51;35:59;"I think I've referenced this before my my senior high school yearbook quote slow down to your food"
35:59;36:02;"Those my quote slow down to your food"
36:04;36:11;"Yeah, I love that wait is that and were you quoting somebody that's a yes original no, it's well, yes it was uh,"
36:11;36:15;"the Bill Murray character in Ghostbusters, he says that to"
36:15;36:22;"Dan Aykroyd, it's a very innocuous scene in the movie and Dan Aykroyd's just like scarfing down this Chinese food"
36:22;36:27;"Like right as they're getting the business started and they're stressed out about like money and like, you know"
36:27;36:34;"Just like getting the business off the ground and Aykroyd's just like stress eating and Murray's just like hey slow down show your food"
36:34;36:40;"Slow down to your food great advice. Yep, you know, hang out behind my mother says before you know"
36:40;36:42;"My my senior yearbook quote was I?"
36:42;36:46;"Don't do you love me? Do you surfer girl?"
36:46;36:56;"Do you know why I like that like double you you love me do you there's also yeah"
36:56;37:03;"There's something about that that it's so pretty in the song. Do you love me? Do you but like written out? Do you love me?"
37:03;37:09;"Do you surfer girl? I think I credit to Brian Wilson, which may or may not be true"
37:09;37:12;"I don't actually know if he wrote those lyrics"
37:12;37:19;"Little surfer, little one"
37:19;37:25;"May my heart come all undone"
37:25;37:33;"Do you love me? Do you surfer girl?"
37:33;37:39;"Surfer girl, my little surfer girl"
37:39;37:46;"I have watched you on the shore"
37:46;37:53;"Standing by the ocean's roar"
37:53;38:00;"Do you love me? Do you surfer girl?"
38:00;38:04;"Surfer girl, surfer girl"
38:04;38:13;"We could ride the surf together"
38:13;38:20;"While our love would grow"
38:20;38:27;"In my woody I will take you"
38:27;38:33;"Everywhere I go"
38:33;38:40;"So I say from me to you"
38:40;38:47;"I will make your dreams come true"
38:47;38:56;"Do you love me? Do you surfer girl?"
38:56;38:59;"Surfer girl, my little surfer girl"
38:59;39:07;"Actually speaking of 80s movies quotes, somebody was telling me about a band recently and they have a very long name"
39:07;39:15;"They're called I Don't Know How But They Found Us and somebody I was with immediately knew that that was a movie quote"
39:15;39:16;"Yeah, I know what it is"
39:16;39:17;"You know, Dick?"
39:17;39:18;"Yeah"
39:18;39:19;"What is it?"
39:19;39:20;"Back to the Future"
39:20;39:22;"Is that an iconic line or that's just one of those movies people have seen 30 times?"
39:22;39:26;"Rockfort Marty, I Don't Know How But They Found Us"
39:26;39:31;"I've seen that movie a million times. I mean, it's not really like, it's kind of like Slow Down and Chew Your Food"
39:31;39:35;"I mean, I guess it's a little more climactic than Slow Down and Chew Your Food"
39:35;39:39;"But it's when like they're testing out the time machine in the parking lot of the mall"
39:39;39:40;"Right"
39:40;39:51;"And then like the Libyans, like Doc Brown had like basically swindled the Libyan terrorists or whoever out of like plutonium to power the time machine"
39:51;39:52;"Oh yeah"
39:52;39:53;"And then they showed up"
39:53;39:54;"Definitely, I remember the Libyans"
39:54;39:57;"So what's the band called? It's I Don't Know How But They Found Us?"
39:57;40:02;"I Don't Know How But They Found Us and people sometimes call them IDK How for short"
40:02;40:03;"What's their sound?"
40:03;40:06;"Matt, you want to throw in an I Don't Know How But They Found Us song?"
40:06;40:10;"That seems like from a different era sort of like when there were bands named like"
40:10;40:12;"And I think it's Found Me"
40:12;40:13;"Oh, it's Found Me?"
40:13;40:16;"I Don't Know How But They Found Me"
40:26;40:27;"Stop!"
40:52;40:56;"What is this listed under Matt? What's their genre on Apple Music?"
40:56;40:59;"It's indie rock that references 80s movies"
40:59;41:07;"It looks like alternative also just to add, the drummer is from the band Falling In Reverse"
41:07;41:12;"And the vocalist I think was from another like pop punkish band"
41:12;41:16;"Oh, Panic At The Disco! Sorry, the singer is from Panic At The Disco"
41:16;41:21;"The singer of this band used to be in Panic At The Disco, I was going to say it had kind of Panic At The Disco vibes"
41:21;41:25;"It's a little alternative, little pop punk, little muse"
41:25;41:27;"Anyway, if you're a Back To The Future fan, check them out"
42:26;42:30;"You're listening to Time Crisis"
42:30;42:33;"Alright, let's get into it. Jake, you want to lead this one off?"
42:33;42:38;"Sure, I don't have much to lead it off with"
42:38;42:44;"I know, I've not heard this, this hit the thread a few weeks ago"
42:44;42:47;"That Fall Out Boy did a version"
42:47;42:48;"Breaking news"
42:48;42:55;"Breaking news, Fall Out Boy did a, I guess a rewrite of Billy Joel's We Didn't Start To Fire"
42:55;42:57;"I think this happened at least a month ago"
42:57;43:01;"Yeah, and that just seems like if anything is tailored for TC, that's it"
43:01;43:10;"So I guess they updated it, obviously Billy Joel's song was about the post-war era up until 1989 basically when that came out"
43:10;43:11;"Right"
43:11;43:14;"JFK blown away, what else do I have to say?"
43:14;43:15;"Kind of stuff"
43:15;43:20;"So this, they've rewritten it for the modern era, I don't know when they start, I'd be curious to see"
43:20;43:26;"Yeah, well first of all, my hat's off to Fall Out Boy, it's a great idea"
43:26;43:29;"I wonder if anybody tried to do this before"
43:29;43:34;"How about before we even get into it, let's throw on that BJ, the original We Didn't Start To Fire"
43:35;43:39;"[Applause]"
44:19;44:24;"So just these listing stuff from the, basically the 50s"
44:24;44:25;"Yeah"
44:39;44:41;"He's going kind of in front of us"
44:41;44:49;"Yeah, he's after Truman, who was president in 1945, '46, now we're up to Liberace"
44:49;44:52;"Is that Billy singing on the chorus?"
44:52;44:53;"Good question"
44:53;44:55;"It kind of doesn't sound like him"
45:00;45:02;"Roy Cohn"
45:02;45:04;"Roy Cohn, interesting"
45:19;45:21;"Trouble in the Suez"
45:21;45:23;"That's tight"
45:23;45:26;"So this starts in '49"
45:26;45:27;"What?"
45:27;45:33;"This, BJ's version starts at the beginning of 1949 and spans 40 years"
45:43;45:46;"Oh, I think it's when Billy Joel was born, is that right?"
45:46;45:48;"I would track"
45:48;45:50;"Like starting his whole life"
45:50;45:55;"It would have been sick if by the time he got to the 70s he just got fully into Billy Joel history"
45:59;46:01;"Billy Joel puts out the Stranger"
46:01;46:03;"Captain Jack Piano Man"
46:03;46:09;"The Strain, Cold Spring Harbor, The Stranger, Turnstiles, Glass Houses"
46:09;46:12;"And it is in chronological order"
46:12;46:14;"Christie Brinkley"
46:14;46:17;"Yes, she's the Uptown Girl"
46:17;46:19;"Yeah"
46:19;46:22;"Uptown Girl, Christie Brinkley"
46:22;46:26;"Their divorce, playing alimony"
46:26;46:30;"This starts talking about how Springsteen sucks"
46:30;46:31;"Yeah, exactly"
46:31;46:33;"Like, whoa, whoa"
46:33;46:35;"Playing alimony"
46:35;46:37;"Springsteen sucks"
46:50;46:54;"He drops a reference to his prog rock band Attila"
46:54;46:57;"Are you familiar with them?"
46:57;46:58;"Oh, a little bit"
46:58;47:00;"I'm more of the big six"
47:03;47:06;"I like it because it gets into the international affairs stuff"
47:06;47:09;"Russians in Afghanistan"
47:09;47:11;"It's like Mickey Mantle and Russians in Afghanistan"
47:11;47:15;"They get the same, they have the same weight"
47:15;47:19;"Which if you're a kid in America growing up"
47:19;47:21;"Mickey Mantle's more important"
47:21;47:22;"Yeah"
47:22;47:26;"So when this song came out, people"
47:26;47:27;"I might not have the timeline right"
47:27;47:30;"People thought he was ripping off"
47:30;47:33;"The End of the World As We Know It, R.E.M."
47:33;47:34;"Did they?"
47:34;47:36;"Interesting"
47:36;47:40;"Who was the first person to do like, like this type of list song?"
47:40;47:43;"I mean, there's gotta be folk songs that kind of"
47:43;47:47;"You know, work in this form, I would think"
47:47;47:48;"It's a good question"
47:48;47:51;"We didn't stop the fire"
47:51;47:55;"We're going home, it's just the world we're calling home"
47:55;47:57;"We didn't stop the fire"
47:57;48:01;"No, we didn't light it, but the time it burned"
48:01;48:04;"I don't really, like, how do you interpret what the chorus means?"
48:04;48:07;"Like, because he's just listing stuff"
48:07;48:10;"Some of it's good, some of it's tragic"
48:10;48:13;"He's just saying like the world's all been crazy"
48:13;48:15;"But then he's talking about like Doris Day, Mickey Mantle"
48:15;48:17;"I just, I don't understand like what"
48:17;48:20;"What is the perspective on this song?"
48:20;48:21;"That's a great question"
48:21;48:22;"I have thought about it before"
48:22;48:25;"And I think we've even talked about it on the show a bit"
48:25;48:27;"If you look at it through an anti-boomer lens"
48:27;48:30;"Which, you know, has been very fashionable the past"
48:30;48:31;"However many years"
48:31;48:35;"People always try to say, oh, the boomer generation is self-absorbed"
48:35;48:39;"They think that their unique history on earth"
48:39;48:41;"Is like the most important journey"
48:41;48:43;"All right, we get it, you know"
48:43;48:45;"You were born in this uptight world"
48:45;48:47;"And the '60s changed everything"
48:47;48:50;"And now you guys are holding on to all the resources"
48:50;48:53;"And you won't let go of power"
48:53;48:56;"You know, that's a certain take on the boomers"
48:56;48:58;"We're all familiar with"
48:58;49:00;"So if you look at it through that kind of"
49:00;49:02;"Slightly negative lens"
49:02;49:05;"You'd just be like, he was a boomer"
49:05;49:07;"Refusing to accept responsibility"
49:07;49:10;"For any role his generation may have played"
49:10;49:14;"In building the messed up current world that we live in"
49:14;49:16;"You know, like I could see"
49:16;49:17;"I'm sure people have said that"
49:17;49:20;"Oh, Billy Joel, classic boomer denialism"
49:20;49:21;"Oh, what?"
49:21;49:22;"What were we supposed to do?"
49:22;49:23;"Because you hear that all the time"
49:23;49:25;"Oh, they messed up the world"
49:25;49:26;"And this and that"
49:26;49:30;"I would think that a slightly more sophisticated take"
49:30;49:31;"Or charitable take"
49:31;49:35;"Is that Billy, like any member of his generation"
49:35;49:38;"Or let's say any member of any generation"
49:38;49:40;"In the late '80s"
49:40;49:42;"You know, he's in his '40s now"
49:42;49:44;"He's grown up"
49:44;49:47;"He's kind of like bewildered by everything that's happened"
49:47;49:50;"And he's really just saying that"
49:50;49:52;"Life is a crazy tapestry"
49:52;49:54;"Of seemingly unrelated things"
49:54;49:56;"It can feel very chaotic"
49:56;49:58;"Culture is changing all the time"
49:58;50:00;"Politics is changing all the time"
50:00;50:03;"This good thing happens, a bad thing happens"
50:03;50:05;"Everything's constantly moving"
50:05;50:08;"Life is nothing but change and flux"
50:08;50:12;"And he's actually making a sophisticated plea to like"
50:12;50:14;"Don't blame us"
50:14;50:16;"Not because we didn't play a role in this"
50:16;50:17;"Of course we did"
50:17;50:20;"But because this is a sequence of events"
50:20;50:21;"That's been always burning"
50:21;50:23;"Since the world's been turning"
50:23;50:26;"Life is a big, rich, weird tapestry"
50:26;50:29;"There are things that happened literally millions of years ago"
50:29;50:32;"That are still impacting things now"
50:32;50:34;"And you can try to stop the change"
50:34;50:37;"You can try to halt it in its tracks"
50:37;50:40;"But trust me, by the time you're"
50:40;50:41;"How old was Billy when he made this?"
50:41;50:42;"40?"
50:43;50:44;"I think maybe he's saying like"
50:44;50:47;"You know what guys, by the time you're 40, you'll get it"
50:47;50:51;"And maybe somewhere a young Pete Wentz"
50:51;50:53;"Was listening and saying like"
50:53;50:55;"No, Billy, it is your fault"
50:55;50:56;"You started this damn fire"
50:56;50:57;"You, Billy"
50:57;50:58;"And my generation, all that power"
50:58;51:00;"It was you, Billy"
51:00;51:02;"It was you and all the boomers"
51:02;51:03;"This is incredible"
51:03;51:05;"I gotta point this out"
51:05;51:07;"Ezra's right"
51:07;51:10;"I asked Chad GPT"
51:10;51:12;"What is the meaning of"
51:12;51:14;"Billy Joel's ""We Didn't Start the Fire"""
51:14;51:17;"And not only were you right in the sentiment"
51:17;51:19;"Of this collective unconscious"
51:19;51:20;"That whatever it's pulling from"
51:20;51:23;"You used the same words"
51:23;51:24;"Overall, so this is a"
51:24;51:26;"Overall, the song is a testament"
51:26;51:27;"To the constant state of change"
51:27;51:28;"And upheaval in the world"
51:28;51:30;"Suggesting that while individuals"
51:30;51:32;"May play a role in these events"
51:32;51:34;"They're also part of a larger tapestry"
51:34;51:36;"Of history that is always in motion"
51:36;51:38;"I mean the fact that you even said"
51:38;51:40;"A tapestry, I find that"
51:40;51:42;"I'm just saying"
51:42;51:43;"I'm trained on the same language model"
51:43;51:45;"As Chad GPT"
51:45;51:47;"Yeah, this is actually an AI Ezra"
51:47;51:50;"This is a test run on the first"
51:50;51:52;"I mean, I find that, yeah"
51:52;51:55;"I haven't done a teaser live since 2011"
51:55;51:59;"This is how we found out"
51:59;52:01;"We're in the machine"
52:01;52:03;"And you know who actually started the fire?"
52:03;52:05;"Prometheus"
52:05;52:07;"If anybody saw Oppenheimer"
52:07;52:09;"He referenced the Greek myth of Prometheus a lot"
52:09;52:12;"He stole fire from the gods"
52:12;52:13;"He started the fire"
52:13;52:15;"That's why that book is called American"
52:15;52:16;"I see"
52:16;52:17;"American Prometheus"
52:17;52:19;"Yeah, Oppenheimer is the American Prometheus"
52:19;52:21;"I think I'm seeing it next week, folks"
52:21;52:22;"When you watch it"
52:22;52:23;"Yeah"
52:23;52:24;"I want you to just imagine"
52:24;52:25;"That it ends with"
52:25;52:26;"We didn't start the fire"
52:26;52:28;"[Laughter]"
52:28;52:30;"Oppenheimer is a little bit of a"
52:30;52:32;"We didn't start the fire"
52:32;52:33;"You want to know that?"
52:33;52:35;"No spoilers, but it is kind of"
52:35;52:36;"We didn't start the fire"
52:36;52:37;"Like this guy"
52:37;52:39;"Played this huge role in history"
52:39;52:41;"And he wrestles with"
52:41;52:42;"What did I do?"
52:42;52:45;"But he's part of a larger tapestry of science"
52:45;52:46;"And progress"
52:46;52:47;"And violence"
52:47;52:48;"Wouldn't it be such a funny"
52:48;52:50;"And there's parts in it where he's talking to Einstein"
52:50;52:51;"I don't know, Albert"
52:51;52:54;"Sometimes I feel like I started this fire"
52:54;52:55;"Oppenheimer, you didn't"
52:55;52:56;"[Laughter]"
52:56;52:58;"You did not start this fire"
52:58;53:00;"You did not start this fire, Oppy"
53:00;53:03;"It's been always burning since the world's been"
53:03;53:05;"Since the world's been turning"
53:05;53:07;"Doesn't it feel like a real Hollywood"
53:07;53:09;"The end, a Christopher Nolan joint"
53:09;53:12;"Bow, bow, bow, bow, bow, now"
53:12;53:13;"[Laughter]"
53:13;53:15;"But what I was going to say is that"
53:15;53:17;"I feel like it would be like such a funny"
53:17;53:19;"Very real Hollywood thing"
53:19;53:21;"For them to then say, you know what?"
53:21;53:22;"You know what would be cooler?"
53:22;53:24;"Than using Billy Joel?"
53:24;53:26;"Let's get Fall Out Boy to do a new one"
53:26;53:27;"Oh yeah"
53:27;53:28;"Christopher Nolan"
53:28;53:29;"Christopher Nolan says, ooh"
53:29;53:32;"Or his music director says, ooh, I like that"
53:32;53:35;"But let's get Fall Out Boy to end Oppenheimer"
53:35;53:36;"Sort of update it"
53:36;53:37;"That is a classic move"
53:37;53:40;"You get somebody to cover a song for a movie"
53:40;53:42;"And actually, as we talk about this"
53:42;53:45;"I want to say, before we get into the Fall Out Boy version"
53:45;53:48;"I think there's something kind of poignant"
53:48;53:51;"About musicians who've been around for a minute"
53:51;53:53;"Now they're in their 40s"
53:53;53:56;"Maybe have abandoned some of that youthful"
53:56;53:59;"Finger pointing and blaming the younger generation"
53:59;54:01;"And realize like, oh, wait a second"
54:01;54:04;"I used to be so angry at Billy Joel"
54:04;54:07;"Because he shirked responsibility for starting the fire"
54:07;54:10;"When I really believed he and his generation started the fire"
54:10;54:12;"And then I didn't realize, wait a second"
54:12;54:14;"When Billy wrote that song"
54:14;54:17;"He was a bewildered 40-year-old"
54:17;54:20;"Who probably felt like he'd been a kid just yesterday"
54:20;54:22;"And he was processing it"
54:22;54:23;"And hold on a second"
54:23;54:26;"Now I'm a member of Fall Out Boy"
54:26;54:27;"I'm in my early 40s"
54:27;54:29;"And I feel the same way"
54:29;54:31;"Like, wait, wait, I'm the adult"
54:31;54:33;"I have kids now"
54:33;54:36;"People are pointing at me and saying, yeah, that's right"
54:36;54:39;"Silverback millennial, younger Gen X"
54:39;54:41;"Why did you let all this happen?"
54:41;54:42;"All these problems"
54:42;54:43;"It's your fault"
54:43;54:45;"No, no, no, it wasn't me"
54:45;54:46;"It was the Boomers"
54:46;54:48;"Well, welcome to the club"
54:48;54:50;"Welcome to the club, man"
54:50;54:52;"And maybe this will be an interesting tradition"
54:52;54:55;"Every generation, when they reach 40-something"
54:55;54:57;"Will do their version of We Didn't Start the Fire"
54:57;55:00;"And they're kind of like, wow"
55:00;55:02;"I used to ju- somewhere there's a kid right now"
55:02;55:04;"Judging Fall Out Boy"
55:04;55:07;"Being like, why did you let all this crazy stuff happen in this world?"
55:07;55:09;"Come on, Patrick"
55:09;55:11;"You guys could have stopped all this"
