Start Timestamp;End Timestamp;Transcript
55:11;55:13;"And then tomorrow, they'll be 40"
55:13;55:15;"And they'll be doing their own version of We Didn't Start the Fire"
55:15;55:17;"They'll be 40 and they'll be like, oh, wait, yeah"
55:17;55:19;"Rock stars have no power, actually"
55:19;55:21;"They can change the world at all"
55:21;55:23;"It's entertainment"
55:23;55:25;"Huh"
55:25;55:26;"That's funny"
55:26;55:28;"Anyway, I gotta do a cover of, uh"
55:28;55:31;"My manager said I have to do a cover of We Didn't Start the Fire for Oppenheimer 3"
55:31;55:33;"I like that for my guys"
55:33;55:35;"Let's go"
55:35;55:38;"Alright, let's do it"
55:38;55:40;"Let's dive into this Fall Out Boy"
55:40;56:08;""
56:08;56:20;""
56:20;56:22;"Oh, already amazing"
56:22;56:24;"Yeah, I'm loving it"
56:24;56:27;"Oklahoma City Bomb, Kirk Cobain, Pokemon"
56:27;56:43;""
56:43;56:47;"Robert Downey Jr., Iron Man"
56:47;57:07;""
57:07;57:19;""
57:19;57:21;"Oh"
57:21;57:25;"The thing that rules about both songs is just like the"
57:25;57:29;"It's like the building anger at the end of the verses"
57:29;57:31;"Like, come on, man"
57:31;57:35;"Robert Downey Jr., Iron Man, that's not that big of a deal"
57:35;57:59;""
57:59;58:02;"I just heard some Michael Jordan twice"
58:02;58:05;"Oh, did Michael Jordan come back with a different number?"
58:05;58:06;"Okay"
58:06;58:08;"Yeah, he did, right? The Wizard?"
58:08;58:37;""
58:37;58:39;"I kinda like that it's not chronological"
58:39;58:40;"Yeah"
58:40;58:43;"I think it's great for our internet age"
58:43;58:45;"You're just bouncing around like a pinball"
58:45;58:56;""
58:56;59:00;"Should we do a close review of these lyrics?"
59:00;59:02;"Yeah, I'm down"
59:02;59:04;"First of all, I wanna say, like"
59:04;59:06;"It actually really suits them"
59:06;59:09;"If the Billy Joel version didn't exist and that came out"
59:09;59:12;"I think that would be a massive hit for Fall Out Boy"
59:12;59:15;"I don't know, it sounds like a Fall Out Boy song"
59:15;59:18;"And it suits his voice, it suits their kind of arrangement"
59:18;59:21;"And my hat's off to them"
59:21;59:23;"I think they did their thing"
59:23;59:25;"It's a high bar"
59:25;59:27;"You know, people are always gonna be"
59:27;59:29;"Looking through something like this"
59:29;59:31;"Looking for flaws"
59:31;59:34;"It's gonna be goofy, there's no way that you're gonna write"
59:34;59:35;"The original is goofy"
59:35;59:37;"Yeah, there's no way you're gonna rewrite that song"
59:37;59:40;"And just be like, damn, that's really deep and profound"
59:40;59:42;"I really never thought about the world that way"
59:42;59:45;"I mean, it's supposed to be kind of like fun"
59:45;59:48;"Although it does touch on so many messed up things"
59:48;59:53;"In the most like, cavalier, sort of like casual way"
59:53;59:56;"The first lyric is ""Captain Planet"""
59:56;59:58;"What's that?"
59:58;59:59;"You know Captain Planet?"
59:59;01:00:00;"You don't know what Captain Planet is?"
01:00:00;01:00:01;"The cartoon"
01:00:01;01:00:02;"The Planeteers"
01:00:02;01:00:04;"You have no idea what Captain Planet is?"
01:00:04;01:00:06;"Never heard it"
01:00:06;01:00:08;"What is Captain Planet?"
01:00:08;01:00:10;"He was a superhero"
01:00:10;01:00:12;"He was an environmental superhero"
01:00:12;01:00:13;"He had green hair"
01:00:13;01:00:15;"And he was like"
01:00:15;01:00:16;"He was blue"
01:00:16;01:00:18;"Yeah, he's gonna take pollution down to zero"
01:00:18;01:00:20;"The song, the theme song"
01:00:20;01:00:21;"Where would I have encountered this?"
01:00:21;01:00:23;"Can we drop that? Can we run that theme song?"
01:00:23;01:00:27;"You know what, Jake, this is where the years between really kick in"
01:00:27;01:00:28;"Was it on TV?"
01:00:28;01:00:30;"Yeah, it was on the television"
01:00:30;01:00:32;"What year did this drop? Like '91?"
01:00:32;01:00:35;"It ran from '92 to '96"
01:00:35;01:00:38;"It was like a children's cartoon"
01:00:38;01:00:41;"Yeah, like, it for older kids"
01:00:41;01:00:45;"I think this show is like really hitting when you're like 8, 9"
01:00:45;01:00:48;"Yeah, I was 14 in '91, so"
01:00:48;01:00:49;"I missed this one"
01:00:49;01:00:50;"You were drinking Fireball by then"
01:00:50;01:00:51;"Oh yeah"
01:00:51;01:00:54;"Jake was sneaking bottles of Fireball from the gas station by then"
01:00:54;01:00:56;"Listening to Pavement"
01:00:56;01:01:01;"It was co-created by Ted Turner, media mogul and CNN founder"
01:01:01;01:01:03;"He loved the environment too"
01:01:03;01:01:05;"And there were like all the planeteers"
01:01:05;01:01:07;"One of them represented Earth"
01:01:07;01:01:09;"Water, Ezra, you know what I'm talking about"
01:01:09;01:01:10;"Fire was one"
01:01:10;01:01:12;"Heart, Heart was the last one"
01:01:12;01:01:15;"Yeah, I was always a little confusing, Heart, but okay"
01:01:15;01:01:18;"I get it, like none of it works without Heart"
01:01:18;01:01:20;"I understand it now"
01:01:20;01:01:21;"Whoopi Goldberg"
01:01:21;01:01:22;"It didn't make a lot"
01:01:22;01:01:23;"Yeah, it didn't make sense, I agree"
01:01:23;01:01:27;"And they would always be fighting like fat cat polluters, right?"
01:01:27;01:01:29;"Fat cat polluters, tycoons"
01:01:29;01:01:32;"They'd always just be like, yeah, some nasty tycoon just being like"
01:01:32;01:01:37;"And when I poison everybody in the entire city"
01:01:37;01:01:39;"I'll make even more money"
01:01:39;01:01:43;"When I make them drink my toxic sludge"
01:01:43;01:01:45;"And they'd come in, rough them up a little bit"
01:01:45;01:01:48;"It was like Voltron, they'd all say their elements"
01:01:48;01:01:52;"And then they would summon Captain Planet from the sewer"
01:01:52;01:01:55;"And he would come and, you know, f*** up"
01:01:55;01:01:58;"And Whoopi Goldberg, friend of the show Whoopi Goldberg"
01:01:58;01:02:00;"Was the voice of Gaia, spirit of the Earth"
01:02:00;01:02:01;"Oh yeah"
01:02:01;01:02:03;"Alright, let's move on Captain Planet, guys"
01:02:03;01:02:05;"I'm good, I actually don't need"
01:02:05;01:02:08;"You know, I got like a full primer course on Captain Planet"
01:02:08;01:02:09;"No, no, no"
01:02:09;01:02:10;"You should watch it"
01:02:10;01:02:12;"I would start with the third season"
01:02:12;01:02:15;"I mean, you can go back and watch the first and second after"
01:02:15;01:02:19;"Like, but you know, if you watch season three through five"
01:02:19;01:02:22;"You'll take it down in about a week"
01:02:22;01:02:24;"Because you'll be watching multiple episodes a night"
01:02:24;01:02:26;"Jake, you got a DVD player?"
01:02:26;01:02:28;"Do you have a DVD player in your house?"
01:02:28;01:02:29;"Of course"
01:02:29;01:02:30;"Let's get him the box set"
01:02:30;01:02:33;"Alright, we'll get you the DVD box set"
01:02:33;01:02:35;"Okay, Captain Planet"
01:02:35;01:02:38;"Should we just do the song or just jump around?"
01:02:38;01:02:40;"Should we just talk it through?"
01:02:40;01:02:43;"Yeah, let's have Jake, you should read it"
01:02:43;01:02:45;"Okay, Captain Planet, you know what that is"
01:02:45;01:02:46;"Arab Spring, yeah"
01:02:46;01:02:49;"Already in the first two lines, they've established"
01:02:49;01:02:51;"That you don't know what the hell you're in for"
01:02:51;01:02:54;"I bet they actually put some thought into it"
01:02:54;01:02:56;"They're like, if we start with Captain Planet, Arab Spring"
01:02:56;01:02:59;"People know that we're being chaotic"
01:02:59;01:03:01;"And we're juxtaposing stuff"
01:03:01;01:03:04;"Which I guess Billy Joel did too, you know?"
01:03:04;01:03:07;"Yeah, no, his was totally chaotic"
01:03:07;01:03:08;"It just was in order"
01:03:08;01:03:11;"But again, I don't think it really matters"
01:03:11;01:03:15;"Captain Planet, Arab Spring, LA Riots, Rodney King"
01:03:15;01:03:19;"Deepfakes, earthquakes, Iceland volcano"
01:03:19;01:03:21;"Oklahoma City Bomb"
01:03:21;01:03:22;"That's all stuff that happened"
01:03:22;01:03:25;"Kurt Cobain, just the existence of Kurt Cobain"
01:03:25;01:03:28;"Oklahoma City Bomb, Kurt Cobain, Pokemon"
01:03:28;01:03:29;"Tiger Woods, MySpace"
01:03:29;01:03:30;"That's what Billy Joel did"
01:03:30;01:03:32;"He would just list people"
01:03:32;01:03:33;"Yeah, Billy Joel just listed people"
01:03:33;01:03:34;"Yeah, Billy Joel did"
01:03:34;01:03:35;"Joe DiMaggio"
01:03:35;01:03:39;"Tiger Woods, MySpace, Monsanto, GMOs"
01:03:39;01:03:41;"So sometimes they'll like pair stuff"
01:03:41;01:03:43;"They'll pair LA Riots and Rodney King"
01:03:43;01:03:45;"They'll pair Monsanto, GMOs"
01:03:45;01:03:49;"Harry Potter, Twilight, Michael Jackson dies"
01:03:49;01:03:50;"Nuclear accident"
01:03:50;01:03:52;"Oh, Fukushima, Japan"
01:03:52;01:03:56;"Crimean Peninsula, Cambridge Analytica"
01:03:56;01:04:00;"Kim Jong-un, Robert Downey Jr., Iron Man"
01:04:00;01:04:02;"This would be hard to sing"
01:04:02;01:04:04;"These syllables are just like"
01:04:04;01:04:05;"It's very dense"
01:04:05;01:04:07;"You need to know the specific delivery"
01:04:07;01:04:10;"Yeah, I don't have that down quite yet"
01:04:10;01:04:13;"More war in Afghanistan, Cubs go all the way again"
01:04:13;01:04:14;"That's pretty funny"
01:04:14;01:04:15;"Well, they're from Chicago"
01:04:15;01:04:16;"Okay"
01:04:16;01:04:17;"They have a Chicago POV"
01:04:17;01:04:19;"Oh, and they shout out Kanye West later"
01:04:19;01:04:20;"Yep"
01:04:20;01:04:24;"Obama, Spielberg, explosion, Lebanon"
01:04:24;01:04:26;"When was the explosion in Lebanon?"
01:04:26;01:04:27;"I thought that was 1982"
01:04:27;01:04:28;"What was-"
01:04:28;01:04:30;"No, no, no, there's that huge one in Beirut"
01:04:30;01:04:33;"It was like a factory exploded"
01:04:33;01:04:35;"that was like full of explosives"
01:04:35;01:04:36;"Oh"
01:04:36;01:04:37;"Rocked the whole city"
01:04:37;01:04:38;"Right, right"
01:04:38;01:04:39;"Yeah, it was-"
01:04:39;01:04:40;"No, no, no, that was recent"
01:04:40;01:04:41;"Oh, God"
01:04:41;01:04:42;"Three years ago"
01:04:42;01:04:44;"Again, time is a flat circle, right?"
01:04:44;01:04:47;"It's kind of what the songs sing"
01:04:47;01:04:49;"I like this one"
01:04:49;01:04:51;"Unabomber, Bobbitt, John"
01:04:51;01:04:53;"Bombing Boston Marathon"
01:04:53;01:04:55;"That's a good line"
01:04:55;01:04:57;"Unabomber, Bobbitt, John"
01:04:57;01:04:59;"Bombing Boston Marathon"
01:04:59;01:05:02;"Balloon boy, war on terror, QAnon"
01:05:02;01:05:03;"Good alliteration"
01:05:03;01:05:06;"Do you remember, where were you when the balloon boy-"
01:05:06;01:05:07;"Were you captivated?"
01:05:07;01:05:09;"Do you remember where you were?"
01:05:09;01:05:10;"I don't remember the balloon boy"
01:05:10;01:05:11;"I barely remember"
01:05:11;01:05:12;"Wait, was balloon boy a hoax?"
01:05:12;01:05:13;"What was that?"
01:05:13;01:05:15;"Yeah, balloon boy captivated America when"
01:05:15;01:05:16;"the balloon-"
01:05:16;01:05:19;"There was a balloon that took off from the home"
01:05:19;01:05:21;"of a family"
01:05:21;01:05:25;"and it was reported that there was a boy in the balloon"
01:05:25;01:05:30;"and it was like, this was live on television for hours"
01:05:30;01:05:33;"and I remember everything stopped"
01:05:33;01:05:36;"when the balloon boy went sky high"
01:05:36;01:05:38;"and then it turned out to be a hoax"
01:05:38;01:05:42;"there was no boy, ultimately, in the balloon"
01:05:42;01:05:45;"They were very worried he was going to lose oxygen"
01:05:45;01:05:46;"I remember that"
01:05:46;01:05:48;"and they were saying, uh oh"
01:05:48;01:05:50;"the balloon boy's lost oxygen"
01:05:50;01:05:52;"Six year old boy"
01:05:52;01:05:53;"Where was that?"
01:05:53;01:05:55;"Fort Collins, Colorado"
01:05:55;01:05:57;"Huh, deep"
01:05:57;01:05:58;"So wait, what year was that?"
01:05:58;01:06:00;"Was it like early Twitter era?"
01:06:00;01:06:01;"2009"
01:06:01;01:06:02;"Yeah, that might have been right when"
01:06:02;01:06:03;"2009"
01:06:03;01:06:04;"Right when Twitter was popping off"
01:06:04;01:06:06;"So early Obama years"
01:06:06;01:06:10;"he sent some F-16s to try to take it down"
01:06:10;01:06:11;"I don't think he shot down-"
01:06:11;01:06:12;"Did he?"
01:06:12;01:06:14;"Did he try to shoot down the balloon boy?"
01:06:14;01:06:15;"I think the generals-"
01:06:15;01:06:18;"he was circled by F-16s and Obama said, ""Hold your fire"""
01:06:18;01:06:22;"[laughter]"
01:06:22;01:06:23;"They were ready to take him out"
01:06:23;01:06:25;"Obama said, ""One of two things is true"
01:06:25;01:06:28;"either there's a six year old boy on that balloon"
01:06:28;01:06:31;"and I don't want him to be bombed to pieces"
01:06:31;01:06:34;"or that he's not and it's a waste of ammunition"
01:06:34;01:06:36;"either way, hold your fire"""
01:06:36;01:06:38;"and the generals were like, ""President!"
01:06:38;01:06:40;"Please!"""
01:06:40;01:06:42;"[laughter]"
01:06:42;01:06:44;"That was a defining decision point"
01:06:44;01:06:46;"in his first administration"
01:06:46;01:06:50;"Yeah, the balloon boy kind of forgot about"
01:06:50;01:06:52;"but that's the fun of a song like this"
01:06:52;01:06:53;"Yeah"
01:06:53;01:06:55;"They make you think about everything that's happened in the past"
01:06:55;01:06:57;"This is a pretty bleak one"
01:06:57;01:06:59;"Trump gets impeached twice"
01:06:59;01:07:01;"Polar bears got no ice"
01:07:01;01:07:03;"[laughter]"
01:07:03;01:07:05;"Polar bears got no ice"
01:07:05;01:07:07;"Firefest, Black Parade"
01:07:07;01:07:10;"Michael Phelps, Y2K"
01:07:10;01:07:11;"What's Black Parade?"
01:07:11;01:07:13;"I was about to ask if you knew that"
01:07:13;01:07:14;"No"
01:07:14;01:07:15;"You wanna guess?"
01:07:15;01:07:17;"Is it a band?"
01:07:17;01:07:18;"Close"
01:07:18;01:07:20;"Is it like a festival?"
01:07:20;01:07:21;"No"
01:07:21;01:07:22;"Getting a little cooler"
01:07:22;01:07:24;"Okay, it's a band"
01:07:24;01:07:25;"You're warm"
01:07:25;01:07:26;"DJ?"
01:07:26;01:07:29;"A little cooler"
01:07:29;01:07:30;"Go back to band"
01:07:30;01:07:31;"A rap group?"
01:07:31;01:07:33;"No, I'm saying go back to band"
01:07:33;01:07:35;"You're warm when you're on band"
01:07:35;01:07:36;"Are they a rock band?"
01:07:36;01:07:37;"No"
01:07:37;01:07:40;"Well, okay, but it's something adjacent to a rock band"
01:07:40;01:07:42;"Something a rock band might..."
01:07:42;01:07:44;"What are things that rock bands do?"
01:07:44;01:07:45;"Tour?"
01:07:45;01:07:46;"Put out records?"
01:07:46;01:07:47;"Yes"
01:07:47;01:07:48;"Warmer"
01:07:48;01:07:49;"Is it a record?"
01:07:49;01:07:51;"Black Parade"
01:07:51;01:07:54;"Is it a record label?"
01:07:54;01:07:57;"No, you're right, it's an album"
01:07:57;01:07:59;"Do you have any idea who made it?"
01:07:59;01:08:00;"Fall Out Boy?"
01:08:00;01:08:01;"Warm"
01:08:01;01:08:04;"I don't know how to get warmer from Fall Out Boy"
01:08:04;01:08:06;"[laughter]"
01:08:06;01:08:09;"I don't know which direction I'm headed here"
01:08:09;01:08:11;"Right, you gotta throw out another band"
01:08:11;01:08:12;"Deeper into emo rock?"
01:08:12;01:08:14;"Yes"
01:08:14;01:08:17;"I don't know, I don't like any of those bands"
01:08:17;01:08:20;"You're never gonna guess this one"
01:08:20;01:08:22;"Okay, I'll give you one last hint"
01:08:22;01:08:24;"They're from New Jersey"
01:08:24;01:08:27;"And their singer's name is Gerard Way"
01:08:27;01:08:28;"Three words"
01:08:28;01:08:30;"I think that might be why you said it was close"
01:08:30;01:08:31;"Three words"
01:08:31;01:08:34;"Throw out the song Black Parade for Jake"
01:08:34;01:08:43;"[piano music]"
01:08:43;01:08:46;"I've heard this, did Kanye say all this?"
01:08:46;01:08:47;"No"
01:08:47;01:08:48;"[laughter]"
01:08:48;01:08:50;"Oh yeah, I've heard this"
01:08:50;01:08:52;"It might have inspired Runaway"
01:08:52;01:08:55;"Yeah, yeah, that song on Twisted Fantasy"
01:08:55;01:08:59;"Jake, for a certain generation of emo kids, this is Bohemian Rhapsody"
01:08:59;01:09:13;"[piano music]"
01:09:13;01:09:15;"I've heard this song before"
01:09:15;01:09:16;"It's cool"
01:09:16;01:09:17;"Yeah, it is a cool song"
01:09:17;01:09:19;"It's a triumphant"
01:09:19;01:09:21;"dramatic song"
01:09:21;01:09:23;"I know the name of the band"
01:09:23;01:09:26;"Wait, what was that big single from the album before this?"
01:09:26;01:09:28;"The I'm Not Okay song?"
01:09:28;01:09:30;"I always liked that song"
01:09:30;01:09:33;"This is this band, Sgt. Pepper"
01:09:33;01:09:35;"Before they made this"
01:09:35;01:09:37;"This is like, before they went Sgt. Pepper"
01:09:37;01:09:40;"This is their, like, Please Please Me"
01:09:40;01:09:47;"[piano music]"
01:09:47;01:09:49;"So they were contemporaries of the Ballad Boy"
01:09:49;01:09:51;"I'm sure I've heard the name"
01:09:51;01:09:52;"Like, when we say the name"
01:09:52;01:09:55;"First word, my"
01:09:55;01:09:56;"Chemical Romance"
01:09:56;01:09:58;"Yeah, well done"
01:09:58;01:10:00;"Okay, well done"
01:10:00;01:10:12;"[piano music]"
01:10:12;01:10:14;"Yeah, it always has great melodies"
01:10:14;01:10:42;"[piano music]"
01:10:42;01:10:45;"This is the only album he shouts out"
01:10:45;01:10:46;"Yeah, Black Parade"
01:10:46;01:10:51;"I guess it makes sense that for Ballad Boy fans, Black Parade"
01:10:51;01:10:53;"maybe is kind of like a Sgt. Pepper"
01:10:53;01:10:54;"You wanna hear a very quick"
01:10:54;01:10:56;"It's a very important album"
01:10:56;01:10:58;"You wanna hear a very quick, what I think is like, fascinating"
01:10:58;01:11:02;"It's sort of almost related to Read and Start the Fire, My Chemical Romance story"
01:11:02;01:11:03;"Yeah"
01:11:03;01:11:06;"Gerard Way had sold a car-"
01:11:06;01:11:08;"He wasn't gonna be in a band"
01:11:08;01:11:10;"My Chemical Romance doesn't exist"
01:11:10;01:11:12;"He wanted to make cartoons and comic books"
01:11:12;01:11:14;"which he ended up doing, you know, he created"
01:11:14;01:11:16;"Oh yeah, Umbrella Academy"
01:11:16;01:11:17;"For Umbrella Academy"
01:11:17;01:11:18;"Huge, huge success"
01:11:18;01:11:19;"And they made a TV show"
01:11:19;01:11:21;"Yeah, so"
01:11:21;01:11:23;"He went and sold a show to Cartoon Network"
01:11:23;01:11:26;"and he was like, That's it, I'm gonna make a TV show"
01:11:26;01:11:28;"or maybe he had set up a pitch to pitch them"
01:11:28;01:11:31;"and he was feeling, Alright, this is gonna be my career"
01:11:31;01:11:34;"He's a young guy, got time to make the pitch"
01:11:34;01:11:36;"you know, sat down with some network executives"
01:11:36;01:11:39;"I can't remember if it happened, if they bought it or not"
01:11:39;01:11:41;"but basically 9/11 happened"
01:11:41;01:11:42;"Maybe the day that it was-"
01:11:42;01:11:43;"Whoa"
01:11:43;01:11:45;"You know what, I think if I remember correctly"
01:11:45;01:11:48;"it's like the day that he's supposed to actually pitch"
01:11:48;01:11:49;"is 9/11"
01:11:49;01:11:50;"Was 9/11"
01:11:50;01:11:52;"And so they cancelled the pitch"
01:11:52;01:11:54;"He doesn't do it and he goes"
01:11:54;01:11:57;"I don't know, like"
01:11:57;01:11:59;"either this is a sign or I don't know when I'm gonna get"
01:11:59;01:12:01;"like a pitch back on the books"
01:12:01;01:12:03;"and that side of the career is over"
01:12:03;01:12:08;"and he, out of that, like immediately I think started working on My Chemical Romance"
01:12:08;01:12:10;"Whoa, that's crazy"
01:12:10;01:12:12;"Isn't that crazy?"
01:12:12;01:12:14;"So, truly it was"
01:12:14;01:12:17;"and I said, we didn't start the fire away"
01:12:17;01:12:20;"'cause they must, they shot out 9/11, right?"
01:12:20;01:12:21;"Oh yeah, is there a 9/11 in this?"
01:12:21;01:12:23;"There is, World Trade Second Plane"
01:12:23;01:12:25;"What else do I have to say?"
01:12:25;01:12:27;"So there you go, so World Trade Second Plane"
01:12:27;01:12:30;"My Chemical Romance began"
01:12:30;01:12:32;"Wow, that's an amazing story"
01:12:32;01:12:33;"That's wild"
01:12:33;01:12:35;"Talk about a sliding doors moment"
01:12:35;01:12:36;"Yeah"
01:12:37;01:12:40;"I wonder if Osama Bin Laden never knew that"
01:12:40;01:12:43;"Osama Bin Laden, well they always claim he had all this random stuff on his hard drives"
01:12:43;01:12:46;"That sounds like the type of thing you would like hear"
01:12:46;01:12:49;"or something like, you know that Osama Bin Laden had like a whole"
01:12:49;01:12:55;"rip of Black Parade by My Chemical Romance on his hard drive?"
01:12:55;01:12:56;"They found his LimeWire"
01:12:56;01:12:57;"I always hear stuff like that"
01:12:57;01:12:58;"They had his LimeWire account"
01:12:58;01:13:00;"Don't they always say stuff like that?"
01:13:00;01:13:02;"Like, oh yeah, he had like two seasons of Family Guy"
01:13:02;01:13:04;"Yeah, Sex in the City"
01:13:04;01:13:06;"A bunch of porn, Sex in the City"
01:13:06;01:13:08;"Really surprising stuff"
01:13:08;01:13:12;"So what he actually had was, he had video games"
01:13:12;01:13:16;"He had Yoshi's Island, Final Fantasy"
01:13:16;01:13:20;"Mr. Bean, he had memes, he was into memes"
01:13:20;01:13:22;"Ooh, early, early memes"
01:13:22;01:13:23;"Early in the memes"
01:13:23;01:13:25;"Some pre-9/11 memes"
01:13:25;01:13:27;"Well, shout out to Fallout Boy"
01:13:27;01:13:29;"It's a fun song"
01:13:29;01:13:32;"It says in our notes that it got a lot of negative reactions"
01:13:32;01:13:34;"All the haters can go to hell"
01:13:34;01:13:35;"Not on this show"
01:13:36;01:13:37;"We're pro"
01:13:37;01:13:40;"And anyway, to anybody talking s***"
01:13:40;01:13:43;"I want to hear your We Didn't Start the Fire"
01:13:43;01:13:45;"I love that this became a tradition every year"
01:13:45;01:13:49;"Somebody has to step up and do a We Didn't Start the Fire"
01:13:49;01:13:51;"That would be a very fun exercise"
01:13:51;01:13:53;"to sit around with your friends"
01:13:53;01:13:56;"and just like, with the spiral ring notebook"
01:13:56;01:13:57;"and just like"
01:13:57;01:13:58;"Oh yeah"
01:13:58;01:14:00;"Just co-write it together, sitting around"
01:14:00;01:14:01;"Yeah"
01:14:01;01:14:03;"Order some Chinese food, crack some brews"
01:14:03;01:14:05;"Yeah, a New Year's tradition"
01:14:05;01:14:06;"Yeah"
01:14:06;01:14:08;"We Didn't Start the Fire 2023"
01:14:08;01:14:10;"Am I making this up as well?"
01:14:10;01:14:13;"Isn't Pete Wentz a huge fan of Neo Yokio?"
01:14:13;01:14:15;"He was a big supporter of Neo Yokio"
01:14:15;01:14:17;"Yeah, he was a big early fan, so yeah"
01:14:17;01:14:19;"And I've always been a huge fan of his"
01:14:19;01:14:22;"because one thing that's really cool about him"
01:14:22;01:14:25;"is he's a Pete Townsend type"
01:14:25;01:14:27;"in that he is not the singer of the band"
01:14:27;01:14:29;"but he's the primary lyricist"
01:14:29;01:14:31;"Oh, interesting"
01:14:31;01:14:32;"I did not know that"
01:14:32;01:14:36;"I feel like they really have a very specific lyrical style"
01:14:36;01:14:38;"You know, you think even their early hit"
01:14:38;01:14:40;"Going down, down"
01:14:40;01:14:41;"I'll be your number one"
01:14:41;01:14:43;"With a bullet loaded gun complex"
01:14:43;01:14:44;"Cock it and pull it"
01:14:44;01:14:47;"Like, he really has a way with words"
01:14:47;01:14:48;"And I always find that interesting"
01:14:48;01:14:49;"when it's like"
01:14:49;01:14:51;"he's like the bassist writing the lyrics"
01:14:51;01:14:53;"and clearly he's got this kind of mind meld"
01:14:53;01:14:55;"with the singer"
01:14:55;01:14:57;"Anyway, shout out to Fall Out Boy"
01:14:57;01:15:01;"Am I more than you bargained for yet?"
01:15:01;01:15:04;"I've been dying to tell you anything"
01:15:04;01:15:06;"You already hear"
01:15:06;01:15:09;"'Cause that's just who I am this week"
01:15:09;01:15:10;"Lying in the grass"
01:15:10;01:15:14;"Next to the Mars alien"
01:15:14;01:15:16;"I'm just a notch in your bedpost"
01:15:16;01:15:21;"But you're just a lullaby to song"
01:15:21;01:15:24;"Drop a heart"
01:15:24;01:15:26;"And break a name"
01:15:26;01:15:29;"We're always sleeping in the same bed"
01:15:29;01:15:32;"For the wrong team"
01:15:32;01:15:34;"We're going down, down"
01:15:34;01:15:36;"In a million rounds"
01:15:36;01:15:38;"And sugar we're going down swinging"
01:15:38;01:15:40;"I'll be your number one"
01:15:40;01:15:43;"With a bullet loaded gun complex"
01:15:43;01:15:44;"Cock it and pull it"
01:15:44;01:15:46;"We're going down, down"
01:15:46;01:15:47;"In a million rounds"
01:15:47;01:15:50;"And sugar we're going down swinging"
01:15:50;01:15:51;"I'll be your number one"
01:15:51;01:15:55;"With a bullet loaded gun complex"
01:15:55;01:15:56;"Cock it and pull it"
01:15:56;01:15:57;"Alright, top 5?"
01:15:57;01:15:58;"Top 5"
01:15:58;01:16:01;"It's time for the Top 5"
01:16:01;01:16:05;"5 on iTunes"
01:16:05;01:16:07;"This week on the Top 5"
01:16:07;01:16:10;"We're comparing the Top 5 hits of the present day"
01:16:10;01:16:14;"With the Top 5 songs of 1999"
01:16:14;01:16:15;"Why 1999?"
01:16:15;01:16:22;"'Cause we're continuing our episode to year matching system"
01:16:22;01:16:24;"This is episode 199"
01:16:24;01:16:25;"That's crazy"
01:16:25;01:16:26;"Next episode we've done 200"
01:16:26;01:16:28;"We're gonna do something"
01:16:28;01:16:30;"Yeah, crazy"
01:16:30;01:16:34;"So we're doing 1999 'cause it's close to 199"
01:16:34;01:16:37;"So the number 5 song this week in 1999"
01:16:37;01:16:39;"Well this is an all time classic"
01:16:39;01:16:41;"Smash Mouth - All Star"
01:16:41;01:16:45;"Somebody once told me the world is too lonely"
01:16:45;01:16:46;"So this was both on their album Astro Lounge"
01:16:46;01:16:50;"And the Mystery Men original soundtrack"
01:16:50;01:16:52;"She was looking kind of dumb"
01:16:52;01:16:54;"With her finger and her thumb"
01:16:54;01:16:57;"This song got a second life 'cause of Shrek, right?"
01:16:57;01:16:58;"Yes"
01:16:58;01:16:59;"Seinfeld, you must"
01:16:59;01:17:02;"That sounds like something you would know a bunch about"
01:17:02;01:17:03;"No, that's true"
01:17:03;01:17:04;"That's exactly right"
01:17:04;01:17:05;"For the Zoomers, this is the Shrek song"
