Start Timestamp;End Timestamp;Transcript
00:00;00:02;"Time Crisis back again"
00:02;00:09;"It's the middle of August the dog days of summer. Are you hot? Don't blame us. We didn't start the fire"
00:09;00:17;"We'll be talking about fallout boys month-old cover of the Billy Joel classic plus light funky ones"
00:17;00:21;"Farmer country and"
00:21;00:24;"Christine Aguilera all this and more"
00:24;00:29;"With Ezra Koenig"
00:29;00:31;"Yeah"
00:31;00:33;"I"
00:35;00:37;"Oh"
00:41;00:43;"I"
00:43;00:45;"Oh"
00:48;00:52;"My picture clear everything seems so easy"
00:52;00:54;"Oh"
00:54;01:20;"Time crisis back again. It's the dog days of summer"
01:21;01:23;"How you fellas doing"
01:23;01:26;"Jake pretty good"
01:26;01:29;"we were talking we were talking before the show started and"
01:29;01:31;"Nick was"
01:31;01:38;"In about you know how the summer is torched and LA's, you know blown out and I love summer"
01:38;01:40;"I think it's the best season. I"
01:40;01:45;"Like the heat. I like the long days. I'm a summer guy dude always have been"
01:45;01:52;"Even in LA. Yeah, but you grew up in the you grew up in the tri-state area summertime in Connecticut beautiful"
01:52;01:54;"tall leafy trees"
01:54;01:59;"Cool overcast days. Yeah, those kind of interesting"
01:59;02:05;"East Coast days where it feels like it's gonna rain all day right dog days of summer and sometimes it never does"
02:05;02:11;"Just a pregnant summer day on the East Coast. Hmm. Love it. You like summer in Southern, California"
02:11;02:15;"Yeah, I do. Like I said, I like the long days. I don't really mind the heat"
02:15;02:19;"I mean if it gets up to like what's my cutoff? Yeah low hundreds then it starts to be like a bummer"
02:19;02:23;"Most days are what high 80s low 90s"
02:23;02:25;"It's been a nice summer"
02:25;02:30;"I think people are so like up in their heads about summer in a way that they didn't used to be I"
02:30;02:34;"Think it's nice to do with climate change. I think like 20 years ago a hot day"
02:34;02:40;"He would like yeah, it's hot out, but they wouldn't like have this like kind of spiritual sense of"
02:40;02:42;"malaise or or even"
02:43;02:47;"Anxiety about it. You're right. It is because of climate change and"
02:47;02:53;"people increasingly see a hot day, you know, perhaps for good reason as"
02:53;03:00;"Yeah a harbinger of their impending death and everybody else's death. But yeah, maybe that's a little bit extra"
03:00;03:03;"Yeah back in the days. It's just like you'd be looking like music"
03:03;03:06;"Old school to be like hot time summer"
03:06;03:13;"Yes, you might look at it as challenging but kind of like a welcome challenge those summer"
03:13;03:15;"nights"
03:15;03:20;"Yeah, like hot summer fun. Yeah, okay that it's not who how hot is it gonna get Wow"
03:20;03:23;"Whereas now people got that summertime sadness"
03:23;03:30;"Which is kind of launched the career of Lana del Rey that was her first really big hit because clearly it spoke to people"
03:30;03:34;"They don't want to hear a hot fun in the summertime song. They wanted summertime sadness"
03:34;03:36;"Kiss me hot before you go"
03:36;03:41;"Summertime sadness"
03:41;03:45;"I just wanted you to know"
03:45;03:48;"The baby"
03:48;03:53;"I got my red dress on tonight"
03:53;03:56;"dancing in the dark in the"
03:58;04:02;"Dumb hair up real big beauty queen style"
04:03;04:05;"Hi heels off"
04:05;04:07;"I'm feeling"
04:07;04:09;"Oh"
04:11;04:13;"I"
04:17;04:19;"Oh"
04:19;04:21;"I said"
04:21;04:23;"Me"
04:23;04:35;"I just"
04:35;04:37;"I"
04:37;05:03;"So Jake is pro summer but Nick you're more of a you're more anti summer summertime sadness guy"
05:03;05:05;"I mean, I wouldn't say I'm anti summer"
05:05;05:10;"I just I really feel the summertime sadness and I don't know and it's the last few years"
05:10;05:13;"So I I want to maybe I want to be pro summer"
05:13;05:20;"I I'm definitely like very into air, you know Jake's energy on this because I would feel he seems so upbeat about it"
05:20;05:23;"There's a thing first of all it is. I don't know if it's just"
05:23;05:28;"My neck of the woods, but it's very hot. There's been no like 80s. We're in like"
05:28;05:32;"mid 90s to 100 every day and"
05:32;05:37;"I think this is what may be going on. One is you guys have young also younger kids"
05:37;05:42;"There's a thing especially at Max's age where he's a bit older and he's not in school"
05:42;05:46;"And so you're and you don't want him just like I don't want him just like on"
05:46;05:52;"Playing video games all day long. You know what I mean? So it's like that's those school hours good for hand-eye coordination"
05:52;05:55;"It's you know that"
05:55;05:58;"Can he go?"
05:58;06:00;"He certainly told me really good"
06:02;06:03;"Yeah, exactly"
06:03;06:08;"So you're dudes like that kind of like Oh most of the day he's in school and you're able to like oh"
06:08;06:10;"I'm gonna like I can get this work done or I can"
06:10;06:16;"you know accomplish this like that sort of is out the window like summer becomes like a lot of work in a way and"
06:16;06:19;"You're in the middle of it. It's sort of probably like that"
06:19;06:24;"But then you'll find this like respite for these years, you know, once your kids in like full school mode"
06:24;06:29;"You're like, oh man, those like weekdays are like chill and then summer just becomes can can be just a lot"
06:29;06:35;"You know, it can be really a lot and you can't it's too hot just to say jump on your bike"
06:35;06:39;"Dude, I got in the neighborhood kids go catch frogs down by the creek and be like dad. It's a hundred"
06:39;06:43;"It's it's a hundred and eleven degrees. I'm not doing that. Yeah, I got this, you know"
06:43;06:50;"I got this big-ass dog that normally wants to walk for miles you get him outside right now"
06:50;06:54;"He's just like will not move and it's just sort of say I don't know if I left the house today"
06:54;06:58;"You know, I'll step outside but and take the dog out but it's I'm telling you summertime"
06:58;07:01;"I'm Siberian Husky close. It's a"
07:01;07:06;"Samoyed so yeah, big hairy free not meant to be in not meant to be in so in LA"
07:06;07:08;"Yeah, not a so not a SoCal dog"
07:08;07:10;"But you know this, you know"
07:10;07:15;"The other thing that we've talked a lot about is I had a teacher or a professor in college that you I think you took"
07:15;07:20;"A class with as well. Yeah, the legendary and Douglas of Columbia University"
07:20;07:26;"It was just the best and we took a film noir. I took a film noir class. I've often referenced to you"
07:26;07:31;"I don't think on the show and it was like talking about New York versus LA noir and how in New York"
07:31;07:35;"It's all shadows and it's all the sit, you know, like it's all secret alleyways, you know"
07:35;07:38;"And and that's where the sinister stuff happens and in LA"
07:38;07:45;"Yeah, it's just pulled into a dark alleyway in New York City pulled into the darkness and in LA darkness is the enemy"
07:45;07:52;"Yeah, and in LA the Sun is the enemy that the Sun is so there's you can't it's so oppressive and it's so there's no"
07:52;07:57;"There's no shadows that it's just like everything is seen and when it's summertime, baby"
07:57;08:02;"Feel it feels sinister. Yeah, I feel you the sinister son of Southern, California"
08:02;08:05;"Mm-hmm the sinister son of Southern, California"
08:05;08:13;"Yeah, that's the classic LA noir is somebody like hold up in a house looking through Venetian blinds as"
08:13;08:17;"Like that bright harsh Sun creeps in"
08:17;08:22;"And soon he'll walk to his death because he thought he'd never feel this way again"
08:22;08:29;"If he goes back to the house then things will go from bad to worse what could he do?"
08:29;08:36;"He wants to remember things exactly as he left them on that funny day"
08:36;08:46;"And if there is something else beyond he isn't scared because it's bound to be less boring than today"
08:46;08:49;"Bound to be less boring than tomorrow"
08:49;09:10;"Hillary went to her death because she couldn't think of anything to say"
09:13;09:17;"Everybody thought that she was boring so they never listened anyway"
09:17;09:24;"Nobody was really saying anything of interest she fell asleep"
09:24;09:33;"She was into S&M and Bible studies not everyone's cup of tea she would admit to me"
09:33;09:40;"A cup of tea she would admit to no one a cup of tea. She would admit to me"
09:41;09:43;"a cup of tea she would admit to no one"
09:43;09:48;"Maybe you got to just try framing it as a"
09:48;09:54;"You know how there's like just like random dudes who are like into trains or like"
09:54;10:03;"Tornado chasers or something you got to become a heat junkie. Just wake up and just be like wow. We want triple digits"
10:03;10:05;"All right"
10:05;10:09;"Walking around with a little thermometer trying to get the hottest spot"
10:09;10:16;"Exactly. I guess that's like if you gotta like life is beautiful it for your kid. Just be like wake up, buddy. It's 104"
10:16;10:24;"You know taking photos every time my my phone says it's too hot, you know to operate"
10:24;10:27;"You know when the iPhone shuts down with a thermometer just getting psyched"
10:27;10:32;"Exactly. See if you can see if you can fry an egg on on your car"
10:32;10:39;"Do some like crazy stuff with well, don't kill bugs with a magnifying glass, but you could probably come up with a more humane"
10:40;10:41;"game to do with"
10:41;10:47;"Magnifying I don't see if you could set a piece of paper on fire in a bucket having to rebrand myself as a heat junkie"
10:47;10:49;"I like this. Yeah"
10:49;10:52;"Next to real heat junkie"
10:52;11:00;"I'm bringing back while we were by the way"
11:00;11:05;"Next time somebody's like being like, oh man, what a hot summer just be like"
11:06;11:13;"Yeah, real bummer. We almost made it up to 111. I was kind of disappointed. We topped out around 103"
11:13;11:18;"There's one day in August. We hit 103. I was I was hoping for like a 105 106. How about you?"
11:18;11:26;"How's your summer going? My summer has been great been here and there. I'm in New York City"
11:26;11:28;"back on the island"
11:28;11:30;"money making Manhattan, but"
11:30;11:33;"Wait, is that an old phrase?"
11:33;11:40;"Money making Manhattan. Yes, like early hip-hop. Okay, it's got you. Yeah, I feel like it was like the boogie down Bronx. Yeah"
11:40;11:49;"What would come again? But then it was money making man out of those places recently for some reason anyway, where I don't remember"
11:49;11:51;"I just I've heard it money making, Missouri"
11:51;11:58;"Money making Monrovia through the soybean industry. Yeah money making, Missouri"
11:59;12:01;"Absolutely"
12:01;12:30;"I love a"
12:30;12:32;"Bad"
12:32;12:34;"Like"
12:34;12:38;"Down like a penitentiary"
12:38;12:45;"She spreads her loving all over and when she gets home there's none left for me"
12:45;12:49;"Do it"
12:49;12:53;"Ratties on the microphone"
12:53;12:59;"All people in the dance to the three that will well qualified to represent the LBC"
12:59;13:01;"I"
13:01;13:13;"Love being on the East Coast in summer or because well, you know"
13:13;13:19;"I get to see friends and family and also I do feel spiritually connected to summer out here and"
13:19;13:22;"Recently I was in deep deep New York State"
13:22;13:28;"About as far as you can get from Manhattan like Western New York. Yeah deep Western, New York"
13:28;13:29;"and"
13:29;13:36;"I had some interesting experiences out there one of which I started because I this is actually turned into a bit of a TC experience"
13:36;13:44;"There was a little food mart near where I was, you know, just like a local kind of independent little mini mart"
13:44;13:46;"I noticed a few things"
13:46;13:53;"Some handwritten signs outside one of which was that like they had lots of kratom kratom. How do you say that?"
13:53;13:57;"Kratom not familiar. It's like a legal ish drug that"
13:58;14:00;"People are taking probably won't be legal forever"
14:00;14:05;"but the other thing that caught my eye at the front of this kind of quickie Mart was a"
14:05;14:11;"Handwritten sign that said fireball slushy. So of course I had to go find out what that was"
14:11;14:16;"It's just like one dude running the stores like what's up with the fire with fireball slushies and he's like"
14:16;14:20;"you know, I got my slush puppy machine and throw some fireball in there for you and"
14:20;14:26;"First thought in my head. I'm like, is that legal? Cuz like when I think of fireball, that's it's like whiskey"
14:27;14:31;"It's a type of hard alcohol. I guess I don't know that much about fireball. Do you guys know?"
14:31;14:35;"Yeah, I thought it was like this like a flavored, you know, like a spicy whiskey basically"
14:35;14:41;"Like a cinnamon, yeah liquor. Yeah, it's got like a devil breathing fire on it"
14:41;14:46;"So I'm kind of thinking like, you know, I wasn't like a pretty small town"
14:46;14:48;"so like maybe they got their own rules out there, but I was saying like"
14:48;14:55;"There's like something kind of like seemed a little bit like off about that. He's like, yeah, no problem"
14:55;14:59;"I'll make this slush puppy. You know, you pick your flavor slush puppy and I pour in the"
14:59;15:04;"Fireball and I'm like wait, don't you have to be like a bar to do that?"
15:04;15:10;"and I left and then I and then I kept thinking about it so like went back and had to try one and"
15:10;15:14;"He had this um a little plastic jug"
15:14;15:21;"Right by the cash register that's full of small bottles of fireball. Hmm, which has two amazing"
15:21;15:25;"slogans on the jug one was unleash the dragon and"
15:25;15:30;"The second one was fireball tastes like heaven burns like hell. I"
15:30;15:32;"Was like, okay"
15:32;15:37;"I like this and then you know, he's like, all right making a slush puppy with the classic slush puppy machine"
15:37;15:40;"you know with like that that cool dog would like the"
15:40;15:45;"Little beanie on and so he made one he'd like, you know"
15:45;15:52;"Pick your flavor and he'd pick I picked blue raspberry and he squirts that in and then he just reached into the jug took out"
15:52;15:56;"One of the little things of fireball and poured it in, you know, like an airplane sized bottle. Sure"
15:56;16:03;"You know, I was like, alright, thanks drank it insanely sweet bit cinnamon II, you know got a mild buzz"
16:03;16:08;"Maybe mostly from the sugar but I was like, okay, that was an interesting experience"
16:08;16:11;"I've never had a mixed drink at you know"
16:11;16:16;"A 7-eleven type place and I'm like thinking about that a lot and I wondered you know"
16:16;16:21;"Is this is this guy just kind of like doing his own weird thing? Is he gonna get in trouble for this?"
16:21;16:24;"I don't know, but then I looked it up and it turns out that"
16:24;16:31;"Yes, fireball as most people know it is a 33% alcohol whiskey"
16:31;16:37;"But they started selling these little bottles at like gas stations and mini-marts"
16:37;16:41;"That are not made out of whiskey. They're like"
16:41;16:44;"16% alcohol"
16:44;16:46;"like little malt beverages"
16:46;16:47;"hmm and"
16:47;16:52;"The packaging looks exactly the same and then it actually turns out that there's a class-action"
16:52;16:57;"Lawsuit against the fireball company because people were like this is false advertising"
16:57;17:02;"You have a well-known brand as a whiskey. You're selling these little bottles. It's only half the alcohol"
17:02;17:08;"It doesn't even have like the the main ingredient which is whiskey and they're popping up everywhere because a lot of these stores"
17:08;17:14;"I think that was confusing about a lot of these stores don't even have the license to sell hard alcohol. Mm-hmm"
17:14;17:19;"You know, they sell beer. All right, East Coast. The states are more uptight about"
17:19;17:24;"Liquor laws. Yeah, exactly. You got to go to a liquor store to get a bottle of whiskey, right?"
17:24;17:27;"So this is kind of started showing up at places. You normally wouldn't expect hard alcohol"
17:27;17:31;"So for all I know this is like a big trend fireball slushies"
17:32;17:38;"Uh, everywhere. So it's like a but if you just drank it straight it would would it taste like fireball, but it's actually I"
17:38;17:44;"Don't know what a malt like what is a malt liquor? Like I know that's like old English and stuff"
17:44;17:49;"I thought I was like Jason's a beer. I think it's just a way to produce alcohol. So I think"
17:49;17:56;"Malted alcohol is a way that they create alcohol for many of these weird new alcohol drinks"
17:56;18:03;"That malted liquor is the type of mass-market beer with a high alcohol content most closely associated with North America"
18:03;18:09;"Legally, it often includes any alcoholic beverage or it's any alcoholic beverage with 5% or more alcohol by volume"
18:09;18:13;"Made with malted barley. So it's like it is like a beer"
18:13;18:19;"Well, no, I think malt malt liquor is like a beer where they maybe add a bit or something"
18:19;18:20;"There's also malted"
18:20;18:21;"Alco they use malt"
18:21;18:27;"Malted barley to create the alcohol for all sorts of like random drinks because now you have we were in this era of just like"
18:27;18:29;"Alcohol drinks, you know"
18:29;18:35;"Like when we were talking about the rise of all these hard seltzers the white claws of the world and now"
18:35;18:40;"Wait, was it like Duncan is getting in the mix now? Yeah, there's a Duncan Donuts"
18:40;18:47;"like hard iced tea or something or hard hard mocha"
18:49;18:53;"Wait and they and they come in they come in a paper cup with the I mean it's spiked"
18:53;19:01;"I spiked iced coffees and iced teas like alcohol coffee in the same can that's that does not appeal"
19:01;19:06;"I mean, I think is your upper and your downer. I think that's like the for loco stuff, right?"
19:06;19:10;"Like it makes you insane because it wasn't for loco an energy drink with"
19:10;19:16;"Alcohol in it. Yeah. Yeah, they announced this a Duncan this hard Duncan news"
19:16;19:22;"People made a lot of jokes about like it's gonna be you need to call in the National Guard in Boston"
19:22;19:24;"that kind of stuff"
19:24;19:30;"The whole state of Massachusetts is gonna be so twisted all summer long"
19:30;19:35;"It's gonna be a real problem"
19:46;19:51;"For 17 long years"
19:51;20:00;"I spent all my money"
20:00;20:06;"On whiskey"
20:06;20:11;"And beer"
20:11;20:13;"I"
20:13;20:18;"Go to"
20:18;20:23;"Some hollow"
20:23;20:27;"And said"
20:27;20:31;"Of my still"
20:31;20:36;"And if whiskey"
20:39;20:41;"Don't kill me"
20:41;20:47;"And I don't know what will"
20:47;20:49;"I"
20:49;20:51;"Go to"
20:51;20:53;"I"
20:53;21:19;"Go to"
21:19;21:23;"Some bar room"
21:23;21:28;"And drink"
21:28;21:33;"With my friends"
21:33;21:37;"Well the women"
21:37;21:40;"Can't follow"
21:40;21:45;"And see what I spend"
21:48;21:52;"God bless them pretty women"
21:52;21:57;"They was mine"
21:57;22:02;"Their breath is"
22:02;22:05;"That sweet"
22:05;22:09;"They do"
22:09;22:16;"Only fine, but the thing is about all of these whether it's it's the hard Duncan's the white claws, whatever"
22:16;22:18;"back in our day"
22:18;22:22;"You normally would think of a mixed drink as being one of the standard"
22:22;22:27;"Alcohols mixed with something else so we have this naive question"
22:27;22:33;"Which is like oh what kind of alcohol like the same way if back in the day you go to a bar"
22:33;22:37;"You know somebody make a mixed drink you might say like oh, what kind of alcohol is in that?"
22:37;22:42;"Oh, yeah, it's actually it's rum or it's vodka or something these are not made out of rum or vodka or whiskey"
22:43;22:51;"The classics or tequila they're made out of just like the cheapest type of alcohol you can put in some it's just alcohol"
22:51;22:57;"It's sometimes it's derived from malted barley or something, but it's like you know it's new school"
22:57;23:01;"It's just like the cheapest type of alcohol they can put into it right and I think that's a little bit"
23:01;23:06;"What's going on with this these cheap little fireballs, and maybe that's why?"
23:07;23:13;"Maybe these people win their class-action lawsuit because if you have an expectation that you're drinking something with like traditionally made whiskey"
23:13;23:15;"And it's just like some cheap"
23:15;23:21;"Maybe synthetics not the white right word, but it like just the cheapest type of alcohol you can buy"
23:21;23:24;"You're gonna feel a little ripped off listen"
23:24;23:31;"I was buying those airplane sized bottles of the gas station upstate New York, and I thought I was buying the finest whiskey"
23:31;23:36;"They were retailing for a dollar ninety nine each. I feel ripped off"
23:36;23:42;"I was like I wonder if it's a lawsuit they they also have because you know they always have to like the lawyer has to"
23:42;23:44;"like list out the"
23:44;23:50;"You know frame things and like with like emotional distress and stuff like that and just be like right my client"
23:50;23:53;"drank five of these and"
23:53;23:57;"Was not remotely twisted yeah this the synthetic"
23:57;24:01;"You know barley alcoholic slurry not cutting it"
24:03;24:08;"The failure to get twisted that night led my client to severe emotional distress"
24:08;24:11;"Well there you go"
24:11;24:13;"Someone's doing the Lord's work taking on that case"
24:13;24:21;"Really swinging for the fences on that one. I still kind of wonder okay whiskey or not it was still an interesting"
24:21;24:25;"Experience just like watching the dude behind the counter. Yeah, it's like"
24:25;24:31;"Make a mixed drink so he didn't card you know you get carded still"
24:32;24:39;"Very rarely you get carded. No. I think my final carding is behind me some places"
24:39;24:45;"Yeah, some places just do it with everything right like I remember being the grocery store with my dad"
24:45;24:47;"And like we were buying a bunch of wine or something and they like carded my dad"
24:47;24:51;"He's just like really"
24:51;24:54;"Sorry, sir like yeah, well. I feel like this is a joke"
24:54;24:59;"I may have seen multiple times in TVs or movies where like somebody"
24:59;25:04;"Gets carded an older person gets carded and it's like can I see your ID you got and they're just like oh"
25:04;25:10;"You're making me feel so young. I'm actually you know 57 just like yes store policy"
25:10;25:16;"You know I feel like I have witnessed that and I think if you go homes and programs"
25:16;25:22;"I think if you go to like an AMC movie theater like someplace. That's like not normally"
25:22;25:28;"Like a liquor store bar. I've never not been carded or seen them card like my mom really"
25:28;25:31;"Yeah, places that are just like it's policy"
25:31;25:36;"Don't give us a hard time. Don't make don't make this cute. I've been over 21 for a very long time"
25:36;25:38;"Yeah, I know just did this is what we do okay?"
25:38;25:42;"We're not gonna have a cutesy little moment ma'am"
25:42;25:44;"You're old. I'm looking at your old"
25:44;25:52;"You're old. I know my boss is over there. Just just please pay me also when I was when I was in deep, New York"
25:52;25:54;"I went to a bar I"
25:54;26:00;"Might have been there on country music night, and I heard a cool song that I wanted to play for you guys"
26:00;26:04;"Some people in the bar really knew this song so this must be like must have been a big hit"
26:04;26:07;"10 15 years ago"
26:07;26:11;"The song I heard in the bar, which I don't think I'd ever heard before maybe you guys have"
26:11;26:16;"Is by Craig Morgan it's called international harvester"
26:16;26:22;"I know I'm I know my country music, and I don't think I know this one"
26:23;26:27;"And it was like because where I was is kind of surrounded by farmland"
26:27;26:31;"So then I was like oh is this just like farmer country, and then I looked it up"
26:31;26:34;"It's like no this is like crossover country. It's about farming"
26:34;26:38;"Like when I got to the chorus like five people in the bar were yelling"
26:38;26:46;"I've been married ten years to the farmers daughter"
26:48;26:53;"I'm a God-fearing hard-working combine driver hogging up the road and whopper popper flower"
26:53;26:56;"It's heavy like a lugging five miles an hour"
26:56;26:59;"on my international"
26:59;27:01;"harvester"
27:01;27:06;"International harvesters like the company's a miles cars laying all their horns"
27:06;27:11;"Falling on deaf ears a corn"
27:11;27:16;"Lined up behind me like a big parade"
27:16;27:23;"I've laid to work road rage jerk shouting obscene words flipping me the bird"
27:23;27:31;"Well you may be on the state paper"
27:31;27:36;"But that black top runs through my payload"
27:36;27:42;"Excuse me for trying to do my job, but this year ain't been no"
27:44;27:47;"To be a long time to really understand this is song is about eat"
27:47;27:53;"If you don't like the way, I'm a driving get back on the interstate"
27:53;27:58;"Otherwise sit tight and be nice and quit you honking and me that away"
27:58;28:04;"He's on the highway driving his he's not on the highway"
28:04;28:10;"No, he's on the street like that people are honking on the road. He's on the road trying to drive his"
28:11;28:15;"Piece of giant farm machinery down the road and everyone's talking behind"
28:15;28:24;"But I'm proud to say I'm a god-fearing hard-working combine driver"
28:24;28:28;"Flower"
28:28;28:40;"Yeah, he's chugga-lugga-lugga in five miles an hour, but this is also from the point of view of the harvester"
28:41;28:46;"Like this is because international harvester is the company so this is from the point of view of the plow"
28:46;28:56;"No, he says he's I'm on my international on on an international harvester"
28:56;28:59;"Yes, it's not Transformers"
