Start Timestamp;End Timestamp;Transcript
49:43;49:44;"Outrageous."
49:44;49:46;"Like, what's a Snickers run?"
49:46;49:49;"I was just saying that I'm such a high roller,"
49:49;49:50;"I don't even..."
49:50;49:52;"I buy Snickers, I don't even look at the price."
49:52;49:53;"All right."
49:53;49:54;"It's $1.39."
49:54;49:55;"Yeah."
49:55;49:57;"$1.39 for a traditional?"
49:57;49:58;"I was going to guess $1.50."
49:58;49:59;"The target for a..."
49:59;50:01;"Yeah, for your standard Snickers."
50:01;50:04;"I was going to say, yeah, like $1.70 for a Snickers."
50:04;50:07;"But that's amazing because it wasn't that much cheaper."
50:07;50:10;"I mean, how cheap could a Snickers have been in 1995?"
50:10;50:11;"$0.89?"
50:11;50:12;"Yeah, totally."
50:12;50:13;"$0.69."
50:13;50:15;"Can you number crunch this?"
50:15;50:18;"Unless, Dave, do you know off the top of your head"
50:18;50:20;"the average price of a Snickers stand-alone in 1995?"
50:20;50:21;"No, I don't know."
50:21;50:24;"Yeah, I was going to say, yeah, $0.79."
50:24;50:25;"That was my thing."
50:25;50:27;"It was like in the mid-90s or something."
50:27;50:31;"According to ChatGPT, $0.75 to $1 range."
50:31;50:32;"Okay."
50:32;50:33;"$0.95."
50:33;50:34;"Okay, but think about it."
50:34;50:36;"That was 30 years ago."
50:36;50:38;"Yeah."
50:38;50:40;"$0.29, if you want to be exact."
50:40;50:47;"So the price of a Snickers is only up $0.39, $0.40, $0.50."
50:47;50:48;"I just think like..."
50:48;50:50;"Dude, it's percentage, though."
50:50;50:51;"It's gone from..."
50:51;50:53;"It's more than doubled."
50:53;50:54;"It's less than doubled."
50:54;50:57;"Are you factoring in Shrink Flesh, though?"
50:57;50:59;"Because it's a smaller bar."
50:59;51:00;"Well..."
51:00;51:04;"It's probably like, what, a few grams lighter."
51:04;51:05;"Wait, what?"
51:05;51:07;"You're saying current-day Snickers is lighter?"
51:07;51:09;"Smaller than it would have been in '95."
51:09;51:12;"And for all we know, the price of peanuts went down."
51:12;51:15;"All I'm saying is that's less than double."
51:15;51:19;"How much is a dollar worth now versus 1995?"
51:19;51:20;"Okay, listen."
51:20;51:24;"If the Snickers, let's say, Seinfeld had said around 75 cents."
51:24;51:25;"75 cents to a dollar."
51:25;51:27;"So let's just call it 85 cents."
51:27;51:28;"Sure."
51:28;51:31;"So double that would be $1.70."
51:31;51:32;"So basically doubled."
51:32;51:35;"But you just said it's $1.39 at Target."
51:35;51:36;"Okay."
51:36;51:39;"So it's well under doubled, and I just want to know."
51:39;51:44;"A dollar in '95 is $1.71 in 2022."
51:44;51:45;"Okay."
51:45;51:46;"Wait, Seinfeld, did I..."
51:46;51:47;"I didn't have a calculator."
51:47;51:49;"I spaced out for a second."
51:49;51:50;"Yeah, yeah."
51:50;51:57;"So the value of a dollar in '95 is equivalent to $1.71 in 2022."
51:57;52:01;"Which is the latest year that data is available to chat GPT."
52:01;52:02;"Mm-hmm."
52:02;52:08;"So maybe the price of the Snickers has risen higher than the relative rate of inflation."
52:08;52:09;"Or lower."
52:09;52:10;"I'm confused."
52:10;52:11;"Whatever, who cares?"
52:11;52:13;"Yeah, I think that's a good price."
52:13;52:14;"I think that's a great price."
52:14;52:15;"It's an honest price."
52:15;52:16;"Right."
52:16;52:18;"$4 for a kind, though."
52:18;52:21;"The joke was Ezra as Jake saying, ""What?"
52:21;52:22;"$70 for the Snickers?"
52:22;52:23;"That seems like a lot."""
52:23;52:27;"Yeah, no, I'm just imagining Jake because he never looks at how much a Snickers costs."
52:27;52:30;"And actually, a lot of people have to be careful about this."
52:30;52:32;"You don't even think about it."
52:32;52:33;"And you just swipe it."
52:33;52:37;"For all you know, you got to go check your CVS receipts and stuff."
52:37;52:41;"Because at the end of the month, your wife, your accountant might say,"
52:41;52:43;"""You got hosed, man."
52:43;52:44;"You paid $70 for a Snicker."
52:44;52:46;"You go into a mom and pop shop."
52:46;52:47;"You don't really think about it."""
52:47;52:48;"Yeah."
52:48;52:49;"You always have to look."
52:49;52:56;"Paying with the phone, for some reason, corresponds for me for just not thinking about"
52:56;52:58;"what the price is."
52:58;53:01;"Or engaging with the fact that I'm buying something at all."
53:01;53:02;"Exactly."
53:02;53:08;"I'm sure you'd probably get called out within three weeks by one of those"
53:08;53:12;"investigative journalist local news shows."
53:12;53:15;"But imagine you're just a local gas station owner and you're just like,"
53:15;53:16;"""F*** it."
53:16;53:17;"Twizzlers."
53:17;53:19;"$100."""
53:19;53:26;"And you're just like, ""For every 10 sales I lose, I'll get one mark who just pays it."
53:26;53:29;"Rich person just pays it and leaves."""
53:29;53:30;"Never thinks about it."
53:30;53:34;"And then you think that you could maybe get a couple months in and your Twizzler profits"
53:34;53:36;"are up significantly."
53:36;53:40;"And then one day, here comes channel four."
53:40;53:42;"""Can I talk to you, sir?"""
53:42;53:44;"Oh my God."
53:44;53:45;"Yeah."
53:45;53:48;"America was built on $100 Twizzlers, ma'am."
53:52;53:56;"♪ Oh baby, baby, just a second for me ♪"
53:56;54:00;"♪ Oh baby, baby, I wanna look into your eyes and you ♪"
54:00;54:04;"♪ Oh baby, baby, smile and your body has to do ♪"
54:04;54:17;"♪ Oh baby, baby, I wanna see you looking down the street ♪"
54:17;54:21;"♪ Oh baby, baby, looking for the love to keep ♪"
54:21;54:25;"♪ Oh baby, baby, baby, I'm a pessimist before ♪"
54:25;54:29;"♪ Oh baby, baby, I wanna dance and get the money for you ♪"
54:29;54:33;"♪ Yeah, talk about yeah ♪"
54:33;54:36;"♪ Yeah, talk about yeah ♪"
54:36;54:44;"I wonder if the Twizzler, you know, the manufacturer of Twizzler would have anything to say about that."
54:44;54:46;"Yeah, I guess there are all sorts of rules."
54:46;55:00;"I mean, like with tickets, the secondary ticket market, they try to rein it in so you don't get these like scumbags using like sophisticated computer programs, buying
up all the tickets with no intent, you know, and then reselling them for sky's the limit."
55:00;55:07;"But at the same, by the same token, free market, American capitalism, like you got to let people..."
55:07;55:14;"You got to let people, yeah, price it where their local market wants to pay for it."
55:14;55:15;"I know."
55:15;55:18;"Maybe that's $100 in where Jake lives, I don't know."
55:18;55:34;"Yeah, like Jake, how would you feel if Gavin Newsom came out and said, ""The fine art market is out of control. A big painting can be sold for no more than $5,000 bucks and
like a little painting maybe, you know, $1,500."""
55:34;55:35;"We're capping it."
55:35;55:59;"You know, you can totally see somebody be like, ""By selling these works of art for so much, it allows like the big fish to get even bigger. It allows the, you know, these
well-known artists like the David Hockneys of the world to be selling their art for sometimes thousands of times what your local coffee shop artist is selling."" Is
that fair?"
55:59;56:00;"That's not fair."
56:00;56:03;"That's not fair. The state of California has to do something about it."
56:03;56:04;"That's not fair at all."
56:04;56:07;"And that's what I'm campaigning on."
56:07;56:09;"Regulating the art market, that's your platform?"
56:09;56:10;"Yeah."
56:10;56:22;"What about like music venues and tickets? So what we charge, so what Richard Pictures charges at the door at the Old Town Pub, that should be ballpark what Vampire
Weekend's charging at the Hollywood Bowl."
56:22;56:31;"Yes, and it's also what The Weekend should be charging at SoFi Stadium. Everybody comes home with $3,000 bucks."
56:31;56:35;"This is the Ian McKay model. $5 for a show."
56:35;56:50;"This is also everybody comes home with $3,000 bucks. So that means that a ticket to see The Weekend at SoFi costs a nickel and, you know, a ticket to see Richard Pictures
at Old Town Pub ends up costing $100."
56:50;56:52;"That's like the inverse of a..."
56:52;56:56;"Now I'm confused. Dave, what are ticket prices at Disney Hall for your March 2nd show?"
56:56;57:01;"I don't know. That's probably the one question that you could ask me that I don't know."
57:01;57:09;"Well, I'm sure it depends. Well, first of all, Dave is playing Disney Hall, designed by Frank Gehry, downtown Los Angeles."
57:09;57:18;"And I imagine the tickets vary widely because you can be like front row, there's different balconies. You can sit behind the orchestra too, right?"
57:18;57:19;"Yes."
57:19;57:20;"That's pretty cool."
57:20;57:33;"I saw this Messian piece called From the Canyons to the Stars, which I mentioned only because there's a really big percussion section. There's like seven
percussionists in this piece or something like that."
57:33;57:40;"And anyway, it was like almost sold out, the show. And I was like, ""Oh my God, From the Canyons to the Stars is happening. I need to go."""
57:40;57:50;"The only tickets that were still available were those directly behind the orchestra. And it was seriously like a $10 ticket or something like that."
57:50;57:51;"Whoa."
57:51;57:54;"And it was the best seat in the house. It was amazing."
57:54;57:55;"Could you hear the piccolos?"
57:55;57:57;"I could hear the piccolo, yeah."
57:57;57:59;"Okay. So it's not like you were just hearing, ""Bom, bom, bom, bom."""
57:59;58:08;"Oh, not at all. Yeah, no. Yeah, I mean, I guess... I don't know. I think the acoustics of the space are such that, I don't know, it was like a pretty balanced..."
58:08;58:13;"There's probably speakers in there. So maybe they're giving you a little taste of a mixed performance."
58:13;58:15;"Very lightly amplified. I think so."
58:15;58:16;"Oh, that's cool."
58:16;58:22;"But yeah, no. So that's like, I don't know if behind the stage is open for this show, but..."
58:22;58:32;"I feel like it usually is, but all right. That's good for the listeners to know. And what... This is not just a typical Dirty Projectors concert."
58:32;58:37;"You want to explain why this show is happening at the iconic Disney Hall and what it's all about?"
58:37;58:56;"Oh, right. It's basically like an album that I've been working on for three-ish years now that started as a piece of chamber music and has sort of gone through a whole
bunch of different iterations and is now just like the album, you know?"
58:56;59:07;"It's called Song of the Earth and we're kind of like premiering it with the literal LA Phil. So that's why it's at Disney."
59:07;59:15;"Amazing. Just to be clear, so the LA Philharmonic musicians will be playing off of like sheet music that you've written?"
59:15;59:16;"Yeah. Yeah, yeah."
59:16;59:17;"Who's conducting?"
59:17;59:19;"Gustavo. No, not Gustavo."
59:19;59:21;"Not Gustavo? Not Dudamel?"
59:21;59:24;"Not the dude. I don't know if people call him that, but..."
59:24;59:25;"Bradley Cooper?"
59:25;59:27;"Oh, Bradley Cooper could."
59:27;59:30;"Bradley Cooper could. It's Lydia Tarr, actually."
59:30;59:35;"Lydia Tarr, Bradley Cooper, Dudamel. Those are the three most famous conductors living."
59:35;59:49;"It's a woman named Sarah Hicks is conducting. And yeah, she... I've never... I haven't met her yet, but she's worked with a lot of friends and she's apparently really
awesome."
59:49;59:51;"And then you'll be singing?"
59:51;59:57;"Yeah, yeah, yeah. I'll be singing and playing the nylon string guitar."
59:57;59:58;"That's tight."
59:58;01:00:12;"And yeah, the band is in the mix as well. Mike's playing the drums, Maya and Felicia and Olga are singing. Olga's like playing harpsichord and farfisa."
01:00:12;01:00:16;"And then we've got a couple of percussionists as well on the band side."
01:00:16;01:00:26;"So is it songs that roughly fall in like what we expect from like a rock pop album? Like three to five minutes?"
01:00:26;01:00:34;"It's like, man, so this is the first time I'm being asked any questions about this music."
01:00:34;01:00:36;"This is a great opportunity to get your talking points in order."
01:00:36;01:00:43;"I know. I don't have my story straight yet, but like my first reaction is really like, I don't know."
01:00:43;01:00:44;"Not good enough."
01:00:44;01:00:48;"I heard some of the music a while ago and I was like, this reminds me of the Getty Address."
01:00:48;01:00:51;"This is like an updated version of that in a way."
01:00:51;01:00:57;"It's a similar palette of like working with orchestral elements in song form."
01:00:57;01:01:04;"And instead of the album being about Don Henley, it's about Glenn Frey. Rest in peace."
01:01:04;01:01:06;"It's about Glenn this time."
01:01:06;01:01:13;"In the end, I will. Yeah, there's going to be several, you know, sort of iterations of Song of the Earth."
01:01:13;01:01:17;"One about each member of the Eagle."
01:01:17;01:01:19;"Timothy B. Schmidt version."
01:01:19;01:01:20;"Right."
01:01:20;01:01:21;"Looking forward to that."
01:01:21;01:01:23;"Yeah, that's Song of the Earth 4 probably."
01:01:23;01:01:30;"The girls just seem to find out early"
01:01:30;01:01:37;"How to open doors with just a smile"
01:01:37;01:01:44;"A rich old man, she won't have to worry"
01:01:44;01:01:52;"She'll dress up all in lace and go in style"
01:01:52;01:01:59;"Late at night, her big old house gets lonely"
01:01:59;01:02:06;"I guess every form of refuge has its price"
01:02:06;01:02:13;"And it breaks her heart to think her love is only"
01:02:13;01:02:20;"Given to a man with hands as cold as ice"
01:02:20;01:02:28;"So she tells him she must go out for the evening"
01:02:28;01:02:35;"To comfort an old friend who's feeling down"
01:02:35;01:02:42;"But he knows where she's going and she's leaving"
01:02:42;01:02:49;"She is headed for the cheating side of town"
01:02:49;01:02:56;"You can't hide your lying eyes"
01:02:56;01:03:03;"And your smile is a thin disguise"
01:03:03;01:03:11;"I thought by now you'd realize"
01:03:11;01:03:17;"There ain't no way to hide your lying eyes"
01:03:17;01:03:21;"So it's sort of like, I don't know, it flows."
01:03:21;01:03:23;"As a piece of music, it's continuous."
01:03:23;01:03:29;"There are melodies and aspects of the lyrics"
01:03:29;01:03:34;"That recur throughout the thing, front to back."
01:03:34;01:03:39;"There are musical elements that weave through,"
01:03:39;01:03:41;"Across the thing."
01:03:41;01:03:44;"But then it also manages to break down"
01:03:44;01:03:48;"Into these three minute, four minute chunks as well."
01:03:48;01:03:49;"Sick!"
01:03:49;01:03:51;"Yeah, it's kind of like a killer's album."
01:03:51;01:03:55;"Or it's like S&M, Symphony and Metallica."
01:03:55;01:03:57;"Do you remember that live album?"
01:03:57;01:03:58;"I think I missed that one."
01:03:58;01:03:59;"It was cool."
01:03:59;01:04:02;"It was basically Metallica played their greatest hits with a symphony."
01:04:02;01:04:05;"Cello's going bum bum bum bum bum bum."
01:04:05;01:04:08;"Wait, actually maybe we gotta throw this on for a second."
01:04:08;01:04:11;"First of all, there's zero percent chance this has anything to do with"
01:04:11;01:04:17;"What Dave does, but just in the spirit of TC, we gotta throw it on."
01:04:17;01:04:22;"I remember at the time thinking it was kind of cool."
01:04:22;01:04:23;"I can see that."
01:04:23;01:04:27;"You know, I guess because I really have been listening to"
01:04:27;01:04:34;"Way more, I don't know, scored music, old music."
01:04:34;01:04:40;"My recommendations, my algorithm is getting more classical leaning."
01:04:40;01:04:43;"If you have Apple Music, there's a whole classical app you can download."
01:04:43;01:04:45;"It's just called Classical."
01:04:45;01:04:46;"I heard that."
01:04:46;01:04:47;"It's cool."
01:04:47;01:04:48;"I'm intrigued by that."
01:04:48;01:04:49;"Yeah, you should check it out."
01:04:49;01:04:53;"Where I'm going with this though is that, so the other day I was listening to this"
01:04:53;01:04:57;"Specific, what's it called?"
01:04:57;01:05:02;"Play, like a constantly updated playlist."
01:05:02;01:05:04;"What is that called?"
01:05:04;01:05:08;"Whatever, it's just like the new classical releases."
01:05:08;01:05:18;"And like number three that week was some beautiful, coral, acapella arrangement"
01:05:18;01:05:20;"Of some Metallica song."
01:05:20;01:05:24;"Okay, well Metallica has never been a..."
01:05:24;01:05:27;"There's always been a connection between metal and classical, right?"
01:05:27;01:05:28;"For sure."
01:05:28;01:05:32;"The first metal artist was Antonio Vivaldi, roughly speaking."
01:05:32;01:05:33;"Right."
01:05:33;01:05:35;"Just shredding arpeggios."
01:05:35;01:05:40;"Anybody who's listened to Four Seasons knows that it's got everything that a metalhead would want."
01:05:40;01:05:41;"It goes hard."
01:05:42;01:05:47;"And, you know, among a million other classical baroque composers."
01:05:47;01:05:53;"And, you know, and Metallica famously loved Ennio Morricone, the film composer"
01:05:53;01:05:58;"Who, of course, is very conversant in classical arrangement."
01:05:58;01:06:01;"This is what Enter Sandman sounds like on that album."
01:06:01;01:06:04;"This is live with the San Francisco Symphony Orchestra."
01:06:16;01:06:17;"Wow, busy."
01:06:17;01:06:19;"Getting kind of spy movie."
01:06:19;01:06:20;"Yeah."
01:06:27;01:06:32;"And this is before every movie trailer had like a symphonic version of a pop song."
01:06:32;01:06:33;"Right."
01:06:41;01:06:44;"This is some like Live or Let Die type vibe."
01:06:44;01:06:45;"Yeah, right."
01:06:45;01:06:48;"Yeah, Metallica writing a Bond song would be amazing."
01:06:48;01:06:49;"Oh, yeah."
01:06:52;01:06:56;"I feel like the perfect moment for that was 2000."
01:06:56;01:06:58;"But whatever, I still support it."
01:07:06;01:07:10;"I mean, I'll say that I think I don't know if he writes the lyrics by himself,"
01:07:10;01:07:15;"but I think James Hetfield has such like a magnificent way with words."
01:07:15;01:07:19;"So many just like legendary Metallica song titles."
01:07:19;01:07:20;"Yeah."
01:07:20;01:07:23;"On this album, there's a song called The God That Failed,"
01:07:23;01:07:27;"which is taken from a book about Soviet communism."
01:07:27;01:07:28;"Oh, wow."
01:07:28;01:07:31;"I just love the idea of like Hetfield just being in a bookstore"
01:07:31;01:07:33;"and just being like the God that failed."
01:07:33;01:07:35;"It's like that's going on the Black Album."
01:07:35;01:07:37;"I'm going to jot that down."
01:07:49;01:07:51;"That is epic."
01:07:51;01:07:52;"What year is that?"
01:07:52;01:07:57;"This is, this was recorded in 1999."
01:07:57;01:08:00;"The conductor is Michael Kamen."
01:08:00;01:08:01;"Wow."
01:08:01;01:08:03;"So what we're playing at Disney Hall,"
01:08:03;01:08:05;"I don't think it's going to sound that much like that."
01:08:05;01:08:07;"Okay, whatever you're playing, how about a,"
01:08:07;01:08:10;"I would have just an encore of Ender Sandman ready to go."
01:08:10;01:08:12;"Just in case."
01:08:12;01:08:14;"That's probably a good idea."
01:08:14;01:08:16;"People are going to be hype."
01:08:16;01:08:19;"You're going to be like, all right, guys, that's the end of the piece."
01:08:19;01:08:21;"They're going to be like, one more song."
01:08:21;01:08:24;"I guess that's one thing about you've spent years composing this."
01:08:24;01:08:27;"You don't want to be caught with your pants down"
01:08:27;01:08:29;"when you got the crowd chanting one more song"
01:08:29;01:08:32;"and be like, guys, there's 50 people on stage"
01:08:32;01:08:35;"with painstaking orchestral arrangements."
01:08:35;01:08:40;"We can't just bust out, you know, Love Light, Louis Louis."
01:08:40;01:08:41;"Yeah."
01:08:41;01:08:42;"So just have something ready."
01:08:42;01:08:43;"That's a good call."
01:08:43;01:08:45;"Wait, I'm still thinking about this Metallica and classical thing."
01:08:45;01:08:48;"Jay, wait, that movie, Your Friends and Neighbors,"
01:08:48;01:08:49;"do you guys remember that movie?"
01:08:49;01:08:51;"Yeah, the Neil LaBute movie."
01:08:51;01:08:56;"The whole soundtrack is like cello quartet versions of Metallica songs."
01:08:56;01:08:57;"Oh, really?"
01:08:57;01:08:58;"I don't remember that."
01:08:58;01:08:59;"Metallica rules."
01:08:59;01:09:01;"Great band."
01:09:01;01:09:04;"There's one other thing that I want to say about Metallica."
01:09:04;01:09:08;"I was listening to Juan the other day."
01:09:08;01:09:09;"Incredible song."
01:09:09;01:09:10;"Yeah."
01:09:10;01:09:14;"What's insane is how out of tune the guitar solo is in the first minute."
01:09:14;01:09:16;"But actually, that's not what I was going to say."
01:09:16;01:09:20;"What I was going to say is imagine whatever"
01:09:20;01:09:23;"they're like writing the song together there in the rehearsal."
01:09:23;01:09:25;"I don't know how they wrote songs or whatever,"
01:09:25;01:09:28;"but just thinking about the moment that that rhythm arrived."
01:09:28;01:09:35;"Can you imagine how psyched you would be?"
01:09:35;01:09:36;"Yeah."
01:09:36;01:09:39;"Just playing that for the first time."
01:09:39;01:09:41;"Oh, is this a thing?"
01:09:41;01:09:42;"Or sorry, I'm sorry."
01:09:42;01:09:44;"Is this a thing that we can do?"
01:09:44;01:09:47;"Can we do this in this song?"
01:09:47;01:09:50;"And also just thinking about like that rhythm."
01:09:50;01:09:51;"[imitates rhythm]"
01:09:51;01:09:54;"Those like whatever those like triplet 16th or whatever they are."
01:09:54;01:09:56;"Where does that like that rhythm?"
01:09:56;01:09:57;"Where does that come from?"
01:09:57;01:10:02;"I mean, is it a little bit like some Spanish like Berlioz type thing?"
01:10:02;01:10:04;"What's like the famous Spanish?"
01:10:04;01:10:06;"[imitates rhythm]"
01:10:06;01:10:07;"Like the..."
01:10:07;01:10:10;"[imitates rhythm]"
01:10:10;01:10:13;"I guess there's like the La Boheme."
01:10:13;01:10:16;"Yeah, even that you could probably say traces roots to classical."
01:10:16;01:10:18;"But yeah, it's so hard."
01:10:19;01:10:20;"What does it sound like at this concert?"
01:10:20;01:10:22;"When does that happens like pretty deep in the song, right?"
01:10:22;01:10:24;"Yeah, maybe like five minutes in."
01:10:46;01:10:48;"Do you guys think you can do that on a double kick drum pedal?"
01:10:48;01:10:50;"No way."
01:11:01;01:11:03;"Oh my God."
01:11:03;01:11:05;"All this is very James Bond."
01:11:05;01:11:14;"My friend just posted a clip from them playing the some Mahler symphony like last week."
01:11:15;01:11:19;"And it sounded really, really sick, which I say in advance of saying"
01:11:19;01:11:24;"that these arrangements that they're playing here are I kind of agree with Jake."
01:11:24;01:11:26;"It's like the songs are enough."
01:11:26;01:11:27;"Like I can't believe..."
01:11:27;01:11:29;"It's a hat on a hat, man."
01:11:29;01:11:30;"Yeah, it's a hat on a hat."
01:11:30;01:11:35;"I can't believe the arrangement was like, oh, let's add more parts."
01:11:35;01:11:37;"Let's not like adapt the..."
01:11:37;01:11:39;"Well, here's a counterpoint."
01:11:39;01:11:42;"Even if this needed some finessing,"
01:11:43;01:11:46;"this is only two nights they did at the Berkeley Community Theater."
01:11:46;01:11:54;"I think the reason that you hear the SFSO just demolishing a Mahler symphony in 2024"
01:11:54;01:11:57;"is because the seed was planted 25 years ago."
01:11:57;01:12:01;"That maybe of all the symphony orchestras in America,"
01:12:01;01:12:03;"they could kick a little more ass."
01:12:03;01:12:06;"They could come a little bit more correct."
01:12:06;01:12:10;"You know, like it's not New York."
01:12:11;01:12:12;"It's not L.A., smaller city."
01:12:12;01:12:14;"What does San Francisco have to be proud of?"
01:12:14;01:12:17;"The bass band in America came from there."
01:12:17;01:12:19;"And I think the reason that you..."
01:12:19;01:12:20;"The two biggest bands."
01:12:20;01:12:21;"Who's the other one?"
01:12:21;01:12:22;"Grateful Dead."
01:12:22;01:12:23;"And Grateful Dead."
01:12:23;01:12:26;"So I think the reason that even in 2024,"
01:12:26;01:12:29;"they're coming correct on Mahler is because..."
01:12:29;01:12:30;"They warmed up."
01:12:31;01:12:38;"A seed was planted in 1999 by James Hetfield, Lars Ulrich, Jason Newsted."
01:12:38;01:12:40;"This was the end of his tenure."
01:12:40;01:12:41;"And Kirk Hammett."
01:12:41;01:12:42;"That's all I'm saying."
01:12:42;01:12:43;"I like that."
01:12:44;01:12:46;"And maybe that's the same thing that's going to happen with L.A. Phil."
01:12:46;01:12:48;"Probably. Probably."
01:12:48;01:12:50;"Also, just to be completely clear about this."
01:12:50;01:12:53;"Now, obviously, you've always had a foot in both worlds."
01:12:53;01:12:58;"Like, you know, I still remember the first time I ever heard your music."
01:12:58;01:13:00;"I was a college student."
01:13:00;01:13:02;"And I was like, ""Damn, this guy's on some different sh*t."""
01:13:02;01:13:08;"And it's because you know how to compose for chamber music or orchestra."
01:13:08;01:13:13;"But you're also very much a rocker bringing these things together."
01:13:13;01:13:15;"You've done work that's kind of like standalone."
01:13:15;01:13:20;"You've obviously released many classic beloved traditional albums."
01:13:20;01:13:21;"But you've also done standalone work."
01:13:21;01:13:27;"So this one, this is the world premiere, meaning there's no recordings of this floating around."
01:13:27;01:13:31;"You're launching this music with this performance."
01:13:31;01:13:35;"Like in a true, like, classical world kind of way."
01:13:35;01:13:36;"Yeah, that's true."
01:13:36;01:13:37;"Okay, right."
01:13:37;01:13:38;"That's exciting."
01:13:38;01:13:39;"Yeah, that's awesome."
01:13:39;01:13:45;"It has to do also with the sort of like the specifics of the way this music came together."
