Start Timestamp;End Timestamp;Transcript
45:59;46:00;"Life swept you away."
46:00;46:03;"How many people have children primarily just to avoid that?"
46:03;46:06;"Yeah, I think that's the point of marriage."
46:06;46:10;"The fear of loneliness, I think, is the number one cause of marriage."
46:10;46:12;"I'm saying it like it's an illness."
46:12;46:14;"[laughter]"
46:14;46:17;"The number one cause of marriage cancer is loneliness."
46:17;46:20;"Obama, you start the Eleanor Rigby initiative."
46:20;46:22;"We could get those marriage numbers down."
46:22;46:23;"We can get marriage numbers way down."
46:23;46:27;"Because divorce is up because most people realize that marriage is a mistake."
46:27;46:32;"But at the same time, it's like you wouldn't need to even do it if you weren't so terrified."
46:32;46:34;"I think marriage numbers are down."
46:34;46:35;"Are they?"
46:35;46:38;"I remember hearing somewhere like for the first time ever in history,"
46:38;46:41;"over 50% of the population was single."
46:41;46:42;"Oh, wow."
46:42;46:43;"Isn't that crazy?"
46:43;46:44;"Wow."
46:44;46:45;"Are people still pairing off, though?"
46:45;46:46;"Yeah, yeah, yeah."
46:46;46:49;"It meant like maritally, like technically single."
46:49;46:52;"Like on my tax return, it's single still, even though I'm not single."
46:52;46:53;"You have a long-term girlfriend."
46:53;46:54;"Yeah."
46:54;46:56;"You have somebody to do Thanksgiving with."
46:56;46:57;"Yeah."
46:57;46:58;"All right."
46:58;46:59;"Quit bragging."
46:59;47:00;"[laughter]"
47:00;47:01;"Show off."
47:36;47:37;"♪ I feel for you, and I don't know what it's like ♪"
47:37;47:40;"♪ With a skirt on, so pardon me if I am being insensitive ♪"
47:40;47:41;"♪ But darling, this only works on solo ♪"
47:41;47:43;"♪ My halo, se vuelo, it feel like it's bid ♪"
47:43;47:45;"♪ Solo that when they throw me some real pesos ♪"
47:45;47:46;"♪ I don't pay no attention to it ♪"
47:46;47:49;"♪ Solo that I am no rookie, but feel like a kid ♪"
47:49;47:51;"♪ Looking at the other kids with astonishment ♪"
47:51;47:51;"♪ While I'm on punishment ♪"
47:51;47:53;"♪ Watching the summer come close to an end ♪"
47:53;47:56;"♪ After 20 years in, I'm so naive I was under the impression ♪"
47:56;47:57;"♪ That everyone wrote their own verses ♪"
47:57;47:59;"♪ It's coming back different, and yet it hurts me ♪"
47:59;48:00;"♪ I'm humming and whistling to those not deserving ♪"
48:00;48:01;"♪ I stumbled and left every word ♪"
48:01;48:03;"♪ Was I working just way too hard ♪"
48:03;48:04;"- You know what helps though?"
48:04;48:06;"I think phones probably contribute to that too,"
48:06;48:10;"because I was at lunch the other day with a friend of mine,"
48:10;48:12;"and then he left the table for a little while,"
48:12;48:15;"and my battery died on my phone,"
48:15;48:18;"and I was just alone in a restaurant."
48:18;48:20;"'Cause now, like, think about 20 years ago."
48:20;48:24;"Like, 20 years ago, you were just alone in a restaurant."
48:24;48:27;"Like, now, your phone, you're never really alone."
48:27;48:30;"You at least have the illusion of being connected"
48:30;48:33;"and around people, but like, he left and my battery's dead,"
48:33;48:34;"and I was like, oh, I'm just--"
48:34;48:36;"- Did you pretend to look at your phone so people wouldn't--"
48:36;48:38;"- No, I was a-- - What did you do?"
48:38;48:41;"- 'Cause we were done eating, so I was just,"
48:41;48:44;"you don't know what to do with your eyes."
48:44;48:45;"Where do you focus this,"
48:45;48:47;"like, you don't know what to do with your eyes."
48:47;48:49;"And it was my first time noticing the restaurant."
48:49;48:51;"I was very Eckhart Tolle in the moment."
48:51;48:52;"I was right there, but--"
48:52;48:54;"- But was it a positive feeling?"
48:54;48:56;"You looked around and you were just like,"
48:56;48:57;"life's beautiful. - I went through"
48:57;49:00;"every stage of emotion that you could imagine."
49:00;49:02;"Like, it was complete fear and anxiety."
49:02;49:03;"There was denial. - Denial."
49:03;49:03;"- No, no, no, no, no."
49:03;49:06;"There was denial, where I kept trying to turn my phone on."
49:06;49:08;"There was like, he didn't go to the bathroom."
49:08;49:09;"He's back any second."
49:09;49:11;"Like, there's denial, there's fear,"
49:11;49:14;"there's all of these emotions that just run through you."
49:14;49:16;"And then there's acceptance of like,"
49:16;49:19;"I am alone at this table, and here we are."
49:19;49:20;"Look at the architecture. - You know what?"
49:20;49:22;"Before we get into the summer songs,"
49:22;49:23;"because I love this conversation,"
49:23;49:26;"and I love that it's all stemming from the limited edition"
49:26;49:28;"blueberry pie Oreos, check 'em out."
49:29;49:31;"This is a question I always think that,"
49:31;49:33;"we've probably talked about this on Tom Crisis before,"
49:33;49:34;"maybe we haven't."
49:34;49:37;"How many times have you eaten dinner"
49:37;49:39;"at a restaurant by yourself?"
49:39;49:42;"- I probably do it more often than the average person"
49:42;49:45;"because I'm like, out of town, on the road a lot."
49:45;49:46;"- Define restaurant."
49:46;49:48;"It's like a taqueria?"
49:48;49:50;"- No, like-- - With like, fluorescent light."
49:50;49:50;"- No, I'm talking-- - Okay, like a restaurant."
49:50;49:52;"- I'm talking with waiter service."
49:52;49:54;"- Waiter service, where you're not just at the bar,"
49:54;49:55;"'cause at the bar-- - Like, how can I help you?"
49:55;49:57;"Table for one."
49:57;49:58;"- Yeah. - Okay, your server"
49:58;49:59;"will be right with you. - Okay."
49:59;50:01;"- There's always a moment where they squint"
50:01;50:03;"and they go, ""Just you?"""
50:03;50:05;"- Right. - And it's with concern."
50:05;50:06;"It's with slight concern."
50:06;50:08;"- I know, our society doesn't take care of lonely people."
50:08;50:10;"- I do it, like, if I'm in a town"
50:10;50:12;"that doesn't have Postmates,"
50:12;50:14;"you know what I mean?"
50:14;50:16;"Like, and I actually want like a meal,"
50:16;50:18;"then I'll go to a restaurant and I'll sit there,"
50:18;50:21;"and you know, I mean, and again,"
50:21;50:23;"with the phone you can do, you know, emails"
50:23;50:24;"and stuff like that, but even--"
50:24;50:26;"- I almost feel like that, okay, but in--"
50:26;50:27;"- In town. - In your hometown."
50:27;50:31;"- Oh, the true gauge of who your true friends are"
50:31;50:33;"and how you feel about someone is"
50:33;50:36;"when you're scrambling to look for someone to eat with."
50:36;50:39;"That's the truest gauge, and you just go"
50:39;50:41;"and you just go down the list,"
50:41;50:42;"and then you go by area, I'm here,"
50:42;50:44;"like, if you have weird amount of time"
50:44;50:46;"and not enough time to go home,"
50:46;50:48;"and then you're just looking for someone to eat with,"
50:48;50:49;"and it's just like, who--"
50:49;50:51;"- 'Cause there's some people that you actually get to"
50:51;50:54;"and you're like, ""I wouldn't even wanna eat with you."""
50:54;50:57;"- Yeah, but maybe it's easy, the worst."
50:58;50:59;"- Right. - Let's see at lunch."
50:59;51:01;"- Oh man, this made me think about in college."
51:01;51:02;"- Yeah? - That's a weird one,"
51:02;51:05;"when you first get to college and you gotta go eat,"
51:05;51:07;"and it's like, yeah, just like--"
51:07;51:08;"- The tray? - Holding the tray"
51:08;51:10;"and just being like-- - Yeah, but is it really"
51:10;51:11;"like that, like, where you just walk in and--"
51:11;51:14;"- Yeah, at Columbia, it was like a beautiful,"
51:14;51:17;"almost like Hogwarts-style dining hall,"
51:17;51:19;"and you just like kinda roll in"
51:19;51:20;"and you see people like laughing."
51:20;51:22;"It literally was like in a high school,"
51:22;51:23;"it didn't happen in high school to me,"
51:23;51:26;"'cause we went to this small school, I had my friends,"
51:26;51:28;"but then at college, sometimes you look around"
51:28;51:30;"and you're like, it really didn't come naturally to me."
51:30;51:32;"I was like, wait, am I literally,"
51:32;51:33;"I'm talking about the first week,"
51:33;51:35;"it's like you look around, you see some people"
51:35;51:37;"look like they're having a great time,"
51:37;51:39;"and you're like, ""Ah, I don't know the middle,"""
51:39;51:40;"and then you look around, you're like,"
51:40;51:41;"""Don't see your roommate,"
51:41;51:43;"""don't see your handful of people,"""
51:43;51:46;"you know, and you're like, ""That guy's in my seminar."
51:46;51:50;"""Am I literally gonna just sit down and be like,"
51:50;51:54;"""Hey man, we're in Professor whatever's class together."""
51:54;51:56;"- Mm-hmm. - Oh, oh yeah."
51:56;51:58;"- How's it going, good?"
51:58;52:02;"- The only group that actually does that are celebrities."
52:02;52:05;"Celebrities will do that to each other."
52:05;52:06;"I like watching, it's my favorite thing."
52:06;52:07;"- When they've never met before?"
52:07;52:08;"- When they've never met before,"
52:08;52:10;"I like to imagine a conversation starting,"
52:10;52:13;"it's like, ""Hey, you don't film in television?"""
52:13;52:15;"I'm like, ""I do film in television."""
52:15;52:18;"And it's just like an immediate kind of trust"
52:18;52:19;"in a room full of whatever,"
52:19;52:21;"I've seen it happen so many times,"
52:21;52:25;"just like the only two known people in a room"
52:25;52:27;"just find each other."
52:27;52:28;"- Yeah."
52:28;52:30;"- It's just like, oh, because there's at least that"
52:30;52:33;"to connect with, but you should be able to do it."
52:33;52:34;"It's just like with anything."
52:34;52:36;"- Regular people should do that too."
52:36;52:37;"- Yeah."
52:37;52:38;"♪ That's the way every day goes ♪"
52:38;52:41;"♪ Every time we've no control ♪"
52:41;52:43;"♪ If the sky is pink and white ♪"
52:43;52:45;"♪ If the ground is black and yellow ♪"
52:45;52:50;"♪ It's the same way you showed me ♪"
52:50;52:52;"♪ Knot my hair, don't close my eyes ♪"
52:52;52:54;"♪ Halfway on a slow move ♪"
52:54;52:59;"♪ It's the same way you showed me ♪"
52:59;53:01;"♪ If you could fly, then you'd feel south ♪"
53:01;53:03;"♪ Up north's getting cold soon ♪"
53:03;53:05;"♪ But the way it is, we're on land ♪"
53:05;53:08;"♪ So I'm someone all true ♪"
53:08;53:10;"♪ Keep it cool when it's still alive ♪"
53:10;53:12;"♪ Won't let you down when it's all ruined ♪"
53:12;53:16;"♪ Just the same way you showed me ♪"
53:16;53:20;"♪ Showed me ♪"
53:20;53:25;"♪ You showed me love ♪"
53:25;53:29;"♪ Glory from above ♪"
53:29;53:34;"♪ Regardless dear ♪"
53:34;53:39;"♪ It's all downhill from here ♪"
53:39;53:41;"♪ In the wake of a hurricane ♪"
53:41;53:44;"♪ Dark skin of a summer shade ♪"
53:44;53:46;"♪ Nose dive in the flood lines ♪"
53:46;53:48;"♪ Tall tower, milk crates ♪"
53:48;53:53;"♪ Just the same way you showed me ♪"
53:53;53:55;"♪ Cannonball off the porch side ♪"
53:55;53:57;"♪ All the kids trying off the roof ♪"
53:57;53:59;"♪ Just the same way you showed me ♪"
53:59;54:02;"♪ You showed me ♪"
54:02;54:04;"♪ If you could die, come back to life ♪"
54:04;54:06;"♪ Up for air from the swimming pool ♪"
54:06;54:08;"♪ You kneeled down to the dry land ♪"
54:08;54:11;"♪ Kissed the earth that birthed you ♪"
54:11;54:13;"♪ Gave you tools just to stay alive ♪"
54:13;54:15;"♪ And make it up when the sun is ruined ♪"
54:15;54:19;"♪ Just the same way you showed me ♪"
54:19;54:23;"♪ Showed me ♪"
54:23;54:28;"♪ You showed me love ♪"
54:28;54:32;"♪ Glory from above ♪"
54:32;54:37;"♪ Regardless dear ♪"
54:37;54:42;"♪ It's all downhill from here ♪"
54:43;54:46;"♪ In the wake of a hurricane ♪"
54:46;54:49;"♪ Dark skin of a summer shade ♪"
54:49;54:52;"♪ Nose dive in the flood lines ♪"
54:52;54:55;"♪ Tall tower, milk crates ♪"
54:55;54:58;"♪ Just the same way you showed me ♪"
54:58;55:01;"♪ You showed me ♪"
55:01;55:06;"♪ If you could die, come back to life ♪"
55:06;55:10;"♪ Up for air from the swimming pool ♪"
55:10;55:12;"♪ You kneeled down to the dry land ♪"
55:12;55:17;"♪ You showed me ♪"
55:17;55:19;"♪ This is life, life immortality ♪"
55:19;55:21;"- It's always funny you just talk to a stranger."
55:21;55:23;"- People-- - Just like, just walk,"
55:23;55:25;"just approach the stranger. - You know, it's a controversial"
55:25;55:29;"topic because some people find it like invasive"
55:29;55:31;"if a stranger comes and talks to them."
55:31;55:33;"I mean, we live in a scary world, so some people"
55:33;55:35;"would be like, saying hi to somebody you don't know"
55:35;55:37;"is aggressive. - That's the whole point."
55:37;55:40;"Your mourning should be spent, and it essentially"
55:40;55:43;"is making yourself presentable to strangers."
55:43;55:45;"Like, that's the reason you put on your jacket"
55:45;55:47;"and you comb your hair and then you go--"
55:47;55:49;"so if I have to approach a stranger today,"
55:49;55:52;"they will not be completely freaked out."
55:52;55:56;"They will not be completely turned off and disgusted"
55:56;55:59;"by the notion that I would even speak to them."
55:59;56:02;"- Right, but that's like a situation where it's like--"
56:02;56:04;"so you dropped your scarf. - Yeah."
56:04;56:06;"- Versus, like, at, like, the coffee shop."
56:06;56:08;"- What's up? - What's up?"
56:08;56:10;"- Man, you hear about John Galliano?"
56:10;56:12;"- [laughs] - Oh, you didn't?"
56:12;56:15;"I don't know. - I'm jealous of babies"
56:15;56:18;"when I see babies just stare at someone."
56:18;56:20;"'Cause you want to do that constantly."
56:20;56:22;"You always look for the excuse to look at someone"
56:22;56:24;"or to stare at someone, but baby's just, like,"
56:24;56:26;"looking over its mother's shoulder"
56:26;56:28;"and just staring at you, just figuring out"
56:28;56:30;"what is this face-- - Learning."
56:30;56:32;"- Just learning, like, and I wish we could do--"
56:32;56:34;"I want to do that to people constantly."
56:34;56:36;"There's a girl in the next studio that I'm avoiding"
56:36;56:38;"doing that to now."
56:38;56:40;"I just keep wanting to stare-- there's a girl"
56:40;56:42;"in the Mickey Mouse sweatshirt that is stare-adable."
56:42;56:45;"- She's gonna feel weird if people are staring at her."
56:45;56:47;"- She should! She should! She should."
56:47;56:49;"And I shouldn't be-- I'm staring at her now,"
56:49;56:51;"and I shouldn't be doing that."
56:51;56:53;"- We have a responsibility as humans,"
56:53;56:56;"and especially as men, to neutralize our gaze."
56:56;56:58;"- Yeah. - I don't know."
56:58;57:00;"- I don't want to be that guy. You don't want to be that guy."
57:00;57:02;"- And sometimes it's as simple as just, like,"
57:02;57:04;"not leaving people alone. - Yeah."
57:04;57:06;"- [sighs] - Guys."
57:06;57:08;"- Look, the loneliness deficit,"
57:08;57:10;"it's not gonna get solved overnight."
57:10;57:13;"- You have to read this book-- I just read this book"
57:13;57:15;"called ""Tribe."" - Mm-hmm."
57:15;57:17;"- It's an excellent book, and it just talks about,"
57:17;57:19;"you know, essentially our need to belong"
57:19;57:22;"and how a lot of the things in our lives"
57:22;57:24;"and the things that we work for"
57:24;57:27;"actually work against our innate need to belong."
57:27;57:29;"You know, like, we used to-- - Oh, it's like"
57:29;57:31;"a sociological type thing? - Yeah, and how we were"
57:31;57:33;"a part of tribes, and everyone was kind of"
57:33;57:36;"a part of tribe, and then the biggest change in history"
57:36;57:39;"was the ability to essentially be self-sufficient"
57:39;57:42;"and, you know, accumulate things and belongings and wealth,"
57:42;57:44;"because before, all of your belongings"
57:44;57:46;"were things that could travel with you."
57:46;57:50;"But now, like, you kind of-- we don't need people,"
57:50;57:52;"although we need people. - Yeah."
57:52;57:54;"- Especially in L.A., you could spend your entire week"
57:54;57:56;"not really interacting with anybody."
57:56;57:59;"You could just live in isolation, but--"
57:59;58:01;"- Easily. - Easily, but you need people."
58:01;58:04;"You know, like, and it's why-- it actually speaks about"
58:04;58:07;"why depression is so high amongst wealthier people,"
58:07;58:09;"because-- - You're more isolated."
58:09;58:11;"- Because you're more-- because you basically--"
58:11;58:13;"the more money you have, the more you cut out"
58:13;58:16;"the need for others, you know what I mean?"
58:16;58:18;"- Especially if you're so rich, you don't have to work."
58:18;58:20;"You literally don't see it. - You don't have to leave"
58:20;58:22;"your home, and your home is nice, you know,"
58:22;58:24;"and you have everything you need and want."
58:24;58:27;"The beautiful thing about living in a small apartment"
58:27;58:29;"with a bunch of people is that, although it's frustrating"
58:29;58:31;"and it's--and these inconveniences,"
58:31;58:33;"it's also, like, it's a human being."
58:33;58:35;"You can feed off of it. - Right, well, also, it's like,"
58:35;58:37;"earlier we were talking--yeah, actually, that's maybe"
58:37;58:39;"what ""Home Alone"" is about. Earlier we were talking"
58:39;58:41;"about the film ""Home Alone,"" but it literally is"
58:41;58:43;"about the frustration of family. - Yeah."
58:43;58:46;"- He's in this big, noisy family, and some people"
58:46;58:48;"look at that and be like, ""That's a beautiful thing."""
58:48;58:50;"Bunch of kids running around, yeah, whatever,"
58:50;58:52;"you get in fights with your brother or sister,"
58:52;58:54;"but it's like a whole family's under one roof"
58:54;58:56;"traveling to Paris, France together."
58:56;59:00;"It's a beautiful, luxurious trip for a huge family to do,"
59:00;59:02;"but he has all these frustrations with it,"
59:02;59:04;"so he wishes for the polar opposite,"
59:04;59:06;"which is no family. - Yeah."
59:06;59:08;"- And yeah, he gets the cheese pizza for himself,"
59:08;59:10;"but ultimately, well, he's a kid,"
59:10;59:12;"so he's not gonna experience depression,"
59:12;59:15;"so the depression and anxiety takes the form"
59:15;59:18;"of the burglars infiltrating his palace..."
59:18;59:20;"- Yeah. Ooh."
59:20;59:22;"- And trying to kill him. - Interesting."
59:22;59:24;"- That's my take. - Well, ""Home Alone"""
59:24;59:26;"is also about accepting your family,"
59:26;59:28;"even though they're dicks. - Right."
59:28;59:30;"- 'Cause that was, like, also the worst--"
59:30;59:32;"like, the uncle and the brother."
59:32;59:34;"- The buzz. The buzz was horrible."
59:34;59:36;"- The buzz was just a horrible, horrible brother."
59:36;59:39;"But even at their worst-- I mean, it speaks to what you're saying."
59:39;59:42;"Even at their worst, you still have that need."
59:42;59:45;"- Right, it's like you could be in another era,"
59:45;59:49;"the guy who was eating the turkey sub alone on Thanksgiving."
59:49;59:51;"Maybe there's something about this guy"
59:51;59:53;"nobody wants to pair off with him."
59:53;59:56;"He's not gonna get a husband or wife or children or anything."
59:56;01:00:00;"But even then, in a more, like, tribal society,"
01:00:00;01:00:04;"village-based society, on the festival day,"
01:00:04;01:00:06;"he would have been in the mix somewhere."
01:00:06;01:00:08;"- Yeah. - He might have even been"
01:00:08;01:00:10;"this annoying dude that nobody liked that much."
01:00:10;01:00:12;"He might have been the village idiot."
01:00:12;01:00:14;"- Yeah. - But he wouldn't have been"
01:00:14;01:00:16;"at Domino's by himself. - No."
01:00:16;01:00:20;"- To the teenager, ""Happy Thanksgiving."""
01:00:20;01:00:23;"- ""Happy Thanksgiving."" - Thank you."
01:00:23;01:00:25;"- There's not even tables at Domino's."
01:00:25;01:00:28;"- Yeah, it's not. Domino's is heavy on the delivery."
01:00:28;01:00:32;"- Carry-out only. - Heavy on the--not here."
01:00:32;01:00:34;"Domino's slogan should just be ""not here."""
01:00:34;01:00:36;"- Yeah. - [laughter]"
01:00:36;01:00:38;"- Yeah. Maybe in the parking lot."
01:00:38;01:00:40;"- Take that, take that. - It's not here."
01:00:40;01:00:42;"- Go home."
01:00:42;01:00:45;"[upbeat music]"
01:00:45;01:00:52;"♪ ♪"
01:00:52;01:00:54;"- ♪ Happy Thanksgiving ♪"
01:00:54;01:00:56;"♪ Summertime, yeah ♪"
01:00:56;01:00:58;"- ♪ You can say no summertime ♪"
01:00:58;01:01:00;"♪ No matter what ♪"
01:01:00;01:01:03;"♪ 'Cause the shakers can't do one ♪"
01:01:03;01:01:05;"♪ So no summertime ♪"
01:01:05;01:01:07;"- ♪ Here it is, a groove slightly transformed ♪"
01:01:07;01:01:09;"♪ Just a bit of a break from the norm ♪"
01:01:09;01:01:12;"♪ Just a little something to break the monotony ♪"
01:01:12;01:01:14;"♪ All that hardcore dance that has gotten to be ♪"
01:01:14;01:01:16;"♪ A little bit out of control ♪"
01:01:16;01:01:18;"♪ It's cool to dance, but what about a groove ♪"
01:01:18;01:01:20;"♪ That soothes and moves romance? ♪"
01:01:20;01:01:22;"♪ Give me a soft, subtle mix ♪"
01:01:22;01:01:25;"♪ And if it ain't broke, then don't try to fix it ♪"
01:01:25;01:01:27;"♪ And think of the summers of the past ♪"
01:01:27;01:01:29;"♪ Adjust the bass and let the alpine blast ♪"
01:01:29;01:01:32;"♪ Pop in my CD and let me run a rhyme ♪"
01:01:32;01:01:34;"♪ And put your car on cruise ♪"
01:01:34;01:01:36;"♪ And lay back 'cause it's summertime ♪"
01:01:36;01:01:38;"- ♪ Summer, summer, summertime ♪"
01:01:38;01:01:40;"- ♪ Yeah, yeah, yeah ♪"
01:01:40;01:01:42;"- ♪ Time to sit back and done one ♪"
01:01:42;01:01:45;"- ♪ Time to sit back and done one ♪"
01:01:45;01:01:48;"- ♪ Summer, summer, summertime ♪"
01:01:48;01:01:50;"- ♪ Summertime, summertime ♪"
01:01:50;01:01:52;"- ♪ Time to sit back and done one ♪"
01:01:52;01:01:55;"- ♪ Time to sit back and done one ♪"
01:01:55;01:01:58;"- ♪ Summer, summer, summertime ♪"
01:01:58;01:02:00;"- You're listening to..."
01:02:00;01:02:02;"- ♪ Time Crisis ♪"
01:02:02;01:02:04;"- On Beat One."
01:02:04;01:02:06;"- I drug Carmichael in here. It's late August."
01:02:06;01:02:09;"- Yes. - We gotta do the songs of the summer."
01:02:09;01:02:11;"- Songs of the summer."
01:02:11;01:02:13;"- So these are the top ten songs, according to Billboard,"
01:02:13;01:02:15;"of this summer. - Okay."
01:02:15;01:02:17;"- It's finally deep enough in the summer that we can say unequivocally"
01:02:17;01:02:19;"what the top ten songs are, so we're gonna blaze through them."
01:02:19;01:02:21;"Number ten, Kent Jones, ""Don't Mind."""
01:02:21;01:02:23;"I don't know who Kent Jones is. Does anybody?"
01:02:23;01:02:25;"- I feel like I know this song. - Kent. Well, here's the song."
01:02:25;01:02:27;"[dark, funky beat]"
01:02:27;01:02:30;"- ♪ Hola ♪"
01:02:30;01:02:32;"- DJ Mustard."
01:02:32;01:02:35;"[dark, funky beat]"
01:02:35;01:02:38;"- ♪ She tellin' me to ♪"
01:02:38;01:02:40;"- Oh!"
01:02:40;01:02:42;"The ""Konichiwa"" song. - Oh, okay."
01:02:42;01:02:44;"- I call it the ""Konichiwa"" song."
01:02:44;01:02:46;"- ♪ That I wanna teach ♪"
01:02:46;01:02:48;"♪ I'ma show you that where you from ♪"
01:02:48;01:02:50;"♪ Don't matter to me, to me ♪"
01:02:50;01:02:52;"♪ She said hola, como estas ♪"
01:02:52;01:02:54;"♪ She said konichiwa ♪"
01:02:54;01:02:56;"♪ She said pardon my French ♪"
01:02:56;01:02:58;"♪ I said bonjour, madame ♪"
01:02:58;01:03:00;"♪ Then she said ""sabase"" ♪"
01:03:00;01:03:02;"♪ And I said ""nabule"" ♪"
01:03:02;01:03:04;"- I've never heard this in my life. - I'm gonna say..."
01:03:04;01:03:06;"- It's tight, though. - The chords, the..."
01:03:06;01:03:08;"- That's just beautiful. - Mm-hmm."
01:03:08;01:03:10;"- Those are the chords that speak to me. You put that in there."
01:03:10;01:03:12;"That's a great-- yeah, I like that song."
01:03:12;01:03:14;"- Yeah, it's got a tiny touch of jazz in some of the phrasings."
01:03:14;01:03:16;"- Yeah, it's jazzy. - Yeah, it's beautiful."
01:03:16;01:03:18;"- It's beautiful. - The number-nine song."
01:03:18;01:03:20;"Fifth Harmony. This was a big one."
01:03:20;01:03:22;"""Work From Home."""
01:03:22;01:03:24;"- ""Work From Home""?"
01:03:24;01:03:26;"- Yeah, well, 'cause they couldn't call it ""work."""
01:03:26;01:03:28;"You know why, Jake? - Yep, I do."
01:03:28;01:03:30;"- Why? - Because of the number-two song?"
01:03:30;01:03:32;"- Yeah. - Yeah."
01:03:32;01:03:34;"- There's a Tim Heidecker song off his new album"
01:03:34;01:03:36;"called ""Work From Home."" - Really?"
01:03:36;01:03:38;"- Yeah. - Oh, maybe it's the same song."
01:03:38;01:03:40;"- No, it's not."
01:03:40;01:03:42;"- ♪ Put in them hours ♪"
01:03:42;01:03:44;"♪ I'ma make it harder ♪"
01:03:44;01:03:46;"♪ I'm sending pic after picture ♪"
01:03:46;01:03:48;"♪ I'ma get you fired ♪"
01:03:48;01:03:52;"- ♪ I know you're always on that night shift ♪"
01:03:52;01:03:56;"♪ But I can't stand these nights alone ♪"
01:03:56;01:04:01;"♪ And I don't need no explanation ♪"
01:04:01;01:04:05;"♪ Can't play beyond the rocks at home ♪"
01:04:05;01:04:10;"♪ You don't gotta go to work, work, work, work, work, work ♪"
01:04:10;01:04:15;"♪ But you better put in work, work, work, work, work, work ♪"
01:04:15;01:04:19;"♪ You don't gotta go to work, work, work, work, work, work ♪"
01:04:19;01:04:24;"♪ Let my body do the work, work, work, work, work, work ♪"
01:04:24;01:04:25;"♪ We could work from home ♪"
01:04:25;01:04:27;"- Now, since we're blazing through this,"
01:04:27;01:04:29;"I just want to point out one thing about this song, ""Work From Home."""
01:04:29;01:04:31;"You hear the beginning?"
01:04:31;01:04:32;"- Oh."
