Start Timestamp;End Timestamp;Transcript
00:00;00:05;"Time Crisis, the 25th episode."
00:05;00:09;"I'm joined by my co-host, Jake Longstreth, in the studio."
00:09;00:14;"As we discuss Cookies, John Galliano."
00:14;00:20;"We count down the songs of the summer with actor and comedian, Jarrod Carmichael."
00:20;00:27;"All this, plus the top five songs on iTunes, cross-referenced with the CMJ charts."
00:27;00:33;"This is Time Crisis with Ezra King."
00:33;00:38;"B-b-b-b-b-b-b-spot one."
00:38;00:44;"They pass me by, all of those great romances."
00:44;00:51;"The war I've felt, I believe, all my rightful chances."
00:51;00:58;"My picture clear, everything seems so easy."
00:58;01:05;"And so I delve to the floor, one of us had to go."
01:05;01:10;"Now it's different, I want you to know."
01:10;01:16;"One of us is crying, one of us is lying."
01:16;01:21;"I'll be the lonely man."
01:21;01:27;"Time Crisis, episode 25. TC25. Can you believe it, Jake?"
01:27;01:29;"Sort of."
01:29;01:31;"We've done 25 episodes?"
01:31;01:32;"That's crazy."
01:32;01:36;"This show really is a time crisis. What have you been up to, Jake?"
01:36;01:40;"Just grinding in the studio, back at it."
01:40;01:41;"Painting?"
01:41;01:42;"Mm-hmm."
01:42;01:45;"What do you think about August? I talked with somebody today who said that August is the worst month."
01:45;01:46;"I love it."
01:46;01:47;"You love August?"
01:47;01:48;"It's one of my favorites."
01:48;01:49;"Is that just your contrarian nature?"
01:49;01:54;"No, I like that it's mellow. I like that a lot of things kind of like chill out, shut down."
01:54;01:57;"I hate that like back to school feeling."
01:57;02:01;"And even though I haven't been in school in many, many years, I know in September,"
02:01;02:06;"and even like seeing, like driving by like a school with an LED sign on the front that says like,"
02:06;02:09;"""Classes start August 17th."""
02:09;02:14;"I'm just like, ""Dude, are you serious? That's so brutal."""
02:14;02:19;"I get bummed for people having to go back to school, and especially mid-August,"
02:19;02:24;"which is like emotionally and psychologically not the time to go."
02:24;02:30;"You're just ripping across Fountain in your minivan, cranking some tunes,"
02:30;02:33;"and then you just drive past like a high school."
02:33;02:38;"It's like a local L.A. high school that's like, ""Sign up for clubs first week back."""
02:38;02:41;"And you're just like, ""See that?"" Just shake your head."
02:41;02:42;"Man."
02:42;02:48;"Back to school, back to school, to prove to dad that I'm not a fool."
02:48;02:52;"School's out for summer. I mean, I like the dog days of summer."
02:52;02:55;"I like that expression. I like the long days."
02:55;03:00;"I like it when it's hot, but you can go at your own pace a little bit."
03:00;03:02;"Things really do slow down."
03:02;03:05;"The world is going to pick up again in September, and I'm fine with that."
03:05;03:08;"I'm ready to really start cranking with the rest of the world."
03:08;03:13;"I like guilt-free leisure vibes in August."
03:13;03:16;"I feel like in Europe, this is when everybody goes on vacation."
03:16;03:17;"Right."
03:17;03:19;"Paid vacation."
03:19;03:22;"So I feel like over there, it's like things slow down"
03:22;03:27;"because people are leaving the cities, going to explore a little bit,"
03:27;03:31;"get some fresh air, go to the mountains, go to the beach or something."
03:31;03:35;"Whereas I feel like in America, it's like grinding it out in August."
03:35;03:37;"You kind of just feel like you're left behind."
03:37;03:38;"Yeah, if you're just working."
03:38;03:41;"Working through August. It's not a holiday for me."
03:41;03:43;"How about you, August?"
03:43;03:45;"Eh. It's okay."
03:45;03:47;"Are you a summer guy? Are you pumped for fall?"
03:47;03:49;"Yeah, depending on where I am."
03:49;03:51;"L.A. doesn't really have much of a fall."
03:51;03:54;"In fact, L.A., sometimes September is hotter than August."
03:54;03:55;"True."
03:55;03:59;"So, yeah, of course I love an East Coast autumn."
03:59;04:01;"Yeah, August is kind of lame."
04:01;04:04;"I remember when I was a kid, you get July and August off."
04:04;04:06;"July was like Saturday."
04:06;04:07;"Yeah."
04:07;04:09;"I just thought of that, man."
04:09;04:12;"July and August are the Saturday and Sunday of summer."
04:12;04:14;"Yeah."
04:14;04:15;"Sunday is pretty rad, though."
04:15;04:17;"You like Sundays?"
04:17;04:19;"Well, no, I feel you."
04:19;04:22;"There's nothing like the exhilaration of being in seventh grade"
04:22;04:25;"and it's mid-July and you're just like--"
04:25;04:26;"Right."
04:26;04:27;"There's like seven weeks of summer,"
04:27;04:29;"which seems like an eternity when you're that age."
04:29;04:31;"Yeah. No, yes, it's important."
04:31;04:33;"Context is important. You know you got this time coming up."
04:33;04:35;"August is a month of Sundays."
04:35;04:37;"Man, I just thought of that."
04:37;04:38;"That's a lyric, dude."
04:38;04:39;"Start working on that."
04:39;04:42;"The dog days are over"
04:42;04:45;"The dog days are done"
04:45;04:48;"The horses are coming"
04:48;04:51;"So you better run"
04:51;04:53;"Run fast for your mother"
04:53;04:55;"Run fast for your father"
04:55;04:56;"Run for your children"
04:56;04:57;"Run for your sisters"
04:57;04:58;"Run for your brothers"
04:58;05:01;"Leave all your love and your glory behind"
05:01;05:04;"You can't carry it with you if you want to survive"
05:04;05:07;"The dog days are over"
05:07;05:11;"The dog days are done"
05:11;05:14;"Hey, the heroes are here"
05:14;05:16;"The heroes are here"
05:16;05:19;"They come"
05:19;05:21;"Moving on."
05:21;05:24;"Jake, do you know who Toots Thielmans is?"
05:24;05:25;"No, I don't."
05:25;05:26;"It's a name I always remember"
05:26;05:28;"because in the early days of Vampire Weekend,"
05:28;05:31;"we'd go do European press tours,"
05:31;05:34;"get to spend a lot of time with the label rep"
05:34;05:36;"in different countries."
05:36;05:38;"I feel like once we were doing an interview or something"
05:38;05:42;"with our label guy, Jan, in Belgium,"
05:42;05:46;"and somehow we were just talking about Belgian history,"
05:46;05:48;"Belgian pride,"
05:48;05:50;"and maybe he was just like,"
05:50;05:51;"""What Belgians do you know?"""
05:51;05:53;"Luc Toymans."
05:53;05:54;"Who's that?"
05:54;05:55;"Painter."
05:55;05:56;"Oh, wait, from back in the day?"
05:56;05:57;"No, contemporary."
05:57;05:58;"All right."
05:58;05:59;"Not familiar."
05:59;06:02;"I was like, ""Who are truly internationally famous Belgians?"""
06:02;06:03;"Like, household names."
06:03;06:05;"And I was like, ""Jean-Claude Van Damme,"""
06:05;06:07;"and then it's like steep drop-off,"
06:07;06:08;"and I was like, ""Damn, man."""
06:08;06:09;"Hercule Poirot."
06:09;06:10;"Who's that?"
06:10;06:12;"The Agatha Christie detective."
06:12;06:14;"Oh, fictional character doesn't count."
06:14;06:16;"And Agatha Christie wasn't Belgian."
06:16;06:17;"So I was like, ""It's no diss,"
06:17;06:21;"""but is the one truly internationally famous Belgian"
06:21;06:23;"""Jean-Claude Van Damme?"""
06:23;06:25;"And they're like, ""No, of course not."
06:25;06:28;"""The best harmonica player in the world is Belgian."""
06:28;06:32;"And I was like, ""John Popper is from New Jersey."""
06:32;06:33;"And they were like--"
06:33;06:34;"Who's that?"
06:34;06:35;"Yeah, exactly."
06:35;06:36;"They're like, ""Who's John Popper?"""
06:36;06:37;"And I was like, ""He was the lead singer"
06:37;06:41;"""and harmonica player in 'Blues Traveler.'"""
06:41;06:43;"And he was almost like, ""Yo, keep your voice down."
06:43;06:45;"""He is not the best harmonica player in the world."""
06:45;06:46;"I was like, ""Yeah, he is."
06:46;06:47;"""Everybody kind of agrees."""
06:47;06:48;"He's like, ""No, of course not."
06:48;06:49;"""It's Tooth Sillman."""
06:49;06:50;"And I was like, ""Who's that?"""
06:50;06:52;"And he's like, ""You seriously don't know who this dude is?"""
06:52;06:53;"And he was probably right."
06:53;06:54;"I probably should have."
06:54;06:57;"But he was like, ""He's one of the most famous Belgians."""
06:57;06:58;"Hmm."
06:58;07:00;"""He's the best harmonica player in the world."""
07:00;07:02;"And I was like, ""Is it on some, like,"
07:02;07:04;"""Belgium's Got Talent type thing?"
07:04;07:05;"""Like, he's just really good?"""
07:05;07:08;"And he's like, ""No, he's like the Miles Davis of harmonica."""
07:08;07:10;"And then I was like, read up on this guy,"
07:10;07:13;"and I was like, ""Oh, wow, this guy is, like, really serious."
07:13;07:15;"""He, like, pioneered jazz harmonica,"
07:15;07:16;"""and he truly was one of the best players,"
07:16;07:18;"""and he played with all sorts of people."""
07:18;07:20;"So this was maybe eight years ago."
07:20;07:22;"I was just an ignorant American."
07:22;07:23;"Yeah."
07:23;07:26;"This is my equivalent of the Ryan Lochte story."
07:26;07:28;"Just a dumb American abroad."
07:28;07:30;"And after that, I always tried to, you know,"
07:30;07:32;"correct my behavior and be like, you know,"
07:32;07:34;"show respect and love to Tooth Sillman."
07:34;07:37;"And I was very sad last week to see that he died at the age of 94."
07:37;07:40;"And so I want to pay so that other people"
07:40;07:42;"don't make the same ignorant mistake that I made"
07:42;07:45;"and think that John Popper is the most famous harmonica player in the world."
07:45;07:48;"I want to pay tribute to this man."
07:48;07:50;"And just to give you a-- 'cause, like, some people probably--"
07:50;07:53;"it's hard to even picture what it means to be great at harmonica."
07:53;07:55;"Yeah, I'm drawing a blank here."
07:55;07:59;"He was known for usually playing jazz."
07:59;08:01;"He had, like, a band of other Belgians."
08:01;08:03;"He played with everybody."
08:03;08:06;"So he came to the States and, like, had a pickup band and toured,"
08:06;08:09;"or would, like, sit in with, like, Miles Davis quintet or something?"
08:09;08:11;"Yeah, I don't want to say exactly who,"
08:11;08:14;"but, like, he definitely worked with Quincy Jones."
08:14;08:16;"People--real jazz people."
08:16;08:18;"Here's him playing ""I Love You, Porgy."""
08:18;08:20;"You know, Gershwin jazz standard."
08:20;08:22;"So what year are we talking here?"
08:22;08:24;"Like '60s, '50s?"
08:24;08:26;"Ooh."
08:26;08:29;"[playing ""I Love You, Porgy""]"
08:29;08:38;"This is a live recording."
08:38;08:43;"You know, that's a difficult instrument to, like, articulate on."
08:43;08:45;"Very."
08:45;08:48;"Most kids had a harmonica at some point, and you play it, it's like..."
08:48;08:54;"Listen to the dynamics."
08:55;08:57;"[playing ""I Love You, Porgy""]"
08:57;08:59;"I would not have guessed that's a harmonica."
08:59;09:01;"I would have thought it was an accordion."
09:01;09:03;"Oh, yeah, yeah."
09:03;09:06;"So that's kind of him doing, like, his more standard jazz stuff."
09:06;09:09;"So a lot of people probably feel like, oh, that's interesting,"
09:09;09:12;"it's kind of like a quirk, but a lot of people don't realize"
09:12;09:15;"they've heard this guy's work because he played on all sorts of stuff."
09:15;09:17;"Like, you might remember this."
09:17;09:20;"[playing ""I Love You, Porgy""]"
09:20;09:22;"That's Toots."
09:23;09:25;"Okay."
09:25;09:27;"You recognize it?"
09:27;09:29;"Give me a second. Yeah, Sesame Street."
09:29;09:31;"Sesame Street."
09:31;09:33;"Is this the original?"
09:33;09:35;"I think so."
09:35;09:37;"Sounds good."
09:37;09:43;"It's kind of like ""Love Me Do."""
09:43;09:45;"Yeah."
09:45;09:48;"Almost like-- or like a weird outtake of Pet Sounds."
09:48;09:50;"Yeah."
09:50;09:52;"Oh, he totally could have, like, played on some Brahms."
09:52;09:54;"Some, like, weird Wrecking Crew stuff."
09:54;09:56;"Yeah, he would have been the harmonica in the Wrecking Crew."
09:56;09:58;"Yeah."
09:58;10:00;"He even played with a Time Crisis favorite."
10:00;10:02;"Well, let me guess. Yeah, guess."
10:02;10:04;"Herb Alpert. More of a favorite."
10:04;10:06;"Like from the '60s? Gary Puckett?"
10:06;10:08;"No, no, no, no."
10:08;10:10;"No, you're going too deep."
10:10;10:12;"Someone that we actually had on the show? No."
10:12;10:15;"Someone that definitely comes up in conversation."
10:15;10:17;"Legendary artist. Oh, Peter Cetera."
10:17;10:19;"No, you're going way too deep, man."
10:19;10:21;"Too deep?"
10:21;10:23;"I'm talking about, like, a major artist."
10:23;10:27;"A major artist who had a touch of jazz in his pop music,"
10:27;10:30;"who had a lot of shredder musicians on his records."
10:30;10:32;"MJ?"
10:32;10:34;"Getting warmer, I guess."
10:34;10:36;"Um..."
10:36;10:39;"Let me try to think. I'm guessing here, but..."
10:39;10:41;"Maybe about a... Give me, like, a decade here."
10:41;10:44;"Five, five, five, four, Caucasian male."
10:44;10:46;"Paul Simon?"
10:46;10:48;"I think Paul Simon's probably less than five, four."
10:48;10:50;"Taller than Paul Simon."
10:50;10:52;"Caucasian male."
10:52;10:54;"From the greater New York area."
10:54;10:56;"Joel. Joel."
10:56;10:58;"Finally. Okay, okay."
10:58;11:00;"So he played on Billy's song,"
11:00;11:03;"""Leave a Tender Moment Alone,"" from ""An Innocent Man."""
11:03;11:05;"Deeper cut?"
11:05;11:07;"Ooh. Oh, no, this is a classic."
11:07;11:12;"It's like they're talking to each other."
11:12;11:14;"So Billy was just like, ""Get toots in here."""
11:14;11:16;"Yeah, I guess so."
11:16;11:18;"Ooh. It kind of almost reminds me"
11:18;11:21;"a little bit of that Stevie Wonder harmonica tone."
11:21;11:23;"Yeah."
11:23;11:27;"# Even though I'm in love"
11:27;11:30;"# Sometimes I get so afraid"
11:30;11:32;"What year is this?"
11:32;11:34;"I think, like, '80s."
11:34;11:38;"This sounds huge."
11:38;11:42;"# I know the moment isn't right"
11:42;11:44;"'83."
11:44;11:47;"# To tell the girl to come a good life... #"
11:47;11:49;"This is from his, like, his throwback album."
11:49;11:51;"# ...So I'm gonna let you lie... #"
11:51;11:53;"Is this the one with ""Uptown Girl"" on it?"
11:53;11:55;"Yeah, same album. Oh, okay."
11:55;11:57;"# ...I'm just frightened out of my mind"
11:57;12:01;"# But if that's how I feel"
12:01;12:05;"# Then it's the best feeling I've ever known... #"
12:05;12:07;"Yeah, this kind of has, like..."
12:07;12:09;"This could have been, like, a kind of schmaltzy ballad"
12:09;12:12;"in the top five of 1968."
12:12;12:14;"Right."
12:14;12:16;"# Yes, I know I'm in love... #"
12:16;12:18;"Listen to that. Just two great men."
12:18;12:20;"They're in dialogue."
12:20;12:23;"# But just when I ought to relax"
12:23;12:25;"# I put my foot in the door... #"
12:25;12:28;"This is before the days of high-speed Internet connection"
12:28;12:30;"across the Atlantic."
12:30;12:32;"Toots visited Metsa Studios."
12:32;12:34;"Oh, yeah, it's sad to imagine, but today,"
12:34;12:36;"if Billy Joel and Toots were working together,"
12:36;12:38;"Billy would probably be like..."
12:38;12:40;"""I'm not leaving my house."""
12:40;12:42;"Or, like, a producer or something."
12:42;12:44;"""Hey, you know any good harmonica players?"""
12:44;12:47;"""Yeah, Billy, man, there's this real great cat out in Brussels."""
12:47;12:50;"And he'd be like, ""Well, have him email us a potential solo."
12:50;12:52;"""Tell him to do five different takes."
12:52;12:54;"""Pick the best one, comp it together."
12:54;12:56;"""I'm gonna, uh..."""
12:56;12:58;"""Comp it together."""
12:58;13:00;"""I'm gonna go play Pokemon Go outside."""
13:00;13:02;"That's brutal."
13:02;13:04;"But, like, there really is something, that song in Sesame Street,"
13:04;13:06;"there's something just feel-good about Toots' playing."
13:06;13:08;"Yeah."
13:08;13:10;"I think everybody can maybe, you know,"
13:10;13:12;"take a second to Google Toots Thielman's."
13:12;13:15;"Obviously, keep his family and friends in our thoughts."
13:15;13:18;"But '94 is, like, that's a hell of a long time to live."
13:18;13:21;"And clearly this guy left behind a huge body of work."
13:21;13:24;"It's a great run, man. May we all be so lucky."
13:24;13:27;"Clearly he dedicated himself to something."
13:27;13:29;"Very specific, too."
13:29;13:31;"Very specific."
13:31;13:33;"That's really interesting."
13:33;13:35;"He owned a land."
13:35;13:40;"# #"
14:04;14:07;"That was some more music from the legendary Toots Thielman."
14:07;14:09;"Rest in peace."
14:09;14:11;"Coming up on the show, we got Gerard Carmichael,"
14:11;14:13;"long-time friend of the show, coming through."
14:13;14:15;"Haven't seen him in a minute."
14:15;14:17;"Cool."
14:17;14:19;"We're gonna be talking about the songs of the summer."
14:19;14:21;"Now that we're in the dog days of summer,"
14:21;14:23;"we can officially say what the songs of the summer were."
14:23;14:25;"And then we're gonna be getting into the top five"
14:25;14:27;"with a back-to-school special."
14:27;14:30;"We're gonna compare the top five songs on iTunes,"
14:30;14:32;"which is maybe a slightly more populist version"
14:32;14:34;"of what people are listening to,"
14:34;14:36;"and then we're gonna compare with the top five songs"
14:36;14:38;"on the CMJ charts, which is about college radio."
14:38;14:40;"I didn't even know that was a thing still."
14:40;14:42;"Yeah, as long as there's colleges"
14:42;14:44;"and as long as there's college radio, man,"
14:44;14:46;"there'll be a college radio chart."
14:46;14:48;"And there's the dudes that are working"
14:48;14:50;"at the college radio station."
14:50;14:52;"Yeah. Did you ever do college radio?"
14:52;14:54;"Yeah. What was your show all about?"
14:54;14:56;"It's called ""The Jake and Dave Show."""
14:56;14:58;"I had a friend named Dave Kolek,"
14:58;15:00;"and it was kind of a talk format."
15:00;15:02;"From ""Time Crisis."""
15:02;15:04;"My freshman-- I guess it would've been my sophomore year."
15:04;15:07;"We had a discussion about the future of the Internet,"
15:07;15:09;"which would be an amazing tape to find."
15:09;15:11;"Wow. Can you look for that?"
15:11;15:13;"Dave has it. I'll ask him."
15:13;15:15;"Oh, I'd love to play that on ""Time Crisis."""
15:15;15:17;"That'd be hilarious."
15:17;15:19;"Just a couple Lewis and Clark undergrads."
15:19;15:23;"We had this soci-- or I think a poli-sci professor on"
15:23;15:25;"to discuss the Internet in 1996."
15:25;15:27;"Wait, you know, that's interesting, man."
15:27;15:29;"That's something I've been thinking about lately."
15:29;15:32;"Whenever I find myself feeling, like, overwhelmed"
15:32;15:34;"or dissatisfied with the world,"
15:34;15:36;"I talk about it with people."
15:36;15:40;"I'm often, like-- it's very easy for us to point to the Internet"
15:40;15:43;"as being one of the major things"
15:43;15:47;"that's causing even more misery in people's lives today."
15:47;15:51;"It's like everybody is a little bit addicted to their phone,"
15:51;15:54;"the constant stream of, like, information and opinions."
15:54;15:56;"How much time do you spend on the Internet?"
15:56;15:58;"That's a good question."
15:58;16:01;"So you mean, like, how much time am I spending a day"
16:01;16:03;"interfacing with, like, a computer screen?"
16:03;16:05;"Yeah, or how much do you check your phone?"
16:05;16:07;"And not counting, like, anomalous,"
16:07;16:09;"'cause I know, like, maybe on a Sunday afternoon"
16:09;16:11;"you might spend four hours"
16:11;16:14;"just, like, on the Grateful Dead tabs website."
16:14;16:16;"You're not wrong."
16:16;16:19;"I just mean kind of, like, mindless Internet consumption."
16:19;16:21;"I'll probably do an hour a day."
16:21;16:23;"Total? Yeah."
16:23;16:26;"Like, when I'm eating lunch, like, when I'm at my studio"
16:26;16:29;"and I'm editing, I, like, make a turkey sandwich or something,"
16:29;16:31;"and I'm just, like, laptop open."
16:31;16:33;"You just munch it on the turkey sandwich?"
16:33;16:35;"Yeah. Just what are you scrolling?"
16:35;16:37;"Twitter? New York Times?"
16:37;16:39;"Not really the Times. Twitter, Pitchfork."
16:39;16:41;"Wall Street Journal? Yeah, whatever."
16:41;16:43;"Facebook. And then usually I find an article,"
16:43;16:45;"you click on it, and then you go from there."
16:45;16:47;"What about when you get home at the end of the day?"
16:47;16:49;"No. When you spend time with your girlfriend?"
16:49;16:51;"Yeah. And if she's not home..."
16:51;16:53;"You're not on the Internet."
16:53;16:56;"Glass of tequila, grab the guitar,"
16:56;16:58;"start working on those Dead tabs."
17:40;17:42;"What about you?"
17:42;17:44;"I'd be like an addict."
17:44;17:46;"But also an addict in the sense that"
17:46;17:48;"it can be a little like feast or famine."
17:48;17:50;"I'd be like start checking a lot,"
17:50;17:52;"and I'd be like burned out."
17:52;17:54;"I'd see some things I don't want to see,"
17:54;17:56;"whether it's like people saying things to me,"
17:56;17:58;"or even increasingly when I see people"
17:58;18:00;"getting in fights with each other,"
18:00;18:02;"I almost feel like I'm on some like,"
18:02;18:04;"what was that movie with the zombies,"
18:04;18:06;"28 Days Later? Yeah."
18:06;18:08;"You know when they got infected with rage?"
18:08;18:10;"I increasingly when I see other people"
18:10;18:12;"I feel like it's going to infect me."
18:12;18:14;"Do you see that on Twitter? Where do you see that?"
18:14;18:16;"Yeah, see maybe, you probably just have..."
18:16;18:18;"I'm not a famous musician, dude."
18:18;18:20;"You just got a cleaner feed."
18:20;18:22;"My Twitter situation is like mellow."
18:22;18:24;"Right, but come on, it's an election year."
18:24;18:26;"Surely you've seen some like people"
18:26;18:28;"getting in fights about ideology or politics."
18:28;18:30;"Yeah, but it's not, I mean..."
18:30;18:32;"Yeah, well, so whatever. Sometimes I see that stuff"
18:32;18:34;"and it bothers me and I'm like, yo."
18:34;18:36;"I'm out. Let me just like read my book."
18:36;18:38;"Nice. And then I'll start reading my book."
18:38;18:40;"It's kind of random because I've always loved fashion."
18:40;18:42;"Yep."
18:42;18:44;"But I don't know..."
18:44;18:46;"The reason Time Crisis we talk about music"
18:46;18:48;"and not fashion is because I know more about music."
18:48;18:50;"And fashion often has struck me as a world"
18:50;18:52;"so similar to music in terms of like"
18:52;18:54;"the characters, the signifiers, whatever."
18:54;18:56;"But like, I'm a little bit like grandpa"
18:56;18:58;"when it comes to learning about that stuff."
18:58;19:00;"So I was at the bookstore the other day"
19:00;19:02;"and I saw this book called Gods and Kings"
19:02;19:04;"and it's about Alexander McQueen and John Galliano."
19:04;19:06;"And I was like, man, these are two"
19:06;19:08;"incredibly famous people."
19:08;19:10;"Many people consider iconic."
19:10;19:12;"And I know very little about them."
19:12;19:14;"All I know about John Galliano is that"
19:14;19:16;"he got caught on tape saying anti-Semitic"
19:16;19:18;"stuff drunk at a Paris bar."
19:18;19:20;"And all I really know about Alexander McQueen"
19:20;19:22;"is that someone once gave me"
19:22;19:24;"an Alexander McQueen pea coat,"
19:24;19:26;"which I love, and I know that he killed himself."
19:26;19:28;"So I know these kind of like dark, sad things"
19:28;19:30;"about these people. I've never even heard of Galliano."
19:30;19:32;"Oh, really? Yeah."
19:32;19:34;"He was a famous designer in his own right"
19:34;19:36;"until he really became famous"
19:36;19:38;"when he became the head designer for Dior."
19:38;19:40;"Okay. You know Dior, right?"
19:40;19:42;"Yeah, I mean, I'm familiar with it as a brand that exists."
19:42;19:44;"And you're familiar with the types of fabrics"
19:44;19:46;"they use and the silhouettes that they're famous for"
19:46;19:48;"and their haute couture."
19:48;19:50;"Not really."
19:50;19:52;"John Galliano is also interesting."
19:52;19:54;"But you didn't hear about this"
19:54;19:56;"and then he got dismissed from Dior."
19:56;19:58;"No, was this recently? This was like a few years ago."
19:58;20:00;"This is an offshoot of Time Crisis."
20:00;20:02;"This is our new show."
20:02;20:04;"Time Crisis Fashion Edition."
20:04;20:24;"Rest in peace, David Bowie."
20:24;20:26;"This is a new segment on Time Crisis."
20:26;20:28;"It's called Fashion."
20:28;20:30;"So, Jake, I want to tell you more about John Galliano."
20:30;20:32;"He's already very famous in certain circles"
20:32;20:34;"but the story blew up because"
20:34;20:36;"he was caught on video,"
20:36;20:38;"somebody taped him on his phone,"
20:38;20:40;"saying a series of really"
20:40;20:42;"hateful, cruel, and anti-Semitic things"
20:42;20:44;"to a couple of people"
20:44;20:46;"at a bar in Paris."
20:46;20:48;"And you can tell he's intoxicated. When?"
20:48;20:50;"I don't know, three years ago? Okay, recently."
20:50;20:52;"So this is like a guy at the top of the fashion game."
20:52;20:54;"He's like the head designer for one of the biggest"
20:54;20:56;"fashion houses and he's there."
20:56;20:58;"I forget what he says. He says, ""You're ugly."""
20:58;21:00;"Is he American?"
21:00;21:02;"He was British."
21:02;21:04;"Like the Mel Gibson vibe."
21:04;21:06;"It was like a Mel Gibson vibe. It's like some"
21:06;21:08;"Zoolander sh*t. It's like the worst nightmare of what"
21:08;21:10;"a big designer would be like."
21:10;21:12;"Like mean, catty,"
21:12;21:14;"and hateful."
21:14;21:16;"So he literally is there drunk, just being like,"
21:16;21:18;"saying to this person,"
21:18;21:20;"""You're ugly. I love"
21:20;21:22;"Hitler."" So obviously it was outrageous."
21:22;21:24;"People were horrified."
21:24;21:26;"Quickly condemned, dismissed."
21:26;21:28;"Went to rehab,"
21:28;21:30;"whatever. But I remember that whole story."
21:30;21:32;"I mean, clearly he needed it."
21:32;21:34;"But I remember during that whole story,"
21:34;21:36;"I was like, you know, obviously the headline is"
21:36;21:38;"John Galliano is horrible"
